verse_id	chapter	verse	text_en	polarity_en	label_en	text_pt
2TI.1.1	1	1	Paul, an apostle of Jesus Christ by the will of God, according to the promise of life which is in Christ Jesus,	0.0	neutral	Paulo, apóstolo de Cristo Jesus pela vontade de Deus, segundo a promessa da vida que está em Cristo Jesus,
2TI.1.2	1	2	To Timothy, {my} dearly beloved son: Grace, mercy, {and} peace, from God the Father and Christ Jesus our Lord.	0.7	positive	a Timóteo, meu amado filho: Graça, misericórdia e paz da parte de Deus Pai e de Cristo Jesus, nosso Senhor.
2TI.1.3	1	3	I thank God, whom I serve from {my} forefathers with pure conscience, that without ceasing I have remembrance of thee in my prayers night and day;	0.2143	positive	Dou graças a Deus, a quem sirvo com a consciência limpa, como o serviram os meus antepassados, ao lembrar-me constantemente de você noite e dia em minhas orações.
2TI.1.4	1	4	Greatly desiring to see thee, being mindful of thy tears, that I may be filled with joy; {Greatly...: or, remembering thy tears, I greatly desire to see thee that}	0.72	positive	Lembro-me das suas lágrimas e desejo muito vê-lo, para que a minha alegria seja completa.
2TI.1.5	1	5	When I call to remembrance the unfeigned faith that is in thee, which dwelt first in thy grandmother Lois, and thy mother Eunice; and I am persuaded that in thee also.	0.25	positive	Recordo-me da sua fé não fingida, que primeiro habitou em sua avó Lóide e em sua mãe Eunice, e estou convencido de que também habita em você.
2TI.1.6	1	6	Wherefore I put thee in remembrance that thou stir up the gift of God, which is in thee by the putting on of my hands.	0.0	neutral	Por essa razão, torno a lembrar-lhe que mantenha viva a chama do dom de Deus que está em você mediante a imposição das minhas mãos.
2TI.1.7	1	7	For God hath not given us the spirit of fear; but of power, and of love, and of a sound mind.	0.45	positive	Pois Deus não nos deu espírito de covardia, mas de poder, de amor e de equilíbrio.
2TI.1.8	1	8	Be not thou therefore ashamed of the testimony of our Lord, nor of me his prisoner: but be thou partaker of the afflictions of the gospel according to the power of God;	0.0	neutral	Portanto, não se envergonhe de testemunhar do Senhor, nem de mim, que sou prisioneiro dele, mas suporte comigo os sofrimentos pelo evangelho, segundo o poder de Deus,
2TI.1.9	1	9	Who hath saved us, and called {us} with an holy calling, not according to our works, but according to his own purpose and grace, which was given us in Christ Jesus before the world began,	0.6	positive	que nos salvou e nos chamou com uma santa vocação, não em virtude das nossas obras, mas por causa da sua própria determinação e graça. Esta graça nos foi dada em Cristo Jesus desde os tempos eternos,
2TI.1.10	1	10	But is now made manifest by the appearing of our Saviour Jesus Christ, who hath abolished death, and hath brought life and immortality to light through the gospel:	0.4	positive	sendo agora revelada pela manifestação de nosso Salvador, Cristo Jesus. Ele tornou inoperante a morte e trouxe à luz a vida e a imortalidade por meio do evangelho.
2TI.1.11	1	11	Whereunto I am appointed a preacher, and an apostle, and a teacher of the Gentiles.	0.0	neutral	Deste evangelho fui constituído pregador, apóstolo e mestre.
2TI.1.12	1	12	For the which cause I also suffer these things: nevertheless I am not ashamed: for I know whom I have believed, and am persuaded that he is able to keep that which I have committed unto him against that day. {believed: or, trusted}	0.5	positive	Por essa causa também sofro, mas não me envergonho, porque sei em quem tenho crido e estou bem certo de que ele é poderoso para guardar o meu depósito até aquele dia.
2TI.1.13	1	13	Hold fast the form of sound words, which thou hast heard of me, in faith and love which is in Christ Jesus.	0.3667	positive	Retenha, com fé e amor em Cristo Jesus, o modelo da sã doutrina que você ouviu de mim.
2TI.1.14	1	14	That good thing which was committed unto thee keep by the Holy Ghost which dwelleth in us.	0.7	positive	Quanto ao bom depósito, guarde-o por meio do Espírito Santo que habita em nós.
2TI.1.15	1	15	This thou knowest, that all they which are in Asia be turned away from me; of whom are Phygellus and Hermogenes.	0.0	neutral	Você sabe que todos os da província da Ásia me abandonaram, inclusive Fígelo e Hermógenes.
2TI.1.16	1	16	The Lord give mercy unto the house of Onesiphorus; for he oft refreshed me, and was not ashamed of my chain:	0.0	neutral	O Senhor conceda misericórdia à casa de Onesíforo, porque muitas vezes ele me reanimou e não se envergonhou por eu estar preso;
2TI.1.17	1	17	But, when he was in Rome, he sought me out very diligently, and found {me}.	0.2	positive	pelo contrário, quando chegou a Roma procurou-me diligentemente até me encontrar.
2TI.1.18	1	18	The Lord grant unto him that he may find mercy of the Lord in that day: and in how many things he ministered unto me at Ephesus, thou knowest very well.	0.35	positive	Conceda-lhe o Senhor que, naquele dia, encontre misericórdia da parte do Senhor! Você sabe muito bem quantos serviços ele me prestou em Éfeso.
2TI.2.1	2	1	Thou therefore, my son, be strong in the grace that is in Christ Jesus.	0.4333	positive	Portanto, você, meu filho, fortifique-se na graça que há em Cristo Jesus.
2TI.2.2	2	2	And the things that thou hast heard of me among many witnesses, the same commit thou to faithful men, who shall be able to teach others also. {among: or, by}	0.3333	positive	E as coisas que me ouviu dizer na presença de muitas testemunhas, confie a homens fiéis que sejam também capazes de ensinar a outros.
2TI.2.3	2	3	Thou therefore endure hardness, as a good soldier of Jesus Christ.	0.7	positive	Suporte comigo os sofrimentos, como bom soldado de Cristo Jesus.
2TI.2.4	2	4	No man that warreth entangleth himself with the affairs of {this} life; that he may please him who hath chosen him to be a soldier.	0.0	neutral	Nenhum soldado se deixa envolver pelos negócios da vida civil, já que deseja agradar aquele que o alistou.
2TI.2.5	2	5	And if a man also strive for masteries, {yet} is he not crowned, except he strive lawfully.	0.0	neutral	Semelhantemente, nenhum atleta é coroado como vencedor, se não competir de acordo com as regras.
2TI.2.6	2	6	The husbandman that laboureth must be first partaker of the fruits. {that...: or, labouring first, must be partaker of the fruits}	0.25	positive	O lavrador que trabalha arduamente deve ser o primeiro a participar dos frutos da colheita.
2TI.2.7	2	7	Consider what I say; and the Lord give thee understanding in all things.	0.0	neutral	Reflita no que estou dizendo, pois o Senhor lhe dará entendimento em tudo.
2TI.2.8	2	8	Remember that Jesus Christ of the seed of David was raised from the dead according to my gospel:	-0.2	negative	Lembre-se de Jesus Cristo, ressuscitado dos mortos, descendente de Davi, conforme o meu evangelho,
2TI.2.9	2	9	Wherein I suffer trouble, as an evil doer, {even} unto bonds; but the word of God is not bound.	-0.6	negative	pelo qual sofro a ponto de estar preso como criminoso; contudo a palavra de Deus não está presa.
2TI.2.10	2	10	Therefore I endure all things for the elect's sakes, that they may also obtain the salvation which is in Christ Jesus with eternal glory.	0.8	positive	Por isso, tudo suporto por causa dos eleitos, para que também eles alcancem a salvação que está em Cristo Jesus, com glória eterna.
2TI.2.11	2	11	{It is} a faithful saying: For if we be dead with {him}, we shall also live with {him}:	-0.0318	neutral	Esta palavra é digna de confiança: Se morremos com ele, com ele também viveremos;
2TI.2.12	2	12	If we suffer, we shall also reign with {him}: if we deny {him}, he also will deny us:	0.0	neutral	se perseveramos, com ele também reinaremos. Se o negamos, ele também nos negará;
2TI.2.13	2	13	If we believe not, {yet} he abideth faithful: he cannot deny himself.	0.0	neutral	se somos infiéis, ele permanece fiel, pois não pode negar-se a si mesmo.
2TI.2.14	2	14	Of these things put {them} in remembrance, charging {them} before the Lord that they strive not about words to no profit, {but} to the subverting of the hearers.	0.0	neutral	Continue a lembrar essas coisas a todos, advertindo-os solenemente diante de Deus, para que não se envolvam em discussões acerca de palavras; isso não tem proveito, e serve apenas para perverter os ouvintes.
2TI.2.15	2	15	Study to shew thyself approved unto God, a workman that needeth not to be ashamed, rightly dividing the word of truth.	0.2857	positive	Procure apresentar-se a Deus aprovado, como obreiro que não tem do que se envergonhar, que maneja corretamente a palavra da verdade.
2TI.2.16	2	16	But shun profane {and} vain babblings: for they will increase unto more ungodliness.	0.5	positive	Evite as conversas inúteis e profanas, pois os que se dão a isso prosseguem cada vez mais para a impiedade.
2TI.2.17	2	17	And their word will eat as doth a canker: of whom is Hymenaeus and Philetus; {canker: or, gangrene}	0.0	neutral	O ensino deles alastra como câncer; entre eles estão Himeneu e Fileto.
2TI.2.18	2	18	Who concerning the truth have erred, saying that the resurrection is past already; and overthrow the faith of some.	-0.25	negative	Estes se desviaram da verdade, dizendo que a ressurreição já aconteceu, e assim a alguns pervertem a fé.
2TI.2.19	2	19	Nevertheless the foundation of God standeth sure, having this seal, The Lord knoweth them that are his. And, Let every one that nameth the name of Christ depart from iniquity. {sure: or, steady}	0.3889	positive	"Entretanto, o firme fundamento de Deus permanece inabalável e selado com esta inscrição: ""O Senhor conhece quem lhe pertence"" e ""afaste-se da iniqüidade todo aquele que confessa o nome do Senhor""."
2TI.2.20	2	20	But in a great house there are not only vessels of gold and of silver, but also of wood and of earth; and some to honour, and some to dishonour.	0.4	positive	Numa grande casa há vasos não apenas de ouro e prata, mas também de madeira e barro; alguns para fins honrosos, outros para fins desonrosos.
2TI.2.21	2	21	If a man therefore purge himself from these, he shall be a vessel unto honour, sanctified, and meet for the master's use, {and} prepared unto every good work.	0.7	positive	Se alguém se purificar dessas coisas, será vaso para honra, santificado, útil para o Senhor e preparado para toda boa obra.
2TI.2.22	2	22	Flee also youthful lusts: but follow righteousness, faith, charity, peace, with them that call on the Lord out of a pure heart.	0.2143	positive	Fuja dos desejos malignos da juventude e siga a justiça, a fé, o amor e a paz, juntamente com os que, de coração puro, invocam o Senhor.
2TI.2.23	2	23	But foolish and unlearned questions avoid, knowing that they do gender strifes.	0.0	neutral	Evite as controvérsias tolas e fúteis, pois você sabe que acabam em brigas.
2TI.2.24	2	24	And the servant of the Lord must not strive; but be gentle unto all {men}, apt to teach, patient, {patient: or, forbearing}	0.4	positive	Ao servo do Senhor não convém brigar mas, sim, ser amável para com todos, apto para ensinar, paciente.
2TI.2.25	2	25	In meekness instructing those that oppose themselves; if God peradventure will give them repentance to the acknowledging of the truth;	0.0	neutral	Deve corrigir com mansidão os que se lhe opõem, na esperança de que Deus lhes conceda o arrependimento, levando-os ao conhecimento da verdade,
2TI.2.26	2	26	And {that} they may recover themselves out of the snare of the devil, who are taken captive by him at his will. {recover...: Gr. awake} {taken...: Gr. taken alive}	0.15	positive	para que assim voltem à sobriedade e escapem da armadilha do diabo, que os aprisionou para fazerem a sua vontade.
2TI.3.1	3	1	This know also, that in the last days perilous times shall come.	0.0	neutral	Saiba disto: nos últimos dias sobrevirão tempos terríveis.
2TI.3.2	3	2	For men shall be lovers of their own selves, covetous, boasters, proud, blasphemers, disobedient to parents, unthankful, unholy,	0.7	positive	Os homens serão egoístas, avarentos, presunçosos, arrogantes, blasfemos, desobedientes aos pais, ingratos, ímpios,
2TI.3.3	3	3	Without natural affection, trucebreakers, false accusers, incontinent, fierce, despisers of those that are good, {false...: or, one who foments strife}	-0.0	neutral	sem amor pela família, irreconciliáveis, caluniadores, sem domínio próprio, cruéis, inimigos do bem,
2TI.3.4	3	4	Traitors, heady, highminded, lovers of pleasures more than lovers of God;	0.5	positive	traidores, precipitados, soberbos, mais amantes dos prazeres do que amigos de Deus,
2TI.3.5	3	5	Having a form of godliness, but denying the power thereof: from such turn away.	0.0	neutral	tendo aparência de piedade, mas negando o seu poder. Afaste-se também destes.
2TI.3.6	3	6	For of this sort are they which creep into houses, and lead captive silly women laden with sins, led away with divers lusts,	-0.15	negative	São estes os que se introduzem pelas casas e conquistam mulherzinhas sobrecarregadas de pecados, as quais se deixam levar por toda espécie de desejos.
2TI.3.7	3	7	Ever learning, and never able to come to the knowledge of the truth.	-0.25	negative	Elas estão sempre aprendendo, mas não conseguem nunca de chegar ao conhecimento da verdade.
2TI.3.8	3	8	Now as Jannes and Jambres withstood Moses, so do these also resist the truth: men of corrupt minds, reprobate concerning the faith. {reprobate: or, of no judgment}	-0.5	negative	Como Janes e Jambres se opuseram a Moisés, esses também resistem à verdade. A mente deles é depravada; são reprovados na fé.
2TI.3.9	3	9	But they shall proceed no further: for their folly shall be manifest unto all {men}, as theirs also was.	0.0	neutral	Não irão longe, porém; como no caso daqueles, a sua insensatez se tornará evidente a todos.
2TI.3.10	3	10	But thou hast fully known my doctrine, manner of life, purpose, faith, longsuffering, charity, patience, {fully...: or, been a diligent follower of}	0.0	neutral	Mas você tem seguido de perto o meu ensino, a minha conduta, o meu propósito, a minha fé, a minha paciência, o meu amor, a minha perseverança,
2TI.3.11	3	11	Persecutions, afflictions, which came unto me at Antioch, at Iconium, at Lystra; what persecutions I endured: but out of {them} all the Lord delivered me.	0.0	neutral	as perseguições e os sofrimentos que enfrentei, coisas que me aconteceram em Antioquia, Icônio e Listra. Quanta perseguição suportei! Mas, de todas essas coisas o Senhor me livrou!
2TI.3.12	3	12	Yea, and all that will live godly in Christ Jesus shall suffer persecution.	0.1364	positive	De fato, todos os que desejam viver piedosamente em Cristo Jesus serão perseguidos.
2TI.3.13	3	13	But evil men and seducers shall wax worse and worse, deceiving, and being deceived.	-0.6	negative	Contudo, os perversos e impostores irão de mal a pior, enganando e sendo enganados.
2TI.3.14	3	14	But continue thou in the things which thou hast learned and hast been assured of, knowing of whom thou hast learned {them};	0.0	neutral	Quanto a você, porém, permaneça nas coisas que aprendeu e das quais tem convicção, pois você sabe de quem o aprendeu.
2TI.3.15	3	15	And that from a child thou hast known the holy scriptures, which are able to make thee wise unto salvation through faith which is in Christ Jesus.	0.6	positive	Porque desde criança você conhece as sagradas letras, que são capazes de torná-lo sábio para a salvação mediante a fé em Cristo Jesus.
2TI.3.16	3	16	All scripture {is} given by inspiration of God, and {is} profitable for doctrine, for reproof, for correction, for instruction in righteousness:	0.0	neutral	Toda a Escritura é inspirada por Deus e útil para o ensino, para a repreensão, para a correção e para a instrução na justiça,
2TI.3.17	3	17	That the man of God may be perfect, throughly furnished unto all good works. {throughly...: or, perfected}	0.85	positive	para que o homem de Deus seja apto e plenamente preparado para toda boa obra.
2TI.4.1	4	1	I charge {thee} therefore before God, and the Lord Jesus Christ, who shall judge the quick and the dead at his appearing and his kingdom;	0.0667	neutral	Na presença de Deus e de Cristo Jesus, que há de julgar os vivos e os mortos por sua manifestação e por seu Reino, eu o exorto solenemente:
2TI.4.2	4	2	Preach the word; be instant in season, out of season; reprove, rebuke, exhort with all longsuffering and doctrine.	0.0	neutral	Pregue a palavra, esteja preparado a tempo e fora de tempo, repreenda, corrija, exorte com toda a paciência e doutrina.
2TI.4.3	4	3	For the time will come when they will not endure sound doctrine; but after their own lusts shall they heap to themselves teachers, having itching ears;	0.5	positive	Pois virá o tempo em que não suportarão a sã doutrina; pelo contrário, sentindo coceira nos ouvidos, segundo os seus próprios desejos juntarão mestres para si mesmos.
2TI.4.4	4	4	And they shall turn away {their} ears from the truth, and shall be turned unto fables.	0.0	neutral	Eles se recusarão a dar ouvidos à verdade, voltando-se para os mitos.
2TI.4.5	4	5	But watch thou in all things, endure afflictions, do the work of an evangelist, make full proof of thy ministry. {make...; or, fulfil}	0.35	positive	Você, porém, seja sóbrio em tudo, suporte os sofrimentos, faça a obra de um evangelista, cumpra plenamente o seu ministério.
2TI.4.6	4	6	For I am now ready to be offered, and the time of my departure is at hand.	0.2	positive	Eu já estou sendo derramado como uma oferta de bebida. Está próximo o tempo da minha partida.
2TI.4.7	4	7	I have fought a good fight, I have finished {my} course, I have kept the faith:	0.7	positive	Combati o bom combate, terminei a corrida, guardei a fé.
2TI.4.8	4	8	Henceforth there is laid up for me a crown of righteousness, which the Lord, the righteous judge, shall give me at that day: and not to me only, but unto all them also that love his appearing.	0.25	positive	Agora me está reservada a coroa da justiça, que o Senhor, justo Juiz, me dará naquele dia; e não somente a mim, mas também a todos os que amam a sua vinda.
2TI.4.9	4	9	Do thy diligence to come shortly unto me:	0.0	neutral	Procure vir logo ao meu encontro,
2TI.4.10	4	10	For Demas hath forsaken me, having loved this present world, and is departed unto Thessalonica; Crescens to Galatia, Titus unto Dalmatia.	0.35	positive	pois Demas, amando este mundo, abandonou-me e foi para Tessalônica. Crescente foi para a Galácia, e Tito, para a Dalmácia.
2TI.4.11	4	11	Only Luke is with me. Take Mark, and bring him with thee: for he is profitable to me for the ministry.	0.0	neutral	Só Lucas está comigo. Traga Marcos com você, porque ele me é útil para o ministério.
2TI.4.12	4	12	And Tychicus have I sent to Ephesus.	0.0	neutral	Enviei Tíquico a Éfeso.
2TI.4.13	4	13	The cloke that I left at Troas with Carpus, when thou comest, bring {with thee}, and the books, {but} especially the parchments.	0.0	neutral	Quando você vier, traga a capa que deixei na casa de Carpo, em Trôade, e os meus livros, especialmente os pergaminhos.
2TI.4.14	4	14	Alexander the coppersmith did me much evil: the Lord reward him according to his works:	-1.0	negative	Alexandre, o ferreiro, causou-me muitos males. O Senhor lhe dará a retribuição pelo que fez.
2TI.4.15	4	15	Of whom be thou ware also; for he hath greatly withstood our words. {our words: or, our preachings}	0.8	positive	Previna-se contra ele, porque se opôs fortemente às nossas palavras.
2TI.4.16	4	16	At my first answer no man stood with me, but all {men} forsook me: {I pray God} that it may not be laid to their charge.	-0.25	negative	Na minha primeira defesa, ninguém apareceu para me apoiar; todos me abandonaram. Que isso não lhes cobrado.
2TI.4.17	4	17	Notwithstanding the Lord stood with me, and strengthened me; that by me the preaching might be fully known, and {that} all the Gentiles might hear: and I was delivered out of the mouth of the lion.	0.0	neutral	Mas o Senhor permaneceu ao meu lado e me deu forças, para que por mim a mensagem fosse plenamente proclamada, e todos os gentios a ouvissem. E eu fui libertado da boca do leão.
2TI.4.18	4	18	And the Lord shall deliver me from every evil work, and will preserve {me} unto his heavenly kingdom: to whom {be} glory for ever and ever. Amen.	-1.0	negative	O Senhor me livrará de toda obra maligna e me levará a salvo para o seu Reino celestial. A ele seja a glória para todo o sempre. Amém.
2TI.4.19	4	19	Salute Prisca and Aquila, and the household of Onesiphorus.	0.0	neutral	Saudações a Priscila e Áqüila, e à casa de Onesíforo.
2TI.4.20	4	20	Erastus abode at Corinth: but Trophimus have I left at Miletum sick.	-0.3571	negative	Erasto permaneceu em Corinto, mas deixei Trófimo doente em Mileto.
2TI.4.21	4	21	Do thy diligence to come before winter. Eubulus greeteth thee, and Pudens, and Linus, and Claudia, and all the brethren.	0.0	neutral	Procure vir antes do inverno. Êubulo, Prudente, Lino, Cláudia e todos os irmãos enviam-lhe saudações.
2TI.4.22	4	22	The Lord Jesus Christ {be} with thy spirit. Grace {be} with you. Amen. «{The second epistle} unto Timotheus, ordained the first bishop of the church of the Ephesians, was written from Rome, when Paul was brought before Nero the second time.»	0.0833	neutral	O Senhor seja com o seu espírito. A graça seja com vocês.
