verse_id	chapter	verse	text_en	polarity_en	label_en	text_es
EPH.5.5	5	5	For this ye know, that no whoremonger, nor unclean person, nor covetous man, who is an idolater, hath any inheritance in the kingdom of Christ and of God.	0.0	neutral	Porque sabéis esto, que ningún fornicario, ó inmundo, ó avaro, que es servidor de ídolos, tiene herencia en el reino de Cristo y de Dios.
EPH.5.6	5	6	Let no man deceive you with vain words: for because of these things cometh the wrath of God upon the children of disobedience. {disobedience: or, unbelief}	0.0	neutral	Nadie os engañe con palabras vanas; porque por estas cosas viene la ira de Dios sobre los hijos de desobediencia.
EPH.5.7	5	7	Be not ye therefore partakers with them.	0.0	neutral	No seáis pues aparceros con ellos;
EPH.5.8	5	8	For ye were sometimes darkness, but now {are ye} light in the Lord: walk as children of light:	0.4	positive	Porque en otro tiempo erais tinieblas; mas ahora sois luz en el Señor: andad como hijos de luz,
EPH.5.9	5	9	(For the fruit of the Spirit {is} in all goodness and righteousness and truth;)	0.25	positive	(Porque el fruto del Espíritu es en toda bondad, y justicia, y verdad;)
EPH.5.10	5	10	Proving what is acceptable unto the Lord.	0.0	neutral	Aprobando lo que es agradable al Señor.
EPH.5.11	5	11	And have no fellowship with the unfruitful works of darkness, but rather reprove {them}.	-0.6	negative	Y no comuniquéis con las obras infructuosas de las tinieblas; sino antes bien redargüidlas.
EPH.5.12	5	12	For it is a shame even to speak of those things which are done of them in secret.	-0.4	negative	Porque torpe cosa es aun hablar de lo que ellos hacen en oculto.
EPH.5.13	5	13	But all things that are reproved are made manifest by the light: for whatsoever doth make manifest is light. {reproved: or, discovered}	0.4	positive	Mas todas las cosas cuando son redargüidas, son manifestadas por la luz; porque lo que manifiesta todo, la luz es.
EPH.5.14	5	14	Wherefore he saith, Awake thou that sleepest, and arise from the dead, and Christ shall give thee light. {he: or, it}	0.1	neutral	Por lo cual dice: Despiértate, tú que duermes, y levántate de los muertos, y te alumbrará Cristo.
EPH.5.15	5	15	See then that ye walk circumspectly, not as fools, but as wise,	0.7	positive	Mirad, pues, cómo andéis avisadamente; no como necios, mas como sabios;
EPH.5.16	5	16	Redeeming the time, because the days are evil.	-0.25	negative	Redimiendo el tiempo, porque los días son malos.
EPH.5.17	5	17	Wherefore be ye not unwise, but understanding what the will of the Lord {is}.	0.0	neutral	Por tanto, no seáis imprudentes, sino entendidos de cuál sea la voluntad del Señor.
EPH.5.18	5	18	And be not drunk with wine, wherein is excess; but be filled with the Spirit;	0.325	positive	Y no os embriaguéis de vino, en lo cual hay disolución; mas sed llenos de Espíritu;
EPH.5.19	5	19	Speaking to yourselves in psalms and hymns and spiritual songs, singing and making melody in your heart to the Lord;	0.0	neutral	Hablando entre vosotros con salmos, y con himnos, y canciones espirituales, cantando y alabando al Señor en vuestros corazones;
EPH.5.20	5	20	Giving thanks always for all things unto God and the Father in the name of our Lord Jesus Christ;	0.2	positive	Dando gracias siempre de todo al Dios y Padre en el nombre de nuestro Señor Jesucristo:
EPH.5.21	5	21	Submitting yourselves one to another in the fear of God.	0.0	neutral	Sujetados los unos á los otros en el temor de Dios.
EPH.5.22	5	22	Wives, submit yourselves unto your own husbands, as unto the Lord.	0.6	positive	Las casadas estén sujetas á sus propios maridos, como al Señor.
EPH.5.23	5	23	For the husband is the head of the wife, even as Christ is the head of the church: and he is the saviour of the body.	0.0	neutral	Porque el marido es cabeza de la mujer, así como Cristo es cabeza de la iglesia; y él es el que da la salud al cuerpo.
EPH.5.24	5	24	Therefore as the church is subject unto Christ, so {let} the wives {be} to their own husbands in every thing.	0.2167	positive	Así que, como la iglesia está sujeta á Cristo, así también las casadas lo estén á sus maridos en todo.
EPH.5.25	5	25	Husbands, love your wives, even as Christ also loved the church, and gave himself for it;	0.6	positive	Maridos, amad á vuestras mujeres, así como Cristo amó á la iglesia, y se entregó á sí mismo por ella,
EPH.5.26	5	26	That he might sanctify and cleanse it with the washing of water by the word,	0.0	neutral	Para santificarla limpiándola en el lavacro del agua por la palabra,
EPH.5.27	5	27	That he might present it to himself a glorious church, not having spot, or wrinkle, or any such thing; but that it should be holy and without blemish.	0.0	neutral	Para presentársela gloriosa para sí, una iglesia que no tuviese mancha ni arruga, ni cosa semejante; sino que fuese santa y sin mancha.
EPH.5.28	5	28	So ought men to love their wives as their own bodies. He that loveth his wife loveth himself.	0.55	positive	Así también los maridos deben amar á sus mujeres como á sus mismos cuerpos. El que ama á su mujer, á sí mismo se ama.
EPH.5.29	5	29	For no man ever yet hated his own flesh; but nourisheth and cherisheth it, even as the Lord the church:	-0.15	negative	Porque ninguno aborreció jamás á su propia carne, antes la sustenta y regala, como también Cristo á la iglesia;
EPH.5.30	5	30	For we are members of his body, of his flesh, and of his bones.	0.0	neutral	Porque somos miembros de su cuerpo, de su carne y de sus huesos.
EPH.5.31	5	31	For this cause shall a man leave his father and mother, and shall be joined unto his wife, and they two shall be one flesh.	0.0	neutral	Por esto dejará el hombre á su padre y á su madre, y se allegará á su mujer, y serán dos en una carne.
EPH.5.32	5	32	This is a great mystery: but I speak concerning Christ and the church.	0.8	positive	Este misterio grande es: mas yo digo esto con respecto á Cristo y á la iglesia.
EPH.5.33	5	33	Nevertheless let every one of you in particular so love his wife even as himself; and the wife {see} that she reverence {her} husband.	0.3333	positive	Cada uno empero de vosotros de por sí, ame también á su mujer como á sí mismo; y la mujer reverencie á su marido.
EPH.6.1	6	1	Children, obey your parents in the Lord: for this is right.	0.2857	positive	HIJOS, obedeced en el Señor á vuestros padres; porque esto es justo.
EPH.6.2	6	2	Honour thy father and mother; (which is the first commandment with promise;)	0.25	positive	Honra á tu padre y á tu madre, que es el primer mandamiento con promesa,
EPH.6.3	6	3	That it may be well with thee, and thou mayest live long on the earth.	0.0432	neutral	Para que te vaya bien, y seas de larga vida sobre la tierra.
EPH.6.4	6	4	And, ye fathers, provoke not your children to wrath: but bring them up in the nurture and admonition of the Lord.	0.0	neutral	Y vosotros, padres, no provoquéis á ira á vuestros hijos; sino fhhijos; sino fh amonestación del Señor.
EPH.6.5	6	5	Servants, be obedient to them that are {your} masters according to the flesh, with fear and trembling, in singleness of your heart, as unto Christ;	0.4	positive	Siervos, obedeced á vuestros amos según la carne con temor y temblor, con sencillez de vuestro corazón, como á Cristo;
EPH.6.6	6	6	Not with eyeservice, as menpleasers; but as the servants of Christ, doing the will of God from the heart;	0.0	neutral	No sirviendo al ojo, como los que agradan á los hombres; sino como siervos de Cristo, haciendo de ánimo la voluntad de Dios;
EPH.6.7	6	7	With good will doing service, as to the Lord, and not to men:	0.7	positive	Sirviendo con buena voluntad, como al Señor, y no á los hombres;
EPH.6.8	6	8	Knowing that whatsoever good thing any man doeth, the same shall he receive of the Lord, whether {he be} bond or free.	0.3667	positive	Sabiendo que el bien que cada uno hiciere, esto recibirá del Señor, sea siervo ó sea libre.
EPH.6.9	6	9	And, ye masters, do the same things unto them, forbearing threatening: knowing that your Master also is in heaven; neither is there respect of persons with him. {forbearing: or, moderating} {your...: some read, both your and their Master}	0.0	neutral	Y vosotros, amos, haced á ellos lo mismo, dejando las amenazas: sabiendo que el Señor de ellos y vuestro está en los cielos, y que no hay acepción de personas con él.
EPH.6.10	6	10	Finally, my brethren, be strong in the Lord, and in the power of his might.	0.2167	positive	Por lo demás, hermanos míos, confortaos en el Señor, y en la potencia de su fortaleza.
EPH.6.11	6	11	Put on the whole armour of God, that ye may be able to stand against the wiles of the devil.	0.35	positive	Vestíos de toda la armadura de Dios, para que podáis estar firmes contra las asechanzas del diablo.
EPH.6.12	6	12	For we wrestle not against flesh and blood, but against principalities, against powers, against the rulers of the darkness of this world, against spiritual wickedness in high {places}. {flesh...: Gr. blood and flesh} {spiritual...: or, wicked spirits} {high: or, heavenly}	0.08	neutral	Porque no tenemos lucha contra sangre y carne; sino contra principados, contra potestades, contra señores del mundo, gobernadores de estas tinieblas, contra malicias espirituales en los aires.
EPH.6.13	6	13	Wherefore take unto you the whole armour of God, that ye may be able to withstand in the evil day, and having done all, to stand. {having...: or, having overcome all}	-0.1	neutral	Por tanto, tomad toda la armadura de Dios, para que podáis resistir en el día malo, y estar firmes, habiendo acabado todo.
EPH.6.14	6	14	Stand therefore, having your loins girt about with truth, and having on the breastplate of righteousness;	0.0	neutral	Estad pues firmes, ceñidos vuestros lomos de verdad, y vestidos de la cota de justicia.
EPH.6.15	6	15	And your feet shod with the preparation of the gospel of peace;	0.0	neutral	Y calzados los pies con el apresto del evangelio de paz;
EPH.6.16	6	16	Above all, taking the shield of faith, wherewith ye shall be able to quench all the fiery darts of the wicked.	0.25	positive	Sobre todo, tomando el escudo de la fe, con que podáis apagar todos los dardos de fuego del maligno.
EPH.6.17	6	17	And take the helmet of salvation, and the sword of the Spirit, which is the word of God:	0.0	neutral	Y tomad el yelmo de salud, y la espada del Espíritu; que es la palabra de Dios;
EPH.6.18	6	18	Praying always with all prayer and supplication in the Spirit, and watching thereunto with all perseverance and supplication for all saints;	0.0	neutral	Orando en todo tiempo con toda deprecación y súplica en el Espíritu, y velando en ello con toda instancia y suplicación por todos los santos,
EPH.6.19	6	19	And for me, that utterance may be given unto me, that I may open my mouth boldly, to make known the mystery of the gospel,	0.1667	positive	Y por mí, para que me sea dada palabra en el abrir de mi boca con confianza, para hacer notorio el misterio del evangelio,
EPH.6.20	6	20	For which I am an ambassador in bonds: that therein I may speak boldly, as I ought to speak. {in bonds: or, in a chain} {therein: or, thereof}	0.3333	positive	Por el cual soy embajador en cadenas; que resueltamente hable de él, como debo hablar.
EPH.6.21	6	21	But that ye also may know my affairs, {and} how I do, Tychicus, a beloved brother and faithful minister in the Lord, shall make known to you all things:	0.7	positive	Mas para que también vosotros sepáis mis negocios, y cómo lo paso, todo os lo hará saber Tichîco, hermano amado y fiel ministro en el Señor:
EPH.6.22	6	22	Whom I have sent unto you for the same purpose, that ye might know our affairs, and {that} he might comfort your hearts.	0.0	neutral	Al cual os he enviado para esto mismo, para que entendáis lo tocante á nosotros, y que consuele vuestros corazones.
EPH.6.23	6	23	Peace {be} to the brethren, and love with faith, from God the Father and the Lord Jesus Christ.	0.5	positive	Paz sea á los hermanos y amor con fe, de Dios Padre y del Señor Jesucristo.
EPH.6.24	6	24	Grace {be} with all them that love our Lord Jesus Christ in sincerity. Amen. «{To the} Ephesians written from Rome, by Tychicus.» {in sincerity: or, with incorruption}	0.5	positive	Gracia sea con todos los que aman á nuestro Señor Jesucristo en sinceridad. Amén.
