verse_id	chapter	verse	text_en	polarity_en	label_en	text_es
EXO.31.13	31	13	Speak thou also unto the children of Israel, saying, Verily my sabbaths ye shall keep: for it {is} a sign between me and you throughout your generations; that {ye} may know that I {am} the LORD that doth sanctify you.	0.0	neutral	Y tú hablarás á los hijos de Israel, diciendo: Con todo eso vosotros guardaréis mis sábados: porque es señal entre mí y vosotros por vuestras edades, para que sepáis que yo soy Jehová que os santifico.
EXO.31.14	31	14	Ye shall keep the sabbath therefore; for it {is} holy unto you: every one that defileth it shall surely be put to death: for whosoever doeth {any} work therein, that soul shall be cut off from among his people.	0.5	positive	Así que guardaréis el sábado, porque santo es á vosotros: el que lo profanare, de cierto morirá; porque cualquiera que hiciere obra alguna en él, aquella alma será cortada de en medio de sus pueblos.
EXO.31.15	31	15	Six days may work be done; but in the seventh {is} the sabbath of rest, holy to the LORD: whosoever doeth {any} work in the sabbath day, he shall surely be put to death. {holy: Heb. holiness}	0.5	positive	Seis días se hará obra, mas el día séptimo es sábado de reposo consagrado á Jehová; cualquiera que hiciere obra el día del sábado, morirá ciertamente.
EXO.31.16	31	16	Wherefore the children of Israel shall keep the sabbath, to observe the sabbath throughout their generations, {for} a perpetual covenant.	0.0	neutral	Guardarán, pues, el sábado los hijos de Israel: celebrándolo por sus edades por pacto perpetuo:
EXO.31.17	31	17	It {is} a sign between me and the children of Israel for ever: for {in} six days the LORD made heaven and earth, and on the seventh day he rested, and was refreshed.	0.0	neutral	Señal es para siempre entre mí y los hijos de Israel; porque en seis días hizo Jehová los cielos y la tierra, y en el séptimo día cesó, y reposó.
EXO.31.18	31	18	And he gave unto Moses, when he had made an end of communing with him upon mount Sinai, two tables of testimony, tables of stone, written with the finger of God.	0.0	neutral	Y dió á Moisés, como acabó de hablar con él en el monte de Sinaí, dos tablas del testimonio, tablas de piedra escritas con el dedo de Dios.
EXO.32.1	32	1	And when the people saw that Moses delayed to come down out of the mount, the people gathered themselves together unto Aaron, and said unto him, Up, make us gods, which shall go before us; for {as for} this Moses, the man that brought us up out of the land of Egypt, we wot not what is become of him.	-0.1556	negative	MAS viendo el pueblo que Moisés tardaba en descender del monte, allegóse entonces á Aarón, y dijéronle: Levántate, haznos dioses que vayan delante de nosotros; porque á este Moisés, aquel varón que nos sacó de la tierra de Egipto, no sabemos qué le haya acontecido.
EXO.32.2	32	2	And Aaron said unto them, Break off the golden earrings, which {are} in the ears of your wives, of your sons, and of your daughters, and bring {them} unto me.	0.3	positive	Y Aarón les dijo: Apartad los zarcillos de oro que están en las orejas de vuestras mujeres, y de vuestros hijos, y de vuestras hijas, y traédmelos.
EXO.32.3	32	3	And all the people brake off the golden earrings which {were} in their ears, and brought {them} unto Aaron.	0.3	positive	Entonces todo el pueblo apartó los zarcillos de oro que tenían en sus orejas, y trajéronlos á Aarón:
EXO.32.4	32	4	And he received {them} at their hand, and fashioned it with a graving tool, after he had made it a molten calf: and they said, These {be} thy gods, O Israel, which brought thee up out of the land of Egypt.	0.0	neutral	El cual los tomó de las manos de ellos, y formólo con buril, é hizo de ello un becerro de fundición. Entonces dijeron: Israel, estos son tus dioses, que te sacaron de la tierra de Egipto.
EXO.32.5	32	5	And when Aaron saw {it}, he built an altar before it; and Aaron made proclamation, and said, To morrow {is} a feast to the LORD.	0.0	neutral	Y viendo esto Aarón, edificó un altar delante del becerro; y pregonó Aarón, y dijo: Mañana será fiesta á Jehová.
EXO.32.6	32	6	And they rose up early on the morrow, and offered burnt offerings, and brought peace offerings; and the people sat down to eat and to drink, and rose up to play.	0.2861	positive	Y el día siguiente madrugaron, y ofrecieron holocaustos, y presentaron pacíficos: y sentóse el pueblo á comer y á beber, y levantáronse á regocijarse.
EXO.32.7	32	7	And the LORD said unto Moses, Go, get thee down; for thy people, which thou broughtest out of the land of Egypt, have corrupted {themselves}:	-0.1556	negative	Entonces Jehová dijo á Moisés: Anda, desciende, porque tu pueblo que sacaste de tierra de Egipto se ha corrompido:
EXO.32.8	32	8	They have turned aside quickly out of the way which I commanded them: they have made them a molten calf, and have worshipped it, and have sacrificed thereunto, and said, These {be} thy gods, O Israel, which have brought thee up out of the land of Egypt.	0.3333	positive	Presto se han apartado del camino que yo les mandé, y se han hecho un becerro de fundición, y lo han adorado, y han sacrificado á él, y han dicho: Israel, estos son tus dioses, que te sacaron de la tierra de Egipto.
EXO.32.9	32	9	And the LORD said unto Moses, I have seen this people, and, behold, it {is} a stiffnecked people:	0.0	neutral	Dijo más Jehová á Moisés: Yo he visto á este pueblo, que por cierto es pueblo de dura cerviz:
EXO.32.10	32	10	Now therefore let me alone, that my wrath may wax hot against them, and that I may consume them: and I will make of thee a great nation.	0.525	positive	Ahora pues, déjame que se encienda mi furor en ellos, y los consuma: y á ti yo te pondré sobre gran gente.
EXO.32.11	32	11	And Moses besought the LORD his God, and said, LORD, why doth thy wrath wax hot against thy people, which thou hast brought forth out of the land of Egypt with great power, and with a mighty hand? {the LORD: Heb. the face of the LORD}	0.4833	positive	Entonces Moisés oró á la faz de Jehová su Dios, y dijo: Oh Jehová, ¿por qué se encenderá tu furor en tu pueblo, que tú sacaste de la tierra de Egipto con gran fortaleza, y con mano fuerte?
EXO.32.12	32	12	Wherefore should the Egyptians speak, and say, For mischief did he bring them out, to slay them in the mountains, and to consume them from the face of the earth? Turn from thy fierce wrath, and repent of this evil against thy people.	-1.0	negative	¿Por qué han de hablar los Egipcios, diciendo: Para mal los sacó, para matarlos en los montes, y para raerlos de sobre la haz de la tierra? Vuélvete del furor de tu ira, y arrepiéntete del mal de tu pueblo.
EXO.32.13	32	13	Remember Abraham, Isaac, and Israel, thy servants, to whom thou swarest by thine own self, and saidst unto them, I will multiply your seed as the stars of heaven, and all this land that I have spoken of will I give unto your seed, and they shall inherit {it} for ever.	0.3	positive	Acuérdate de Abraham, de Isaac, y de Israel tus siervos, á los cuales has jurado por ti mismo, y dícholes: Yo multiplicaré vuestra simiente como las estrellas del cielo; y daré á vuestra simiente toda esta tierra que he dicho, y la tomarán por heredad para siempre.
EXO.32.14	32	14	And the LORD repented of the evil which he thought to do unto his people.	-1.0	negative	Entonces Jehová se arrepintió del mal que dijo que había de hacer á su pueblo.
EXO.32.15	32	15	And Moses turned, and went down from the mount, and the two tables of the testimony {were} in his hand: the tables {were} written on both their sides; on the one side and on the other {were} they written.	-0.1403	negative	Y volvióse Moisés, y descendió del monte trayendo en su mano las dos tablas del testimonio, las tablas escritas por ambos lados; de una parte y de otra estaban escritas.
EXO.32.16	32	16	And the tables {were} the work of God, and the writing {was} the writing of God, graven upon the tables.	0.0	neutral	Y las tablas eran obra de Dios, y la escritura era escritura de Dios grabada sobre las tablas.
EXO.32.17	32	17	And when Joshua heard the noise of the people as they shouted, he said unto Moses, {There is} a noise of war in the camp.	0.0	neutral	Y oyendo Josué el clamor del pueblo que gritaba, dijo á Moisés: Alarido de pelea hay en el campo.
EXO.32.18	32	18	And he said, {It is} not the voice of {them that} shout for mastery, neither {is it} the voice of {them that} cry for being overcome: {but} the noise of {them that} sing do I hear. {being...: Heb. weakness}	-0.75	negative	Y él respondió: No es eco de algazara de fuertes, ni eco de alaridos de flacos: algazara de cantar oigo yo.
EXO.32.19	32	19	And it came to pass, as soon as he came nigh unto the camp, that he saw the calf, and the dancing: and Moses' anger waxed hot, and he cast the tables out of his hands, and brake them beneath the mount.	-0.225	negative	Y aconteció, que como llegó él al campo, y vió el becerro y las danzas, enardeciósele la ira á Moisés, y arrojó las tablas de sus manos, y quebrólas al pie del monte.
EXO.32.20	32	20	And he took the calf which they had made, and burnt {it} in the fire, and ground {it} to powder, and strawed {it} upon the water, and made the children of Israel drink {of it}.	0.0	neutral	Y tomó el becerro que habían hecho, y quemólo en el fuego, y moliólo hasta reducirlo á polvo, que esparció sobre las aguas, y diólo á beber á los hijos de Israel.
EXO.32.21	32	21	And Moses said unto Aaron, What did this people unto thee, that thou hast brought so great a sin upon them?	0.8	positive	Y dijo Moisés á Aarón: ¿Qué te ha hecho este pueblo, que has traído sobre él tan gran pecado?
EXO.32.22	32	22	And Aaron said, Let not the anger of my lord wax hot: thou knowest the people, that they {are set} on mischief.	-0.225	negative	Y respondió Aarón: No se enoje mi señor; tú conoces el pueblo, que es inclinado á mal.
EXO.32.23	32	23	For they said unto me, Make us gods, which shall go before us: for {as for} this Moses, the man that brought us up out of the land of Egypt, we wot not what is become of him.	0.0	neutral	Porque me dijeron: Haznos dioses que vayan delante de nosotros, que á este Moisés, el varón que nos sacó de tierra de Egipto, no sabemos qué le ha acontecido.
EXO.32.24	32	24	And I said unto them, Whosoever hath any gold, let them break {it} off. So they gave {it} me: then I cast it into the fire, and there came out this calf.	0.0	neutral	Y yo les respondí: ¿Quién tiene oro? Apartadlo. Y diéronmelo, y echélo en el fuego, y salió este becerro.
EXO.32.25	32	25	And when Moses saw that the people {were} naked; (for Aaron had made them naked unto {their} shame among their enemies:) {their enemies: Heb. those that rose up against them}	0.275	positive	Y viendo Moisés que el pueblo estaba despojado, porque Aarón lo había despojado para vergüenza entre sus enemigos,
EXO.32.26	32	26	Then Moses stood in the gate of the camp, and said, Who {is} on the LORD'S side? {let him come} unto me. And all the sons of Levi gathered themselves together unto him.	0.0	neutral	Púsose Moisés á la puerta del real, y dijo: ¿Quién es de Jehová? júntese conmigo. Y juntáronse con él todos los hijos de Leví.
EXO.32.27	32	27	And he said unto them, Thus saith the LORD God of Israel, Put every man his sword by his side, {and} go in and out from gate to gate throughout the camp, and slay every man his brother, and every man his companion, and every man his neighbour.	0.0	neutral	Y él les dijo: Así ha dicho Jehová, el Dios de Israel: Poned cada uno su espada sobre su muslo: pasad y volved de puerta á puerta por el campo, y matad cada uno á su hermano, y á su amigo, y á su pariente.
EXO.32.28	32	28	And the children of Levi did according to the word of Moses: and there fell of the people that day about three thousand men.	0.0	neutral	Y los hijos de Leví lo hicieron conforme al dicho de Moisés: y cayeron del pueblo en aquel día como tres mil hombres.
EXO.32.29	32	29	For Moses had said, Consecrate yourselves to day to the LORD, even every man upon his son, and upon his brother; that he may bestow upon you a blessing this day. {For Moses...: or, And Moses said, Consecrate yourselves to day to the LORD, because every man hath been against his brother, etc} {Consecrate...: Heb. Fill your hands}	0.0	neutral	Entonces Moisés dijo: Hoy os habéis consagrado á Jehová, porque cada uno se ha consagrado en su hijo, y en su hermano, para que dé él hoy bendición sobre vosotros.
EXO.32.30	32	30	And it came to pass on the morrow, that Moses said unto the people, Ye have sinned a great sin: and now I will go up unto the LORD; peradventure I shall make an atonement for your sin.	0.8	positive	Y aconteció que el día siguiente dijo Moisés al pueblo: Vosotros habéis cometido un gran pecado: mas yo subiré ahora á Jehová; quizá le aplacaré acerca de vuestro pecado.
EXO.32.31	32	31	And Moses returned unto the LORD, and said, Oh, this people have sinned a great sin, and have made them gods of gold.	0.8	positive	Entonces volvió Moisés á Jehová, y dijo: Ruégote, pues este pueblo ha cometido un gran pecado, porque se hicieron dioses de oro,
EXO.32.32	32	32	Yet now, if thou wilt forgive their sin-; and if not, blot me, I pray thee, out of thy book which thou hast written.	0.0	neutral	Que perdones ahora su pecado, y si no, ráeme ahora de tu libro que has escrito.
EXO.32.33	32	33	And the LORD said unto Moses, Whosoever hath sinned against me, him will I blot out of my book.	0.0	neutral	Y Jehová respondió á Moisés: Al que pecare contra mí, á éste raeré yo de mi libro.
EXO.32.34	32	34	Therefore now go, lead the people unto {the place} of which I have spoken unto thee: behold, mine Angel shall go before thee: nevertheless in the day when I visit I will visit their sin upon them.	0.0	neutral	Ve pues ahora, lleva á este pueblo donde te he dicho: he aquí mi ángel irá delante de ti; que en el día de mi visitación yo visitaré en ellos su pecado.
EXO.32.35	32	35	And the LORD plagued the people, because they made the calf, which Aaron made.	0.0	neutral	Y Jehová hirió al pueblo, porque habían hecho el becerro que formó Aarón.
EXO.33.1	33	1	And the LORD said unto Moses, Depart, {and} go up hence, thou and the people which thou hast brought up out of the land of Egypt, unto the land which I sware unto Abraham, to Isaac, and to Jacob, saying, Unto thy seed will I give it:	0.0	neutral	Y JEHOVA dijo á Moisés: Ve, sube de aquí, tú y el pueblo que sacaste de la tierra de Egipto, á la tierra de la cual juré á Abraham, Isaac, y Jacob, diciendo: A tu simiente la daré:
EXO.33.2	33	2	And I will send an angel before thee; and I will drive out the Canaanite, the Amorite, and the Hittite, and the Perizzite, the Hivite, and the Jebusite:	0.0	neutral	Y yo enviaré delante de ti el ángel, y echaré fuera al Cananeo y al Amorrheo, y al Hetheo, y al Pherezeo, y al Heveo y al Jebuseo:
EXO.33.3	33	3	Unto a land flowing with milk and honey: for I will not go up in the midst of thee; for thou {art} a stiffnecked people: lest I consume thee in the way.	0.0	neutral	(A la tierra que fluye leche y miel); porque yo no subiré en medio de ti, porque eres pueblo de dura cerviz, no sea que te consuma en el camino.
EXO.33.4	33	4	And when the people heard these evil tidings, they mourned: and no man did put on him his ornaments.	-1.0	negative	Y oyendo el pueblo esta sensible palabra, vistieron luto, y ninguno se puso sus atavíos:
EXO.33.5	33	5	For the LORD had said unto Moses, Say unto the children of Israel, Ye {are} a stiffnecked people: I will come up into the midst of thee in a moment, and consume thee: therefore now put off thy ornaments from thee, that I may know what to do unto thee.	0.0	neutral	Pues Jehová dijo á Moisés: Di á los hijos de Israel: Vosotros sois pueblo de dura cerviz: en un momento subiré en medio de ti, y te consumiré: quítate pues ahora tus atavíos, que yo sabré lo que te tengo de hacer.
EXO.33.6	33	6	And the children of Israel stripped themselves of their ornaments by the mount Horeb.	0.0	neutral	Entonces los hijos de Israel se despojaron de sus atavíos desde el monte Horeb.
EXO.33.7	33	7	And Moses took the tabernacle, and pitched it without the camp, afar off from the camp, and called it the Tabernacle of the congregation. And it came to pass, {that} every one which sought the LORD went out unto the tabernacle of the congregation, which {was} without the camp.	0.0	neutral	Y Moisés tomó el tabernáculo, y extendiólo fuera del campo, lejos del campo, y llamólo el Tabernáculo del Testimonio. Y fué, que cualquiera que requería á Jehová, salía al tabernáculo del testimonio, que estaba fuera del campo.
EXO.33.8	33	8	And it came to pass, when Moses went out unto the tabernacle, {that} all the people rose up, and stood every man {at} his tent door, and looked after Moses, until he was gone into the tabernacle.	0.6	positive	Y sucedía que, cuando salía Moisés al tabernáculo, todo el pueblo se levantaba, y estaba cada cual en pie á la puerta de su tienda, y miraban en pos de Moisés, hasta que él entraba en el tabernáculo.
EXO.33.9	33	9	And it came to pass, as Moses entered into the tabernacle, the cloudy pillar descended, and stood {at} the door of the tabernacle, and {the LORD} talked with Moses.	0.0	neutral	Y cuando Moisés entraba en el tabernáculo, la columna de nube descendía, y poníase á la puerta del tabernáculo, y Jehová hablaba con Moisés.
EXO.33.10	33	10	And all the people saw the cloudy pillar stand {at} the tabernacle door: and all the people rose up and worshipped, every man {in} his tent door.	0.6	positive	Y viendo todo el pueblo la columna de nube, que estaba á la puerta del tabernáculo, levantábase todo el pueblo, cada uno á la puerta de su tienda y adoraba.
EXO.33.11	33	11	And the LORD spake unto Moses face to face, as a man speaketh unto his friend. And he turned again into the camp: but his servant Joshua, the son of Nun, a young man, departed not out of the tabernacle.	0.1	neutral	Y hablaba Jehová á Moisés cara á cara, como habla cualquiera á su compañero. Y volvíase al campo; mas el joven Josué, su criado, hijo de Nun, nunca se apartaba de en medio del tabernáculo.
EXO.33.12	33	12	And Moses said unto the LORD, See, thou sayest unto me, Bring up this people: and thou hast not let me know whom thou wilt send with me. Yet thou hast said, I know thee by name, and thou hast also found grace in my sight.	0.0	neutral	Y dijo Moisés á Jehová: Mira, tú me dices á mí: Saca este pueblo: y tú no me has declarado á quién has de enviar conmigo: sin embargo, tú dices: Yo te he conocido por tu nombre, y has hallado también gracia en mis ojos.
EXO.33.13	33	13	Now therefore, I pray thee, if I have found grace in thy sight, shew me now thy way, that I may know thee, that I may find grace in thy sight: and consider that this nation {is} thy people.	0.0	neutral	Ahora, pues, si he hallado gracia en tus ojos, ruégote que me muestres ahora tu camino, para que te conozca, porque halle gracia en tus ojos: y mira que tu pueblo es aquesta gente.
EXO.33.14	33	14	And he said, My presence shall go {with thee}, and I will give thee rest.	0.0	neutral	Y él dijo: Mi rostro irá contigo, y te haré descansar.
EXO.33.15	33	15	And he said unto him, If thy presence go not {with me}, carry us not up hence.	0.0	neutral	Y él respondió: Si tu rostro no ha de ir conmigo, no nos saques de aquí.
EXO.33.16	33	16	For wherein shall it be known here that I and thy people have found grace in thy sight? {is it} not in that thou goest with us? so shall we be separated, I and thy people, from all the people that {are} upon the face of the earth.	0.0	neutral	¿Y en qué se conocerá aquí que he hallado gracia en tus ojos, yo y tu pueblo, sino en andar tú con nosotros, y que yo y tu pueblo seamos apartados de todos los pueblos que están sobre la faz de la tierra?
EXO.33.17	33	17	And the LORD said unto Moses, I will do this thing also that thou hast spoken: for thou hast found grace in my sight, and I know thee by name.	0.0	neutral	Y Jehová dijo á Moisés: También haré esto que has dicho, por cuanto has hallado gracia en mis ojos, y te he conocido por tu nombre.
EXO.33.18	33	18	And he said, I beseech thee, shew me thy glory.	0.0	neutral	El entonces dijo: Ruégote que me muestres tu gloria.
EXO.33.19	33	19	And he said, I will make all my goodness pass before thee, and I will proclaim the name of the LORD before thee; and will be gracious to whom I will be gracious, and will shew mercy on whom I will shew mercy.	0.0	neutral	Y respondióle: Yo haré pasar todo mi bien delante de tu rostro, y proclamaré el nombre de Jehová delante de ti; y tendré misericordia del que tendré misericordia, y seré clemente para con el que seré clemente.
EXO.33.20	33	20	And he said, Thou canst not see my face: for there shall no man see me, and live.	0.1364	positive	Dijo más: No podrás ver mi rostro: porque no me verá hombre, y vivirá.
EXO.33.21	33	21	And the LORD said, Behold, {there is} a place by me, and thou shalt stand upon a rock:	0.0	neutral	Y dijo aún Jehová: He aquí lugar junto á mí, y tú estarás sobre la peña:
EXO.33.22	33	22	And it shall come to pass, while my glory passeth by, that I will put thee in a clift of the rock, and will cover thee with my hand while I pass by:	0.0	neutral	Y será que, cuando pasare mi gloria, yo te pondré en una hendidura de la peña, y te cubriré con mi mano hasta que haya pasado:
EXO.33.23	33	23	And I will take away mine hand, and thou shalt see my back parts: but my face shall not be seen.	0.0	neutral	Después apartaré mi mano, y verás mis espaldas; mas no se verá mi rostro.
EXO.34.1	34	1	And the LORD said unto Moses, Hew thee two tables of stone like unto the first: and I will write upon {these} tables the words that were in the first tables, which thou brakest.	0.25	positive	Y JEHOVA dijo á Moisés: Alísate dos tablas de piedra como las primeras, y escribiré sobre esas tablas las palabras que estaban en las tablas primeras que quebraste.
EXO.34.2	34	2	And be ready in the morning, and come up in the morning unto mount Sinai, and present thyself there to me in the top of the mount.	0.2333	positive	Apercíbete, pues, para mañana, y sube por la mañana al monte de Sinaí, y estáme allí sobre la cumbre del monte.
EXO.34.3	34	3	And no man shall come up with thee, neither let any man be seen throughout all the mount; neither let the flocks nor herds feed before that mount.	0.0	neutral	Y no suba hombre contigo, ni parezca alguno en todo el monte; ni ovejas ni bueyes pazcan delante del monte.
EXO.34.4	34	4	And he hewed two tables of stone like unto the first; and Moses rose up early in the morning, and went up unto mount Sinai, as the LORD had commanded him, and took in his hand the two tables of stone.	0.3167	positive	Y Moisés alisó dos tablas de piedra como las primeras; y levantóse por la mañana, y subió al monte de Sinaí, como le mandó Jehová, y llevó en su mano las dos tablas de piedra.
EXO.34.5	34	5	And the LORD descended in the cloud, and stood with him there, and proclaimed the name of the LORD.	0.0	neutral	Y Jehová descendió en la nube, y estuvo allí con él, proclamando el nombre de Jehová.
EXO.34.6	34	6	And the LORD passed by before him, and proclaimed, The LORD, The LORD God, merciful and gracious, longsuffering, and abundant in goodness and truth,	0.6	positive	Y pasando Jehová por delante de él, proclamó: Jehová, Jehová, fuerte, misericordioso, y piadoso; tardo para la ira, y grande en benignidad y verdad;
EXO.34.7	34	7	Keeping mercy for thousands, forgiving iniquity and transgression and sin, and that will by no means clear {the guilty}; visiting the iniquity of the fathers upon the children, and upon the children's children, unto the third and to the fourth {generation}.	-0.1	neutral	Que guarda la misericordia en millares, que perdona la iniquidad, la rebelión, y el pecado, y que de ningún modo justificará al malvado; que visita la iniquidad de los padres sobre los hijos y sobre los hijos de los hijos, sobre los terceros, y sobre los cuartos.
EXO.34.8	34	8	And Moses made haste, and bowed his head toward the earth, and worshipped.	0.0	neutral	Entonces Moisés, apresurándose, bajó la cabeza hacia el suelo y encorvóse;
EXO.34.9	34	9	And he said, If now I have found grace in thy sight, O Lord, let my Lord, I pray thee, go among us; for it {is} a stiffnecked people; and pardon our iniquity and our sin, and take us for thine inheritance.	0.0	neutral	Y dijo: Si ahora, Señor, he hallado gracia en tus ojos, vaya ahora el Señor en medio de nosotros; porque este es pueblo de dura cerviz; y perdona nuestra iniquidad y nuestro pecado, y poséenos.
EXO.34.10	34	10	And he said, Behold, I make a covenant: before all thy people I will do marvels, such as have not been done in all the earth, nor in any nation: and all the people among which thou {art} shall see the work of the LORD: for it {is} a terrible thing that I will do with thee.	-0.5	negative	Y él dijo: He aquí, yo hago concierto delante de todo tu pueblo: haré maravillas que no han sido hechas en toda la tierra, ni en nación alguna; y verá todo el pueblo en medio del cual estás tú, la obra de Jehová; porque ha de ser cosa terrible la que yo haré contigo.
EXO.34.11	34	11	Observe thou that which I command thee this day: behold, I drive out before thee the Amorite, and the Canaanite, and the Hittite, and the Perizzite, and the Hivite, and the Jebusite.	0.0	neutral	Guarda lo que yo te mando hoy; he aquí que yo echo de delante de tu presencia al Amorrheo, y al Cananeo, y al Hetheo, y al Pherezeo, y al Heveo, y al Jebuseo.
