verse_id	chapter	verse	text_en	polarity_en	label_en	text_es
EXO.36.31	36	31	And he made bars of shittim wood; five for the boards of the one side of the tabernacle,	0.0	neutral	Hizo también las barras de madera de Sittim; cinco para las tablas del un lado del tabernáculo,
EXO.36.32	36	32	And five bars for the boards of the other side of the tabernacle, and five bars for the boards of the tabernacle for the sides westward.	-0.125	negative	Y cinco barras para las tablas del otro lado del tabernáculo, y cinco barras para las tablas del lado del tabernáculo á la parte occidental.
EXO.36.33	36	33	And he made the middle bar to shoot through the boards from the one end to the other.	-0.0625	neutral	E hizo que la barra del medio pasase por medio de las tablas del un cabo al otro.
EXO.36.34	36	34	And he overlaid the boards with gold, and made their rings {of} gold {to be} places for the bars, and overlaid the bars with gold.	0.0	neutral	Y cubrió las tablas de oro, é hizo de oro los anillos de ellas por donde pasasen las barras: cubrió también de oro las barras.
EXO.36.35	36	35	And he made a vail {of} blue, and purple, and scarlet, and fine twined linen: {with} cherubims made he it of cunning work.	-0.0833	neutral	Hizo asimismo el velo de cárdeno, y púrpura, y carmesí, y lino torcido, el cual hizo con querubines de delicada obra.
EXO.36.36	36	36	And he made thereunto four pillars {of} shittim {wood}, and overlaid them with gold: their hooks {were of} gold; and he cast for them four sockets of silver.	0.0	neutral	Y para él hizo cuatro columnas de madera de Sittim; y cubriólas de oro, los capiteles de las cuales eran de oro; é hizo para ellas cuatro basas de plata de fundición.
EXO.36.37	36	37	And he made an hanging for the tabernacle door {of} blue, and purple, and scarlet, and fine twined linen, of needlework; {of needlework: Heb. the work of a needleworker or, embroiderer}	0.2083	positive	Hizo también el velo para la puerta del tabernáculo, de jacinto, y púrpura, y carmesí, y lino torcido, obra de recamador;
EXO.36.38	36	38	And the five pillars of it with their hooks: and he overlaid their chapiters and their fillets with gold: but their five sockets {were of} brass.	0.0	neutral	Y sus cinco columnas con sus capiteles: y cubrió las cabezas de ellas y sus molduras de oro: pero sus cinco basas las hizo de metal.
EXO.37.1	37	1	And Bezaleel made the ark {of} shittim wood: two cubits and a half {was} the length of it, and a cubit and a half the breadth of it, and a cubit and a half the height of it:	-0.1667	negative	HIZO también Bezaleel el arca de madera de Sittim: su longitud era de dos codos y medio, y de codo y medio su anchura, y su altura de otro codo y medio:
EXO.37.2	37	2	And he overlaid it with pure gold within and without, and made a crown of gold to it round about.	0.0071	neutral	Y cubrióla de oro puro por de dentro y por de fuera, é hízole una cornisa de oro en derredor.
EXO.37.3	37	3	And he cast for it four rings of gold, {to be set} by the four corners of it; even two rings upon the one side of it, and two rings upon the other side of it.	-0.125	negative	Hízole además de fundición cuatro anillos de oro á sus cuatro esquinas; en el un lado dos anillos y en el otro lado dos anillos.
EXO.37.4	37	4	And he made staves {of} shittim wood, and overlaid them with gold.	0.0	neutral	Hizo también las varas de madera de Sittim, y cubriólas de oro.
EXO.37.5	37	5	And he put the staves into the rings by the sides of the ark, to bear the ark.	0.0	neutral	Y metió las varas por los anillos á los lados del arca, para llevar el arca.
EXO.37.6	37	6	And he made the mercy seat {of} pure gold: two cubits and a half {was} the length thereof, and one cubit and a half the breadth thereof.	-0.0397	neutral	Hizo asimismo la cubierta de oro puro: su longitud de dos codos y medio, y su anchura de codo y medio.
EXO.37.7	37	7	And he made two cherubims {of} gold, beaten out of one piece made he them, on the two ends of the mercy seat; {on...: or, out of, etc}	0.0	neutral	Hizo también los dos querubines de oro, hízolos labrados á martillo, á los dos cabos de la cubierta:
EXO.37.8	37	8	One cherub on the end on this side, and another cherub on the {other} end on that side: out of the mercy seat made he the cherubims on the two ends thereof. {on the end: or, out of, etc} {on the other end: or, out of, etc}	-0.125	negative	El un querubín de esta parte al un cabo, y el otro querubín de la otra parte al otro cabo de la cubierta: hizo los querubines á sus dos cabos.
EXO.37.9	37	9	And the cherubims spread out {their} wings on high, {and} covered with their wings over the mercy seat, with their faces one to another; {even} to the mercy seatward were the faces of the cherubims.	0.16	positive	Y los querubines extendían sus alas por encima, cubriendo con sus alas la cubierta: y sus rostros el uno enfrente del otro, hacia la cubierta los rostros de los querubines.
EXO.37.10	37	10	And he made the table {of} shittim wood: two cubits {was} the length thereof, and a cubit the breadth thereof, and a cubit and a half the height thereof:	-0.1667	negative	Hizo también la mesa de madera de Sittim; su longitud de dos codos, y su anchura de un codo, y de codo y medio su altura;
EXO.37.11	37	11	And he overlaid it with pure gold, and made thereunto a crown of gold round about.	0.0071	neutral	Y cubrióla de oro puro, é hízole una cornisa de oro en derredor.
EXO.37.12	37	12	Also he made thereunto a border of an handbreadth round about; and made a crown of gold for the border thereof round about.	-0.2	negative	Hízole también una moldura alrededor, del ancho de una mano, á la cual moldura hizo la cornisa de oro en circunferencia.
EXO.37.13	37	13	And he cast for it four rings of gold, and put the rings upon the four corners that {were} in the four feet thereof.	0.0	neutral	Hízole asimismo de fundición cuatro anillos de oro, y púsolos á las cuatro esquinas que correspondían á los cuatro pies de ella.
EXO.37.14	37	14	Over against the border were the rings, the places for the staves to bear the table.	0.0	neutral	Delante de la moldura estaban los anillos, por los cuales se metiesen las varas para llevar la mesa.
EXO.37.15	37	15	And he made the staves {of} shittim wood, and overlaid them with gold, to bear the table.	0.0	neutral	E hizo las varas de madera de Sittim para llevar la mesa, y cubriólas de oro.
EXO.37.16	37	16	And he made the vessels which {were} upon the table, his dishes, and his spoons, and his bowls, and his covers to cover withal, {of} pure gold. {to cover...: or, to pour out withal}	0.2143	positive	También hizo los vasos que habían de estar sobre la mesa, sus platos, y sus cucharas, y sus cubiertos y sus tazones con que se había de libar, de oro fino.
EXO.37.17	37	17	And he made the candlestick {of} pure gold: {of} beaten work made he the candlestick; his shaft, and his branch, his bowls, his knops, and his flowers, were of the same:	-0.1786	negative	Hizo asimismo el candelero de oro puro, é hízolo labrado á martillo: su pie y su caña, sus copas, sus manzanas y sus flores eran de lo mismo.
EXO.37.18	37	18	And six branches going out of the sides thereof; three branches of the candlestick out of the one side thereof, and three branches of the candlestick out of the other side thereof:	-0.125	negative	De sus lados salían seis brazos; tres brazos del un lado del candelero, y otros tres brazos del otro lado del candelero:
EXO.37.19	37	19	Three bowls made after the fashion of almonds in one branch, a knop and a flower; and three bowls made like almonds in another branch, a knop and a flower: so throughout the six branches going out of the candlestick.	0.0	neutral	En el un brazo, tres copas figura de almendras, una manzana y una flor; y en el otro brazo tres copas figura de almendras, una manzana y una flor: y así en los seis brazos que salían del candelero.
EXO.37.20	37	20	And in the candlestick {were} four bowls made like almonds, his knops, and his flowers:	0.0	neutral	Y en el candelero había cuatro copas figura de almendras, sus manzanas y sus flores:
EXO.37.21	37	21	And a knop under two branches of the same, and a knop under two branches of the same, and a knop under two branches of the same, according to the six branches going out of it.	0.0	neutral	Y una manzana debajo de los dos brazos de lo mismo, y otra manzana debajo de los otros dos brazos de lo mismo, y otra manzana debajo de los otros dos brazos de lo mismo, conforme á los seis brazos que salían de él.
EXO.37.22	37	22	Their knops and their branches were of the same: all of it {was} one beaten work {of} pure gold.	0.1071	positive	Sus manzanas y sus brazos eran de lo mismo; todo era una pieza labrada á martillo, de oro puro.
EXO.37.23	37	23	And he made his seven lamps, and his snuffers, and his snuffdishes, {of} pure gold.	0.2143	positive	Hizo asimismo sus siete candilejas, y sus despabiladeras, y sus platillos, de oro puro;
EXO.37.24	37	24	{Of} a talent of pure gold made he it, and all the vessels thereof.	0.2143	positive	De un talento de oro puro lo hizo, con todos sus vasos.
EXO.37.25	37	25	And he made the incense altar {of} shittim wood: the length of it {was} a cubit, and the breadth of it a cubit; {it was} foursquare; and two cubits {was} the height of it; the horns thereof were of the same.	0.0	neutral	Hizo también el altar del perfume de madera de Sittim: un codo su longitud, y otro codo su anchura, era cuadrado; y su altura de dos codos; y sus cuernos de la misma pieza.
EXO.37.26	37	26	And he overlaid it with pure gold, {both} the top of it, and the sides thereof round about, and the horns of it: also he made unto it a crown of gold round about.	0.0786	neutral	Y cubriólo de oro puro, su mesa y sus paredes alrededor, y sus cuernos: é hízole una corona de oro alrededor.
EXO.37.27	37	27	And he made two rings of gold for it under the crown thereof, by the two corners of it, upon the two sides thereof, to be places for the staves to bear it withal.	0.0	neutral	Hízole también dos anillos de oro debajo de la corona en las dos esquinas á los dos lados, para pasar por ellos las varas con que había de ser conducido.
EXO.37.28	37	28	And he made the staves {of} shittim wood, and overlaid them with gold.	0.0	neutral	E hizo las varas de madera de Sittim, y cubriólas de oro.
EXO.37.29	37	29	And he made the holy anointing oil, and the pure incense of sweet spices, according to the work of the apothecary.	0.2821	positive	Hizo asimismo el aceite santo de la unción, y el fino perfume aromático, de obra de perfumador.
EXO.38.1	38	1	And he made the altar of burnt offering {of} shittim wood: five cubits {was} the length thereof, and five cubits the breadth thereof; {it was} foursquare; and three cubits the height thereof.	0.0	neutral	IGUALMENTE hizo el altar del holocausto de madera de Sittim: su longitud de cinco codos, y su anchura de otros cinco codos, cuadrado, y de tres codos de altura.
EXO.38.2	38	2	And he made the horns thereof on the four corners of it; the horns thereof were of the same: and he overlaid it with brass.	0.0	neutral	E hízole sus cuernos á sus cuatro esquinas, los cuales eran de la misma pieza, y cubriólo de metal.
EXO.38.3	38	3	And he made all the vessels of the altar, the pots, and the shovels, and the basons, {and} the fleshhooks, and the firepans: all the vessels thereof made he {of} brass.	0.0	neutral	Hizo asimismo todos los vasos del altar: calderas, y tenazas, y tazones, y garfios, y palas: todos sus vasos hizo de metal.
EXO.38.4	38	4	And he made for the altar a brasen grate of network under the compass thereof beneath unto the midst of it.	0.0	neutral	E hizo para el altar el enrejado de metal, de hechura de red, que puso en su cerco por debajo hasta el medio del altar.
EXO.38.5	38	5	And he cast four rings for the four ends of the grate of brass, {to be} places for the staves.	0.0	neutral	Hizo también cuatro anillos de fundición á los cuatro cabos del enrejado de metal, para meter las varas.
EXO.38.6	38	6	And he made the staves {of} shittim wood, and overlaid them with brass.	0.0	neutral	E hizo las varas de madera de Sittim, y cubriólas de metal.
EXO.38.7	38	7	And he put the staves into the rings on the sides of the altar, to bear it withal; he made the altar hollow with boards.	-0.1	neutral	Y metió las varas por los anillos á los lados del altar, para llevarlo con ellas: hueco lo hizo, de tablas.
EXO.38.8	38	8	And he made the laver {of} brass, and the foot of it {of} brass, of the lookingglasses of {the women} assembling, which assembled {at} the door of the tabernacle of the congregation. {lookingglasses: or, brasen glasses} {assembling: Heb. assembling by troops}	0.0	neutral	También hizo la fuente de metal, con su basa de metal, de los espejos de las que velaban á la puerta del tabernáculo del testimonio.
EXO.38.9	38	9	And he made the court: on the south side southward the hangings of the court {were of} fine twined linen, an hundred cubits:	0.4167	positive	Hizo asimismo el atrio; á la parte austral del mediodía las cortinas del atrio eran de cien codos, de lino torcido:
EXO.38.10	38	10	Their pillars {were} twenty, and their brasen sockets twenty; the hooks of the pillars and their fillets {were of} silver.	0.0	neutral	Sus columnas veinte, con sus veinte basas de metal: los capiteles de las columnas y sus molduras, de plata.
EXO.38.11	38	11	And for the north side {the hangings were} an hundred cubits, their pillars {were} twenty, and their sockets of brass twenty; the hooks of the pillars and their fillets {of} silver.	0.0	neutral	Y á la parte del aquilón cortinas de cien codos: sus columnas veinte, con sus veinte basas de metal; los capiteles de las columnas y sus molduras, de plata.
EXO.38.12	38	12	And for the west side {were} hangings of fifty cubits, their pillars ten, and their sockets ten; the hooks of the pillars and their fillets {of} silver.	0.0	neutral	A la parte del occidente cortinas de cincuenta codos: sus columnas diez, y sus diez basas; los capiteles de las columnas y sus molduras, de plata.
EXO.38.13	38	13	And for the east side eastward fifty cubits.	0.0	neutral	Y á la parte oriental, al levante, cortinas de cincuenta codos:
EXO.38.14	38	14	The hangings of the one side {of the gate were} fifteen cubits; their pillars three, and their sockets three.	0.0	neutral	Al un lado cortinas de quince codos, sus tres columnas, y sus tres basas;
EXO.38.15	38	15	And for the other side of the court gate, on this hand and that hand, {were} hangings of fifteen cubits; their pillars three, and their sockets three.	-0.125	negative	Al otro lado, de la una parte y de la otra de la puerta del atrio, cortinas de á quince codos, sus tres columnas, y sus tres basas.
EXO.38.16	38	16	All the hangings of the court round about {were} of fine twined linen.	0.1083	positive	Todas las cortinas del atrio alrededor eran de lino torcido.
EXO.38.17	38	17	And the sockets for the pillars {were of} brass; the hooks of the pillars and their fillets {of} silver; and the overlaying of their chapiters {of} silver; and all the pillars of the court {were} filleted with silver.	0.0	neutral	Y las basas de las columnas eran de metal; los capiteles de las columnas y sus molduras, de plata; asimismo las cubiertas de las cabezas de ellas, de plata: y todas las columnas del atrio tenían molduras de plata.
EXO.38.18	38	18	And the hanging for the gate of the court {was} needlework, {of} blue, and purple, and scarlet, and fine twined linen: and twenty cubits {was} the length, and the height in the breadth {was} five cubits, answerable to the hangings of the court.	0.2083	positive	Y el pabellón de la puerta del atrio fue de obra de recamado, de jacinto, y púrpura, y carmesí, y lino torcido: la longitud de veinte codos, y la altura en el ancho de cinco codos, conforme á las cortinas del atrio.
EXO.38.19	38	19	And their pillars {were} four, and their sockets {of} brass four; their hooks {of} silver, and the overlaying of their chapiters and their fillets {of} silver.	0.0	neutral	Y sus columnas fueron cuatro con sus cuatro basas de metal: y sus capiteles de plata; y las cubiertas de los capiteles de ellas y sus molduras, de plata.
EXO.38.20	38	20	And all the pins of the tabernacle, and of the court round about, {were of} brass.	-0.2	negative	Y todas las estacas del tabernáculo y del atrio alrededor fueron de metal.
EXO.38.21	38	21	This is the sum of the tabernacle, {even} of the tabernacle of testimony, as it was counted, according to the commandment of Moses, {for} the service of the Levites, by the hand of Ithamar, son to Aaron the priest.	0.0	neutral	Estas son las cuentas del tabernáculo, del tabernáculo del testimonio, lo que fué contado de orden de Moisés por mano de Ithamar, hijo de Aarón sacerdote, para el ministerio de los Levitas.
EXO.38.22	38	22	And Bezaleel the son of Uri, the son of Hur, of the tribe of Judah, made all that the LORD commanded Moses.	0.0	neutral	Y Bezaleel, hijo de Uri, hijo de Hur, de la tribu de Judá, hizo todas las cosas que Jehová mandó á Moisés.
EXO.38.23	38	23	And with him {was} Aholiab, son of Ahisamach, of the tribe of Dan, an engraver, and a cunning workman, and an embroiderer in blue, and in purple, and in scarlet, and fine linen.	0.1389	positive	Y con él estaba Aholiab, hijo de Ahisamac, de la tribu de Dan, artífice, y diseñador, y recamador en jacinto, y púrpura, y carmesí, y lino fino.
EXO.38.24	38	24	All the gold that was occupied for the work in all the work of the holy {place}, even the gold of the offering, was twenty and nine talents, and seven hundred and thirty shekels, after the shekel of the sanctuary.	0.0	neutral	Todo el oro empleado en la obra, en toda la obra del santuario, el cual fué oro de ofrenda, fué veintinueve talentos, y setecientos y treinta siclos, según el siclo del santuario.
EXO.38.25	38	25	And the silver of them that were numbered of the congregation {was} an hundred talents, and a thousand seven hundred and threescore and fifteen shekels, after the shekel of the sanctuary:	0.0	neutral	Y la plata de los contados de la congregación fué cien talentos, y mil setecientos setenta y cinco siclos, según el siclo del santuario:
EXO.38.26	38	26	A bekah for every man, {that is}, half a shekel, after the shekel of the sanctuary, for every one that went to be numbered, from twenty years old and upward, for six hundred thousand and three thousand and five hundred and fifty {men}. {every man: Heb. a poll}	-0.0333	neutral	Medio por cabeza, medio siclo, según el siclo del santuario, á todos los que pasaron por cuenta de edad de veinte años y arriba, que fueron seiscientos tres mil quinientos cincuenta.
EXO.38.27	38	27	And of the hundred talents of silver were cast the sockets of the sanctuary, and the sockets of the vail; an hundred sockets of the hundred talents, a talent for a socket.	0.0	neutral	Hubo además cien talentos de plata para hacer de fundición las basas del santuario y las basas del velo: en cien basas cien talentos, á talento por basa.
EXO.38.28	38	28	And of the thousand seven hundred seventy and five shekels he made hooks for the pillars, and overlaid their chapiters, and filleted them.	0.0	neutral	Y de los mil setecientos setenta y cinco siclos hizo los capiteles de las columnas, y cubrió los capiteles de ellas, y las ciñó.
EXO.38.29	38	29	And the brass of the offering {was} seventy talents, and two thousand and four hundred shekels.	0.0	neutral	Y el metal de la ofrenda fue setenta talentos, y dos mil cuatrocientos siclos;
EXO.38.30	38	30	And therewith he made the sockets to the door of the tabernacle of the congregation, and the brasen altar, and the brasen grate for it, and all the vessels of the altar,	0.0	neutral	Del cual hizo las basas de la puerta del tabernáculo del testimonio, y el altar de metal, y su enrejado de metal, y todos los vasos del altar.
EXO.38.31	38	31	And the sockets of the court round about, and the sockets of the court gate, and all the pins of the tabernacle, and all the pins of the court round about.	-0.2	negative	Y las basas del atrio alrededor, y las basas de la puerta del atrio, y todas las estacas del tabernáculo, y todas las estacas del atrio alrededor.
EXO.39.1	39	1	And of the blue, and purple, and scarlet, they made cloths of service, to do service in the holy {place}, and made the holy garments for Aaron; as the LORD commanded Moses.	0.0	neutral	Y DEL jacinto, y púrpura, y carmesí, hicieron las vestimentas del ministerio para ministrar en el santuario, y asimismo hicieron las vestiduras sagradas para Aarón; como Jehová lo había mandado á Moisés.
EXO.39.2	39	2	And he made the ephod {of} gold, blue, and purple, and scarlet, and fine twined linen.	0.2083	positive	Hizo también el ephod de oro, de cárdeno y púrpura y carmesí, y lino torcido.
EXO.39.3	39	3	And they did beat the gold into thin plates, and cut {it into} wires, to work {it} in the blue, and in the purple, and in the scarlet, and in the fine linen, {with} cunning work.	0.0042	neutral	Y extendieron las planchas de oro, y cortaron hilos para tejerlos entre el jacinto, y entre la púrpura, y entre el carmesí, y entre el lino, con delicada obra.
EXO.39.4	39	4	They made shoulderpieces for it, to couple {it} together: by the two edges was it coupled together.	0.0	neutral	Hiciéronle las hombreras que se juntasen; y uníanse en sus dos lados.
EXO.39.5	39	5	And the curious girdle of his ephod, that {was} upon it, {was} of the same, according to the work thereof; {of} gold, blue, and purple, and scarlet, and fine twined linen; as the LORD commanded Moses.	0.0792	neutral	Y el cinto del ephod que estaba sobre él, era de lo mismo, conforme á su obra; de oro, jacinto, y púrpura, y carmesí, y lino torcido; como Jehová lo había mandado á Moisés.
EXO.39.6	39	6	And they wrought onyx stones inclosed in ouches of gold, graven, as signets are graven, with the names of the children of Israel.	0.0	neutral	Y labraron las piedras oniquinas cercadas de engastes de oro, grabadas de grabadura de sello con los nombres de los hijos de Israel:
EXO.39.7	39	7	And he put them on the shoulders of the ephod, {that they should be} stones for a memorial to the children of Israel; as the LORD commanded Moses.	0.0	neutral	Y púsolas sobre las hombreras del ephod, por piedras de memoria á los hijos de Israel; como Jehová lo había á Moisés mandado.
EXO.39.8	39	8	And he made the breastplate {of} cunning work, like the work of the ephod; {of} gold, blue, and purple, and scarlet, and fine twined linen.	0.1389	positive	Hizo también el racional de primorosa obra, como la obra del ephod, de oro, jacinto, y púrpura, y carmesí, y lino torcido.
EXO.39.9	39	9	It was foursquare; they made the breastplate double: a span {was} the length thereof, and a span the breadth thereof, {being} doubled.	0.0	neutral	Era cuadrado: doblado hicieron el racional: su longitud era de un palmo, y de un palmo su anchura, doblado.
EXO.39.10	39	10	And they set in it four rows of stones: {the first} row {was} a sardius, a topaz, and a carbuncle: this {was} the first row. {sardius: or, ruby}	-0.0833	neutral	Y engastaron en él cuatro órdenes de piedras. El primer orden era un sardio, un topacio, y un carbunclo: este el primer orden.
EXO.39.11	39	11	And the second row, an emerald, a sapphire, and a diamond.	0.0	neutral	El segundo orden, una esmeralda, un zafiro, y un diamante.
EXO.39.12	39	12	And the third row, a ligure, an agate, and an amethyst.	0.0	neutral	El tercer orden, un ligurio, un ágata, y un amatista.
EXO.39.13	39	13	And the fourth row, a beryl, an onyx, and a jasper: {they were} inclosed in ouches of gold in their inclosings.	-0.375	negative	Y el cuarto orden, un berilo, un onix, y un jaspe: cercadas y encajadas en sus engastes de oro.
EXO.39.14	39	14	And the stones {were} according to the names of the children of Israel, twelve, according to their names, {like} the engravings of a signet, every one with his name, according to the twelve tribes.	0.0	neutral	Las cuales piedras eran conforme á los nombres de los hijos de Israel, doce según los nombres de ellos; como grabaduras de sello, cada una con su nombre según las doce tribus.
EXO.39.15	39	15	And they made upon the breastplate chains at the ends, {of} wreathen work {of} pure gold.	0.2143	positive	Hicieron también sobre el racional las cadenas pequeñas de hechura de trenza, de oro puro.
EXO.39.16	39	16	And they made two ouches {of} gold, and two gold rings; and put the two rings in the two ends of the breastplate.	0.0	neutral	Hicieron asimismo los dos engastes y los dos anillos, de oro; los cuales dos anillos de oro pusieron en los dos cabos del racional.
EXO.39.17	39	17	And they put the two wreathen chains of gold in the two rings on the ends of the breastplate.	0.0	neutral	Y pusieron las dos trenzas de oro en aquellos dos anillos á los cabos del racional.
EXO.39.18	39	18	And the two ends of the two wreathen chains they fastened in the two ouches, and put them on the shoulderpieces of the ephod, before it.	0.0	neutral	Y fijaron los dos cabos de las dos trenzas en los dos engastes, que pusieron sobre las hombreras del ephod, en la parte delantera de él.
EXO.39.19	39	19	And they made two rings of gold, and put {them} on the two ends of the breastplate, upon the border of it, which {was} on the side of the ephod inward.	0.0	neutral	E hicieron dos anillos de oro, que pusieron en los dos cabos del racional, en su orilla, á la parte baja del ephod.
EXO.39.20	39	20	And they made two {other} golden rings, and put them on the two sides of the ephod underneath, toward the forepart of it, over against the {other} coupling thereof, above the curious girdle of the ephod.	-0.01	neutral	Hicieron además dos anillos de oro, los cuales pusieron en las dos hombreras del ephod, abajo en la parte delantera, delante de su juntura, sobre el cinto del ephod.
