verse_id	chapter	verse	text_en	polarity_en	label_en	text_es
EXO.34.12	34	12	Take heed to thyself, lest thou make a covenant with the inhabitants of the land whither thou goest, lest it be for a snare in the midst of thee:	0.0	neutral	Guárdate que no hagas alianza con los moradores de la tierra donde has de entrar, porque no sean por tropezadero en medio de ti:
EXO.34.13	34	13	But ye shall destroy their altars, break their images, and cut down their groves: {images: Heb. statues}	-0.3685	negative	Mas derribaréis sus altares, y quebraréis sus estatuas, y talaréis sus bosques:
EXO.34.14	34	14	For thou shalt worship no other god: for the LORD, whose name {is} Jealous, {is} a jealous God:	0.0625	neutral	Porque no te has de inclinar á dios ajeno; que Jehová, cuyo nombre es Celoso, Dios celoso es.
EXO.34.15	34	15	Lest thou make a covenant with the inhabitants of the land, and they go a whoring after their gods, and do sacrifice unto their gods, and {one} call thee, and thou eat of his sacrifice;	0.0	neutral	Por tanto no harás alianza con los moradores de aquella tierra; porque fornicarán en pos de sus dioses, y sacrificarán á sus dioses, y te llamarán, y comerás de sus sacrificios;
EXO.34.16	34	16	And thou take of their daughters unto thy sons, and their daughters go a whoring after their gods, and make thy sons go a whoring after their gods.	0.0	neutral	O tomando de sus hijas para tus hijos, y fornicando sus hijas en pos de sus dioses, harán también fornicar á tus hijos en pos de los dioses de ellas.
EXO.34.17	34	17	Thou shalt make thee no molten gods.	0.0	neutral	No harás dioses de fundición para ti.
EXO.34.18	34	18	The feast of unleavened bread shalt thou keep. Seven days thou shalt eat unleavened bread, as I commanded thee, in the time of the month Abib: for in the month Abib thou camest out from Egypt.	0.0	neutral	La fiesta de los ázimos guardarás: siete días comerás por leudar, según te he mandado, en el tiempo del mes de Abib; porque en el mes de Abib saliste de Egipto.
EXO.34.19	34	19	All that openeth the matrix {is} mine; and every firstling among thy cattle, {whether} ox or sheep, {that is male}. {sheep: or, kid}	0.0	neutral	Todo lo que abre matriz, mío es; y de tu ganado todo primerizo de vaca ó de oveja que fuere macho.
EXO.34.20	34	20	But the firstling of an ass thou shalt redeem with a lamb: and if thou redeem {him} not, then shalt thou break his neck. All the firstborn of thy sons thou shalt redeem. And none shall appear before me empty. {lamb: or, kid}	-0.1	neutral	Empero redimirás con cordero el primerizo del asno; y si no lo redimieres, le has de cortar la cabeza. Redimirás todo primogénito de tus hijos, y no serán vistos vacíos delante de mí.
EXO.34.21	34	21	Six days thou shalt work, but on the seventh day thou shalt rest: in earing time and in harvest thou shalt rest.	0.0	neutral	Seis días trabajarás, mas en el séptimo día cesarás: cesarás aun en la arada y en la siega.
EXO.34.22	34	22	And thou shalt observe the feast of weeks, of the firstfruits of wheat harvest, and the feast of ingathering at the year's end. {year's end: Heb. revolution of the year}	0.0	neutral	Y te harás la fiesta de las semanas á los principios de la siega del trigo: y la fiesta de la cosecha á la vuelta del año.
EXO.34.23	34	23	Thrice in the year shall all your men children appear before the Lord GOD, the God of Israel.	0.0	neutral	Tres veces en el año será visto todo varón tuyo delante del Señoreador Jehová, Dios de Israel.
EXO.34.24	34	24	For I will cast out the nations before thee, and enlarge thy borders: neither shall any man desire thy land, when thou shalt go up to appear before the LORD thy God thrice in the year.	0.0	neutral	Porque yo arrojaré las gentes de tu presencia, y ensancharé tu término: y ninguno codiciará tu tierra, cuando tú subieres para ser visto delante de Jehová tu Dios tres veces en el año.
EXO.34.25	34	25	Thou shalt not offer the blood of my sacrifice with leaven; neither shall the sacrifice of the feast of the passover be left unto the morning.	0.0	neutral	No ofrecerás con leudo la sangre de mi sacrificio; ni quedará de la noche para la mañana el sacrificio de la fiesta de la pascua.
EXO.34.26	34	26	The first of the firstfruits of thy land thou shalt bring unto the house of the LORD thy God. Thou shalt not seethe a kid in his mother's milk.	0.25	positive	La primicia de los primeros frutos de tu tierra meterás en la casa de Jehová tu Dios. No cocerás el cabrito en la leche de su madre.
EXO.34.27	34	27	And the LORD said unto Moses, Write thou these words: for after the tenor of these words I have made a covenant with thee and with Israel.	0.0	neutral	Y Jehová dijo á Moisés: Escribe tú estas palabras; porque conforme á estas palabras he hecho la alianza contigo y con Israel.
EXO.34.28	34	28	And he was there with the LORD forty days and forty nights; he did neither eat bread, nor drink water. And he wrote upon the tables the words of the covenant, the ten commandments. {commandments: Heb. words}	0.0	neutral	Y él estuvo allí con Jehová cuarenta días y cuarenta noches: no comió pan, ni bebió agua; y escribió en tablas las palabras de la alianza, las diez palabras.
EXO.34.29	34	29	And it came to pass, when Moses came down from mount Sinai with the two tables of testimony in Moses' hand, when he came down from the mount, that Moses wist not that the skin of his face shone while he talked with him.	-0.1556	negative	Y aconteció, que descendiendo Moisés del monte Sinaí con las dos tablas del testimonio en su mano, mientras descendía del monte, no sabía él que la tez de su rostro resplandecía, después que hubo con El hablado.
EXO.34.30	34	30	And when Aaron and all the children of Israel saw Moses, behold, the skin of his face shone; and they were afraid to come nigh him.	-0.6	negative	Y miró Aarón y todos los hijos de Israel á Moisés, y he aquí la tez de su rostro era resplandeciente; y tuvieron miedo de llegarse á él.
EXO.34.31	34	31	And Moses called unto them; and Aaron and all the rulers of the congregation returned unto him: and Moses talked with them.	0.0	neutral	Y llamólos Moisés; y Aarón y todos los príncipes de la congregación volvieron á él, y Moisés les habló.
EXO.34.32	34	32	And afterward all the children of Israel came nigh: and he gave them in commandment all that the LORD had spoken with him in mount Sinai.	0.0	neutral	Y después se llegaron todos los hijos de Israel, á los cuales mandó todas las cosas que Jehová le había dicho en el monte de Sinaí.
EXO.34.33	34	33	And {till} Moses had done speaking with them, he put a vail on his face.	0.0	neutral	Y cuando hubo acabado Moisés de hablar con ellos, puso un velo sobre su rostro.
EXO.34.34	34	34	But when Moses went in before the LORD to speak with him, he took the vail off, until he came out. And he came out, and spake unto the children of Israel {that} which he was commanded.	0.0	neutral	Y cuando venía Moisés delante de Jehová para hablar con él, quitábase el velo hasta que salía; y saliendo, hablaba con los hijos de Israel lo que le era mandado;
EXO.34.35	34	35	And the children of Israel saw the face of Moses, that the skin of Moses' face shone: and Moses put the vail upon his face again, until he went in to speak with him.	0.0	neutral	Y veían los hijos de Israel el rostro de Moisés, que la tez de su rostro era resplandeciente; y volvía Moisés á poner el velo sobre su rostro, hasta que entraba á hablar con El.
EXO.35.1	35	1	And Moses gathered all the congregation of the children of Israel together, and said unto them, These {are} the words which the LORD hath commanded, that {ye} should do them.	0.0	neutral	Y MOISÉS hizo juntar toda la congregación de los hijos de Israel, y díjoles: Estas son las cosas que Jehová ha mandado que hagáis.
EXO.35.2	35	2	Six days shall work be done, but on the seventh day there shall be to you an holy day, a sabbath of rest to the LORD: whosoever doeth work therein shall be put to death. {an...: Heb. holiness}	0.0	neutral	Seis días se hará obra, mas el día séptimo os será santo, sábado de reposo á Jehová: cualquiera que en él hiciere obra, morirá.
EXO.35.3	35	3	Ye shall kindle no fire throughout your habitations upon the sabbath day.	0.0	neutral	No encenderéis fuego en todas vuestras moradas en el día del sábado.
EXO.35.4	35	4	And Moses spake unto all the congregation of the children of Israel, saying, This {is} the thing which the LORD commanded, saying,	0.0	neutral	Y habló Moisés á toda la congregación de los hijos de Israel, diciendo: Esto es lo que Jehová ha mandado, diciendo:
EXO.35.5	35	5	Take ye from among you an offering unto the LORD: whosoever {is} of a willing heart, let him bring it, an offering of the LORD; gold, and silver, and brass,	0.25	positive	Tomad de entre vosotros ofrenda para Jehová: todo liberal de corazón la traerá á Jehová: oro, plata, metal;
EXO.35.6	35	6	And blue, and purple, and scarlet, and fine linen, and goats' {hair},	0.2083	positive	Y cárdeno, y púrpura, y carmesí, y lino fino, y pelo de cabras;
EXO.35.7	35	7	And rams' skins dyed red, and badgers' skins, and shittim wood,	0.0	neutral	Y cueros rojos de carneros, y cueros de tejones, y madera de Sittim;
EXO.35.8	35	8	And oil for the light, and spices for anointing oil, and for the sweet incense,	0.375	positive	Y aceite para la luminaria, y especias aromáticas para el aceite de la unción, y para el perfume aromático;
EXO.35.9	35	9	And onyx stones, and stones to be set for the ephod, and for the breastplate.	0.0	neutral	Y piedras de onix, y demás pedrería, para el ephod, y para el racional.
EXO.35.10	35	10	And every wise hearted among you shall come, and make all that the LORD hath commanded;	0.7	positive	Y todo sabio de corazón de entre vosotros, vendrá y hará todas las cosas que Jehová ha mandado:
EXO.35.11	35	11	The tabernacle, his tent, and his covering, his taches, and his boards, his bars, his pillars, and his sockets,	0.0	neutral	El tabernáculo, su tienda, y su cubierta, y sus anillos, y sus tablas, sus barras, sus columnas, y sus basas;
EXO.35.12	35	12	The ark, and the staves thereof, {with} the mercy seat, and the vail of the covering,	0.0	neutral	El arca, y sus varas, la cubierta, y el velo de la tienda;
EXO.35.13	35	13	The table, and his staves, and all his vessels, and the shewbread,	0.0	neutral	La mesa, y sus varas, y todos sus vasos, y el pan de la proposición.
EXO.35.14	35	14	The candlestick also for the light, and his furniture, and his lamps, with the oil for the light,	0.4	positive	El candelero de la luminaria, y sus vasos, y sus candilejas, y el aceite para la luminaria;
EXO.35.15	35	15	And the incense altar, and his staves, and the anointing oil, and the sweet incense, and the hanging for the door at the entering in of the tabernacle,	0.35	positive	Y el altar del perfume, y sus varas, y el aceite de la unción, y el perfume aromático, y el pabellón de la puerta, para la entrada del tabernáculo;
EXO.35.16	35	16	The altar of burnt offering, with his brasen grate, his staves, and all his vessels, the laver and his foot,	0.0	neutral	El altar del holocausto, y su enrejado de metal, y sus varas, y todos sus vasos, y la fuente con su basa;
EXO.35.17	35	17	The hangings of the court, his pillars, and their sockets, and the hanging for the door of the court,	0.0	neutral	Las cortinas del atrio, sus columnas, y sus basas, y el pabellón de la puerta del atrio;
EXO.35.18	35	18	The pins of the tabernacle, and the pins of the court, and their cords,	0.0	neutral	Las estacas del tabernáculo, y las estacas del atrio, y sus cuerdas;
EXO.35.19	35	19	The cloths of service, to do service in the holy {place}, the holy garments for Aaron the priest, and the garments of his sons, to minister in the priest's office.	0.0	neutral	Las vestiduras del servicio para ministrar en el santuario, las sagradas vestiduras de Aarón el sacerdote, y las vestiduras de sus hijos para servir en el sacerdocio.
EXO.35.20	35	20	And all the congregation of the children of Israel departed from the presence of Moses.	0.0	neutral	Y salió toda la congregación de los hijos de Israel de delante de Moisés.
EXO.35.21	35	21	And they came, every one whose heart stirred him up, and every one whom his spirit made willing, {and} they brought the LORD'S offering to the work of the tabernacle of the congregation, and for all his service, and for the holy garments.	0.25	positive	Y vino todo varón á quien su corazón estimuló, y todo aquel á quien su espíritu le dió voluntad, y trajeron ofrenda á Jehová para la obra del tabernáculo del testimonio, y para toda su fábrica, y para las sagradas vestiduras.
EXO.35.22	35	22	And they came, both men and women, as many as were willing hearted, {and} brought bracelets, and earrings, and rings, and tablets, all jewels of gold: and every man that offered {offered} an offering of gold unto the LORD.	0.375	positive	Y vinieron así hombres como mujeres, todo voluntario de corazón, y trajeron cadenas y zarcillos, sortijas y brazaletes, y toda joya de oro; y cualquiera ofrecía ofrenda de oro á Jehová.
EXO.35.23	35	23	And every man, with whom was found blue, and purple, and scarlet, and fine linen, and goats' {hair}, and red skins of rams, and badgers' skins, brought {them}.	0.1389	positive	Todo hombre que se hallaba con jacinto, ó púrpura, ó carmesí, ó lino fino, ó pelo de cabras, ó cueros rojos de carneros, ó cueros de tejones, lo traía.
EXO.35.24	35	24	Every one that did offer an offering of silver and brass brought the LORD'S offering: and every man, with whom was found shittim wood for any work of the service, brought {it}.	0.0	neutral	Cualquiera que ofrecía ofrenda de plata ó de metal, traía á Jehová la ofrenda: y todo el que se hallaba con madera de Sittim, traíala para toda la obra del servicio.
EXO.35.25	35	25	And all the women that were wise hearted did spin with their hands, and brought that which they had spun, {both} of blue, and of purple, {and} of scarlet, and of fine linen.	0.3722	positive	Además todas las mujeres sabias de corazón hilaban de sus manos, y traían lo que habían hilado: cárdeno, ó púrpura, ó carmesí, ó lino fino.
EXO.35.26	35	26	And all the women whose heart stirred them up in wisdom spun goats' {hair}.	0.0	neutral	Y todas las mujeres cuyo corazón las levantó en sabiduría, hilaron pelos de cabras.
EXO.35.27	35	27	And the rulers brought onyx stones, and stones to be set, for the ephod, and for the breastplate;	0.0	neutral	Y los príncipes trajeron piedras de onix, y las piedras de los engastes para el ephod y el racional;
EXO.35.28	35	28	And spice, and oil for the light, and for the anointing oil, and for the sweet incense.	0.375	positive	Y la especia aromática y aceite, para la luminaria, y para el aceite de la unción, y para el perfume aromático.
EXO.35.29	35	29	The children of Israel brought a willing offering unto the LORD, every man and woman, whose heart made them willing to bring for all manner of work, which the LORD had commanded to be made by the hand of Moses.	0.25	positive	De los hijos de Israel, así hombres como mujeres, todos los que tuvieron corazón voluntario para traer para toda la obra, que Jehová había mandado por medio de Moisés que hiciesen, trajeron ofrenda voluntaria á Jehová.
EXO.35.30	35	30	And Moses said unto the children of Israel, See, the LORD hath called by name Bezaleel the son of Uri, the son of Hur, of the tribe of Judah;	0.0	neutral	Y dijo Moisés á los hijos de Israel: Mirad, Jehová ha nombrado á Bezaleel hijo de Uri, hijo de Hur, de la tribu de Judá;
EXO.35.31	35	31	And he hath filled him with the spirit of God, in wisdom, in understanding, and in knowledge, and in all manner of workmanship;	0.4	positive	Y lo ha henchido de espíritu de Dios, en sabiduría, en inteligencia, y en ciencia, y en todo artificio,
EXO.35.32	35	32	And to devise curious works, to work in gold, and in silver, and in brass,	-0.1	neutral	Para proyectar inventos, para trabajar en oro, y en plata, y en metal,
EXO.35.33	35	33	And in the cutting of stones, to set {them}, and in carving of wood, to make any manner of cunning work.	-0.3	negative	Y en obra de pedrería para engastar, y en obra de madera, para trabajar en toda invención ingeniosa.
EXO.35.34	35	34	And he hath put in his heart that he may teach, {both} he, and Aholiab, the son of Ahisamach, of the tribe of Dan.	0.0	neutral	Y ha puesto en su corazón el que pueda enseñar, así él como Aholiab hijo de Ahisamac, de la tribu de Dan:
EXO.35.35	35	35	Them hath he filled with wisdom of heart, to work all manner of work, of the engraver, and of the cunning workman, and of the embroiderer, in blue, and in purple, in scarlet, and in fine linen, and of the weaver, {even} of them that do any work, and of those that devise cunning work.	0.1633	positive	Y los ha henchido de sabiduría de corazón, para que hagan toda obra de artificio, y de invención, y de recamado en jacinto, y en púrpura, y en carmesí, y en lino fino, y en telar; para que hagan toda labor, é inventen todo diseño.
EXO.36.1	36	1	Then wrought Bezaleel and Aholiab, and every wise hearted man, in whom the LORD put wisdom and understanding to know how to work all manner of work for the service of the sanctuary, according to all that the LORD had commanded.	0.7	positive	HIZO, pues, Bezaleel y Aholiab, y todo hombre sabio de corazón, á quien Jehová dió sabiduría é inteligencia para que supiesen hacer toda la obra del servicio del santuario, todas las cosas que había mandado Jehová.
EXO.36.2	36	2	And Moses called Bezaleel and Aholiab, and every wise hearted man, in whose heart the LORD had put wisdom, {even} every one whose heart stirred him up to come unto the work to do it:	0.7	positive	Y Moisés llamó á Bezaleel y á Aholiab, y á todo varón sabio de corazón, en cuyo corazón había dado Jehová sabiduría, y á todo hombre á quien su corazón le movió á llegarse á la obra, para trabajar en ella;
EXO.36.3	36	3	And they received of Moses all the offering, which the children of Israel had brought for the work of the service of the sanctuary, to make it {withal}. And they brought yet unto him free offerings every morning.	0.4	positive	Y tomaron de delante de Moisés toda la ofrenda que los hijos de Israel habían traído para la obra del servicio del santuario, á fin de hacerla. Y ellos le traían aún ofrenda voluntaria cada mañana.
EXO.36.4	36	4	And all the wise men, that wrought all the work of the sanctuary, came every man from his work which they made;	0.7	positive	Vinieron, por tanto, todos los maestros que hacían toda la obra del santuario, cada uno de la obra que hacía.
EXO.36.5	36	5	And they spake unto Moses, saying, The people bring much more than enough for the service of the work, which the LORD commanded to make.	0.25	positive	Y hablaron á Moisés, diciendo: El pueblo trae mucho más de lo que es menester para la atención de hacer la obra que Jehová ha mandado que se haga.
EXO.36.6	36	6	And Moses gave commandment, and they caused it to be proclaimed throughout the camp, saying, Let neither man nor woman make any more work for the offering of the sanctuary. So the people were restrained from bringing.	0.5	positive	Entonces Moisés mandó pregonar por el campo, diciendo: Ningún hombre ni mujer haga más obra para ofrecer para el santuario. Y así fue el pueblo impedido de ofrecer;
EXO.36.7	36	7	For the stuff they had was sufficient for all the work to make it, and too much.	0.2	positive	Pues tenia material abundante para hacer toda la obra, y sobraba.
EXO.36.8	36	8	And every wise hearted man among them that wrought the work of the tabernacle made ten curtains {of} fine twined linen, and blue, and purple, and scarlet: {with} cherubims of cunning work made he them.	0.0611	neutral	Y todos los sabios de corazón entre los que hacían la obra, hicieron el tabernáculo de diez cortinas, de lino torcido, y de jacinto, y de púrpura y carmesí; las cuales hicieron de obra prima, con querubines.
EXO.36.9	36	9	The length of one curtain {was} twenty and eight cubits, and the breadth of one curtain four cubits: the curtains {were} all of one size.	0.0	neutral	La longitud de la una cortina era de veintiocho codos, y la anchura de cuatro codos: todas las cortinas tenían una misma medida.
EXO.36.10	36	10	And he coupled the five curtains one unto another: and {the other} five curtains he coupled one unto another.	-0.125	negative	Y juntó las cinco cortinas la una con la otra: asimismo unió las otras cinco cortinas la una con la otra.
EXO.36.11	36	11	And he made loops of blue on the edge of one curtain from the selvedge in the coupling: likewise he made in the uttermost side of {another} curtain, in the coupling of the second. {selvedge: an edge of cloth so woven that it cannot unravel}	0.0	neutral	E hizo las lazadas de color de jacinto en la orilla de la una cortina, en el borde, á la juntura; y así hizo en la orilla al borde de la segunda cortina, en la juntura.
EXO.36.12	36	12	Fifty loops made he in one curtain, and fifty loops made he in the edge of the curtain which {was} in the coupling of the second: the loops held one {curtain} to another.	0.0	neutral	Cincuenta lazadas hizo en la una cortina, y otras cincuenta en la segunda cortina, en el borde, en la juntura; las unas lazadas enfrente de las otras.
EXO.36.13	36	13	And he made fifty taches of gold, and coupled the curtains one unto another with the taches: so it became one tabernacle.	0.0	neutral	Hizo también cincuenta corchetes de oro, con los cuales juntó las cortinas, la una con la otra; é hízose un tabernáculo.
EXO.36.14	36	14	And he made curtains {of} goats' {hair} for the tent over the tabernacle: eleven curtains he made them.	0.0	neutral	Hizo asimismo cortinas de pelo de cabras para la tienda sobre el tabernáculo, é hízolas en número de once.
EXO.36.15	36	15	The length of one curtain {was} thirty cubits, and four cubits {was} the breadth of one curtain: the eleven curtains {were} of one size.	0.0	neutral	La longitud de la una cortina era de treinta codos, y la anchura de cuatro codos: las once cortinas tenían una misma medida.
EXO.36.16	36	16	And he coupled five curtains by themselves, and six curtains by themselves.	0.0	neutral	Y juntó las cinco cortinas de por sí, y las seis cortinas aparte.
EXO.36.17	36	17	And he made fifty loops upon the uttermost edge of the curtain in the coupling, and fifty loops made he upon the edge of the curtain which coupleth the second.	0.0	neutral	Hizo además cincuenta lazadas en la orilla de la postrera cortina en la juntura, y otras cincuenta lazadas en la orilla de la otra cortina en la juntura.
EXO.36.18	36	18	And he made fifty taches {of} brass to couple the tent together, that it might be one.	0.0	neutral	Hizo también cincuenta corchetes de metal para juntar la tienda, de modo que fuese una.
EXO.36.19	36	19	And he made a covering for the tent {of} rams' skins dyed red, and a covering {of} badgers' skins above {that}.	0.0	neutral	E hizo una cubierta para la tienda de cueros rojos de carneros, y una cubierta encima de cueros de tejones.
EXO.36.20	36	20	And he made boards for the tabernacle {of} shittim wood, standing up.	0.0	neutral	Además hizo las tablas para el tabernáculo de madera de Sittim, para estar derechas.
EXO.36.21	36	21	The length of a board {was} ten cubits, and the breadth of a board one cubit and a half.	-0.0833	neutral	La longitud de cada tabla de diez codos, y de codo y medio la anchura.
EXO.36.22	36	22	One board had two tenons, equally distant one from another: thus did he make for all the boards of the tabernacle.	-0.1	neutral	Cada tabla tenía dos quicios enclavijados el uno delante del otro: así hizo todas las tablas del tabernáculo.
EXO.36.23	36	23	And he made boards for the tabernacle; twenty boards for the south side southward:	0.0	neutral	Hizo, pues, las tablas para el tabernáculo: veinte tablas al lado del austro, al mediodía.
EXO.36.24	36	24	And forty sockets of silver he made under the twenty boards; two sockets under one board for his two tenons, and two sockets under another board for his two tenons.	0.0	neutral	Hizo también las cuarenta basas de plata debajo de las veinte tablas: dos basas debajo de la una tabla para sus dos quicios, y dos basas debajo de la otra tabla para sus dos quicios.
EXO.36.25	36	25	And for the other side of the tabernacle, {which is} toward the north corner, he made twenty boards,	-0.125	negative	Y para el otro lado del tabernáculo, á la parte del aquilón, hizo veinte tablas,
EXO.36.26	36	26	And their forty sockets of silver; two sockets under one board, and two sockets under another board.	0.0	neutral	Con sus cuarenta basas de plata: dos basas debajo de la una tabla, y dos basas debajo de la otra tabla.
EXO.36.27	36	27	And for the sides of the tabernacle westward he made six boards.	0.0	neutral	Y para el lado occidental del tabernáculo hizo seis tablas.
EXO.36.28	36	28	And two boards made he for the corners of the tabernacle in the two sides.	0.0	neutral	Para las esquinas del tabernáculo en los dos lados hizo dos tablas,
EXO.36.29	36	29	And they were coupled beneath, and coupled together at the head thereof, to one ring: thus he did to both of them in both the corners. {coupled: Heb. twinned}	0.0	neutral	Las cuales se juntaban por abajo, y asimismo por arriba á un gozne: y así hizo á la una y á la otra en las dos esquinas.
EXO.36.30	36	30	And there were eight boards; and their sockets {were} sixteen sockets of silver, under every board two sockets. {under...: Heb. two sockets, two sockets under one board}	0.0	neutral	Eran, pues, ocho tablas, y sus basas de plata dieciséis; dos basas debajo de cada tabla.
