verse_id	chapter	verse	text_en	polarity_en	label_en	text_es
2CO.10.11	10	11	Let such an one think this, that, such as we are in word by letters when we are absent, such {will we be} also in deed when we are present.	0.0	neutral	Esto piense el tal, que cuales somos en la palabra por cartas estando ausentes, tales seremos también en hechos, estando presentes.
2CO.10.12	10	12	For we dare not make ourselves of the number, or compare ourselves with some that commend themselves: but they measuring themselves by themselves, and comparing themselves among themselves, are not wise. {are...: or, understand it not}	-0.35	negative	Porque no osamos entremeternos ó compararnos con algunos que se alaban á sí mismos: mas ellos, midiéndose á sí mismos por sí mismos, y comparándose consigo mismos no son juiciosos.
2CO.10.13	10	13	But we will not boast of things without {our} measure, but according to the measure of the rule which God hath distributed to us, a measure to reach even unto you. {rule: or, line}	0.0	neutral	Nosotros empero, no nos gloriaremos fuera de nuestra medida, sino conforme á la medida de la regla, de la medida que Dios nos repartió, para llegar aun hasta vosotros.
2CO.10.14	10	14	For we stretch not ourselves beyond {our measure}, as though we reached not unto you: for we are come as far as to you also in {preaching} the gospel of Christ:	0.1	neutral	Porque no nos extendemos sobre nuestra medida, como si no llegásemos hasta vosotros: porque también hasta vosotros hemos llegado en el evangelio de Cristo:
2CO.10.15	10	15	Not boasting of things without {our} measure, {that is}, of other men's labours; but having hope, when your faith is increased, that we shall be enlarged by you according to our rule abundantly, {enlarged...: or, magnified in you}	0.2375	positive	No gloriándonos fuera de nuestra medida en trabajos ajenos; mas teniendo esperanza del crecimiento de vuestra fe, que seremos muy engrandecidos entre vosotros, conforme á nuestra regla.
2CO.10.16	10	16	To preach the gospel in the {regions} beyond you, {and} not to boast in another man's line of things made ready to our hand. {line: or, rule}	0.2	positive	Y que anunciaremos el evangelio en los lugares más allá de vosotros, sin entrar en la medida de otro para gloriarnos en lo que ya estaba aparejado.
2CO.10.17	10	17	But he that glorieth, let him glory in the Lord.	0.0	neutral	Mas el que se gloría, gloríese en el Señor.
2CO.10.18	10	18	For not he that commendeth himself is approved, but whom the Lord commendeth.	0.0	neutral	Porque no el que se alaba á sí mismo, el tal es aprobado; mas aquel á quien Dios alaba.
2CO.11.1	11	1	Would to God ye could bear with me a little in {my} folly: and indeed bear with me. {indeed bear...: or, indeed ye do bear with me}	-0.1875	negative	OJALA toleraseis un poco mi locura; empero toleradme.
2CO.11.2	11	2	For I am jealous over you with godly jealousy: for I have espoused you to one husband, that I may present {you as} a chaste virgin to Christ.	0.0	neutral	Pues que os celo con celo de Dios; porque os he desposado á un marido, para presentaros como una virgen pura á Cristo.
2CO.11.3	11	3	But I fear, lest by any means, as the serpent beguiled Eve through his subtilty, so your minds should be corrupted from the simplicity that is in Christ.	0.0	neutral	Mas temo que como la serpiente engaño á Eva con su astucia, sean corrompidos así vuestros sentidos en alguna manera, de la simplicidad que es en Cristo.
2CO.11.4	11	4	For if he that cometh preacheth another Jesus, whom we have not preached, or {if} ye receive another spirit, which ye have not received, or another gospel, which ye have not accepted, ye might well bear with {him}. {with him: or, with me}	0.0	neutral	Porque si el que viene, predicare otro Jesús que el que hemos predicado, ó recibiereis otro espíritu del que habéis recibido, ú otro evangelio del que habéis aceptado, lo sufrierais bien.
2CO.11.5	11	5	For I suppose I was not a whit behind the very chiefest apostles.	-0.1	neutral	Cierto pienso que en nada he sido inferior á aquellos grandes apóstoles.
2CO.11.6	11	6	But though {I be} rude in speech, yet not in knowledge; but we have been throughly made manifest among you in all things.	-0.3	negative	Porque aunque soy basto en la palabra, empero no en la ciencia: mas en todo somos ya del todo manifiestos á vosotros.
2CO.11.7	11	7	Have I committed an offence in abasing myself that ye might be exalted, because I have preached to you the gospel of God freely?	0.4	positive	¿Pequé yo humillándome á mí mismo, para que vosotros fueseis ensalzados, porque os he predicado el evangelio de Dios de balde?
2CO.11.8	11	8	I robbed other churches, taking wages {of them}, to do you service.	-0.125	negative	He despojado las otras iglesias, recibiendo salario para ministraros á vosotros.
2CO.11.9	11	9	And when I was present with you, and wanted, I was chargeable to no man: for that which was lacking to me the brethren which came from Macedonia supplied: and in all {things} I have kept myself from being burdensome unto you, and {so} will I keep {myself}.	0.0	neutral	Y estando con vosotros y teniendo necesidad, á ninguno fuí carga; porque lo que me faltaba, suplieron los hermanos que vinieron de Macedonia: y en todo me guardé de seros gravoso, y me guardaré.
2CO.11.10	11	10	As the truth of Christ is in me, no man shall stop me of this boasting in the regions of Achaia. {no man...: Gr. this boasting shall not be stopped in me}	0.0	neutral	Es la verdad de Cristo en mí, que esta gloria no me será cerrada en las partes de Acaya.
2CO.11.11	11	11	Wherefore? because I love you not? God knoweth.	0.5	positive	¿Por qué? ¿porque no os amo? Dios lo sabe.
2CO.11.12	11	12	But what I do, that I will do, that I may cut off occasion from them which desire occasion; that wherein they glory, they may be found even as we.	0.0	neutral	Mas lo que hago, haré aún, para cortar la ocasión de aquellos que la desean, á fin de que en aquello que se glorían, sean hallados semejantes á nosotros.
2CO.11.13	11	13	For such {are} false apostles, deceitful workers, transforming themselves into the apostles of Christ.	-0.2	negative	Porque éstos son falsos apóstoles, obreros fraudulentos, trasfigurándose en apóstoles de Cristo.
2CO.11.14	11	14	And no marvel; for Satan himself is transformed into an angel of light.	0.4	positive	Y no es maravilla, porque el mismo Satanás se transfigura en ángel de luz.
2CO.11.15	11	15	Therefore {it is} no great thing if his ministers also be transformed as the ministers of righteousness; whose end shall be according to their works.	-0.4	negative	Así que, no es mucho si también sus ministros se transfiguran como ministros de justicia; cuyo fin será conforme á sus obras.
2CO.11.16	11	16	I say again, Let no man think me a fool; if otherwise, yet as a fool receive me, that I may boast myself a little. {receive: or, suffer}	-0.1875	negative	Otra vez digo: Que nadie me estime ser loco; de otra manera, recibidme como á loco, para que aun me gloríe yo un poquito.
2CO.11.17	11	17	That which I speak, I speak {it} not after the Lord, but as it were foolishly, in this confidence of boasting.	0.0	neutral	Lo que hablo, no lo hablo según el Señor, sino como en locura, con esta confianza de gloria.
2CO.11.18	11	18	Seeing that many glory after the flesh, I will glory also.	0.5	positive	Pues que muchos se glorían según la carne, también yo me gloriaré.
2CO.11.19	11	19	For ye suffer fools gladly, seeing ye {yourselves} are wise.	0.6	positive	Porque de buena gana toleráis los necios, siendo vosotros sabios:
2CO.11.20	11	20	For ye suffer, if a man bring you into bondage, if a man devour {you}, if a man take {of you}, if a man exalt himself, if a man smite you on the face.	0.0	neutral	Porque toleráis si alguno os pone en servidumbre, si alguno os devora, si alguno toma, si alguno se ensalza, si alguno os hiere en la cara.
2CO.11.21	11	21	I speak as concerning reproach, as though we had been weak. Howbeit whereinsoever any is bold, (I speak foolishly,) I am bold also.	0.0972	neutral	Dígolo cuanto á la afrenta, como si nosotros hubiésemos sido flacos. Empero en lo que otro tuviere osadía (hablo con locura), también yo tengo osadía.
2CO.11.22	11	22	Are they Hebrews? so {am} I. Are they Israelites? so {am} I. Are they the seed of Abraham? so {am} I.	0.0	neutral	¿Son Hebreos? yo también. ¿Son Israelitas? yo también. ¿Son simiente de Abraham? también yo.
2CO.11.23	11	23	Are they ministers of Christ? (I speak as a fool) I {am} more; in labours more abundant, in stripes above measure, in prisons more frequent, in deaths oft.	0.3667	positive	¿Son ministros de Cristo? (como poco sabio hablo) yo más: en trabajos más abundante; en azotes sin medida; en cárceles más; en muertes, muchas veces.
2CO.11.24	11	24	Of the Jews five times received I forty {stripes} save one.	0.0	neutral	De los judíos cinco veces he recibido cuarenta azotes menos uno.
2CO.11.25	11	25	Thrice was I beaten with rods, once was I stoned, thrice I suffered shipwreck, a night and a day I have been in the deep;	0.0	neutral	Tres veces he sido azotado con varas; una vez apedreado; tres veces he padecido naufragio; una noche y un día he estado en lo profundo de la mar;
2CO.11.26	11	26	{In} journeyings often, {in} perils of waters, {in} perils of robbers, {in} perils by {mine own} countrymen, {in} perils by the heathen, {in} perils in the city, {in} perils in the wilderness, {in} perils in the sea, {in} perils among false brethren;	0.1	neutral	En caminos muchas veces, peligros de ríos, peligros de ladrones, peligros de los de mi nación, peligros de los Gentiles, peligros en la ciudad, peligros en el desierto, peligros en la mar, peligros entre falsos hermanos;
2CO.11.27	11	27	In weariness and painfulness, in watchings often, in hunger and thirst, in fastings often, in cold and nakedness.	-0.6	negative	En trabajo y fatiga, en muchas vigilias, en hambre y sed, en muchos ayunos, en frío y en desnudez;
2CO.11.28	11	28	Beside those things that are without, that which cometh upon me daily, the care of all the churches.	0.0	neutral	Sin otras cosas además, lo que sobre mí se agolpa cada día, la solicitud de todas las iglesias.
2CO.11.29	11	29	Who is weak, and I am not weak? who is offended, and I burn not?	-0.0938	neutral	¿Quién enferma, y yo no enfermo? ¿Quién se escandaliza, y yo no me quemo?
2CO.11.30	11	30	If I must needs glory, I will glory of the things which concern mine infirmities.	0.0	neutral	Si es menester gloriarse, me gloriaré yo de lo que es de mi flaqueza.
2CO.11.31	11	31	The God and Father of our Lord Jesus Christ, which is blessed for evermore, knoweth that I lie not.	0.0	neutral	El Dios y Padre del Señor nuestro Jesucristo, que es bendito por siglos, sabe que no miento.
2CO.11.32	11	32	In Damascus the governor under Aretas the king kept the city of the Damascenes with a garrison, desirous to apprehend me:	0.0	neutral	En Damasco, el gobernador de la provincia del rey Aretas guardaba la ciudad de los Damascenos para prenderme;
2CO.11.33	11	33	And through a window in a basket was I let down by the wall, and escaped his hands.	-0.1556	negative	Y fuí descolgado del muro en un serón por una ventana, y escapé de sus manos.
2CO.12.1	12	1	It is not expedient for me doubtless to glory. I will come to visions and revelations of the Lord. {I will come: Gr. For I will come}	0.0	neutral	CIERTO no me es conveniente gloriarme; mas vendré á las visiones y á las revelaciones del Señor.
2CO.12.2	12	2	I knew a man in Christ above fourteen years ago, (whether in the body, I cannot tell; or whether out of the body, I cannot tell: God knoweth;) such an one caught up to the third heaven.	0.0625	neutral	Conozco á un hombre en Cristo, que hace catorce años (si en el cuerpo, no lo sé; si fuera del cuerpo, no lo sé: Dios lo sabe) fué arrebatado hasta el tercer cielo.
2CO.12.3	12	3	And I knew such a man, (whether in the body, or out of the body, I cannot tell: God knoweth;)	0.125	positive	Y conozco tal hombre, (si en el cuerpo, ó fuera del cuerpo, no lo sé: Dios lo sabe,)
2CO.12.4	12	4	How that he was caught up into paradise, and heard unspeakable words, which it is not lawful for a man to utter. {lawful: or, possible}	0.0	neutral	Que fué arrebatado al paraíso, donde oyó palabras secretas que el hombre no puede decir.
2CO.12.5	12	5	Of such an one will I glory: yet of myself I will not glory, but in mine infirmities.	0.0	neutral	De este tal me gloriaré, mas de mí mismo nada me gloriaré, sino en mis flaquezas.
2CO.12.6	12	6	For though I would desire to glory, I shall not be a fool; for I will say the truth: but {now} I forbear, lest any man should think of me above that which he seeth me {to be}, or {that} he heareth of me.	0.0	neutral	Por lo cual si quisiere gloriarme, no seré insensato: porque diré verdad: empero lo dejo, porque nadie piense de mí más de lo que en mí ve, ú oye de mí.
2CO.12.7	12	7	And lest I should be exalted above measure through the abundance of the revelations, there was given to me a thorn in the flesh, the messenger of Satan to buffet me, lest I should be exalted above measure.	0.0	neutral	Y porque la grandeza de las revelaciones no me levante descomedidamente, me es dado un aguijón en mi carne, un mensajero de Satanás que me abofetee, para que no me enaltezca sobremanera.
2CO.12.8	12	8	For this thing I besought the Lord thrice, that it might depart from me.	0.0	neutral	Por lo cual tres veces he rogado al Señor, que se quite de mí.
2CO.12.9	12	9	And he said unto me, My grace is sufficient for thee: for my strength is made perfect in weakness. Most gladly therefore will I rather glory in my infirmities, that the power of Christ may rest upon me.	0.6667	positive	Y me ha dicho: Bástate mi gracia; porque mi potencia en la flaqueza se perfecciona. Por tanto, de buena gana me gloriaré más bien en mis flaquezas, porque habite en mí la potencia de Cristo.
2CO.12.10	12	10	Therefore I take pleasure in infirmities, in reproaches, in necessities, in persecutions, in distresses for Christ's sake: for when I am weak, then am I strong.	0.0292	neutral	Por lo cual me gozo en las flaquezas, en afrentas, en necesidades, en persecuciones, en angustias por Cristo; porque cuando soy flaco, entonces soy poderoso.
2CO.12.11	12	11	I am become a fool in glorying; ye have compelled me: for I ought to have been commended of you: for in nothing am I behind the very chiefest apostles, though I be nothing.	-0.1	neutral	Heme hecho un necio en gloriarme: vosotros me constreñisteis; pues yo había de ser alabado de vosotros: porque en nada he sido menos que los sumos apóstoles, aunque soy nada.
2CO.12.12	12	12	Truly the signs of an apostle were wrought among you in all patience, in signs, and wonders, and mighty deeds.	0.4	positive	Con todo esto, las señales de apóstol han sido hechas entre vosotros en toda paciencia, en señales, y en prodigios, y en maravillas.
2CO.12.13	12	13	For what is it wherein ye were inferior to other churches, except {it be} that I myself was not burdensome to you? forgive me this wrong.	-0.3125	negative	Porque ¿qué hay en que habéis sido menos que las otras iglesias, sino en que yo mismo no os he sido carga? Perdonadme esta injuria.
2CO.12.14	12	14	Behold, the third time I am ready to come to you; and I will not be burdensome to you: for I seek not yours, but you: for the children ought not to lay up for the parents, but the parents for the children.	0.1	neutral	He aquí estoy aparejado para ir á vosotros la tercera vez, y no os seré gravoso; porque no busco vuestras cosas, sino á vosotros: porque no han de atesorar los hijos para los padres sino los padres para los hijos.
2CO.12.15	12	15	And I will very gladly spend and be spent for you; though the more abundantly I love you, the less I be loved. {for you: Gr. for your souls}	0.3472	positive	Empero yo de muy buena gana despenderé y seré despendido por vuestras almas, aunque amándoos más, sea amado menos.
2CO.12.16	12	16	But be it so, I did not burden you: nevertheless, being crafty, I caught you with guile.	0.4	positive	Mas sea así, yo no os he agravado: sino que, como soy astuto, os he tomado por engaño.
2CO.12.17	12	17	Did I make a gain of you by any of them whom I sent unto you?	0.0	neutral	¿Acaso os he engañado por alguno de los que he enviado á vosotros?
2CO.12.18	12	18	I desired Titus, and with {him} I sent a brother. Did Titus make a gain of you? walked we not in the same spirit? {walked we} not in the same steps?	0.0	neutral	Rogué á Tito, y envié con él al hermano. ¿Os engañó quizá Tito? ¿no hemos procedido con el mismo espíritu y por las mismas pisadas?
2CO.12.19	12	19	Again, think ye that we excuse ourselves unto you? we speak before God in Christ: but {we do} all things, dearly beloved, for your edifying.	0.325	positive	¿Pensáis aún que nos excusamos con vosotros? Delante de Dios en Cristo hablamos: mas todo, muy amados, por vuestra edificación.
2CO.12.20	12	20	For I fear, lest, when I come, I shall not find you such as I would, and {that} I shall be found unto you such as ye would not: lest {there be} debates, envyings, wraths, strifes, backbitings, whisperings, swellings, tumults:	0.0	neutral	Porque temo que cuando llegare, no os halle tales como quiero, y yo sea hallado de vosotros cual no queréis; que haya entre vosotros contiendas, envidias, iras, disensiones, detracciones, murmuaciones, elaciones, bandos:
2CO.12.21	12	21	{And} lest, when I come again, my God will humble me among you, and {that} I shall bewail many which have sinned already, and have not repented of the uncleanness and fornication and lasciviousness which they have committed.	0.15	positive	Que cuando volviere, me humille Dios entre vosotros, y haya de llorar por muchos de los que antes habrán pecado, y no se han arrepentido de la inmundicia y fornicación y deshonestidad que han cometido.
2CO.13.1	13	1	This {is} the third {time} I am coming to you. In the mouth of two or three witnesses shall every word be established.	0.0	neutral	ESTA tercera vez voy á vosotros. En la boca de dos ó de tres testigos consistirá todo negocio.
2CO.13.2	13	2	I told you before, and foretell you, as if I were present, the second time; and being absent now I write to them which heretofore have sinned, and to all other, that, if I come again, I will not spare:	-0.0417	neutral	He dicho antes, y ahora digo otra vez como presente, y ahora ausente lo escribo á los que antes pecaron, y á todos los demás, que si voy otra vez, no perdonaré;
2CO.13.3	13	3	Since ye seek a proof of Christ speaking in me, which to you-ward is not weak, but is mighty in you.	0.2938	positive	Pues buscáis una prueba de Cristo que habla en mí, el cual no es flaco para con vosotros, antes es poderoso en vosotros.
2CO.13.4	13	4	For though he was crucified through weakness, yet he liveth by the power of God. For we also are weak in him, but we shall live with him by the power of God toward you. {in him: or, with him}	-0.1193	negative	Porque aunque fué crucificado por flaqueza, empero vive por potencia de Dios. Pues también nosotros somos flacos con él, mas viviremos con él por la potencia de Dios para con vosotros.
2CO.13.5	13	5	Examine yourselves, whether ye be in the faith; prove your own selves. Know ye not your own selves, how that Jesus Christ is in you, except ye be reprobates?	0.6	positive	Examinaos á vosotros mismos si estáis en fe; probaos á vosotros mismos. ¿No os conocéis á vosotros mismos, que Jesucristo está en vosotros? si ya no sois reprobados.
2CO.13.6	13	6	But I trust that ye shall know that we are not reprobates.	0.0	neutral	Mas espero que conoceréis que nosotros no somos reprobados.
2CO.13.7	13	7	Now I pray to God that ye do no evil; not that we should appear approved, but that ye should do that which is honest, though we be as reprobates.	0.55	positive	Y oramos á Dios que ninguna cosa mala hagáis; no para que nosotros seamos hallados aprobados, mas para que vosotros hagáis lo que es bueno, aunque nosotros seamos como reprobados.
2CO.13.8	13	8	For we can do nothing against the truth, but for the truth.	0.0	neutral	Porque ninguna cosas podemos contra la verdad, sino por la verdad.
2CO.13.9	13	9	For we are glad, when we are weak, and ye are strong: and this also we wish, {even} your perfection. {perfection: or, reformation, or, restoration}	0.1861	positive	Por lo cual nos gozamos que seamos nosotros flacos, y que vosotros estéis fuertes; y aun deseamos vuestra perfección.
2CO.13.10	13	10	Therefore I write these things being absent, lest being present I should use sharpness, according to the power which the Lord hath given me to edification, and not to destruction.	0.0	neutral	Por tanto os escribo esto ausente, por no tratar presente con dureza, conforme á la potestad que el Señor me ha dado para edificación, y no para destrucción.
2CO.13.11	13	11	Finally, brethren, farewell. Be perfect, be of good comfort, be of one mind, live in peace; and the God of love and peace shall be with you.	0.4673	positive	Resta, hermanos, que tengáis gozo, seáis perfectos, tengáis consolación, sintáis una misma cosa, tengáis paz; y el Dios de paz y de caridad será con vosotros.
2CO.13.12	13	12	Greet one another with an holy kiss.	0.0	neutral	Saludaos los unos á los otros con ósculo santo.
2CO.13.13	13	13	All the saints salute you.	0.0	neutral	(13-12) Todos los santos os saludan.
2CO.13.14	13	14	The grace of the Lord Jesus Christ, and the love of God, and the communion of the Holy Ghost, {be} with you all. Amen. «{The second epistle} to the Corinthians was written from Philippi, {a city} of Macedonia, by Titus and Lucas.»	0.25	positive	(13-13) La gracia del Señor Jesucristo, y el amor de Dios, y la participación del Espíritu Santo sea con vosotros todos. Amén. Epístola á los Corintios fué enviada de Filipos de Macedonia con Tito y Lucas.
