verse_id	chapter	verse	text_en	polarity_en	label_en	text_es
2CO.1.1	1	1	Paul, an apostle of Jesus Christ by the will of God, and Timothy {our} brother, unto the church of God which is at Corinth, with all the saints which are in all Achaia:	0.0	neutral	PABLO, apóstol de Jesucristo por la voluntad de Dios, y Timoteo el hermano, á la iglesia de Dios que está en Corinto, juntamente con todos los santos que están por toda la Acaya:
2CO.1.2	1	2	Grace {be} to you and peace from God our Father, and {from} the Lord Jesus Christ.	0.0	neutral	Gracia y paz á vosotros de Dios nuestro Padre, y del Señor Jesucristo.
2CO.1.3	1	3	Blessed {be} God, even the Father of our Lord Jesus Christ, the Father of mercies, and the God of all comfort;	0.0	neutral	Bendito sea el Dios y Padre del Señor Jesucristo, el Padre de misericordias, y el Dios de toda consolación,
2CO.1.4	1	4	Who comforteth us in all our tribulation, that we may be able to comfort them which are in any trouble, by the comfort wherewith we ourselves are comforted of God.	0.15	positive	El cual nos consuela en todas nuestras tribulaciones, para que podamos también nosotros consolar á los que están en cualquiera angustia, con la consolación con que nosotros somos consolados de Dios.
2CO.1.5	1	5	For as the sufferings of Christ abound in us, so our consolation also aboundeth by Christ.	0.0	neutral	Porque de la manera que abundan en nosotros las aflicciones de Cristo, así abunda también por el mismo Cristo nuestra consolación.
2CO.1.6	1	6	And whether we be afflicted, {it is} for your consolation and salvation, which is effectual in the enduring of the same sufferings which we also suffer: or whether we be comforted, {it is} for your consolation and salvation. {is effectual: or, is wrought}	0.0	neutral	Mas si somos atribulados, es por vuestra consolación y salud; la cual es obrada en el sufrir las mismas aflicciones que nosotros también padecemos: ó si somos consolados, es por vuestra consolación y salud;
2CO.1.7	1	7	And our hope of you {is} stedfast, knowing, that as ye are partakers of the sufferings, so {shall ye be} also of the consolation.	0.0	neutral	Y nuestra esperanza de vosotros es firme; estando ciertos que como sois compañeros de las aflicciones, así también lo sois de la consolación.
2CO.1.8	1	8	For we would not, brethren, have you ignorant of our trouble which came to us in Asia, that we were pressed out of measure, above strength, insomuch that we despaired even of life:	-0.1	neutral	Porque hermanos, no queremos que ignoréis de nuestra tribulación que nos fué hecha en Asia; que sobremanera fuimos cargados sobre nuestras fuerzas de tal manera que estuviésemos en duda de la vida.
2CO.1.9	1	9	But we had the sentence of death in ourselves, that we should not trust in ourselves, but in God which raiseth the dead: {sentence: or, answer}	-0.475	negative	Mas nosotros tuvimos en nosotros mismos respuesta de muerte, para que no confiemos en nosotros mismos, sino en Dios que levanta los muertos:
2CO.1.10	1	10	Who delivered us from so great a death, and doth deliver: in whom we trust that he will yet deliver {us};	0.8	positive	El cual nos libró y libra de tanta muerte; en el cual esperamos que aun nos librará;
2CO.1.11	1	11	Ye also helping together by prayer for us, that for the gift {bestowed} upon us by the means of many persons thanks may be given by many on our behalf.	0.4	positive	Ayudándonos también vosotros con oración por nosotros, para que por la merced hecha á nos por respeto de muchos, por muchos sean hechas gracias por nosotros.
2CO.1.12	1	12	For our rejoicing is this, the testimony of our conscience, that in simplicity and godly sincerity, not with fleshly wisdom, but by the grace of God, we have had our conversation in the world, and more abundantly to you-ward.	0.55	positive	Porque nuestra gloria es esta: el testimonio de nuestra conciencia, que con simplicidad y sinceridad de Dios, no con sabiduría carnal, mas con la gracia de Dios, hemos conversado en el mundo, y muy más con vosotros.
2CO.1.13	1	13	For we write none other things unto you, than what ye read or acknowledge; and I trust ye shall acknowledge even to the end;	-0.125	negative	Porque no os escribimos otras cosas de las que leéis, ó también conocéis: y espero que aun hasta el fin las conoceréis:
2CO.1.14	1	14	As also ye have acknowledged us in part, that we are your rejoicing, even as ye also {are} ours in the day of the Lord Jesus.	0.0	neutral	Como también en parte habéis conocido que somos vuestra gloria, así como también vosotros la nuestra, para el día del Señor Jesús.
2CO.1.15	1	15	And in this confidence I was minded to come unto you before, that ye might have a second benefit; {benefit: or, grace}	0.0	neutral	Y con esta confianza quise primero ir á vosotros, para que tuvieseis una segunda gracia;
2CO.1.16	1	16	And to pass by you into Macedonia, and to come again out of Macedonia unto you, and of you to be brought on my way toward Judaea.	0.0	neutral	Y por vosotros pasar á Macedonia, y de Macedonia venir otra vez á vosotros, y ser vuelto de vosotros á Judea.
2CO.1.17	1	17	When I therefore was thus minded, did I use lightness? or the things that I purpose, do I purpose according to the flesh, that with me there should be yea yea, and nay nay?	0.0	neutral	Así que, pretendiendo esto, ¿usé quizá de liviandad? ó lo que pienso hacer, ¿piénsolo según la carne, para que haya en mí Sí y No?
2CO.1.18	1	18	But {as} God {is} true, our word toward you was not yea and nay. {word: or, preaching}	0.35	positive	Antes, Dios fiel sabe que nuestra palabra para con vosotros no es Sí y No.
2CO.1.19	1	19	For the Son of God, Jesus Christ, who was preached among you by us, {even} by me and Silvanus and Timotheus, was not yea and nay, but in him was yea.	0.0	neutral	Porque el Hijo de Dios, Jesucristo, que por nosotros ha sido entre vosotros predicado, por mí y Silvano y Timoteo, no ha sido Sí y No; mas ha sido Sí en él.
2CO.1.20	1	20	For all the promises of God in him {are} yea, and in him Amen, unto the glory of God by us.	0.0	neutral	Porque todas las promesas de Dios son en él Sí, y en él Amén, por nosotros á gloria de Dios.
2CO.1.21	1	21	Now he which stablisheth us with you in Christ, and hath anointed us, {is} God;	0.0	neutral	Y el que nos confirma con vosotros en Cristo, y el que nos ungió, es Dios;
2CO.1.22	1	22	Who hath also sealed us, and given the earnest of the Spirit in our hearts.	0.0	neutral	El cual también nos ha sellado, y dado la prenda del Espíritu en nuestros corazones.
2CO.1.23	1	23	Moreover I call God for a record upon my soul, that to spare you I came not as yet unto Corinth.	0.0	neutral	Mas yo llamo á Dios por testigo sobre mi alma, que por ser indulgente con vosotros no he pasado todavía á Corinto.
2CO.1.24	1	24	Not for that we have dominion over your faith, but are helpers of your joy: for by faith ye stand.	0.8	positive	No que nos enseñoreemos de vuestra fe, mas somos ayudadores de vuestro gozo: porque por la fe estáis firmes.
2CO.2.1	2	1	But I determined this with myself, that I would not come again to you in heaviness.	0.0	neutral	ESTO pues determiné para conmigo, no venir otra vez á vosotros con tristeza.
2CO.2.2	2	2	For if I make you sorry, who is he then that maketh me glad, but the same which is made sorry by me?	-0.125	negative	Porque si yo os contristo, ¿quién será luego el que me alegrará, sino aquel á quien yo contristare?
2CO.2.3	2	3	And I wrote this same unto you, lest, when I came, I should have sorrow from them of whom I ought to rejoice; having confidence in you all, that my joy is {the joy} of you all.	0.5333	positive	Y esto mismo os escribí, porque cuando llegare no tenga tristeza sobre tristeza de los que me debiera gozar; confiando en vosotros todos que mi gozo es el de todos vosotros.
2CO.2.4	2	4	For out of much affliction and anguish of heart I wrote unto you with many tears; not that ye should be grieved, but that ye might know the love which I have more abundantly unto you.	0.46	positive	Porque por la mucha tribulación y angustia del corazón os escribí con muchas lágrimas; no para que fueseis contristados, mas para que supieseis cuánto más amor tengo para con vosotros.
2CO.2.5	2	5	But if any have caused grief, he hath not grieved me, but in part: that I may not overcharge you all.	-0.8	negative	Que si alguno me contristó, no me contristó á mí, sino en parte, por no cargaros, á todos vosotros.
2CO.2.6	2	6	Sufficient to such a man {is} this punishment, which {was inflicted} of many. {punishment: or, censure}	0.25	positive	Bástale al tal esta reprensión hecha de muchos;
2CO.2.7	2	7	So that contrariwise ye {ought} rather to forgive {him}, and comfort {him}, lest perhaps such a one should be swallowed up with overmuch sorrow.	0.0	neutral	Así que, al contrario, vosotros más bien lo perdonéis y consoléis, porque no sea el tal consumido de demasiada tristeza.
2CO.2.8	2	8	Wherefore I beseech you that ye would confirm {your} love toward him.	0.5	positive	Por lo cual os ruego que confirméis el amor para con él.
2CO.2.9	2	9	For to this end also did I write, that I might know the proof of you, whether ye be obedient in all things.	0.4	positive	Porque también por este fin os escribí, para tener experiencia de vosotros si sois obedientes en todo.
2CO.2.10	2	10	To whom ye forgive any thing, I {forgive} also: for if I forgave any thing, to whom I forgave {it}, for your sakes {forgave I it} in the person of Christ; {person: or, sight}	0.0	neutral	Y al que vosotros perdonareis, yo también: porque también yo lo que he perdonado, si algo he perdonado, por vosotros lo he hecho en persona de Cristo;
2CO.2.11	2	11	Lest Satan should get an advantage of us: for we are not ignorant of his devices.	0.0	neutral	Porque no seamos engañados de Satanás: pues no ignoramos sus maquinaciones.
2CO.2.12	2	12	Furthermore, when I came to Troas to {preach} Christ's gospel, and a door was opened unto me of the Lord,	0.0	neutral	Cuando vine á Troas para el evangelio de Cristo, aunque me fué abierta puerta en el Señor,
2CO.2.13	2	13	I had no rest in my spirit, because I found not Titus my brother: but taking my leave of them, I went from thence into Macedonia.	0.0	neutral	No tuve reposo en mi espíritu, por no haber hallado á Tito mi hermano: así, despidiéndome de ellos, partí para Macedonia.
2CO.2.14	2	14	Now thanks {be} unto God, which always causeth us to triumph in Christ, and maketh manifest the savour of his knowledge by us in every place.	0.2	positive	Mas á Dios gracias, el cual hace que siempre triunfemos en Cristo Jesús, y manifiesta el olor de su conocimiento por nosotros en todo lugar.
2CO.2.15	2	15	For we are unto God a sweet savour of Christ, in them that are saved, and in them that perish:	0.35	positive	Porque para Dios somos buen olor de Cristo en los que se salvan, y en los que se pierden:
2CO.2.16	2	16	To the one {we are} the savour of death unto death; and to the other the savour of life unto life. And who {is} sufficient for these things?	-0.125	negative	A éstos ciertamente olor de muerte para muerte; y á aquéllos olor de vida para vida. Y para estas cosas ¿quién es suficiente?
2CO.2.17	2	17	For we are not as many, which corrupt the word of God: but as of sincerity, but as of God, in the sight of God speak we in Christ. {corrupt: or, deal deceitfully with} {in Christ: or, of Christ}	-0.1667	negative	Porque no somos como muchos, mercaderes falsos de la palabra de Dios: antes con sinceridad, como de Dios, delante de Dios, hablamos en Cristo.
2CO.3.1	3	1	Do we begin again to commend ourselves? or need we, as some {others}, epistles of commendation to you, or {letters} of commendation from you?	0.0	neutral	¿COMENZAMOS otra vez á alabarnos á nosotros mismos? ¿ó tenemos necesidad, como algunos, de letras de recomendación para vosotros, ó de recomendación de vosotros?
2CO.3.2	3	2	Ye are our epistle written in our hearts, known and read of all men:	0.0	neutral	Nuestras letras sois vosotros, escritas en nuestros corazones, sabidas y leídas de todos los hombres;
2CO.3.3	3	3	{Forasmuch as ye are} manifestly declared to be the epistle of Christ ministered by us, written not with ink, but with the Spirit of the living God; not in tables of stone, but in fleshy tables of the heart.	0.0	neutral	Siendo manifiesto que sois letra de Cristo administrada de nosotros, escrita no con tinta, mas con el Espíritu del Dios vivo; no en tablas de piedra, sino en tablas de carne del corazón.
2CO.3.4	3	4	And such trust have we through Christ to God-ward:	0.0	neutral	Y tal confianza tenemos por Cristo para con Dios:
2CO.3.5	3	5	Not that we are sufficient of ourselves to think any thing as of ourselves; but our sufficiency {is} of God;	0.0	neutral	No que seamos suficientes de nosotros mismos para pensar algo como de nosotros mismos, sino que nuestra suficiencia es de Dios;
2CO.3.6	3	6	Who also hath made us able ministers of the new testament; not of the letter, but of the spirit: for the letter killeth, but the spirit giveth life. {giveth life: or, quickeneth}	0.3182	positive	El cual asimismo nos hizo ministros suficientes de un nuevo pacto: no de la letra, mas del espíritu; porque la letra mata, mas el espíritu vivifica.
2CO.3.7	3	7	But if the ministration of death, written {and} engraven in stones, was glorious, so that the children of Israel could not stedfastly behold the face of Moses for the glory of his countenance; which {glory} was to be done away:	0.0	neutral	Y si el ministerio de muerte en la letra grabado en piedras, fué con gloria, tanto que los hijos de Israel no pudiesen poner los ojos en la faz de Moisés á causa de la gloria de su rostro, la cual había de perecer,
2CO.3.8	3	8	How shall not the ministration of the spirit be rather glorious?	0.0	neutral	¿Cómo no será más bien con gloria el ministerio del espíritu?
2CO.3.9	3	9	For if the ministration of condemnation {be} glory, much more doth the ministration of righteousness exceed in glory.	0.5	positive	Porque si el ministerio de condenación fué con gloria, mucho más abundará en gloria el ministerio de justicia.
2CO.3.10	3	10	For even that which was made glorious had no glory in this respect, by reason of the glory that excelleth.	0.0	neutral	Porque aun lo que fué glorioso, no es glorioso en esta parte, en comparación de la excelente gloria.
2CO.3.11	3	11	For if that which is done away {was} glorious, much more that which remaineth {is} glorious.	0.5	positive	Porque si lo que perece tuvo gloria, mucho más será en gloria lo que permanece.
2CO.3.12	3	12	Seeing then that we have such hope, we use great plainness of speech: {plainness: or, boldness}	0.0167	neutral	Así que, teniendo tal esperanza, hablamos con mucha confianza;
2CO.3.13	3	13	And not as Moses, {which} put a vail over his face, that the children of Israel could not stedfastly look to the end of that which is abolished:	0.0	neutral	Y no como Moisés, que ponía un velo sobre su faz, para que los hijos de Israel no pusiesen los ojos en el fin de lo que había de ser abolido.
2CO.3.14	3	14	But their minds were blinded: for until this day remaineth the same vail untaken away in the reading of the old testament; which {vail} is done away in Christ.	0.05	neutral	Empero los sentidos de ellos se embotaron; porque hasta el día de hoy les queda el mismo velo no descubierto en la lección del antiguo testamento, el cual por Cristo es quitado.
2CO.3.15	3	15	But even unto this day, when Moses is read, the vail is upon their heart.	0.0	neutral	Y aun hasta el día de hoy, cuando Moisés es leído, el velo está puesto sobre el corazón de ellos.
2CO.3.16	3	16	Nevertheless when it shall turn to the Lord, the vail shall be taken away.	0.0	neutral	Mas cuando se convirtieren al Señor, el velo se quitará.
2CO.3.17	3	17	Now the Lord is that Spirit: and where the Spirit of the Lord {is}, there {is} liberty.	0.0	neutral	Porque el Señor es el Espíritu; y donde hay el Espíritu del Señor, allí hay libertad.
2CO.3.18	3	18	But we all, with open face beholding as in a glass the glory of the Lord, are changed into the same image from glory to glory, {even} as by the Spirit of the Lord. {by the...: or, of the Lord the Spirit}	0.0	neutral	Por tanto, nosotros todos, mirando á cara descubierta como en un espejo la gloria del Señor, somos transformados de gloria en gloria en la misma semejanza, como por el Espíritu del Señor.
2CO.4.1	4	1	Therefore seeing we have this ministry, as we have received mercy, we faint not;	-0.5	negative	POR lo cual teniendo nosotros esta administración según la misericordia que hemos alcanzado, no desmayamos;
2CO.4.2	4	2	But have renounced the hidden things of dishonesty, not walking in craftiness, nor handling the word of God deceitfully; but by manifestation of the truth commending ourselves to every man's conscience in the sight of God. {dishonesty: Gr. shame}	-0.1667	negative	Antes quitamos los escondrijos de vergüenza, no andando con astucia, ni adulterando la palabra de Dios, sino por manifestación de la verdad encomendándonos á nosotros mismos á toda conciencia humana delante de Dios.
2CO.4.3	4	3	But if our gospel be hid, it is hid to them that are lost:	0.0	neutral	Que si nuestro evangelio está aún encubierto, entre los que se pierden está encubierto:
2CO.4.4	4	4	In whom the god of this world hath blinded the minds of them which believe not, lest the light of the glorious gospel of Christ, who is the image of God, should shine unto them.	0.4	positive	En los cuales el dios de este siglo cegó los entendimientos de los incrédulos, para que no les resplandezca la lumbre del evangelio de la gloria de Cristo, el cual es la imagen de Dios.
2CO.4.5	4	5	For we preach not ourselves, but Christ Jesus the Lord; and ourselves your servants for Jesus' sake.	0.0	neutral	Porque no nos predicamos á nosotros mismos, sino á Jesucristo, el Señor; y nosotros vuestros siervos por Jesús.
2CO.4.6	4	6	For God, who commanded the light to shine out of darkness, hath shined in our hearts, to {give} the light of the knowledge of the glory of God in the face of Jesus Christ. {hath: Gr. is he who hath}	0.4	positive	Porque Dios, que mandó que de las tinieblas resplandeciese la luz, es el que resplandeció en nuestros corazones, para iluminación del conocimiento de la gloria de Dios en la faz de Jesucristo.
2CO.4.7	4	7	But we have this treasure in earthen vessels, that the excellency of the power may be of God, and not of us.	0.0	neutral	Tenemos empero este tesoro en vasos de barro, para que la alteza del poder sea de Dios, y no de nosotros:
2CO.4.8	4	8	{We are} troubled on every side, yet not distressed; {we are} perplexed, but not in despair; {in despair: or, altogether without help, or, means}	-0.05	neutral	Estando atribulados en todo, mas no angustiados; en apuros, mas no desesperamos;
2CO.4.9	4	9	Persecuted, but not forsaken; cast down, but not destroyed;	-0.1556	negative	Perseguidos, mas no desamparados; abatidos, mas no perecemos;
2CO.4.10	4	10	Always bearing about in the body the dying of the Lord Jesus, that the life also of Jesus might be made manifest in our body.	0.0	neutral	Llevando siempre por todas partes la muerte de Jesús en el cuerpo, para que también la vida de Jesús sea manifestada en nuestros cuerpos.
2CO.4.11	4	11	For we which live are alway delivered unto death for Jesus' sake, that the life also of Jesus might be made manifest in our mortal flesh.	0.1364	positive	Porque nosotros que vivimos, siempre estamos entregados á muerte por Jesús, para que también la vida de Jesús sea manifestada en nuestra carne mortal.
2CO.4.12	4	12	So then death worketh in us, but life in you.	0.0	neutral	De manera que la muerte obra en nosotros, y en vosotros la vida.
2CO.4.13	4	13	We having the same spirit of faith, according as it is written, I believed, and therefore have I spoken; we also believe, and therefore speak;	0.0	neutral	Empero teniendo el mismo espíritu de fe, conforme á lo que está escrito: Creí, por lo cual también hablé: nosotros también creemos, por lo cual también hablamos;
2CO.4.14	4	14	Knowing that he which raised up the Lord Jesus shall raise up us also by Jesus, and shall present {us} with you.	0.0	neutral	Estando ciertos que el que levantó al Señor Jesús, á nosotros también nos levantará por Jesús, y nos pondrá con vosotros.
2CO.4.15	4	15	For all things {are} for your sakes, that the abundant grace might through the thanksgiving of many redound to the glory of God.	0.55	positive	Porque todas estas cosas padecemos por vosotros, para que abundando la gracia por muchos, en el hacimiento de gracias sobreabunde á gloria de Dios.
2CO.4.16	4	16	For which cause we faint not; but though our outward man perish, yet the inward {man} is renewed day by day.	-0.5	negative	Por tanto, no desmayamos: antes aunque este nuestro hombre exterior se va desgastando, el interior empero se renueva de día en día.
2CO.4.17	4	17	For our light affliction, which is but for a moment, worketh for us a far more exceeding {and} eternal weight of glory;	0.3333	positive	Porque lo que al presente es momentáneo y leve de nuestra tribulación, nos obra un sobremanera alto y eterno peso de gloria;
2CO.4.18	4	18	While we look not at the things which are seen, but at the things which are not seen: for the things which are seen {are} temporal; but the things which are not seen {are} eternal.	0.0	neutral	No mirando nosotros á las cosas que se ven, sino á las que no se ven: porque las cosas que se ven son temporales, mas las que no se ven son eternas.
2CO.5.1	5	1	For we know that if our earthly house of {this} tabernacle were dissolved, we have a building of God, an house not made with hands, eternal in the heavens.	0.0	neutral	PORQUE sabemos, que si la casa terrestre de nuestra habitación se deshiciere, tenemos de Dios un edificio, una casa no hecha de manos, eterna en los cielos.
2CO.5.2	5	2	For in this we groan, earnestly desiring to be clothed upon with our house which is from heaven:	0.0	neutral	Y por esto también gemimos, deseando ser sobrevestidos de aquella nuestra habitación celestial;
2CO.5.3	5	3	If so be that being clothed we shall not be found naked.	0.0	neutral	Puesto que en verdad habremos sido hallados vestidos, y no desnudos.
2CO.5.4	5	4	For we that are in {this} tabernacle do groan, being burdened: not for that we would be unclothed, but clothed upon, that mortality might be swallowed up of life.	0.0	neutral	Porque asimismo los que estamos en este tabernáculo, gemimos agravados; porque no quisiéramos ser desnudados; sino sobrevestidos, para que lo mortal sea absorbido por la vida.
2CO.5.5	5	5	Now he that hath wrought us for the selfsame thing {is} God, who also hath given unto us the earnest of the Spirit.	0.0	neutral	Mas el que nos hizo para esto mismo, es Dios; el cual nos ha dado la prenda del Espíritu.
2CO.5.6	5	6	Therefore {we are} always confident, knowing that, whilst we are at home in the body, we are absent from the Lord:	0.5	positive	Así que vivimos confiados siempre, y sabiendo, que entre tanto que estamos en el cuerpo, peregrinamos ausentes del Señor;
2CO.5.7	5	7	(For we walk by faith, not by sight:)	0.5	positive	(Porque por fe andamos, no por vista;)
2CO.5.8	5	8	We are confident, {I say}, and willing rather to be absent from the body, and to be present with the Lord.	0.25	positive	Mas confiamos, y más quisiéramos partir del cuerpo, y estar presentes al Señor.
2CO.5.9	5	9	Wherefore we labour, that, whether present or absent, we may be accepted of him. {labour: or, endeavour}	0.0	neutral	Por tanto procuramos también, ó ausentes, ó presentes, serle agradables:
2CO.5.10	5	10	For we must all appear before the judgment seat of Christ; that every one may receive the things {done} in {his} body, according to that he hath done, whether {it be} good or bad.	0.0	neutral	Porque es menester que todos nosotros parezcamos ante el tribunal de Cristo, para que cada uno reciba según lo que hubiere hecho por medio del cuerpo, ora sea bueno ó malo.
2CO.5.11	5	11	Knowing therefore the terror of the Lord, we persuade men; but we are made manifest unto God; and I trust also are made manifest in your consciences.	0.0	neutral	Estando pues poseídos del temor del Señor, persuadimos á los hombres, mas á Dios somos manifiestos; y espero que también en vuestras conciencias somos manifiestos.
2CO.5.12	5	12	For we commend not ourselves again unto you, but give you occasion to glory on our behalf, that ye may have somewhat to {answer} them which glory in appearance, and not in heart. {in appearance: Gr. in the face}	0.0	neutral	No nos encomendamos pues otra vez á vosotros, sino os damos ocasión de gloriaros por nosotros, para que tengáis qué responder contra los que se glorían en las apariencias, y no en el corazón.
2CO.5.13	5	13	For whether we be beside ourselves, {it is} to God: or whether we be sober, {it is} for your cause.	0.1	neutral	Porque si loqueamos, es para Dios; y si estamos en seso, es para vosotros.
2CO.5.14	5	14	For the love of Christ constraineth us; because we thus judge, that if one died for all, then were all dead:	0.15	positive	Porque el amor de Cristo nos constriñe, pensando esto: Que si uno murió por todos, luego todos son muertos;
2CO.5.15	5	15	And {that} he died for all, that they which live should not henceforth live unto themselves, but unto him which died for them, and rose again.	0.2909	positive	Y por todos murió, para que los que viven, ya no vivan para sí, mas para aquel que murió y resucitó por ellos.
2CO.5.16	5	16	Wherefore henceforth know we no man after the flesh: yea, though we have known Christ after the flesh, yet now henceforth know we {him} no more.	-0.25	negative	De manera que nosotros de aquí adelante á nadie conocemos según la carne: y aun si á Cristo conocimos según la carne, empero ahora ya no le conocemos.
