verse_id	chapter	verse	text_en	polarity_en	label_en	text_es
2CO.5.17	5	17	Therefore if any man {be} in Christ, {he is} a new creature: old things are passed away; behold, all things are become new. {he is: or, let him be}	0.1242	positive	De modo que si alguno está en Cristo, nueva criatura es: las cosas viejas pasaron; he aquí todas son hechas nuevas.
2CO.5.18	5	18	And all things {are} of God, who hath reconciled us to himself by Jesus Christ, and hath given to us the ministry of reconciliation;	0.0	neutral	Y todo esto es de Dios, el cual nos reconcilió á sí por Cristo; y nos dió el ministerio de la reconciliación.
2CO.5.19	5	19	To wit, that God was in Christ, reconciling the world unto himself, not imputing their trespasses unto them; and hath committed unto us the word of reconciliation. {committed...: Gr. put in us}	0.0	neutral	Porque ciertamente Dios estaba en Cristo reconciliando el mundo á sí, no imputándole sus pecados, y puso en nosotros la palabra de la reconciliación.
2CO.5.20	5	20	Now then we are ambassadors for Christ, as though God did beseech {you} by us: we pray {you} in Christ's stead, be ye reconciled to God.	0.0	neutral	Así que, somos embajadores en nombre de Cristo, como si Dios rogase por medio nuestro; os rogamos en nombre de Cristo: Reconciliaos con Dios.
2CO.5.21	5	21	For he hath made him {to be} sin for us, who knew no sin; that we might be made the righteousness of God in him.	0.0	neutral	Al que no conoció pecado, hizo pecado por nosotros, para que nosotros fuésemos hechos justicia de Dios en él.
2CO.6.1	6	1	We then, {as} workers together {with him}, beseech {you} also that ye receive not the grace of God in vain.	0.0	neutral	Y ASI nosotros, como ayudadores juntamente con él, os exhortamos también á que no recibáis en vano la gracia de Dios,
2CO.6.2	6	2	(For he saith, I have heard thee in a time accepted, and in the day of salvation have I succoured thee: behold, now {is} the accepted time; behold, now {is} the day of salvation.)	0.0	neutral	En tiempo aceptable te he oído, Y en día de salud te he socorrido: he aquí ahora el tiempo aceptable; he aquí ahora el día de salud:)
2CO.6.3	6	3	Giving no offence in any thing, that the ministry be not blamed:	0.0	neutral	No dando á nadie ningún escándalo, porque el ministerio nuestro no sea vituperado:
2CO.6.4	6	4	But in all {things} approving ourselves as the ministers of God, in much patience, in afflictions, in necessities, in distresses, {approving: Gr. commending}	0.2	positive	Antes habiéndonos en todas cosas como ministros de Dios, en mucha paciencia, en tribulaciones, en necesidades, en angustias;
2CO.6.5	6	5	In stripes, in imprisonments, in tumults, in labours, in watchings, in fastings; {in tumults: or, in tossings to and fro}	0.0	neutral	En azotes, en cárceles, en alborotos, en trabajos, en vigilias, en ayunos;
2CO.6.6	6	6	By pureness, by knowledge, by longsuffering, by kindness, by the Holy Ghost, by love unfeigned,	0.5	positive	En castidad, en ciencia, en longanimidad, en bondad, en Espíritu Santo, en amor no fingido;
2CO.6.7	6	7	By the word of truth, by the power of God, by the armour of righteousness on the right hand and on the left,	0.1429	positive	En palabra de verdad, en potencia de Dios, en armas de justicia á diestro y á siniestro;
2CO.6.8	6	8	By honour and dishonour, by evil report and good report: as deceivers, and {yet} true;	0.0167	neutral	Por honra y por deshonra, por infamia y por buena fama; como engañadores, mas hombres de verdad;
2CO.6.9	6	9	As unknown, and {yet} well known; as dying, and, behold, we live; as chastened, and not killed;	0.0455	neutral	Como ignorados, mas conocidos; como muriendo, mas he aquí vivimos; como castigados, mas no muertos;
2CO.6.10	6	10	As sorrowful, yet alway rejoicing; as poor, yet making many rich; as having nothing, and {yet} possessing all things.	0.1583	positive	Como doloridos, mas siempre gozosos; como pobres, mas enriqueciendo á muchos; como no teniendo nada, mas poseyéndolo todo.
2CO.6.11	6	11	O {ye} Corinthians, our mouth is open unto you, our heart is enlarged.	0.0	neutral	Nuestra boca está abierta á vosotros, oh Corintios: nuestro corazón es ensanchado.
2CO.6.12	6	12	Ye are not straitened in us, but ye are straitened in your own bowels.	0.6	positive	No estáis estrechos en nosotros, mas estáis estrechos en vuestras propias entrañas.
2CO.6.13	6	13	Now for a recompence in the same, (I speak as unto {my} children,) be ye also enlarged.	0.0	neutral	Pues, para corresponder al propio modo (como á hijos hablo), ensanchaos también vosotros.
2CO.6.14	6	14	Be ye not unequally yoked together with unbelievers: for what fellowship hath righteousness with unrighteousness? and what communion hath light with darkness?	0.4	positive	No os juntéis en yugo con los infieles: porque ¿qué compañía tienes la justicia con la injusticia? ¿y qué comunión la luz con las tinieblas?
2CO.6.15	6	15	And what concord hath Christ with Belial? or what part hath he that believeth with an infidel?	0.0	neutral	¿Y qué concordia Cristo con Belial? ¿ó qué parte el fiel con el infiel?
2CO.6.16	6	16	And what agreement hath the temple of God with idols? for ye are the temple of the living God; as God hath said, I will dwell in them, and walk in {them}; and I will be their God, and they shall be my people.	0.0	neutral	¿Y qué concierto el templo de Dios con los ídolos? porque vosotros sois el templo del Dios viviente, como Dios dijo: Habitaré y andaré en ellos; y seré el Dios de ellos, y ellos serán mi pueblo.
2CO.6.17	6	17	Wherefore come out from among them, and be ye separate, saith the Lord, and touch not the unclean {thing}; and I will receive you,	0.0	neutral	Por lo cual Salid de en medio de ellos, y apartaos, dice el Señor, Y no toquéis lo inmundo; Y yo os recibiré,
2CO.6.18	6	18	And will be a Father unto you, and ye shall be my sons and daughters, saith the Lord Almighty.	0.0	neutral	Y seré á vosotros Padre, Y vosotros me seréis á mí hijos é hijas, dice el Señor Todopoderoso.
2CO.7.1	7	1	Having therefore these promises, dearly beloved, let us cleanse ourselves from all filthiness of the flesh and spirit, perfecting holiness in the fear of God.	0.7	positive	ASI que, amados, pues tenemos tales promesas, limpiémonos de toda inmundicia de carne y de espíritu, perfeccionando la santificación en temor de Dios.
2CO.7.2	7	2	Receive us; we have wronged no man, we have corrupted no man, we have defrauded no man.	0.0	neutral	Admitidnos: á nadie hemos injuriado, á nadie hemos corrompido, á nadie hemos engañado.
2CO.7.3	7	3	I speak not {this} to condemn {you}: for I have said before, that ye are in our hearts to die and live with {you}.	0.1364	positive	No para condenar os lo digo; que ya he dicho antes que estáis en nuestros corazones, para morir y para vivir juntamente.
2CO.7.4	7	4	Great {is} my boldness of speech toward you, great {is} my glorying of you: I am filled with comfort, I am exceeding joyful in all our tribulation.	0.6667	positive	Mucha confianza tengo de vosotros, tengo de vosotros mucha gloria; lleno estoy de consolación, sobreabundo de gozo en todas nuestras tribulaciones.
2CO.7.5	7	5	For, when we were come into Macedonia, our flesh had no rest, but we were troubled on every side; without {were} fightings, within {were} fears.	-0.5	negative	Porque aun cuando vinimos á Macedonia, ningún reposo tuvo nuestra carne; antes, en todo fuimos atribulados: de fuera, cuestiones; de dentro, temores.
2CO.7.6	7	6	Nevertheless God, that comforteth those that are cast down, comforted us by the coming of Titus;	-0.1556	negative	Mas Dios, que consuela á los humildes, nos consoló con la venida de Tito:
2CO.7.7	7	7	And not by his coming only, but by the consolation wherewith he was comforted in you, when he told us your earnest desire, your mourning, your fervent mind toward me; so that I rejoiced the more.	0.25	positive	Y no sólo con su venida, sino también con la consolación con que él fué consolado acerca de vosotros, haciéndonos saber vuestro deseo grande, vuestro lloro, vuestro celo por mí, para que así me gozase más.
2CO.7.8	7	8	For though I made you sorry with a letter, I do not repent, though I did repent: for I perceive that the same epistle hath made you sorry, though {it were} but for a season.	-0.3333	negative	Porque aunque os contristé por la carta, no me arrepiento, bien que me arrepentí; porque veo que aquella carta, aunque por algún tiempo os contristó,
2CO.7.9	7	9	Now I rejoice, not that ye were made sorry, but that ye sorrowed to repentance: for ye were made sorry after a godly manner, that ye might receive damage by us in nothing. {after...: or, according to God}	-0.5	negative	Ahora me gozo, no porque hayáis sido contristados, sino porque fuisteis contristados para arrepentimiento; porque habéis sido contristados según Dios, para que ninguna pérdida padecieseis por nuestra parte.
2CO.7.10	7	10	For godly sorrow worketh repentance to salvation not to be repented of: but the sorrow of the world worketh death.	0.0	neutral	Porque el dolor que es según Dios, obra arrepentimiento saludable, de que no hay que arrepentirse; mas el dolor del siglo obra muerte.
2CO.7.11	7	11	For behold this selfsame thing, that ye sorrowed after a godly sort, what carefulness it wrought in you, yea, {what} clearing of yourselves, yea, {what} indignation, yea, {what} fear, yea, {what} vehement desire, yea, {what} zeal, yea, {what} revenge! In all {things} ye have approved yourselves to be clear in this matter.	0.1	neutral	Porque he aquí, esto mismo que según Dios fuisteis contristados, cuánta solicitud ha obrado en vosotros, y aun defensa, y aun enojo, y aun temor, y aun gran deseo, y aun celo, y aun vindicación. En todo os habéis mostrado limpios en el negocio.
2CO.7.12	7	12	Wherefore, though I wrote unto you, {I did it} not for his cause that had done the wrong, nor for his cause that suffered wrong, but that our care for you in the sight of God might appear unto you.	-0.5	negative	Así que, aunque os escribí, no fué por causa del que hizo la injuria, ni por causa del que la padeció, mas para que os fuese manifiesta nuestra solicitud que tenemos por vosotros delante de Dios.
2CO.7.13	7	13	Therefore we were comforted in your comfort: yea, and exceedingly the more joyed we for the joy of Titus, because his spirit was refreshed by you all.	0.65	positive	Por tanto, tomamos consolación de vuestra consolación: empero mucho más nos gozamos por el gozo de Tito, que haya sido recreado su espíritu de todos vosotros.
2CO.7.14	7	14	For if I have boasted any thing to him of you, I am not ashamed; but as we spake all things to you in truth, even so our boasting, which {I made} before Titus, is found a truth.	0.0	neutral	Pues si algo me he gloriado para con él de vosotros, no he sido avergonzado; antes, como todo lo que habíamos dicho de vosotros era con verdad, así también nuestra gloria delante de Tito fué hallada verdadera.
2CO.7.15	7	15	And his inward affection is more abundant toward you, whilst he remembereth the obedience of you all, how with fear and trembling ye received him. {inward...: Gr. bowels}	0.55	positive	Y sus entrañas son más abundantes para con vosotros, cuando se acuerda de la obediencia de todos vosotros, de cómo lo recibisteis con temor y temblor.
2CO.7.16	7	16	I rejoice therefore that I have confidence in you in all {things}.	0.0	neutral	Me gozo de que en todo estoy confiado de vosotros.
2CO.8.1	8	1	Moreover, brethren, we do you to wit of the grace of God bestowed on the churches of Macedonia;	0.0	neutral	ASIMISMO, hermanos, os hacemos saber la gracia de Dios que ha sido dada á las iglesias de Macedonia:
2CO.8.2	8	2	How that in a great trial of affliction the abundance of their joy and their deep poverty abounded unto the riches of their liberality. {liberality: Gr. simplicity}	0.5333	positive	Que en grande prueba de tribulación, la abundancia de su gozo y su profunda pobreza abundaron en riquezas de su bondad.
2CO.8.3	8	3	For to {their} power, I bear record, yea, and beyond {their} power {they were} willing of themselves;	0.25	positive	Pues de su grado han dado conforme á sus fuerzas, yo testifico, y aun sobre sus fuerzas;
2CO.8.4	8	4	Praying us with much intreaty that we would receive the gift, and {take upon us} the fellowship of the ministering to the saints.	0.2	positive	Pidiéndonos con muchos ruegos, que aceptásemos la gracia y la comunicación del servicio para los santos.
2CO.8.5	8	5	And {this they did}, not as we hoped, but first gave their own selves to the Lord, and unto us by the will of God.	0.425	positive	Y no como lo esperábamos, mas aun á sí mismos se dieron primeramente al Señor, y á nosotros por la voluntad de Dios.
2CO.8.6	8	6	Insomuch that we desired Titus, that as he had begun, so he would also finish in you the same grace also. {grace: or, gift}	0.0	neutral	De manera que exhortamos á Tito, que como comenzó antes, así también acabe esta gracia entre vosotros también.
2CO.8.7	8	7	Therefore, as ye abound in every {thing, in} faith, and utterance, and knowledge, and {in} all diligence, and {in} your love to us, {see} that ye abound in this grace also.	0.5	positive	Por tanto, como en todo abundáis, en fe, y en palabra, y en ciencia, y en toda solicitud, y en vuestro amor para con nosotros, que también abundéis en esta gracia.
2CO.8.8	8	8	I speak not by commandment, but by occasion of the forwardness of others, and to prove the sincerity of your love.	0.5	positive	No hablo como quien manda, sino para poner á prueba, por la eficacia de otros, la sinceridad también de la caridad vuestra.
2CO.8.9	8	9	For ye know the grace of our Lord Jesus Christ, that, though he was rich, yet for your sakes he became poor, that ye through his poverty might be rich.	0.1167	positive	Porque ya sabéis la gracia de nuestro Señor Jesucristo, que por amor de vosotros se hizo pobre, siendo rico; para que vosotros con su pobreza fueseis enriquecidos.
2CO.8.10	8	10	And herein I give {my} advice: for this is expedient for you, who have begun before, not only to do, but also to be forward a year ago. {forward: Gr. willing}	0.125	positive	Y en esto doy mi consejo; porque esto os conviene á vosotros, que comenzasteis antes, no sólo á hacerlo, mas aun á quererlo desde el año pasado.
2CO.8.11	8	11	Now therefore perform the doing {of it}; that as {there was} a readiness to will, so {there may be} a performance also out of that which ye have.	0.0	neutral	Ahora pues, llevad también á cabo el hecho, para que como estuvisteis prontos á querer, así también lo estéis en cumplir conforme á lo que tenéis.
2CO.8.12	8	12	For if there be first a willing mind, {it is} accepted according to that a man hath, {and} not according to that he hath not.	0.25	positive	Porque si primero hay la voluntad pronta, será acepta por lo que tiene, no por lo que no tiene.
2CO.8.13	8	13	For {I mean} not that other men be eased, and ye burdened:	-0.2188	negative	Porque no digo esto para que haya para otros desahogo, y para vosotros apretura;
2CO.8.14	8	14	But by an equality, {that} now at this time your abundance {may be a supply} for their want, that their abundance also may be {a supply} for your want: that there may be equality:	0.0	neutral	Sino para que en este tiempo, con igualdad, vuestra abundancia supla la falta de ellos, para que también la abundancia de ellos supla vuestra falta, porque haya igualdad;
2CO.8.15	8	15	As it is written, He that {had gathered} much had nothing over; and he that {had gathered} little had no lack.	0.0063	neutral	Como está escrito: El que recogió mucho, no tuvo más; y el que poco, no tuvo menos.
2CO.8.16	8	16	But thanks {be} to God, which put the same earnest care into the heart of Titus for you.	0.1	neutral	Empero gracias á Dios que dió la misma solicitud por vosotros en el corazón de Tito.
2CO.8.17	8	17	For indeed he accepted the exhortation; but being more forward, of his own accord he went unto you.	0.55	positive	Pues á la verdad recibió la exhortación; mas estando también muy solícito, de su voluntad partió para vosotros.
2CO.8.18	8	18	And we have sent with him the brother, whose praise {is} in the gospel throughout all the churches;	0.0	neutral	Y enviamos juntamente con él al hermano cuya alabanza en el evangelio es por todas las iglesias;
2CO.8.19	8	19	And not {that} only, but who was also chosen of the churches to travel with us with this grace, which is administered by us to the glory of the same Lord, and {declaration of} your ready mind: {grace: or, gift}	-0.1375	negative	Y no sólo esto, mas también fué ordenado por las iglesias el compañero de nuestra peregrinación para llevar esta gracia, que es administrada de nosotros para gloria del mismo Señor, y para demostrar vuestro pronto ánimo:
2CO.8.20	8	20	Avoiding this, that no man should blame us in this abundance which is administered by us:	0.0	neutral	Evitando que nadie nos vitupere en esta abundancia que ministramos;
2CO.8.21	8	21	Providing for honest things, not only in the sight of the Lord, but also in the sight of men.	0.3	positive	Procurando las cosas honestas, no sólo delante del Señor, mas aun delante de los hombres.
2CO.8.22	8	22	And we have sent with them our brother, whom we have oftentimes proved diligent in many things, but now much more diligent, upon the great confidence which {I have} in you. {I have: or, he hath}	0.6	positive	Enviamos también con ellos á nuestro hermano, al cual muchas veces hemos experimentado diligente, mas ahora mucho más con la mucha confianza que tiene en vosotros.
2CO.8.23	8	23	Whether {any do enquire} of Titus, {he is} my partner and fellowhelper concerning you: or our brethren {be enquired of, they are} the messengers of the churches, {and} the glory of Christ.	0.0	neutral	Ora en orden á Tito, es mi compañero y coadjutor para con vosotros; ó acerca de nuestros hermanos, los mensajeros son de las iglesias, y la gloria de Cristo.
2CO.8.24	8	24	Wherefore shew ye to them, and before the churches, the proof of your love, and of our boasting on your behalf.	0.5	positive	Mostrad pues, para con ellos á la faz de las iglesias la prueba de vuestro amor, y de nuestra gloria acerca de vosotros.
2CO.9.1	9	1	For as touching the ministering to the saints, it is superfluous for me to write to you:	0.5	positive	PORQUE cuanto á la suministración para los santos, por demás me es escribiros;
2CO.9.2	9	2	For I know the forwardness of your mind, for which I boast of you to them of Macedonia, that Achaia was ready a year ago; and your zeal hath provoked very many.	0.425	positive	Pues conozco vuestro pronto ánimo, del cual me glorío yo entre los de Macedonia, que Acaya está apercibida desde el año pasado; y vuestro ejemplo ha estimulado á muchos.
2CO.9.3	9	3	Yet have I sent the brethren, lest our boasting of you should be in vain in this behalf; that, as I said, ye may be ready:	0.2	positive	Mas he enviado los hermanos, porque nuestra gloria de vosotros no sea vana en esta parte; para que, como lo he dicho, estéis apercibidos;
2CO.9.4	9	4	Lest haply if they of Macedonia come with me, and find you unprepared, we (that we say not, ye) should be ashamed in this same confident boasting.	0.25	positive	No sea que, si vinieren conmigo Macedonios, y os hallaren desapercibidos, nos avergoncemos nosotros, por no decir vosotros, de este firme gloriarnos.
2CO.9.5	9	5	Therefore I thought it necessary to exhort the brethren, that they would go before unto you, and make up beforehand your bounty, whereof ye had notice before, that the same might be ready, as {a matter of} bounty, and not as {of} covetousness. {bounty: Gr. blessing} {whereof...: or, which hath been so much spoken of before}	0.1	neutral	Por tanto, tuve por cosa necesaria exhortar á los hermanos que fuesen primero á vosotros, y apresten primero vuestra bendición antes prometida para que esté aparejada como de bendición, y no como de mezquindad.
2CO.9.6	9	6	But this {I say}, He which soweth sparingly shall reap also sparingly; and he which soweth bountifully shall reap also bountifully.	0.0	neutral	Esto empero digo: El que siembra escasamente, también segará escasamente; y el que siembra en bendiciones, en bendiciones también segará.
2CO.9.7	9	7	Every man according as he purposeth in his heart, {so let him give}; not grudgingly, or of necessity: for God loveth a cheerful giver.	0.35	positive	Cada uno dé como propuso en su corazón: no con tristeza, ó por necesidad; porque Dios ama el dador alegre.
2CO.9.8	9	8	And God {is} able to make all grace abound toward you; that ye, always having all sufficiency in all {things}, may abound to every good work:	0.6	positive	Y poderoso es Dios para hacer que abunde en vosotros toda gracia; á fin de que, teniendo siempre en todas las cosas todo lo que basta, abundéis para toda buena obra:
2CO.9.9	9	9	(As it is written, He hath dispersed abroad; he hath given to the poor: his righteousness remaineth for ever.	-0.4	negative	Como está escrito: Derramó, dió á los pobres; Su justicia permanece para siempre.
2CO.9.10	9	10	Now he that ministereth seed to the sower both minister bread for {your} food, and multiply your seed sown, and increase the fruits of your righteousness;)	0.125	positive	Y el que da simiente al que siembra, también dará pan para comer, y multiplicará vuestra sementera, y aumentará los crecimientos de los frutos de vuestra justicia;
2CO.9.11	9	11	Being enriched in every thing to all bountifulness, which causeth through us thanksgiving to God. {bountifulness: or, liberality: Gr. simplicity}	0.0	neutral	Para que estéis enriquecidos en todo para toda bondad, la cual obra por nosotros hacimiento de gracias á Dios.
2CO.9.12	9	12	For the administration of this service not only supplieth the want of the saints, but is abundant also by many thanksgivings unto God;	0.3667	positive	Porque la suministración de este servicio, no solamente suple lo que á los santos falta, sino también abunda en muchos hacimientos de gracias á Dios:
2CO.9.13	9	13	Whiles by the experiment of this ministration they glorify God for your professed subjection unto the gospel of Christ, and for {your} liberal distribution unto them, and unto all {men};	0.0	neutral	Que por la experiencia de esta suministración glorifican á Dios por la obediencia que profesáis al evangelio de Cristo, y por la bondad de contribuir para ellos y para todos;
2CO.9.14	9	14	And by their prayer for you, which long after you for the exceeding grace of God in you.	-0.05	neutral	Asimismo por la oración de ellos á favor vuestro, los cuales os quieren á causa de la eminente gracia de Dios en vosotros.
2CO.9.15	9	15	Thanks {be} unto God for his unspeakable gift.	0.2	positive	Gracias á Dios por su don inefable.
2CO.10.1	10	1	Now I Paul myself beseech you by the meekness and gentleness of Christ, who in presence {am} base among you, but being absent am bold toward you: {in presence: or, in outward appearance}	-0.4056	negative	EMPERO yo Pablo, os ruego por la mansedumbre y modestia de Cristo, yo que presente ciertamente soy bajo entre vosotros, mas ausente soy confiado entre vosotros:
2CO.10.2	10	2	But I beseech {you}, that I may not be bold when I am present with that confidence, wherewith I think to be bold against some, which think of us as if we walked according to the flesh. {think: or, reckon}	0.2222	positive	Ruego pues, que cuando estuviere presente, no tenga que ser atrevido con la confianza con que estoy en ánimo de ser resuelto para con algunos, que nos tienen como si anduviésemos según la carne.
2CO.10.3	10	3	For though we walk in the flesh, we do not war after the flesh:	0.0	neutral	Pues aunque andamos en la carne, no militamos según la carne.
2CO.10.4	10	4	(For the weapons of our warfare {are} not carnal, but mighty through God to the pulling down of strong holds;) {through God: or, to God}	0.2319	positive	(Porque las armas de nuestra milicia no son carnales, sino poderosas en Dios para la destrucción de fortalezas;)
2CO.10.5	10	5	Casting down imaginations, and every high thing that exalteth itself against the knowledge of God, and bringing into captivity every thought to the obedience of Christ; {imaginations: or, reasonings}	0.0022	neutral	Destruyendo consejos, y toda altura que se levanta contra la ciencia de Dios, y cautivando todo intento á la obediencia, de Cristo;
2CO.10.6	10	6	And having in a readiness to revenge all disobedience, when your obedience is fulfilled.	0.0	neutral	Y estando prestos para castigar toda desobediencia, cuando vuestra obediencia fuere cumplida.
2CO.10.7	10	7	Do ye look on things after the outward appearance? If any man trust to himself that he is Christ's, let him of himself think this again, that, as he {is} Christ's, even so {are} we Christ's.	0.0	neutral	Miráis las cosas según la apariencia. Si alguno está confiado en sí mismo que es de Cristo, esto también piense por sí mismo, que como él es de Cristo, así también nosotros somos de Cristo.
2CO.10.8	10	8	For though I should boast somewhat more of our authority, which the Lord hath given us for edification, and not for your destruction, I should not be ashamed:	0.5	positive	Porque aunque me glorié aun un poco de nuestra potestad (la cual el Señor nos dió para edificación y no para vuestra destrucción), no me avergonzaré;
2CO.10.9	10	9	That I may not seem as if I would terrify you by letters.	0.0	neutral	Porque no parezca como que os quiero espantar por cartas.
2CO.10.10	10	10	For {his} letters, say they, {are} weighty and powerful; but {his} bodily presence {is} weak, and {his} speech contemptible. {say they: Gr. saith he}	-0.025	neutral	Porque á la verdad, dicen, las cartas son graves y fuertes; mas la presencia corporal flaca, y la palabra menospreciable.
