verse_id	chapter	verse	text_en	polarity_en	label_en	text_pt
2SA.15.8	15	8	For thy servant vowed a vow while I abode at Geshur in Syria, saying, If the LORD shall bring me again indeed to Jerusalem, then I will serve the LORD.	0.0	neutral	"Quando o teu servo estava em Gesur, na Síria, fez este voto: Se o Senhor me permitir voltar a Jerusalém, prestarei culto a ele em Hebrom""."
2SA.15.9	15	9	And the king said unto him, Go in peace. So he arose, and went to Hebron.	0.0	neutral	"""Vá em paz! "", disse o rei. E ele foi para Hebrom."
2SA.15.10	15	10	But Absalom sent spies throughout all the tribes of Israel, saying, As soon as ye hear the sound of the trumpet, then ye shall say, Absalom reigneth in Hebron.	0.4	positive	"Absalão enviou secretamente mensageiros a todas as tribos de Israel, dizendo: ""Assim que vocês ouvirem o som das trombetas, digam: Absalão é rei em Hebrom""."
2SA.15.11	15	11	And with Absalom went two hundred men out of Jerusalem, {that were} called; and they went in their simplicity, and they knew not any thing.	0.0	neutral	Absalão levou duzentos homens de Jerusalém. Eles tinham sido convidados e nada sabiam nem suspeitavam do que estava acontecendo.
2SA.15.12	15	12	And Absalom sent for Ahithophel the Gilonite, David's counsellor, from his city, {even} from Giloh, while he offered sacrifices. And the conspiracy was strong; for the people increased continually with Absalom.	0.4333	positive	Depois de oferecer sacrifícios, Absalão mandou chamar da cidade de Gilo Aitofel, que era de Gilo, conselheiro de Davi. A conspiração ganhou força, e cresceu o número dos que seguiam Absalão.
2SA.15.13	15	13	And there came a messenger to David, saying, The hearts of the men of Israel are after Absalom.	0.0	neutral	"Então um mensageiro chegou e disse a Davi: ""Os israelitas estão com Absalão! """
2SA.15.14	15	14	And David said unto all his servants that {were} with him at Jerusalem, Arise, and let us flee; for we shall not {else} escape from Absalom: make speed to depart, lest he overtake us suddenly, and bring evil upon us, and smite the city with the edge of the sword. {bring: Heb. thrust}	-0.5	negative	"Então Davi disse aos conselheiros que estavam com ele em Jerusalém: ""Vamos fugir; caso contrário não escaparemos de Absalão. Se não partirmos imediatamente ele nos alcançará, causará a nossa ruína e matará o povo à espada""."
2SA.15.15	15	15	And the king's servants said unto the king, Behold, thy servants {are ready to do} whatsoever my lord the king shall appoint. {appoint: Heb. choose}	0.2	positive	"Os conselheiros do rei lhe responderam: ""Teus servos estão dispostos a fazer tudo o que o rei, nosso senhor, decidir""."
2SA.15.16	15	16	And the king went forth, and all his household after him. And the king left ten women, {which were} concubines, to keep the house. {after...: Heb. at his feet}	0.0	neutral	O rei partiu, seguido por todos os de sua família; deixou, porém, dez concubinas para tomarem conta do palácio.
2SA.15.17	15	17	And the king went forth, and all the people after him, and tarried in a place that was far off.	0.1	neutral	Assim, o rei partiu com todo o povo. Pararam na última casa da cidade,
2SA.15.18	15	18	And all his servants passed on beside him; and all the Cherethites, and all the Pelethites, and all the Gittites, six hundred men which came after him from Gath, passed on before the king.	0.0	neutral	e todos os seus soldados marcharam, passando por ele: todos os queretitas e peletitas, e os seiscentos giteus que o acompanhavam desde Gate.
2SA.15.19	15	19	Then said the king to Ittai the Gittite, Wherefore goest thou also with us? return to thy place, and abide with the king: for thou {art} a stranger, and also an exile.	0.0	neutral	"O rei disse então a Itai, de Gate: ""Por que você está indo conosco? Volte e fique com o novo rei, pois você é estrangeiro, um exilado de sua terra."
2SA.15.20	15	20	Whereas thou camest {but} yesterday, should I this day make thee go up and down with us? seeing I go whither I may, return thou, and take back thy brethren: mercy and truth {be} with thee. {go up...: Heb. wander in going}	-0.0778	neutral	"Faz pouco tempo que você chegou. Como eu poderia fazê-lo acompanhar-me? Volte e leve consigo os seus irmãos. Que o Senhor o trate com bondade e fidelidade! """
2SA.15.21	15	21	And Ittai answered the king, and said, {As} the LORD liveth, and {as} my lord the king liveth, surely in what place my lord the king shall be, whether in death or life, even there also will thy servant be.	0.5	positive	"Itai, contudo, respondeu ao rei: ""Juro pelo nome do Senhor e por tua vida que onde quer que o rei, meu senhor, esteja, ali estará o seu servo, para viver ou para morrer! """
2SA.15.22	15	22	And David said to Ittai, Go and pass over. And Ittai the Gittite passed over, and all his men, and all the little ones that {were} with him.	-0.1875	negative	"Então Davi disse a Itai: ""Está bem, pode ir adiante"". E Itai, o giteu, marchou, com todos os seus soldados e com as famílias que estavam com ele."
2SA.15.23	15	23	And all the country wept with a loud voice, and all the people passed over: the king also himself passed over the brook Kidron, and all the people passed over, toward the way of the wilderness. {Kidron: Gr. Cedron}	0.1	neutral	Todo o povo do lugar chorava em alta voz enquanto o exército passava. O rei atravessou o vale do Cedrom e todo o povo foi com ele em direção ao deserto.
2SA.15.24	15	24	And lo Zadok also, and all the Levites {were} with him, bearing the ark of the covenant of God: and they set down the ark of God; and Abiathar went up, until all the people had done passing out of the city.	-0.1556	negative	Zadoque também estava lá, e com ele todos os levitas que carregavam a arca da aliança de Deus; Abiatar também estava lá. Puseram no chão a arca de Deus até que todo o povo saísse da cidade.
2SA.15.25	15	25	And the king said unto Zadok, Carry back the ark of God into the city: if I shall find favour in the eyes of the LORD, he will bring me again, and shew me {both} it, and his habitation:	0.0	neutral	"Então o rei disse a Zadoque: ""Leve a arca de Deus de volta para a cidade. Se o Senhor mostrar benevolência a mim, ele me trará de volta e me deixará ver a arca e o lugar onde ela deve permanecer."
2SA.15.26	15	26	But if he thus say, I have no delight in thee; behold, {here am} I, let him do to me as seemeth good unto him.	0.7	positive	"Mas, se ele disser que já não sou do seu agrado, aqui estou! Faça ele comigo o que for de sua vontade""."
2SA.15.27	15	27	The king said also unto Zadok the priest, {Art not} thou a seer? return into the city in peace, and your two sons with you, Ahimaaz thy son, and Jonathan the son of Abiathar.	0.0	neutral	"Disse ainda o rei ao sacerdote Zadoque: ""Fique alerta! Volte em paz para a cidade, você, Aimaás, seu filho, e Jônatas, filho de Abiatar."
2SA.15.28	15	28	See, I will tarry in the plain of the wilderness, until there come word from you to certify me.	-0.2143	negative	"Junto às torrentes do deserto ficarei esperando notícias de vocês""."
2SA.15.29	15	29	Zadok therefore and Abiathar carried the ark of God again to Jerusalem: and they tarried there.	0.0	neutral	Então Zadoque e Abiatar levaram a arca de Deus de volta para Jerusalém, e lá permaneceram.
2SA.15.30	15	30	And David went up by the ascent of {mount} Olivet, and wept as he went up, and had his head covered, and he went barefoot: and all the people that {was} with him covered every man his head, and they went up, weeping as they went up. {and wept...: Heb. going up and weeping}	0.0	neutral	Davi, porém, continuou subindo o monte das Oliveiras, caminhando e chorando, e com a cabeça coberta e os pés descalços. E todos os que iam com ele também tinham a cabeça coberta e subiam chorando.
2SA.15.31	15	31	And {one} told David, saying, Ahithophel {is} among the conspirators with Absalom. And David said, O LORD, I pray thee, turn the counsel of Ahithophel into foolishness.	0.0	neutral	"Quando informaram a Davi que Aitofel era um dos conspiradores que apoiavam Absalão, Davi orou: ""Ó Senhor, transforma em loucura os conselhos de Aitofel""."
2SA.15.32	15	32	And it came to pass, that {when} David was come to the top {of the mount}, where he worshipped God, behold, Hushai the Archite came to meet him with his coat rent, and earth upon his head:	0.5	positive	Quando Davi chegou ao alto do monte, ao lugar onde o povo costumava adorar a Deus, veio ao seu encontro o arquita Husai, com a roupa rasgada e com terra sobre a cabeça.
2SA.15.33	15	33	Unto whom David said, If thou passest on with me, then thou shalt be a burden unto me:	0.0	neutral	"E Davi lhe disse: ""Não adianta você vir comigo."
2SA.15.34	15	34	But if thou return to the city, and say unto Absalom, I will be thy servant, O king; {as} I {have been} thy father's servant hitherto, so {will} I now also {be} thy servant: then mayest thou for me defeat the counsel of Ahithophel.	0.0	neutral	Mas se voltar à cidade, poderá dizer a Absalão: 'Estarei a teu serviço, ó rei. No passado estive a serviço de teu pai, mas agora estarei a teu serviço'. Assim você me ajudará, frustrando o conselho de Aitofel.
2SA.15.35	15	35	And {hast thou} not there with thee Zadok and Abiathar the priests? therefore it shall be, {that} what thing soever thou shalt hear out of the king's house, thou shalt tell {it} to Zadok and Abiathar the priests.	0.0	neutral	Os sacerdotes Zadoque e Abiatar estarão lá com você. Informe-os do que você souber no palácio.
2SA.15.36	15	36	Behold, {they have} there with them their two sons, Ahimaaz Zadok's {son}, and Jonathan Abiathar's {son}; and by them ye shall send unto me every thing that ye can hear.	0.0	neutral	"Também estão lá os dois filhos deles: Aimaás e Jônatas. Por meio deles me informe de tudo que você ouvir""."
2SA.15.37	15	37	So Hushai David's friend came into the city, and Absalom came into Jerusalem.	0.0	neutral	Então Husai, amigo de Davi, chegou a Jerusalém quando Absalão estava entrando na cidade.
2SA.16.1	16	1	And when David was a little past the top {of the hill}, behold, Ziba the servant of Mephibosheth met him, with a couple of asses saddled, and upon them two hundred {loaves} of bread, and an hundred bunches of raisins, and an hundred of summer fruits, and a bottle of wine.	0.0208	neutral	Mal Davi tinha passado pelo alto do monte, lá estava à sua espera Ziba, criado de Mefibosete. Ele trazia dois jumentos carregando duzentos pães, cem bolos de uvas passas, cem frutas da estação e uma vasilha de couro cheia de vinho.
2SA.16.2	16	2	And the king said unto Ziba, What meanest thou by these? And Ziba said, The asses {be} for the king's household to ride on; and the bread and summer fruit for the young men to eat; and the wine, that such as be faint in the wilderness may drink.	-0.1333	negative	"O rei perguntou a Ziba: ""Por que você trouxe essas coisas? "" Ziba respondeu: ""Os jumentos servirão de montaria para a família do rei, os pães e as frutas são para os homens comerem, e o vinho servirá para reanimar os que ficarem exaustos no deserto""."
2SA.16.3	16	3	And the king said, And where {is} thy master's son? And Ziba said unto the king, Behold, he abideth at Jerusalem: for he said, To day shall the house of Israel restore me the kingdom of my father.	0.0	neutral	"O rei então perguntou: ""Onde está Mefibosete, neto de seu senhor? "" Respondeu-lhe Ziba: ""Ele ficou em Jerusalém, pois acredita que os israelitas lhe restituirão o reino de seu avô ""."
2SA.16.4	16	4	Then said the king to Ziba, Behold, thine {are} all that {pertained} unto Mephibosheth. And Ziba said, I humbly beseech thee {that} I may find grace in thy sight, my lord, O king. {I humbly...: Heb. I do obeisance}	-0.2	negative	"Então o rei disse a Ziba: ""Tudo o que pertencia a Mefibosete agora é seu"". ""Humildemente me prostro"", disse Ziba. ""Que o rei, meu senhor, agrade-se de mim""."
2SA.16.5	16	5	And when king David came to Bahurim, behold, thence came out a man of the family of the house of Saul, whose name {was} Shimei, the son of Gera: he came forth, and cursed still as he came. {he came forth...: or, he still came forth and cursed}	0.0	neutral	Chegando o rei Davi a Baurim, um homem do clã da família de Saul chamado Simei, filho de Gera, saiu da cidade proferindo maldições contra ele.
2SA.16.6	16	6	And he cast stones at David, and at all the servants of king David: and all the people and all the mighty men {were} on his right hand and on his left.	0.2286	positive	Ele atirava pedras em Davi e em todos os conselheiros do rei, embora todo o exército e a guarda de elite estivessem à direita e à esquerda de Davi.
2SA.16.7	16	7	And thus said Shimei when he cursed, Come out, come out, thou bloody man, and thou man of Belial: {bloody...: Heb. man of blood}	-0.7833	negative	"Enquanto amaldiçoava, Simei dizia: ""Saia daqui, saia daqui! Assassino! Bandido!"
2SA.16.8	16	8	The LORD hath returned upon thee all the blood of the house of Saul, in whose stead thou hast reigned; and the LORD hath delivered the kingdom into the hand of Absalom thy son: and, behold, thou {art taken} in thy mischief, because thou {art} a bloody man. {behold...: Heb. behold thee in thy evil}	-0.9	negative	"O Senhor retribuiu a você todo o sangue derramado na família de Saul, em cujo lugar você reinou. O Senhor entregou o reino nas mãos de seu filho Absalão. Você está arruinado porque é um assassino! """
2SA.16.9	16	9	Then said Abishai the son of Zeruiah unto the king, Why should this dead dog curse my lord the king? let me go over, I pray thee, and take off his head.	-0.2	negative	"Então Abisai, filho de Zeruia, disse ao rei: ""Por que esse cão morto amaldiçoa o rei meu senhor? Permite que eu lhe corte a cabeça""."
2SA.16.10	16	10	And the king said, What have I to do with you, ye sons of Zeruiah? so let him curse, because the LORD hath said unto him, Curse David. Who shall then say, Wherefore hast thou done so?	0.0	neutral	"Mas o rei disse: ""Que é que vocês têm com isso, filhos de Zeruia? Ele me amaldiçoa porque o Senhor lhe disse que amaldiçoasse Davi. Portanto, quem poderá questioná-lo? """
2SA.16.11	16	11	And David said to Abishai, and to all his servants, Behold, my son, which came forth of my bowels, seeketh my life: how much more now {may this} Benjamite {do it}? let him alone, and let him curse; for the LORD hath bidden him.	0.5	positive	"Disse então Davi a Abisai e a todos os seus conselheiros: ""Até meu filho, sangue do meu sangue, procura matar-me. Quanto mais este benjamita! Deixem-no em paz! Que amaldiçoe, pois foi o que o Senhor lhe mandou fazer."
2SA.16.12	16	12	It may be that the LORD will look on mine affliction, and that the LORD will requite me good for his cursing this day. {affliction: or, tears: Heb. eye}	0.7	positive	"Talvez o Senhor considere a minha aflição e me retribua com o bem a maldição que hoje recebo""."
2SA.16.13	16	13	And as David and his men went by the way, Shimei went along on the hill's side over against him, and cursed as he went, and threw stones at him, and cast dust. {cast...: Heb. dusted him with dust}	0.0	neutral	Assim, Davi e os seus soldados prosseguiram pela estrada, enquanto Simei ia pela encosta do monte, no lado oposto, amaldiçoando, jogando pedras e terra.
2SA.16.14	16	14	And the king, and all the people that {were} with him, came weary, and refreshed themselves there.	0.0	neutral	O rei e todo o povo que estava com ele chegaram exaustos a seu destino. E lá descansaram.
2SA.16.15	16	15	And Absalom, and all the people the men of Israel, came to Jerusalem, and Ahithophel with him.	0.0	neutral	Enquanto isso, Absalão e todos os homens de Israel entraram em Jerusalém, e Aitofel estava com eles.
2SA.16.16	16	16	And it came to pass, when Hushai the Archite, David's friend, was come unto Absalom, that Hushai said unto Absalom, God save the king, God save the king. {God...: Heb. Let the king live}	0.1364	positive	"Então Husai, o arquita, amigo de Davi, aproximou-se de Absalão e exclamou: ""Viva o rei! Viva o rei! """
2SA.16.17	16	17	And Absalom said to Hushai, {Is} this thy kindness to thy friend? why wentest thou not with thy friend?	0.0	neutral	"Mas Absalão disse a Husai: ""É essa a lealdade que você tem para com o seu amigo? Por que você não foi com ele? """
2SA.16.18	16	18	And Hushai said unto Absalom, Nay; but whom the LORD, and this people, and all the men of Israel, choose, his will I be, and with him will I abide.	0.0	neutral	"Respondeu Husai: ""Não! Sou do escolhido do Senhor, deste povo e de todos os israelitas; e com ele permanecerei."
2SA.16.19	16	19	And again, whom should I serve? {should I} not {serve} in the presence of his son? as I have served in thy father's presence, so will I be in thy presence.	0.0	neutral	"Além disso, a quem devo servir? Não deveria eu servir o filho? Assim como servi a teu pai, também te servirei""."
2SA.16.20	16	20	Then said Absalom to Ahithophel, Give counsel among you what we shall do.	0.0	neutral	"Então Absalão disse a Aitofel: ""Dê-nos o seu conselho. Que devemos fazer? """
2SA.16.21	16	21	And Ahithophel said unto Absalom, Go in unto thy father's concubines, which he hath left to keep the house; and all Israel shall hear that thou art abhorred of thy father: then shall the hands of all that {are} with thee be strong.	0.2167	positive	"Aitofel respondeu: ""Tenha relações com as concubinas de teu pai, que ele deixou para tomar conta do palácio. Então todo o Israel ficará sabendo que te tornaste repugnante para teu pai, e todos os que estão contigo se encherão de coragem""."
2SA.16.22	16	22	So they spread Absalom a tent upon the top of the house; and Absalom went in unto his father's concubines in the sight of all Israel.	0.5	positive	E assim armaram uma tenda no terraço do palácio para Absalão, e ele teve relações com as concubinas de seu pai à vista de todo o Israel.
2SA.16.23	16	23	And the counsel of Ahithophel, which he counselled in those days, {was} as if a man had enquired at the oracle of God: so {was} all the counsel of Ahithophel both with David and with Absalom. {oracle: Heb. word}	0.0	neutral	Naquela época, tanto Davi como Absalão consideravam os conselhos de Aitofel como se fossem a palavra do próprio Deus.
2SA.17.1	17	1	Moreover Ahithophel said unto Absalom, Let me now choose out twelve thousand men, and I will arise and pursue after David this night:	0.0	neutral	"Aitofel disse a Absalão: ""Permite-me escolher doze mil homens, e partirei esta noite em perseguição a Davi."
2SA.17.2	17	2	And I will come upon him while he {is} weary and weak handed, and will make him afraid: and all the people that {are} with him shall flee; and I will smite the king only:	-0.325	negative	Eu o atacarei enquanto ele está exausto e fraco; vou causar-lhe pânico, e seu exército fugirá. Depois matarei somente o rei,
2SA.17.3	17	3	And I will bring back all the people unto thee: the man whom thou seekest {is} as if all returned: {so} all the people shall be in peace.	-0.375	negative	"e trarei todo o exército de volta a ti. É somente um homem que procuras matar. Assim, todo o exército ficará em paz""."
2SA.17.4	17	4	And the saying pleased Absalom well, and all the elders of Israel. {pleased...: Heb. was right in the eyes of, etc}	0.4286	positive	Esse plano pareceu bom a Absalão e a todas as autoridades de Israel.
2SA.17.5	17	5	Then said Absalom, Call now Hushai the Archite also, and let us hear likewise what he saith. {what...: Heb. what is in his mouth}	0.0	neutral	"Entretanto, Absalão disse: ""Chamem também Husai, o arquita, para que ouçamos a opinião dele""."
2SA.17.6	17	6	And when Hushai was come to Absalom, Absalom spake unto him, saying, Ahithophel hath spoken after this manner: shall we do {after} his saying? if not; speak thou. {his saying: Heb. his word}	0.0	neutral	"Quando Husai entrou, Absalão lhe disse: ""Aitofel deu-nos o conselho dele. Devemos fazer o que ele diz, ou você tem outra opinião? """
2SA.17.7	17	7	And Hushai said unto Absalom, The counsel that Ahithophel hath given {is} not good at this time. {given: Heb. counselled}	-0.35	negative	"Husai respondeu: ""O conselho que Aitofel deu desta vez não é bom."
2SA.17.8	17	8	For, said Hushai, thou knowest thy father and his men, that they {be} mighty men, and they {be} chafed in their minds, as a bear robbed of her whelps in the field: and thy father {is} a man of war, and will not lodge with the people. {chafed...: Heb. bitter of soul}	0.15	positive	Sabes que o teu pai e os homens que estão com ele são guerreiros, e estão furiosos como uma ursa selvagem da qual roubaram os filhotes. Além disso, teu pai é um soldado experiente e não passará a noite com o exército.
2SA.17.9	17	9	Behold, he is hid now in some pit, or in some {other} place: and it will come to pass, when some of them be overthrown at the first, that whosoever heareth it will say, There is a slaughter among the people that follow Absalom. {overthrown: Heb. fallen}	0.0625	neutral	Ele, agora, já deve estar escondido numa caverna ou nalgum outro lugar. Se alguns dos teus soldados forem mortos no primeiro ataque, quem souber disso dirá: 'Houve matança no meio do exército de Absalão'.
2SA.17.10	17	10	And he also {that is} valiant, whose heart {is} as the heart of a lion, shall utterly melt: for all Israel knoweth that thy father {is} a mighty man, and {they} which {be} with him {are} valiant men.	0.2	positive	Então, até o mais bravo soldado, corajoso como leão, ficará morrendo de medo, pois todo o Israel sabe que teu pai é um guerreiro valente e que seus soldados são corajosos.
2SA.17.11	17	11	Therefore I counsel that all Israel be generally gathered unto thee, from Dan even to Beersheba, as the sand that {is} by the sea for multitude; and that thou go to battle in thine own person. {that thou...: Heb. that thy face, or, presence go, etc}	0.325	positive	"""Por isso, dou o seguinte conselho: Que se reúnam a ti todos os homens de Israel, desde Dã até Berseba, tantos como a areia da praia e que tu mesmo os conduzas na batalha."
2SA.17.12	17	12	So shall we come upon him in some place where he shall be found, and we will light upon him as the dew falleth on the ground: and of him and of all the men that {are} with him there shall not be left so much as one.	0.2	positive	Então o atacaremos onde quer que ele se encontre, e cairemos sobre ele como o orvalho cai sobre a terra. Nem ele nem nenhum dos seus homens escapará.
2SA.17.13	17	13	Moreover, if he be gotten into a city, then shall all Israel bring ropes to that city, and we will draw it into the river, until there be not one small stone found there.	-0.25	negative	"Se ele se refugiar em alguma cidade, todo o Israel levará cordas para lá, e arrastaremos aquela cidade para o vale, até que não reste ali sequer uma pequena pedra""."
2SA.17.14	17	14	And Absalom and all the men of Israel said, The counsel of Hushai the Archite {is} better than the counsel of Ahithophel. For the LORD had appointed to defeat the good counsel of Ahithophel, to the intent that the LORD might bring evil upon Absalom. {appointed: Heb. commanded}	0.0667	neutral	Absalão e todos os homens de Israel consideraram o conselho de Husai, o arquita, melhor do que o de Aitofel; pois o Senhor tinha decidido frustrar o eficiente conselho de Aitofel a fim de trazer ruína sobre Absalão.
2SA.17.15	17	15	Then said Hushai unto Zadok and to Abiathar the priests, Thus and thus did Ahithophel counsel Absalom and the elders of Israel; and thus and thus have I counselled.	0.0	neutral	Husai contou aos sacerdotes Zadoque e Abiatar o conselho que Aitofel dera a Absalão e às autoridades de Israel, e o que ele mesmo lhes tinha aconselhado em seguida.
2SA.17.16	17	16	Now therefore send quickly, and tell David, saying, Lodge not this night in the plains of the wilderness, but speedily pass over; lest the king be swallowed up, and all the people that {are} with him.	0.3333	positive	"Então pediu que enviassem imediatamente esta mensagem a Davi: ""Não passe a noite nos pontos de travessia do Jordão, no deserto, mas atravesse logo o rio, senão o rei e todo o seu exército serão exterminados""."
2SA.17.17	17	17	Now Jonathan and Ahimaaz stayed by Enrogel; for they might not be seen to come into the city: and a wench went and told them; and they went and told king David.	0.0	neutral	Jônatas e Aimaás estavam em En-Rogel, e uma serva os informava regularmente, pois não podiam arriscar-se a serem vistos na cidade. Eles, por sua vez, iam relatar ao rei Davi o que tinham ouvido.
2SA.17.18	17	18	Nevertheless a lad saw them, and told Absalom: but they went both of them away quickly, and came to a man's house in Bahurim, which had a well in his court; whither they went down.	0.0889	neutral	Mas um jovem os viu e avisou Absalão. Então eles partiram rapidamente e foram para a casa de um habitante de Baurim, que tinha um poço no quintal. Eles desceram ao poço,
2SA.17.19	17	19	And the woman took and spread a covering over the well's mouth, and spread ground corn thereon; and the thing was not known.	0.0	neutral	e a dona da casa colocou a tampa no poço e, para disfarçar, espalhou grãos de cereal por cima.
2SA.17.20	17	20	And when Absalom's servants came to the woman to the house, they said, Where {is} Ahimaaz and Jonathan? And the woman said unto them, They be gone over the brook of water. And when they had sought and could not find {them}, they returned to Jerusalem.	0.0	neutral	"Os soldados de Absalão chegaram à casa da mulher e lhe perguntaram: ""Onde estão Aimaás e Jônatas? "" A mulher respondeu: ""Eles atravessaram as águas"". Os homens os procuraram sem sucesso, e voltaram a Jerusalém."
