verse_id	chapter	verse	text_en	polarity_en	label_en	text_pt
2SA.13.6	13	6	So Amnon lay down, and made himself sick: and when the king was come to see him, Amnon said unto the king, I pray thee, let Tamar my sister come, and make me a couple of cakes in my sight, that I may eat at her hand.	-0.4349	negative	"Amnom atendeu e deitou-se na cama, fingindo-se doente. Quando o rei foi visitá-lo, Amnom lhe disse: ""Eu gostaria que minha irmã Tamar viesse e preparasse dois bolos aqui mesmo e me servisse""."
2SA.13.7	13	7	Then David sent home to Tamar, saying, Go now to thy brother Amnon's house, and dress him meat.	0.0	neutral	"Davi mandou dizer a Tamar no palácio: ""Vá à casa de seu irmão Amnom e prepare algo para ele comer""."
2SA.13.8	13	8	So Tamar went to her brother Amnon's house; and he was laid down. And she took flour, and kneaded {it}, and made cakes in his sight, and did bake the cakes. {flour: or, paste}	-0.1556	negative	Assim, Tamar foi à casa de seu irmão, que estava deitado. Ela amassou a farinha, preparou os bolos na presença dele e os assou.
2SA.13.9	13	9	And she took a pan, and poured {them} out before him; but he refused to eat. And Amnon said, Have out all men from me. And they went out every man from him.	0.0	neutral	Depois pegou a assadeira e lhe serviu os bolos, mas ele não quis comer. Então Amnom deu ordem para que todos saíssem; depois que todos saíram,
2SA.13.10	13	10	And Amnon said unto Tamar, Bring the meat into the chamber, that I may eat of thine hand. And Tamar took the cakes which she had made, and brought {them} into the chamber to Amnon her brother.	0.0	neutral	"Amnom disse a Tamar: ""Traga os bolos e sirva-me aqui no meu quarto"". Tamar levou os bolos que havia preparado ao quarto de seu irmão."
2SA.13.11	13	11	And when she had brought {them} unto him to eat, he took hold of her, and said unto her, Come lie with me, my sister.	0.0	neutral	"Mas quando ela se aproximou para servi-lo, ele a agarrou e disse: ""Deite-se comigo, minha irmã""."
2SA.13.12	13	12	And she answered him, Nay, my brother, do not force me; for no such thing ought to be done in Israel: do not thou this folly. {force...: Heb. humble me} {no such...: Heb. it ought not so to be done}	-0.0667	neutral	"Mas ela lhe disse: ""Não, meu irmão! Não me faça essa violência. Não se faz uma coisa dessas em Israel! Não cometa essa loucura."
2SA.13.13	13	13	And I, whither shall I cause my shame to go? and as for thee, thou shalt be as one of the fools in Israel. Now therefore, I pray thee, speak unto the king; for he will not withhold me from thee.	0.0	neutral	"O que seria de mim? Como eu poderia livrar-me da minha desonra? E o que seria de você? Você cairia em desgraça em Israel. Fale com o rei; ele deixará que eu me case com você""."
2SA.13.14	13	14	Howbeit he would not hearken unto her voice: but, being stronger than she, forced her, and lay with her.	-0.3	negative	Mas Amnom não quis ouvir e, sendo mais forte que ela, violentou-a.
2SA.13.15	13	15	Then Amnon hated her exceedingly; so that the hatred wherewith he hated her {was} greater than the love wherewith he had loved her. And Amnon said unto her, Arise, be gone. {exceedingly: Heb. with great hatred greatly}	0.2143	positive	"Logo depois Amnom sentiu uma forte aversão por ela, mais forte que a paixão que sentira. E disse a ela: ""Levante-se e saia! """
2SA.13.16	13	16	And she said unto him, {There is} no cause: this evil in sending me away {is} greater than the other that thou didst unto me. But he would not hearken unto her.	-0.2083	negative	"Mas ela lhe disse: ""Não, meu irmão, mandar-me embora seria pior do que o mal que você já me fez"". Ele, porém, não quis ouvi-la,"
2SA.13.17	13	17	Then he called his servant that ministered unto him, and said, Put now this {woman} out from me, and bolt the door after her.	0.0	neutral	"e chamando seu servo, disse-lhe: ""Ponha esta mulher para fora daqui e tranque a porta""."
2SA.13.18	13	18	And {she had} a garment of divers colours upon her: for with such robes were the king's daughters {that were} virgins apparelled. Then his servant brought her out, and bolted the door after her.	0.0	neutral	Então o servo a pôs para fora e trancou a porta. Ela estava vestindo uma túnica longa, pois esse era o tipo de roupa que as filhas virgens do rei usavam desde a puberdade.
2SA.13.19	13	19	And Tamar put ashes on her head, and rent her garment of divers colours that {was} on her, and laid her hand on her head, and went on crying.	-0.2	negative	Tamar pôs cinza na cabeça, rasgou a túnica longa que estava usando e se pôs a caminho, com as mãos sobre a cabeça e chorando em alta voz.
2SA.13.20	13	20	And Absalom her brother said unto her, Hath Amnon thy brother been with thee? but hold now thy peace, my sister: he {is} thy brother; regard not this thing. So Tamar remained desolate in her brother Absalom's house. {Amnon: Heb. Aminon} {regard...: Heb. set not thy heart} {desolate: Heb. and desolate}	0.0	neutral	"Absalão, seu irmão, lhe perguntou: ""Seu irmão, Amnom, lhe fez algum mal? Agora, acalme-se, minha irmã; ele é seu irmão! Não se deixe dominar pela angústia"". E Tamar, muito triste, ficou na casa de seu irmão Absalão."
2SA.13.21	13	21	But when king David heard of all these things, he was very wroth.	0.2	positive	Ao saber de tudo isso, o rei Davi ficou furioso.
2SA.13.22	13	22	And Absalom spake unto his brother Amnon neither good nor bad: for Absalom hated Amnon, because he had forced his sister Tamar.	-0.3	negative	E Absalão não falou nada com Amnom, nem bem, nem mal, embora o odiasse por ter violentado sua irmã Tamar.
2SA.13.23	13	23	And it came to pass after two full years, that Absalom had sheepshearers in Baalhazor, which {is} beside Ephraim: and Absalom invited all the king's sons.	0.35	positive	Dois anos depois, quando os tosquiadores de ovelhas de Absalão estavam em Baal-Hazor, perto da fronteira de Efraim, Absalão convidou todos os filhos do rei para se reunirem com ele.
2SA.13.24	13	24	And Absalom came to the king, and said, Behold now, thy servant hath sheepshearers; let the king, I beseech thee, and his servants go with thy servant.	0.0	neutral	"Absalão foi ao rei e lhe disse: ""Eu, teu servo, estou tosquiando as ovelhas e gostaria que o rei e os seus conselheiros estivessem comigo""."
2SA.13.25	13	25	And the king said to Absalom, Nay, my son, let us not all now go, lest we be chargeable unto thee. And he pressed him: howbeit he would not go, but blessed him.	0.0	neutral	"Respondeu o rei: ""Não, meu filho. Não iremos todos, pois isso seria um peso para você"". Embora Absalão insistisse, ele se recusou a ir, mas o abençoou."
2SA.13.26	13	26	Then said Absalom, If not, I pray thee, let my brother Amnon go with us. And the king said unto him, Why should he go with thee?	0.0	neutral	"Então Absalão lhe disse: ""Se não queres ir, permite, por favor, que o meu irmão Amnom vá conosco"". O rei perguntou: ""Mas, por que ele iria com você? """
2SA.13.27	13	27	But Absalom pressed him, that he let Amnon and all the king's sons go with him.	0.0	neutral	Mas Absalão insistiu tanto que o rei acabou deixando que Amnom e os seus outros filhos fossem com ele.
2SA.13.28	13	28	Now Absalom had commanded his servants, saying, Mark ye now when Amnon's heart is merry with wine, and when I say unto you, Smite Amnon; then kill him, fear not: have not I commanded you? be courageous, and be valiant. {have...: or, will you not, since I have commanded you?} {valiant: Heb. sons of valour}	0.0	neutral	"Absalão ordenou aos seus homens: ""Ouçam! Quando Amnom estiver embriagado de vinho e eu disser: 'Matem Amnom! ', vocês o matarão. Não tenham medo; eu assumo a responsabilidade. Sejam fortes e corajosos! """
2SA.13.29	13	29	And the servants of Absalom did unto Amnon as Absalom had commanded. Then all the king's sons arose, and every man gat him up upon his mule, and fled. {gat...: Heb. rode}	0.0	neutral	Assim os homens de Absalão mataram Amnom, obedecendo às suas ordens. Então todos os filhos do rei montaram em suas mulas e fugiram.
2SA.13.30	13	30	And it came to pass, while they were in the way, that tidings came to David, saying, Absalom hath slain all the king's sons, and there is not one of them left.	0.0	neutral	"Estando eles ainda a caminho, chegou a seguinte notícia ao rei: ""Absalão matou todos os teus filhos; nenhum deles escapou""."
2SA.13.31	13	31	Then the king arose, and tare his garments, and lay on the earth; and all his servants stood by with their clothes rent.	0.0	neutral	O rei levantou-se, rasgou as suas vestes, prostrou-se, e todos os conselheiros que estavam com ele também rasgaram as vestes.
2SA.13.32	13	32	And Jonadab, the son of Shimeah David's brother, answered and said, Let not my lord suppose {that} they have slain all the young men the king's sons; for Amnon only is dead: for by the appointment of Absalom this hath been determined from the day that he forced his sister Tamar. {appointment: Heb. mouth} {determined: or, settled}	-0.1	neutral	"Mas, Jonadabe, filho de Siméia, irmão de Davi, disse: ""Não pense o meu senhor que mataram todos os teus filhos. Somente Amnom foi morto. Essa era a intenção de Absalão desde o dia em que Amnom violentou Tamar, irmã dele."
2SA.13.33	13	33	Now therefore let not my lord the king take the thing to his heart, to think that all the king's sons are dead: for Amnon only is dead.	-0.1333	negative	"O rei, meu senhor, não deve acreditar que todos os seus filhos estão mortos. Apenas Amnom morreu""."
2SA.13.34	13	34	But Absalom fled. And the young man that kept the watch lifted up his eyes, and looked, and, behold, there came much people by the way of the hill side behind him.	-0.0333	neutral	"Enquanto isso, Absalão fugiu. Nesse meio tempo o sentinela viu muita gente que vinha pela estrada de Horonaim, descendo pela encosta da colina, e disse ao rei: ""Vejo homens vindo pela estrada de Horonaim, na encosta da colina""."
2SA.13.35	13	35	And Jonadab said unto the king, Behold, the king's sons come: as thy servant said, so it is. {as thy...: Heb. according to the word of thy servant}	0.0	neutral	"E Jonadabe disse ao rei: ""São os filhos do rei! Aconteceu como o teu servo disse""."
2SA.13.36	13	36	And it came to pass, as soon as he had made an end of speaking, that, behold, the king's sons came, and lifted up their voice and wept: and the king also and all his servants wept very sore. {very...: Heb. with a great weeping greatly}	0.5	positive	Acabando de falar, os filhos do rei chegaram, chorando em alta voz. Também o rei e todos os seus conselheiros choraram muito.
2SA.13.37	13	37	But Absalom fled, and went to Talmai, the son of Ammihud, king of Geshur. And {David} mourned for his son every day. {Ammihud: or, Ammihur}	0.0	neutral	Absalão fugiu para o território de Talmai, filho de Amiúde, rei de Gesur. E o rei Davi pranteava por seu filho todos os dias.
2SA.13.38	13	38	So Absalom fled, and went to Geshur, and was there three years.	0.0	neutral	Depois que Absalão fugiu para Gesur, e lá permaneceu três anos,
2SA.13.39	13	39	And {the soul of} king David longed to go forth unto Absalom: for he was comforted concerning Amnon, seeing he was dead. {longed: or, was consumed}	-0.2	negative	a ira do rei contra Absalão cessou, pois ele se sentia consolado da morte de Amnom.
2SA.14.1	14	1	Now Joab the son of Zeruiah perceived that the king's heart {was} toward Absalom.	0.0	neutral	Joabe, filho de Zeruia, percebeu que o rei estava com saudade de Absalão,
2SA.14.2	14	2	And Joab sent to Tekoah, and fetched thence a wise woman, and said unto her, I pray thee, feign thyself to be a mourner, and put on now mourning apparel, and anoint not thyself with oil, but be as a woman that had a long time mourned for the dead:	0.15	positive	"então mandou buscar uma mulher astuta em Tecoa, e lhe disse: ""Finja que está de luto: Vista-se de preto e não se perfume. Aja como uma mulher que há algum tempo está de luto."
2SA.14.3	14	3	And come to the king, and speak on this manner unto him. So Joab put the words in her mouth.	0.0	neutral	"Vá dizer ao rei estas palavras"", e a instruiu sobre o que ela deveria dizer."
2SA.14.4	14	4	And when the woman of Tekoah spake to the king, she fell on her face to the ground, and did obeisance, and said, Help, O king. {Help: Heb. Save}	0.0	neutral	"Quando a mulher apresentou-se ao rei, prostrou-se, rosto em terra, em sinal de respeito, e lhe disse: ""Ajuda-me, ó rei! """
2SA.14.5	14	5	And the king said unto her, What aileth thee? And she answered, I {am} indeed a widow woman, and mine husband is dead.	-0.2	negative	"""Qual é o seu problema? "", perguntou-lhe o rei, e ela respondeu: ""Sou viúva, meu marido morreu"
2SA.14.6	14	6	And thy handmaid had two sons, and they two strove together in the field, and {there was} none to part them, but the one smote the other, and slew him. {none...: Heb. no deliverer between them}	-0.125	negative	deixando-me com dois filhos. Eles brigaram no campo e, não havendo ninguém para separá-los, um acabou matando o outro.
2SA.14.7	14	7	And, behold, the whole family is risen against thine handmaid, and they said, Deliver him that smote his brother, that we may kill him, for the life of his brother whom he slew; and we will destroy the heir also: and so they shall quench my coal which is left, and shall not leave to my husband {neither} name nor remainder upon the earth. {upon...: Heb. upon the face of the earth}	0.0	neutral	"Agora, todo o clã levantou-se contra a tua serva, exigindo: 'Entregue o assassino, para que o matemos pela vida do irmão, e nos livremos também do herdeiro'. Assim eles querem apagar a última centelha que me restou, deixando meu marido sem nome nem descendência na face da terra""."
2SA.14.8	14	8	And the king said unto the woman, Go to thine house, and I will give charge concerning thee.	0.0	neutral	"O rei disse à mulher: ""Vá para casa. Eu mandarei que cuidem do seu caso""."
2SA.14.9	14	9	And the woman of Tekoah said unto the king, My lord, O king, the iniquity {be} on me, and on my father's house: and the king and his throne {be} guiltless.	0.0	neutral	"Mas a mulher de Tecoa lhe disse: ""Ó rei, meu senhor, é sobre mim e sobre a família de meu pai que pesará a iniqüidade; não pesa culpa sobre o rei e sobre o seu trono""."
2SA.14.10	14	10	And the king said, Whosoever saith {ought} unto thee, bring him to me, and he shall not touch thee any more.	0.5	positive	"O rei respondeu: ""Se alguém ameaçá-la, traga-o a mim, e ele não mais a incomodará""."
2SA.14.11	14	11	Then said she, I pray thee, let the king remember the LORD thy God, that thou wouldest not suffer the revengers of blood to destroy any more, lest they destroy my son. And he said, {As} the LORD liveth, there shall not one hair of thy son fall to the earth. {that...: Heb. that the revenger of blood do not multiply to destroy}	0.05	neutral	"Ela acrescentou: ""Peço então ao rei que, em nome do Senhor, o seu Deus, não permita que o vingador da vítima cause maior destruição, matando meu outro filho"". E disse ele: ""Eu juro pelo nome do Senhor, que nem um só fio de cabelo da cabeça de seu filho cairá""."
2SA.14.12	14	12	Then the woman said, Let thine handmaid, I pray thee, speak {one} word unto my lord the king. And he said, Say on.	0.0	neutral	"Disse-lhe ainda a mulher: ""Permite que a tua serva fale mais uma coisa ao rei meu senhor"". ""Fale"", respondeu ele."
2SA.14.13	14	13	And the woman said, Wherefore then hast thou thought such a thing against the people of God? for the king doth speak this thing as one which is faulty, in that the king doth not fetch home again his banished.	0.0	neutral	"Disse então a mulher: ""Por que terá o rei agido contra o povo de Deus? O rei está se condenando com o que acaba de dizer, pois não permitiu a volta do que foi banido."
2SA.14.14	14	14	For we must needs die, and {are} as water spilt on the ground, which cannot be gathered up again; neither doth God respect {any} person: yet doth he devise means, that his banished be not expelled from him. {neither...: or, because God hath not taken away his life, he hath also devised means, etc}	0.0	neutral	Que teremos que morrer um dia, é tão certo como não se pode recolher a água que se espalhou pela terra. Mas Deus não tira a vida; pelo contrário, cria meios para que o banido não permaneça afastado dele.
2SA.14.15	14	15	Now therefore that I am come to speak of this thing unto my lord the king, {it is} because the people have made me afraid: and thy handmaid said, I will now speak unto the king; it may be that the king will perform the request of his handmaid.	-0.6	negative	"""E eu vim falar sobre isso ao rei, meu senhor, porque o povo me ameaçou. Tua serva pensou que se falasse com o rei, talvez ele atendesse o seu pedido,"
2SA.14.16	14	16	For the king will hear, to deliver his handmaid out of the hand of the man {that would} destroy me and my son together out of the inheritance of God.	-0.2	negative	e concordasse em livrar a sua serva das mãos do homem que está tentando eliminar tanto a mim como a meu filho da herança que Deus nos deu.
2SA.14.17	14	17	Then thine handmaid said, The word of my lord the king shall now be comfortable: for as an angel of God, so {is} my lord the king to discern good and bad: therefore the LORD thy God will be with thee. {comfortable: Heb. for rest} {to discern: Heb. to hear}	0.2	positive	"""E agora a tua serva diz: Traga-me descanso a decisão do rei, o meu senhor, pois o rei, meu senhor, é como um anjo de Deus, capaz de discernir entre o bem e o mal. Que o Senhor teu Deus esteja contigo! """
2SA.14.18	14	18	Then the king answered and said unto the woman, Hide not from me, I pray thee, the thing that I shall ask thee. And the woman said, Let my lord the king now speak.	0.0	neutral	"Então o rei disse à mulher: ""Não me esconda nada do que vou lhe perguntar"". ""Fale o rei, meu senhor"", disse a mulher."
2SA.14.19	14	19	And the king said, {Is not} the hand of Joab with thee in all this? And the woman answered and said, {As} thy soul liveth, my lord the king, none can turn to the right hand or to the left from ought that my lord the king hath spoken: for thy servant Joab, he bade me, and he put all these words in the mouth of thine handmaid:	0.1429	positive	"O rei perguntou: ""Não é Joabe que está por trás de tudo isso? "" A mulher respondeu: ""Juro por tua vida, ó rei, ninguém é capaz de desviar-se para a direita ou para a esquerda do que tu dizes. Sim, foi o teu servo Joabe quem me mandou aqui para dizer tudo isso."
2SA.14.20	14	20	To fetch about this form of speech hath thy servant Joab done this thing: and my lord {is} wise, according to the wisdom of an angel of God, to know all {things} that {are} in the earth.	0.7	positive	"O teu servo Joabe agiu assim para mudar essa situação. Mas o meu senhor é sábio como um anjo de Deus, e nada lhe escapa de tudo o que acontece em seu país""."
2SA.14.21	14	21	And the king said unto Joab, Behold now, I have done this thing: go therefore, bring the young man Absalom again.	0.1	neutral	"Depois o rei disse a Joabe: ""Muito bem, atenderei esse pedido. Vá e traga de volta o jovem Absalão""."
2SA.14.22	14	22	And Joab fell to the ground on his face, and bowed himself, and thanked the king: and Joab said, To day thy servant knoweth that I have found grace in thy sight, my lord, O king, in that the king hath fulfilled the request of his servant. {thanked: Heb. blessed} {his servant: or, thy servant}	0.0	neutral	"Joabe prostrou-se, rosto em terra, abençoou o rei e disse: ""Hoje o teu servo ficou sabendo que o vês com bons olhos, pois o rei atendeu o pedido de seu servo""."
2SA.14.23	14	23	So Joab arose and went to Geshur, and brought Absalom to Jerusalem.	0.0	neutral	Então Joabe foi a Gesur e trouxe Absalão de volta para Jerusalém.
2SA.14.24	14	24	And the king said, Let him turn to his own house, and let him not see my face. So Absalom returned to his own house, and saw not the king's face.	0.6	positive	"Mas o rei disse: ""Ele irá para a casa dele; não virá à minha presença"". Assim, Absalão foi para a sua casa e não compareceu mais à presença do rei."
2SA.14.25	14	25	But in all Israel there was none to be so much praised as Absalom for his beauty: from the sole of his foot even to the crown of his head there was no blemish in him. {But...: Heb. And as Absalom there was not a beautiful man in all Israel to praise greatly}	0.1438	positive	Em todo o Israel não havia homem tão elogiado por sua beleza como Absalão. Da cabeça aos pés não havia nele nenhum defeito.
2SA.14.26	14	26	And when he polled his head, (for it was at every year's end that he polled {it}: because {the hair} was heavy on him, therefore he polled it:) he weighed the hair of his head at two hundred shekels after the king's weight.	0.15	positive	Sempre que o cabelo lhe ficava pesado demais, ele o cortava e o pesava: eram dois quilos e quatrocentos gramas, segundo o padrão do rei.
2SA.14.27	14	27	And unto Absalom there were born three sons, and one daughter, whose name {was} Tamar: she was a woman of a fair countenance.	0.7	positive	Ele teve três filhos e uma filha, chamada Tamar, que se tornou uma linda mulher.
2SA.14.28	14	28	So Absalom dwelt two full years in Jerusalem, and saw not the king's face.	0.35	positive	Absalão morou dois anos em Jerusalém sem ser recebido pelo rei.
2SA.14.29	14	29	Therefore Absalom sent for Joab, to have sent him to the king; but he would not come to him: and when he sent again the second time, he would not come.	0.0	neutral	Então mandou chamar Joabe para enviá-lo ao rei, mas Joabe não quis ir. Mandou chamá-lo pela segunda vez, mas ele, novamente, não quis ir.
2SA.14.30	14	30	Therefore he said unto his servants, See, Joab's field is near mine, and he hath barley there; go and set it on fire. And Absalom's servants set the field on fire. {near...: Heb. near my place}	0.1	neutral	"Então Absalão disse a seus servos: ""Vejam, a propriedade de Joabe é vizinha da minha, e ele tem uma plantação de cevada. Tratem de incendiá-la"". E os servos de Absalão puseram fogo na plantação."
2SA.14.31	14	31	Then Joab arose, and came to Absalom unto {his} house, and said unto him, Wherefore have thy servants set my field on fire?	0.0	neutral	"Então Joabe foi à casa de Absalão e lhe perguntou: ""Porque os seus servos puseram fogo na minha propriedade? """
2SA.14.32	14	32	And Absalom answered Joab, Behold, I sent unto thee, saying, Come hither, that I may send thee to the king, to say, Wherefore am I come from Geshur? {it had been} good for me {to have been} there still: now therefore let me see the king's face; and if there be {any} iniquity in me, let him kill me.	0.7	positive	"Absalão respondeu: ""Mandei chamá-lo para enviá-lo ao rei com a seguinte mensagem: 'Por que voltei de Gesur? Melhor seria que eu lá permanecesse! ' Quero ser recebido pelo rei; e, se eu for culpado de alguma coisa, que ele mande me matar""."
2SA.14.33	14	33	So Joab came to the king, and told him: and when he had called for Absalom, he came to the king, and bowed himself on his face to the ground before the king: and the king kissed Absalom.	0.0	neutral	Então Joabe foi contar tudo ao rei. Este mandou chamar Absalão, que entrou e prostrou-se, rosto em terra, perante o rei. E o rei saudou-o com um beijo.
2SA.15.1	15	1	And it came to pass after this, that Absalom prepared him chariots and horses, and fifty men to run before him.	0.0	neutral	Algum tempo depois, Absalão adquiriu uma carruagem, cavalos e uma escolta de cinqüenta homens.
2SA.15.2	15	2	And Absalom rose up early, and stood beside the way of the gate: and it was {so}, that when any man that had a controversy came to the king for judgment, then Absalom called unto him, and said, Of what city {art} thou? And he said, Thy servant {is} of one of the tribes of Israel. {came: Heb. to come}	0.35	positive	Ele se levantava cedo e ficava junto ao caminho que levava à porta da cidade. Sempre que alguém trazia uma causa para ser decidida pelo rei, Absalão o chamava e perguntava de que cidade vinha. A pessoa respondia que era de uma das tribos de Israel,
2SA.15.3	15	3	And Absalom said unto him, See, thy matters {are} good and right; but {there is} no man {deputed} of the king to hear thee. {there...: or, none will hear thee from the king downward}	0.4929	positive	"e Absalão dizia: ""A sua causa é válida e legítima, mas não há nenhum representante do rei para ouvi-lo""."
2SA.15.4	15	4	Absalom said moreover, Oh that I were made judge in the land, that every man which hath any suit or cause might come unto me, and I would do him justice!	0.0	neutral	"E Absalão acrescentava: ""Quem me dera ser designado juiz desta terra! Todos os que tivessem uma causa ou uma questão legal viriam a mim, e eu lhe faria justiça""."
2SA.15.5	15	5	And it was {so}, that when any man came nigh {to him} to do him obeisance, he put forth his hand, and took him, and kissed him.	0.0	neutral	E sempre que alguém se aproximava dele para prostrar-se em sinal de respeito, Absalão estendia a mão, abraçava-o e beijava-o.
2SA.15.6	15	6	And on this manner did Absalom to all Israel that came to the king for judgment: so Absalom stole the hearts of the men of Israel.	0.0	neutral	Absalão agia assim com todos os israelitas que vinham pedir que o rei lhes fizesse justiça. Assim ele foi conquistando a lealdade dos homens de Israel.
2SA.15.7	15	7	And it came to pass after forty years, that Absalom said unto the king, I pray thee, let me go and pay my vow, which I have vowed unto the LORD, in Hebron.	0.0	neutral	"Ao final de quatro anos, Absalão disse ao rei: ""Deixa-me ir a Hebrom para cumprir um voto que fiz ao Senhor."
