verse_id	chapter	verse	text_en	polarity_en	label_en	text_pt
2SA.17.21	17	21	And it came to pass, after they were departed, that they came up out of the well, and went and told king David, and said unto David, Arise, and pass quickly over the water: for thus hath Ahithophel counselled against you.	0.3333	positive	Tendo eles ido embora, os dois saíram do poço e foram informar o rei Davi. Falaram-lhe do conselho que Aitofel dera contra ele, e lhe disseram que atravessasse imediatamente o Jordão.
2SA.17.22	17	22	Then David arose, and all the people that {were} with him, and they passed over Jordan: by the morning light there lacked not one of them that was not gone over Jordan.	0.4	positive	Então Davi e todo o seu exército saíram e, quando o sol nasceu, todos tinham atravessado o Jordão.
2SA.17.23	17	23	And when Ahithophel saw that his counsel was not followed, he saddled {his} ass, and arose, and gat him home to his house, to his city, and put his household in order, and hanged himself, and died, and was buried in the sepulchre of his father. {followed: Heb. done} {put his...: Heb. gave charge concerning his house}	0.0	neutral	Vendo Aitofel que o seu conselho não havia sido aceito, selou seu jumento e foi para casa, para a sua cidade natal; pôs seus negócios em ordem, e depois se enforcou. Ele foi sepultado no túmulo de seu pai.
2SA.17.24	17	24	Then David came to Mahanaim. And Absalom passed over Jordan, he and all the men of Israel with him.	0.0	neutral	Davi já tinha chegado a Maanaim, quando Absalão atravessou o Jordão com todos os homens de Israel.
2SA.17.25	17	25	And Absalom made Amasa captain of the host instead of Joab: which Amasa {was} a man's son, whose name {was} Ithra an Israelite, that went in to Abigail the daughter of Nahash, sister to Zeruiah Joab's mother. {Ithra an Israelite: or, Jether an Ishmaelite} {Abigail: Heb. Abigal} {Nahash: or, Jesse}	0.0	neutral	Absalão havia nomeado Amasa para comandar o exército em lugar de Joabe. Amasa era filho de Jéter, um israelita que havia possuído Abigail, filha de Naás e irmã de Zeruia, mãe de Joabe.
2SA.17.26	17	26	So Israel and Absalom pitched in the land of Gilead.	0.0	neutral	Absalão e os israelitas acamparam em Gileade.
2SA.17.27	17	27	And it came to pass, when David was come to Mahanaim, that Shobi the son of Nahash of Rabbah of the children of Ammon, and Machir the son of Ammiel of Lodebar, and Barzillai the Gileadite of Rogelim,	0.0	neutral	Quando Davi chegou a Maanaim, Sobi, filho de Naás, de Rabá dos amonitas, e Maquir, filho de Amiel, de Lo-Debar, e o gileadita Barzilai, de Rogelim,
2SA.17.28	17	28	Brought beds, and basons, and earthen vessels, and wheat, and barley, and flour, and parched {corn}, and beans, and lentiles, and parched {pulse}, {basons: or, cups}	0.0	neutral	trouxeram a Davi e ao seu exército camas, bacias e utensílios de cerâmica e também trigo, cevada, farinha, grãos torrados, feijão e lentilha,
2SA.17.29	17	29	And honey, and butter, and sheep, and cheese of kine, for David, and for the people that {were} with him, to eat: for they said, The people {is} hungry, and weary, and thirsty, in the wilderness.	0.0	neutral	mel e coalhada, ovelhas e queijo de leite de vaca; pois sabiam que o exército estava cansado, com fome e com sede no deserto.
2SA.18.1	18	1	And David numbered the people that {were} with him, and set captains of thousands and captains of hundreds over them.	0.0	neutral	Davi passou em revista o exército e nomeou comandantes de batalhões de mil e de cem.
2SA.18.2	18	2	And David sent forth a third part of the people under the hand of Joab, and a third part under the hand of Abishai the son of Zeruiah, Joab's brother, and a third part under the hand of Ittai the Gittite. And the king said unto the people, I will surely go forth with you myself also.	0.125	positive	"Davi dividiu o exército em três companhias: uma sob o comando de Joabe, outra sob o comando de Abisai, irmão de Joabe, filho de Zeruia, e outra sob o comando de Itai, o giteu. Disse então o rei ao exército: ""Eu também marcharei com vocês""."
2SA.18.3	18	3	But the people answered, Thou shalt not go forth: for if we flee away, they will not care for us; neither if half of us die, will they care for us: but now {thou art} worth ten thousand of us: therefore now {it is} better that thou succour us out of the city. {care...: Heb. set their heart on us} {worth...: Heb. as ten thousand of us} {succour: Heb. be to succour or help}	0.1556	positive	"Mas os homens disseram: ""Não faças isso! Se tivermos que fugir, eles não se preocuparão conosco, e mesmo que metade de nós morra em batalha, eles não se importarão. Tu, porém, vales por dez mil de nós. Melhor será que fiques na cidade e dali nos dês apoio""."
2SA.18.4	18	4	And the king said unto them, What seemeth you best I will do. And the king stood by the gate side, and all the people came out by hundreds and by thousands.	1.0	positive	"O rei respondeu: ""Farei o que acharem melhor"". E o rei ficou junto à porta, enquanto os soldados marchavam, saindo em unidades de cem e de mil."
2SA.18.5	18	5	And the king commanded Joab and Abishai and Ittai, saying, {Deal} gently for my sake with the young man, {even} with Absalom. And all the people heard when the king gave all the captains charge concerning Absalom.	0.15	positive	"O rei ordenou a Joabe, a Abisai e a Itai: ""Por amor a mim, tratem bem o jovem Absalão! "" E todo o exército ouviu quando o rei deu essa ordem sobre Absalão a cada um dos comandantes."
2SA.18.6	18	6	So the people went out into the field against Israel: and the battle was in the wood of Ephraim;	0.0	neutral	O exército saiu a campo para enfrentar Israel, e a batalha aconteceu na floresta de Efraim,
2SA.18.7	18	7	Where the people of Israel were slain before the servants of David, and there was there a great slaughter that day of twenty thousand {men}.	0.8	positive	onde o exército de Israel foi derrotado pelos soldados de Davi. Houve grande matança naquele dia, elevando-se o número de mortos a vinte mil.
2SA.18.8	18	8	For the battle was there scattered over the face of all the country: and the wood devoured more people that day than the sword devoured. {devoured: Heb. multiplied to devour}	0.5	positive	A batalha espalhou-se por toda a região e, naquele dia, a floresta matou mais que a espada.
2SA.18.9	18	9	And Absalom met the servants of David. And Absalom rode upon a mule, and the mule went under the thick boughs of a great oak, and his head caught hold of the oak, and he was taken up between the heaven and the earth; and the mule that {was} under him went away.	0.25	positive	Durante a batalha, Absalão, montado em sua mula, encontrou-se com os soldados de Davi. Passando a mula debaixo dos galhos de uma grande árvore, e Absalão ficou preso pela cabeça nos galhos. Ele ficou pendurado entre o céu e a terra, e a mula prosseguiu.
2SA.18.10	18	10	And a certain man saw {it}, and told Joab, and said, Behold, I saw Absalom hanged in an oak.	0.2143	positive	"Um homem o viu, e foi informar a Joabe: ""Acabei de ver Absalão pendurado numa grande árvore""."
2SA.18.11	18	11	And Joab said unto the man that told him, And, behold, thou sawest {him}, and why didst thou not smite him there to the ground? and I would have given thee ten {shekels} of silver, and a girdle.	0.0	neutral	"""Você o viu? "", perguntou Joabe ao homem. ""E por que não o matou ali mesmo? Eu teria dado a você dez peças de prata e um cinturão de guerreiro! """
2SA.18.12	18	12	And the man said unto Joab, Though I should receive a thousand {shekels} of silver in mine hand, {yet} would I not put forth mine hand against the king's son: for in our hearing the king charged thee and Abishai and Ittai, saying, Beware that none {touch} the young man Absalom. {receive: Heb. weigh upon mine hand} {Beware...: Heb. Beware whosoever ye be of, etc}	0.1	neutral	"Mas o homem respondeu: ""Mesmo que fossem pesadas e colocadas em minhas mãos mil peças de prata, eu não levantaria a mão contra o filho do rei. Ouvimos o rei ordenar a ti, a Abisai e a Itai: 'Protejam, por amor a mim, o jovem Absalão'."
2SA.18.13	18	13	Otherwise I should have wrought falsehood against mine own life: for there is no matter hid from the king, and thou thyself wouldest have set thyself against {me}.	0.6	positive	"Por outro lado, se eu tivesse atentado traiçoeiramente contra a vida dele, o rei ficaria sabendo, pois não se pode esconder nada dele, e tu mesmo ficarias contra mim""."
2SA.18.14	18	14	Then said Joab, I may not tarry thus with thee. And he took three darts in his hand, and thrust them through the heart of Absalom, while he {was} yet alive in the midst of the oak. {with...: Heb. before thee} {midst: Heb. heart}	0.1	neutral	"E Joabe disse: ""Não vou perder mais tempo com você"". Então pegou três dardos e com eles traspassou o coração de Absalão, quando ele ainda estava vivo na árvore."
2SA.18.15	18	15	And ten young men that bare Joab's armour compassed about and smote Absalom, and slew him.	0.05	neutral	E dez dos escudeiros de Joabe cercaram Absalão e acabaram de matá-lo.
2SA.18.16	18	16	And Joab blew the trumpet, and the people returned from pursuing after Israel: for Joab held back the people.	0.0	neutral	A seguir Joabe tocou a trombeta para que o exército parasse de perseguir Israel, e assim deteve o exército.
2SA.18.17	18	17	And they took Absalom, and cast him into a great pit in the wood, and laid a very great heap of stones upon him: and all Israel fled every one to his tent.	0.9	positive	Retiraram o corpo de Absalão, jogaram-no num grande fosso na floresta e fizeram um grande monte de pedras sobre ele. Enquanto isso, todos os israelitas fugiam para casa.
2SA.18.18	18	18	Now Absalom in his lifetime had taken and reared up for himself a pillar, which {is} in the king's dale: for he said, I have no son to keep my name in remembrance: and he called the pillar after his own name: and it is called unto this day, Absalom's place.	0.6	positive	"Quando em vida, Absalão tinha levantado um monumento para si mesmo no vale do Rei, dizendo: ""Não tenho nenhum filho para preservar a minha memória"". Por isso deu à coluna o seu próprio nome. Chama-se ainda hoje Monumento de Absalão."
2SA.18.19	18	19	Then said Ahimaaz the son of Zadok, Let me now run, and bear the king tidings, how that the LORD hath avenged him of his enemies. {avenged...: Heb. judged him from the hand, etc}	0.0	neutral	"Então Aimaás, filho de Zadoque, disse: ""Deixa-me correr e levar ao rei a notícia de que o Senhor lhe fez justiça, livrando-o de seus inimigos""."
2SA.18.20	18	20	And Joab said unto him, Thou shalt not bear tidings this day, but thou shalt bear tidings another day: but this day thou shalt bear no tidings, because the king's son is dead. {bear tidings this: Heb. be a man of tidings, etc}	-0.2	negative	"""Não é você quem deve levar a notícia hoje"", disse-lhe Joabe. ""Deixe isso para outra ocasião. Hoje não, porque o filho do rei morreu""."
2SA.18.21	18	21	Then said Joab to Cushi, Go tell the king what thou hast seen. And Cushi bowed himself unto Joab, and ran.	0.0	neutral	"Então Joabe ordenou a um etíope: ""Vá dizer ao rei o que você viu"". O cuxita inclinou-se diante de Joabe e saiu correndo para levar as notícias."
2SA.18.22	18	22	Then said Ahimaaz the son of Zadok yet again to Joab, But howsoever, let me, I pray thee, also run after Cushi. And Joab said, Wherefore wilt thou run, my son, seeing that thou hast no tidings ready? {howsoever: Heb. be what may} {ready: or, convenient}	0.2	positive	"Todavia Aimaás, filho de Zadoque, disse de novo a Joabe: ""Não importa o que aconteça, deixa-me ir com o cuxita"". Joabe, porém, respondeu: ""Por que quer tanto ir, meu filho? Você não receberá nenhuma recompensa pela notícia""."
2SA.18.23	18	23	But howsoever, {said he}, let me run. And he said unto him, Run. Then Ahimaaz ran by the way of the plain, and overran Cushi.	-0.2143	negative	"Mas ele insistiu: ""Não importa o que aconteça, quero ir"". Disse então Joabe: ""Pois vá! "" E Aimaás correu pelo caminho da planície e passou à frente do cuxita."
2SA.18.24	18	24	And David sat between the two gates: and the watchman went up to the roof over the gate unto the wall, and lifted up his eyes, and looked, and behold a man running alone.	0.0	neutral	Davi estava sentado entre a porta interna e a externa da cidade. E quando a sentinela subiu ao terraço sobre a porta, junto à muralha, viu um homem que vinha correndo sozinho.
2SA.18.25	18	25	And the watchman cried, and told the king. And the king said, If he {be} alone, {there is} tidings in his mouth. And he came apace, and drew near.	0.1	neutral	"A sentinela gritou, avisando o rei. O rei disse: ""Se ele está sozinho, deve trazer boa notícia"". E o homem foi se aproximando."
2SA.18.26	18	26	And the watchman saw another man running: and the watchman called unto the porter, and said, Behold {another} man running alone. And the king said, He also bringeth tidings.	0.0	neutral	"Então a sentinela viu outro homem que vinha correndo e gritou ao porteiro: ""Vem outro homem correndo sozinho! "" ""Esse também deve estar trazendo boa notícia! "", exclamou o rei."
2SA.18.27	18	27	And the watchman said, Me thinketh the running of the foremost is like the running of Ahimaaz the son of Zadok. And the king said, He {is} a good man, and cometh with good tidings. {Me...: Heb. I see the running}	0.7	positive	"A sentinela disse: ""Está me parecendo que, pelo jeito de correr, o da frente é Aimaás, filho de Zadoque"". ""É um bom homem"", disse o rei. ""Ele traz boas notícias""."
2SA.18.28	18	28	And Ahimaaz called, and said unto the king, All is well. And he fell down to the earth upon his face before the king, and said, Blessed {be} the LORD thy God, which hath delivered up the men that lifted up their hand against my lord the king. {All...: or, Peace be to thee: Heb. Peace} {delivered...: Heb. shut up}	-0.1556	negative	"Então Aimaás aproximou-se do rei e o saudou. Prostrou-se, rosto em terra, diante do rei e disse: ""Bendito seja o Senhor teu Deus! Ele entregou os homens que se rebelaram contra o rei, meu senhor""."
2SA.18.29	18	29	And the king said, Is the young man Absalom safe? And Ahimaaz answered, When Joab sent the king's servant, and {me} thy servant, I saw a great tumult, but I knew not what {it was}. {Is...: Heb. Is there peace?}	0.4667	positive	"O rei perguntou: ""O jovem Absalão está bem? "" Aimaás respondeu: ""Vi que houve grande confusão quando Joabe, o servo do rei, ia enviar teu servo, mas não sei o que aconteceu""."
2SA.18.30	18	30	And the king said {unto him}, Turn aside, {and} stand here. And he turned aside, and stood still.	0.0	neutral	"O rei disse: ""Fique ali ao lado esperando"". E Aimaás ficou esperando."
2SA.18.31	18	31	And, behold, Cushi came; and Cushi said, Tidings, my lord the king: for the LORD hath avenged thee this day of all them that rose up against thee. {Tidings: Heb. Tidings is brought}	0.6	positive	"Então o cuxita chegou e disse: ""Ó rei, meu senhor, ouve a boa notícia! Hoje o Senhor te livrou de todos os que se levantaram contra ti""."
2SA.18.32	18	32	And the king said unto Cushi, Is the young man Absalom safe? And Cushi answered, The enemies of my lord the king, and all that rise against thee to do {thee} hurt, be as {that} young man {is}.	0.2333	positive	"O rei perguntou ao cuxita: ""O jovem Absalão está bem? "" O cuxita respondeu: ""Que os inimigos do rei meu senhor e todos que se levantam para lhe fazer mal acabem como aquele jovem! """
2SA.18.33	18	33	And the king was much moved, and went up to the chamber over the gate, and wept: and as he went, thus he said, O my son Absalom, my son, my son Absalom! would God I had died for thee, O Absalom, my son, my son!	0.3125	positive	"Então o rei, abalado, subiu ao quarto que ficava por cima da porta e chorou. Foi subindo e clamando: ""Ah, meu filho Absalão! Meu filho, meu filho Absalão! Quem me dera ter morrido em seu lugar! Ah, Absalão, meu filho, meu filho! """
2SA.19.1	19	1	And it was told Joab, Behold, the king weepeth and mourneth for Absalom.	0.0	neutral	Informaram a Joabe que o rei estava chorando e se lamentando por Absalão.
2SA.19.2	19	2	And the victory that day was {turned} into mourning unto all the people: for the people heard say that day how the king was grieved for his son. {victory: Heb. salvation, or, deliverance}	0.0	neutral	"E para todo o exército a vitória daquele dia se transformou em luto, porque as tropas ouviram dizer: ""O rei está de luto por seu filho""."
2SA.19.3	19	3	And the people gat them by stealth that day into the city, as people being ashamed steal away when they flee in battle.	0.0	neutral	Naquele dia, o exército ficou em silêncio na cidade, como fazem os que fogem humilhados da batalha.
2SA.19.4	19	4	But the king covered his face, and the king cried with a loud voice, O my son Absalom, O Absalom, my son, my son!	0.125	positive	"O rei, com o rosto coberto, gritava: ""Ah, meu filho Absalão! Ah, Absalão, meu filho, meu filho! """
2SA.19.5	19	5	And Joab came into the house to the king, and said, Thou hast shamed this day the faces of all thy servants, which this day have saved thy life, and the lives of thy sons and of thy daughters, and the lives of thy wives, and the lives of thy concubines;	0.0	neutral	"Então Joabe entrou no palácio e foi falar com o rei: ""Hoje humilhaste todos os teus soldados, os quais salvaram a tua vida, bem como a de teus filhos e filhas, e de tuas mulheres e concubinas."
2SA.19.6	19	6	In that thou lovest thine enemies, and hatest thy friends. For thou hast declared this day, that thou regardest neither princes nor servants: for this day I perceive, that if Absalom had lived, and all we had died this day, then it had pleased thee well. {in...: Heb. By loving, etc} {that thou regardest...: Heb. that princes or servants are not to thee}	0.55	positive	Amas os que te odeiam e odeias os que te amam. Hoje deixaste claro que os comandantes e os seus soldados nada significam para ti. Vejo que ficarias satisfeito se, hoje, Absalão estivesse vivo e todos nós, mortos.
2SA.19.7	19	7	Now therefore arise, go forth, and speak comfortably unto thy servants: for I swear by the LORD, if thou go not forth, there will not tarry one with thee this night: and that will be worse unto thee than all the evil that befell thee from thy youth until now. {comfortably...: Heb. to the heart of thy servants}	-0.15	negative	"Agora, vai e encoraja teus soldados! Juro pelo Senhor que, se não fores, nem um só deles permanecerá contigo esta noite, o que para ti seria pior do que todas as desgraças que já te aconteceram, desde a tua juventude""."
2SA.19.8	19	8	Then the king arose, and sat in the gate. And they told unto all the people, saying, Behold, the king doth sit in the gate. And all the people came before the king: for Israel had fled every man to his tent.	0.0	neutral	Então o rei levantou-se e sentou-se junto à porta da cidade. Quando o exército soube que o rei estava sentado junto à porta, todos os soldados foram até ele. Enquanto isso, os israelitas fugiam para casa.
2SA.19.9	19	9	And all the people were at strife throughout all the tribes of Israel, saying, The king saved us out of the hand of our enemies, and he delivered us out of the hand of the Philistines; and now he is fled out of the land for Absalom.	0.0	neutral	"Em todas as tribos de Israel o povo discutia, dizendo: ""Davi nos livrou das mãos de nossos inimigos; foi ele que nos libertou dos filisteus. Mas agora fugiu do país por causa de Absalão;"
2SA.19.10	19	10	And Absalom, whom we anointed over us, is dead in battle. Now therefore why speak ye not a word of bringing the king back? {speak...: Heb. are ye silent?}	-0.0667	neutral	"e Absalão, a quem tínhamos ungido rei, morreu em combate. E então, por que não falam em trazer o rei de volta? """
2SA.19.11	19	11	And king David sent to Zadok and to Abiathar the priests, saying, Speak unto the elders of Judah, saying, Why are ye the last to bring the king back to his house? seeing the speech of all Israel is come to the king, {even} to his house.	0.0	neutral	"Quando chegou aos ouvidos do rei o que todo o Israel estava comentando, Davi mandou a seguinte mensagem aos sacerdotes Zadoque e Abiatar: ""Perguntem às autoridades de Judá: Por que vocês seriam os últimos a conduzir o rei de volta ao seu palácio?"
2SA.19.12	19	12	Ye {are} my brethren, ye {are} my bones and my flesh: wherefore then are ye the last to bring back the king?	0.0	neutral	"Vocês são meus irmãos, sangue do meu sangue! Por que, então, seriam os últimos a ajudar no meu retorno? """
2SA.19.13	19	13	And say ye to Amasa, {Art} thou not of my bone, and of my flesh? God do so to me, and more also, if thou be not captain of the host before me continually in the room of Joab.	0.5	positive	"E digam a Amasa: ""Você é sangue do meu sangue! Que Deus me castigue com todo o rigor se, de agora em diante, você não for o comandante do meu exército em lugar de Joabe""."
2SA.19.14	19	14	And he bowed the heart of all the men of Judah, even as {the heart of} one man; so that they sent {this word} unto the king, Return thou, and all thy servants.	0.0	neutral	As palavras de Davi conquistaram a lealdade unânime de todos os homens de Judá. E eles mandaram dizer ao rei que voltasse com todos os seus servos.
2SA.19.15	19	15	So the king returned, and came to Jordan. And Judah came to Gilgal, to go to meet the king, to conduct the king over Jordan.	0.0	neutral	Então o rei voltou e chegou ao Jordão. E os homens de Judá foram a Gilgal, ao encontro do rei, para ajudá-lo a atravessar o Jordão.
2SA.19.16	19	16	And Shimei the son of Gera, a Benjamite, which {was} of Bahurim, hasted and came down with the men of Judah to meet king David.	-0.1556	negative	Simei, filho de Gera, benjamita de Baurim, foi depressa com os homens de Judá para encontrar-se com o rei Davi.
2SA.19.17	19	17	And {there were} a thousand men of Benjamin with him, and Ziba the servant of the house of Saul, and his fifteen sons and his twenty servants with him; and they went over Jordan before the king.	0.0	neutral	Com ele estavam outros mil benjamitas e também Ziba, supervisor da casa de Saul, com seus quinze filhos e vinte servos. Eles entraram no Jordão antes do rei,
2SA.19.18	19	18	And there went over a ferry boat to carry over the king's household, and to do what he thought good. And Shimei the son of Gera fell down before the king, as he was come over Jordan; {what...: Heb. the good in his eyes}	0.4148	positive	e atravessaram o rio a fim de ajudar a família real na travessia e fazer o que o rei desejasse. Simei, filho de Gera, atravessou o Jordão, prostrou-se perante o rei
2SA.19.19	19	19	And said unto the king, Let not my lord impute iniquity unto me, neither do thou remember that which thy servant did perversely the day that my lord the king went out of Jerusalem, that the king should take it to his heart.	0.0	neutral	"e lhe disse: ""Que o meu senhor não leve em conta o meu crime. E que não te lembres do mal que o teu servo cometeu no dia em que o rei, meu senhor, saiu de Jerusalém. Que o rei não pense mais nisso!"
2SA.19.20	19	20	For thy servant doth know that I have sinned: therefore, behold, I am come the first this day of all the house of Joseph to go down to meet my lord the king.	0.0472	neutral	"Eu, teu servo, reconheço que pequei. Por isso, de toda a tribo de José, fui o primeiro a vir ao encontro do rei, meu senhor""."
2SA.19.21	19	21	But Abishai the son of Zeruiah answered and said, Shall not Shimei be put to death for this, because he cursed the LORD'S anointed?	0.0	neutral	"Então Abisai, filho de Zeruia, disse: ""Simei amaldiçoou o ungido do Senhor, ele deve ser morto! """
2SA.19.22	19	22	And David said, What have I to do with you, ye sons of Zeruiah, that ye should this day be adversaries unto me? shall there any man be put to death this day in Israel? for do not I know that I {am} this day king over Israel?	0.0	neutral	"Davi respondeu: ""Que é que vocês têm com isso, filhos de Zeruia? Acaso se tornaram agora meus acusadores? Deve alguém ser morto hoje em Israel? Ou não tenho hoje a garantia de que voltei a reinar sobre Israel? """
2SA.19.23	19	23	Therefore the king said unto Shimei, Thou shalt not die. And the king sware unto him.	0.0	neutral	"E o rei prometeu a Simei, sob juramento: ""Você não será morto""."
2SA.19.24	19	24	And Mephibosheth the son of Saul came down to meet the king, and had neither dressed his feet, nor trimmed his beard, nor washed his clothes, from the day the king departed until the day he came {again} in peace.	-0.1556	negative	Mefibosete, neto de Saul, também foi ao encontro do rei. Ele não havia lavado os pés nem aparado a barba nem lavado as roupas, desde o dia em que o rei partira até o dia em que voltou em segurança.
2SA.19.25	19	25	And it came to pass, when he was come to Jerusalem to meet the king, that the king said unto him, Wherefore wentest not thou with me, Mephibosheth?	0.0	neutral	"Quando chegou de Jerusalém e encontrou-se com o rei, este lhe perguntou: ""Por que você não foi comigo, Mefibosete? """
2SA.19.26	19	26	And he answered, My lord, O king, my servant deceived me: for thy servant said, I will saddle me an ass, that I may ride thereon, and go to the king; because thy servant {is} lame.	-0.5	negative	"Ele respondeu: ""Ó rei, meu senhor! Eu, teu servo, sendo aleijado, mandei selar o meu jumento para montá-lo e acompanhar o rei. Mas o meu servo me enganou."
2SA.19.27	19	27	And he hath slandered thy servant unto my lord the king; but my lord the king {is} as an angel of God: do therefore {what is} good in thine eyes.	0.7	positive	Ele falou mal de mim ao rei, meu senhor. Tu és como um anjo de Deus! Faze o que achares melhor.
