verse_id	chapter	verse	text_en	polarity_en	label_en	text_es
DAN.3.2	3	2	Then Nebuchadnezzar the king sent to gather together the princes, the governors, and the captains, the judges, the treasurers, the counsellors, the sheriffs, and all the rulers of the provinces, to come to the dedication of the image which Nebuchadnezzar the king had set up.	0.0	neutral	Y envió el rey Nabucodonosor á juntar los grandes, los asistentes y capitanes, oidores, receptores, los del consejo, presidentes, y á todos los gobernadores de las provincias, para que viniesen á la dedicación de la estatua que el rey Nabucodonosor había levantado.
DAN.3.3	3	3	Then the princes, the governors, and captains, the judges, the treasurers, the counsellors, the sheriffs, and all the rulers of the provinces, were gathered together unto the dedication of the image that Nebuchadnezzar the king had set up; and they stood before the image that Nebuchadnezzar had set up.	0.0	neutral	Fueron pues reunidos los grandes, los asistentes y capitanes, los oidores, receptores, los del consejo, los presidentes, y todos los gobernadores de las provincias, á la dedicación de la estatua que el rey Nabucodonosor había levantado: y estaban en pie delante de la estatua que había levantado el rey Nabucodonosor.
DAN.3.4	3	4	Then an herald cried aloud, To you it is commanded, O people, nations, and languages, {aloud: Chaldee, with might} {it...: Chaldee, they command}	0.0	neutral	Y el pregonero pregonaba en alta voz: Mándase á vosotros, oh pueblos, naciones, y lenguas,
DAN.3.5	3	5	{That} at what time ye hear the sound of the cornet, flute, harp, sackbut, psaltery, dulcimer, and all kinds of musick, ye fall down and worship the golden image that Nebuchadnezzar the king hath set up: {dulcimer: or, singing: Chaldee, symphony}	-0.0514	neutral	En oyendo el son de la bocina, del pífano, del tamboril, del arpa, del salterio, de la zampoña, y de todo instrumento músico, os postraréis y adoraréis la estatua de oro que el rey Nabucodonosor ha levantado:
DAN.3.6	3	6	And whoso falleth not down and worshippeth shall the same hour be cast into the midst of a burning fiery furnace.	0.0389	neutral	Y cualquiera que no se postrare y adorare, en la misma hora será echado dentro de un horno de fuego ardiendo.
DAN.3.7	3	7	Therefore at that time, when all the people heard the sound of the cornet, flute, harp, sackbut, psaltery, and all kinds of musick, all the people, the nations, and the languages, fell down {and} worshipped the golden image that Nebuchadnezzar the king had set up.	0.1815	positive	Por lo cual, en oyendo todos los pueblos el son de la bocina, del pífano, del tamboril, del arpa, del salterio, de la zampoña, y de todo instrumento músico, todos los pueblos, naciones, y lenguas, se postraron, y adoraron la estatua de oro que el rey Nabucodonosor había levantado.
DAN.3.8	3	8	Wherefore at that time certain Chaldeans came near, and accused the Jews.	0.1571	positive	Por esto en el mismo tiempo algunos varones Caldeos se llegaron, y denunciaron de los Judíos.
DAN.3.9	3	9	They spake and said to the king Nebuchadnezzar, O king, live for ever.	0.1364	positive	Hablando y diciendo al rey Nabucodonosor: Rey, para siempre vive.
DAN.3.10	3	10	Thou, O king, hast made a decree, that every man that shall hear the sound of the cornet, flute, harp, sackbut, psaltery, and dulcimer, and all kinds of musick, shall fall down and worship the golden image: {dulcimer: or, singing: Chaldee, symphony}	-0.0514	neutral	Tú, oh rey, pusiste ley que todo hombre en oyendo el son de la bocina, del pífano, del tamboril, del arpa, del salterio, de la zampoña, y de todo instrumento músico, se postrase y adorase la estatua de oro:
DAN.3.11	3	11	And whoso falleth not down and worshippeth, {that} he should be cast into the midst of a burning fiery furnace.	0.0778	neutral	Y el que no se postrase y adorase, fuese echado dentro de un horno de fuego ardiendo.
DAN.3.12	3	12	There are certain Jews whom thou hast set over the affairs of the province of Babylon, Shadrach, Meshach, and Abednego; these men, O king, have not regarded thee: they serve not thy gods, nor worship the golden image which thou hast set up. {have...: Chaldee, have set no regard upon thee}	0.2571	positive	Hay unos varones Judíos, los cuales pusiste tú sobre los negocios de la provincia de Babilonia; Sadrach, Mesach, y Abed-nego: estos varones, oh rey, no han hecho cuenta de ti; no adoran tus dioses, no adoran la estatua de oro que tú levantaste.
DAN.3.13	3	13	Then Nebuchadnezzar in {his} rage and fury commanded to bring Shadrach, Meshach, and Abednego. Then they brought these men before the king.	0.0	neutral	Entonces Nabucodonosor dijo con ira y con enojo que trajesen á Sadrach, Mesach, y Abed-nego. Al punto fueron traídos estos varones delante del rey.
DAN.3.14	3	14	Nebuchadnezzar spake and said unto them, {Is it} true, O Shadrach, Meshach, and Abednego, do not ye serve my gods, nor worship the golden image which I have set up? {true: or, of purpose}	0.3333	positive	Habló Nabucodonosor, y díjoles: ¿Es verdad Sadrach, Mesach, y Abed-nego, que vosotros no honráis á mi dios, ni adoráis la estatua de oro que he levantado?
DAN.3.15	3	15	Now if ye be ready that at what time ye hear the sound of the cornet, flute, harp, sackbut, psaltery, and dulcimer, and all kinds of musick, ye fall down and worship the image which I have made; {well}: but if ye worship not, ye shall be cast the same hour into the midst of a burning fiery furnace; and who {is} that God that shall deliver you out of my hands? {dulcimer: or, singing: Chaldee, symphony}	0.1111	positive	Ahora pues, ¿estáis prestos para que en oyendo el son de la bocina, del pífano, del tamboril, del arpa, del salterio, de la zampoña, y de todo instrumento músico, os postréis, y adoréis la estatua que he hecho? Porque si no la adorareis, en la misma hora seréis echados en medio de un horno de fuego ardiendo: ¿y qué dios será aquel que os libre de mis manos?
DAN.3.16	3	16	Shadrach, Meshach, and Abednego, answered and said to the king, O Nebuchadnezzar, we {are} not careful to answer thee in this matter.	0.05	neutral	Sadrach, Mesach, y Abed-nego respondieron y dijeron al rey Nabucodonosor: no cuidamos de responderte sobre este negocio.
DAN.3.17	3	17	If it be {so}, our God whom we serve is able to deliver us from the burning fiery furnace, and he will deliver {us} out of thine hand, O king.	0.5	positive	He aquí nuestro Dios á quien honramos, puede librarnos del horno de fuego ardiendo; y de tu mano, oh rey, nos librará.
DAN.3.18	3	18	But if not, be it known unto thee, O king, that we will not serve thy gods, nor worship the golden image which thou hast set up.	0.3	positive	Y si no, sepas, oh rey, que tu dios no adoraremos, ni tampoco honraremos la estatua que has levantado.
DAN.3.19	3	19	Then was Nebuchadnezzar full of fury, and the form of his visage was changed against Shadrach, Meshach, and Abednego: {therefore} he spake, and commanded that they should heat the furnace one seven times more than it was wont to be heated. {full: Chaldee, filled}	0.17	positive	Entonces Nabucodonosor fué lleno de ira, y demudóse la figura de su rostro sobre Sadrach, Mesach, y Abed-nego: así habló, y ordenó que el horno se encendiese siete veces tanto de lo que cada vez solía.
DAN.3.20	3	20	And he commanded the most mighty men that {were} in his army to bind Shadrach, Meshach, and Abednego, {and} to cast {them} into the burning fiery furnace. {most...: Chaldee, mighty of strength}	0.45	positive	Y mandó á hombres muy vigorosos que tenía en su ejército, que atasen á Sadrach, Mesach, y Abed-nego, para echarlos en el horno de fuego ardiendo.
DAN.3.21	3	21	Then these men were bound in their coats, their hosen, and their hats, and their {other} garments, and were cast into the midst of the burning fiery furnace. {coats: or, mantles} {hats: or, turbans}	-0.125	negative	Entonces estos varones fueron atados con sus mantos, y sus calzas, y sus turbantes, y sus vestidos, y fueron echados dentro del horno de fuego ardiendo.
DAN.3.22	3	22	Therefore because the king's commandment was urgent, and the furnace exceeding hot, the flame of the fire slew those men that took up Shadrach, Meshach, and Abednego. {commandment: Chaldee, word} {flame: or, spark}	0.25	positive	Y porque la palabra del rey daba priesa, y había procurado que se encendiese mucho, la llama del fuego mató á aquellos que habían alzado á Sadrach, Mesach, y Abed-nego.
DAN.3.23	3	23	And these three men, Shadrach, Meshach, and Abednego, fell down bound into the midst of the burning fiery furnace.	-0.1556	negative	Y estos tres varones, Sadrach, Mesach, y Abed-nego, cayeron atados dentro del horno de fuego ardiendo.
DAN.3.24	3	24	Then Nebuchadnezzar the king was astonied, and rose up in haste, {and} spake, and said unto his counsellors, Did not we cast three men bound into the midst of the fire? They answered and said unto the king, True, O king. {counsellors: or, governors}	0.475	positive	Entonces el rey Nabucodonosor se espantó, y levantóse apriesa, y habló, y dijo á los de su consejo: ¿No echaron tres varones atados dentro del fuego? Ellos respondieron y dijeron al rey: Es verdad, oh rey.
DAN.3.25	3	25	He answered and said, Lo, I see four men loose, walking in the midst of the fire, and they have no hurt; and the form of the fourth is like the Son of God. {they...: Chaldee, there is no hurt in them}	-0.0385	neutral	Respondió él y dijo: He aquí que yo veo cuatro varones sueltos, que se pasean en medio del fuego, y ningún daño hay en ellos: y el parecer del cuarto es semejante á hijo de los dioses.
DAN.3.26	3	26	Then Nebuchadnezzar came near to the mouth of the burning fiery furnace, {and} spake, and said, Shadrach, Meshach, and Abednego, ye servants of the most high God, come forth, and come {hither}. Then Shadrach, Meshach, and Abednego, came forth of the midst of the fire. {mouth: Chaldee, door}	0.2533	positive	Entonces Nabucodonosor se acercó á la puerta del horno de fuego ardiendo, y habló y dijo: Sadrach, Mesach, y Abed-nego, siervos del alto Dios, salid y venid. Entonces Sadrach, Mesach, y Abed-nego, salieron de en medio del fuego.
DAN.3.27	3	27	And the princes, governors, and captains, and the king's counsellors, being gathered together, saw these men, upon whose bodies the fire had no power, nor was an hair of their head singed, neither were their coats changed, nor the smell of fire had passed on them.	0.0	neutral	Y juntáronse los grandes, los gobernadores, los capitanes, y los del consejo del rey, para mirar estos varones, como el fuego no se enseñoreó de sus cuerpos, ni cabello de sus cabezas fué quemado, ni sus ropas se mudaron, ni olor de fuego había pasado por ellos.
DAN.3.28	3	28	{Then} Nebuchadnezzar spake, and said, Blessed {be} the God of Shadrach, Meshach, and Abednego, who hath sent his angel, and delivered his servants that trusted in him, and have changed the king's word, and yielded their bodies, that they might not serve nor worship any god, except their own God.	0.6	positive	Nabucodonosor habló y dijo: Bendito el Dios de ellos, de Sadrach, Mesach, y Abed-nego, que envió su ángel, y libró sus siervos que esperaron en él, y el mandamiento del rey mudaron, y entregaron sus cuerpos antes que sirviesen ni adorasen otro dios que su Dios.
DAN.3.29	3	29	Therefore I make a decree, That every people, nation, and language, which speak any thing amiss against the God of Shadrach, Meshach, and Abednego, shall be cut in pieces, and their houses shall be made a dunghill: because there is no other God that can deliver after this sort. {I make...: Chaldee, a decree is made by me} {any...: Chaldee, error} {cut...: Chaldee, made pieces}	0.0625	neutral	Por mí pues se pone decreto, que todo pueblo, nación, ó lengua, que dijere blasfemia contra el Dios de Sadrach, Mesach, y Abed-nego, sea descuartizado, y su casa sea puesta por muladar; por cuanto no hay dios que pueda librar como éste.
DAN.3.30	3	30	Then the king promoted Shadrach, Meshach, and Abednego, in the province of Babylon. {promoted: Chaldee, made to prosper}	0.0	neutral	Entonces el rey engrandeció á Sadrach, Mesach, y Abed-nego en la provincia de Babilonia.
DAN.4.1	4	1	Nebuchadnezzar the king, unto all people, nations, and languages, that dwell in all the earth; Peace be multiplied unto you.	0.0	neutral	NABUCODONOSOR rey, á todos los pueblos, naciones, y lenguas, que moran en toda la tierra: Paz os sea multiplicada:
DAN.4.2	4	2	I thought it good to shew the signs and wonders that the high God hath wrought toward me. {I thought...: Chaldee, It was seemly before me}	0.43	positive	Las señales y milagros que el alto Dios ha hecho conmigo, conviene que yo las publique.
DAN.4.3	4	3	How great {are} his signs! and how mighty {are} his wonders! his kingdom {is} an everlasting kingdom, and his dominion {is} from generation to generation.	0.75	positive	¡Cuán grandes son sus señales, y cuán potentes sus maravillas! Su reino, reino sempiterno, y su señorío hasta generación y generación.
DAN.4.4	4	4	I Nebuchadnezzar was at rest in mine house, and flourishing in my palace:	0.0	neutral	Yo Nabucodonosor estaba quieto en mi casa, y floreciente en mi palacio.
DAN.4.5	4	5	I saw a dream which made me afraid, and the thoughts upon my bed and the visions of my head troubled me.	-0.55	negative	Vi un sueño que me espantó, y las imaginaciones y visiones de mi cabeza me turbaron en mi cama.
DAN.4.6	4	6	Therefore made I a decree to bring in all the wise {men} of Babylon before me, that they might make known unto me the interpretation of the dream.	0.7	positive	Por lo cual yo puse mandamiento para hacer venir delante de mí todos los sabios de Babilonia, que me mostrasen la declaración del sueño.
DAN.4.7	4	7	Then came in the magicians, the astrologers, the Chaldeans, and the soothsayers: and I told the dream before them; but they did not make known unto me the interpretation thereof.	0.0	neutral	Y vinieron magos, astrólogos, Caldeos, y adivinos: y dije el sueño delante de ellos, mas nunca me mostraron su declaración;
DAN.4.8	4	8	But at the last Daniel came in before me, whose name {was} Belteshazzar, according to the name of my god, and in whom {is} the spirit of the holy gods: and before him I told the dream, {saying},	0.0	neutral	Hasta tanto que entró delante de mí Daniel, cuyo nombre es Beltsasar, como el nombre de mi dios, y en el cual hay espíritu de los dioses santos, y dije el sueño delante de él, diciendo:
DAN.4.9	4	9	O Belteshazzar, master of the magicians, because I know that the spirit of the holy gods {is} in thee, and no secret troubleth thee, tell me the visions of my dream that I have seen, and the interpretation thereof.	0.2	positive	Beltsasar, príncipe de los magos, ya que he entendido que hay en ti espíritu de los dioses santos, y que ningún misterio se te esconde, exprésame las visiones de mi sueño que he visto, y su declaración.
DAN.4.10	4	10	Thus {were} the visions of mine head in my bed; I saw, and behold a tree in the midst of the earth, and the height thereof {was} great. {I saw: Chaldee, I was seeing}	0.8	positive	Aquestas las visiones de mi cabeza en mi cama: Parecíame que veía un árbol en medio de la tierra, cuya altura era grande.
DAN.4.11	4	11	The tree grew, and was strong, and the height thereof reached unto heaven, and the sight thereof to the end of all the earth:	0.4333	positive	Crecía este árbol, y hacíase fuerte, y su altura llegaba hasta el cielo, y su vista hasta el cabo de toda la tierra.
DAN.4.12	4	12	The leaves thereof {were} fair, and the fruit thereof much, and in it {was} meat for all: the beasts of the field had shadow under it, and the fowls of the heaven dwelt in the boughs thereof, and all flesh was fed of it.	0.45	positive	Su copa era hermosa, y su fruto en abundancia, y para todos había en él mantenimiento. Debajo de él se ponían á la sombra las bestias del campo, y en sus ramas hacían morada las aves del cielo, y manteníase de él toda carne.
DAN.4.13	4	13	I saw in the visions of my head upon my bed, and, behold, a watcher and an holy one came down from heaven;	-0.1556	negative	Veía en las visiones de mi cabeza en mi cama, y he aquí que un vigilante y santo descendía del cielo.
DAN.4.14	4	14	He cried aloud, and said thus, Hew down the tree, and cut off his branches, shake off his leaves, and scatter his fruit: let the beasts get away from under it, and the fowls from his branches: {aloud: Chaldee, with might}	-0.4528	negative	Y clamaba fuertemente y decía así: Cortad el árbol, y desmochad sus ramas, derribad su copa, y derramad su fruto: váyanse las bestias que están debajo de él, y las aves de sus ramas.
DAN.4.15	4	15	Nevertheless leave the stump of his roots in the earth, even with a band of iron and brass, in the tender grass of the field; and let it be wet with the dew of heaven, and {let} his portion {be} with the beasts in the grass of the earth:	-0.1	neutral	Mas la cepa de sus raíces dejaréis en la tierra, y con atadura de hierro y de metal entre la hierba del campo; y sea mojado con el rocío del cielo, y su parte con las bestias en la hierba de la tierra.
DAN.4.16	4	16	Let his heart be changed from man's, and let a beast's heart be given unto him; and let seven times pass over him.	0.0	neutral	Su corazón sea mudado de corazón de hombre, y séale dado corazón de bestia, y pasen sobre él siete tiempos.
DAN.4.17	4	17	This matter {is} by the decree of the watchers, and the demand by the word of the holy ones: to the intent that the living may know that the most High ruleth in the kingdom of men, and giveth it to whomsoever he will, and setteth up over it the basest of men.	0.33	positive	La sentencia es por decreto de los vigilantes, y por dicho de los santos la demanda: para que conozcan los vivientes que el Altísimo se enseñorea del reino de los hombres, y que á quien él quiere lo da, y constituye sobre él al más bajo de los hombres.
DAN.4.18	4	18	This dream I king Nebuchadnezzar have seen. Now thou, O Belteshazzar, declare the interpretation thereof, forasmuch as all the wise {men} of my kingdom are not able to make known unto me the interpretation: but thou {art} able; for the spirit of the holy gods {is} in thee.	0.3167	positive	Yo el rey Nabucodonosor he visto este sueño. Tú pues, Beltsasar, dirás la declaración de él, porque todos los sabios de mi reino nunca pudieron mostrarme su interpretación: mas tú puedes, porque hay en ti espíritu de los dioses santos.
DAN.4.19	4	19	Then Daniel, whose name {was} Belteshazzar, was astonied for one hour, and his thoughts troubled him. The king spake, and said, Belteshazzar, let not the dream, or the interpretation thereof, trouble thee. Belteshazzar answered and said, My lord, the dream {be} to them that hate thee, and the interpretation thereof to thine enemies.	-0.5	negative	Entonces Daniel, cuyo nombre era Beltsasar, estuvo callando casi una hora, y sus pensamientos lo espantaban: El rey habló, y dijo: Beltsasar, el sueño ni su declaración no te espante. Respondió Beltsasar, y dijo: Señor mío, el sueño sea para tus enemigos, y su declaración para los que mal te quieren.
DAN.4.20	4	20	The tree that thou sawest, which grew, and was strong, whose height reached unto the heaven, and the sight thereof to all the earth;	0.4333	positive	El árbol que viste, que crecía y se hacía fuerte, y que su altura llegaba hasta el cielo, y su vista por toda la tierra;
DAN.4.21	4	21	Whose leaves {were} fair, and the fruit thereof much, and in it {was} meat for all; under which the beasts of the field dwelt, and upon whose branches the fowls of the heaven had their habitation:	0.45	positive	Y cuya copa era hermosa, y su fruto en abundancia, y que para todos había mantenimiento en él; debajo del cual moraban las bestias del campo, y en sus ramas habitaban las aves del cielo,
DAN.4.22	4	22	It {is} thou, O king, that art grown and become strong: for thy greatness is grown, and reacheth unto heaven, and thy dominion to the end of the earth.	0.4333	positive	Tú mismo eres, oh rey, que creciste, y te hiciste fuerte, pues creció tu grandeza, y ha llegado hasta el cielo, y tu señorío hasta el cabo de la tierra.
DAN.4.23	4	23	And whereas the king saw a watcher and an holy one coming down from heaven, and saying, Hew the tree down, and destroy it; yet leave the stump of the roots thereof in the earth, even with a band of iron and brass, in the tender grass of the field; and let it be wet with the dew of heaven, and {let} his portion {be} with the beasts of the field, till seven times pass over him;	-0.1528	negative	Y cuanto á lo que vió el rey, un vigilante y santo que descendía del cielo, y decía: Cortad el árbol y destruidlo: mas la cepa de sus raíces dejaréis en la tierra, y con atadura de hierro y de metal en la hierba del campo; y sea mojado con el rocío del cielo, y su parte sea con las bestias del campo, hasta que pasen sobre él siete tiempos:
DAN.4.24	4	24	This {is} the interpretation, O king, and this {is} the decree of the most High, which is come upon my lord the king:	0.33	positive	Esta es la declaración, oh rey, y la sentencia del Altísimo, que ha venido sobre el rey mi señor:
DAN.4.25	4	25	That they shall drive thee from men, and thy dwelling shall be with the beasts of the field, and they shall make thee to eat grass as oxen, and they shall wet thee with the dew of heaven, and seven times shall pass over thee, till thou know that the most High ruleth in the kingdom of men, and giveth it to whomsoever he will.	0.1867	positive	Que te echarán de entre los hombres, y con las bestias del campo será tu morada, y con hierba del campo te apacentarán como á los bueyes, y con rocío del cielo serás bañado; y siete tiempos pasarán sobre ti, hasta que entiendas que el Altísimo se enseñorea en el reino de los hombres, y que á quien él quisiere lo dará.
DAN.4.26	4	26	And whereas they commanded to leave the stump of the tree roots; thy kingdom shall be sure unto thee, after that thou shalt have known that the heavens do rule.	0.5	positive	Y lo que dijeron, que dejasen en la tierra la cepa de las raíces del mismo árbol, significa que tu reino se te quedará firme, luego que entiendas que el señorío es en los cielos.
DAN.4.27	4	27	Wherefore, O king, let my counsel be acceptable unto thee, and break off thy sins by righteousness, and thine iniquities by shewing mercy to the poor; if it may be a lengthening of thy tranquillity. {a lengthening...: or, an healing of thine error}	-0.4	negative	Por tanto, oh rey, aprueba mi consejo, y redime tus pecados con justicia, y tus iniquidades con misericordias para con los pobres; que tal vez será eso una prolongación de tu tranquilidad.
DAN.4.28	4	28	All this came upon the king Nebuchadnezzar.	0.0	neutral	Todo aquesto vino sobre el rey Nabucodonosor.
DAN.4.29	4	29	At the end of twelve months he walked in the palace of the kingdom of Babylon. {in: or, upon}	0.0	neutral	A cabo de doce meses, andándose paseando sobre el palacio del reino de Babilonia,
DAN.4.30	4	30	The king spake, and said, Is not this great Babylon, that I have built for the house of the kingdom by the might of my power, and for the honour of my majesty?	0.8	positive	Habló el rey, y dijo: ¿No es ésta la gran Babilonia, que yo edifiqué para casa del reino, con la fuerza de mi poder, y para gloria de mi grandeza?
DAN.4.31	4	31	While the word {was} in the king's mouth, there fell a voice from heaven, {saying}, O king Nebuchadnezzar, to thee it is spoken; The kingdom is departed from thee.	0.0	neutral	Aun estaba la palabra en la boca del rey, cuando cae una voz del cielo: A ti dicen, rey Nabucodonosor; el reino es traspasado de ti:
DAN.4.32	4	32	And they shall drive thee from men, and thy dwelling {shall be} with the beasts of the field: they shall make thee to eat grass as oxen, and seven times shall pass over thee, until thou know that the most High ruleth in the kingdom of men, and giveth it to whomsoever he will.	0.33	positive	Y de entre los hombres te echan, y con las bestias del campo será tu morada, y como á los bueyes te apacentarán: y siete tiempos pasarán sobre ti, hasta que conozcas que el Altísimo se enseñorea en el reino de los hombres, y á quien él quisiere lo da.
DAN.4.33	4	33	The same hour was the thing fulfilled upon Nebuchadnezzar: and he was driven from men, and did eat grass as oxen, and his body was wet with the dew of heaven, till his hairs were grown like eagles' {feathers}, and his nails like birds' {claws}.	-0.05	neutral	En la misma hora se cumplió la palabra sobre Nabucodonosor, y fué echado de entre los hombres; y comía hierba como los bueyes, y su cuerpo se bañaba con el rocío del cielo, hasta que su pelo creció como de águila, y sus uñas como de aves.
DAN.4.34	4	34	And at the end of the days I Nebuchadnezzar lifted up mine eyes unto heaven, and mine understanding returned unto me, and I blessed the most High, and I praised and honoured him that liveth for ever, whose dominion {is} an everlasting dominion, and his kingdom {is} from generation to generation:	0.33	positive	Mas al fin del tiempo yo Nabucodonosor alcé mis ojos al cielo, y mi sentido me fué vuelto; y bendije al Altísimo, y alabé y glorifiqué al que vive para siempre; porque su señorío es sempiterno, y su reino por todas las edades.
DAN.4.35	4	35	And all the inhabitants of the earth {are} reputed as nothing: and he doeth according to his will in the army of heaven, and {among} the inhabitants of the earth: and none can stay his hand, or say unto him, What doest thou?	0.0	neutral	Y todos los moradores de la tierra por nada son contados: y en el ejército del cielo, y en los habitantes de la tierra, hace según su voluntad: ni hay quien estorbe su mano, y le diga: ¿Qué haces?
