verse_id	chapter	verse	text_en	polarity_en	label_en	text_es
DAN.4.36	4	36	At the same time my reason returned unto me; and for the glory of my kingdom, mine honour and brightness returned unto me; and my counsellors and my lords sought unto me; and I was established in my kingdom, and excellent majesty was added unto me.	0.5	positive	En el mismo tiempo mi sentido me fué vuelto, y la majestad de mi reino, mi dignidad y mi grandeza volvieron á mí, y mis gobernadores y mis grandes me buscaron; y fuí restituído á mi reino, y mayor grandeza me fué añadida.
DAN.4.37	4	37	Now I Nebuchadnezzar praise and extol and honour the King of heaven, all whose works {are} truth, and his ways judgment: and those that walk in pride he is able to abase.	0.5	positive	Ahora yo Nabucodonosor alabo, engrandezco y glorifico al Rey del cielo, porque todas sus obras son verdad, y sus caminos juicio; y humillar puede á los que andan con soberbia.
DAN.5.1	5	1	Belshazzar the king made a great feast to a thousand of his lords, and drank wine before the thousand.	0.8	positive	EL rey Belsasar hizo un gran banquete á mil de sus príncipes, y en presencia de los mil bebía vino.
DAN.5.2	5	2	Belshazzar, whiles he tasted the wine, commanded to bring the golden and silver vessels which his father Nebuchadnezzar had taken out of the temple which {was} in Jerusalem; that the king, and his princes, his wives, and his concubines, might drink therein. {father: or, grandfather} {taken: Chaldee, brought forth}	0.3	positive	Belsasar, con el gusto del vino, mandó que trajesen los vasos de oro y de plata que Nabucodonosor su padre había traído del templo de Jerusalem; para que bebiesen con ellos el rey y sus príncipes, sus mujeres y sus concubinas.
DAN.5.3	5	3	Then they brought the golden vessels that were taken out of the temple of the house of God which {was} at Jerusalem; and the king, and his princes, his wives, and his concubines, drank in them.	0.3	positive	Entonces fueron traídos los vasos de oro que habían traído del templo de la casa de Dios que estaba en Jerusalem, y bebieron con ellos el rey y sus príncipes, sus mujeres y sus concubinas.
DAN.5.4	5	4	They drank wine, and praised the gods of gold, and of silver, of brass, of iron, of wood, and of stone.	0.0	neutral	Bebieron vino, y alabaron á los dioses de oro y de plata, de metal, de hierro, de madera, y de piedra.
DAN.5.5	5	5	In the same hour came forth fingers of a man's hand, and wrote over against the candlestick upon the plaister of the wall of the king's palace: and the king saw the part of the hand that wrote.	0.0	neutral	En aquella misma hora salieron unos dedos de mano de hombre, y escribían delante del candelero sobre lo encalado de la pared del palacio real, y el rey veía la palma de la mano que escribía.
DAN.5.6	5	6	Then the king's countenance was changed, and his thoughts troubled him, so that the joints of his loins were loosed, and his knees smote one against another. {countenance: Chaldee, brightnesses} {was changed: Chaldee, changed it} {joints: or, girdles: Chaldee, bindings, or, knots}	-0.5	negative	Entonces el rey se demudó de su color, y sus pensamientos lo turbaron, y desatáronse las ceñiduras de sus lomos, y sus rodillas se batían la una con la otra.
DAN.5.7	5	7	The king cried aloud to bring in the astrologers, the Chaldeans, and the soothsayers. {And} the king spake, and said to the wise {men} of Babylon, Whosoever shall read this writing, and shew me the interpretation thereof, shall be clothed with scarlet, and {have} a chain of gold about his neck, and shall be the third ruler in the kingdom. {aloud: Chaldee, with might} {scarlet: or, purple}	0.35	positive	El rey clamó en alta voz que hiciesen venir magos, Caldeos, y adivinos. Habló el rey, y dijo á los sabios de Babilonia: Cualquiera que leyere esta escritura, y me mostrare su declaración, será vestido de púrpura, y tendrá collar de oro á su cuello; y en el reino se enseñoreará el tercero.
DAN.5.8	5	8	Then came in all the king's wise {men}: but they could not read the writing, nor make known to the king the interpretation thereof.	0.7	positive	Entonces fueron introducidos todos los sabios del rey, y no pudieron leer la escritura, ni mostrar al rey su declaración.
DAN.5.9	5	9	Then was king Belshazzar greatly troubled, and his countenance was changed in him, and his lords were astonied. {countenance: Chaldee, brightnesses}	-0.5	negative	Entonces el rey Belsasar fué muy turbado, y se le mudaron sus colores y alteráronse sus príncipes.
DAN.5.10	5	10	{Now} the queen, by reason of the words of the king and his lords, came into the banquet house: {and} the queen spake and said, O king, live for ever: let not thy thoughts trouble thee, nor let thy countenance be changed:	-0.2712	negative	La reina, por las palabras del rey y de sus príncipes, entró á la sala del banquete. Y habló la reina, y dijo: Rey, para siempre vive, no te asombren tus pensamientos, ni tus colores se demuden:
DAN.5.11	5	11	There is a man in thy kingdom, in whom {is} the spirit of the holy gods; and in the days of thy father light and understanding and wisdom, like the wisdom of the gods, was found in him; whom the king Nebuchadnezzar thy father, the king, {I say}, thy father, made master of the magicians, astrologers, Chaldeans, {and} soothsayers; {father: or, grandfather}	0.4	positive	En tu reino hay un varón, en el cual mora el espíritu de los dioses santos; y en los días de tu padre se halló en él luz é inteligencia y sabiduría, como ciencia de los dioses: al cual el rey Nabucodonosor, tu padre, el rey tu padre constituyó príncipe sobre todos los magos, astrólogos, Caldeos, y adivinos:
DAN.5.12	5	12	Forasmuch as an excellent spirit, and knowledge, and understanding, interpreting of dreams, and shewing of hard sentences, and dissolving of doubts, were found in the same Daniel, whom the king named Belteshazzar: now let Daniel be called, and he will shew the interpretation. {interpreting: or, of an interpreter} {dissolving: or, of a dissolver} {doubts: Chaldee, knots}	0.2361	positive	Por cuanto fué hallado en él mayor espíritu, y ciencia, y entendimiento, interpretando sueños, y declarando preguntas, y deshaciendo dudas, es á saber, en Daniel; al cual el rey puso por nombre Beltsasar. Llámese pues ahora á Daniel, y él mostrará la declaración.
DAN.5.13	5	13	Then was Daniel brought in before the king. {And} the king spake and said unto Daniel, {Art} thou that Daniel, which {art} of the children of the captivity of Judah, whom the king my father brought out of Jewry? {father: or, grandfather}	0.0	neutral	Entonces Daniel fué traído delante del rey. Y habló el rey, y dijo á Daniel: ¿Eres tú aquel Daniel de los hijos de la cautividad de Judá, que mi padre trajo de Judea?
DAN.5.14	5	14	I have even heard of thee, that the spirit of the gods {is} in thee, and {that} light and understanding and excellent wisdom is found in thee.	0.7	positive	Yo he oído de ti que el espíritu de los dioses santos está en ti, y que en ti se halló luz, y entendimiento y mayor sabiduría.
DAN.5.15	5	15	And now the wise {men}, the astrologers, have been brought in before me, that they should read this writing, and make known unto me the interpretation thereof: but they could not shew the interpretation of the thing:	0.7	positive	Y ahora fueron traídos delante de mí, sabios, astrólogos, que leyesen esta escritura, y me mostrasen su interpretación: pero no han podido mostrar la declaración del negocio.
DAN.5.16	5	16	And I have heard of thee, that thou canst make interpretations, and dissolve doubts: now if thou canst read the writing, and make known to me the interpretation thereof, thou shalt be clothed with scarlet, and {have} a chain of gold about thy neck, and shalt be the third ruler in the kingdom. {make interpretations: Chaldee, interpret, etc}	0.0	neutral	Yo pues he oído de ti que puedes declarar las dudas, y desatar dificultades. Si ahora pudieres leer esta escritura, y mostrarme su interpretación, serás vestido de púrpura, y collar de oro tendrás en tu cuello, y en el reino serás el tercer señor.
DAN.5.17	5	17	Then Daniel answered and said before the king, Let thy gifts be to thyself, and give thy rewards to another; yet I will read the writing unto the king, and make known to him the interpretation. {rewards: or, fee}	0.0	neutral	Entonces Daniel respondió, y dijo delante del rey: Tus dones sean para ti, y tus presentes dalos á otro. La escritura yo la leeré al rey, y le mostraré la declaración.
DAN.5.18	5	18	O thou king, the most high God gave Nebuchadnezzar thy father a kingdom, and majesty, and glory, and honour:	0.33	positive	El altísimo Dios, oh rey, dió á Nabucodonosor tu padre el reino, y la grandeza, y la gloria, y la honra:
DAN.5.19	5	19	And for the majesty that he gave him, all people, nations, and languages, trembled and feared before him: whom he would he slew; and whom he would he kept alive; and whom he would he set up; and whom he would he put down.	-0.0278	neutral	Y por la grandeza que le dió, todos los pueblos, naciones, y lenguas, temblaban y temían delante de él. Los que él quería mataba, y daba vida á los que quería: engrandecía á los que quería, y á los que quería humillaba.
DAN.5.20	5	20	But when his heart was lifted up, and his mind hardened in pride, he was deposed from his kingly throne, and they took his glory from him: {in pride: or, to deal proudly} {deposed: Chaldee, made to come down}	-0.0352	neutral	Mas cuando su corazón se ensoberbeció, y su espíritu se endureció en altivez, fué depuesto del trono de su reino, y traspasaron de él la gloria:
DAN.5.21	5	21	And he was driven from the sons of men; and his heart was made like the beasts, and his dwelling {was} with the wild asses: they fed him with grass like oxen, and his body was wet with the dew of heaven; till he knew that the most high God ruled in the kingdom of men, and {that} he appointeth over it whomsoever he will. {his heart...: or, he made his heart equal, etc}	0.132	positive	Y fué echado de entre los hijos de los hombres; y su corazón fué puesto con las bestias, y con los asnos monteses fué su morada. Hierba le hicieron comer, como á buey, y su cuerpo fué bañado con el rocío del cielo, hasta que conoció que el altísimo Dios se enseñorea del reino de los hombres, y que pondrá sobre él al que quisiere.
DAN.5.22	5	22	And thou his son, O Belshazzar, hast not humbled thine heart, though thou knewest all this;	0.0	neutral	Y tú, su hijo Belsasar, no has humillado tu corazón, sabiendo todo esto:
DAN.5.23	5	23	But hast lifted up thyself against the Lord of heaven; and they have brought the vessels of his house before thee, and thou, and thy lords, thy wives, and thy concubines, have drunk wine in them; and thou hast praised the gods of silver, and gold, of brass, iron, wood, and stone, which see not, nor hear, nor know: and the God in whose hand thy breath {is}, and whose {are} all thy ways, hast thou not glorified:	-0.5	negative	Antes contra el Señor del cielo te has ensoberbecido, é hiciste traer delante de ti los vasos de su casa, y tú y tus príncipes, tus mujeres y tus concubinas, bebisteis vino en ellos: demás de esto, á dioses de plata y de oro, de metal, de hierro, de madera, y de piedra, que ni ven, ni oyen, ni saben, diste alabanza: y al Dios en cuya mano está tu vida, y cuyos son todos tus caminos, nunca honraste.
DAN.5.24	5	24	Then was the part of the hand sent from him; and this writing was written.	0.0	neutral	Entonces de su presencia fué enviada la palma de la mano que esculpió esta escritura.
DAN.5.25	5	25	And this {is} the writing that was written, MENE, MENE, TEKEL, UPHARSIN.	0.0	neutral	Y la escritura que esculpió es: MENE, MENE, TEKEL, UPHARSIN.
DAN.5.26	5	26	This {is} the interpretation of the thing: MENE; God hath numbered thy kingdom, and finished it.	0.0	neutral	La declaración del negocio es: MENE: Contó Dios tu reino, y halo rematado.
DAN.5.27	5	27	TEKEL; Thou art weighed in the balances, and art found wanting.	0.0	neutral	TEKEL: Pesado has sido en balanza, y fuiste hallado falto.
DAN.5.28	5	28	PERES; Thy kingdom is divided, and given to the Medes and Persians.	0.0	neutral	PERES: Tu reino fué rompido, y es dado á Medos y Persas.
DAN.5.29	5	29	Then commanded Belshazzar, and they clothed Daniel with scarlet, and {put} a chain of gold about his neck, and made a proclamation concerning him, that he should be the third ruler in the kingdom.	0.0	neutral	Entonces, mandándolo Belsasar, vistieron á Daniel de púrpura, y en su cuello fué puesto un collar de oro, y pregonaron de él que fuese el tercer señor en el reino.
DAN.5.30	5	30	In that night was Belshazzar the king of the Chaldeans slain.	0.0	neutral	La misma noche fué muerto Belsasar, rey de los Caldeos.
DAN.5.31	5	31	And Darius the Median took the kingdom, {being} about threescore and two years old. {being...: Chaldee, he as the son of, etc} {about: or, now}	0.1	neutral	Y Darío de Media tomó el reino, siendo de sesenta y dos años.
DAN.6.1	6	1	It pleased Darius to set over the kingdom an hundred and twenty princes, which should be over the whole kingdom;	0.35	positive	PARECIO bien á Darío constituir sobre el reino ciento veinte gobernadores, que estuviesen en todo el reino.
DAN.6.2	6	2	And over these three presidents; of whom Daniel {was} first: that the princes might give accounts unto them, and the king should have no damage.	0.25	positive	Y sobre ellos tres presidentes, de los cuales Daniel era el uno, á quienes estos gobernadores diesen cuenta, porque el rey no recibiese daño.
DAN.6.3	6	3	Then this Daniel was preferred above the presidents and princes, because an excellent spirit {was} in him; and the king thought to set him over the whole realm.	0.4	positive	Pero el mismo Daniel era superior á estos gobernadores y presidentes, porque había en él más abundancia de espíritu: y el rey pensaba de ponerlo sobre todo el reino.
DAN.6.4	6	4	Then the presidents and princes sought to find occasion against Daniel concerning the kingdom; but they could find none occasion nor fault; forasmuch as he {was} faithful, neither was there any error or fault found in him.	0.0	neutral	Entonces los presidentes y gobernadores buscaban ocasiones contra Daniel por parte del reino; mas no podían hallar alguna ocasión ó falta, porque él era fiel, y ningún vicio ni falta fué en él hallado.
DAN.6.5	6	5	Then said these men, We shall not find any occasion against this Daniel, except we find {it} against him concerning the law of his God.	0.0	neutral	Entonces dijeron aquellos hombres: No hallaremos contra este Daniel ocasión alguna, si no la hallamos contra él en la ley de su Dios.
DAN.6.6	6	6	Then these presidents and princes assembled together to the king, and said thus unto him, King Darius, live for ever. {assembled...: or, came tumultuously}	0.1364	positive	Entonces estos gobernadores y presidentes se juntaron delante del rey, y le dijeron así: Rey Darío, para siempre vive:
DAN.6.7	6	7	All the presidents of the kingdom, the governors, and the princes, the counsellors, and the captains, have consulted together to establish a royal statute, and to make a firm decree, that whosoever shall ask a petition of any God or man for thirty days, save of thee, O king, he shall be cast into the den of lions. {decree: or, interdict}	-0.2	negative	Todos los presidentes del reino, magistrados, gobernadores, grandes y capitanes, han acordado por consejo promulgar un real edicto, y confirmarlo, que cualquiera que demandare petición de cualquier dios ú hombre en el espacio de treinta días, sino de ti, oh rey, sea echado en el foso de los leones.
DAN.6.8	6	8	Now, O king, establish the decree, and sign the writing, that it be not changed, according to the law of the Medes and Persians, which altereth not. {altereth not: Chaldee, passeth not}	0.0	neutral	Ahora, oh rey, confirma el edicto, y firma la escritura, para que no se pueda mudar, conforme á la ley de Media y de Persia, la cual no se revoca.
DAN.6.9	6	9	Wherefore king Darius signed the writing and the decree.	0.0	neutral	Firmó pues el rey Darío la escritura y el edicto.
DAN.6.10	6	10	Now when Daniel knew that the writing was signed, he went into his house; and his windows being open in his chamber toward Jerusalem, he kneeled upon his knees three times a day, and prayed, and gave thanks before his God, as he did aforetime.	0.1	neutral	Y Daniel, cuando supo que la escritura estaba firmada, entróse en su casa, y abiertas las ventanas de su cámara que estaban hacia Jerusalem, hincábase de rodillas tres veces al día, y oraba, y confesaba delante de su Dios, como lo solía hacer antes.
DAN.6.11	6	11	Then these men assembled, and found Daniel praying and making supplication before his God.	0.0	neutral	Entonces se juntaron aquellos hombres, y hallaron á Daniel orando y rogando delante de su Dios.
DAN.6.12	6	12	Then they came near, and spake before the king concerning the king's decree; Hast thou not signed a decree, that every man that shall ask {a petition} of any God or man within thirty days, save of thee, O king, shall be cast into the den of lions? The king answered and said, The thing {is} true, according to the law of the Medes and Persians, which altereth not.	0.225	positive	Llegáronse luego, y hablaron delante del rey acerca del edicto real: ¿No has confirmado edicto que cualquiera que pidiere á cualquier dios ú hombre en el espacio de treinta días, excepto á ti, oh rey, fuese echado en el foso de los leones? Respondió el rey y dijo: Verdad es, conforme á la ley de Media y de Persia, la cual no se abroga.
DAN.6.13	6	13	Then answered they and said before the king, That Daniel, which {is} of the children of the captivity of Judah, regardeth not thee, O king, nor the decree that thou hast signed, but maketh his petition three times a day.	0.0	neutral	Entonces respondieron y dijeron delante del rey: Daniel que es de los hijos de la cautividad de los Judíos, no ha hecho cuenta de ti, oh rey, ni del edicto que confirmaste; antes tres veces al día hace su petición.
DAN.6.14	6	14	Then the king, when he heard {these} words, was sore displeased with himself, and set {his} heart on Daniel to deliver him: and he laboured till the going down of the sun to deliver him.	-0.1556	negative	El rey entonces, oyendo el negocio, pesóle en gran manera, y sobre Daniel puso cuidado para librarlo; y hasta puestas del sol trabajó para librarle.
DAN.6.15	6	15	Then these men assembled unto the king, and said unto the king, Know, O king, that the law of the Medes and Persians {is}, That no decree nor statute which the king establisheth may be changed.	0.0	neutral	Empero aquellos hombres se reunieron cerca del rey, y dijeron al rey: Sepas, oh rey, que es ley de Media y de Persia, que ningún decreto ú ordenanza que el rey confirmare pueda mudarse.
DAN.6.16	6	16	Then the king commanded, and they brought Daniel, and cast {him} into the den of lions. {Now} the king spake and said unto Daniel, Thy God whom thou servest continually, he will deliver thee.	0.0	neutral	Entonces el rey mandó, y trajeron á Daniel, y echáronle en el foso de los leones. Y hablando el rey dijo á Daniel: El Dios tuyo, á quien tú continuamente sirves, él te libre.
DAN.6.17	6	17	And a stone was brought, and laid upon the mouth of the den; and the king sealed it with his own signet, and with the signet of his lords; that the purpose might not be changed concerning Daniel.	0.6	positive	Y fué traída una piedra, y puesta sobre la puerta del foso, la cual selló el rey con su anillo, y con el anillo de sus príncipes, porque el acuerdo acerca de Daniel no se mudase.
DAN.6.18	6	18	Then the king went to his palace, and passed the night fasting: neither were instruments of musick brought before him: and his sleep went from him. {instruments...: or, table}	0.0	neutral	Fuése luego el rey á su palacio, y acostóse ayuno; ni instrumentos de música fueron traídos delante de él, y se le fué el sueño.
DAN.6.19	6	19	Then the king arose very early in the morning, and went in haste unto the den of lions.	0.13	positive	El rey, por tanto, se levantó muy de mañana, y fué apriesa al foso de los leones:
DAN.6.20	6	20	And when he came to the den, he cried with a lamentable voice unto Daniel: {and} the king spake and said to Daniel, O Daniel, servant of the living God, is thy God, whom thou servest continually, able to deliver thee from the lions?	-0.125	negative	Y llegándose cerca del foso llamó á voces á Daniel con voz triste: y hablando el rey dijo á Daniel: Daniel, siervo del Dios viviente, el Dios tuyo, á quien tú continuamente sirves ¿te ha podido librar de los leones?
DAN.6.21	6	21	Then said Daniel unto the king, O king, live for ever.	0.1364	positive	Entonces habló Daniel con el rey: oh rey, para siempre vive.
DAN.6.22	6	22	My God hath sent his angel, and hath shut the lions' mouths, that they have not hurt me: forasmuch as before him innocency was found in me; and also before thee, O king, have I done no hurt.	0.0	neutral	El Dios mío envió su ángel, el cual cerró la boca de los leones, para que no me hiciesen mal: porque delante de él se halló en mí justicia: y aun delante de ti, oh rey, yo no he hecho lo que no debiese.
DAN.6.23	6	23	Then was the king exceeding glad for him, and commanded that they should take Daniel up out of the den. So Daniel was taken up out of the den, and no manner of hurt was found upon him, because he believed in his God.	0.5	positive	Entonces se alegró el rey en gran manera á causa de él, y mandó sacar á Daniel del foso: y fué Daniel sacado del foso, y ninguna lesión se halló en él, porque creyó en su Dios.
DAN.6.24	6	24	And the king commanded, and they brought those men which had accused Daniel, and they cast {them} into the den of lions, them, their children, and their wives; and the lions had the mastery of them, and brake all their bones in pieces or ever they came at the bottom of the den.	0.0	neutral	Y mandándolo el rey fueron traídos aquellos hombres que habían acusado á Daniel, y fueron echados en el foso de los leones, ellos, sus hijos, y sus mujeres; y aun no habían llegado al suelo del foso, cuando los leones se apoderaron de ellos, y quebrantaron todos sus huesos.
DAN.6.25	6	25	Then king Darius wrote unto all people, nations, and languages, that dwell in all the earth; Peace be multiplied unto you.	0.0	neutral	Entonces el rey Darío escribió á todos los pueblos, naciones, y lenguas, que habitan en toda la tierra: Paz os sea multiplicada:
DAN.6.26	6	26	I make a decree, That in every dominion of my kingdom men tremble and fear before the God of Daniel: for he {is} the living God, and stedfast for ever, and his kingdom {that} which shall not be destroyed, and his dominion {shall be even} unto the end.	0.0	neutral	De parte mía es puesta ordenanza, que en todo el señorío de mi reino todos teman y tiemblen de la presencia del Dios de Daniel: porque él es el Dios viviente y permanente por todos los siglos, y su reino tal que no será desecho, y su señorío hasta el fin.
DAN.6.27	6	27	He delivereth and rescueth, and he worketh signs and wonders in heaven and in earth, who hath delivered Daniel from the power of the lions. {power: Chaldee, hand}	0.0	neutral	Que salva y libra, y hace señales y maravillas en el cielo y en la tierra; el cual libró á Daniel del poder de los leones.
DAN.6.28	6	28	So this Daniel prospered in the reign of Darius, and in the reign of Cyrus the Persian.	0.0	neutral	Y este Daniel fué prosperado durante el reinado de Darío, y durante el reinado de Ciro, Persa.
DAN.7.1	7	1	In the first year of Belshazzar king of Babylon Daniel had a dream and visions of his head upon his bed: then he wrote the dream, {and} told the sum of the matters. {had: Chaldee, saw} {matters: or, words}	0.25	positive	EN el primer año de Belsasar rey de Babilonia, vió Daniel un sueño y visiones de su cabeza en su cama: luego escribió el sueño, y notó la suma de los negocios.
DAN.7.2	7	2	Daniel spake and said, I saw in my vision by night, and, behold, the four winds of the heaven strove upon the great sea.	0.8	positive	Habló Daniel y dijo: Veía yo en mi visión de noche, y he aquí que los cuatro vientos del cielo combatían en la gran mar.
DAN.7.3	7	3	And four great beasts came up from the sea, diverse one from another.	0.8	positive	Y cuatro bestias grandes, diferentes la una de la otra, subían de la mar.
DAN.7.4	7	4	The first {was} like a lion, and had eagle's wings: I beheld till the wings thereof were plucked, and it was lifted up from the earth, and made stand upon the feet as a man, and a man's heart was given to it. {and it: or, wherewith it}	0.25	positive	La primera era como león, y tenía alas de águila. Yo estaba mirando hasta tanto que sus alas fueron arrancadas, y fué quitada de la tierra; y púsose enhiesta sobre los pies á manera de hombre, y fuéle dado corazón de hombre.
DAN.7.5	7	5	And behold another beast, a second, like to a bear, and it raised up itself on one side, and {it had} three ribs in the mouth of it between the teeth of it: and they said thus unto it, Arise, devour much flesh. {it raised...: or, it raised up one dominion}	0.1	neutral	Y he aquí otra segunda bestia, semejante á un oso, la cual se puso al un lado, y tenía en su boca tres costillas entre sus dientes; y fuéle dicho así: Levántate, traga carne mucha.
DAN.7.6	7	6	After this I beheld, and lo another, like a leopard, which had upon the back of it four wings of a fowl; the beast had also four heads; and dominion was given to it.	0.0	neutral	Después de esto yo miraba, y he aquí otra, semejante á un tigre, y tenía cuatro alas de ave en sus espaldas: tenía también esta bestia cuatro cabezas; y fuéle dada potestad.
