verse_id	chapter	verse	text_en	polarity_en	label_en	text_es
GEN.48.3	48	3	And Jacob said unto Joseph, God Almighty appeared unto me at Luz in the land of Canaan, and blessed me,	0.0	neutral	Y dijo á José: El Dios Omnipotente me apareció en Luz en la tierra de Canaán, y me bendijo,
GEN.48.4	48	4	And said unto me, Behold, I will make thee fruitful, and multiply thee, and I will make of thee a multitude of people; and will give this land to thy seed after thee {for} an everlasting possession.	0.0	neutral	Y díjome: He aquí, yo te haré crecer, y te multiplicaré, y te pondré por estirpe de pueblos: y daré esta tierra á tu simiente después de ti por heredad perpetua.
GEN.48.5	48	5	And now thy two sons, Ephraim and Manasseh, which were born unto thee in the land of Egypt before I came unto thee into Egypt, {are} mine; as Reuben and Simeon, they shall be mine.	0.0	neutral	Y ahora tus dos hijos Ephraim y Manasés, que te nacieron en la tierra de Egipto, antes que viniese á ti á la tierra de Egipto, míos son; como Rubén y Simeón, serán míos:
GEN.48.6	48	6	And thy issue, which thou begettest after them, shall be thine, {and} shall be called after the name of their brethren in their inheritance.	0.0	neutral	Y los que después de ellos has engendrado, serán tuyos; por el nombre de sus hermanos serán llamados en sus heredades.
GEN.48.7	48	7	And as for me, when I came from Padan, Rachel died by me in the land of Canaan in the way, when yet {there was} but a little way to come unto Ephrath: and I buried her there in the way of Ephrath; the same {is} Bethlehem.	-0.0938	neutral	Porque cuando yo venía de Padan-aram, se me murió Rachêl en la tierra de Canaán, en el camino, como media legua de tierra viniendo á Ephrata; y sepultéla allí en el camino de Ephrata, que es Bethlehem.
GEN.48.8	48	8	And Israel beheld Joseph's sons, and said, Who {are} these?	0.0	neutral	Y vió Israel los hijos de José, y dijo: ¿Quiénes son éstos?
GEN.48.9	48	9	And Joseph said unto his father, They {are} my sons, whom God hath given me in this {place}. And he said, Bring them, I pray thee, unto me, and I will bless them.	0.0	neutral	Y respondió José á su padre: Son mis hijos, que Dios me ha dado aquí. Y él dijo: Allégalos ahora á mí, y los bendeciré.
GEN.48.10	48	10	Now the eyes of Israel were dim for age, {so that} he could not see. And he brought them near unto him; and he kissed them, and embraced them. {dim: Heb. heavy}	0.025	neutral	Y los ojos de Israel estaban tan agravados de la vejez, que no podía ver. Hízoles, pues, llegar á él, y él los besó y abrazó.
GEN.48.11	48	11	And Israel said unto Joseph, I had not thought to see thy face: and, lo, God hath shewed me also thy seed.	0.0	neutral	Y dijo Israel á José: No pensaba yo ver tu rostro, y he aquí Dios me ha hecho ver también tu simiente.
GEN.48.12	48	12	And Joseph brought them out from between his knees, and he bowed himself with his face to the earth.	0.0	neutral	Entonces José los sacó de entre sus rodillas, é inclinóse á tierra.
GEN.48.13	48	13	And Joseph took them both, Ephraim in his right hand toward Israel's left hand, and Manasseh in his left hand toward Israel's right hand, and brought {them} near unto him.	0.1343	positive	Y tomólos José á ambos, Ephraim á su diestra, á la siniestra de Israel; y á Manasés á su izquierda, á la derecha de Israel; é hízoles llegar á él.
GEN.48.14	48	14	And Israel stretched out his right hand, and laid {it} upon Ephraim's head, who {was} the younger, and his left hand upon Manasseh's head, guiding his hands wittingly; for Manasseh {was} the firstborn.	0.0589	neutral	Entonces Israel extendió su diestra, y púsola sobre la cabeza de Ephraim, que era el menor, y su siniestra sobre la cabeza de Manasés, colocando así sus manos adrede, aunque Manasés era el primogénito.
GEN.48.15	48	15	And he blessed Joseph, and said, God, before whom my fathers Abraham and Isaac did walk, the God which fed me all my life long unto this day,	-0.05	neutral	Y bendijo á José, y dijo: El Dios en cuya presencia anduvieron mis padres Abraham é Isaac, el Dios que me mantiene desde que yo soy hasta este día,
GEN.48.16	48	16	The Angel which redeemed me from all evil, bless the lads; and let my name be named on them, and the name of my fathers Abraham and Isaac; and let them grow into a multitude in the midst of the earth. {grow: Heb. as fishes do increase}	-1.0	negative	El Angel que me liberta de todo mal, bendiga á estos mozos: y mi nombre sea llamado en ellos, y el nombre de mis padres Abraham é Isaac: y multipliquen en gran manera en medio de la tierra.
GEN.48.17	48	17	And when Joseph saw that his father laid his right hand upon the head of Ephraim, it displeased him: and he held up his father's hand, to remove it from Ephraim's head unto Manasseh's head. {displeased...: was evil in his eyes}	-0.3571	negative	Entonces viendo José que su padre ponía la mano derecha sobre la cabeza de Eprhaim, causóle esto disgusto; y asió la mano de su padre, para mudarla de sobre la cabeza de Ephraim á la cabeza de Manasés.
GEN.48.18	48	18	And Joseph said unto his father, Not so, my father: for this {is} the firstborn; put thy right hand upon his head.	0.2857	positive	Y dijo José á su padre: No así, padre mío, porque éste es el primogénito; pon tu diestra sobre su cabeza.
GEN.48.19	48	19	And his father refused, and said, I know {it}, my son, I know {it}: he also shall become a people, and he also shall be great: but truly his younger brother shall be greater than he, and his seed shall become a multitude of nations. {multitude: Heb. fulness}	0.4333	positive	Mas su padre no quiso, y dijo: Lo sé, hijo mío, lo sé: también él vendrá á ser un pueblo, y será también acrecentado; pero su hermano menor será más grande que él, y su simiente será plenitud de gentes.
GEN.48.20	48	20	And he blessed them that day, saying, In thee shall Israel bless, saying, God make thee as Ephraim and as Manasseh: and he set Ephraim before Manasseh.	0.0	neutral	Y bendíjolos aquel día, diciendo: En ti bendecirá Israel, diciendo: Póngate Dios como á Ephraim y como á Manasés. Y puso á Ephraim delante de Manasés.
GEN.48.21	48	21	And Israel said unto Joseph, Behold, I die: but God shall be with you, and bring you again unto the land of your fathers.	0.0	neutral	Y dijo Israel á José: He aquí, yo muero, mas Dios será con vosotros, y os hará volver á la tierra de vuestros padres.
GEN.48.22	48	22	Moreover I have given to thee one portion above thy brethren, which I took out of the hand of the Amorite with my sword and with my bow.	0.0	neutral	Y yo te he dado á ti una parte sobre tus hermanos, la cual tomé yo de mano del Amorrheo con mi espada y con mi arco.
GEN.49.1	49	1	And Jacob called unto his sons, and said, Gather yourselves together, that I may tell you {that} which shall befall you in the last days.	0.0	neutral	Y LLAMO Jacob á sus hijos, y dijo: Juntaos, y os declararé lo que os ha de acontecer en los postreros días.
GEN.49.2	49	2	Gather yourselves together, and hear, ye sons of Jacob; and hearken unto Israel your father.	0.0	neutral	Juntaos y oid, hijos de Jacob; Y escuchad á vuestro padre Israel.
GEN.49.3	49	3	Reuben, thou {art} my firstborn, my might, and the beginning of my strength, the excellency of dignity, and the excellency of power:	0.0	neutral	Rubén, tú eres mi primogénito, mi fortaleza, y el principio de mi vigor; Principal en dignidad, principal en poder.
GEN.49.4	49	4	Unstable as water, thou shalt not excel; because thou wentest up to thy father's bed; then defiledst thou {it}: he went up to my couch. {thou shalt...: Heb. do not thou excel} {he went...: or, my couch is gone}	0.0	neutral	Corriente como las aguas, no seas el principal; Por cuanto subiste al lecho de tu padre: Entonces te envileciste, subiendo á mi estrado.
GEN.49.5	49	5	Simeon and Levi {are} brethren; instruments of cruelty {are in} their habitations. {instruments...: or, their swords are weapons of violence}	0.0	neutral	Simeón y Leví, hermanos: Armas de iniquidad sus armas.
GEN.49.6	49	6	O my soul, come not thou into their secret; unto their assembly, mine honour, be not thou united: for in their anger they slew a man, and in their selfwill they digged down a wall. {digged...: or, houghed oxen}	-0.4185	negative	En su secreto no entre mi alma, Ni mi honra se junte en su compañía; Que en su furor mataron varón, Y en su voluntad arrancaron muro.
GEN.49.7	49	7	Cursed {be} their anger, for {it was} fierce; and their wrath, for it was cruel: I will divide them in Jacob, and scatter them in Israel.	-0.85	negative	Maldito su furor, que fué fiero; Y su ira, que fué dura: Yo los apartaré en Jacob, Y los esparciré en Israel.
GEN.49.8	49	8	Judah, thou {art he} whom thy brethren shall praise: thy hand {shall be} in the neck of thine enemies; thy father's children shall bow down before thee.	-0.1556	negative	Judá, alabarte han tus hermanos: Tu mano en la cerviz de tus enemigos: Los hijos de tu padre se inclinarán á ti.
GEN.49.9	49	9	Judah {is} a lion's whelp: from the prey, my son, thou art gone up: he stooped down, he couched as a lion, and as an old lion; who shall rouse him up?	-0.0278	neutral	Cachorro de león Judá: De la presa subiste, hijo mío: Encorvóse, echóse como león, Así como león viejo; ¿quién lo despertará?
GEN.49.10	49	10	The sceptre shall not depart from Judah, nor a lawgiver from between his feet, until Shiloh come; and unto him {shall} the gathering of the people {be}.	0.0	neutral	No será quitado el cetro de Judá, Y el legislador de entre sus piés, Hasta que venga Shiloh; Y á él se congregarán los pueblos.
GEN.49.11	49	11	Binding his foal unto the vine, and his ass's colt unto the choice vine; he washed his garments in wine, and his clothes in the blood of grapes:	0.0	neutral	Atando á la vid su pollino, Y á la cepa el hijo de su asna, Lavó en el vino su vestido, Y en la sangre de uvas su manto:
GEN.49.12	49	12	His eyes {shall be} red with wine, and his teeth white with milk.	0.0	neutral	Sus ojos bermejos del vino, Y los dientes blancos de la leche.
GEN.49.13	49	13	Zebulun shall dwell at the haven of the sea; and he {shall be} for an haven of ships; and his border {shall be} unto Zidon.	0.0	neutral	Zabulón en puertos de mar habitará, Y será para puerto de navíos; Y su término hasta Sidón.
GEN.49.14	49	14	Issachar {is} a strong ass couching down between two burdens:	0.1389	positive	Issachâr, asno huesudo Echado entre dos tercios:
GEN.49.15	49	15	And he saw that rest {was} good, and the land that {it was} pleasant; and bowed his shoulder to bear, and became a servant unto tribute.	0.7167	positive	Y vió que el descanso era bueno, Y que la tierra era deleitosa; Y bajó su hombro para llevar, Y sirvió en tributo.
GEN.49.16	49	16	Dan shall judge his people, as one of the tribes of Israel.	0.0	neutral	Dan juzgará á su pueblo, Como una de las tribus de Israel.
GEN.49.17	49	17	Dan shall be a serpent by the way, an adder in the path, that biteth the horse heels, so that his rider shall fall backward. {an adder: Heb. an arrow-snake}	0.0	neutral	Será Dan serpiente junto al camino, Cerasta junto á la senda, Que muerde los talones de los caballos, Y hace caer por detrás al cabalgador de ellos.
GEN.49.18	49	18	I have waited for thy salvation, O LORD.	0.0	neutral	Tu salud esperé, oh Jehová.
GEN.49.19	49	19	Gad, a troop shall overcome him: but he shall overcome at the last.	0.0	neutral	Gad, ejército lo acometerá; Mas él acometerá al fin.
GEN.49.20	49	20	Out of Asher his bread {shall be} fat, and he shall yield royal dainties.	0.0	neutral	El pan de Aser será grueso, Y él dará deleites al rey.
GEN.49.21	49	21	Naphtali {is} a hind let loose: he giveth goodly words.	0.3115	positive	Nephtalí, sierva dejada, Que dará dichos hermosos.
GEN.49.22	49	22	Joseph {is} a fruitful bough, {even} a fruitful bough by a well; {whose} branches run over the wall: {branches: Heb. daughters}	-0.75	negative	Ramo fructífero José, Ramo fructífero junto á fuente, Cuyos vástagos se extienden sobre el muro.
GEN.49.23	49	23	The archers have sorely grieved him, and shot {at him}, and hated him:	-0.9	negative	Y causáronle amargura, Y asaeteáronle, Y aborreciéronle los archeros:
GEN.49.24	49	24	But his bow abode in strength, and the arms of his hands were made strong by the hands of the mighty {God} of Jacob; (from thence {is} the shepherd, the stone of Israel:)	0.4444	positive	Mas su arco quedó en fortaleza, Y los brazos de sus manos se corroboraron Por las manos del Fuerte de Jacob, (De allí el pastor, y la piedra de Israel,)
GEN.49.25	49	25	{Even} by the God of thy father, who shall help thee; and by the Almighty, who shall bless thee with blessings of heaven above, blessings of the deep that lieth under, blessings of the breasts, and of the womb:	0.0	neutral	Del Dios de tu padre, el cual te ayudará, Y del Omnipotente, el cual te bendecirá Con bendiciones de los cielos de arriba, Con bendiciones del abismo que está abajo, Con bendiciones del seno y de la matriz.
GEN.49.26	49	26	The blessings of thy father have prevailed above the blessings of my progenitors unto the utmost bound of the everlasting hills: they shall be on the head of Joseph, and on the crown of the head of him that was separate from his brethren.	0.0	neutral	Las bendiciones de tu padre Fueron mayores que las bendiciones de mis progenitores: Hasta el término de los collados eternos Serán sobre la cabeza de José, Y sobre la mollera del Nazareo de sus hermanos.
