verse_id	chapter	verse	text_en	polarity_en	label_en	text_es
GEN.45.12	45	12	And, behold, your eyes see, and the eyes of my brother Benjamin, that {it is} my mouth that speaketh unto you.	0.0	neutral	Y he aquí, vuestros ojos ven, y los ojos de mi hermano Benjamín, que mi boca os habla.
GEN.45.13	45	13	And ye shall tell my father of all my glory in Egypt, and of all that ye have seen; and ye shall haste and bring down my father hither.	-0.1556	negative	Haréis pues saber á mi padre toda mi gloria en Egipto, y todo lo que habéis visto: y daos priesa, y traed á mi padre acá.
GEN.45.14	45	14	And he fell upon his brother Benjamin's neck, and wept; and Benjamin wept upon his neck.	0.0	neutral	Y echóse sobre el cuello de Benjamín su hermano, y lloró; y también Benjamín lloró sobre su cuello.
GEN.45.15	45	15	Moreover he kissed all his brethren, and wept upon them: and after that his brethren talked with him.	0.0	neutral	Y besó á todos sus hermanos, y lloró sobre ellos: y después sus hermanos hablaron con él.
GEN.45.16	45	16	And the fame thereof was heard in Pharaoh's house, saying, Joseph's brethren are come: and it pleased Pharaoh well, and his servants. {pleased...: Heb. was good in the eyes of Pharaoh}	0.5667	positive	Y oyóse la noticia en la casa de Faraón, diciendo: Los hermanos de José han venido. Y plugo en los ojos de Faraón y de sus siervos.
GEN.45.17	45	17	And Pharaoh said unto Joseph, Say unto thy brethren, This do ye; lade your beasts, and go, get you unto the land of Canaan;	0.0	neutral	Y dijo Faraón á José: Di á tus hermanos: Haced esto: cargad vuestras bestias, é id, volved á la tierra de Canaán;
GEN.45.18	45	18	And take your father and your households, and come unto me: and I will give you the good of the land of Egypt, and ye shall eat the fat of the land.	0.7	positive	Y tomad á vuestro padre y vuestras familias, y venid á mí, que yo os daré lo bueno de la tierra de Egipto y comeréis la grosura de la tierra.
GEN.45.19	45	19	Now thou art commanded, this do ye; take you wagons out of the land of Egypt for your little ones, and for your wives, and bring your father, and come.	-0.1875	negative	Y tú manda: Haced esto: tomaos de la tierra de Egipto carros para vuestros niños y vuestras mujeres; y tomad á vuestro padre, y venid.
GEN.45.20	45	20	Also regard not your stuff; for the good of all the land of Egypt {is} yours. {regard...: Heb. let not your eye spare, etc.}	0.7	positive	Y no se os dé nada de vuestras alhajas, porque el bien de la tierra de Egipto será vuestro.
GEN.45.21	45	21	And the children of Israel did so: and Joseph gave them wagons, according to the commandment of Pharaoh, and gave them provision for the way. {commandment: Heb. mouth}	0.0	neutral	E hiciéronlo así los hijos de Israel: y dióles José carros conforme á la orden de Faraón, y suministróles víveres para el camino.
GEN.45.22	45	22	To all of them he gave each man changes of raiment; but to Benjamin he gave three hundred {pieces} of silver, and five changes of raiment.	0.0	neutral	A cada uno de todos ellos dió mudas de vestidos, y á Benjamín dió trescientas piezas de plata, y cinco mudas de vestidos.
GEN.45.23	45	23	And to his father he sent after this {manner}; ten asses laden with the good things of Egypt, and ten she asses laden with corn and bread and meat for his father by the way. {laden...: Heb. carrying}	0.2333	positive	Y á su padre envió esto: diez asnos cargados de lo mejor de Egipto, y diez asnas cargadas de trigo, y pan y comida, para su padre en el camino.
GEN.45.24	45	24	So he sent his brethren away, and they departed: and he said unto them, See that ye fall not out by the way.	0.0	neutral	Y despidió á sus hermanos, y fuéronse. Y él les dijo: No riñáis por el camino.
GEN.45.25	45	25	And they went up out of Egypt, and came into the land of Canaan unto Jacob their father,	0.0	neutral	Y subieron de Egipto, y llegaron á la tierra de Canaán á Jacob su padre.
GEN.45.26	45	26	And told him, saying, Joseph {is} yet alive, and he {is} governor over all the land of Egypt. And Jacob's heart fainted, for he believed them not. {Jacob's: Heb. his}	0.1	neutral	Y diéronle las nuevas, diciendo: José vive aún; y él es señor en toda la tierra de Egipto. Y su corazón se desmayó; pues no los creía.
GEN.45.27	45	27	And they told him all the words of Joseph, which he had said unto them: and when he saw the wagons which Joseph had sent to carry him, the spirit of Jacob their father revived:	0.0	neutral	Y ellos le contaron todas las palabras de José, que él les había hablado; y viendo él los carros que José enviaba para llevarlo, el espíritu de Jacob su padre revivió.
GEN.45.28	45	28	And Israel said, {It is} enough; Joseph my son {is} yet alive: I will go and see him before I die.	0.05	neutral	Entonces dijo Israel: Basta; José mi hijo vive todavía: iré, y le veré antes que yo muera.
GEN.46.1	46	1	And Israel took his journey with all that he had, and came to Beersheba, and offered sacrifices unto the God of his father Isaac.	0.0	neutral	Y PARTIOSE Israel con todo lo que tenía, y vino á Beer-seba, y ofreció sacrificios al Dios de su padre Isaac.
GEN.46.2	46	2	And God spake unto Israel in the visions of the night, and said, Jacob, Jacob. And he said, Here {am} I.	0.0	neutral	Y habló Dios á Israel en visiones de noche, y dijo: Jacob, Jacob. Y él respondió: Heme aquí.
GEN.46.3	46	3	And he said, I {am} God, the God of thy father: fear not to go down into Egypt; for I will there make of thee a great nation:	0.3222	positive	Y dijo: Yo soy Dios, el Dios de tu padre; no temas de descender á Egipto, porque yo te pondré allí en gran gente.
GEN.46.4	46	4	I will go down with thee into Egypt; and I will also surely bring thee up {again}: and Joseph shall put his hand upon thine eyes.	0.1722	positive	Yo descenderé contigo á Egipto, y yo también te haré volver: y José pondrá su mano sobre tus ojos.
GEN.46.5	46	5	And Jacob rose up from Beersheba: and the sons of Israel carried Jacob their father, and their little ones, and their wives, in the wagons which Pharaoh had sent to carry him.	0.2062	positive	Y levantóse Jacob de Beer-seba; y tomaron los hijos de Israel á su padre Jacob, y á sus niños, y á sus mujeres, en los carros que Faraón había enviado para llevarlo.
GEN.46.6	46	6	And they took their cattle, and their goods, which they had gotten in the land of Canaan, and came into Egypt, Jacob, and all his seed with him:	0.0	neutral	Y tomaron sus ganados, y su hacienda que había adquirido en la tierra de Canaán, y viniéronse á Egipto, Jacob, y toda su simiente consigo;
GEN.46.7	46	7	His sons, and his sons' sons with him, his daughters, and his sons' daughters, and all his seed brought he with him into Egypt.	0.0	neutral	Sus hijos, y los hijos de sus hijos consigo; sus hijas, y las hijas de sus hijos, y á toda su simiente trajo consigo á Egipto.
GEN.46.8	46	8	And these {are} the names of the children of Israel, which came into Egypt, Jacob and his sons: Reuben, Jacob's firstborn.	0.0	neutral	Y estos son los nombres de los hijos de Israel, que entraron en Egipto, Jacob y sus hijos: Rubén, el primogénito de Jacob.
GEN.46.9	46	9	And the sons of Reuben; Hanoch, and Phallu, and Hezron, and Carmi.	0.0	neutral	Y los hijos de Rubén: Hanoch, y Phallu, y Hezrón, y Carmi.
GEN.46.10	46	10	And the sons of Simeon; Jemuel, and Jamin, and Ohad, and Jachin, and Zohar, and Shaul the son of a Canaanitish woman. {Jemuel: or, Nemuel} {Jachin: or, Jarib} {Zohar: or, Zerah}	0.0	neutral	Y los hijos de Simeón: Jemuel, y Jamín, y Ohad, y Jachîn, y Zohar, y Saúl, hijo de la Cananea.
GEN.46.11	46	11	And the sons of Levi; Gershon, Kohath, and Merari. {Gershon: or, Gershom}	0.0	neutral	Y los hijos de Leví: Gersón, Coath, y Merari.
GEN.46.12	46	12	And the sons of Judah; Er, and Onan, and Shelah, and Pharez, and Zerah: but Er and Onan died in the land of Canaan. And the sons of Pharez were Hezron and Hamul.	0.0	neutral	Y los hijos de Judá: Er, y Onán, y Sela, y Phares, y Zara: mas Er y Onán, murieron en la tierra de Canaán. Y los hijos de Phares fueron Hezrón y Hamul.
GEN.46.13	46	13	And the sons of Issachar; Tola, and Phuvah, and Job, and Shimron. {Phuvah, and Job: or, Puah, and Jashub}	0.0	neutral	Y los hijos de Issachâr: Thola, y Phua, y Job, y Simrón.
GEN.46.14	46	14	And the sons of Zebulun; Sered, and Elon, and Jahleel.	0.0	neutral	Y los hijos de Zabulón: Sered y Elón, y Jahleel.
GEN.46.15	46	15	These {be} the sons of Leah, which she bare unto Jacob in Padanaram, with his daughter Dinah: all the souls of his sons and his daughters {were} thirty and three.	0.05	neutral	Estos fueron los hijos de Lea, los que parió á Jacob en Padan-aram, y además su hija Dina: treinta y tres las almas todas de sus hijos é hijas.
GEN.46.16	46	16	And the sons of Gad; Ziphion, and Haggi, Shuni, and Ezbon, Eri, and Arodi, and Areli. {Ziphion: or, Zephon} {Ezbon: or, Ozni} {Arodi: or, Arod}	0.0	neutral	Y los hijos de Gad: Ziphión, y Aggi, y Ezbón, y Suni, y Heri, y Arodi, y Areli.
GEN.46.17	46	17	And the sons of Asher; Jimnah, and Ishuah, and Isui, and Beriah, and Serah their sister: and the sons of Beriah; Heber, and Malchiel.	0.0	neutral	Y los hijos de Aser: Jimna, é Ishua, é Isui y Beria, y Sera, hermana de ellos. Los hijos de Beria: Heber, y Malchîel.
GEN.46.18	46	18	These {are} the sons of Zilpah, whom Laban gave to Leah his daughter, and these she bare unto Jacob, {even} sixteen souls.	0.05	neutral	Estos fueron los hijos de Zilpa, la que Labán dió á su hija Lea, y parió estos á Jacob; todas diez y seis almas.
GEN.46.19	46	19	The sons of Rachel Jacob's wife; Joseph, and Benjamin.	0.0	neutral	Y los hijos de Rachêl, mujer de Jacob: José y Benjamín.
GEN.46.20	46	20	And unto Joseph in the land of Egypt were born Manasseh and Ephraim, which Asenath the daughter of Potipherah priest of On bare unto him. {priest: or, prince}	0.05	neutral	Y nacieron á José en la tierra de Egipto Manasés y Ephraim, los que le parió Asenath, hija de Potipherah, sacerdote de On.
GEN.46.21	46	21	And the sons of Benjamin {were} Belah, and Becher, and Ashbel, Gera, and Naaman, Ehi, and Rosh, Muppim, and Huppim, and Ard. {Ehi: or, Ahiram} {Muppim: or, Shupham or, Shuppim} {Huppim: or, Hupham}	0.0	neutral	Y los hijos de Benjamín fueron Bela, y Bechêr y Asbel, y Gera, y Naamán, y Ehi, y Ros y Muppim, y Huppim, y Ard.
GEN.46.22	46	22	These {are} the sons of Rachel, which were born to Jacob: all the souls {were} fourteen.	0.0	neutral	Estos fueron los hijos de Rachêl, que nacieron á Jacob: en todas, catorce almas.
GEN.46.23	46	23	And the sons of Dan; Hushim. {Hushim: or, Shuham}	0.0	neutral	Y los hijos de Dan: Husim.
GEN.46.24	46	24	And the sons of Naphtali; Jahzeel, and Guni, and Jezer, and Shillem.	0.0	neutral	Y los hijos de Nephtalí: Jahzeel, y Guni, y Jezer, y Shillem.
GEN.46.25	46	25	These {are} the sons of Bilhah, which Laban gave unto Rachel his daughter, and she bare these unto Jacob: all the souls {were} seven.	0.05	neutral	Estos fueron los hijos de Bilha, la que dió Labán á Rachêl su hija, y parió estos á Jacob; todas siete almas.
GEN.46.26	46	26	All the souls that came with Jacob into Egypt, which came out of his loins, besides Jacob's sons' wives, all the souls {were} threescore and six; {loins: Heb. thigh}	0.0	neutral	Todas las personas que vinieron con Jacob á Egipto, procedentes de sus lomos, sin las mujeres de los hijos de Jacob, todas las personas fueron sesenta y seis.
GEN.46.27	46	27	And the sons of Joseph, which were born him in Egypt, {were} two souls: all the souls of the house of Jacob, which came into Egypt, {were} threescore and ten.	0.0	neutral	Y los hijos de José, que le nacieron en Egipto, dos personas. Todas las almas de la casa de Jacob, que entraron en Egipto, fueron setenta.
GEN.46.28	46	28	And he sent Judah before him unto Joseph, to direct his face unto Goshen; and they came into the land of Goshen.	0.1	neutral	Y envió á Judá delante de sí á José, para que le viniese á ver á Gosén; y llegaron á la tierra de Gosén.
GEN.46.29	46	29	And Joseph made ready his chariot, and went up to meet Israel his father, to Goshen, and presented himself unto him; and he fell on his neck, and wept on his neck a good while.	0.45	positive	Y José unció su carro y vino á recibir á Israel su padre á Gosén; y se manifestó á él, y echóse sobre su cuello, y lloró sobre su cuello bastante.
GEN.46.30	46	30	And Israel said unto Joseph, Now let me die, since I have seen thy face, because thou {art} yet alive.	0.1	neutral	Entonces Israel dijo á José: Muera yo ahora, ya que he visto tu rostro, pues aun vives.
GEN.46.31	46	31	And Joseph said unto his brethren, and unto his father's house, I will go up, and shew Pharaoh, and say unto him, My brethren, and my father's house, which {were} in the land of Canaan, are come unto me;	0.0	neutral	Y José dijo á sus hermanos, y á la casa de su padre: Subiré y haré saber á Faraón, y diréle: Mis hermanos y la casa de mi padre, que estaban en la tierra de Canaán, han venido á mí;
GEN.46.32	46	32	And the men {are} shepherds, for their trade hath been to feed cattle; and they have brought their flocks, and their herds, and all that they have. {their trade...: Heb. they are men of cattle}	0.0	neutral	Y los hombres son pastores de ovejas, porque son hombres ganaderos: y han traído sus ovejas y sus vacas, y todo lo que tenían.
GEN.46.33	46	33	And it shall come to pass, when Pharaoh shall call you, and shall say, What {is} your occupation?	0.0	neutral	Y cuando Faraón os llamare y dijere: ¿cuál es vuestro oficio?
GEN.46.34	46	34	That ye shall say, Thy servants' trade hath been about cattle from our youth even until now, both we, {and} also our fathers: that ye may dwell in the land of Goshen; for every shepherd {is} an abomination unto the Egyptians.	0.0	neutral	Entonces diréis: Hombres de ganadería han sido tus siervos desde nuestra mocedad hasta ahora, nosotros y nuestros padres; á fin que moréis en la tierra de Gosén, porque los Egipcios abominan todo pastor de ovejas.
GEN.47.1	47	1	Then Joseph came and told Pharaoh, and said, My father and my brethren, and their flocks, and their herds, and all that they have, are come out of the land of Canaan; and, behold, they {are} in the land of Goshen.	0.0	neutral	Y JOSÉ vino, é hizo saber á Faraón, y dijo: Mi padre y mis hermanos, y sus ovejas y sus vacas, con todo lo que tienen, han venido de la tierra de Canaán, y he aquí, están en la tierra de Gosén.
GEN.47.2	47	2	And he took some of his brethren, {even} five men, and presented them unto Pharaoh.	0.0	neutral	Y de los postreros de sus hermanos tomó cinco varones, y presentólos delante de Faraón.
GEN.47.3	47	3	And Pharaoh said unto his brethren, What {is} your occupation? And they said unto Pharaoh, Thy servants {are} shepherds, both we, {and} also our fathers.	0.0	neutral	Y Faraón dijo á sus hermanos: ¿Cuál es vuestro oficio? Y ellos respondieron á Faraón: Pastores de ovejas son tus siervos, así nosotros como nuestros padres.
GEN.47.4	47	4	They said moreover unto Pharaoh, For to sojourn in the land are we come; for thy servants have no pasture for their flocks; for the famine {is} sore in the land of Canaan: now therefore, we pray thee, let thy servants dwell in the land of Goshen.	0.0	neutral	Dijeron además á Faraón: Por morar en esta tierra hemos venido; porque no hay pasto para las ovejas de tus siervos, pues el hambre es grave en la tierra de Canaán: por tanto, te rogamos ahora que habiten tus siervos en la tierra de Gosén.
GEN.47.5	47	5	And Pharaoh spake unto Joseph, saying, Thy father and thy brethren are come unto thee:	0.0	neutral	Entonces Faraón habló á José, diciendo: Tu padre y tus hermanos han venido á ti;
GEN.47.6	47	6	The land of Egypt {is} before thee; in the best of the land make thy father and brethren to dwell; in the land of Goshen let them dwell: and if thou knowest {any} men of activity among them, then make them rulers over my cattle.	1.0	positive	La tierra de Egipto delante de ti está; en lo mejor de la tierra haz habitar á tu padre y á tus hermanos; habiten en la tierra de Gosén; y si entiendes que hay entre ellos hombres eficaces, ponlos por mayorales del ganado mío.
GEN.47.7	47	7	And Joseph brought in Jacob his father, and set him before Pharaoh: and Jacob blessed Pharaoh.	0.0	neutral	Y José introdujo á su padre, y presentólo delante de Faraón; y Jacob bendijo á Faraón.
GEN.47.8	47	8	And Pharaoh said unto Jacob, How old {art} thou? {How...: Heb. How many are the days of the years of thy life?}	0.3	positive	Y dijo Faraón á Jacob: ¿Cuántos son los días de los años de tu vida?
GEN.47.9	47	9	And Jacob said unto Pharaoh, The days of the years of my pilgrimage {are} an hundred and thirty years: few and evil have the days of the years of my life been, and have not attained unto the days of the years of the life of my fathers in the days of their pilgrimage.	-0.6	negative	Y Jacob respondió á Faraón: Los días de los años de mi peregrinación son ciento treinta años; pocos y malos han sido los días de los años de mi vida, y no han llegado á los días de los años de la vida de mis padres en los días de su peregrinación.
GEN.47.10	47	10	And Jacob blessed Pharaoh, and went out from before Pharaoh.	0.0	neutral	Y Jacob bendijo á Faraón, y salióse de delante de Faraón.
GEN.47.11	47	11	And Joseph placed his father and his brethren, and gave them a possession in the land of Egypt, in the best of the land, in the land of Rameses, as Pharaoh had commanded.	1.0	positive	Así José hizo habitar á su padre y á sus hermanos, y dióles posesión en la tierra de Egipto, en lo mejor de la tierra, en la tierra de Rameses como mandó Faraón.
GEN.47.12	47	12	And Joseph nourished his father, and his brethren, and all his father's household, with bread, according to {their} families. {according...: or, as a little child is nourished: Heb. according to the little ones}	-0.1875	negative	Y alimentaba José á su padre y á sus hermanos, y á toda la casa de su padre, de pan, hasta la boca del niño.
GEN.47.13	47	13	And {there was} no bread in all the land; for the famine {was} very sore, so that the land of Egypt and {all} the land of Canaan fainted by reason of the famine.	0.2	positive	Y no había pan en toda la tierra, y el hambre era muy grave; por lo que desfalleció de hambre la tierra de Egipto y la tierra de Canaán.
GEN.47.14	47	14	And Joseph gathered up all the money that was found in the land of Egypt, and in the land of Canaan, for the corn which they bought: and Joseph brought the money into Pharaoh's house.	0.0	neutral	Y recogió José todo el dinero que se halló en la tierra de Egipto y en la tierra de Canaán, por los alimentos que de él compraban; y metió José el dinero en casa de Faraón.
GEN.47.15	47	15	And when money failed in the land of Egypt, and in the land of Canaan, all the Egyptians came unto Joseph, and said, Give us bread: for why should we die in thy presence? for the money faileth.	-0.5	negative	Y acabado el dinero de la tierra de Egipto y de la tierra de Canaán, vino todo Egipto á José diciendo: Danos pan: ¿por qué moriremos delante de ti, por haberse acabado el dinero?
GEN.47.16	47	16	And Joseph said, Give your cattle; and I will give you for your cattle, if money fail.	-0.5	negative	Y José dijo: Dad vuestros ganados, y yo os daré por vuestros ganados, si se ha acabado el dinero.
GEN.47.17	47	17	And they brought their cattle unto Joseph: and Joseph gave them bread {in exchange} for horses, and for the flocks, and for the cattle of the herds, and for the asses: and he fed them with bread for all their cattle for that year. {fed...: Heb. led them}	0.0	neutral	Y ellos trajeron sus ganados á José; y José les dió alimentos por caballos, y por el ganado de las ovejas, y por el ganado de las vacas, y por asnos: y sustentólos de pan por todos sus ganados aquel año.
GEN.47.18	47	18	When that year was ended, they came unto him the second year, and said unto him, We will not hide {it} from my lord, how that our money is spent; my lord also hath our herds of cattle; there is not ought left in the sight of my lord, but our bodies, and our lands:	-0.0333	neutral	Y acabado aquel año, vinieron á él el segundo año, y le dijeron: No encubriremos á nuestro señor que el dinero ciertamente se ha acabado; también el ganado es ya de nuestro señor; nada ha quedado delante de nuestro señor sino nuestros cuerpos y nuestra tierra.
GEN.47.19	47	19	Wherefore shall we die before thine eyes, both we and our land? buy us and our land for bread, and we and our land will be servants unto Pharaoh: and give {us} seed, that we may live, and not die, that the land be not desolate.	0.1364	positive	¿Por qué moriremos delante de tus ojos, así nosotros como nuestra tierra? Cómpranos á nosotros y á nuestra tierra por pan, y seremos nosotros y nuestra tierra siervos de Faraón: y danos simiente para que vivamos y no muramos, y no sea asolada la tierra.
GEN.47.20	47	20	And Joseph bought all the land of Egypt for Pharaoh; for the Egyptians sold every man his field, because the famine prevailed over them: so the land became Pharaoh's.	0.0	neutral	Entonces compró José toda la tierra de Egipto para Faraón; pues los Egipcios vendieron cada uno sus tierras, porque se agravó el hambre sobre ellos: y la tierra vino á ser de Faraón.
GEN.47.21	47	21	And as for the people, he removed them to cities from {one} end of the borders of Egypt even to the {other} end thereof.	-0.125	negative	Y al pueblo hízolo pasar á las ciudades desde el un cabo del término de Egipto hasta el otro cabo.
GEN.47.22	47	22	Only the land of the priests bought he not; for the priests had a portion {assigned them} of Pharaoh, and did eat their portion which Pharaoh gave them: wherefore they sold not their lands. {priests: or, princes}	0.0	neutral	Solamente la tierra de los sacerdotes no compró, por cuanto los sacerdotes tenían ración de Faraón, y ellos comían su ración que Faraón les daba: por eso no vendieron su tierra.
GEN.47.23	47	23	Then Joseph said unto the people, Behold, I have bought you this day and your land for Pharaoh: lo, {here is} seed for you, and ye shall sow the land.	0.0	neutral	Y José dijo al pueblo: He aquí os he hoy comprado y á vuestra tierra para Faraón: ved aquí simiente, y sembraréis la tierra.
GEN.47.24	47	24	And it shall come to pass in the increase, that ye shall give the fifth {part} unto Pharaoh, and four parts shall be your own, for seed of the field, and for your food, and for them of your households, and for food for your little ones.	0.2062	positive	Y será que de los frutos daréis el quinto á Faraón, y las cuatro partes serán vuestras para sembrar las tierras, y para vuestro mantenimiento, y de los que están en vuestras casas, y para que coman vuestros niños.
GEN.47.25	47	25	And they said, Thou hast saved our lives: let us find grace in the sight of my lord, and we will be Pharaoh's servants.	0.0	neutral	Y ellos respondieron: La vida nos has dado: hallemos gracia en ojos de mi señor, y seamos siervos de Faraón.
GEN.47.26	47	26	And Joseph made it a law over the land of Egypt unto this day, {that} Pharaoh should have the fifth {part}; except the land of the priests only, {which} became not Pharaoh's. {priests: or, princes}	0.0	neutral	Entonces José lo puso por fuero hasta hoy sobre la tierra de Egipto, señalando para Faraón el quinto; excepto sólo la tierra de los sacerdotes, que no fué de Faraón.
GEN.47.27	47	27	And Israel dwelt in the land of Egypt, in the country of Goshen; and they had possessions therein, and grew, and multiplied exceedingly.	0.0	neutral	Así habitó Israel en la tierra de Egipto, en la tierra de Gosén; y aposesionáronse en ella, y se aumentaron, y multiplicaron en gran manera.
GEN.47.28	47	28	And Jacob lived in the land of Egypt seventeen years: so the whole age of Jacob was an hundred forty and seven years. {the whole...: Heb. the days of the years of his life}	0.2	positive	Y vivió Jacob en la tierra de Egipto diecisiete años: y fueron los días de Jacob, los años de su vida, ciento cuarenta y siete años.
GEN.47.29	47	29	And the time drew nigh that Israel must die: and he called his son Joseph, and said unto him, If now I have found grace in thy sight, put, I pray thee, thy hand under my thigh, and deal kindly and truly with me; bury me not, I pray thee, in Egypt:	0.6	positive	Y llegáronse los días de Israel para morir, y llamó á José su hijo, y le dijo: Si he hallado ahora gracia en tus ojos, ruégote que pongas tu mano debajo de mi muslo, y harás conmigo misericordia y verdad; ruégote que no me entierres en Egipto;
GEN.47.30	47	30	But I will lie with my fathers, and thou shalt carry me out of Egypt, and bury me in their buryingplace. And he said, I will do as thou hast said.	0.0	neutral	Mas cuando durmiere con mis padres, llevarme has de Egipto, y me sepultarás en el sepulcro de ellos. Y él respondió: Yo haré como tú dices.
GEN.47.31	47	31	And he said, Swear unto me. And he sware unto him. And Israel bowed himself upon the bed's head.	0.0	neutral	Y él dijo: Júramelo. Y él le juró. Entonces Israel se inclinó sobre la cabecera de la cama.
GEN.48.1	48	1	And it came to pass after these things, that {one} told Joseph, Behold, thy father {is} sick: and he took with him his two sons, Manasseh and Ephraim.	-0.7143	negative	Y SUCEDIO después de estas cosas el haberse dicho á José: He aquí tu padre está enfermo. Y él tomó consigo sus dos hijos Manasés y Ephraim.
GEN.48.2	48	2	And {one} told Jacob, and said, Behold, thy son Joseph cometh unto thee: and Israel strengthened himself, and sat upon the bed.	0.0	neutral	Y se hizo saber á Jacob, diciendo: He aquí tu hijo José viene á ti. Entonces se esforzó Israel, y sentóse sobre la cama;
