verse_id	chapter	verse	text_en	polarity_en	label_en	text_es
GEN.42.36	42	36	And Jacob their father said unto them, Me have ye bereaved {of my children}: Joseph {is} not, and Simeon {is} not, and ye will take Benjamin {away}: all these things are against me.	0.0	neutral	Entonces su padre Jacob les dijo: Habéisme privado de mis hijos; José no parece, ni Simeón tampoco, y á Benjamín le llevaréis: contra mí son todas estas cosas.
GEN.42.37	42	37	And Reuben spake unto his father, saying, Slay my two sons, if I bring him not to thee: deliver him into my hand, and I will bring him to thee again.	0.0	neutral	Y Rubén habló á su padre, diciendo: Harás morir á mis dos hijos, si no te lo volviere; entrégalo en mi mano, que yo lo volveré á ti.
GEN.42.38	42	38	And he said, My son shall not go down with you; for his brother is dead, and he is left alone: if mischief befall him by the way in the which ye go, then shall ye bring down my gray hairs with sorrow to the grave.	-0.1278	negative	Y él dijo: No descenderá mi hijo con vosotros; que su hermano es muerto, y él solo ha quedado: y si le aconteciere algún desastre en el camino por donde vais, haréis descender mis canas con dolor á la sepultura.
GEN.43.1	43	1	And the famine {was} sore in the land.	0.0	neutral	Y EL hambre era grande en la tierra.
GEN.43.2	43	2	And it came to pass, when they had eaten up the corn which they had brought out of Egypt, their father said unto them, Go again, buy us a little food.	-0.1875	negative	Y aconteció que como acabaron de comer el trigo que trajeron de Egipto, díjoles su padre: Volved, y comprad para nosotros un poco de alimento.
GEN.43.3	43	3	And Judah spake unto him, saying, The man did solemnly protest unto us, saying, Ye shall not see my face, except your brother {be} with you. {did...: Heb. protesting protested}	0.0	neutral	Y respondió Judá, diciendo: Aquel varón nos protestó con ánimo resuelto, diciendo: No veréis mi rostro sin vuestro hermano con vosotros.
GEN.43.4	43	4	If thou wilt send our brother with us, we will go down and buy thee food:	-0.1556	negative	Si enviares á nuestro hermano con nosotros, descenderemos y te compraremos alimento:
GEN.43.5	43	5	But if thou wilt not send {him}, we will not go down: for the man said unto us, Ye shall not see my face, except your brother {be} with you.	-0.1556	negative	Pero si no le enviares, no descenderemos: porque aquel varón nos dijo: No veréis mi rostro sin vuestro hermano con vosotros.
GEN.43.6	43	6	And Israel said, Wherefore dealt ye {so} ill with me, {as} to tell the man whether ye had yet a brother?	-0.5	negative	Y dijo Israel: ¿Por qué me hicisteis tanto mal, declarando al varón que teníais más hermano?
GEN.43.7	43	7	And they said, The man asked us straitly of our state, and of our kindred, saying, {Is} your father yet alive? have ye {another} brother? and we told him according to the tenor of these words: could we certainly know that he would say, Bring your brother down? {asked...: Heb. asking asked us} {tenor: Heb. mouth} {could...: Heb. knowing could we know}	0.0529	neutral	Y ellos respondieron: Aquel varón nos preguntó expresamente por nosotros, y por nuestra parentela, diciendo: ¿Vive aún vuestro padre? ¿tenéis otro hermano? y declarámosle conforme á estas palabras. ¿Podíamos nosotros saber que había de decir: Haced venir á vuestro hermano?
GEN.43.8	43	8	And Judah said unto Israel his father, Send the lad with me, and we will arise and go; that we may live, and not die, both we, and thou, {and} also our little ones.	-0.0256	neutral	Entonces Judá dijo á Israel su padre: Envía al mozo conmigo, y nos levantaremos é iremos, á fin que vivamos y no muramos nosotros, y tú, y nuestros niños.
GEN.43.9	43	9	I will be surety for him; of my hand shalt thou require him: if I bring him not unto thee, and set him before thee, then let me bear the blame for ever:	0.0	neutral	Yo lo fío; á mí me pedirás cuenta de él: si yo no te lo volviere y lo pusiere delante de ti, seré para ti el culpante todos los días:
GEN.43.10	43	10	For except we had lingered, surely now we had returned this second time. {this: or, twice by this}	0.25	positive	Que si no nos hubiéramos detenido, cierto ahora hubiéramos ya vuelto dos veces.
GEN.43.11	43	11	And their father Israel said unto them, If {it must be} so now, do this; take of the best fruits in the land in your vessels, and carry down the man a present, a little balm, and a little honey, spices, and myrrh, nuts, and almonds:	0.0939	neutral	Entonces Israel su padre les respondió: Pues que así es, hacedlo; tomad de lo mejor de la tierra en vuestros vasos, y llevad á aquel varón un presente, un poco de bálsamo, y un poco de miel, aromas y mirra, nueces y almendras.
GEN.43.12	43	12	And take double money in your hand; and the money that was brought again in the mouth of your sacks, carry {it} again in your hand; peradventure it {was} an oversight:	0.0	neutral	Y tomad en vuestras manos doblado dinero, y llevad en vuestra mano el dinero vuelto en las bocas de vuestros costales; quizá fué yerro.
GEN.43.13	43	13	Take also your brother, and arise, go again unto the man:	0.0	neutral	Tomad también á vuestro hermano, y levantaos, y volved á aquel varón.
GEN.43.14	43	14	And God Almighty give you mercy before the man, that he may send away your other brother, and Benjamin. If I be bereaved {of my children}, I am bereaved. {If...: or, And I, as I have been, etc.}	-0.125	negative	Y el Dios Omnipotente os dé misericordias delante de aquel varón, y os suelte al otro vuestro hermano, y á este Benjamín. Y si he de ser privado de mis hijos, séalo.
GEN.43.15	43	15	And the men took that present, and they took double money in their hand, and Benjamin; and rose up, and went down to Egypt, and stood before Joseph.	0.1111	positive	Entonces tomaron aquellos varones el presente, y tomaron en su mano doblado dinero, y á Benjamín; y se levantaron, y descendieron á Egipto, y presentáronse delante de José.
GEN.43.16	43	16	And when Joseph saw Benjamin with them, he said to the ruler of his house, Bring {these} men home, and slay, and make ready; for {these} men shall dine with me at noon. {slay: Heb. kill a killing} {dine: Heb. eat}	0.2	positive	Y vió José á Benjamín con ellos, y dijo al mayordomo de su casa: Mete en casa á esos hombres, y degüella víctima, y aderéza la; porque estos hombres comerán conmigo al medio día.
GEN.43.17	43	17	And the man did as Joseph bade; and the man brought the men into Joseph's house.	0.0	neutral	E hizo el hombre como José dijo; y metió aquel hombre á los hombres en casa de José.
GEN.43.18	43	18	And the men were afraid, because they were brought into Joseph's house; and they said, Because of the money that was returned in our sacks at the first time are we brought in; that he may seek occasion against us, and fall upon us, and take us for bondmen, and our asses. {seek...: Heb. roll himself upon us}	-0.175	negative	Y aquellos hombres tuvieron temor, cuando fueron metidos en casa de José, y decían: Por el dinero que fué vuelto en nuestros costales la primera vez nos han metido aquí, para revolver contra nosotros, y dar sobre nosotros, y tomarnos por siervos á nosotros, y á nuestros asnos.
GEN.43.19	43	19	And they came near to the steward of Joseph's house, and they communed with him at the door of the house,	0.1	neutral	Y llegáronse al mayordomo de la casa de José, y le hablaron á la entrada de la casa.
GEN.43.20	43	20	And said, O sir, we came indeed down at the first time to buy food: {we...: Heb. coming down we came down}	-0.1933	negative	Y dijeron: Ay, señor mío, nosotros en realidad de verdad descendimos al principio á comprar alimentos:
GEN.43.21	43	21	And it came to pass, when we came to the inn, that we opened our sacks, and, behold, {every} man's money {was} in the mouth of his sack, our money in full weight: and we have brought it again in our hand.	0.35	positive	Y aconteció que como vinimos al mesón y abrimos nuestros costales, he aquí el dinero de cada uno estaba en la boca de su costal, nuestro dinero en su justo peso; y hémoslo vuelto en nuestras manos.
GEN.43.22	43	22	And other money have we brought down in our hands to buy food: we cannot tell who put our money in our sacks.	-0.1403	negative	Hemos también traído en nuestras manos otro dinero para comprar alimentos: nosotros no sabemos quién haya puesto nuestro dinero en nuestros costales.
GEN.43.23	43	23	And he said, Peace {be} to you, fear not: your God, and the God of your father, hath given you treasure in your sacks: I had your money. And he brought Simeon out unto them. {I had...: Heb. your money came to me}	0.0	neutral	Y él respondió: Paz á vosotros, no temáis; vuestro Dios y el Dios de vuestro padre os dió el tesoro en vuestros costales: vuestro dinero vino á mí. Y sacó á Simeón á ellos.
GEN.43.24	43	24	And the man brought the men into Joseph's house, and gave {them} water, and they washed their feet; and he gave their asses provender.	0.0	neutral	Y metió aquel varón á aquellos hombres en casa de José: y dióles agua, y lavaron sus pies: y dió de comer á sus asnos.
GEN.43.25	43	25	And they made ready the present against Joseph came at noon: for they heard that they should eat bread there.	0.1	neutral	Y ellos prepararon el presente entretanto que venía José al medio día, porque habían oído que allí habían de comer pan.
GEN.43.26	43	26	And when Joseph came home, they brought him the present which {was} in their hand into the house, and bowed themselves to him to the earth.	0.0	neutral	Y vino José á casa, y ellos le trajeron el presente que tenían en su mano dentro de casa, é inclináronse á él hasta tierra.
GEN.43.27	43	27	And he asked them of {their} welfare, and said, {Is} your father well, the old man of whom ye spake? {Is} he yet alive? {welfare: Heb. peace} {Is your...: Heb. Is there peace to your father?}	0.1	neutral	Entonces les preguntó él cómo estaban, y dijo: ¿Vuestro padre, el anciano que dijisteis, lo pasa bien? ¿vive todavía?
GEN.43.28	43	28	And they answered, Thy servant our father {is} in good health, he {is} yet alive. And they bowed down their heads, and made obeisance.	0.2148	positive	Y ellos respondieron: Bien va á tu siervo nuestro padre; aun vive. Y se inclinaron, é hicieron reverencia.
GEN.43.29	43	29	And he lifted up his eyes, and saw his brother Benjamin, his mother's son, and said, {Is} this your younger brother, of whom ye spake unto me? And he said, God be gracious unto thee, my son.	0.0	neutral	Y alzando él sus ojos vió á Benjamín su hermano, hijo de su madre, y dijo: ¿Es éste vuestro hermano menor, de quien me hablasteis? Y dijo: Dios tenga misericordia de ti, hijo mío.
GEN.43.30	43	30	And Joseph made haste; for his bowels did yearn upon his brother: and he sought {where} to weep; and he entered into {his} chamber, and wept there.	0.0	neutral	Entonces José se apresuró, porque se conmovieron sus entrañas á causa de su hermano, y procuró donde llorar: y entróse en su cámara, y lloró allí.
GEN.43.31	43	31	And he washed his face, and went out, and refrained himself, and said, Set on bread.	0.0	neutral	Y lavó su rostro, y salió fuera, y reprimióse, y dijo: Poned pan.
GEN.43.32	43	32	And they set on for him by himself, and for them by themselves, and for the Egyptians, which did eat with him, by themselves: because the Egyptians might not eat bread with the Hebrews; for that {is} an abomination unto the Egyptians.	0.0	neutral	Y pusieron para él aparte, y separadamente para ellos, y aparte para los Egipcios que con él comían: porque los Egipcios no pueden comer pan con los Hebreos, lo cual es abominación á los Egipcios.
GEN.43.33	43	33	And they sat before him, the firstborn according to his birthright, and the youngest according to his youth: and the men marvelled one at another.	0.0	neutral	Y sentáronse delante de él, el mayor conforme á su mayoría, y el menor conforme á su menoría; y estaban aquellos hombres atónitos mirándose el uno al otro.
GEN.43.34	43	34	And he took {and sent} messes unto them from before him: but Benjamin's mess was five times so much as any of theirs. And they drank, and were merry with him. {were...: Heb. drank largely}	0.0798	neutral	Y él tomó viandas de delante de sí para ellos; mas la porción de Benjamín era cinco veces como cualquiera de las de ellos. Y bebieron, y alegráronse con él.
GEN.44.1	44	1	And he commanded the steward of his house, saying, Fill the men's sacks {with} food, as much as they can carry, and put every man's money in his sack's mouth. {the steward...: Heb. him that was over his house}	0.2	positive	Y MANDO José al mayordomo de su casa, diciendo: Hinche los costales de aquestos varones de alimentos, cuanto pudieren llevar, y pon el dinero de cada uno en la boca de su costal:
GEN.44.2	44	2	And put my cup, the silver cup, in the sack's mouth of the youngest, and his corn money. And he did according to the word that Joseph had spoken.	0.0	neutral	Y pondrás mi copa, la copa de plata, en la boca del costal del menor, con el dinero de su trigo. Y él hizo como dijo José.
GEN.44.3	44	3	As soon as the morning was light, the men were sent away, they and their asses.	0.4	positive	Venida la mañana, los hombres fueron despedidos con sus asnos.
GEN.44.4	44	4	{And} when they were gone out of the city, {and} not {yet} far off, Joseph said unto his steward, Up, follow after the men; and when thou dost overtake them, say unto them, Wherefore have ye rewarded evil for good?	-0.0667	neutral	Habiendo ellos salido de la ciudad, de la que aun no se habían alejado, dijo José á su mayordomo: Levántate, y sigue á esos hombres; y cuando los alcanzares, diles: ¿Por qué habéis vuelto mal por bien?
GEN.44.5	44	5	{Is} not this {it} in which my lord drinketh, and whereby indeed he divineth? ye have done evil in so doing. {divineth: or, maketh trial?}	-1.0	negative	¿No es ésta en la que bebe mi señor, y por la que suele adivinar? habéis hecho mal en lo que hicisteis.
GEN.44.6	44	6	And he overtook them, and he spake unto them these same words.	0.0	neutral	Y como él los alcanzó, díjoles estas palabras.
GEN.44.7	44	7	And they said unto him, Wherefore saith my lord these words? God forbid that thy servants should do according to this thing:	0.0	neutral	Y ellos le respondieron: ¿Por qué dice mi señor tales cosas? Nunca tal hagan tus siervos.
GEN.44.8	44	8	Behold, the money, which we found in our sacks' mouths, we brought again unto thee out of the land of Canaan: how then should we steal out of thy lord's house silver or gold?	0.0	neutral	He aquí, el dinero que hallamos en la boca de nuestros costales, te lo volvimos á traer desde la tierra de Canaán; ¿cómo, pues, habíamos de hurtar de casa de tu señor plata ni oro?
GEN.44.9	44	9	With whomsoever of thy servants it be found, both let him die, and we also will be my lord's bondmen.	0.0	neutral	Aquel de tus siervos en quien fuere hallada la copa, que muera, y aun nosotros seremos siervos de mi señor.
GEN.44.10	44	10	And he said, Now also {let} it {be} according unto your words: he with whom it is found shall be my servant; and ye shall be blameless.	0.0	neutral	Y él dijo: También ahora sea conforme á vuestras palabras; aquél en quien se hallare, será mi siervo, y vosotros seréis sin culpa.
GEN.44.11	44	11	Then they speedily took down every man his sack to the ground, and opened every man his sack.	-0.1556	negative	Ellos entonces se dieron prisa, y derribando cada uno su costal en tierra, abrió cada cual el costal suyo.
GEN.44.12	44	12	And he searched, {and} began at the eldest, and left at the youngest: and the cup was found in Benjamin's sack.	0.0	neutral	Y buscó; desde el mayor comenzó, y acabó en el menor; y la copa fué hallada en el costal de Benjamín.
GEN.44.13	44	13	Then they rent their clothes, and laded every man his ass, and returned to the city.	0.0	neutral	Entonces ellos rasgaron sus vestidos, y cargó cada uno su asno, y volvieron á la ciudad.
GEN.44.14	44	14	And Judah and his brethren came to Joseph's house; for he {was} yet there: and they fell before him on the ground.	0.0	neutral	Y llegó Judá con sus hermanos á casa de José, que aun estaba allí, y postráronse delante de él en tierra.
GEN.44.15	44	15	And Joseph said unto them, What deed {is} this that ye have done? wot ye not that such a man as I can certainly divine? {divine: or, make trial?}	0.1071	positive	Y díjoles José: ¿Qué obra es esta que habéis hecho? ¿no sabéis que un hombre como yo sabe adivinar?
GEN.44.16	44	16	And Judah said, What shall we say unto my lord? what shall we speak? or how shall we clear ourselves? God hath found out the iniquity of thy servants: behold, we {are} my lord's servants, both we, and {he} also with whom the cup is found.	0.1	neutral	Entonces dijo Judá: ¿Qué diremos á mi señor? ¿qué hablaremos? ¿ó con qué nos justificaremos? Dios ha hallado la maldad de tus siervos: he aquí, nosotros somos siervos de mi señor, nosotros, y también aquél en cuyo poder fué hallada la copa.
GEN.44.17	44	17	And he said, God forbid that I should do so: {but} the man in whose hand the cup is found, he shall be my servant; and as for you, get you up in peace unto your father.	-0.75	negative	Y él respondió: Nunca yo tal haga: el varón en cuyo poder fué hallada la copa, él será mi siervo; vosotros id en paz á vuestro padre.
GEN.44.18	44	18	Then Judah came near unto him, and said, Oh my lord, let thy servant, I pray thee, speak a word in my lord's ears, and let not thine anger burn against thy servant: for thou {art} even as Pharaoh.	-0.3	negative	Entonces Judá se llegó á él, y dijo: Ay señor mío, ruégote que hable tu siervo una palabra en oídos de mi señor, y no se encienda tu enojo contra tu siervo, pues que tú eres como Faraón.
GEN.44.19	44	19	My lord asked his servants, saying, Have ye a father, or a brother?	0.0	neutral	Mi señor preguntó á sus siervos, diciendo: ¿Tenéis padre ó hermano?
GEN.44.20	44	20	And we said unto my lord, We have a father, an old man, and a child of his old age, a little one; and his brother is dead, and he alone is left of his mother, and his father loveth him.	-0.0375	neutral	Y nosotros respondimos á mi señor: Tenemos un padre anciano, y un mozo que le nació en su vejez, pequeño aún; y un hermano suyo murió, y él quedó solo de su madre, y su padre lo ama.
GEN.44.21	44	21	And thou saidst unto thy servants, Bring him down unto me, that I may set mine eyes upon him.	-0.1556	negative	Y tú dijiste á tus siervos: Traédmelo, y pondré mis ojos sobre él.
GEN.44.22	44	22	And we said unto my lord, The lad cannot leave his father: for {if} he should leave his father, {his father} would die.	0.0	neutral	Y nosotros dijimos á mi señor: El mozo no puede dejar á su padre, porque si le dejare, su padre morirá.
GEN.44.23	44	23	And thou saidst unto thy servants, Except your youngest brother come down with you, ye shall see my face no more.	-0.2028	negative	Y dijiste á tus siervos: Si vuestro hermano menor no descendiere con vosotros, no veáis más mi rostro.
GEN.44.24	44	24	And it came to pass when we came up unto thy servant my father, we told him the words of my lord.	0.0	neutral	Aconteció pues, que como llegamos á mi padre tu siervo, contámosle las palabras de mi señor.
GEN.44.25	44	25	And our father said, Go again, {and} buy us a little food.	-0.1875	negative	Y dijo nuestro padre: Volved á comprarnos un poco de alimento.
GEN.44.26	44	26	And we said, We cannot go down: if our youngest brother be with us, then will we go down: for we may not see the man's face, except our youngest brother {be} with us.	-0.1556	negative	Y nosotros respondimos: No podemos ir: si nuestro hermano fuere con nosotros, iremos; porque no podemos ver el rostro del varón, no estando con nosotros nuestro hermano el menor.
GEN.44.27	44	27	And thy servant my father said unto us, Ye know that my wife bare me two {sons}:	0.05	neutral	Entonces tu siervo mi padre nos dijo: Vosotros sabéis que dos me parió mi mujer;
GEN.44.28	44	28	And the one went out from me, and I said, Surely he is torn in pieces; and I saw him not since:	0.5	positive	Y el uno salió de conmigo, y pienso de cierto que fué despedazado, y hasta ahora no le he visto;
GEN.44.29	44	29	And if ye take this also from me, and mischief befall him, ye shall bring down my gray hairs with sorrow to the grave.	-0.1556	negative	Y si tomareis también éste de delante de mí, y le aconteciere algún desastre, haréis descender mis canas con dolor á la sepultura.
GEN.44.30	44	30	Now therefore when I come to thy servant my father, and the lad {be} not with us; seeing that his life is bound up in the lad's life;	0.0	neutral	Ahora, pues, cuando llegare yo á tu siervo mi padre, y el mozo no fuere conmigo, como su alma está ligada al alma de él,
GEN.44.31	44	31	It shall come to pass, when he seeth that the lad {is} not {with us}, that he will die: and thy servants shall bring down the gray hairs of thy servant our father with sorrow to the grave.	-0.1556	negative	Sucederá que cuando no vea al mozo, morirá: y tus siervos harán descender las canas de tu siervo nuestro padre con dolor á la sepultura.
GEN.44.32	44	32	For thy servant became surety for the lad unto my father, saying, If I bring him not unto thee, then I shall bear the blame to my father for ever.	0.0	neutral	Como tu siervo salió por fiador del mozo con mi padre, diciendo: Si no te lo volviere, entonces yo seré culpable para mi padre todos los días;
GEN.44.33	44	33	Now therefore, I pray thee, let thy servant abide instead of the lad a bondman to my lord; and let the lad go up with his brethren.	0.0	neutral	Ruégote por tanto que quede ahora tu siervo por el mozo por siervo de mi señor, y que el mozo vaya con sus hermanos.
GEN.44.34	44	34	For how shall I go up to my father, and the lad {be} not with me? lest peradventure I see the evil that shall come on my father. {come...: Heb. find my father}	-1.0	negative	Porque ¿cómo iré yo á mi padre sin el mozo? No podré, por no ver el mal que sobrevendrá á mi padre.
GEN.45.1	45	1	Then Joseph could not refrain himself before all them that stood by him; and he cried, Cause every man to go out from me. And there stood no man with him, while Joseph made himself known unto his brethren.	0.0	neutral	NO podía ya José contenerse delante de todos los que estaban al lado suyo, y clamó: Haced salir de conmigo á todos. Y no quedó nadie con él, al darse á conocer José á sus hermanos.
GEN.45.2	45	2	And he wept aloud: and the Egyptians and the house of Pharaoh heard. {wept...: Heb. gave forth his voice in weeping}	0.0	neutral	Entonces se dió á llorar á voz en grito; y oyeron los Egipcios, y oyó también la casa de Faraón.
GEN.45.3	45	3	And Joseph said unto his brethren, I {am} Joseph; doth my father yet live? And his brethren could not answer him; for they were troubled at his presence. {troubled: or, terrified}	-0.2879	negative	Y dijo José á sus hermanos: Yo soy José: ¿vive aún mi padre? Y sus hermanos no pudieron responderle, porque estaban turbados delante de él.
GEN.45.4	45	4	And Joseph said unto his brethren, Come near to me, I pray you. And they came near. And he said, I {am} Joseph your brother, whom ye sold into Egypt.	0.1	neutral	Entonces dijo José á sus hermanos: Llegaos ahora á mí. Y ellos se llegaron. Y él dijo: Yo soy José vuestro hermano el que vendisteis para Egipto.
GEN.45.5	45	5	Now therefore be not grieved, nor angry with yourselves, that ye sold me hither: for God did send me before you to preserve life. {nor...: Heb. neither let there be anger in your eyes}	-0.6	negative	Ahora pues, no os entristezcáis, ni os pese de haberme vendido acá; que para preservación de vida me envió Dios delante de vosotros:
GEN.45.6	45	6	For these two years {hath} the famine {been} in the land: and yet {there are} five years, in the which {there shall} neither {be} earing nor harvest.	0.0	neutral	Que ya ha habido dos años de hambre en medio de la tierra, y aun quedan cinco años en que ni habrá arada ni siega.
GEN.45.7	45	7	And God sent me before you to preserve you a posterity in the earth, and to save your lives by a great deliverance. {to preserve...: Heb. to put for you a remnant}	0.8	positive	Y Dios me envió delante de vosotros, para que vosotros quedaseis en la tierra, y para daros vida por medio de grande salvamento.
GEN.45.8	45	8	So now {it was} not you {that} sent me hither, but God: and he hath made me a father to Pharaoh, and lord of all his house, and a ruler throughout all the land of Egypt.	0.0	neutral	Así pues, no me enviasteis vosotros acá, sino Dios, que me ha puesto por padre de Faraón, y por señor de toda su casa, y por gobernador en toda la tierra de Egipto.
GEN.45.9	45	9	Haste ye, and go up to my father, and say unto him, Thus saith thy son Joseph, God hath made me lord of all Egypt: come down unto me, tarry not:	-0.1556	negative	Daos priesa, id á mi padre y decidle: Así dice tu hijo José: Dios me ha puesto por señor de todo Egipto; ven á mí, no te detengas:
GEN.45.10	45	10	And thou shalt dwell in the land of Goshen, and thou shalt be near unto me, thou, and thy children, and thy children's children, and thy flocks, and thy herds, and all that thou hast:	0.1	neutral	Y habitarás en la tierra de Gosén, y estarás cerca de mí, tú y tus hijos, y los hijos de tus hijos, tus ganados y tus vacas, y todo lo que tienes.
GEN.45.11	45	11	And there will I nourish thee; for yet {there are} five years of famine; lest thou, and thy household, and all that thou hast, come to poverty.	0.0	neutral	Y allí te alimentaré, pues aun quedan cinco años de hambre, porque no perezcas de pobreza tú y tu casa, y todo lo que tienes:
