verse_id	chapter	verse	text_en	polarity_en	label_en	text_pt
LUK.8.38	8	38	Now the man out of whom the devils were departed besought him that he might be with him: but Jesus sent him away, saying,	0.0	neutral	O homem de quem haviam saído os demônios suplicava-lhe que o deixasse ir com ele; mas Jesus o mandou embora, dizendo:
LUK.8.39	8	39	Return to thine own house, and shew how great things God hath done unto thee. And he went his way, and published throughout the whole city how great things Jesus had done unto him.	0.6	positive	"""Volte para casa e conte o quanto Deus lhe fez"". Assim, o homem se foi e anunciou a toda a cidade o quanto Jesus tinha feito por ele."
LUK.8.40	8	40	And it came to pass, that, when Jesus was returned, the people {gladly} received him: for they were all waiting for him.	0.5	positive	Quando Jesus voltou, uma multidão o recebeu, pois todos o esperavam.
LUK.8.41	8	41	And, behold, there came a man named Jairus, and he was a ruler of the synagogue: and he fell down at Jesus' feet, and besought him that he would come into his house:	-0.1556	negative	Então um homem chamado Jairo, dirigente da sinagoga, veio e prostrou-se aos pés de Jesus, implorando-lhe que fosse à sua casa
LUK.8.42	8	42	For he had one only daughter, about twelve years of age, and she lay a dying. But as he went the people thronged him.	0.0	neutral	porque sua única filha, de cerca de doze anos, estava à morte. Estando Jesus a caminho, a multidão o comprimia.
LUK.8.43	8	43	And a woman having an issue of blood twelve years, which had spent all her living upon physicians, neither could be healed of any,	-0.1	neutral	E estava ali certa mulher que havia doze anos vinha sofrendo de uma hemorragia e gastara tudo o que tinha com os médicos; mas ninguém pudera curá-la.
LUK.8.44	8	44	Came behind {him}, and touched the border of his garment: and immediately her issue of blood stanched.	-0.4	negative	Ela chegou por trás dele, tocou na borda de seu manto, e imediatamente cessou sua hemorragia.
LUK.8.45	8	45	And Jesus said, Who touched me? When all denied, Peter and they that were with him said, Master, the multitude throng thee and press {thee}, and sayest thou, Who touched me?	0.0	neutral	"""Quem tocou em mim? "", perguntou Jesus. Como todos negassem, Pedro disse: ""Mestre, a multidão se aglomera e te comprime""."
LUK.8.46	8	46	And Jesus said, Somebody hath touched me: for I perceive that virtue is gone out of me.	0.0	neutral	"Mas Jesus disse: ""Alguém tocou em mim; eu sei que de mim saiu poder""."
LUK.8.47	8	47	And when the woman saw that she was not hid, she came trembling, and falling down before him, she declared unto him before all the people for what cause she had touched him, and how she was healed immediately.	-0.1556	negative	Então a mulher, vendo que não conseguiria passar despercebida, veio tremendo e prostrou-se aos seus pés. Na presença de todo o povo contou por que tinha tocado nele e como fora instantaneamente curada.
LUK.8.48	8	48	And he said unto her, Daughter, be of good comfort: thy faith hath made thee whole; go in peace.	0.45	positive	"Então ele lhe disse: ""Filha, a sua fé a curou! Vá em paz""."
LUK.8.49	8	49	While he yet spake, there cometh one from the ruler of the synagogue's {house}, saying to him, Thy daughter is dead; trouble not the Master.	-0.2	negative	"Enquanto Jesus ainda estava falando, chegou alguém da casa de Jairo, o dirigente da sinagoga, e disse: ""Sua filha morreu. Não incomode mais o Mestre""."
LUK.8.50	8	50	But when Jesus heard {it}, he answered him, saying, Fear not: believe only, and she shall be made whole.	0.1	neutral	"Ouvindo isso, Jesus disse a Jairo: ""Não tenha medo; tão-somente creia, e ela será curada""."
LUK.8.51	8	51	And when he came into the house, he suffered no man to go in, save Peter, and James, and John, and the father and the mother of the maiden.	0.0	neutral	Quando chegou à casa de Jairo, não deixou ninguém entrar com ele, exceto Pedro, João, Tiago e o pai e a mãe da criança.
LUK.8.52	8	52	And all wept, and bewailed her: but he said, Weep not; she is not dead, but sleepeth.	0.1	neutral	"Enquanto isso, todo o povo estava se lamentando e chorando por ela. ""Não chorem"", disse Jesus. ""Ela não está morta, mas dorme""."
LUK.8.53	8	53	And they laughed him to scorn, knowing that she was dead.	0.25	positive	Todos começaram a rir dele, pois sabiam que ela estava morta.
LUK.8.54	8	54	And he put them all out, and took her by the hand, and called, saying, Maid, arise.	0.0	neutral	"Mas ele a tomou pela mão e disse: ""Menina, levante-se! """
LUK.8.55	8	55	And her spirit came again, and she arose straightway: and he commanded to give her meat.	0.0	neutral	O espírito dela voltou, e ela se levantou imediatamente. Então Jesus lhes ordenou que lhe dessem de comer.
LUK.8.56	8	56	And her parents were astonished: but he charged them that they should tell no man what was done.	0.0	neutral	Os pais dela ficaram maravilhados, mas ele lhes ordenou que não contassem a ninguém o que tinha acontecido.
LUK.9.1	9	1	Then he called his twelve disciples together, and gave them power and authority over all devils, and to cure diseases.	0.0	neutral	Reunindo os Doze, Jesus deu-lhes poder e autoridade para expulsar todos os demônios e curar doenças,
LUK.9.2	9	2	And he sent them to preach the kingdom of God, and to heal the sick.	-0.7143	negative	e os enviou a pregar o Reino de Deus e a curar os enfermos.
LUK.9.3	9	3	And he said unto them, Take nothing for {your} journey, neither staves, nor scrip, neither bread, neither money; neither have two coats apiece.	0.0	neutral	"E disse-lhes: ""Não levem nada pelo caminho: nem bordão, nem saco de viagem, nem pão, nem dinheiro, nem túnica extra."
LUK.9.4	9	4	And whatsoever house ye enter into, there abide, and thence depart.	0.0	neutral	Na casa em que vocês entrarem, fiquem ali até partirem.
LUK.9.5	9	5	And whosoever will not receive you, when ye go out of that city, shake off the very dust from your feet for a testimony against them.	0.2	positive	"Se não os receberem, sacudam a poeira dos seus pés quando saírem daquela cidade, como testemunho contra eles""."
LUK.9.6	9	6	And they departed, and went through the towns, preaching the gospel, and healing every where.	0.0	neutral	Assim, eles saíram e foram pelos povoados, pregando o evangelho e fazendo curas por toda parte.
LUK.9.7	9	7	Now Herod the tetrarch heard of all that was done by him: and he was perplexed, because that it was said of some, that John was risen from the dead;	0.1	neutral	Herodes, o tetrarca, ouviu falar de tudo o que estava acontecendo e ficou perplexo, porque algumas pessoas estavam dizendo que João tinha ressuscitado dos mortos;
LUK.9.8	9	8	And of some, that Elias had appeared; and of others, that one of the old prophets was risen again.	0.1	neutral	outros, que Elias tinha aparecido; e ainda outros, que um dos profetas do passado tinha voltado à vida.
LUK.9.9	9	9	And Herod said, John have I beheaded: but who is this, of whom I hear such things? And he desired to see him.	0.0	neutral	"Mas Herodes disse: ""João, eu decapitei! Quem, pois, é este de quem ouço essas coisas? "" E procurava vê-lo."
LUK.9.10	9	10	And the apostles, when they were returned, told him all that they had done. And he took them, and went aside privately into a desert place belonging to the city called Bethsaida.	0.0	neutral	Ao voltarem, os apóstolos relataram a Jesus o que tinham feito. Então ele os tomou consigo, e retiraram-se para uma cidade chamada Betsaida;
LUK.9.11	9	11	And the people, when they knew {it}, followed him: and he received them, and spake unto them of the kingdom of God, and healed them that had need of healing.	0.0	neutral	mas as multidões ficaram sabendo, e o seguiram. Ele as acolheu, e falava-lhes acerca do Reino de Deus, e curava os que precisavam de cura.
LUK.9.12	9	12	And when the day began to wear away, then came the twelve, and said unto him, Send the multitude away, that they may go into the towns and country round about, and lodge, and get victuals: for we are here in a desert place.	-0.2	negative	"Ao fim da tarde os Doze aproximaram-se dele e disseram: ""Manda embora a multidão para que eles possam ir aos campos vizinhos e aos povoados, e encontrem comida e pousada, porque aqui estamos em lugar deserto""."
LUK.9.13	9	13	But he said unto them, Give ye them to eat. And they said, We have no more but five loaves and two fishes; except we should go and buy meat for all this people.	-0.25	negative	"Ele, porém, respondeu: ""Dêem-lhes vocês algo para comer"". Eles disseram: ""Temos apenas cinco pães e dois peixes — a menos que compremos alimento para toda esta multidão""."
LUK.9.14	9	14	For they were about five thousand men. And he said to his disciples, Make them sit down by fifties in a company.	-0.1556	negative	"( E estavam ali cerca de cinco mil homens ). Mas ele disse aos seus discípulos: ""Façam-nos sentar-se em grupos de cinqüenta""."
LUK.9.15	9	15	And they did so, and made them all sit down.	-0.1556	negative	Os discípulos assim fizeram, e todos se assentaram.
LUK.9.16	9	16	Then he took the five loaves and the two fishes, and looking up to heaven, he blessed them, and brake, and gave to the disciples to set before the multitude.	0.0	neutral	Tomando os cinco pães e os dois peixes, e olhando para o céu, deu graças e os partiu. Em seguida, entregou-os aos discípulos para que os servissem ao povo.
LUK.9.17	9	17	And they did eat, and were all filled: and there was taken up of fragments that remained to them twelve baskets.	0.4	positive	Todos comeram e ficaram satisfeitos, e os discípulos recolheram doze cestos cheios de pedaços que sobraram.
LUK.9.18	9	18	And it came to pass, as he was alone praying, his disciples were with him: and he asked them, saying, Whom say the people that I am?	0.0	neutral	"Certa vez Jesus estava orando em particular, e com ele estavam os seus discípulos; então lhes perguntou: ""Quem as multidões dizem que eu sou? """
LUK.9.19	9	19	They answering said, John the Baptist; but some {say}, Elias; and others {say}, that one of the old prophets is risen again.	0.1	neutral	"Eles responderam: ""Alguns dizem que és João Batista; outros, Elias; e, ainda outros, que és um dos profetas do passado que ressuscitou""."
LUK.9.20	9	20	He said unto them, But whom say ye that I am? Peter answering said, The Christ of God.	0.0	neutral	"""E vocês, o que dizem? "", perguntou. ""Quem vocês dizem que eu sou? "" Pedro respondeu: ""O Cristo de Deus""."
LUK.9.21	9	21	And he straitly charged them, and commanded {them} to tell no man that thing;	0.0	neutral	Jesus os advertiu severamente que não contassem isso a ninguém.
LUK.9.22	9	22	Saying, The Son of man must suffer many things, and be rejected of the elders and chief priests and scribes, and be slain, and be raised the third day.	0.25	positive	"E disse: ""É necessário que o Filho do homem sofra muitas coisas e seja rejeitado pelos líderes religiosos, pelos chefes dos sacerdotes e pelos mestres da lei, seja morto e ressuscite no terceiro dia""."
LUK.9.23	9	23	And he said to {them} all, If any {man} will come after me, let him deny himself, and take up his cross daily, and follow me.	0.0	neutral	"Jesus dizia a todos: ""Se alguém quiser acompanhar-me, negue-se a si mesmo, tome diariamente a sua cruz e siga-me."
LUK.9.24	9	24	For whosoever will save his life shall lose it: but whosoever will lose his life for my sake, the same shall save it.	0.0	neutral	Pois quem quiser salvar a sua vida a perderá; mas quem perder a vida por minha causa, este a salvará.
LUK.9.25	9	25	For what is a man advantaged, if he gain the whole world, and lose himself, or be cast away?	0.2	positive	Pois que adianta ao homem ganhar o mundo inteiro, e perder-se ou destruir a si mesmo?
LUK.9.26	9	26	For whosoever shall be ashamed of me and of my words, of him shall the Son of man be ashamed, when he shall come in his own glory, and {in his} Father's, and of the holy angels.	0.6	positive	Se alguém se envergonhar de mim e das minhas palavras, o Filho do homem se envergonhará dele, quando vier em sua glória e na glória do Pai e dos santos anjos.
LUK.9.27	9	27	But I tell you of a truth, there be some standing here, which shall not taste of death, till they see the kingdom of God.	0.0	neutral	"Garanto-lhes que alguns que aqui se acham de modo nenhum experimentarão a morte antes de verem o Reino de Deus""."
LUK.9.28	9	28	And it came to pass about an eight days after these sayings, he took Peter and John and James, and went up into a mountain to pray. {sayings: or, things}	0.0	neutral	Aproximadamente oito dias depois de dizer essas coisas, Jesus tomou consigo a Pedro, João e Tiago e subiu a um monte para orar.
LUK.9.29	9	29	And as he prayed, the fashion of his countenance was altered, and his raiment {was} white {and} glistering.	0.0	neutral	Enquanto orava, a aparência de seu rosto se transformou, e suas roupas ficaram alvas e resplandecentes como o brilho de um relâmpago.
LUK.9.30	9	30	And, behold, there talked with him two men, which were Moses and Elias:	0.0	neutral	Surgiram dois homens que começaram a conversar com Jesus. Eram Moisés e Elias.
LUK.9.31	9	31	Who appeared in glory, and spake of his decease which he should accomplish at Jerusalem.	0.0	neutral	Apareceram em glorioso esplendor, e falavam sobre a partida de Jesus, que estava para se cumprir em Jerusalém.
LUK.9.32	9	32	But Peter and they that were with him were heavy with sleep: and when they were awake, they saw his glory, and the two men that stood with him.	-0.2	negative	Pedro e os seus companheiros estavam dominados pelo sono; acordando subitamente, viram a glória de Jesus e os dois homens que estavam com ele.
LUK.9.33	9	33	And it came to pass, as they departed from him, Peter said unto Jesus, Master, it is good for us to be here: and let us make three tabernacles; one for thee, and one for Moses, and one for Elias: not knowing what he said.	0.7	positive	"Quando estes estavam se retirando, Pedro disse a Jesus: ""Mestre, é bom estarmos aqui. Façamos três tendas: uma para ti, uma para Moisés e uma para Elias"". ( Ele não sabia o que estava dizendo. )"
LUK.9.34	9	34	While he thus spake, there came a cloud, and overshadowed them: and they feared as they entered into the cloud.	0.0	neutral	Enquanto ele estava falando, uma nuvem apareceu e os envolveu, e eles ficaram com medo ao entrarem na nuvem.
LUK.9.35	9	35	And there came a voice out of the cloud, saying, This is my beloved Son: hear him.	0.7	positive	"Dela saiu uma voz que dizia: ""Este é o meu Filho, o Escolhido; ouçam a ele! """
LUK.9.36	9	36	And when the voice was past, Jesus was found alone. And they kept {it} close, and told no man in those days any of those things which they had seen.	-0.25	negative	Tendo-se ouvido a voz, Jesus ficou só. Os discípulos guardaram isto somente para si; naqueles dias, não contaram a ninguém nada do que tinham visto.
LUK.9.37	9	37	And it came to pass, that on the next day, when they were come down from the hill, much people met him.	0.0148	neutral	No dia seguinte, quando desceram do monte, uma grande multidão veio ao encontro dele.
LUK.9.38	9	38	And, behold, a man of the company cried out, saying, Master, I beseech thee, look upon my son: for he is mine only child.	0.0	neutral	"Um homem da multidão bradou: ""Mestre, rogo-te que dês atenção ao meu filho, pois é o único que tenho."
LUK.9.39	9	39	And, lo, a spirit taketh him, and he suddenly crieth out; and it teareth him that he foameth again, and bruising him hardly departeth from him.	-0.1458	negative	Um espírito o domina; de repente ele grita; lança-o em convulsões e o faz espumar; quase nunca o abandona, e o está destruindo.
LUK.9.40	9	40	And I besought thy disciples to cast him out; and they could not.	0.0	neutral	"Roguei aos teus discípulos que o expulsassem, mas eles não conseguiram""."
LUK.9.41	9	41	And Jesus answering said, O faithless and perverse generation, how long shall I be with you, and suffer you? Bring thy son hither.	-0.05	neutral	"Respondeu Jesus: ""Ó geração incrédula e perversa, até quando estarei com vocês e terei que suportá-los? Traga-me aqui o seu filho""."
LUK.9.42	9	42	And as he was yet a coming, the devil threw him down, and tare {him}. And Jesus rebuked the unclean spirit, and healed the child, and delivered him again to his father.	-0.1556	negative	Quando o menino vinha vindo, o demônio o lançou por terra, em convulsão. Mas Jesus repreendeu o espírito imundo, curou o menino e o entregou de volta a seu pai.
LUK.9.43	9	43	And they were all amazed at the mighty power of God. But while they wondered every one at all things which Jesus did, he said unto his disciples,	0.4	positive	E todos ficaram atônitos ante a grandeza de Deus. Estando todos maravilhados com tudo o que Jesus fazia, ele disse aos seus discípulos:
LUK.9.44	9	44	Let these sayings sink down into your ears: for the Son of man shall be delivered into the hands of men.	-0.1556	negative	"""Ouçam atentamente o que vou lhes dizer: o Filho do homem será traído e entregue nas mãos dos homens""."
LUK.9.45	9	45	But they understood not this saying, and it was hid from them, that they perceived it not: and they feared to ask him of that saying.	0.0	neutral	Mas eles não entendiam o que isso significava; era-lhes encoberto, para que não o entendessem. E tinham receio de perguntar-lhe a respeito dessa palavra.
LUK.9.46	9	46	Then there arose a reasoning among them, which of them should be greatest.	1.0	positive	Começou uma discussão entre os discípulos, acerca de qual deles seria o maior.
LUK.9.47	9	47	And Jesus, perceiving the thought of their heart, took a child, and set him by him,	0.0	neutral	Jesus, conhecendo os seus pensamentos, tomou uma criança e a colocou em pé, a seu lado.
LUK.9.48	9	48	And said unto them, Whosoever shall receive this child in my name receiveth me: and whosoever shall receive me receiveth him that sent me: for he that is least among you all, the same shall be great.	0.1667	positive	"Então lhes disse: ""Quem recebe esta criança em meu nome, está me recebendo; e quem me recebe, está recebendo aquele que me enviou. Pois aquele que entre vocês for o menor, este será o maior""."
LUK.9.49	9	49	And John answered and said, Master, we saw one casting out devils in thy name; and we forbad him, because he followeth not with us.	0.0	neutral	"Disse João: ""Mestre, vimos um homem expulsando demônios em teu nome e procuramos impedi-lo, porque ele não era um dos nossos. """
LUK.9.50	9	50	And Jesus said unto him, Forbid {him} not: for he that is not against us is for us.	0.0	neutral	"""Não o impeçam"", disse Jesus, ""pois quem não é contra vocês, é a favor de vocês""."
LUK.9.51	9	51	And it came to pass, when the time was come that he should be received up, he stedfastly set his face to go to Jerusalem,	0.0	neutral	Aproximando-se o tempo em que seria elevado ao céu, Jesus partiu resolutamente em direção a Jerusalém.
LUK.9.52	9	52	And sent messengers before his face: and they went, and entered into a village of the Samaritans, to make ready for him.	0.2	positive	E enviou mensageiros à sua frente. Indo estes, entraram num povoado samaritano para lhe fazer os preparativos;
LUK.9.53	9	53	And they did not receive him, because his face was as though he would go to Jerusalem.	0.0	neutral	mas o povo dali não o recebeu porque se notava em seu semblante que ele ia para Jerusalém.
LUK.9.54	9	54	And when his disciples James and John saw {this}, they said, Lord, wilt thou that we command fire to come down from heaven, and consume them, even as Elias did?	-0.1556	negative	"Ao verem isso, os discípulos Tiago e João perguntaram: ""Senhor, queres que façamos cair fogo do céu para destruí-los? """
LUK.9.55	9	55	But he turned, and rebuked them, and said, Ye know not what manner of spirit ye are of.	0.0	neutral	"Mas Jesus, voltando-se, os repreendeu, dizendo: ""Vocês não sabem de que espécie de espírito são, pois o Filho do homem não veio para destruir a vida dos homens, mas para salvá-los"";"
LUK.9.56	9	56	For the Son of man is not come to destroy men's lives, but to save {them}. And they went to another village.	-0.2	negative	e foram para outro povoado.
LUK.9.57	9	57	And it came to pass, that, as they went in the way, a certain {man} said unto him, Lord, I will follow thee whithersoever thou goest.	0.2143	positive	"Quando andavam pelo caminho, um homem lhe disse: ""Eu te seguirei por onde quer que fores""."
LUK.9.58	9	58	And Jesus said unto him, Foxes have holes, and birds of the air {have} nests; but the Son of man hath not where to lay {his} head.	0.0	neutral	"Jesus respondeu: ""As raposas têm suas tocas e as aves do céu têm seus ninhos, mas o Filho do homem não tem onde repousar a cabeça""."
LUK.9.59	9	59	And he said unto another, Follow me. But he said, Lord, suffer me first to go and bury my father.	0.25	positive	"A outro disse: ""Siga-me"". Mas o homem respondeu: ""Senhor, deixa-me ir primeiro sepultar meu pai""."
LUK.9.60	9	60	Jesus said unto him, Let the dead bury their dead: but go thou and preach the kingdom of God.	-0.2	negative	"Jesus lhe disse: ""Deixe que os mortos sepultem os seus próprios mortos; você, porém, vá e proclame o Reino de Deus""."
LUK.9.61	9	61	And another also said, Lord, I will follow thee; but let me first go bid them farewell, which are at home at my house.	0.25	positive	"Ainda outro disse: ""Vou seguir-te, Senhor, mas deixa-me primeiro voltar e me despedir da minha família""."
LUK.9.62	9	62	And Jesus said unto him, No man, having put his hand to the plough, and looking back, is fit for the kingdom of God.	0.2	positive	"Jesus respondeu: ""Ninguém que põe a mão no arado e olha para trás é apto para o Reino de Deus""."
LUK.10.1	10	1	After these things the Lord appointed other seventy also, and sent them two and two before his face into every city and place, whither he himself would come.	-0.125	negative	Depois disso o Senhor designou outros setenta e dois e os enviou dois a dois, adiante dele, a todas as cidades e lugares para onde ele estava prestes a ir.
LUK.10.2	10	2	Therefore said he unto them, The harvest truly {is} great, but the labourers {are} few: pray ye therefore the Lord of the harvest, that he would send forth labourers into his harvest.	0.3	positive	"E lhes disse: ""A colheita é grande, mas os trabalhadores são poucos. Portanto, peçam ao Senhor da colheita que mande trabalhadores para a sua colheita."
LUK.10.3	10	3	Go your ways: behold, I send you forth as lambs among wolves.	0.0	neutral	Vão! Eu os estou enviando como cordeiros entre lobos.
LUK.10.4	10	4	Carry neither purse, nor scrip, nor shoes: and salute no man by the way.	0.0	neutral	Não levem bolsa nem saco de viagem nem sandálias; e não saúdem ninguém pelo caminho.
LUK.10.5	10	5	And into whatsoever house ye enter, first say, Peace {be} to this house.	0.25	positive	"""Quando entrarem numa casa, digam primeiro: 'Paz a esta casa'."
LUK.10.6	10	6	And if the son of peace be there, your peace shall rest upon it: if not, it shall turn to you again.	0.0	neutral	Se houver ali um homem de paz, a paz de vocês repousará sobre ele; se não, ela voltará para vocês.
LUK.10.7	10	7	And in the same house remain, eating and drinking such things as they give: for the labourer is worthy of his hire. Go not from house to house.	0.1111	positive	Fiquem naquela casa, e comam e bebam o que lhes derem, pois o trabalhador merece o seu salário. Não fiquem mudando de casa em casa.
LUK.10.8	10	8	And into whatsoever city ye enter, and they receive you, eat such things as are set before you:	0.0	neutral	"""Quando entrarem numa cidade e forem bem recebidos, comam o que for posto diante de vocês."
LUK.10.9	10	9	And heal the sick that are therein, and say unto them, The kingdom of God is come nigh unto you.	-0.7143	negative	Curem os doentes que ali houver e digam-lhes: 'O Reino de Deus está próximo de vocês'.
LUK.10.10	10	10	But into whatsoever city ye enter, and they receive you not, go your ways out into the streets of the same, and say,	0.0	neutral	Mas quando entrarem numa cidade e não forem bem recebidos, saiam por suas ruas e digam:
LUK.10.11	10	11	Even the very dust of your city, which cleaveth on us, we do wipe off against you: notwithstanding be ye sure of this, that the kingdom of God is come nigh unto you.	0.35	positive	'Até o pó da sua cidade, que se apegou aos nossos pés, sacudimos contra vocês. Fiquem certos disto: O Reino de Deus está próximo'.
LUK.10.12	10	12	But I say unto you, that it shall be more tolerable in that day for Sodom, than for that city.	0.5	positive	Eu lhes digo: Naquele dia haverá mais tolerância para Sodoma do que para aquela cidade.
LUK.10.13	10	13	Woe unto thee, Chorazin! woe unto thee, Bethsaida! for if the mighty works had been done in Tyre and Sidon, which have been done in you, they had a great while ago repented, sitting in sackcloth and ashes.	0.6	positive	"""Ai de você, Corazim! Ai de você, Betsaida! Porque se os milagres que foram realizados entre vocês o fossem em Tiro e Sidom, há muito tempo elas se teriam arrependido, vestindo roupas de saco e cobrindo-se de cinzas."
LUK.10.14	10	14	But it shall be more tolerable for Tyre and Sidon at the judgment, than for you.	0.5	positive	Mas no juízo haverá menor rigor para Tiro e Sidom do que para vocês.
LUK.10.15	10	15	And thou, Capernaum, which art exalted to heaven, shalt be thrust down to hell.	-0.1556	negative	E você, Cafarnaum: será elevada até o céu? Não; você descerá até ao Hades!
LUK.10.16	10	16	He that heareth you heareth me; and he that despiseth you despiseth me; and he that despiseth me despiseth him that sent me.	0.0	neutral	"""Aquele que lhes dá ouvidos, está me dando ouvidos; aquele que os rejeita, está me rejeitando; mas aquele que me rejeita, está rejeitando aquele que me enviou""."
