verse_id	chapter	verse	text_en	polarity_en	label_en	text_pt
LUK.12.11	12	11	And when they bring you unto the synagogues, and {unto} magistrates, and powers, take ye no thought how or what thing ye shall answer, or what ye shall say:	0.0	neutral	"""Quando vocês forem levados às sinagogas e diante dos governantes e das autoridades, não se preocupem com a forma pela qual se defenderão, ou com o que dirão,"
LUK.12.12	12	12	For the Holy Ghost shall teach you in the same hour what ye ought to say.	0.0	neutral	"pois naquela hora o Espírito Santo lhes ensinará o que devem dizer""."
LUK.12.13	12	13	And one of the company said unto him, Master, speak to my brother, that he divide the inheritance with me.	0.0	neutral	"Alguém da multidão lhe disse: ""Mestre, dize a meu irmão que divida a herança comigo""."
LUK.12.14	12	14	And he said unto him, Man, who made me a judge or a divider over you?	0.0	neutral	"Respondeu Jesus: ""Homem, quem me designou juiz ou árbitro entre vocês? """
LUK.12.15	12	15	And he said unto them, Take heed, and beware of covetousness: for a man's life consisteth not in the abundance of the things which he possesseth.	0.0	neutral	"Então lhes disse: ""Cuidado! Fiquem de sobreaviso contra todo tipo de ganância; a vida de um homem não consiste na quantidade dos seus bens""."
LUK.12.16	12	16	And he spake a parable unto them, saying, The ground of a certain rich man brought forth plentifully:	0.2946	positive	"Então lhes contou esta parábola: ""A terra de certo homem rico produziu muito bem."
LUK.12.17	12	17	And he thought within himself, saying, What shall I do, because I have no room where to bestow my fruits?	0.0	neutral	Ele pensou consigo mesmo: 'O que vou fazer? Não tenho onde armazenar minha colheita'.
LUK.12.18	12	18	And he said, This will I do: I will pull down my barns, and build greater; and there will I bestow all my fruits and my goods.	0.1722	positive	"""Então disse: 'Já sei o que vou fazer. Vou derrubar os meus celeiros e construir outros maiores, e ali guardarei toda a minha safra e todos os meus bens."
LUK.12.19	12	19	And I will say to my soul, Soul, thou hast much goods laid up for many years; take thine ease, eat, drink, {and} be merry.	0.35	positive	E direi a mim mesmo: Você tem grande quantidade de bens, armazenados para muitos anos. Descanse, coma, beba e alegre-se'.
LUK.12.20	12	20	But God said unto him, {Thou} fool, this night thy soul shall be required of thee: then whose shall those things be, which thou hast provided? {thy...: Gr. do they require thy soul}	0.0	neutral	"""Contudo, Deus lhe disse: 'Insensato! Esta mesma noite a sua vida lhe será exigida. Então, quem ficará com o que você preparou? '"
LUK.12.21	12	21	So {is} he that layeth up treasure for himself, and is not rich toward God.	-0.1875	negative	"""Assim acontece com quem guarda para si riquezas, mas não é rico para com Deus""."
LUK.12.22	12	22	And he said unto his disciples, Therefore I say unto you, Take no thought for your life, what ye shall eat; neither for the body, what ye shall put on.	0.0	neutral	"Dirigindo-se aos seus discípulos, Jesus acrescentou: ""Portanto eu lhes digo: não se preocupem com suas próprias vidas, quanto ao que comer; nem com seus próprios corpos, quanto ao que vestir."
LUK.12.23	12	23	The life is more than meat, and the body {is more} than raiment.	0.5	positive	A vida é mais importante do que a comida, e o corpo, mais do que as roupas.
LUK.12.24	12	24	Consider the ravens: for they neither sow nor reap; which neither have storehouse nor barn; and God feedeth them: how much more are ye better than the fowls?	0.5	positive	Observem os corvos: não semeiam nem colhem, não têm armazéns nem celeiros; contudo, Deus os alimenta. E vocês têm muito mais valor do que as aves!
LUK.12.25	12	25	And which of you with taking thought can add to his stature one cubit?	0.0	neutral	Quem de vocês, por mais que se preocupe, pode acrescentar uma hora que seja à sua vida?
LUK.12.26	12	26	If ye then be not able to do that thing which is least, why take ye thought for the rest?	-0.275	negative	Visto que vocês não podem sequer fazer uma coisa tão pequena, por que se preocupar com o restante?
LUK.12.27	12	27	Consider the lilies how they grow: they toil not, they spin not; and yet I say unto you, that Solomon in all his glory was not arrayed like one of these.	0.0	neutral	"""Observem como crescem os lírios. Eles não trabalham nem tecem. Contudo, eu lhes digo que nem Salomão, em todo o seu esplendor, vestiu-se como um deles."
LUK.12.28	12	28	If then God so clothe the grass, which is to day in the field, and to morrow is cast into the oven; how much more {will he clothe} you, O ye of little faith?	0.1562	positive	Se Deus veste assim a erva do campo, que hoje existe e amanhã é lançada ao fogo, quanto mais vestirá vocês, homens de pequena fé!
LUK.12.29	12	29	And seek not ye what ye shall eat, or what ye shall drink, neither be ye of doubtful mind. {neither...: or, live not in careful suspense}	-0.2545	negative	Não busquem ansiosamente o que hão de comer ou beber; não se preocupem com isso.
LUK.12.30	12	30	For all these things do the nations of the world seek after: and your Father knoweth that ye have need of these things.	0.0	neutral	Pois o mundo pagão é que corre atrás dessas coisas; mas o Pai sabe que vocês precisam delas.
LUK.12.31	12	31	But rather seek ye the kingdom of God; and all these things shall be added unto you.	0.0	neutral	Busquem, pois, o Reino de Deus, e essas coisas lhes serão acrescentadas.
LUK.12.32	12	32	Fear not, little flock; for it is your Father's good pleasure to give you the kingdom.	0.3969	positive	"""Não tenham medo, pequeno rebanho, pois foi do agrado do Pai dar-lhes o Reino."
LUK.12.33	12	33	Sell that ye have, and give alms; provide yourselves bags which wax not old, a treasure in the heavens that faileth not, where no thief approacheth, neither moth corrupteth.	-0.05	neutral	Vendam o que têm e dêem esmolas. Façam para vocês bolsas que não se gastem com o tempo, um tesouro nos céus que não se acabe, onde ladrão algum chega perto e nenhuma traça destrói.
LUK.12.34	12	34	For where your treasure is, there will your heart be also.	0.0	neutral	"Pois onde estiver o seu tesouro, ali também estará o seu coração""."
