verse_id	chapter	verse	text_en	polarity_en	label_en	text_pt
LUK.10.17	10	17	And the seventy returned again with joy, saying, Lord, even the devils are subject unto us through thy name.	0.3167	positive	"Os setenta e dois voltaram alegres e disseram: ""Senhor, até os demônios se submetem a nós, em teu nome""."
LUK.10.18	10	18	And he said unto them, I beheld Satan as lightning fall from heaven.	0.0	neutral	"Ele respondeu: ""Eu vi Satanás caindo do céu como relâmpago."
LUK.10.19	10	19	Behold, I give unto you power to tread on serpents and scorpions, and over all the power of the enemy: and nothing shall by any means hurt you.	0.0	neutral	Eu lhes dei autoridade para pisarem sobre cobras e escorpiões, e sobre todo o poder do inimigo; nada lhes fará dano.
LUK.10.20	10	20	Notwithstanding in this rejoice not, that the spirits are subject unto you; but rather rejoice, because your names are written in heaven.	-0.1667	negative	"Contudo, alegrem-se, não porque os espíritos se submetem a vocês, mas porque seus nomes estão escritos nos céus""."
LUK.10.21	10	21	In that hour Jesus rejoiced in spirit, and said, I thank thee, O Father, Lord of heaven and earth, that thou hast hid these things from the wise and prudent, and hast revealed them unto babes: even so, Father; for so it seemed good in thy sight.	0.7	positive	"Naquela hora Jesus, exultando no Espírito Santo, disse: ""Eu te louvo, Pai, Senhor do céu e da terra, porque escondeste estas coisas dos sábios e cultos e as revelaste aos pequeninos. Sim, Pai, pois assim foi do teu agrado."
LUK.10.22	10	22	All things are delivered to me of my Father: and no man knoweth who the Son is, but the Father; and who the Father is, but the Son, and {he} to whom the Son will reveal {him}. {many ancient copies add these words at the beginning of verse, and turning to his disciples, he said}	0.5	positive	"""Todas as coisas me foram entregues por meu Pai. Ninguém sabe quem é o Filho, a não ser o Pai; e ninguém sabe quem é o Pai, a não ser o Filho e aqueles a quem o Filho o quiser revelar""."
LUK.10.23	10	23	And he turned him unto {his} disciples, and said privately, Blessed {are} the eyes which see the things that ye see:	0.0	neutral	"Então ele se voltou para os seus discípulos e lhes disse em particular: ""Felizes são os olhos que vêem o que vocês vêem."
LUK.10.24	10	24	For I tell you, that many prophets and kings have desired to see those things which ye see, and have not seen {them}; and to hear those things which ye hear, and have not heard {them}.	0.5	positive	"Pois eu lhes digo que muitos profetas e reis desejaram ver o que vocês estão vendo, mas não viram; e ouvir o que vocês estão ouvindo, mas não ouviram""."
LUK.10.25	10	25	And, behold, a certain lawyer stood up, and tempted him, saying, Master, what shall I do to inherit eternal life?	0.2143	positive	"Certa ocasião, um perito na lei levantou-se para pôr Jesus à prova e lhe perguntou: ""Mestre, o que preciso fazer para herdar a vida eterna? """
LUK.10.26	10	26	He said unto him, What is written in the law? how readest thou?	0.0	neutral	"""O que está escrito na Lei? "", respondeu Jesus. ""Como você a lê? """
LUK.10.27	10	27	And he answering said, Thou shalt love the Lord thy God with all thy heart, and with all thy soul, and with all thy strength, and with all thy mind; and thy neighbour as thyself.	0.5	positive	"Ele respondeu: "" 'Ame o Senhor, o seu Deus de todo o seu coração, de toda a sua alma, de todas as suas forças e de todo o seu entendimento' e 'Ame o seu próximo como a si mesmo'""."
LUK.10.28	10	28	And he said unto him, Thou hast answered right: this do, and thou shalt live.	0.211	positive	"Disse Jesus: ""Você respondeu corretamente. Faça isso, e viverá""."
LUK.10.29	10	29	But he, willing to justify himself, said unto Jesus, And who is my neighbour?	0.25	positive	"Mas ele, querendo justificar-se, perguntou a Jesus: ""E quem é o meu próximo? """
LUK.10.30	10	30	And Jesus answering said, A certain {man} went down from Jerusalem to Jericho, and fell among thieves, which stripped him of his raiment, and wounded {him}, and departed, leaving {him} half dead.	-0.077	neutral	"Em resposta, disse Jesus: ""Um homem descia de Jerusalém para Jericó, quando caiu nas mãos de assaltantes. Estes lhe tiraram as roupas, espancaram-no e se foram, deixando-o quase morto."
LUK.10.31	10	31	And by chance there came down a certain priest that way: and when he saw him, he passed by on the other side.	-0.0221	neutral	Aconteceu estar descendo pela mesma estrada um sacerdote. Quando viu o homem, passou pelo outro lado.
LUK.10.32	10	32	And likewise a Levite, when he was at the place, came and looked {on him}, and passed by on the other side.	-0.125	negative	E assim também um levita; quando chegou ao lugar e o viu, passou pelo outro lado.
LUK.10.33	10	33	But a certain Samaritan, as he journeyed, came where he was: and when he saw him, he had compassion {on him},	0.2143	positive	Mas um samaritano, estando de viagem, chegou onde se encontrava o homem e, quando o viu, teve piedade dele.
LUK.10.34	10	34	And went to {him}, and bound up his wounds, pouring in oil and wine, and set him on his own beast, and brought him to an inn, and took care of him.	0.6	positive	Aproximou-se, enfaixou-lhe as feridas, derramando nelas vinho e óleo. Depois colocou-o sobre o seu próprio animal, levou-o para uma hospedaria e cuidou dele.
LUK.10.35	10	35	And on the morrow when he departed, he took out two pence, and gave {them} to the host, and said unto him, Take care of him; and whatsoever thou spendest more, when I come again, I will repay thee.	0.5	positive	No dia seguinte, deu dois denários ao hospedeiro e disse-lhe: 'Cuide dele. Quando voltar lhe pagarei todas as despesas que você tiver'.
LUK.10.36	10	36	Which now of these three, thinkest thou, was neighbour unto him that fell among the thieves?	0.0	neutral	"""Qual destes três você acha que foi o próximo do homem que caiu nas mãos dos assaltantes? """
LUK.10.37	10	37	And he said, He that shewed mercy on him. Then said Jesus unto him, Go, and do thou likewise.	0.0	neutral	"""Aquele que teve misericórdia dele"", respondeu o perito na lei. Jesus lhe disse: ""Vá e faça o mesmo""."
LUK.10.38	10	38	Now it came to pass, as they went, that he entered into a certain village: and a certain woman named Martha received him into her house.	0.2143	positive	Caminhando Jesus e os seus discípulos, chegaram a um povoado, onde certa mulher chamada Marta o recebeu em sua casa.
LUK.10.39	10	39	And she had a sister called Mary, which also sat at Jesus' feet, and heard his word.	0.0	neutral	Maria, sua irmã, ficou sentada aos pés do Senhor, ouvindo-lhe a palavra.
LUK.10.40	10	40	But Martha was cumbered about much serving, and came to him, and said, Lord, dost thou not care that my sister hath left me to serve alone? bid her therefore that she help me.	0.1	neutral	"Marta, porém, estava ocupada com muito serviço. E, aproximando-se dele, perguntou: ""Senhor, não te importas que minha irmã tenha me deixado sozinha com o serviço? Dize-lhe que me ajude! """
LUK.10.41	10	41	And Jesus answered and said unto her, Martha, Martha, thou art careful and troubled about many things:	-0.0333	neutral	"Respondeu o Senhor: ""Marta! Marta! Você está preocupada e inquieta com muitas coisas;"
LUK.10.42	10	42	But one thing is needful: and Mary hath chosen that good part, which shall not be taken away from her.	0.7	positive	"todavia apenas uma é necessária. Maria escolheu a boa parte, e esta não lhe será tirada""."
LUK.11.1	11	1	And it came to pass, that, as he was praying in a certain place, when he ceased, one of his disciples said unto him, Lord, teach us to pray, as John also taught his disciples.	0.2143	positive	"Certo dia Jesus estava orando em determinado lugar. Tendo terminado, um dos seus discípulos lhe disse: ""Senhor, ensina-nos a orar, como João ensinou aos discípulos dele""."
LUK.11.2	11	2	And he said unto them, When ye pray, say, Our Father which art in heaven, Hallowed be thy name. Thy kingdom come. Thy will be done, as in heaven, so in earth.	0.0	neutral	"Ele lhes disse: ""Quando vocês orarem, digam: 'Pai! Santificado seja o teu nome. Venha o teu Reino."
LUK.11.3	11	3	Give us day by day our daily bread. {day by day: or, for the day}	0.0	neutral	Dá-nos cada dia o nosso pão cotidiano.
LUK.11.4	11	4	And forgive us our sins; for we also forgive every one that is indebted to us. And lead us not into temptation; but deliver us from evil.	-1.0	negative	"Perdoa-nos os nossos pecados, pois também perdoamos a todos os que nos devem. E não nos deixes cair em tentação' ""."
LUK.11.5	11	5	And he said unto them, Which of you shall have a friend, and shall go unto him at midnight, and say unto him, Friend, lend me three loaves;	0.0	neutral	"Então lhes disse: ""Suponham que um de vocês tenha um amigo e que recorra a ele à meia-noite e diga: 'Amigo, empreste-me três pães,"
LUK.11.6	11	6	For a friend of mine in his journey is come to me, and I have nothing to set before him? {in...: or, out of his way}	0.0	neutral	porque um amigo meu chegou de viagem, e não tenho nada para lhe oferecer'.
LUK.11.7	11	7	And he from within shall answer and say, Trouble me not: the door is now shut, and my children are with me in bed; I cannot rise and give thee.	-0.2	negative	"""E o que estiver dentro responda: 'Não me incomode. A porta já está fechada, e meus filhos estão deitados comigo. Não posso me levantar e lhe dar o que me pede'."
LUK.11.8	11	8	I say unto you, Though he will not rise and give him, because he is his friend, yet because of his importunity he will rise and give him as many as he needeth.	0.5	positive	Eu lhes digo: embora ele não se levante para dar-lhe o pão por ser seu amigo, por causa da importunação se levantará e lhe dará tudo o que precisar.
LUK.11.9	11	9	And I say unto you, Ask, and it shall be given you; seek, and ye shall find; knock, and it shall be opened unto you.	0.0	neutral	"""Por isso lhes digo: Peçam, e lhes será dado; busquem, e encontrarão; batam, e a porta lhes será aberta."
LUK.11.10	11	10	For every one that asketh receiveth; and he that seeketh findeth; and to him that knocketh it shall be opened.	0.0	neutral	Pois todo o que pede, recebe; o que busca, encontra; e àquele que bate, a porta será aberta.
LUK.11.11	11	11	If a son shall ask bread of any of you that is a father, will he give him a stone? or if {he ask} a fish, will he for a fish give him a serpent?	0.0	neutral	"""Qual pai, entre vocês, se o filho lhe pedir um peixe, em lugar disso lhe dará uma cobra?"
LUK.11.12	11	12	Or if he shall ask an egg, will he offer him a scorpion? {offer: Gr. give}	0.0	neutral	Ou se pedir um ovo, lhe dará um escorpião?
LUK.11.13	11	13	If ye then, being evil, know how to give good gifts unto your children: how much more shall {your} heavenly Father give the Holy Spirit to them that ask him?	0.0667	neutral	"Se vocês, apesar de serem maus, sabem dar boas coisas aos seus filhos, quanto mais o Pai que está no céu dará o Espírito Santo a quem o pedir! """
LUK.11.14	11	14	And he was casting out a devil, and it was dumb. And it came to pass, when the devil was gone out, the dumb spake; and the people wondered.	-0.375	negative	Jesus estava expulsando um demônio que era mudo. Quando o demônio saiu, o mudo falou, e a multidão ficou admirada.
LUK.11.15	11	15	But some of them said, He casteth out devils through Beelzebub the chief of the devils. {Beelzebub: Gr. Beelzebul}	0.0	neutral	"Mas alguns deles disseram: ""É por Belzebu, o príncipe dos demônios, que ele expulsa demônios""."
LUK.11.16	11	16	And others, tempting {him}, sought of him a sign from heaven.	0.0	neutral	Outros o punham à prova, pedindo-lhe um sinal do céu.
LUK.11.17	11	17	But he, knowing their thoughts, said unto them, Every kingdom divided against itself is brought to desolation; and a house {divided} against a house falleth.	0.0	neutral	"Jesus, conhecendo os seus pensamentos, disse-lhes: ""Todo reino dividido contra si mesmo será arruinado, e uma casa dividida contra si mesma cairá."
LUK.11.18	11	18	If Satan also be divided against himself, how shall his kingdom stand? because ye say that I cast out devils through Beelzebub.	0.0	neutral	Se Satanás está dividido contra si mesmo, como o seu reino pode subsistir? Digo isso porque vocês estão dizendo que expulso demônios por Belzebu.
LUK.11.19	11	19	And if I by Beelzebub cast out devils, by whom do your sons cast {them} out? therefore shall they be your judges.	0.0	neutral	Se eu expulso demônios por Belzebu, por quem os expulsam os filhos de vocês? Por isso, eles mesmos estarão como juízes sobre vocês.
LUK.11.20	11	20	But if I with the finger of God cast out devils, no doubt the kingdom of God is come upon you.	0.0	neutral	Mas se é pelo dedo de Deus que eu expulso demônios, então chegou a vocês o Reino de Deus.
LUK.11.21	11	21	When a strong man armed keepeth his palace, his goods are in peace:	0.4333	positive	"""Quando um homem forte, bem armado, guarda sua casa, seus bens estão seguros."
LUK.11.22	11	22	But when a stronger than he shall come upon him, and overcome him, he taketh from him all his armour wherein he trusted, and divideth his spoils.	0.0	neutral	Mas quando alguém mais forte o ataca e vence, tira-lhe a armadura em que confiava e divide os despojos.
LUK.11.23	11	23	He that is not with me is against me: and he that gathereth not with me scattereth.	0.0	neutral	"""Aquele que não está comigo é contra mim, e aquele que comigo não ajunta, espalha."
LUK.11.24	11	24	When the unclean spirit is gone out of a man, he walketh through dry places, seeking rest; and finding none, he saith, I will return unto my house whence I came out.	-0.0667	neutral	"""Quando um espírito imundo sai de um homem, passa por lugares áridos procurando descanso, e não o encontrando, diz: 'Voltarei para a casa de onde saí'."
LUK.11.25	11	25	And when he cometh, he findeth {it} swept and garnished.	0.0	neutral	Quando chega, encontra a casa varrida e em ordem.
LUK.11.26	11	26	Then goeth he, and taketh {to him} seven other spirits more wicked than himself; and they enter in, and dwell there: and the last {state} of that man is worse than the first.	0.045	neutral	"Então vai e traz outros sete espíritos piores do que ele, e entrando passam a viver ali. E o estado final daquele homem torna-se pior do que o primeiro""."
LUK.11.27	11	27	And it came to pass, as he spake these things, a certain woman of the company lifted up her voice, and said unto him, Blessed {is} the womb that bare thee, and the paps which thou hast sucked.	0.1321	positive	"Quando Jesus dizia estas coisas, uma mulher da multidão exclamou: ""Feliz é a mulher que te deu à luz e te amamentou""."
LUK.11.28	11	28	But he said, Yea rather, blessed {are} they that hear the word of God, and keep it.	0.0	neutral	"Ele respondeu: ""Antes, felizes são aqueles que ouvem a palavra de Deus e lhe obedecem""."
LUK.11.29	11	29	And when the people were gathered thick together, he began to say, This is an evil generation: they seek a sign; and there shall no sign be given it, but the sign of Jonas the prophet.	-0.65	negative	"Aumentando a multidão, Jesus começou a dizer: ""Esta é uma geração perversa. Ela pede um sinal miraculoso, mas nenhum sinal lhe será dado, exceto o sinal de Jonas."
LUK.11.30	11	30	For as Jonas was a sign unto the Ninevites, so shall also the Son of man be to this generation.	0.0	neutral	Pois assim como Jonas foi um sinal para os ninivitas, o Filho do homem também o será para esta geração.
LUK.11.31	11	31	The queen of the south shall rise up in the judgment with the men of this generation, and condemn them: for she came from the utmost parts of the earth to hear the wisdom of Solomon; and, behold, a greater than Solomon {is} here.	0.5	positive	A rainha do Sul se levantará no juízo com os homens desta geração e os condenará, pois ela veio dos confins da terra para ouvir a sabedoria de Salomão, e agora está aqui o que é maior do que Salomão.
LUK.11.32	11	32	The men of Nineve shall rise up in the judgment with this generation, and shall condemn it: for they repented at the preaching of Jonas; and, behold, a greater than Jonas {is} here.	0.5	positive	"Os homens de Nínive se levantarão no juízo com esta geração e a condenarão; pois eles se arrependeram com a pregação de Jonas, e agora está aqui o que é maior do que Jonas""."
LUK.11.33	11	33	No man, when he hath lighted a candle, putteth {it} in a secret place, neither under a bushel, but on a candlestick, that they which come in may see the light.	0.0	neutral	"""Ninguém acende uma candeia e a coloca em lugar onde fique escondida ou debaixo de uma vasilha. Pelo contrário, coloca-a no lugar apropriado, para que os que entram possam ver a luz."
LUK.11.34	11	34	The light of the body is the eye: therefore when thine eye is single, thy whole body also is full of light; but when {thine eye} is evil, thy body also {is} full of darkness.	0.0898	neutral	Os olhos são a candeia do corpo. Quando os seus olhos forem bons, igualmente todo o seu corpo estará cheio de luz. Mas quando forem maus, igualmente o seu corpo estará cheio de trevas.
LUK.11.35	11	35	Take heed therefore that the light which is in thee be not darkness.	0.4	positive	Portanto, cuidado para que a luz que está em seu interior não sejam trevas.
LUK.11.36	11	36	If thy whole body therefore {be} full of light, having no part dark, the whole shall be full of light, as when the bright shining of a candle doth give thee light. {the bright...: Gr. a candle by its bright shining}	0.3864	positive	"Logo, se todo o seu corpo estiver cheio de luz, e nenhuma parte dele estiver em trevas, estará completamente iluminado, como quando a luz de uma candeia brilha sobre você""."
LUK.11.37	11	37	And as he spake, a certain Pharisee besought him to dine with him: and he went in, and sat down to meat.	0.0294	neutral	Tendo terminado de falar, um fariseu o convidou para comer com ele. Então Jesus foi, e reclinou-se à mesa;
LUK.11.38	11	38	And when the Pharisee saw {it}, he marvelled that he had not first washed before dinner.	-0.125	negative	mas o fariseu, notando que Jesus não se lavara cerimonialmente antes da refeição, ficou surpreso.
LUK.11.39	11	39	And the Lord said unto him, Now do ye Pharisees make clean the outside of the cup and the platter; but your inward part is full of ravening and wickedness.	0.2389	positive	"Então o Senhor lhe disse: ""Vocês, fariseus, limpam o exterior do copo e do prato, mas interiormente estão cheios de ganância e da maldade."
LUK.11.40	11	40	{Ye} fools, did not he that made that which is without make that which is within also?	0.0	neutral	Insensatos! Quem fez o exterior não fez também o interior?
LUK.11.41	11	41	But rather give alms of such things as ye have; and, behold, all things are clean unto you. {of...: or, as you are able}	0.2889	positive	Mas dêem o que está dentro do prato como esmola, e verão que tudo lhes ficará limpo.
LUK.11.42	11	42	But woe unto you, Pharisees! for ye tithe mint and rue and all manner of herbs, and pass over judgment and the love of God: these ought ye to have done, and not to leave the other undone.	0.1875	positive	"""Ai de vocês, fariseus, porque dão a Deus o dízimo da hortelã, da arruda e de toda a sorte de hortaliças, mas desprezam a justiça e o amor de Deus! Vocês deviam praticar estas coisas, sem deixar de fazer aquelas."
LUK.11.43	11	43	Woe unto you, Pharisees! for ye love the uppermost seats in the synagogues, and greetings in the markets.	0.5	positive	"""Ai de vocês, fariseus, porque amam os lugares de honra nas sinagogas e as saudações em público!"
LUK.11.44	11	44	Woe unto you, scribes and Pharisees, hypocrites! for ye are as graves which appear not, and the men that walk over {them} are not aware {of them}.	-0.125	negative	"""Ai de vocês, porque são como túmulos que não se vêem, por sobre os quais os homens andam sem o saber! """
LUK.11.45	11	45	Then answered one of the lawyers, and said unto him, Master, thus saying thou reproachest us also.	0.0	neutral	"Um dos peritos na lei lhe respondeu: ""Mestre, quando dizes essas coisas, insultas também a nós""."
LUK.11.46	11	46	And he said, Woe unto you also, {ye} lawyers! for ye lade men with burdens grievous to be borne, and ye yourselves touch not the burdens with one of your fingers.	-0.8	negative	"""Quanto a vocês, peritos na lei"", disse Jesus, ""ai de vocês também! porque sobrecarregam os homens com fardos que dificilmente eles podem carregar, e vocês mesmos não levantam nem um dedo para ajudá-los."
LUK.11.47	11	47	Woe unto you! for ye build the sepulchres of the prophets, and your fathers killed them.	-0.2	negative	"""Ai de vocês, porque edificam os túmulos dos profetas, sendo que foram os seus próprios antepassados que os mataram."
LUK.11.48	11	48	Truly ye bear witness that ye allow the deeds of your fathers: for they indeed killed them, and ye build their sepulchres.	-0.2	negative	Assim vocês dão testemunho de que aprovam o que os seus antepassados fizeram. Eles mataram os profetas, e vocês lhes edificam os túmulos.
LUK.11.49	11	49	Therefore also said the wisdom of God, I will send them prophets and apostles, and {some} of them they shall slay and persecute:	0.0	neutral	Por isso, Deus disse em sua sabedoria: 'Eu lhes mandarei profetas e apóstolos, dos quais eles matarão alguns, e a outros perseguirão'.
LUK.11.50	11	50	That the blood of all the prophets, which was shed from the foundation of the world, may be required of this generation;	0.0	neutral	Pelo que, esta geração será considerada responsável pelo sangue de todos os profetas, derramado desde o princípio do mundo:
LUK.11.51	11	51	From the blood of Abel unto the blood of Zacharias, which perished between the altar and the temple: verily I say unto you, It shall be required of this generation.	0.0	neutral	desde o sangue de Abel até o sangue de Zacarias, que foi morto entre o altar e o santuário. Sim, eu lhes digo, esta geração será considerada responsável por tudo isso.
LUK.11.52	11	52	Woe unto you, lawyers! for ye have taken away the key of knowledge: ye entered not in yourselves, and them that were entering in ye hindered. {hindered: or, forbad}	-0.1333	negative	"""Ai de vocês, peritos na lei, porque se apoderaram da chave do conhecimento. Vocês mesmos não entraram e impediram os que estavam prestes a entrar! """
LUK.11.53	11	53	And as he said these things unto them, the scribes and the Pharisees began to urge {him} vehemently, and to provoke him to speak of many things:	0.5	positive	Quando Jesus saiu dali, os fariseus e os mestres da lei começaram a opor-se fortemente a ele e a interrogá-lo com muitas perguntas,
LUK.11.54	11	54	Laying wait for him, and seeking to catch something out of his mouth, that they might accuse him.	0.0	neutral	esperando apanhá-lo em algo que dissesse.
LUK.12.1	12	1	In the mean time, when there were gathered together an innumerable multitude of people, insomuch that they trode one upon another, he began to say unto his disciples first of all, Beware ye of the leaven of the Pharisees, which is hypocrisy.	-0.0312	neutral	"Nesse meio tempo, tendo-se juntado uma multidão de milhares de pessoas, a ponto de se atropelarem umas às outras, Jesus começou a falar primeiramente aos seus discípulos, dizendo: ""Tenham cuidado com o fermento dos fariseus, que é a hipocrisia."
LUK.12.2	12	2	For there is nothing covered, that shall not be revealed; neither hid, that shall not be known.	0.0	neutral	Não há nada escondido que não venha a ser descoberto, ou oculto que não venha a ser conhecido.
LUK.12.3	12	3	Therefore whatsoever ye have spoken in darkness shall be heard in the light; and that which ye have spoken in the ear in closets shall be proclaimed upon the housetops.	0.4	positive	O que vocês disseram nas trevas será ouvido à luz do dia, e o que vocês sussurraram aos ouvidos dentro de casa, será proclamado dos telhados.
LUK.12.4	12	4	And I say unto you my friends, Be not afraid of them that kill the body, and after that have no more that they can do.	0.025	neutral	"""Eu lhes digo, meus amigos: não tenham medo dos que matam o corpo e depois nada mais podem fazer."
LUK.12.5	12	5	But I will forewarn you whom ye shall fear: Fear him, which after he hath killed hath power to cast into hell; yea, I say unto you, Fear him.	-0.2	negative	Mas eu lhes mostrarei a quem vocês devem temer: temam aquele que, depois de matar o corpo, tem poder para lançar no inferno. Sim, eu lhes digo, esse vocês devem temer.
LUK.12.6	12	6	Are not five sparrows sold for two farthings, and not one of them is forgotten before God?	0.0	neutral	Não se vendem cinco pardais por duas moedinhas? Contudo, nenhum deles é esquecido por Deus.
LUK.12.7	12	7	But even the very hairs of your head are all numbered. Fear not therefore: ye are of more value than many sparrows.	0.4	positive	Até os cabelos da cabeça de vocês estão todos contados. Não tenham medo; vocês valem mais do que muitos pardais!
LUK.12.8	12	8	Also I say unto you, Whosoever shall confess me before men, him shall the Son of man also confess before the angels of God:	0.0	neutral	"""Eu lhes digo: quem me confessar diante dos homens, também o Filho do homem o confessará diante dos anjos de Deus."
LUK.12.9	12	9	But he that denieth me before men shall be denied before the angels of God.	0.0	neutral	Mas aquele que me negar diante dos homens será negado diante dos anjos de Deus.
LUK.12.10	12	10	And whosoever shall speak a word against the Son of man, it shall be forgiven him: but unto him that blasphemeth against the Holy Ghost it shall not be forgiven.	0.0	neutral	Todo aquele que disser uma palavra contra o Filho do homem será perdoado, mas quem blasfemar contra o Espírito Santo não será perdoado.
