verse_id	chapter	verse	text_en	polarity_en	label_en	text_pt
JER.3.20	3	20	Surely {as} a wife treacherously departeth from her husband, so have ye dealt treacherously with me, O house of Israel, saith the LORD. {husband: Heb. friend}	0.5	positive	"Mas, como a mulher que trai o marido, assim vocês têm sido infiéis comigo, ó comunidade de Israel"", declara o Senhor."
JER.3.21	3	21	A voice was heard upon the high places, weeping {and} supplications of the children of Israel: for they have perverted their way, {and} they have forgotten the LORD their God.	0.16	positive	Ouve-se um choro no campo, o pranto de súplica dos israelitas, porque perverteram os seus caminhos e esqueceram o Senhor, o seu Deus.
JER.3.22	3	22	Return, ye backsliding children, {and} I will heal your backslidings. Behold, we come unto thee; for thou {art} the LORD our God.	0.0	neutral	"""Voltem, filhos rebeldes! Eu os curarei da sua rebeldia. ""Sim! Nós viremos a ti, pois tu és o Senhor, o nosso Deus."
JER.3.23	3	23	Truly in vain {is salvation hoped for} from the hills, {and from} the multitude of mountains: truly in the LORD our God {is} the salvation of Israel.	0.0	neutral	De fato, a agitação idólatra nas colinas e o murmúrio nos montes é um engano. No Senhor, no nosso Deus, está a salvação de Israel.
JER.3.24	3	24	For shame hath devoured the labour of our fathers from our youth; their flocks and their herds, their sons and their daughters.	0.0	neutral	Desde a nossa juventude, Baal, o deus da vergonha, tem consumido o fruto do trabalho dos nossos antepassados: as ovelhas, os bois, os seus filhos e as suas filhas.
JER.3.25	3	25	We lie down in our shame, and our confusion covereth us: for we have sinned against the LORD our God, we and our fathers, from our youth even unto this day, and have not obeyed the voice of the LORD our God.	-0.1556	negative	"Seja a vergonha a nossa cama e a desonra, o nosso cobertor. Pecamos contra o Senhor, o nosso Deus, tanto nós como os nossos antepassados, desde a nossa juventude até ao dia de hoje; e não temos obedecido ao Senhor, ao nosso Deus. """
JER.4.1	4	1	If thou wilt return, O Israel, saith the LORD, return unto me: and if thou wilt put away thine abominations out of my sight, then shalt thou not remove.	0.0	neutral	"""Se você voltar, ó Israel, volte para mim"", diz o Senhor. ""Se você afastar para longe de minha vista os seus ídolos detestáveis, e não se desviar,"
JER.4.2	4	2	And thou shalt swear, The LORD liveth, in truth, in judgment, and in righteousness; and the nations shall bless themselves in him, and in him shall they glory.	0.0	neutral	"se você jurar pelo nome do Senhor, com fidelidade, justiça e retidão, então as nações serão por ele abençoadas e nele se gloriarão. """
JER.4.3	4	3	For thus saith the LORD to the men of Judah and Jerusalem, Break up your fallow ground, and sow not among thorns.	0.0	neutral	"Assim diz o Senhor ao povo de Judá e de Jerusalém: ""Lavrem seus campos não arados e não semeiem entre espinhos."
JER.4.4	4	4	Circumcise yourselves to the LORD, and take away the foreskins of your heart, ye men of Judah and inhabitants of Jerusalem: lest my fury come forth like fire, and burn that none can quench {it}, because of the evil of your doings.	-1.0	negative	Purifiquem-se para o Senhor, sejam fiéis à aliança, homens de Judá e habitantes de Jerusalém! Se não fizerem isso, a minha ira se acenderá e queimará como fogo, por causa do mal que vocês fizeram; queimará e ninguém conseguirá apagá-la.
JER.4.5	4	5	Declare ye in Judah, and publish in Jerusalem; and say, Blow ye the trumpet in the land: cry, gather together, and say, Assemble yourselves, and let us go into the defenced cities.	0.0	neutral	"""Anunciem em Judá! Proclamem em Jerusalém: 'Toquem a trombeta por toda esta terra! ' Gritem bem alto e digam: 'Reúnam-se! Fujamos para as cidades fortificadas! '"
JER.4.6	4	6	Set up the standard toward Zion: retire, stay not: for I will bring evil from the north, and a great destruction. {retire: or, strengthen} {destruction: Heb. breaking}	-0.0667	neutral	"Ergam o sinal indicando Sião. Fujam sem demora em busca de abrigo! Porque do Norte eu estou trazendo desgraça, uma grande destruição""."
JER.4.7	4	7	The lion is come up from his thicket, and the destroyer of the Gentiles is on his way; he is gone forth from his place to make thy land desolate; {and} thy cities shall be laid waste, without an inhabitant.	-0.2	negative	Um leão saiu da sua toca, um destruidor de nações se pôs a caminho. Ele saiu de onde vive para arrasar a sua terra. Suas cidades ficarão em ruínas e sem habitantes.
JER.4.8	4	8	For this gird you with sackcloth, lament and howl: for the fierce anger of the LORD is not turned back from us.	-0.35	negative	Por isso, ponham vestes de lamento, chorem e gritem, pois o fogo da ira do Senhor não se desviou de nós.
JER.4.9	4	9	And it shall come to pass at that day, saith the LORD, {that} the heart of the king shall perish, and the heart of the princes; and the priests shall be astonished, and the prophets shall wonder.	0.0	neutral	"""Naquele dia"", diz o Senhor, ""o rei e os seus oficiais perderão a coragem, os sacerdotes ficarão horrorizados e os profetas, perplexos. """
JER.4.10	4	10	Then said I, Ah, Lord GOD! surely thou hast greatly deceived this people and Jerusalem, saying, Ye shall have peace; whereas the sword reacheth unto the soul.	0.65	positive	"Então eu disse: ""Ah, Soberano Senhor, como enganaste completamente este povo e a Jerusalém dizendo: 'Vocês terão paz', quando a espada está em nossa garganta""."
JER.4.11	4	11	At that time shall it be said to this people and to Jerusalem, A dry wind of the high places in the wilderness toward the daughter of my people, not to fan, nor to cleanse,	0.0467	neutral	"Naquela época será dito a este povo e a Jerusalém: ""Um vento escaldante, que vem das dunas do deserto, sopra na direção da minha filha, do meu povo, mas não para peneirar nem para limpar."
JER.4.12	4	12	{Even} a full wind from those {places} shall come unto me: now also will I give sentence against them. {a full...: or, a fuller wind than those} {give...: Heb. utter judgments}	0.2333	positive	"É um vento forte demais, que vem da minha parte. Agora eu pronunciarei as minhas sentenças contra eles""."
JER.4.13	4	13	Behold, he shall come up as clouds, and his chariots {shall be} as a whirlwind: his horses are swifter than eagles. Woe unto us! for we are spoiled.	0.0	neutral	Vejam! Ele avança como as nuvens; os seus carros de guerra são como um furacão e os seus cavalos são mais velozes do que as águias. Ai de nós! Estamos perdidos!
JER.4.14	4	14	O Jerusalem, wash thine heart from wickedness, that thou mayest be saved. How long shall thy vain thoughts lodge within thee?	-0.05	neutral	Ó Jerusalém, lave o mal do seu coração para que você seja salva. Até quando você vai acolher projetos malignos no íntimo?
JER.4.15	4	15	For a voice declareth from Dan, and publisheth affliction from mount Ephraim.	0.0	neutral	Ouve-se uma voz proclamando desde Dã, desde os montes de Efraim se anuncia calamidade.
JER.4.16	4	16	Make ye mention to the nations; behold, publish against Jerusalem, {that} watchers come from a far country, and give out their voice against the cities of Judah.	0.1	neutral	"""Relatem isso a esta nação e proclamem contra Jerusalém: 'Um exército inimigo está vindo de uma terra distante, dando seu grito de guerra contra as cidades de Judá."
JER.4.17	4	17	As keepers of a field, are they against her round about; because she hath been rebellious against me, saith the LORD.	-0.2	negative	"Eles a cercam como homens que guardam um campo, pois ela se rebelou contra mim' "", declara o Senhor."
JER.4.18	4	18	Thy way and thy doings have procured these {things} unto thee; this {is} thy wickedness, because it is bitter, because it reacheth unto thine heart.	-0.1	neutral	"""A sua própria conduta e as suas ações trouxeram isso sobre você. Como é amargo este seu castigo! Ele atinge até o seu coração! """
JER.4.19	4	19	My bowels, my bowels! I am pained at my very heart; my heart maketh a noise in me; I cannot hold my peace, because thou hast heard, O my soul, the sound of the trumpet, the alarm of war. {my very...: Heb. the walls of my heart}	0.2667	positive	Ah, minha angústia, minha angústia! Eu me contorço de dor. Ó paredes do meu coração! O meu coração dispara dentro de mim; não posso ficar calado. Ouvi o som da trombeta, ouvi o grito de guerra.
JER.4.20	4	20	Destruction upon destruction is cried; for the whole land is spoiled: suddenly are my tents spoiled, {and} my curtains in a moment.	0.1	neutral	Um desastre depois do outro; toda a minha terra foi devastada. Num instante as minhas tendas foram destruídas, e os meus abrigos num momento.
JER.4.21	4	21	How long shall I see the standard, {and} hear the sound of the trumpet?	0.1167	positive	Até quando verei o sinal levantado e ouvirei o som da trombeta?
JER.4.22	4	22	For my people {is} foolish, they have not known me; they {are} sottish children, and they have none understanding: they {are} wise to do evil, but to do good they have no knowledge.	0.1333	positive	"""O meu povo é tolo, eles não me conhecem. São crianças insensatas que nada compreendem. São hábeis para praticar o mal, mas não sabem fazer o bem. """
JER.4.23	4	23	I beheld the earth, and, lo, {it was} without form, and void; and the heavens, and they {had} no light.	-0.2	negative	Olhei para a terra e ela era sem forma e vazia; e para os céus, e a sua luz tinha desaparecido.
JER.4.24	4	24	I beheld the mountains, and, lo, they trembled, and all the hills moved lightly.	0.4	positive	Olhei para os montes e eles estavam tremendo; todas as colinas estavam oscilando.
JER.4.25	4	25	I beheld, and, lo, {there was} no man, and all the birds of the heavens were fled.	0.0	neutral	Olhei, e não havia mais gente; todas as aves do céu tinham fugido em revoada.
JER.4.26	4	26	I beheld, and, lo, the fruitful place {was} a wilderness, and all the cities thereof were broken down at the presence of the LORD, {and} by his fierce anger.	-0.4185	negative	Olhei, e a terra fértil era deserto; todas as suas cidades estavam em ruínas por causa do Senhor, por causa do fogo da sua ira.
JER.4.27	4	27	For thus hath the LORD said, The whole land shall be desolate; yet will I not make a full end.	0.275	positive	"Assim diz o Senhor: ""Toda esta terra ficará devastada, embora eu não vá destruí-la completamente."
JER.4.28	4	28	For this shall the earth mourn, and the heavens above be black: because I have spoken {it}, I have purposed {it}, and will not repent, neither will I turn back from it.	-0.0556	neutral	"Por causa disso, a terra ficará de luto e o céu, em cima, se escurecerá; porque eu falei, e não me arrependi, decidi, e não voltei atrás""."
JER.4.29	4	29	The whole city shall flee for the noise of the horsemen and bowmen; they shall go into thickets, and climb up upon the rocks: every city {shall be} forsaken, and not a man dwell therein.	0.2	positive	Quando se ouvem os cavaleiros e os flecheiros, todos os habitantes da cidade fogem. Alguns vão para o meio dos arbustos; outros escalam as rochas. Todas as cidades são abandonadas, e ficam sem habitantes.
JER.4.30	4	30	And {when} thou {art} spoiled, what wilt thou do? Though thou clothest thyself with crimson, though thou deckest thee with ornaments of gold, though thou rentest thy face with painting, in vain shalt thou make thyself fair; {thy} lovers will despise thee, they will seek thy life. {face: Heb. eyes}	0.7	positive	O que você está fazendo, ó cidade devastada? Por que se veste de vermelho e se enfeita com jóias de ouro? Por que você passa sombra nos olhos? Você se embeleza em vão, pois os seus amantes a desprezam e querem tirar-lhe a vida.
JER.4.31	4	31	For I have heard a voice as of a woman in travail, {and} the anguish as of her that bringeth forth her first child, the voice of the daughter of Zion, {that} bewaileth herself, {that} spreadeth her hands, {saying}, Woe {is} me now! for my soul is wearied because of murderers.	0.3125	positive	"Ouvi um grito, como de mulher em trabalho de parto, como a agonia de uma mulher ao dar à luz o primeiro filho. É o grito da cidade de Sião, que está ofegante e estende as mãos, dizendo: ""Ai de mim! Estou desfalecendo. Minha vida está nas mãos de assassinos! """
JER.5.1	5	1	Run ye to and fro through the streets of Jerusalem, and see now, and know, and seek in the broad places thereof, if ye can find a man, if there be {any} that executeth judgment, that seeketh the truth; and I will pardon it.	0.0625	neutral	"""Percorram as ruas de Jerusalém, olhem e observem. Procurem em suas praças para ver se podem encontrar alguém que aja com honestidade e que busque a verdade. Então eu perdoarei a cidade."
JER.5.2	5	2	And though they say, The LORD liveth; surely they swear falsely.	0.05	neutral	"Embora digam: 'Juro pelo nome do Senhor', ainda assim estão jurando falsamente. """
JER.5.3	5	3	O LORD, {are} not thine eyes upon the truth? thou hast stricken them, but they have not grieved; thou hast consumed them, {but} they have refused to receive correction: they have made their faces harder than a rock; they have refused to return.	-0.1	neutral	Senhor, não é fidelidade que os teus olhos procuram? Tu os feriste, mas eles nada sentiram; tu os deixaste esgotados, mas eles recusaram a correção. Endureceram o rosto, mais que a rocha e recusaram arrepender-se.
JER.5.4	5	4	Therefore I said, Surely these {are} poor; they are foolish: for they know not the way of the LORD, {nor} the judgment of their God.	0.05	neutral	Pensei: Esses são apenas pobres e ignorantes, não conhecem o caminho do Senhor, as exigências do seu Deus.
JER.5.5	5	5	I will get me unto the great men, and will speak unto them; for they have known the way of the LORD, {and} the judgment of their God: but these have altogether broken the yoke, {and} burst the bonds.	0.2	positive	Irei aos nobres e falarei com eles, pois, sem dúvida, eles conhecem o caminho do Senhor, as exigências do seu Deus. Mas todos eles também quebraram o jugo e romperam as amarras.
JER.5.6	5	6	Wherefore a lion out of the forest shall slay them, {and} a wolf of the evenings shall spoil them, a leopard shall watch over their cities: every one that goeth out thence shall be torn in pieces: because their transgressions are many, {and} their backslidings are increased. {evenings: or, deserts} {are increased: Heb. are strong}	0.4667	positive	Por isso, um leão da floresta os atacará, um lobo da estepe os arrasará, um leopardo ficará à espreita, nos arredores das suas cidades, para despedaçar qualquer pessoa que delas sair. Porque a rebeldia deles é grande e muitos são os seus desvios.
JER.5.7	5	7	How shall I pardon thee for this? thy children have forsaken me, and sworn by {them that are} no gods: when I had fed them to the full, they then committed adultery, and assembled themselves by troops in the harlots' houses.	0.35	positive	"""Por que deveria eu perdoar-lhe isso? Seus filhos me abandonaram e juraram por aqueles que não são deuses. Embora eu tenha suprido as suas necessidades, eles cometeram adultério e freqüentaram as casas de prostituição."
JER.5.8	5	8	They were {as} fed horses in the morning: every one neighed after his neighbour's wife.	0.0	neutral	Eles são garanhões bem-alimentados e excitados, cada um relinchando para a mulher do próximo.
JER.5.9	5	9	Shall I not visit for these {things}? saith the LORD: and shall not my soul be avenged on such a nation as this?	0.0	neutral	"Não devo eu castigá-los por isso? "", pergunta o Senhor. ""Não devo eu vingar-me de uma nação como esta?"
JER.5.10	5	10	Go ye up upon her walls, and destroy; but make not a full end: take away her battlements; for they {are} not the LORD'S.	-0.1875	negative	"""Vão por entre as suas vinhas e destruam-nas, mas não acabem totalmente com elas. Cortem os seus ramos, pois eles não pertencem ao Senhor."
JER.5.11	5	11	For the house of Israel and the house of Judah have dealt very treacherously against me, saith the LORD.	0.2	positive	"Porque a comunidade de Israel e a comunidade de Judá têm-me traído"", declara o Senhor."
JER.5.12	5	12	They have belied the LORD, and said, {It is} not he; neither shall evil come upon us; neither shall we see sword nor famine:	-1.0	negative	"Mentiram acerca do Senhor, dizendo: ""Ele não vai fazer nada! Nenhum mal nos acontecerá; jamais veremos espada ou fome."
JER.5.13	5	13	And the prophets shall become wind, and the word {is} not in them: thus shall it be done unto them.	0.0	neutral	"Os profetas não passam de vento, e a palavra não está neles; por isso aconteça com eles o que dizem""."
JER.5.14	5	14	Wherefore thus saith the LORD God of hosts, Because ye speak this word, behold, I will make my words in thy mouth fire, and this people wood, and it shall devour them.	0.0	neutral	"Portanto, assim diz o Senhor dos Exércitos: ""Porque falaram essas palavras, farei com que as minhas palavras em sua boca sejam fogo, e este povo seja a lenha que o fogo consome."
JER.5.15	5	15	Lo, I will bring a nation upon you from far, O house of Israel, saith the LORD: it {is} a mighty nation, it {is} an ancient nation, a nation whose language thou knowest not, neither understandest what they say.	0.25	positive	"""Ó comunidade de Israel"", declara o Senhor. ""estou trazendo de longe uma nação para atacá-la: uma nação muito antiga e invencível, uma nação cuja língua você não conhece e cuja fala você não entende."
JER.5.16	5	16	Their quiver {is} as an open sepulchre, they {are} all mighty men.	0.2	positive	Sua aljava é como um túmulo aberto; toda ela é composta de guerreiros.
JER.5.17	5	17	And they shall eat up thine harvest, and thy bread, {which} thy sons and thy daughters should eat: they shall eat up thy flocks and thine herds: they shall eat up thy vines and thy fig trees: they shall impoverish thy fenced cities, wherein thou trustedst, with the sword.	0.0	neutral	Devorarão as suas colheitas e os seus alimentos; devorarão os seus filhos e as suas filhas; devorarão as suas ovelhas e os seus bois; devorarão as suas videiras e as suas figueiras. Destruirão pela espada as cidades fortificadas nas quais vocês confiam.
JER.5.18	5	18	Nevertheless in those days, saith the LORD, I will not make a full end with you.	0.35	positive	"""Contudo, mesmo naqueles dias não os destruirei completamente"", declara o Senhor."
JER.5.19	5	19	And it shall come to pass, when ye shall say, Wherefore doeth the LORD our God all these {things} unto us? then shalt thou answer them, Like as ye have forsaken me, and served strange gods in your land, so shall ye serve strangers in a land {that is} not yours.	-0.05	neutral	"""E, quando perguntarem: 'Por que o Senhor, o nosso Deus, fez isso conosco? ', você lhes dirá: 'Assim como vocês me abandonaram e serviram deuses estrangeiros em sua própria terra, também agora vocês servirão estrangeiros numa terra que não é de vocês'."
JER.5.20	5	20	Declare this in the house of Jacob, and publish it in Judah, saying,	0.0	neutral	"""Anunciem isto à comunidade de Jacó e proclamem-no em Judá:"
JER.5.21	5	21	Hear now this, O foolish people, and without understanding; which have eyes, and see not; which have ears, and hear not: {understanding: Heb. heart}	-0.75	negative	Ouçam isto, vocês, povo tolo e insensato, que têm olhos mas não vêem, têm ouvidos mas não ouvem:
JER.5.22	5	22	Fear ye not me? saith the LORD: will ye not tremble at my presence, which have placed the sand {for} the bound of the sea by a perpetual decree, that it cannot pass it: and though the waves thereof toss themselves, yet can they not prevail; though they roar, yet can they not pass over it?	0.0	neutral	"Acaso vocês não me temem? "", pergunta o Senhor. ""Não tremem diante da minha presença? Porque fui eu que fiz da areia um limite para o mar, um decreto eterno que ele não pode ultrapassar. As ondas podem quebrar, mas não podem prevalecer, podem bramir, mas não podem ultrapassá-lo."
JER.5.23	5	23	But this people hath a revolting and a rebellious heart; they are revolted and gone.	0.0	neutral	Mas este povo tem coração obstinado e rebelde; eles se afastaram e foram embora.
JER.5.24	5	24	Neither say they in their heart, Let us now fear the LORD our God, that giveth rain, both the former and the latter, in his season: he reserveth unto us the appointed weeks of the harvest.	0.0	neutral	Não dizem no seu íntimo: 'Temamos o Senhor, o nosso Deus: aquele que dá as chuvas do outono e da primavera no tempo certo, e assegura-nos as semanas certas da colheita'.
JER.5.25	5	25	Your iniquities have turned away these {things}, and your sins have withholden good {things} from you.	0.7	positive	Mas os pecados de vocês têm afastado essas coisas; as faltas de vocês os têm privado desses bens.
JER.5.26	5	26	For among my people are found wicked {men}: they lay wait, as he that setteth snares; they set a trap, they catch men. {they lay...: or, they pry as fowlers lie in wait}	0.0	neutral	"""Há ímpios no meio do meu povo: homens que ficam à espreita como num esconderijo de caçadores de pássaros; preparam armadilhas para capturar gente."
JER.5.27	5	27	As a cage is full of birds, so {are} their houses full of deceit: therefore they are become great, and waxen rich. {cage: or, coop}	0.4688	positive	Suas casas estão cheias de engano, como gaiolas cheias de pássaros. E assim eles se tornaram poderosos e ricos,
JER.5.28	5	28	They are waxen fat, they shine: yea, they overpass the deeds of the wicked: they judge not the cause, the cause of the fatherless, yet they prosper; and the right of the needy do they not judge.	0.2857	positive	estão gordos e bem-alimentados. Não há limites para as suas obras más. Não se empenham pela causa do órfão, nem defendem os direitos do pobre.
JER.5.29	5	29	Shall I not visit for these {things}? saith the LORD: shall not my soul be avenged on such a nation as this?	0.0	neutral	"Não devo eu castigá-los? "", pergunta o Senhor. ""Não devo eu vingar-me de uma nação como essa?"
JER.5.30	5	30	A wonderful and horrible thing is committed in the land; {A wonderful...: or, Astonishment and filthiness}	0.3333	positive	"""Uma coisa espantosa e horrível acontece nesta terra:"
JER.5.31	5	31	The prophets prophesy falsely, and the priests bear rule by their means; and my people love {to have it} so: and what will ye do in the end thereof? {bear...: or, take into their hands}	0.05	neutral	Os profetas profetizam mentiras, os sacerdotes governam por sua própria autoridade, e o meu povo gosta dessas coisas. Mas o que vocês farão quando tudo isso chegar ao fim?
JER.6.1	6	1	O ye children of Benjamin, gather yourselves to flee out of the midst of Jerusalem, and blow the trumpet in Tekoa, and set up a sign of fire in Bethhaccerem: for evil appeareth out of the north, and great destruction.	-0.1	neutral	"""Fuja para um lugar seguro, povo de Benjamim! Fuja de Jerusalém! Toquem a trombeta em Tecoa! Ponham sinal em Bete-Haquerém! Porque já se vê a desgraça que vem do Norte, uma terrível destruição!"
JER.6.2	6	2	I have likened the daughter of Zion to a comely and delicate {woman}. {comely: or, dwelling at home}	-0.3	negative	Destruirei a cidade de Sião; você é como uma bela pastagem,
JER.6.3	6	3	The shepherds with their flocks shall come unto her; they shall pitch {their} tents against her round about; they shall feed every one in his place.	-0.2	negative	para onde os pastores vêm com os seus rebanhos; armam as suas tendas ao redor dela e apascentam, cada um no seu lugar.
JER.6.4	6	4	Prepare ye war against her; arise, and let us go up at noon. Woe unto us! for the day goeth away, for the shadows of the evening are stretched out.	-0.05	neutral	"""Preparem-se para enfrentá-la na batalha! Vamos, ataquemos ao meio-dia! Ai de nós! O dia declina e as sombras da tarde já se estendem."
JER.6.5	6	5	Arise, and let us go by night, and let us destroy her palaces.	-0.2	negative	"Vamos, ataquemos de noite! Destruamos as suas fortalezas! """
JER.6.6	6	6	For thus hath the LORD of hosts said, Hew ye down trees, and cast a mount against Jerusalem: this {is} the city to be visited; she {is} wholly oppression in the midst of her. {cast...: or, pour out the engine of shot}	-0.1556	negative	"Assim diz o Senhor dos Exércitos: ""Derrubem as árvores e construam rampas de cerco contra Jerusalém. Ó cidade da falsidade! Ela está cheia de opressão."
JER.6.7	6	7	As a fountain casteth out her waters, so she casteth out her wickedness: violence and spoil is heard in her; before me continually {is} grief and wounds.	-0.8	negative	Assim como um poço produz água, também ela produz sua maldade. Violência! Destruição! É o que se ouve dentro dela; doenças e feridas estão sempre diante de mim.
JER.6.8	6	8	Be thou instructed, O Jerusalem, lest my soul depart from thee; lest I make thee desolate, a land not inhabited. {depart: Heb. be loosed, or, disjointed}	0.0	neutral	"Ouça a minha advertência, ó Jerusalém! Do contrário eu me afastarei inteiramente de você e farei de você uma desolação, uma terra desabitada""."
JER.6.9	6	9	Thus saith the LORD of hosts, They shall throughly glean the remnant of Israel as a vine: turn back thine hand as a grapegatherer into the baskets.	0.0	neutral	"Assim diz o Senhor dos Exércitos: ""Rebusque-se o remanescente de Israel tão completamente, como se faz com uma videira, como faz quem colhe uvas: repassa os ramos cacho por cacho""."
