verse_id	chapter	verse	text_en	polarity_en	label_en	text_pt
JER.6.10	6	10	To whom shall I speak, and give warning, that they may hear? behold, their ear {is} uncircumcised, and they cannot hearken: behold, the word of the LORD is unto them a reproach; they have no delight in it.	0.0	neutral	A quem posso eu falar ou advertir? Quem me escutará? Os ouvidos deles são obstinados, e eles não podem ouvir. A palavra do Senhor é para eles desprezível, não encontram nela motivo de prazer.
JER.6.11	6	11	Therefore I am full of the fury of the LORD; I am weary with holding in: I will pour it out upon the children abroad, and upon the assembly of young men together: for even the husband with the wife shall be taken, the aged with {him that is} full of days.	0.175	positive	"Mas a ira do Senhor dentro de mim transborda, já não posso retê-la. ""Derrama-a sobre as crianças na rua e sobre os jovens reunidos em grupos; pois eles também serão pegos juntos com os maridos e as mulheres, os velhos e os de idade bem avançada."
JER.6.12	6	12	And their houses shall be turned unto others, {with their} fields and wives together: for I will stretch out my hand upon the inhabitants of the land, saith the LORD.	0.0	neutral	"As casas deles serão entregues a outros, juntamente com os seus campos e as suas mulheres, quando eu estender a minha mão contra os que vivem nesta terra"", declara o Senhor."
JER.6.13	6	13	For from the least of them even unto the greatest of them every one {is} given to covetousness; and from the prophet even unto the priest every one dealeth falsely.	0.1	neutral	"""Desde o menor até o maior, todos são gananciosos; profetas e sacerdotes igualmente, todos praticam o engano."
JER.6.14	6	14	They have healed also the hurt {of the daughter} of my people slightly, saying, Peace, peace; when {there is} no peace. {hurt: Heb. bruise, or, breach}	-0.1667	negative	Eles tratam da ferida do meu povo como se não fosse grave. 'Paz, paz', dizem, quando não há paz alguma.
JER.6.15	6	15	Were they ashamed when they had committed abomination? nay, they were not at all ashamed, neither could they blush: therefore they shall fall among them that fall: at the time {that} I visit them they shall be cast down, saith the LORD.	-0.1556	negative	"Ficarão eles envergonhados da sua conduta detestável? Não, eles não sentem vergonha alguma, nem mesmo sabem corar. Portanto, cairão entre os que caem; serão humilhados quando eu os castigar"", declara o Senhor."
JER.6.16	6	16	Thus saith the LORD, Stand ye in the ways, and see, and ask for the old paths, where {is} the good way, and walk therein, and ye shall find rest for your souls. But they said, We will not walk {therein}.	0.4	positive	"Assim diz o Senhor: ""Ponham-se nas encruzilhadas e olhem; perguntem pelos caminhos antigos, perguntem pelo bom caminho. Sigam-no e acharão descanso"". Mas vocês disseram: 'Não seguiremos! '"
JER.6.17	6	17	Also I set watchmen over you, {saying}, Hearken to the sound of the trumpet. But they said, We will not hearken.	0.4	positive	Coloquei sentinelas entre vocês e disse: Prestem atenção ao som da trombeta! Mas vocês disseram: 'Não daremos atenção'.
JER.6.18	6	18	Therefore hear, ye nations, and know, O congregation, what {is} among them.	0.0	neutral	Vejam, ó nações; observe, ó assembléia, o que acontecerá a eles.
JER.6.19	6	19	Hear, O earth: behold, I will bring evil upon this people, {even} the fruit of their thoughts, because they have not hearkened unto my words, nor to my law, but rejected it.	-1.0	negative	Ouça, ó terra: Vou trazer desgraça sobre este povo, o fruto das suas maquinações, porque não deram atenção às minhas palavras e rejeitaram a minha lei.
JER.6.20	6	20	To what purpose cometh there to me incense from Sheba, and the sweet cane from a far country? your burnt offerings {are} not acceptable, nor your sacrifices sweet unto me.	0.2667	positive	"De que me serve o incenso trazido de Sabá, ou o cálamo aromático de uma terra distante? Os seus holocaustos não são aceitáveis nem me agradam as suas ofertas""."
JER.6.21	6	21	Therefore thus saith the LORD, Behold, I will lay stumblingblocks before this people, and the fathers and the sons together shall fall upon them; the neighbour and his friend shall perish.	0.0	neutral	"Assim diz o Senhor: ""Estou colocando obstáculos diante deste povo. Pais e filhos tropeçarão neles; vizinhos e amigos perecerão""."
JER.6.22	6	22	Thus saith the LORD, Behold, a people cometh from the north country, and a great nation shall be raised from the sides of the earth.	0.8	positive	"Assim diz o Senhor: ""Veja! Um exército vem do Norte; uma grande nação está sendo mobilizada desde os confins da terra."
JER.6.23	6	23	They shall lay hold on bow and spear; they {are} cruel, and have no mercy; their voice roareth like the sea; and they ride upon horses, set in array as men for war against thee, O daughter of Zion.	-1.0	negative	"Eles empunham o arco e a lança; são cruéis e sem misericórdia, e o barulho que fazem é como o bramido do mar. Vêm montando os seus cavalos em formação de batalha, para atacá-la, ó cidade de Sião. """
JER.6.24	6	24	We have heard the fame thereof: our hands wax feeble: anguish hath taken hold of us, {and} pain, as of a woman in travail.	-0.5	negative	Ouvimos os relatos sobre eles, e as nossas mãos amoleceram. A angústia tomou conta de nós, dores como as da mulher que está dando à luz.
JER.6.25	6	25	Go not forth into the field, nor walk by the way; for the sword of the enemy {and} fear {is} on every side.	0.0	neutral	Não saiam aos campos nem andem pelas estradas, pois o inimigo traz a espada e há terror por todos os lados.
JER.6.26	6	26	O daughter of my people, gird {thee} with sackcloth, and wallow thyself in ashes: make thee mourning, {as for} an only son, most bitter lamentation: for the spoiler shall suddenly come upon us.	0.1	neutral	Ó minha filha, meu povo, ponha vestes de lamento e revolva-se em cinza. Lamente-se com choro amargurado, como quem chora por um filho único, pois subitamente o destruidor virá sobre nós.
JER.6.27	6	27	I have set thee {for} a tower {and} a fortress among my people, that thou mayest know and try their way.	0.0	neutral	"""Eu o designei como examinador de metais, provador do meu povo para que você examine e ponha à prova a conduta deles."
JER.6.28	6	28	They {are} all grievous revolters, walking with slanders: {they are} brass and iron; they {are} all corrupters.	-0.775	negative	Todos eles são rebeldes obstinados, e propagadores de calúnias. Estão endurecidos como o bronze e o ferro. Todos eles são corruptos.
JER.6.29	6	29	The bellows are burned, the lead is consumed of the fire; the founder melteth in vain: for the wicked are not plucked away.	0.0	neutral	O fole sopra com força para separar o chumbo com o fogo, mas o refino prossegue em vão; os ímpios não são expurgados.
JER.6.30	6	30	Reprobate silver shall {men} call them, because the LORD hath rejected them. {Reprobate...: or, Refuse silver}	0.0	neutral	"São chamados prata rejeitada, porque o Senhor os rejeitou. """
JER.7.1	7	1	The word that came to Jeremiah from the LORD, saying,	0.0	neutral	Esta é a palavra que veio a Jeremias da parte do Senhor:
JER.7.2	7	2	Stand in the gate of the LORD'S house, and proclaim there this word, and say, Hear the word of the LORD, all {ye of} Judah, that enter in at these gates to worship the LORD.	0.0	neutral	"""Fique junto à porta o templo do Senhor e proclame esta mensagem: "" 'Ouçam a palavra do Senhor, todos vocês de Judá que atravessam estas portas para adorar o Senhor."
JER.7.3	7	3	Thus saith the LORD of hosts, the God of Israel, Amend your ways and your doings, and I will cause you to dwell in this place.	0.0	neutral	Assim diz o Senhor dos Exércitos, o Deus de Israel: Corrijam a sua conduta e as suas ações, eu os farei habitar neste lugar.
JER.7.4	7	4	Trust ye not in lying words, saying, The temple of the LORD, The temple of the LORD, The temple of the LORD, {are} these.	0.0	neutral	"Não confiem em palavras enganosas: ""Este é o templo do Senhor, o templo do Senhor, o templo do Senhor! """
JER.7.5	7	5	For if ye throughly amend your ways and your doings; if ye throughly execute judgment between a man and his neighbour;	0.0	neutral	Mas se vocês realmente corrigirem a sua conduta e as suas ações, e se, de fato, tratarem uns aos outros com justiça,
JER.7.6	7	6	{If} ye oppress not the stranger, the fatherless, and the widow, and shed not innocent blood in this place, neither walk after other gods to your hurt:	-0.1875	negative	se não oprimirem o estrangeiro, o órfão e a viúva e não derramarem sangue inocente neste lugar, e se vocês não seguirem outros deuses para a sua própria ruína,
JER.7.7	7	7	Then will I cause you to dwell in this place, in the land that I gave to your fathers, for ever and ever.	0.0	neutral	então eu os farei habitar neste lugar, na terra que dei aos seus antepassados desde a antigüidade e para sempre.
JER.7.8	7	8	Behold, ye trust in lying words, that cannot profit.	0.0	neutral	Mas vejam! Vocês confiam em palavras enganosas e inúteis.
JER.7.9	7	9	Will ye steal, murder, and commit adultery, and swear falsely, and burn incense unto Baal, and walk after other gods whom ye know not;	-0.2625	negative	""" 'Vocês pensam que podem roubar e matar, cometer adultério e jurar falsamente, queimar incenso a Baal e seguir outros deuses que vocês não conheceram,"
JER.7.10	7	10	And come and stand before me in this house, which is called by my name, and say, We are delivered to do all these abominations? {which...: Heb. whereupon my name is called}	0.0	neutral	e depois vir e permanecer perante mim neste templo, que leva o meu nome, e dizer: Estamos seguros!, seguros para continuar com todas essas práticas repugnantes?
JER.7.11	7	11	Is this house, which is called by my name, become a den of robbers in your eyes? Behold, even I have seen {it}, saith the LORD.	0.0	neutral	"Esse templo, que leva o meu nome, tornou-se para vocês um covil de ladrões? Cuidado! Eu mesmo estou vendo isso' "", declara o Senhor."
JER.7.12	7	12	But go ye now unto my place which {was} in Shiloh, where I set my name at the first, and see what I did to it for the wickedness of my people Israel.	0.25	positive	""" 'Portanto, vão agora a Siló, o meu lugar de adoração, onde primeiro fiz uma habitação em honra do meu nome, e vejam o que eu lhe fiz por causa da impiedade de Israel, meu povo."
JER.7.13	7	13	And now, because ye have done all these works, saith the LORD, and I spake unto you, rising up early and speaking, but ye heard not; and I called you, but ye answered not;	0.1	neutral	Mas agora, visto que vocês fizeram todas essas coisas, diz o Senhor, apesar de eu lhes ter falado repetidas vezes, e vocês não me terem dado atenção, e de eu lhes ter chamado, e vocês não me terem respondido,
JER.7.14	7	14	Therefore will I do unto {this} house, which is called by my name, wherein ye trust, and unto the place which I gave to you and to your fathers, as I have done to Shiloh.	0.0	neutral	eu farei a este templo que leva o meu nome, no qual vocês confiam, o lugar de adoração que dei a vocês e aos seus antepassados, o mesmo que fiz a Siló.
JER.7.15	7	15	And I will cast you out of my sight, as I have cast out all your brethren, {even} the whole seed of Ephraim.	0.2	positive	Expulsarei vocês da minha presença, como fiz com todos os seus compatriotas, o povo de Efraim'.
JER.7.16	7	16	Therefore pray not thou for this people, neither lift up cry nor prayer for them, neither make intercession to me: for I will not hear thee.	0.0	neutral	"""Mas a você, Jeremias, não ore por este povo nem faça súplicas ou pedidos em favor dele, nem interceda por ele junto a mim, pois eu não o ouvirei."
JER.7.17	7	17	Seest thou not what they do in the cities of Judah and in the streets of Jerusalem?	0.0	neutral	Não vê o que estão fazendo nas cidades de Judá e nas ruas de Jerusalém?
JER.7.18	7	18	The children gather wood, and the fathers kindle the fire, and the women knead {their} dough, to make cakes to the queen of heaven, and to pour out drink offerings unto other gods, that they may provoke me to anger. {queen...: or, frame, or, workmanship of heaven}	-0.4125	negative	Os filhos ajuntam a lenha, os pais acendem o fogo, e as mulheres preparam a massa e fazem bolos para a Rainha dos Céus. Além disso, derramam ofertas a outros deuses para provocarem a minha ira.
JER.7.19	7	19	Do they provoke me to anger? saith the LORD: {do they} not {provoke} themselves to the confusion of their own faces?	-0.2833	negative	Mas será que é a mim que eles estão provocando?, pergunta o Senhor. Não é a si mesmos, para a sua própria vergonha?
JER.7.20	7	20	Therefore thus saith the Lord GOD; Behold, mine anger and my fury shall be poured out upon this place, upon man, and upon beast, and upon the trees of the field, and upon the fruit of the ground; and it shall burn, and shall not be quenched.	-0.7	negative	""" 'Portanto, assim diz o Soberano Senhor: A minha ardente ira será derramada sobre este lugar, sobre os homens, os animais, e as árvores do campo, como também sobre o produto do solo; ela arderá como fogo, e não poderá ser extinguida."
JER.7.21	7	21	Thus saith the LORD of hosts, the God of Israel; Put your burnt offerings unto your sacrifices, and eat flesh.	0.0	neutral	""" 'Assim diz o Senhor dos Exércitos, o Deus de Israel: Juntem os seus holocaustos aos outros sacrifícios e comam a carne vocês mesmos!"
JER.7.22	7	22	For I spake not unto your fathers, nor commanded them in the day that I brought them out of the land of Egypt, concerning burnt offerings or sacrifices: {concerning: Heb. concerning the matter of}	-0.75	negative	Quando tirei do Egito os seus antepassados, nada lhes falei nem lhes ordenei quanto a holocaustos e sacrifícios.
JER.7.23	7	23	But this thing commanded I them, saying, Obey my voice, and I will be your God, and ye shall be my people: and walk ye in all the ways that I have commanded you, that it may be well unto you.	0.0	neutral	Dei-lhes, entretanto, esta ordem: Obedeçam-me, e eu serei o seu Deus e vocês serão o meu povo. Vocês andarão em todo o caminho que eu lhes ordenar, para que tudo lhes vá bem.
JER.7.24	7	24	But they hearkened not, nor inclined their ear, but walked in the counsels {and} in the imagination of their evil heart, and went backward, and not forward. {imagination: or, stubbornness} {went: Heb. were}	-1.0	negative	Mas eles não me ouviram nem me deram atenção. Antes, seguiram o raciocínio rebelde dos seus corações maus. Andaram para trás e não para a frente.
JER.7.25	7	25	Since the day that your fathers came forth out of the land of Egypt unto this day I have even sent unto you all my servants the prophets, daily rising up early and sending {them}:	0.05	neutral	Desde a época em que os seus antepassados saíram do Egito até o dia de hoje, eu lhes enviei os meus servos, os profetas, dia após dia.
JER.7.26	7	26	Yet they hearkened not unto me, nor inclined their ear, but hardened their neck: they did worse than their fathers.	-0.4	negative	Mas eles não me ouviram nem me deram atenção. Antes tornaram-se obstinados e foram piores do que os antepassados deles'.
JER.7.27	7	27	Therefore thou shalt speak all these words unto them; but they will not hearken to thee: thou shalt also call unto them; but they will not answer thee.	0.0	neutral	"""Quando você lhes disser tudo isso, eles não o escutarão; quando você os chamar, não responderão."
JER.7.28	7	28	But thou shalt say unto them, This {is} a nation that obeyeth not the voice of the LORD their God, nor receiveth correction: truth is perished, and is cut off from their mouth. {correction: or, instruction}	0.0	neutral	Portanto, diga a eles: 'Esta é uma nação que não obedeceu ao Senhor, ao seu Deus, nem aceitou a correção. A verdade foi destruída e desapareceu dos seus lábios.
JER.7.29	7	29	Cut off thine hair, {O Jerusalem}, and cast {it} away, and take up a lamentation on high places; for the LORD hath rejected and forsaken the generation of his wrath.	0.16	positive	Cortem os seus cabelos consagrados e joguem-os fora. Lamentem-se sobre os montes estéreis, pois o Senhor rejeitou e abandonou esta geração que provocou a sua ira.
JER.7.30	7	30	For the children of Judah have done evil in my sight, saith the LORD: they have set their abominations in the house which is called by my name, to pollute it.	-1.0	negative	""" 'Os de Judá fizeram o que eu reprovo, declara o Senhor. Profanaram o templo que leva o meu nome, colocando nele as imagens dos seus ídolos."
JER.7.31	7	31	And they have built the high places of Tophet, which {is} in the valley of the son of Hinnom, to burn their sons and their daughters in the fire; which I commanded {them} not, neither came it into my heart. {came...: Heb. came it upon my heart}	0.16	positive	Construíram o alto de Tofete no vale de Ben-Hinom, para queimarem em sacrifício os seus filhos e as suas filhas, coisa que nunca ordenei e que jamais me veio à mente.
JER.7.32	7	32	Therefore, behold, the days come, saith the LORD, that it shall no more be called Tophet, nor the valley of the son of Hinnom, but the valley of slaughter: for they shall bury in Tophet, till there be no place.	-0.25	negative	Por isso, certamente vêm os dias, declara o Senhor, em que não mais chamarão este lugar Tofete ou vale de Ben-Hinom, mas vale da Matança, pois ali enterrarão cadáveres até que não haja mais lugar.
JER.7.33	7	33	And the carcases of this people shall be meat for the fowls of the heaven, and for the beasts of the earth; and none shall fray {them} away.	0.0	neutral	Então os cadáveres deste povo servirão de comida para as aves e para os animais, e não haverá quem os afugente.
JER.7.34	7	34	Then will I cause to cease from the cities of Judah, and from the streets of Jerusalem, the voice of mirth, and the voice of gladness, the voice of the bridegroom, and the voice of the bride: for the land shall be desolate.	0.0	neutral	Darei fim às vozes de júbilo e de alegria, às vozes do noivo e da noiva nas cidades de Judá e nas ruas de Jerusalém, pois esta terra se tornará um deserto.
JER.8.1	8	1	At that time, saith the LORD, they shall bring out the bones of the kings of Judah, and the bones of his princes, and the bones of the priests, and the bones of the prophets, and the bones of the inhabitants of Jerusalem, out of their graves:	0.0	neutral	""" 'Naquele tempo, declara o Senhor, os ossos dos reis e dos líderes de Judá, os ossos dos sacerdotes e dos profetas e os ossos do povo de Jerusalém serão retirados dos seus túmulos."
JER.8.2	8	2	And they shall spread them before the sun, and the moon, and all the host of heaven, whom they have loved, and whom they have served, and after whom they have walked, and whom they have sought, and whom they have worshipped: they shall not be gathered, nor be buried; they shall be for dung upon the face of the earth.	0.7	positive	Serão expostos ao sol e à lua e a todos os astros do céu, que eles amaram, aos quais prestaram culto e os quais seguiram, consultaram e adoraram. Não serão ajuntados nem enterrados, mas se tornarão esterco sobre o solo.
JER.8.3	8	3	And death shall be chosen rather than life by all the residue of them that remain of this evil family, which remain in all the places whither I have driven them, saith the LORD of hosts.	-1.0	negative	Todos os sobreviventes dessa nação má preferirão a morte à vida, em todos os lugares para onde eu os expulsar, diz o Senhor dos Exércitos'.
JER.8.4	8	4	Moreover thou shalt say unto them, Thus saith the LORD; Shall they fall, and not arise? shall he turn away, and not return?	0.0	neutral	"""Diga a eles: 'Assim diz o Senhor. "" 'Quando os homens caem, não se levantam mais? Quando alguém se desvia do caminho, não retorna a ele?"
JER.8.5	8	5	Why {then} is this people of Jerusalem slidden back by a perpetual backsliding? they hold fast deceit, they refuse to return.	0.1	neutral	Por que será, então, que este povo se desviou? Por que Jerusalém persiste em desviar-se? Eles apegam-se ao engano e recusam-se a voltar.
JER.8.6	8	6	I hearkened and heard, {but} they spake not aright: no man repented him of his wickedness, saying, What have I done? every one turned to his course, as the horse rusheth into the battle.	0.0	neutral	"Eu ouvi com atenção, mas eles não dizem o que é certo. Ninguém se arrepende de sua maldade e diz: ""O que foi que eu fiz? "" Cada um se desvia e segue seu próprio curso, como um cavalo que se lança com ímpeto na batalha."
JER.8.7	8	7	Yea, the stork in the heaven knoweth her appointed times; and the turtle and the crane and the swallow observe the time of their coming; but my people know not the judgment of the LORD.	0.0	neutral	Até a cegonha no céu conhece as estações que lhe estão determinadas, e a pomba, a andorinha e o tordo observam a época de sua migração. Mas o meu povo não conhece as exigências do Senhor.
JER.8.8	8	8	How do ye say, We {are} wise, and the law of the LORD {is} with us? Lo, certainly in vain made he {it}; the pen of the scribes {is} in vain. {in vain made...: or, the false pen of the scribes worketh for falsehood}	0.1714	positive	""" 'Como vocês podem dizer ""Somos sábios, pois temos a lei do Senhor"", quando na verdade a pena mentirosa dos escribas a transformou em mentira?"
JER.8.9	8	9	The wise {men} are ashamed, they are dismayed and taken: lo, they have rejected the word of the LORD; and what wisdom {is} in them? {The wise...: or, Have they been ashamed, etc} {what...: Heb. the wisdom of what thing}	0.7	positive	Os sábios serão envergonhados; ficarão amedrontados e serão pegos na armadilha. Visto que rejeitaram a palavra do Senhor, que sabedoria é essa que eles têm?
JER.8.10	8	10	Therefore will I give their wives unto others, {and} their fields to them that shall inherit {them}: for every one from the least even unto the greatest is given to covetousness, from the prophet even unto the priest every one dealeth falsely.	0.1	neutral	Por isso, entregarei as suas mulheres a outros homens, e darei os seus campos a outros proprietários. Desde o menor até o maior, todos são gananciosos; tanto os sacerdotes como os profetas, todos praticam a falsidade.
JER.8.11	8	11	For they have healed the hurt of the daughter of my people slightly, saying, Peace, peace; when {there is} no peace.	-0.1667	negative	"Eles tratam da ferida do meu povo como se ela não fosse grave. ""Paz, paz"", dizem, quando não há paz alguma."
JER.8.12	8	12	Were they ashamed when they had committed abomination? nay, they were not at all ashamed, neither could they blush: therefore shall they fall among them that fall: in the time of their visitation they shall be cast down, saith the LORD. {I will...: or, In gathering I will consume}	-0.1556	negative	Ficaram eles envergonhados de sua conduta detestável? Não, eles não sentem vergonha, nem mesmo sabem corar. Portanto, cairão entre os que caem; serão humilhados quando eu os castigar, declara o Senhor.
JER.8.13	8	13	I will surely consume them, saith the LORD: {there shall be} no grapes on the vine, nor figs on the fig tree, and the leaf shall fade; and {the things that} I have given them shall pass away from them.	-0.125	negative	""" 'Eu quis recolher a colheita deles, declara o Senhor. Mas não há uvas na videira nem figos na figueira; as folhas estão secas. O que lhes dei será tomado deles'."
JER.8.14	8	14	Why do we sit still? assemble yourselves, and let us enter into the defenced cities, and let us be silent there: for the LORD our God hath put us to silence, and given us water of gall to drink, because we have sinned against the LORD. {gall: or, poison}	0.0	neutral	"""Por que estamos sentados aqui? Reúnam-se! Fujamos para as cidades fortificadas e pereçamos ali! Pois o Senhor, o nosso Deus, condenou-nos a perecer e nos deu água envenenada para beber, porque temos pecado contra ele."
JER.8.15	8	15	We looked for peace, but no good {came; and} for a time of health, and behold trouble!	-0.3	negative	Esperávamos a paz, mas não veio bem algum; esperávamos um tempo de cura, mas há somente terror.
JER.8.16	8	16	The snorting of his horses was heard from Dan: the whole land trembled at the sound of the neighing of his strong ones; for they are come, and have devoured the land, and all that is in it; the city, and those that dwell therein. {all...: Heb. the fulness thereof}	0.3444	positive	O resfolegar dos seus cavalos pode-se ouvir desde Dã; ao relinchar dos seus garanhões a terra toda treme. Vieram para devorar esta terra e tudo o que nela existe, a cidade e todos os que nela habitam.
JER.8.17	8	17	For, behold, I will send serpents, cockatrices, among you, which {will} not {be} charmed, and they shall bite you, saith the LORD.	0.0	neutral	"""Vejam, estou enviando contra vocês serpentes venenosas, que ninguém consegue encantar; elas morderão vocês, e não haverá remédio"", diz o Senhor."
JER.8.18	8	18	{When} I would comfort myself against sorrow, my heart {is} faint in me. {in: Heb. upon}	-0.5	negative	A tristeza tomou conta de mim; o meu coração desfalece.
JER.8.19	8	19	Behold the voice of the cry of the daughter of my people because of them that dwell in a far country: {Is} not the LORD in Zion? {is} not her king in her? Why have they provoked me to anger with their graven images, {and} with strange vanities? {them...: Heb. the country of them that are far off}	-0.26	negative	"Ouça o grito de socorro da minha filha, do meu povo, grito que se estende por toda esta terra: ""O Senhor não está em Sião? Não se acha mais ali o seu rei? "" ""Por que eles me provocaram à ira com os seus ídolos, com os seus inúteis deuses estrangeiros? """
