verse_id	chapter	verse	text_en	polarity_en	label_en	text_pt
JER.18.7	18	7	{At what} instant I shall speak concerning a nation, and concerning a kingdom, to pluck up, and to pull down, and to destroy {it};	-0.1185	negative	Se em algum momento eu decretar que uma nação ou um reino seja arrancado, despedaçado e arruinado,
JER.18.8	18	8	If that nation, against whom I have pronounced, turn from their evil, I will repent of the evil that I thought to do unto them.	-1.0	negative	e se essa nação que eu adverti converter-se da sua perversidade, então eu me arrependerei e não trarei sobre ela a desgraça que eu tinha planejado.
JER.18.9	18	9	And {at what} instant I shall speak concerning a nation, and concerning a kingdom, to build and to plant {it};	0.0	neutral	E, se noutra ocasião eu decretar que uma nação ou um reino seja edificado e plantado,
JER.18.10	18	10	If it do evil in my sight, that it obey not my voice, then I will repent of the good, wherewith I said I would benefit them.	-0.15	negative	e se ele fizer o que eu reprovo e não me obedecer, então me arrependerei do bem que eu pretendia fazer em favor dele.
JER.18.11	18	11	Now therefore go to, speak to the men of Judah, and to the inhabitants of Jerusalem, saying, Thus saith the LORD; Behold, I frame evil against you, and devise a device against you: return ye now every one from his evil way, and make your ways and your doings good.	-0.4333	negative	"""Agora, portanto, diga ao povo de Judá e aos habitantes de Jerusalém: 'Assim diz o Senhor: Estou preparando uma desgraça e fazendo um plano contra vocês. Por isso, converta-se cada um de seu mau procedimento e corrija a sua conduta e as suas ações'."
JER.18.12	18	12	And they said, There is no hope: but we will walk after our own devices, and we will every one do the imagination of his evil heart.	-0.2	negative	"Mas eles responderão: 'Não adianta. Continuaremos com os nossos próprios planos; cada um de nós seguirá a rebeldia do seu coração mau'. """
JER.18.13	18	13	Therefore thus saith the LORD; Ask ye now among the heathen, who hath heard such things: the virgin of Israel hath done a very horrible thing.	-0.5	negative	"Portanto, assim diz o Senhor: ""Perguntem entre as nações se alguém já ouviu uma coisa dessas; coisa tremendamente horrível fez a virgem, Israel!"
JER.18.14	18	14	Will {a man} leave the snow of Lebanon {which cometh} from the rock of the field? {or} shall the cold flowing waters that come from another place be forsaken? {the snow...: or, my fields for a rock, or for the snow of Lebanon? shall the running waters be forsaken for the strange cold waters?}	-0.4167	negative	Poderá desaparecer a neve do Líbano de suas encostas rochosas? Poderá parar de fluir suas águas frias, vindas de lugares distantes?
JER.18.15	18	15	Because my people hath forgotten me, they have burned incense to vanity, and they have caused them to stumble in their ways {from} the ancient paths, to walk in paths, {in} a way not cast up;	-0.05	neutral	Contudo, o meu povo esqueceu-se de mim: queimam incenso a ídolos inúteis, que os fazem tropeçar em seus caminhos e nas antigas veredas, para que andem em desvios, em estradas não aterradas.
JER.18.16	18	16	To make their land desolate, {and} a perpetual hissing; every one that passeth thereby shall be astonished, and wag his head.	0.0	neutral	A terra deles ficará deserta e será tema de permanente zombaria. Todos os que por ela passarem ficarão chocados e balançarão a cabeça.
JER.18.17	18	17	I will scatter them as with an east wind before the enemy; I will shew them the back, and not the face, in the day of their calamity.	0.0	neutral	"Como o vento leste, eu os dispersarei diante dos inimigos; eu lhes mostrarei as costas e não o rosto, no dia da sua derrota""."
JER.18.18	18	18	Then said they, Come, and let us devise devices against Jeremiah; for the law shall not perish from the priest, nor counsel from the wise, nor the word from the prophet. Come, and let us smite him with the tongue, and let us not give heed to any of his words. {with...: or, for the tongue}	0.7	positive	"Então disseram: ""Venham! Façamos planos contra Jeremias, pois não cessará o ensino da lei pelo sacerdote nem o conselho do sábio nem a mensagem do profeta. Venham! Façamos acusações contra ele e não ouçamos nada do que ele disser""."
JER.18.19	18	19	Give heed to me, O LORD, and hearken to the voice of them that contend with me.	0.0	neutral	Atende-me, ó Senhor; ouve o que os meus acusadores estão dizendo!
JER.18.20	18	20	Shall evil be recompensed for good? for they have digged a pit for my soul. Remember that I stood before thee to speak good for them, {and} to turn away thy wrath from them.	0.1333	positive	Acaso se paga o bem com o mal? Mas eles cavaram uma cova para mim. Lembra-te de que eu compareci diante de ti para interceder em favor deles, para que desviasses deles a tua ira.
JER.18.21	18	21	Therefore deliver up their children to the famine, and pour out their {blood} by the force of the sword; and let their wives be bereaved of their children, and {be} widows; and let their men be put to death; {let} their young men {be} slain by the sword in battle. {pour...: Heb. pour them out}	0.1	neutral	Por isso entrega os filhos deles à fome e ao poder da espada. Que as suas mulheres fiquem sem filhos e viúvas; que os seus homens sejam mortos, e os seus rapazes sejam mortos pela espada na batalha.
JER.18.22	18	22	Let a cry be heard from their houses, when thou shalt bring a troop suddenly upon them: for they have digged a pit to take me, and hid snares for my feet.	0.0	neutral	Seja ouvido o grito que vem de suas casas, quando repentinamente trouxeres invasores contra eles; pois cavaram uma cova para me capturarem e esconderam armadilhas para os meus pés.
JER.18.23	18	23	Yet, LORD, thou knowest all their counsel against me to slay {me}: forgive not their iniquity, neither blot out their sin from thy sight, but let them be overthrown before thee; deal {thus} with them in the time of thine anger. {to slay...: Heb. for death}	-0.7	negative	Mas tu conheces, ó Senhor, todas as suas conspirações para me matarem. Não perdoes os seus crimes nem apagues de diante da tua vista os seus pecados. Sejam eles derrubados diante de ti; age contra eles na hora da tua ira!
JER.19.1	19	1	Thus saith the LORD, Go and get a potter's earthen bottle, and {take} of the ancients of the people, and of the ancients of the priests;	0.0	neutral	"Assim diz o Senhor: ""Vá comprar um vaso de barro de um oleiro. Leve com você alguns líderes do povo e alguns sacerdotes"
JER.19.2	19	2	And go forth unto the valley of the son of Hinnom, which {is} by the entry of the east gate, and proclaim there the words that I shall tell thee, {the east...: Heb. the sun gate}	0.0	neutral	e vá em direção ao vale de Ben-Hinom, perto da entrada da porta dos Cacos. Proclame ali as palavras que eu lhe disser.
JER.19.3	19	3	And say, Hear ye the word of the LORD, O kings of Judah, and inhabitants of Jerusalem; Thus saith the LORD of hosts, the God of Israel; Behold, I will bring evil upon this place, the which whosoever heareth, his ears shall tingle.	-1.0	negative	Diga: 'Ouçam a palavra do Senhor, reis de Judá e habitantes de Jerusalém. Assim diz o Senhor dos Exércitos, Deus de Israel: Trarei desgraça tal sobre este lugar que fará retinir os ouvidos daqueles que ouvirem isso.
JER.19.4	19	4	Because they have forsaken me, and have estranged this place, and have burned incense in it unto other gods, whom neither they nor their fathers have known, nor the kings of Judah, and have filled this place with the blood of innocents;	0.1375	positive	Porque eles me abandonaram e profanaram este lugar, oferecendo sacrifícios a deuses estranhos, que nem eles nem seus antepassados nem os reis de Judá conheceram; e encheram este lugar com o sangue de inocentes.
JER.19.5	19	5	They have built also the high places of Baal, to burn their sons with fire {for} burnt offerings unto Baal, which I commanded not, nor spake {it}, neither came {it} into my mind:	0.16	positive	Construíram nos montes os altares dedicados a Baal, para queimarem os seus filhos como holocaustos oferecidos a Baal, coisa que não ordenei, da qual nunca falei nem jamais me veio à mente.
JER.19.6	19	6	Therefore, behold, the days come, saith the LORD, that this place shall no more be called Tophet, nor The valley of the son of Hinnom, but The valley of slaughter.	-0.25	negative	Por isso, certamente vêm os dias, declara o Senhor, em que não mais chamarão este lugar Tofete ou vale de Ben-Hinom, mas vale da Matança.
JER.19.7	19	7	And I will make void the counsel of Judah and Jerusalem in this place; and I will cause them to fall by the sword before their enemies, and by the hands of them that seek their lives: and their carcases will I give to be meat for the fowls of the heaven, and for the beasts of the earth.	0.0	neutral	""" 'Esvaziarei neste lugar os planos de Judá e de Jerusalém: eu os farei morrer pela espada perante os seus inimigos, pelas mãos daqueles que os perseguem; e darei os seus cadáveres como comida para as aves e os animais."
JER.19.8	19	8	And I will make this city desolate, and an hissing; every one that passeth thereby shall be astonished and hiss because of all the plagues thereof.	0.0	neutral	Farei com que esta cidade fique deserta e seja tema de zombaria. Todos os que por ela passarem ficarão chocados e zombarão de todos os seus ferimentos.
JER.19.9	19	9	And I will cause them to eat the flesh of their sons and the flesh of their daughters, and they shall eat every one the flesh of his friend in the siege and straitness, wherewith their enemies, and they that seek their lives, shall straiten them.	0.0	neutral	Eu farei com que comam a carne dos seus filhos e das suas filhas; e cada um comerá a carne do seu próximo, por causa do sofrimento que lhes infligirão durante o cerco feito pelos inimigos, os quais procuram tirar-lhes a vida'.
JER.19.10	19	10	Then shalt thou break the bottle in the sight of the men that go with thee,	0.0	neutral	"""Depois quebre o vaso de barro diante dos homens que o acompanharam,"
JER.19.11	19	11	And shalt say unto them, Thus saith the LORD of hosts; Even so will I break this people and this city, as {one} breaketh a potter's vessel, that cannot be made whole again: and they shall bury {them} in Tophet, till {there be} no place to bury. {be made...: Heb. be healed}	0.2	positive	e diga-lhes: 'Assim diz o Senhor dos Exércitos: Assim como se quebra o vaso de oleiro, que não pode ser mais restaurado, quebrarei este povo e esta cidade, e os mortos em Tofete serão sepultados até que não haja mais lugar.
JER.19.12	19	12	Thus will I do unto this place, saith the LORD, and to the inhabitants thereof, and {even} make this city as Tophet:	0.0	neutral	"Assim farei a este lugar e aos seus habitantes"", declara o Senhor, ""tornarei esta cidade como Tofete."
JER.19.13	19	13	And the houses of Jerusalem, and the houses of the kings of Judah, shall be defiled as the place of Tophet, because of all the houses upon whose roofs they have burned incense unto all the host of heaven, and have poured out drink offerings unto other gods.	-0.125	negative	"As casas de Jerusalém e os palácios reais de Judá serão profanados, como este lugar de Tofete: todas as casas em cujos terraços queimaram incenso a todos os corpos celestes, e derramaram ofertas de bebidas aos seus deuses estrangeiros' ""."
JER.19.14	19	14	Then came Jeremiah from Tophet, whither the LORD had sent him to prophesy; and he stood in the court of the LORD'S house; and said to all the people,	0.0	neutral	Jeremias, voltou então de Tofete para onde o Senhor o mandara profetizar e, entrando no pátio do templo do Senhor, disse a todo o povo:
JER.19.15	19	15	Thus saith the LORD of hosts, the God of Israel; Behold, I will bring upon this city and upon all her towns all the evil that I have pronounced against it, because they have hardened their necks, that they might not hear my words.	-1.0	negative	"""Assim diz o Senhor dos Exércitos, o Deus de Israel: 'Ouçam! Trarei sobre esta cidade, e sobre todos os povoados ao redor, todas as desgraças contra eles anunciadas, porque se obstinaram e não quiseram obedecer às minhas palavras' ""."
JER.20.1	20	1	Now Pashur the son of Immer the priest, who {was} also chief governor in the house of the LORD, heard that Jeremiah prophesied these things.	0.0	neutral	Quando o sacerdote Pasur, filho de Imer, o mais alto funcionário do templo do Senhor, ouviu Jeremias profetizando essas coisas,
JER.20.2	20	2	Then Pashur smote Jeremiah the prophet, and put him in the stocks that {were} in the high gate of Benjamin, which {was} by the house of the LORD.	0.16	positive	mandou espancar o profeta e prendê-lo no tronco, que havia junto à porta Superior de Benjamim, no templo do Senhor.
JER.20.3	20	3	And it came to pass on the morrow, that Pashur brought forth Jeremiah out of the stocks. Then said Jeremiah unto him, The LORD hath not called thy name Pashur, but Magormissabib. {Magormissabib: that is, Fear round about}	-0.2	negative	"Na manhã seguinte, quando Pasur mandou soltá-lo do tronco, Jeremias lhe disse: ""O Senhor já não o chama Pasur, e sim Magor-Missabibe."
JER.20.4	20	4	For thus saith the LORD, Behold, I will make thee a terror to thyself, and to all thy friends: and they shall fall by the sword of their enemies, and thine eyes shall behold {it}: and I will give all Judah into the hand of the king of Babylon, and he shall carry them captive into Babylon, and shall slay them with the sword.	0.2	positive	Pois assim diz o Senhor: 'Farei de você um terror para si mesmo e para todos os seus amigos: você verá com os próprios olhos quando eles forem mortos pela espada dos seus inimigos. Entregarei todo o povo de Judá nas mãos do rei da Babilônia, que os levará para a Babilônia e os matará à espada.
JER.20.5	20	5	Moreover I will deliver all the strength of this city, and all the labours thereof, and all the precious things thereof, and all the treasures of the kings of Judah will I give into the hand of their enemies, which shall spoil them, and take them, and carry them to Babylon.	0.5	positive	Eu entregarei nas mãos dos seus inimigos toda a riqueza desta cidade: toda a sua produção, todos os seus bens de valor e todos os tesouros dos reis de Judá. Levarão tudo como despojo para a Babilônia.
JER.20.6	20	6	And thou, Pashur, and all that dwell in thine house shall go into captivity: and thou shalt come to Babylon, and there thou shalt die, and shalt be buried there, thou, and all thy friends, to whom thou hast prophesied lies.	0.0	neutral	"E você, Pasur, e todos os que vivem em sua casa irão para o exílio, para a Babilônia. Lá vocês morrerão e serão sepultados, você e todos os seus amigos a quem você tem profetizado mentiras' ""."
JER.20.7	20	7	O LORD, thou hast deceived me, and I was deceived: thou art stronger than I, and hast prevailed: I am in derision daily, every one mocketh me. {was deceived: or, was enticed}	0.0	neutral	Senhor, tu me enganaste, e eu fui enganado; foste mais forte do que eu e prevaleceste. Sou ridicularizado o dia inteiro; todos zombam de mim.
JER.20.8	20	8	For since I spake, I cried out, I cried violence and spoil; because the word of the LORD was made a reproach unto me, and a derision, daily.	0.0	neutral	Sempre que falo, é para gritar que há violência e destruição. Por isso a palavra do Senhor trouxe-me insulto e censura o tempo todo.
JER.20.9	20	9	Then I said, I will not make mention of him, nor speak any more in his name. But {his word} was in mine heart as a burning fire shut up in my bones, and I was weary with forbearing, and I could not {stay}.	0.5	positive	"Mas, se eu digo: ""Não o mencionarei nem mais falarei em seu nome"", é como se um fogo ardesse em meu coração, um fogo dentro de mim. Estou exausto tentando contê-lo; já não posso mais!"
JER.20.10	20	10	For I heard the defaming of many, fear on every side. Report, {say they}, and we will report it. All my familiars watched for my halting, {saying}, Peradventure he will be enticed, and we shall prevail against him, and we shall take our revenge on him. {All...: Heb. Every man of my peace}	0.5	positive	"Ouço muitos comentando: ""Terror por todos os lados! Denunciem-no! Vamos denunciá-lo! "" Todos os meus amigos estão esperando que eu tropece, e dizem: ""Talvez ele se deixe enganar; então nós o venceremos e nos vingaremos dele""."
JER.20.11	20	11	But the LORD {is} with me as a mighty terrible one: therefore my persecutors shall stumble, and they shall not prevail: they shall be greatly ashamed; for they shall not prosper: {their} everlasting confusion shall never be forgotten.	-0.12	negative	Mas o Senhor está comigo, como um forte guerreiro! Portanto, aqueles que me perseguem tropeçarão e não prevalecerão. O seu fracasso lhes trará completa vergonha; a sua desonra jamais será esquecida.
JER.20.12	20	12	But, O LORD of hosts, that triest the righteous, {and} seest the reins and the heart, let me see thy vengeance on them: for unto thee have I opened my cause.	0.0	neutral	Ó Senhor dos Exércitos, tu que examinas o justo e vês o coração e a mente, deixa-me ver a tua vingança sobre eles, pois a ti expus a minha causa.
JER.20.13	20	13	Sing unto the LORD, praise ye the LORD: for he hath delivered the soul of the poor from the hand of evildoers.	-0.4	negative	Cantem ao Senhor! Louvem ao Senhor! Porque ele salva o pobre das mãos dos ímpios.
JER.20.14	20	14	Cursed {be} the day wherein I was born: let not the day wherein my mother bare me be blessed.	0.05	neutral	Maldito seja o dia em que eu nasci! Jamais seja abençoado o dia em que minha mãe me deu à luz!
JER.20.15	20	15	Cursed {be} the man who brought tidings to my father, saying, A man child is born unto thee; making him very glad.	0.65	positive	"Maldito seja o homem que levou a notícia a meu pai, e o deixou muito alegre, quando disse: ""Você é pai de um menino! """
JER.20.16	20	16	And let that man be as the cities which the LORD overthrew, and repented not: and let him hear the cry in the morning, and the shouting at noontide;	0.0	neutral	Seja aquele homem como as cidades que o Senhor destruiu sem piedade. Que ele ouça gritos de socorro pela manhã, e gritos de guerra ao meio-dia;
JER.20.17	20	17	Because he slew me not from the womb; or that my mother might have been my grave, and her womb {to be} always great {with me}.	0.8	positive	pois ele não me matou no ventre materno nem fez da minha mãe o meu túmulo, e tampouco a deixou permanentemente grávida.
JER.20.18	20	18	Wherefore came I forth out of the womb to see labour and sorrow, that my days should be consumed with shame?	0.0	neutral	Por que saí do ventre materno? Só para ver dificuldades e tristezas, e terminar os meus dias na maior decepção?
JER.21.1	21	1	The word which came unto Jeremiah from the LORD, when king Zedekiah sent unto him Pashur the son of Melchiah, and Zephaniah the son of Maaseiah the priest, saying,	0.0	neutral	Esta é a palavra que veio a Jeremias da parte do Senhor, quando o rei Zedequias enviou-lhe Pasur, filho de Malquias, e o sacerdote Sofonias, filho de Maaséias. Eles disseram:
JER.21.2	21	2	Enquire, I pray thee, of the LORD for us; for Nebuchadrezzar king of Babylon maketh war against us; if so be that the LORD will deal with us according to all his wondrous works, that he may go up from us.	0.0	neutral	"""Consulte agora o Senhor por nós porque Nabucodonosor, rei da Babilônia, está nos atacando. Talvez o Senhor faça por nós uma de suas maravilhas e, assim, ele se retire de nós""."
JER.21.3	21	3	Then said Jeremiah unto them, Thus shall ye say to Zedekiah:	0.0	neutral	"Jeremias, porém, respondeu-lhes: ""Digam a Zedequias:"
JER.21.4	21	4	Thus saith the LORD God of Israel; Behold, I will turn back the weapons of war that {are} in your hands, wherewith ye fight against the king of Babylon, and {against} the Chaldeans, which besiege you without the walls, and I will assemble them into the midst of this city.	0.0	neutral	'Assim diz o Senhor, o Deus de Israel: Estou a ponto de voltar contra vocês as armas de guerra que estão em suas mãos, as quais vocês estão usando para combater o rei da Babilônia e os babilônios, os quais cercam vocês do lado de fora do muro. E eu os reunirei dentro desta cidade.
JER.21.5	21	5	And I myself will fight against you with an outstretched hand and with a strong arm, even in anger, and in fury, and in great wrath.	0.1778	positive	Eu mesmo lutarei contra vocês com mão poderosa e braço forte, com ira, furor e grande indignação.
JER.21.6	21	6	And I will smite the inhabitants of this city, both man and beast: they shall die of a great pestilence.	0.8	positive	Matarei os habitantes desta cidade, tanto homens como animais; eles morrerão de uma peste terrível.
JER.21.7	21	7	And afterward, saith the LORD, I will deliver Zedekiah king of Judah, and his servants, and the people, and such as are left in this city from the pestilence, from the sword, and from the famine, into the hand of Nebuchadrezzar king of Babylon, and into the hand of their enemies, and into the hand of those that seek their life: and he shall smite them with the edge of the sword; he shall not spare them, neither have pity, nor have mercy.	-0.0333	neutral	Depois disso, declara o Senhor, entregarei Zedequias, rei de Judá, seus conselheiros e o povo desta cidade que sobreviver, à peste, à espada e à fome, e nas mãos de Nabucodonosor, rei da Babilônia, dos inimigos deles e daqueles que querem tirar-lhes a vida. Ele os matará à espada sem piedade nem misericórdia; não terá deles nenhuma compaixão'.
JER.21.8	21	8	And unto this people thou shalt say, Thus saith the LORD; Behold, I set before you the way of life, and the way of death.	0.0	neutral	"""Diga a este povo: 'Assim diz o Senhor: Ponho diante de vocês o caminho da vida e o caminho da morte."
JER.21.9	21	9	He that abideth in this city shall die by the sword, and by the famine, and by the pestilence: but he that goeth out, and falleth to the Chaldeans that besiege you, he shall live, and his life shall be unto him for a prey.	0.1364	positive	Todo aquele que ficar nesta cidade morrerá pela espada, pela fome ou pela peste. Mas todo o que sair e render-se aos babilônios, que os cercam vocês, viverá; este escapará com vida.
JER.21.10	21	10	For I have set my face against this city for evil, and not for good, saith the LORD: it shall be given into the hand of the king of Babylon, and he shall burn it with fire.	-0.15	negative	Decidi fazer o mal e não o bem a esta cidade, diz o Senhor. Ela será entregue nas mãos do rei da Babilônia, e ele a incendiará'.
JER.21.11	21	11	And touching the house of the king of Judah, {say}, Hear ye the word of the LORD;	0.5	positive	"""Digam à casa real de Judá: 'Ouçam a palavra do Senhor."
JER.21.12	21	12	O house of David, thus saith the LORD; Execute judgment in the morning, and deliver {him that is} spoiled out of the hand of the oppressor, lest my fury go out like fire, and burn that none can quench {it}, because of the evil of your doings. {Execute: Heb. Judge}	-1.0	negative	"Ó dinastia de Davi, assim diz o Senhor: "" 'Administrem justiça cada manhã: livrem o explorado das mãos do opressor; se não a minha ira se acenderá e queimará como fogo inextinguível, por causa do mal que vocês têm feito."
JER.21.13	21	13	Behold, I {am} against thee, O inhabitant of the valley, {and} rock of the plain, saith the LORD; which say, Who shall come down against us? or who shall enter into our habitations? {inhabitant: Heb. inhabitress}	-0.1849	negative	"Eu estou contra você, Jerusalém! Você que está entronizada acima deste vale, na rocha do planalto, declara o Senhor, vocês que dizem: ""Quem nos atacará? Quem poderá invadir nossas moradas? """
JER.21.14	21	14	But I will punish you according to the fruit of your doings, saith the LORD: and I will kindle a fire in the forest thereof, and it shall devour all things round about it. {punish: Heb. visit upon}	-0.2	negative	"Eu os castigarei de acordo com as suas obras, diz o Senhor, Porei fogo em sua floresta, que consumirá tudo ao redor' ""."
JER.22.1	22	1	Thus saith the LORD; Go down to the house of the king of Judah, and speak there this word,	-0.1556	negative	"Assim diz o Senhor: ""Desça ao palácio do rei de Judá e proclame ali esta mensagem:"
JER.22.2	22	2	And say, Hear the word of the LORD, O king of Judah, that sittest upon the throne of David, thou, and thy servants, and thy people that enter in by these gates:	0.0	neutral	'Ouça a palavra do Senhor, ó rei de Judá, tu que te assentas no trono de Davi; tu e teus conselheiros, e teu povo que passa por estas portas.
JER.22.3	22	3	Thus saith the LORD; Execute ye judgment and righteousness, and deliver the spoiled out of the hand of the oppressor: and do no wrong, do no violence to the stranger, the fatherless, nor the widow, neither shed innocent blood in this place.	0.375	positive	Assim diz o Senhor: Administrem a justiça e o direito: livrem o explorado das mãos do opressor. Não oprimam nem maltratem o estrangeiro, o órfão ou a viúva; nem derramem sangue inocente neste lugar.
JER.22.4	22	4	For if ye do this thing indeed, then shall there enter in by the gates of this house kings sitting upon the throne of David, riding in chariots and on horses, he, and his servants, and his people. {upon...: Heb. for David upon his throne}	0.0	neutral	Porque, se vocês tiverem o cuidado de cumprir essas ordens, então os reis que se assentarem no trono de Davi entrarão pelas portas deste palácio em carruagens e cavalos, em companhia de seus conselheiros e de seu povo.
