verse_id	chapter	verse	text_en	polarity_en	label_en	text_pt
JER.52.17	52	17	Also the pillars of brass that {were} in the house of the LORD, and the bases, and the brasen sea that {was} in the house of the LORD, the Chaldeans brake, and carried all the brass of them to Babylon.	0.0	neutral	Os babilônios despedaçaram as colunas de bronze, os estrados móveis e o mar de bronze que ficavam no templo do Senhor e levaram todo o bronze para a Babilônia.
JER.52.18	52	18	The caldrons also, and the shovels, and the snuffers, and the bowls, and the spoons, and all the vessels of brass wherewith they ministered, took they away. {shovels: or, instruments to remove the ashes} {bowls: or, basons}	0.0	neutral	Também levaram embora as panelas, pás, tesouras de pavio, bacias de aspersão, tigelas e todos os utensílios de bronze usados no serviço do templo.
JER.52.19	52	19	And the basons, and the firepans, and the bowls, and the caldrons, and the candlesticks, and the spoons, and the cups; {that} which {was} of gold {in} gold, and {that} which {was} of silver {in} silver, took the captain of the guard away. {firepans: or, censers}	0.0	neutral	O comandante da guarda imperial levou embora as pias, os incensários, as bacias de aspersão, as panelas, os candeeiros, as tigelas e as bacias usadas para as ofertas derramadas, tudo que era feito de ouro puro ou de prata.
JER.52.20	52	20	The two pillars, one sea, and twelve brasen bulls that {were} under the bases, which king Solomon had made in the house of the LORD: the brass of all these vessels was without weight. {the brass: Heb. their brass}	0.0	neutral	O bronze tirado das duas colunas, o mar e os doze touros de bronze debaixo dele, e os estrados móveis, que o rei Salomão fizera para o templo do Senhor, eram mais do que se podia pesar.
JER.52.21	52	21	And {concerning} the pillars, the height of one pillar {was} eighteen cubits; and a fillet of twelve cubits did compass it; and the thickness thereof {was} four fingers: {it was} hollow. {fillet: Heb. thread}	-0.425	negative	Cada uma das colunas tinha oito metros e dez centímetros de altura e cinco metros e quarenta centímetros de circunferência; cada uma tinha quadro dedos de espessura e era oca.
JER.52.22	52	22	And a chapiter of brass {was} upon it; and the height of one chapiter {was} five cubits, with network and pomegranates upon the chapiters round about, all {of} brass. The second pillar also and the pomegranates {were} like unto these.	-0.1	neutral	O capitel de bronze no alto de uma coluna tinha dois metros e vinte e cinco centímetros de altura e era ornamentado com um trabalho entrelaçado e romãs de bronze em volta, tudo de bronze. A outra coluna, com suas romãs, era igual.
JER.52.23	52	23	And there were ninety and six pomegranates on a side; {and} all the pomegranates upon the network {were} an hundred round about.	-0.2	negative	Havia noventa e seis romãs nos lados; o número total de romãs acima do trabalho entrelaçado ao redor era de cem.
JER.52.24	52	24	And the captain of the guard took Seraiah the chief priest, and Zephaniah the second priest, and the three keepers of the door: {door: Heb. threshold}	-0.375	negative	O comandante da guarda tomou como prisioneiros o sumo sacerdote Seraías, o sacerdote adjunto Sofonias e os três guardas das portas.
JER.52.25	52	25	He took also out of the city an eunuch, which had the charge of the men of war; and seven men of them that were near the king's person, which were found in the city; and the principal scribe of the host, who mustered the people of the land; and threescore men of the people of the land, that were found in the midst of the city. {were near...: Heb. saw the face of the king} {principal...: or, scribe of the captain of the host}	0.1	neutral	Dos que ainda estavam na cidade, tomou o oficial encarregado dos homens de combate e sete conselheiros reais. Também tomou o secretário que era o oficial maior encarregado do alistamento do povo da terra e sessenta de seus homens que foram encontrados na cidade.
JER.52.26	52	26	So Nebuzaradan the captain of the guard took them, and brought them to the king of Babylon to Riblah.	0.0	neutral	O comandante Nebuzaradã tomou todos eles e os levou ao rei da Babilônia em Ribla.
JER.52.27	52	27	And the king of Babylon smote them, and put them to death in Riblah in the land of Hamath. Thus Judah was carried away captive out of his own land.	0.4	positive	Ali em Ribla, na terra de Hamate, o rei fez com que fossem executados. Assim Judá foi para o cativeiro, longe de sua terra.
JER.52.28	52	28	This {is} the people whom Nebuchadrezzar carried away captive: in the seventh year three thousand Jews and three and twenty:	0.2	positive	Este é o número dos que Nebuzaradã levou para o exílio: no sétimo ano, 3. 023 judeus;
JER.52.29	52	29	In the eighteenth year of Nebuchadrezzar he carried away captive from Jerusalem eight hundred thirty and two persons: {persons: Heb. souls}	-0.275	negative	no décimo oitavo ano de Nabucodonosor, 832 de Jerusalém;
JER.52.30	52	30	In the three and twentieth year of Nebuchadrezzar Nebuzaradan the captain of the guard carried away captive of the Jews seven hundred forty and five persons: all the persons {were} four thousand and six hundred.	0.2	positive	em seu vigésimo terceiro ano, 745 judeus levados ao exílio pelo comandante da guarda imperial Nebuzaradã. Foram ao todo 4. 600 judeus.
JER.52.31	52	31	And it came to pass in the seven and thirtieth year of the captivity of Jehoiachin king of Judah, in the twelfth month, in the five and twentieth {day} of the month, {that} Evilmerodach king of Babylon in the {first} year of his reign lifted up the head of Jehoiachin king of Judah, and brought him forth out of prison,	0.25	positive	No ano trinta e sete do exílio do rei Joaquim de Judá, no ano em que Evil-Merodaque tornou-se rei de Babilônia, ele libertou o rei Joaquim de Judá da prisão no dia vinte e cinco do décimo segundo mês.
JER.52.32	52	32	And spake kindly unto him, and set his throne above the throne of the kings that {were} with him in Babylon, {kindly...: Heb. good things with him}	0.475	positive	Ele falou bondosamente com ele e deu-lhe um assento de honra mais elevado do que os dos outros reis que estavam com ele na Babilônia.
JER.52.33	52	33	And changed his prison garments: and he did continually eat bread before him all the days of his life.	0.0	neutral	Desse modo Joaquim tirou as roupas da prisão e pelo resto da vida comeu à mesa do rei.
JER.52.34	52	34	And {for} his diet, there was a continual diet given him of the king of Babylon, every day a portion until the day of his death, all the days of his life. {every...: Heb. the matter of the day in his day}	0.0	neutral	Dia após dia o rei da Babilônia deu a Joaquim uma pensão diária enquanto ele viveu, até o dia de sua morte.
