verse_id	chapter	verse	text_en	polarity_en	label_en	text_pt
JER.15.4	15	4	And I will cause them to be removed into all kingdoms of the earth, because of Manasseh the son of Hezekiah king of Judah, for {that} which he did in Jerusalem. {cause...: Heb. give them for a removing}	0.0	neutral	Eu farei deles uma causa de terror para todas as nações da terra, por tudo o que Manassés, filho de Ezequias, rei de Judá, fez em Jerusalém.
JER.15.5	15	5	For who shall have pity upon thee, O Jerusalem? or who shall bemoan thee? or who shall go aside to ask how thou doest? {how...: Heb. of thy peace?}	-0.1	neutral	"""Quem terá compaixão de você, ó Jerusalém? Quem se lamentará por você? Quem vai parar e perguntar como você está?"
JER.15.6	15	6	Thou hast forsaken me, saith the LORD, thou art gone backward: therefore will I stretch out my hand against thee, and destroy thee; I am weary with repenting.	-0.2	negative	"Você me rejeitou"", diz o Senhor; ""Você vive se desviando. Por isso, porei as mãos em você e a destruirei; cansei-me de mostrar compaixão."
JER.15.7	15	7	And I will fan them with a fan in the gates of the land; I will bereave {them} of children, I will destroy my people, {since} they return not from their ways. {children: or, whatsoever is dear}	-0.2	negative	Eu os espalhei ao vento como palha nas cidades desta terra. Deixei-os sem filhos; destruí o meu povo, pois não se converteram de seus caminhos.
JER.15.8	15	8	Their widows are increased to me above the sand of the seas: I have brought upon them against the mother of the young men a spoiler at noonday: I have caused {him} to fall upon it suddenly, and terrors upon the city. {the mother...: or, the mother city a young man spoiling, etc, or, the mother and the young men}	0.06	neutral	Fiz com que as suas viúvas se tornassem mais numerosas do que a areia do mar. Ao meio-dia, trouxe um destruidor contra as mães dos jovens guerreiros; fiz cair sobre elas repentina angústia e pavor.
JER.15.9	15	9	She that hath borne seven languisheth: she hath given up the ghost; her sun is gone down while {it was} yet day: she hath been ashamed and confounded: and the residue of them will I deliver to the sword before their enemies, saith the LORD.	-0.1556	negative	"A mãe de sete filhos desmaiou e está ofegante. Para ela o sol se pôs enquanto ainda era dia; ela foi envergonhada e humilhada. Entregarei os sobreviventes à espada diante dos seus inimigos"", declara o Senhor"
JER.15.10	15	10	Woe is me, my mother, that thou hast borne me a man of strife and a man of contention to the whole earth! I have neither lent on usury, nor men have lent to me on usury; {yet} every one of them doth curse me.	0.25	positive	Ai de mim, minha mãe, por me haver dado à luz! Pois sou um homem em luta e em contenda com a terra toda! Nunca emprestei nem tomei emprestado, e assim mesmo todos me amaldiçoam.
JER.15.11	15	11	The LORD said, Verily it shall be well with thy remnant; verily I will cause the enemy to entreat thee {well} in the time of evil and in the time of affliction. {cause...: or, intreat the enemy for thee}	-1.0	negative	"O Senhor disse: ""Eu certamente o fortaleci para o bem e intervim por você, na época da desgraça e da adversidade, por causa do inimigo."
JER.15.12	15	12	Shall iron break the northern iron and the steel?	0.0	neutral	"""Será alguém capaz de quebrar o ferro, o ferro que vem do norte, ou o bronze?"
JER.15.13	15	13	Thy substance and thy treasures will I give to the spoil without price, and {that} for all thy sins, even in all thy borders.	0.0	neutral	Diga a esse povo: Darei de graça a sua riqueza e os seus tesouros como despojo, por causa de todos os seus pecados, por toda a sua terra.
JER.15.14	15	14	And I will make {thee} to pass with thine enemies into a land {which} thou knowest not: for a fire is kindled in mine anger, {which} shall burn upon you.	-0.7	negative	"Eu os tornarei escravos de seus inimigos, numa terra que vocês não conhecem, pois a minha ira acenderá um fogo que arderá contra vocês""."
JER.15.15	15	15	O LORD, thou knowest: remember me, and visit me, and revenge me of my persecutors; take me not away in thy longsuffering: know that for thy sake I have suffered rebuke.	0.0	neutral	Tu me conheces, Senhor; lembra-te de mim e vem em meu auxílio e vinga-me dos meus perseguidores. Que, pela tua paciência para com eles, eu não seja eliminado. Sabes que sofro afronta por tua causa.
JER.15.16	15	16	Thy words were found, and I did eat them; and thy word was unto me the joy and rejoicing of mine heart: for I am called by thy name, O LORD God of hosts. {I am...: Heb. thy name is called upon me}	0.8	positive	Quando as tuas palavras foram encontradas eu as comi; elas são a minha alegria e o meu júbilo, pois pertenço a ti, Senhor Deus dos Exércitos.
JER.15.17	15	17	I sat not in the assembly of the mockers, nor rejoiced; I sat alone because of thy hand: for thou hast filled me with indignation.	0.4	positive	Jamais me sentei na companhia dos que se divertem, nunca festejei com eles. Sentei-me sozinho, porque a tua mão estava sobre mim e me encheste de indignação.
JER.15.18	15	18	Why is my pain perpetual, and my wound incurable, {which} refuseth to be healed? wilt thou be altogether unto me as a liar, {and as} waters {that} fail? {fail: Heb. be not sure?}	-0.4375	negative	Por que é permanente a minha dor, e a minha ferida é grave e incurável? Por que te tornaste para mim como um riacho seco, cujos mananciais falham?
JER.15.19	15	19	Therefore thus saith the LORD, If thou return, then will I bring thee again, {and} thou shalt stand before me: and if thou take forth the precious from the vile, thou shalt be as my mouth: let them return unto thee; but return not thou unto them.	0.5	positive	"Assim respondeu o Senhor: ""Se você se arrepender, eu o restaurarei para que possa me servir; se você disser palavras de valor, e não indignas, será o meu porta-voz. Deixe esse povo voltar-se para você, mas não se volte para eles."
JER.15.20	15	20	And I will make thee unto this people a fenced brasen wall: and they shall fight against thee, but they shall not prevail against thee: for I {am} with thee to save thee and to deliver thee, saith the LORD.	0.0	neutral	"Eu farei de você uma muralha de bronze fortificada diante deste povo; lutarão contra você, mas não o vencerão, pois estou com você para resgatá-lo e salvá-lo"", declara o Senhor."
JER.15.21	15	21	And I will deliver thee out of the hand of the wicked, and I will redeem thee out of the hand of the terrible.	-1.0	negative	"""Eu o livrarei das mãos dos ímpios e o resgatarei das garras dos violentos""."
JER.16.1	16	1	The word of the LORD came also unto me, saying,	0.0	neutral	Então o Senhor me dirigiu a palavra, dizendo:
JER.16.2	16	2	Thou shalt not take thee a wife, neither shalt thou have sons or daughters in this place.	0.0	neutral	"""Não se case nem tenha filhos ou filhas neste lugar"";"
JER.16.3	16	3	For thus saith the LORD concerning the sons and concerning the daughters that are born in this place, and concerning their mothers that bare them, and concerning their fathers that begat them in this land;	0.05	neutral	porque assim diz o Senhor a respeito dos filhos e filhas nascidos nesta terra, e a respeito das mulheres que forem suas mães e dos homens que forem seus pais:
JER.16.4	16	4	They shall die of grievous deaths; they shall not be lamented; neither shall they be buried; {but} they shall be as dung upon the face of the earth: and they shall be consumed by the sword, and by famine; and their carcases shall be meat for the fowls of heaven, and for the beasts of the earth.	-0.8	negative	"""Eles morrerão de doenças graves; ninguém pranteará por eles; não serão sepultados, mas servirão de esterco para o solo. Perecerão pela espada e pela fome, e os seus cadáveres serão o alimento das aves e dos animais""."
JER.16.5	16	5	For thus saith the LORD, Enter not into the house of mourning, neither go to lament nor bemoan them: for I have taken away my peace from this people, saith the LORD, {even} lovingkindness and mercies. {mourning: or, mourning feast}	0.0	neutral	"Porque assim diz o Senhor: ""Não entre numa casa onde há luto; não vá prantear nem mostrar condolências, porque retirei a minha paz, o meu amor leal e a minha compaixão desse povo"", declara o Senhor."
JER.16.6	16	6	Both the great and the small shall die in this land: they shall not be buried, neither shall {men} lament for them, nor cut themselves, nor make themselves bald for them:	0.275	positive	"""Tanto grandes como pequenos morrerão nesta terra; não serão sepultados nem se pranteará por eles; não se farão incisões nem se rapará a cabeça por causa deles."
JER.16.7	16	7	Neither shall {men} tear {themselves} for them in mourning, to comfort them for the dead; neither shall {men} give them the cup of consolation to drink for their father or for their mother. {tear...: or, break bread for them}	-0.2	negative	Ninguém oferecerá comida para fortalecer os que pranteiam pelos mortos; ninguém dará de beber do cálice da consolação nem mesmo pelo pai ou pela mãe.
JER.16.8	16	8	Thou shalt not also go into the house of feasting, to sit with them to eat and to drink.	0.0	neutral	"""Não entre numa casa em que há um banquete para se assentar com eles a fim de comer e beber."
JER.16.9	16	9	For thus saith the LORD of hosts, the God of Israel; Behold, I will cause to cease out of this place in your eyes, and in your days, the voice of mirth, and the voice of gladness, the voice of the bridegroom, and the voice of the bride.	0.0	neutral	Porque assim diz o Senhor dos Exércitos, o Deus de Israel: Farei cessar neste lugar, diante dos olhos de vocês e durante a vida de vocês, a voz de júbilo e a voz de alegria, a voz do noivo e a voz da noiva.
JER.16.10	16	10	And it shall come to pass, when thou shalt shew this people all these words, and they shall say unto thee, Wherefore hath the LORD pronounced all this great evil against us? or what {is} our iniquity? or what {is} our sin that we have committed against the LORD our God?	-0.1	neutral	"""Quando você falar todas essas coisas a este povo e eles lhe perguntarem: 'Por que o Senhor determinou uma desgraça tão terrível contra nós? Que delito ou pecado cometemos contra o Senhor, contra o nosso Deus? ',"
JER.16.11	16	11	Then shalt thou say unto them, Because your fathers have forsaken me, saith the LORD, and have walked after other gods, and have served them, and have worshipped them, and have forsaken me, and have not kept my law;	-0.125	negative	diga-lhes: 'Foi porque os seus antepassados me abandonaram', diz o Senhor, 'e seguiram outros deuses, aos quais prestaram culto e adoraram. Eles me abandonaram e não obedeceram à minha lei.
JER.16.12	16	12	And ye have done worse than your fathers; for, behold, ye walk every one after the imagination of his evil heart, that they may not hearken unto me: {imagination: or, stubbornness}	-0.7167	negative	Mas vocês têm feito coisas piores do que os seus antepassados: cada um segue a rebeldia do seu coração mau, em vez de obedecer-me.
JER.16.13	16	13	Therefore will I cast you out of this land into a land that ye know not, {neither} ye nor your fathers; and there shall ye serve other gods day and night; where I will not shew you favour.	-0.125	negative	Por isso os lançarei fora desta terra, para uma terra que vocês e os seus antepassados desconhecem; lá vocês servirão a outros deuses dia e noite, pois não terei misericórdia de vocês'.
JER.16.14	16	14	Therefore, behold, the days come, saith the LORD, that it shall no more be said, The LORD liveth, that brought up the children of Israel out of the land of Egypt;	-0.25	negative	"""Contudo, vêm dias"", declara o Senhor, ""quando já não mais se dirá: 'Juro pelo nome do Senhor, que trouxe os israelitas do Egito'."
JER.16.15	16	15	But, The LORD liveth, that brought up the children of Israel from the land of the north, and from all the lands whither he had driven them: and I will bring them again into their land that I gave unto their fathers.	0.0	neutral	Antes dirão: 'Juro pelo nome do Senhor, que trouxe os israelitas do norte e de todos os países para onde ele os havia expulsado'. Eu os conduzirei de volta para a sua terra, terra que dei aos seus antepassados.
JER.16.16	16	16	Behold, I will send for many fishers, saith the LORD, and they shall fish them; and after will I send for many hunters, and they shall hunt them from every mountain, and from every hill, and out of the holes of the rocks.	0.5	positive	"""Mas agora mandarei chamar muitos pescadores"", declara o Senhor, ""e eles os pescarão. Depois disso mandarei chamar muitos caçadores, e eles os caçarão em cada monte e colina e nas fendas das rochas."
JER.16.17	16	17	For mine eyes {are} upon all their ways: they are not hid from my face, neither is their iniquity hid from mine eyes.	0.0	neutral	Os meus olhos vêem todos os seus caminhos; eles não estão escondidos de mim, nem a sua iniqüidade está oculta aos meus olhos.
JER.16.18	16	18	And first I will recompense their iniquity and their sin double; because they have defiled my land, they have filled mine inheritance with the carcases of their detestable and abominable things.	0.2167	positive	"Eu lhes retribuirei em dobro pela sua impiedade e pelo seu pecado, porque contaminaram a minha terra com as carcaças de seus ídolos detestáveis e encheram a minha herança com as suas abominações. """
JER.16.19	16	19	O LORD, my strength, and my fortress, and my refuge in the day of affliction, the Gentiles shall come unto thee from the ends of the earth, and shall say, Surely our fathers have inherited lies, vanity, and {things} wherein {there is} no profit.	0.5	positive	"Senhor, minha força e minha fortaleza, meu abrigo seguro na hora da adversidade, a ti virão as nações desde os confins da terra e dirão: ""Nossos antepassados possuíam deuses falsos, ídolos inúteis, que não lhes fizeram bem algum."
JER.16.20	16	20	Shall a man make gods unto himself, and they {are} no gods?	0.0	neutral	"Pode o homem mortal fazer os seus próprios deuses? Sim, mas estes não seriam deuses! """
JER.16.21	16	21	Therefore, behold, I will this once cause them to know, I will cause them to know mine hand and my might; and they shall know that my name {is} The LORD. {The LORD: or, JEHOVAH}	0.0	neutral	"""Portanto eu lhes ensinarei; desta vez eu lhes ensinarei sobre o meu poder e sobre a minha força. Então saberão que o meu nome é Senhor."
JER.17.1	17	1	The sin of Judah {is} written with a pen of iron, {and} with the point of a diamond: {it is} graven upon the table of their heart, and upon the horns of your altars; {point: Heb. nail}	-0.75	negative	"""O pecado de Judá está escrito com estilete de ferro, gravado com ponta de diamante, nas tábuas dos seus corações e nas pontas dos seus altares."
JER.17.2	17	2	Whilst their children remember their altars and their groves by the green trees upon the high hills.	-0.02	neutral	Os filhos deles se lembram dos seus altares e dos postes de Aserá, ao lado das árvores verdejantes e sobre os montes altos
JER.17.3	17	3	O my mountain in the field, I will give thy substance {and} all thy treasures to the spoil, {and} thy high places for sin, throughout all thy borders.	0.16	positive	e sobre as montanhas do campo. As riquezas de vocês e todos os seus tesouros, eu os darei como despojo, como preço por todos os seus pecados nos altares idólatras, por toda a sua terra.
JER.17.4	17	4	And thou, even thyself, shalt discontinue from thine heritage that I gave thee; and I will cause thee to serve thine enemies in the land which thou knowest not: for ye have kindled a fire in mine anger, {which} shall burn for ever. {thyself: Heb. in thyself}	-0.7	negative	"Você mesmo perdeu a posse da herança que eu lhe tinha dado. Eu o farei escravo de seus inimigos numa terra que você não conhece, pois acendeu-se a minha ira, que arderá para sempre. """
JER.17.5	17	5	Thus saith the LORD; Cursed {be} the man that trusteth in man, and maketh flesh his arm, and whose heart departeth from the LORD.	0.0	neutral	"Assim diz o Senhor: ""Maldito é o homem que confia nos homens, que faz da humanidade mortal a sua força, mas cujo coração se afasta do Senhor."
JER.17.6	17	6	For he shall be like the heath in the desert, and shall not see when good cometh; but shall inhabit the parched places in the wilderness, {in} a salt land and not inhabited.	0.7	positive	Ele será como um arbusto no deserto; não verá quando vier algum bem. Habitará nos lugares áridos do deserto, numa terra salgada onde não vive ninguém.
JER.17.7	17	7	Blessed {is} the man that trusteth in the LORD, and whose hope the LORD is.	0.0	neutral	"""Mas bendito é o homem cuja confiança está no Senhor, cuja confiança nele está."
JER.17.8	17	8	For he shall be as a tree planted by the waters, and {that} spreadeth out her roots by the river, and shall not see when heat cometh, but her leaf shall be green; and shall not be careful in the year of drought, neither shall cease from yielding fruit. {drought: or, restraint}	-0.15	negative	"Ele será como uma árvore plantada junto às águas e que estende as suas raízes para o ribeiro. Ela não temerá quando chegar o calor, porque as suas folhas estão sempre verdes; não ficará ansiosa no ano da seca nem deixará de dar fruto""."
JER.17.9	17	9	The heart {is} deceitful above all {things}, and desperately wicked: who can know it?	-0.3	negative	O coração é mais enganoso que qualquer outra coisa e sua doença é incurável. Quem é capaz de compreendê-lo?
JER.17.10	17	10	I the LORD search the heart, {I} try the reins, even to give every man according to his ways, {and} according to the fruit of his doings.	0.0	neutral	"""Eu sou o Senhor que sonda o coração e examina a mente, para recompensar a cada um de acordo com a sua conduta, de acordo com as suas obras. """
JER.17.11	17	11	{As} the partridge sitteth {on eggs}, and hatcheth {them} not; {so} he that getteth riches, and not by right, shall leave them in the midst of his days, and at his end shall be a fool. {sitteth...: or, gathereth young which she hath not brought forth}	0.1929	positive	O homem que obtém riquezas por meios injustos é como a perdiz que choca ovos que não pôs. Quando a metade da sua vida tiver passado, elas o abandonarão, e, no final, ele se revelará um tolo.
JER.17.12	17	12	A glorious high throne from the beginning {is} the place of our sanctuary.	0.16	positive	Um trono glorioso, exaltado desde o início, é o lugar de nosso santuário.
JER.17.13	17	13	O LORD, the hope of Israel, all that forsake thee shall be ashamed, {and} they that depart from me shall be written in the earth, because they have forsaken the LORD, the fountain of living waters.	0.0	neutral	Ó Senhor, esperança de Israel, todos os que te abandonarem Sofrerão vergonha; aqueles que se desviarem de ti terão os seus nomes escritos no pó, pois abandonaram o Senhor, a fonte de água viva.
JER.17.14	17	14	Heal me, O LORD, and I shall be healed; save me, and I shall be saved: for thou {art} my praise.	0.0	neutral	Cura-me, Senhor, e serei curado; salva-me, e serei salvo, pois tu és aquele a quem eu louvo.
JER.17.15	17	15	Behold, they say unto me, Where {is} the word of the LORD? let it come now.	0.0	neutral	"Há os que vivem me dizendo: ""Onde está a palavra do Senhor? Que ela se cumpra! """
JER.17.16	17	16	As for me, I have not hastened from {being} a pastor to follow thee: neither have I desired the woeful day; thou knowest: that which came out of my lips was {right} before thee. {to...: Heb. after thee}	0.2857	positive	Mas não insisti eu contigo para que afastasses a desgraça? Tu sabes que não desejei o dia do desespero. Sabes o que saiu de meus lábios, pois está diante de ti.
JER.17.17	17	17	Be not a terror unto me: thou {art} my hope in the day of evil.	-1.0	negative	Não sejas motivo de pavor para mim; tu és o meu refúgio no dia da desgraça.
JER.17.18	17	18	Let them be confounded that persecute me, but let not me be confounded: let them be dismayed, but let not me be dismayed: bring upon them the day of evil, and destroy them with double destruction. {destroy...: Heb. break them with a double breach}	-0.28	negative	Que os meus perseguidores sejam humilhados, mas não eu; que eles sejam aterrorizados, mas não eu. Traze sobre eles o dia da desgraça; destrói-os com destruição dobrada.
JER.17.19	17	19	Thus said the LORD unto me; Go and stand in the gate of the children of the people, whereby the kings of Judah come in, and by the which they go out, and in all the gates of Jerusalem;	0.0	neutral	"Assim me disse o Senhor: ""Vá colocar-se à porta do Povo, por onde entram e saem os reis de Judá; faça o mesmo junto a todas as portas de Jerusalém."
JER.17.20	17	20	And say unto them, Hear ye the word of the LORD, ye kings of Judah, and all Judah, and all the inhabitants of Jerusalem, that enter in by these gates:	0.0	neutral	Diga-lhes: 'Ouçam a palavra do Senhor, reis de Judá, todo o Judá e todos os habitantes de Jerusalém, vocês que passam por essas portas.
JER.17.21	17	21	Thus saith the LORD; Take heed to yourselves, and bear no burden on the sabbath day, nor bring {it} in by the gates of Jerusalem;	0.0	neutral	Assim diz o Senhor: Por amor à vida de vocês, tenham o cuidado de não levar cargas nem de fazê-las passar pelas portas de Jerusalém no dia de sábado.
JER.17.22	17	22	Neither carry forth a burden out of your houses on the sabbath day, neither do ye any work, but hallow ye the sabbath day, as I commanded your fathers.	0.0	neutral	Não levem carga alguma para fora de casa nem façam nenhum trabalho no sábado, mas guardem o dia de sábado como dia consagrado, como ordenei aos seus antepassados.
JER.17.23	17	23	But they obeyed not, neither inclined their ear, but made their neck stiff, that they might not hear, nor receive instruction.	-0.2143	negative	Contudo, eles não me ouviram nem me deram atenção; foram obstinados e não quiseram ouvir nem aceitar a disciplina.
JER.17.24	17	24	And it shall come to pass, if ye diligently hearken unto me, saith the LORD, to bring in no burden through the gates of this city on the sabbath day, but hallow the sabbath day, to do no work therein;	0.0	neutral	Mas se vocês tiverem o cuidado de obedecer-me, diz o Senhor, e não fizerem passar carga alguma pelas portas desta cidade no sábado, mas guardarem o dia de sábado como dia consagrado, deixando de realizar nele todo e qualquer trabalho,
JER.17.25	17	25	Then shall there enter into the gates of this city kings and princes sitting upon the throne of David, riding in chariots and on horses, they, and their princes, the men of Judah, and the inhabitants of Jerusalem: and this city shall remain for ever.	0.0	neutral	então os reis que se assentarem no trono de Davi entrarão pelas portas desta cidade em companhia de seus conselheiros. Eles e os seus conselheiros virão em carruagens e cavalos, acompanhados dos homens de Judá e dos habitantes de Jerusalém; e esta cidade será habitada para sempre.
JER.17.26	17	26	And they shall come from the cities of Judah, and from the places about Jerusalem, and from the land of Benjamin, and from the plain, and from the mountains, and from the south, bringing burnt offerings, and sacrifices, and meat offerings, and incense, and bringing sacrifices of praise, unto the house of the LORD.	-0.2143	negative	Virá gente das cidades de Judá e dos povoados ao redor de Jerusalém, do território de Benjamim e da Sefelá, das montanhas e do Neguebe, trazendo holocaustos e sacrifícios, ofertas de cereal, incenso e ofertas de ação de graças ao templo do Senhor.
JER.17.27	17	27	But if ye will not hearken unto me to hallow the sabbath day, and not to bear a burden, even entering in at the gates of Jerusalem on the sabbath day; then will I kindle a fire in the gates thereof, and it shall devour the palaces of Jerusalem, and it shall not be quenched.	0.0	neutral	"Mas, se vocês não me obedecerem e deixarem de guardar o sábado como dia consagrado, fazendo passar cargas pelas portas de Jerusalém no dia de sábado, porei fogo nas suas portas, que consumirá os seus palácios' ""."
JER.18.1	18	1	The word which came to Jeremiah from the LORD, saying,	0.0	neutral	Esta é a palavra que veio a Jeremias da parte do Senhor:
JER.18.2	18	2	Arise, and go down to the potter's house, and there I will cause thee to hear my words.	-0.1556	negative	"""Vá à casa do oleiro, e ali você ouvirá a minha mensagem""."
JER.18.3	18	3	Then I went down to the potter's house, and, behold, he wrought a work on the wheels. {wheels: or, frames, or, seats}	-0.1556	negative	Então fui à casa do oleiro, e o vi trabalhando com a roda.
JER.18.4	18	4	And the vessel that he made of clay was marred in the hand of the potter: so he made it again another vessel, as seemed good to the potter to make {it}. {of clay...: or, was marred, as clay in the hand of the potter} {made it...: Heb. returned and made, etc}	0.7	positive	Mas o vaso de barro que ele estava formando se estragou-se em suas mãos; e ele o refez, moldando outro vaso de acordo com a sua vontade.
JER.18.5	18	5	Then the word of the LORD came to me, saying,	0.0	neutral	Então o Senhor dirigiu-me a palavra:
JER.18.6	18	6	O house of Israel, cannot I do with you as this potter? saith the LORD. Behold, as the clay {is} in the potter's hand, so {are} ye in mine hand, O house of Israel.	0.0	neutral	"""Ó comunidade de Israel, será que não posso eu agir com vocês como fez o oleiro? "", pergunta o Senhor. ""Como barro nas mãos do oleiro, assim são vocês nas minhas mãos, ó comunidade de Israel."
