verse_id	chapter	verse	text_en	polarity_en	label_en	text_pt
JER.38.22	38	22	And, behold, all the women that are left in the king of Judah's house {shall be} brought forth to the king of Babylon's princes, and those {women} shall say, Thy friends have set thee on, and have prevailed against thee: thy feet are sunk in the mire, {and} they are turned away back. {Thy friends: Heb. Men of thy peace}	0.0	neutral	"Todas as mulheres deixadas no palácio real de Judá serão levadas aos oficiais do rei da Babilônia. E elas lhe dirão: 'Aqueles teus amigos de confiança te enganaram e prevaleceram sobre ti. Teus pés estão atolados na lama; teus amigos te abandonaram'. """
JER.38.23	38	23	So they shall bring out all thy wives and thy children to the Chaldeans: and thou shalt not escape out of their hand, but shalt be taken by the hand of the king of Babylon: and thou shalt cause this city to be burned with fire. {thou shalt cause...: Heb. thou shalt burn, etc}	0.0	neutral	"""Todas as tuas mulheres e os teus filhos serão levados aos babilônios. Tu mesmo não escaparás das mãos deles, mas serás capturado pelo rei da Babilônia; e esta cidade será incendiada. """
JER.38.24	38	24	Then said Zedekiah unto Jeremiah, Let no man know of these words, and thou shalt not die.	0.0	neutral	"Então Zedequias disse a Jeremias: ""Se alguém souber dessa conversa, você morrerá."
JER.38.25	38	25	But if the princes hear that I have talked with thee, and they come unto thee, and say unto thee, Declare unto us now what thou hast said unto the king, hide it not from us, and we will not put thee to death; also what the king said unto thee:	0.0	neutral	Se os líderes ouvirem que eu conversei com você e vierem dizer-lhe: 'Conte-nos o que você disse ao rei e o que o rei disse a você; não esconda nada de nós, se não nós o mataremos',
JER.38.26	38	26	Then thou shalt say unto them, I presented my supplication before the king, that he would not cause me to return to Jonathan's house, to die there.	0.0	neutral	"diga: 'Fui suplicar ao rei que não me mandasse de volta à casa de Jônatas, para ali morrer' ""."
JER.38.27	38	27	Then came all the princes unto Jeremiah, and asked him: and he told them according to all these words that the king had commanded. So they left off speaking with him; for the matter was not perceived. {they...: Heb. they were silent from him}	0.0	neutral	Quando os líderes vieram interrogar Jeremias, ele lhes disse tudo o que o rei tinha ordenado que dissesse. E eles não lhe perguntaram mais nada, pois ninguém tinha ouvido a conversa com o rei.
JER.38.28	38	28	So Jeremiah abode in the court of the prison until the day that Jerusalem was taken: and he was {there} when Jerusalem was taken.	0.0	neutral	E Jeremias permaneceu no pátio da guarda até o dia em que Jerusalém foi conquistada.
JER.39.1	39	1	In the ninth year of Zedekiah king of Judah, in the tenth month, came Nebuchadrezzar king of Babylon and all his army against Jerusalem, and they besieged it.	0.0	neutral	Foi assim que Jerusalém foi tomada: No nono ano do reinado de Zedequias, rei de Judá, no décimo mês, Nabucodonosor, rei da Babilônia, marchou contra Jerusalém com todo seu exército e a sitiou.
JER.39.2	39	2	{And} in the eleventh year of Zedekiah, in the fourth month, the ninth {day} of the month, the city was broken up.	-0.2	negative	E no dia novo do quarto mês do décimo primeiro ano do reinado de Zedequias, o muro da cidade foi rompido.
JER.39.3	39	3	And all the princes of the king of Babylon came in, and sat in the middle gate, {even} Nergalsharezer, Samgarnebo, Sarsechim, Rabsaris, Nergalsharezer, Rabmag, with all the residue of the princes of the king of Babylon.	0.0	neutral	Então todos os oficiais do rei da Babilônia vieram e se assentaram junto à porta do Meio: Nergal-Sarezer de Sangar, Nebo-Sarsequim, um dos chefes dos oficiais, Nergal-Sarezer, um alto oficial, e todos os outros oficiais do rei da Babilônia.
JER.39.4	39	4	And it came to pass, {that} when Zedekiah the king of Judah saw them, and all the men of war, then they fled, and went forth out of the city by night, by the way of the king's garden, by the gate betwixt the two walls: and he went out the way of the plain.	-0.2143	negative	Quando Zedequias, rei de Judá, e todos os soldados os viram, fugiram e saíram da cidade, à noite, na direção do jardim real, pela porta entre os dois muros; e foram para a Arabá.
JER.39.5	39	5	But the Chaldeans' army pursued after them, and overtook Zedekiah in the plains of Jericho: and when they had taken him, they brought him up to Nebuchadnezzar king of Babylon to Riblah in the land of Hamath, where he gave judgment upon him. {gave...: Heb. spake with him judgments}	0.0	neutral	Mas o exército babilônio os perseguiu e alcançou Zedequias na planície de Jericó. Eles o capturaram e o levaram a Nabucodonosor, rei da Babilônia, em Ribla, na terra de Hamate, que o sentenciou.
JER.39.6	39	6	Then the king of Babylon slew the sons of Zedekiah in Riblah before his eyes: also the king of Babylon slew all the nobles of Judah.	0.0	neutral	Em Ribla, o rei da Babilônia mandou executar os filhos de Zedequias diante dos seus olhos, e também matou todos os nobres de Judá.
JER.39.7	39	7	Moreover he put out Zedekiah's eyes, and bound him with chains, to carry him to Babylon. {with...: Heb. with two brasen chains, or, fetters}	0.0	neutral	Mandou furar os olhos de Zedequias e prendê-lo com correntes de bronze para levá-lo para a Babilônia.
JER.39.8	39	8	And the Chaldeans burned the king's house, and the houses of the people, with fire, and brake down the walls of Jerusalem.	-0.1556	negative	Os babilônios incendiaram o palácio real e as casas do povo, e derrubaram os muros de Jerusalém.
JER.39.9	39	9	Then Nebuzaradan the captain of the guard carried away captive into Babylon the remnant of the people that remained in the city, and those that fell away, that fell to him, with the rest of the people that remained. {captain...: or, chief marshal: Heb. chief of the executioners, or, slaughtermen}	0.2	positive	Nebuzaradã, o comandante da guarda imperial, deportou para a Babilônia o povo que restou na cidade, juntamente com aqueles que tinham se rendido a ele, e o restante dos artesãos.
JER.39.10	39	10	But Nebuzaradan the captain of the guard left of the poor of the people, which had nothing, in the land of Judah, and gave them vineyards and fields at the same time. {captain...: or, chief marshal: Heb. chief of the executioners, or, slaughtermen} {at the...: Heb. in that day}	-0.1333	negative	Somente alguns dos mais pobres do povo, que nada tinham, Nebuzaradã, o comandante da guarda imperial, deixou para trás em Judá. E, naquela ocasião, ele lhes deu vinhas e campos.
JER.39.11	39	11	Now Nebuchadrezzar king of Babylon gave charge concerning Jeremiah to Nebuzaradan the captain of the guard, saying, {to: Heb. by the hand of} {captain...: or, chief marshal: Heb. chief of the executioners, or, slaughtermen}	0.0	neutral	Mas Nabucodonosor, rei da Babilônia, deu ordens a respeito de Jeremias a Nebuzaradã, o comandante da guarda imperial:
JER.39.12	39	12	Take him, and look well to him, and do him no harm; but do unto him even as he shall say unto thee. {look...: Heb. set thine eyes upon him}	0.0	neutral	"""Vá buscá-lo e cuide bem dele; não o maltrate, mas faça o que ele pedir""."
JER.39.13	39	13	So Nebuzaradan the captain of the guard sent, and Nebushasban, Rabsaris, and Nergalsharezer, Rabmag, and all the king of Babylon's princes; {captain...: or, chief marshal: Heb. chief of the executioners, or, slaughtermen}	0.0	neutral	Então Nebuzaradã, o comandante da guarda imperial, Nebusazbã, um dos chefes dos oficiais, Nergal-Sarezer, um alto oficial, e todos os outros oficiais do rei da Babilônia
JER.39.14	39	14	Even they sent, and took Jeremiah out of the court of the prison, and committed him unto Gedaliah the son of Ahikam the son of Shaphan, that he should carry him home: so he dwelt among the people.	0.0	neutral	mandaram tirar Jeremias do pátio da guarda e o entregaram a Gedalias, filho de Aicam, filho de Safã, para que o levasse à residência do governador. Assim, Jeremias permaneceu no meio do seu povo.
JER.39.15	39	15	Now the word of the LORD came unto Jeremiah, while he was shut up in the court of the prison, saying,	0.0	neutral	Enquanto Jeremias esteve preso no pátio da guarda, o Senhor lhe dirigiu a palavra:
JER.39.16	39	16	Go and speak to Ebedmelech the Ethiopian, saying, Thus saith the LORD of hosts, the God of Israel; Behold, I will bring my words upon this city for evil, and not for good; and they shall be {accomplished} in that day before thee.	-0.0333	neutral	"""Vá dizer a Ebede-Meleque, o etíope: 'Assim diz o Senhor dos Exércitos, Deus de Israel: Estou para cumprir as minhas advertências contra esta cidade, com desgraça e não com prosperidade. Naquele dia, elas se cumprirão diante dos seus olhos."
JER.39.17	39	17	But I will deliver thee in that day, saith the LORD: and thou shalt not be given into the hand of the men of whom thou {art} afraid.	-0.6	negative	Mas eu o resgatarei naquele dia', declara o Senhor; 'você não será entregue nas mãos daqueles a quem teme.
JER.39.18	39	18	For I will surely deliver thee, and thou shalt not fall by the sword, but thy life shall be for a prey unto thee: because thou hast put thy trust in me, saith the LORD.	0.5	positive	"Eu certamente o resgatarei; você não morrerá pela espada, mas escapará com vida, porque você confia em mim' "", declara o Senhor."
JER.40.1	40	1	The word that came to Jeremiah from the LORD, after that Nebuzaradan the captain of the guard had let him go from Ramah, when he had taken him being bound in chains among all that were carried away captive of Jerusalem and Judah, which were carried away captive unto Babylon. {chains: or, manicles}	0.2	positive	O Senhor dirigiu a palavra a Jeremias depois que o comandante da guarda imperial, Nebuzaradã, o libertou em Ramá. Ele tinha encontrado Jeremias acorrentado entre todos os cativos de Jerusalém e de Judá que estavam sendo levados para o exílio na Babilônia.
JER.40.2	40	2	And the captain of the guard took Jeremiah, and said unto him, The LORD thy God hath pronounced this evil upon this place.	-1.0	negative	"Quando o comandante da guarda encontrou Jeremias, disse-lhe: ""Foi o Senhor, o seu Deus, que determinou esta desgraça para este lugar."
JER.40.3	40	3	Now the LORD hath brought {it}, and done according as he hath said: because ye have sinned against the LORD, and have not obeyed his voice, therefore this thing is come upon you.	0.0	neutral	Agora o Senhor a cumpriu e fez o que tinha prometido. Tudo isso aconteceu porque vocês pecaram contra o Senhor e não lhe obedeceram.
JER.40.4	40	4	And now, behold, I loose thee this day from the chains which {were} upon thine hand. If it seem good unto thee to come with me into Babylon, come; and I will look well unto thee: but if it seem ill unto thee to come with me into Babylon, forbear: behold, all the land {is} before thee: whither it seemeth good and convenient for thee to go, thither go. {were...: or, are upon thine hand} {I will...: Heb. I will set mine eye upon thee}	0.2058	positive	"Mas hoje eu o liberto das correntes que prendem as suas mãos. Se você quiser, venha comigo para a Babilônia e eu cuidarei de você; se, porém, não quiser, pode ficar. Veja! Toda esta terra está diante de você; vá para onde melhor lhe parecer""."
JER.40.5	40	5	Now while he was not yet gone back, {he said}, Go back also to Gedaliah the son of Ahikam the son of Shaphan, whom the king of Babylon hath made governor over the cities of Judah, and dwell with him among the people: or go wheresoever it seemeth convenient unto thee to go. So the captain of the guard gave him victuals and a reward, and let him go.	0.0	neutral	"Contudo, antes de Jeremias se virar para partir, Nebuzaradã acrescentou: ""Volte a Gedalias, filho de Aicam, neto de Safã, a quem o rei da Babilônia nomeou governador sobre as cidades de Judá, e viva com ele entre o povo, ou vá para qualquer outro lugar que desejar"". Então o comandante lhe deu provisões e um presente, e o deixou partir."
JER.40.6	40	6	Then went Jeremiah unto Gedaliah the son of Ahikam to Mizpah; and dwelt with him among the people that were left in the land.	0.0	neutral	Jeremias foi a Gedalias, filho de Aicam, em Mispá, e permaneceu com ele entre o povo que foi deixado na terra de Judá.
JER.40.7	40	7	Now when all the captains of the forces which {were} in the fields, {even} they and their men, heard that the king of Babylon had made Gedaliah the son of Ahikam governor in the land, and had committed unto him men, and women, and children, and of the poor of the land, of them that were not carried away captive to Babylon;	-0.1	neutral	Havia comandantes do exército, que ainda estavam em campo aberto com os seus soldados. Eles ouviram que o rei da Babilônia tinha nomeado Gedalias, filho de Aicam, governador de Judá e o havia encarregado dos homens, das mulheres, das crianças e dos mais pobres da terra, que não tinham sido deportados para a Babilônia.
JER.40.8	40	8	Then they came to Gedaliah to Mizpah, even Ishmael the son of Nethaniah, and Johanan and Jonathan the sons of Kareah, and Seraiah the son of Tanhumeth, and the sons of Ephai the Netophathite, and Jezaniah the son of a Maachathite, they and their men.	0.0	neutral	Então foram até Gedalias, em Mispá: Ismael, filho de Netanias, Joanã e Jônatas, filhos de Careá, Seraías, filho de Tanumete, os filhos de Efai, de Netofate, e Jazanias, filho do maacatita, juntamente com os seus soldados.
JER.40.9	40	9	And Gedaliah the son of Ahikam the son of Shaphan sware unto them and to their men, saying, Fear not to serve the Chaldeans: dwell in the land, and serve the king of Babylon, and it shall be well with you.	0.0	neutral	"Gedalias, filho de Aicam, neto de Safã, fez um juramento a eles e aos seus soldados: ""Não temam sujeitar-se aos babilônios. Estabeleçam-se na terra, sujeitem-se ao rei da Babilônia, e tudo lhes irá bem."
JER.40.10	40	10	As for me, behold, I will dwell at Mizpah to serve the Chaldeans, which will come unto us: but ye, gather ye wine, and summer fruits, and oil, and put {them} in your vessels, and dwell in your cities that ye have taken. {to serve: Heb. to stand before}	0.0	neutral	"Eu mesmo permanecerei em Mispá para representá-los diante dos babilônios que vierem a nós. Mas, vocês, façam a colheita das uvas para o vinho, das frutas e das olivas para o azeite, ponham o produto em jarros, e vivam nas cidades que vocês ocuparam""."
JER.40.11	40	11	Likewise when all the Jews that {were} in Moab, and among the Ammonites, and in Edom, and that {were} in all the countries, heard that the king of Babylon had left a remnant of Judah, and that he had set over them Gedaliah the son of Ahikam the son of Shaphan;	0.0	neutral	Quando todos os judeus que estavam em Moabe, em Amom, em Edom e em todas as outras terras ouviram que o rei da Babilônia tinha deixado um remanescente em Judá, e que havia nomeado Gedalias, filho de Aicam, neto de Safã, governador sobre eles,
JER.40.12	40	12	Even all the Jews returned out of all places whither they were driven, and came to the land of Judah, to Gedaliah, unto Mizpah, and gathered wine and summer fruits very much.	0.26	positive	voltaram, de todos os lugares para onde tinham sido espalhados, e vieram para a terra de Judá, e foram até Gedalias em Mispá. E fizeram uma grande colheita de uvas para o vinho, e também de frutas de verão.
JER.40.13	40	13	Moreover Johanan the son of Kareah, and all the captains of the forces that {were} in the fields, came to Gedaliah to Mizpah,	0.0	neutral	Joanã, filho de Careá, e todos os comandantes do exército que ainda estavam em campo aberto, foram até Gedalias em Mispá
JER.40.14	40	14	And said unto him, Dost thou certainly know that Baalis the king of the Ammonites hath sent Ishmael the son of Nethaniah to slay thee? But Gedaliah the son of Ahikam believed them not. {to slay...: Heb. to strike thee in soul?}	0.2143	positive	"e lhe disseram: ""Você não sabe que Baalis, rei dos amonitas, enviou Ismael, filho de Netanias, para matá-lo? "" Mas Gedalias, filho de Aicam, não acreditou neles."
JER.40.15	40	15	Then Johanan the son of Kareah spake to Gedaliah in Mizpah secretly, saying, Let me go, I pray thee, and I will slay Ishmael the son of Nethaniah, and no man shall know {it}: wherefore should he slay thee, that all the Jews which are gathered unto thee should be scattered, and the remnant in Judah perish?	-0.4	negative	"Então Joanã, filho de Careá, disse em particular a Gedalias, em Mispá: ""Irei agora e matarei Ismael, filho de Netanias, e ninguém ficará sabendo disso. Por que deveria ele fazer com que os judeus que se reuniram a você sejam espalhados e o remanescente de Judá seja destruído? """
JER.40.16	40	16	But Gedaliah the son of Ahikam said unto Johanan the son of Kareah, Thou shalt not do this thing: for thou speakest falsely of Ishmael.	-0.4	negative	"Mas Gedalias, filho de Aicam, disse a Joanã, filho de Careá: ""Não faça uma coisa dessas. O que você está dizendo sobre Ismael não é verdade""."
JER.41.1	41	1	Now it came to pass in the seventh month, {that} Ishmael the son of Nethaniah the son of Elishama, of the seed royal, and the princes of the king, even ten men with him, came unto Gedaliah the son of Ahikam to Mizpah; and there they did eat bread together in Mizpah.	0.0	neutral	No sétimo mês, Ismael, filho de Netanias, filho de Elisama, que era de sangue real e tinha sido um dos oficiais do rei, foi até Gedalias, filho de Aicam, em Mispá, levando consigo dez homens. Enquanto comiam juntos,
JER.41.2	41	2	Then arose Ishmael the son of Nethaniah, and the ten men that were with him, and smote Gedaliah the son of Ahikam the son of Shaphan with the sword, and slew him, whom the king of Babylon had made governor over the land.	0.0	neutral	Ismael, filho de Netanias, e os dez homens que estavam com ele se levantaram e feriram à espada Gedalias, filho de Aicam, neto de Safã, matando aquele que o rei da Babilônia tinha nomeado governador de Judá.
JER.41.3	41	3	Ishmael also slew all the Jews that were with him, {even} with Gedaliah, at Mizpah, and the Chaldeans that were found there, {and} the men of war.	0.0	neutral	Ismael também matou todos os judeus que estavam com Gedalias em Mispá, bem como os soldados babilônios que ali estavam.
JER.41.4	41	4	And it came to pass the second day after he had slain Gedaliah, and no man knew {it},	0.0	neutral	No dia seguinte ao assassinato de Gedalias, antes que alguém o soubesse,
JER.41.5	41	5	That there came certain from Shechem, from Shiloh, and from Samaria, {even} fourscore men, having their beards shaven, and their clothes rent, and having cut themselves, with offerings and incense in their hand, to bring {them} to the house of the LORD.	0.2143	positive	oitenta homens que haviam rapado a barba, rasgado suas roupas e feito cortes no corpo, vieram de Siquém, de Siló e de Samaria, trazendo ofertas de cereal e incenso para oferecer no templo do Senhor.
JER.41.6	41	6	And Ishmael the son of Nethaniah went forth from Mizpah to meet them, weeping all along as he went: and it came to pass, as he met them, he said unto them, Come to Gedaliah the son of Ahikam. {weeping...: Heb. in going and weeping}	0.0	neutral	"Ismael, filho de Netanias, saiu de Mispá para encontrá-los, chorando enquanto caminhava. Quando os encontrou, disse: ""Venham até onde se encontra Gedalias, filho de Aicam""."
JER.41.7	41	7	And it was {so}, when they came into the midst of the city, that Ishmael the son of Nethaniah slew them, {and cast them} into the midst of the pit, he, and the men that {were} with him.	0.0	neutral	Quando entraram na cidade, Ismael, filho de Netanias, e os homens que estavam com ele os mataram e os atiraram numa cisterna.
JER.41.8	41	8	But ten men were found among them that said unto Ishmael, Slay us not: for we have treasures in the field, of wheat, and of barley, and of oil, and of honey. So he forbare, and slew them not among their brethren.	0.0	neutral	"Mas dez deles disseram a Ismael: ""Não nos mate! Temos trigo e cevada, azeite e mel, escondidos num campo"". Então ele os deixou em paz e não os matou com os demais."
JER.41.9	41	9	Now the pit wherein Ishmael had cast all the dead bodies of the men, whom he had slain because of Gedaliah, {was} it which Asa the king had made for fear of Baasha king of Israel: {and} Ishmael the son of Nethaniah filled it with {them that were} slain. {because...: or, near Gedaliah: Heb. by the hand, or, by the side of Gedaliah}	-0.1125	negative	A cisterna na qual ele jogou os corpos dos homens que havia matado, juntamente com o de Gedalias, tinha sido cavada pelo rei Asa para defender-se de Baasa, rei de Israel. Ismael, filho de Netanias, encheu-a com os mortos.
JER.41.10	41	10	Then Ishmael carried away captive all the residue of the people that {were} in Mizpah, {even} the king's daughters, and all the people that remained in Mizpah, whom Nebuzaradan the captain of the guard had committed to Gedaliah the son of Ahikam: and Ishmael the son of Nethaniah carried them away captive, and departed to go over to the Ammonites.	0.2	positive	Ismael tomou como prisioneiros todo o restante do povo que estava em Mispá, inclusive as filhas do rei, sobre os quais Nebuzaradã, o comandante da guarda imperial, havia nomeado Gedalias, filho de Aicam, governador. Ismael, filho de Netanias, levou-os como prisioneiros e partiu para o território de Amom.
JER.41.11	41	11	But when Johanan the son of Kareah, and all the captains of the forces that {were} with him, heard of all the evil that Ishmael the son of Nethaniah had done,	-1.0	negative	Quando Joanã, filho de Careá, e todos os comandantes do exército, que com ele estavam, souberam do crime que Ismael, filho de Netanias, tinha cometido,
JER.41.12	41	12	Then they took all the men, and went to fight with Ishmael the son of Nethaniah, and found him by the great waters that {are} in Gibeon.	0.8	positive	convocaram todos os seus soldados para lutar contra ele. Eles o alcançaram perto do grande açude de Gibeom.
JER.41.13	41	13	Now it came to pass, {that} when all the people which {were} with Ishmael saw Johanan the son of Kareah, and all the captains of the forces that {were} with him, then they were glad.	0.5	positive	Quando todo o povo, que Ismael tinha levado como prisioneiro, viu Joanã, filho de Careá, e os comandantes do exército que estavam com ele, alegrou-se.
JER.41.14	41	14	So all the people that Ishmael had carried away captive from Mizpah cast about and returned, and went unto Johanan the son of Kareah.	0.2	positive	Todo o povo que Ismael tinha levado como prisioneiro de Mispá se voltou e passou para o lado de Joanã, filho de Careá.
JER.41.15	41	15	But Ishmael the son of Nethaniah escaped from Johanan with eight men, and went to the Ammonites.	0.0	neutral	Mas Ismael, filho de Netanias, e oito de seus homens escaparam de Joanã e fugiram para o território de Amom
JER.41.16	41	16	Then took Johanan the son of Kareah, and all the captains of the forces that {were} with him, all the remnant of the people whom he had recovered from Ishmael the son of Nethaniah, from Mizpah, after {that} he had slain Gedaliah the son of Ahikam, {even} mighty men of war, and the women, and the children, and the eunuchs, whom he had brought again from Gibeon:	0.4	positive	Então, Joanã, filho de Careá, e todos os comandantes do exército que com ele estavam levaram todos os que tinham restado em Mispá, os quais ele tinha resgatado de Ismael, filho de Netanias, depois que este havia assassinado Gedalias, filho de Aicam: os soldados, as mulheres, as crianças e os oficiais do palácio real, que ele tinha trazido de Gibeom.
JER.41.17	41	17	And they departed, and dwelt in the habitation of Chimham, which is by Bethlehem, to go to enter into Egypt,	0.0	neutral	E eles prosseguiram, parando em Gerute-Quimã, perto de Belém, a caminho do Egito,
JER.41.18	41	18	Because of the Chaldeans: for they were afraid of them, because Ishmael the son of Nethaniah had slain Gedaliah the son of Ahikam, whom the king of Babylon made governor in the land.	-0.6	negative	Queriam escapar dos babilônios. Estavam com medo porque Ismael, filho de Netanias, tinha matado Gedalias, filho de Aicam, a quem o rei da Babilônia nomeara governador de Judá.
JER.42.1	42	1	Then all the captains of the forces, and Johanan the son of Kareah, and Jezaniah the son of Hoshaiah, and all the people from the least even unto the greatest, came near,	0.2667	positive	Então todos os líderes do exército, inclusive Joanã, filho de Careá, e Jezanias, filho de Hosaías, e todo o povo, desde o menor até o maior, aproximaram-se
JER.42.2	42	2	And said unto Jeremiah the prophet, Let, we beseech thee, our supplication be accepted before thee, and pray for us unto the LORD thy God, {even} for all this remnant; (for we are left {but} a few of many, as thine eyes do behold us:) {Let...: or, Let our supplication fall before thee}	0.2	positive	"do profeta Jeremias e lhe disseram: ""Por favor, ouça a nossa petição e ore ao Senhor, ao seu Deus, por nós e em favor de todo este remanescente; pois, como você vê, embora fôssemos muitos, agora só restam poucos de nós."
JER.42.3	42	3	That the LORD thy God may shew us the way wherein we may walk, and the thing that we may do.	0.0	neutral	"Ore rogando ao Senhor, ao seu Deus, que nos diga para onde devemos ir e o que devemos fazer""."
