verse_id	chapter	verse	text_en	polarity_en	label_en	text_pt
JER.45.3	45	3	Thou didst say, Woe is me now! for the LORD hath added grief to my sorrow; I fainted in my sighing, and I find no rest.	-0.8	negative	Você disse, 'Ai de mim! O Senhor acrescentou tristeza ao meu sofrimento. Estou exausto de tanto gemer, e não encontro descanso'.
JER.45.4	45	4	Thus shalt thou say unto him, The LORD saith thus; Behold, {that} which I have built will I break down, and that which I have planted I will pluck up, even this whole land.	0.0222	neutral	Mas o Senhor manda-me dizer-lhe: 'Assim diz o Senhor: Destruirei o que edifiquei e arrancarei o que plantei em toda esta terra.
JER.45.5	45	5	And seekest thou great things for thyself? seek {them} not: for, behold, I will bring evil upon all flesh, saith the LORD: but thy life will I give unto thee for a prey in all places whither thou goest.	-0.1	neutral	"E então? Você deveria buscar coisas especiais para você? Não as busque; pois trarei desgraça sobre toda a humanidade', diz o Senhor, 'mas eu o deixarei escapar com vida onde quer que você vá' ""."
JER.46.1	46	1	The word of the LORD which came to Jeremiah the prophet against the Gentiles;	0.0	neutral	Esta é a mensagem do Senhor que veio ao profeta Jeremias acerca das nações:
JER.46.2	46	2	Against Egypt, against the army of Pharaohnecho king of Egypt, which was by the river Euphrates in Carchemish, which Nebuchadrezzar king of Babylon smote in the fourth year of Jehoiakim the son of Josiah king of Judah.	0.0	neutral	Acerca do Egito: Esta é a mensagem contra o exército do rei do Egito, o faraó Neco, que foi derrotado em Carquemis, junto ao rio Eufrates, por Nabucodonosor, rei da Babilônia, no quarto ano do reinado de Jeoaquim, filho de Josias, rei de Judá:
JER.46.3	46	3	Order ye the buckler and shield, and draw near to battle.	0.1	neutral	"""Preparem seus escudos, os grandes e os pequenos, e marchem para a batalha!"
JER.46.4	46	4	Harness the horses; and get up, ye horsemen, and stand forth with {your} helmets; furbish the spears, {and} put on the brigandines.	0.0	neutral	Selem os cavalos e montem! Tomem posição e coloquem o capacete! Passem óleo na ponta de suas lanças e vistam a armadura!
JER.46.5	46	5	Wherefore have I seen them dismayed {and} turned away back? and their mighty ones are beaten down, and are fled apace, and look not back: {for} fear {was} round about, saith the LORD. {beaten...: Heb. broken in pieces} {fled...: Heb. fled a flight}	-0.1579	negative	"Mas o que vejo? Eles estão apavorados, estão se retirando, seus guerreiros estão derrotados. Fogem às pressas, sem olhar para trás; há terror por todos os lados"", declara o Senhor."
JER.46.6	46	6	Let not the swift flee away, nor the mighty man escape; they shall stumble, and fall toward the north by the river Euphrates.	0.175	positive	"""O ágil não consegue fugir, nem o forte escapar. No norte, junto ao rio Eufrates, eles tropeçam e caem."
JER.46.7	46	7	Who {is} this {that} cometh up as a flood, whose waters are moved as the rivers?	0.0	neutral	"""Quem é aquele que se levanta como o Nilo, como rios de águas agitadas?"
JER.46.8	46	8	Egypt riseth up like a flood, and {his} waters are moved like the rivers; and he saith, I will go up, {and} will cover the earth; I will destroy the city and the inhabitants thereof.	-0.2	negative	O Egito se levanta como o Nilo, como rios de águas agitadas. Ele diz: 'Eu me levantarei e cobrirei a terra; destruirei as cidades e os seus habitantes'.
JER.46.9	46	9	Come up, ye horses; and rage, ye chariots; and let the mighty men come forth; the Ethiopians and the Libyans, that handle the shield; and the Lydians, that handle {and} bend the bow. {the Ethiopians: Heb. Cush} {the Libyans: Heb. Put}	0.4	positive	Ao ataque, cavalos! Avancem, carros de guerra! Marchem em frente, guerreiros! Homens da Etiópia e da Líbia, que levam escudos; homens da Lídia, que empunham o arco!
JER.46.10	46	10	For this {is} the day of the Lord GOD of hosts, a day of vengeance, that he may avenge him of his adversaries: and the sword shall devour, and it shall be satiate and made drunk with their blood: for the Lord GOD of hosts hath a sacrifice in the north country by the river Euphrates.	-0.5	negative	Mas aquele dia pertence ao Soberano, ao Senhor dos Exércitos. Será um dia de vingança, para vingar-se dos seus adversários. A espada devorará até saciar-se, até satisfazer sua sede de sangue. Porque o Soberano, o Senhor dos Exércitos, fará um banquete na terra do norte, junto ao rio Eufrates.
JER.46.11	46	11	Go up into Gilead, and take balm, O virgin, the daughter of Egypt: in vain shalt thou use many medicines; {for} thou shalt not be cured. {thou shalt...: Heb. no cure shall be unto thee}	0.5	positive	"""Suba a Gileade em busca de bálsamo, ó virgem, filha do Egito! Você multiplica remédios em vão; não há cura para você."
JER.46.12	46	12	The nations have heard of thy shame, and thy cry hath filled the land: for the mighty man hath stumbled against the mighty, {and} they are fallen both together.	0.4	positive	"As nações ouviram da tua humilhação; os seus gritos encheram a terra, quando um guerreiro tropeçou noutro guerreiro e ambos caíram. """
JER.46.13	46	13	The word that the LORD spake to Jeremiah the prophet, how Nebuchadrezzar king of Babylon should come {and} smite the land of Egypt.	0.0	neutral	Esta é a mensagem que o Senhor falou ao profeta Jeremias acerca da vinda de Nabucodonosor, rei da Babilônia para atacar o Egito:
JER.46.14	46	14	Declare ye in Egypt, and publish in Migdol, and publish in Noph and in Tahpanhes: say ye, Stand fast, and prepare thee; for the sword shall devour round about thee.	0.0	neutral	"""Anunciem isto no Egito e proclamem-no em Migdol; proclamem-no também em Mênfis e em Tafnes: 'Assumam posição! Preparem-se! Porque a espada devora aqueles que estão ao seu redor'."
JER.46.15	46	15	Why are thy valiant {men} swept away? they stood not, because the LORD did drive them.	0.0	neutral	Por que o deus Ápis fugiu? O seu touro não resistiu, porque o Senhor o derrubou.
JER.46.16	46	16	He made many to fall, yea, one fell upon another: and they said, Arise, and let us go again to our own people, and to the land of our nativity, from the oppressing sword. {made...: Heb. multiplied the faller}	0.55	positive	Tropeçam e caem, caem uns sobre os outros. Eles dizem: 'Levantem-se. Vamos voltar para nosso próprio povo e para nossa terra natal, para longe da espada do opressor.
JER.46.17	46	17	They did cry there, Pharaoh king of Egypt {is but} a noise; he hath passed the time appointed.	0.0	neutral	O faraó, rei do Egito, é barulho e nada mais! Ele perdeu a sua oportunidade'.
JER.46.18	46	18	{As} I live, saith the King, whose name {is} the LORD of hosts, Surely as Tabor {is} among the mountains, and as Carmel by the sea, {so} shall he come.	0.3182	positive	"""Juro pela minha vida"", declara o Rei, cujo nome é o Senhor dos Exércitos, ""ele virá como o Tabor entre os montes, como o Carmelo junto ao mar."
JER.46.19	46	19	O thou daughter dwelling in Egypt, furnish thyself to go into captivity: for Noph shall be waste and desolate without an inhabitant. {furnish...: Heb. make thee instruments of captivity}	-0.2	negative	Arrumem a bagagem para o exílio, vocês que vivem no Egito, pois Mênfis será arrasada, ficará desolada e desabitada.
JER.46.20	46	20	Egypt {is like} a very fair heifer, {but} destruction cometh; it cometh out of the north.	0.91	positive	"""O Egito é uma linda novilha, mas do norte a ataca uma mutuca."
JER.46.21	46	21	Also her hired men {are} in the midst of her like fatted bullocks; for they also are turned back, {and} are fled away together: they did not stand, because the day of their calamity was come upon them, {and} the time of their visitation. {fatted...: Heb. bullocks of the stall}	0.0	neutral	Os mercenários em suas fileiras são como bezerros gordos. Eles também darão meia volta e juntos fugirão; não defenderão suas posições, pois o dia da derrota deles está chegando, a hora de serem castigados.
JER.46.22	46	22	The voice thereof shall go like a serpent; for they shall march with an army, and come against her with axes, as hewers of wood.	0.0	neutral	O Egito silvará como uma serpente em fuga à medida que o inimigo avança com grande força. Virão sobre ele com machados, como os homens que derrubam árvores.
JER.46.23	46	23	They shall cut down her forest, saith the LORD, though it cannot be searched; because they are more than the grasshoppers, and {are} innumerable.	0.1722	positive	"Eles derrubarão sua floresta"", declara o Senhor, ""por mais densa que seja. São mais que os gafanhotos; são incontáveis!"
JER.46.24	46	24	The daughter of Egypt shall be confounded; she shall be delivered into the hand of the people of the north.	0.0	neutral	"A cidade do Egito será envergonhada, será entregue nas mãos do povo do norte""."
JER.46.25	46	25	The LORD of hosts, the God of Israel, saith; Behold, I will punish the multitude of No, and Pharaoh, and Egypt, with their gods, and their kings; even Pharaoh, and {all} them that trust in him: {multitude: or, nourisher: Heb. Amon}	-0.75	negative	"O Senhor dos Exércitos, o Deus de Israel, diz: ""Castigarei Amom, deus de Tebas, o faraó, o Egito, seus deuses e seus reis, e também os que confiam no faraó."
JER.46.26	46	26	And I will deliver them into the hand of those that seek their lives, and into the hand of Nebuchadrezzar king of Babylon, and into the hand of his servants: and afterward it shall be inhabited, as in the days of old, saith the LORD.	0.1	neutral	"Eu os entregarei nas mãos daqueles que desejam tirar-lhes a vida; nas mãos de Nabucodonosor, rei da Babilônia, e de seus oficiais. Mais tarde, porém, o Egito será habitado como em épocas passadas"", declara o Senhor."
JER.46.27	46	27	But fear not thou, O my servant Jacob, and be not dismayed, O Israel: for, behold, I will save thee from afar off, and thy seed from the land of their captivity; and Jacob shall return, and be in rest and at ease, and none shall make {him} afraid.	-0.6	negative	"""Quanto a você, não tema, meu servo Jacó! Não fique assustado, ó Israel! Eu o salvarei de um lugar distante, e os seus descendentes da terra do seu exílio. Jacó voltará e ficará em paz e em segurança; ninguém o inquietará."
JER.46.28	46	28	Fear thou not, O Jacob my servant, saith the LORD: for I {am} with thee; for I will make a full end of all the nations whither I have driven thee: but I will not make a full end of thee, but correct thee in measure; yet will I not leave thee wholly unpunished. {not leave...: or, not utterly cut thee off}	0.2333	positive	"Não tema, meu servo Jacó! Eu estou com você"", declara o Senhor. ""Destruirei completamente todas as nações entre as quais eu o dispersei; mas a você, não destruirei completamente. Eu o disciplinarei, como você merece; não serei severo demais. """
JER.47.1	47	1	The word of the LORD that came to Jeremiah the prophet against the Philistines, before that Pharaoh smote Gaza. {Gaza: Heb. Azzah}	0.0	neutral	Esta é a palavra do Senhor que veio ao profeta Jeremias acerca dos filisteus, antes do ataque do faraó a Gaza:
JER.47.2	47	2	Thus saith the LORD; Behold, waters rise up out of the north, and shall be an overflowing flood, and shall overflow the land, and all that is therein; the city, and them that dwell therein: then the men shall cry, and all the inhabitants of the land shall howl. {all that...: Heb. the fulness thereof}	0.0	neutral	"Assim diz o Senhor: ""Vejam como as águas estão subindo do norte; elas se tornam uma torrente transbordante. Inundarão esta terra e tudo o que nela existe; as cidades e os seus habitantes. O povo clamará, gritarão todos os habitantes desta terra,"
JER.47.3	47	3	At the noise of the stamping of the hoofs of his strong {horses}, at the rushing of his chariots, {and at} the rumbling of his wheels, the fathers shall not look back to {their} children for feebleness of hands;	0.2167	positive	ao estrondo dos cascos dos seus cavalos galopando, ao barulho dos seus carros de guerra, e ao estampido de suas rodas. Os pais não se voltarão para ajudar seus filhos; pois suas mãos estão fracas.
JER.47.4	47	4	Because of the day that cometh to spoil all the Philistines, {and} to cut off from Tyrus and Zidon every helper that remaineth: for the LORD will spoil the Philistines, the remnant of the country of Caphtor. {the country: Heb. the isle}	0.0	neutral	Pois chegou o dia de destruir todos os filisteus e de eliminar todos os sobreviventes que poderiam ajudar Tiro e Sidom. O Senhor destruirá os filisteus, o remanescente da ilha de Caftor.
JER.47.5	47	5	Baldness is come upon Gaza; Ashkelon is cut off {with} the remnant of their valley: how long wilt thou cut thyself?	-0.05	neutral	"Os habitantes de Gaza rasparam a cabeça; Ascalom está calada. Ó remanescentes da planície, até quando você fará incisões no próprio corpo? """
JER.47.6	47	6	O thou sword of the LORD, how long {will it be} ere thou be quiet? put up thyself into thy scabbard, rest, and be still. {put...: Heb. gather thyself}	-0.025	neutral	""" 'Ah, espada do Senhor, quando você descansará? Volte à sua bainha, acalme-se e repouse. '"
JER.47.7	47	7	How can it be quiet, seeing the LORD hath given it a charge against Ashkelon, and against the sea shore? there hath he appointed it. {How...: Heb. How canst thou}	0.0	neutral	"Mas como poderá ela descansar quando o Senhor lhe deu ordens, quando ele lhe ordenou que ataque Ascalom e o litoral? """
JER.48.1	48	1	Against Moab thus saith the LORD of hosts, the God of Israel; Woe unto Nebo! for it is spoiled: Kiriathaim is confounded {and} taken: Misgab is confounded and dismayed. {Misgab: or, the high place}	0.16	positive	"Acerca de Moabe assim diz o Senhor dos Exércitos, Deus de Israel: ""Ai de Nebo, pois ficou em ruínas. Quiriataim foi derrotada e capturada; a fortaleza foi derrotada e destroçada."
JER.48.2	48	2	{There shall be} no more praise of Moab: in Heshbon they have devised evil against it; come, and let us cut it off from {being} a nation. Also thou shalt be cut down, O Madmen; the sword shall pursue thee. {be cut...: or, be brought to silence} {pursue...: Heb. go after thee}	-0.4685	negative	Moabe não é mais louvada; em Hesbom tramam a sua ruína: 'Venham! Vamos dar fim àquela nação'. Você também ficará calada, ó Madmém; a espada a perseguirá.
JER.48.3	48	3	A voice of crying {shall be} from Horonaim, spoiling and great destruction.	0.3	positive	Ouçam os gritos de Horonaim: 'Devastação! Grande destruição!
JER.48.4	48	4	Moab is destroyed; her little ones have caused a cry to be heard.	-0.1875	negative	Moabe está destruída! ' É o grito que se ouve até em Zoar.
JER.48.5	48	5	For in the going up of Luhith continual weeping shall go up; for in the going down of Horonaim the enemies have heard a cry of destruction. {continual...: Heb. weeping with weeping}	-0.1556	negative	Eles sobem pelo caminho para Luíte, chorando amargamente enquanto seguem; na estrada que desce a Horonaim ouvem-se gritos angustiados por causa da destruição.
JER.48.6	48	6	Flee, save your lives, and be like the heath in the wilderness. {the heath: or, a naked tree}	0.0	neutral	Fujam! Corram para salvar suas vidas; tornem-se como um arbusto no deserto.
JER.48.7	48	7	For because thou hast trusted in thy works and in thy treasures, thou shalt also be taken: and Chemosh shall go forth into captivity {with} his priests and his princes together.	0.0	neutral	Uma vez que vocês confiam em seus feitos e em suas riquezas, vocês também serão capturados, e Camos irá para o exílio, junto com seus sacerdotes e líderes.
JER.48.8	48	8	And the spoiler shall come upon every city, and no city shall escape: the valley also shall perish, and the plain shall be destroyed, as the LORD hath spoken.	-0.2143	negative	O destruidor virá contra todas as cidades, e nenhuma escapará. O vale se tornará ruínas, e o planalto será destruído, como o Senhor falou.
JER.48.9	48	9	Give wings unto Moab, that it may flee and get away: for the cities thereof shall be desolate, without any to dwell therein.	0.0	neutral	Ponham sal sobre Moabe, pois ela será deixada em ruínas; suas cidades ficarão devastadas, sem nenhum habitante.
JER.48.10	48	10	Cursed {be} he that doeth the work of the LORD deceitfully, and cursed {be} he that keepeth back his sword from blood. {deceitfully: or, negligently}	0.0	neutral	"""Maldito o que faz com negligência o trabalho do Senhor! Maldito aquele que impede a sua espada de derramar sangue!"
JER.48.11	48	11	Moab hath been at ease from his youth, and he hath settled on his lees, and hath not been emptied from vessel to vessel, neither hath he gone into captivity: therefore his taste remained in him, and his scent is not changed. {remained: Heb. stood}	0.0	neutral	"""Moabe tem estado tranqüila desde a sua juventude, como o vinho deixado com os seus resíduos; não foi mudada de vasilha em vasilha. Nunca foi para o exílio; por isso, o seu sabor permanece o mesmo e o seu cheiro não mudou."
JER.48.12	48	12	Therefore, behold, the days come, saith the LORD, that I will send unto him wanderers, that shall cause him to wander, and shall empty his vessels, and break their bottles.	-0.1	neutral	"Portanto, certamente vêm os dias"", declara o Senhor, ""quando enviarei decantadores que o decantarão; esvaziarão as suas jarras e as despedaçarão."
JER.48.13	48	13	And Moab shall be ashamed of Chemosh, as the house of Israel was ashamed of Bethel their confidence.	0.0	neutral	Então Moabe se decepcionará com Camos, assim como Israel se decepcionou com Betel, em quem confiava.
JER.48.14	48	14	How say ye, We {are} mighty and strong men for the war?	0.4167	positive	"""Como vocês podem dizer: 'Somos guerreiros, somos homens de guerra'?"
JER.48.15	48	15	Moab is spoiled, and gone up {out of} her cities, and his chosen young men are gone down to the slaughter, saith the King, whose name {is} the LORD of hosts. {his...: Heb. the choice of}	-0.0278	neutral	"Moabe foi destruída e suas cidades serão invadidas; o melhor dos seus jovens desceu para a matança"", declara o Rei, cujo nome é o Senhor dos Exércitos."
JER.48.16	48	16	The calamity of Moab {is} near to come, and his affliction hasteth fast.	0.15	positive	"""A derrota de Moabe está próxima; a sua desgraça vem rapidamente."
JER.48.17	48	17	All ye that are about him, bemoan him; and all ye that know his name, say, How is the strong staff broken, {and} the beautiful rod!	0.3444	positive	Lamentem por ela, todos os seus vizinhos, todos os que conhecem a sua fama. Digam: 'Como está quebrado o cajado poderoso, o cetro glorioso! '
JER.48.18	48	18	Thou daughter that dost inhabit Dibon, come down from {thy} glory, and sit in thirst; for the spoiler of Moab shall come upon thee, {and} he shall destroy thy strong holds.	0.0259	neutral	"""Desçam de sua glória e sentem-se sobre o chão ressequido, ó moradores da cidade de Dibom, pois o destruidor de Moabe veio para atacá-los e destruir as suas fortalezas."
JER.48.19	48	19	O inhabitant of Aroer, stand by the way, and espy; ask him that fleeth, and her that escapeth, {and} say, What is done? {inhabitant: Heb. inhabitress}	0.0	neutral	Fiquem junto à estrada e vigiem, vocês que vivem em Aroer. Perguntem ao homem que foge e à mulher que escapa, perguntem a eles: 'O que aconteceu? '
JER.48.20	48	20	Moab is confounded; for it is broken down: howl and cry; tell ye it in Arnon, that Moab is spoiled,	-0.2778	negative	Moabe ficou envergonhada, pois está destroçada. Gritem e clamem! Anunciem junto ao Arnom que Moabe foi destruída.
JER.48.21	48	21	And judgment is come upon the plain country; upon Holon, and upon Jahazah, and upon Mephaath,	-0.2143	negative	O julgamento chegou ao planalto: a Holom, Jaza e Mefaate,
JER.48.22	48	22	And upon Dibon, and upon Nebo, and upon Bethdiblathaim,	0.0	neutral	a Dibom, Nebo e Bete-Diblataim,
JER.48.23	48	23	And upon Kiriathaim, and upon Bethgamul, and upon Bethmeon,	0.0	neutral	a Quiriataim, Bete-Gamul e Bete-Meom,
JER.48.24	48	24	And upon Kerioth, and upon Bozrah, and upon all the cities of the land of Moab, far or near.	0.1	neutral	a Queriote e Bozra, a todas as cidades de Moabe, distantes e próximas.
JER.48.25	48	25	The horn of Moab is cut off, and his arm is broken, saith the LORD.	-0.4	negative	"O poder de Moabe foi eliminado; seu braço está quebrado"", declara o Senhor."
JER.48.26	48	26	Make ye him drunken: for he magnified {himself} against the LORD: Moab also shall wallow in his vomit, and he also shall be in derision.	0.0	neutral	"""Embriaguem-na, pois ela desafiou o Senhor. Moabe se revolverá no seu vômito e será objeto de ridículo."
JER.48.27	48	27	For was not Israel a derision unto thee? was he found among thieves? for since thou spakest of him, thou skippedst for joy. {skippedst...: or, movedst thyself}	0.8	positive	Não foi Israel objeto de ridículo para você? Foi ele encontrado em companhia de ladrões para que você sacuda a cabeça sempre que fala dele?
JER.48.28	48	28	O ye that dwell in Moab, leave the cities, and dwell in the rock, and be like the dove {that} maketh her nest in the sides of the hole's mouth.	0.0	neutral	Abandonem as cidades! Habitem entre as rochas, vocês que moram em Moabe! Sejam como uma pomba que faz o seu ninho nas bordas de um precipício.
JER.48.29	48	29	We have heard the pride of Moab, (he is exceeding proud) his loftiness, and his arrogancy, and his pride, and the haughtiness of his heart.	0.8	positive	"""Temos ouvido do orgulho de Moabe: da sua extrema arrogância, do seu orgulho e soberba, e do seu espírito de superioridade."
JER.48.30	48	30	I know his wrath, saith the LORD; but {it shall} not {be} so; his lies shall not so effect {it}. {his lies...: or, those on whom he stayeth (Heb. his bars) do not right}	-0.1429	negative	"Conheço bem a sua arrogância"", declara o Senhor. ""A sua tagarelice sem fundamento e as suas ações que nada alcançam."
JER.48.31	48	31	Therefore will I howl for Moab, and I will cry out for all Moab; {mine heart} shall mourn for the men of Kirheres.	0.0	neutral	Por isso, lamentarei por Moabe, gritarei por causa de toda a terra de Moabe, prantearei pelos habitantes de Quir-Heres.
JER.48.32	48	32	O vine of Sibmah, I will weep for thee with the weeping of Jazer: thy plants are gone over the sea, they reach {even} to the sea of Jazer: the spoiler is fallen upon thy summer fruits and upon thy vintage.	0.0	neutral	Chorarei por vocês mais do que choro por Jazar, ó videiras de Sibma. Os seus ramos se estendiam até o mar, e chegavam até Jazar. O destruidor caiu sobre as suas frutas e sobre as suas uvas.
JER.48.33	48	33	And joy and gladness is taken from the plentiful field, and from the land of Moab; and I have caused wine to fail from the winepresses: none shall tread with shouting; {their} shouting {shall be} no shouting.	0.15	positive	A alegria e a satisfação se foram das terras férteis de Moabe. Interrompi a produção de vinho nos lagares. Ninguém mais pisa as uvas com gritos de alegria; embora haja gritos, não são de alegria.
JER.48.34	48	34	From the cry of Heshbon {even} unto Elealeh, {and even} unto Jahaz, have they uttered their voice, from Zoar {even} unto Horonaim, {as} an heifer of three years old: for the waters also of Nimrim shall be desolate. {desolate: Heb. desolations}	0.1	neutral	"""O grito de Hesbom é ouvido em Eleale e Jaaz, desde Zoar até Horonaim e Eglate-Selisia, pois até as águas do Ninrim secaram."
JER.48.35	48	35	Moreover I will cause to cease in Moab, saith the LORD, him that offereth in the high places, and him that burneth incense to his gods.	0.16	positive	"Em Moabe darei fim àqueles que fazem ofertas nos altares idólatras e queimam incenso a seus deuses"", declara o Senhor."
JER.48.36	48	36	Therefore mine heart shall sound for Moab like pipes, and mine heart shall sound like pipes for the men of Kirheres: because the riches {that} he hath gotten are perished.	0.4	positive	"""Por isso o meu coração lamenta-se por Moabe, como uma flauta; lamenta-se como uma flauta pelos habitantes de Quir-Heres. A riqueza que acumularam se foi."
JER.48.37	48	37	For every head {shall be} bald, and every beard clipped: upon all the hands {shall be} cuttings, and upon the loins sackcloth. {clipped: Heb. diminished}	0.0	neutral	Toda cabeça foi rapada e toda barba foi cortada; toda mão sofreu incisões e toda cintura foi coberta com veste de lamento.
JER.48.38	48	38	{There shall be} lamentation generally upon all the housetops of Moab, and in the streets thereof: for I have broken Moab like a vessel wherein {is} no pleasure, saith the LORD.	-0.175	negative	"Em todos os terraços de Moabe e nas praças não há nada senão pranto, pois despedacei Moabe como a um jarro que ninguém deseja"", declara o Senhor."
JER.48.39	48	39	They shall howl, {saying}, How is it broken down! how hath Moab turned the back with shame! so shall Moab be a derision and a dismaying to all them about him. {back: Heb. neck}	-0.1486	negative	"""Como ela foi destruída! Como lamentam! Como Moabe dá as costas, envergonhada! Moabe tornou-se objeto de ridículo e de pavor para todos os seus vizinhos. """
JER.48.40	48	40	For thus saith the LORD; Behold, he shall fly as an eagle, and shall spread his wings over Moab.	0.8	positive	"Assim diz o Senhor: ""Vejam! Uma águia planando estende as asas sobre Moabe."
JER.48.41	48	41	Kerioth is taken, and the strong holds are surprised, and the mighty men's hearts in Moab at that day shall be as the heart of a woman in her pangs. {Kerioth: or, The cities}	0.3111	positive	Queriote será capturada, e as fortalezas serão tomadas. Naquele dia, a coragem dos guerreiros de Moabe será como a de uma mulher em trabalho de parto.
