verse_id	chapter	verse	text_en	polarity_en	label_en	text_pt
JER.42.4	42	4	Then Jeremiah the prophet said unto them, I have heard {you}; behold, I will pray unto the LORD your God according to your words; and it shall come to pass, {that} whatsoever thing the LORD shall answer you, I will declare {it} unto you; I will keep nothing back from you.	0.0	neutral	"""Eu os atenderei"", respondeu o profeta Jeremias. ""Orarei ao Senhor, ao seu Deus, conforme vocês pediram. E tudo o que o Senhor responder eu lhes direi; nada esconderei de vocês. """
JER.42.5	42	5	Then they said to Jeremiah, The LORD be a true and faithful witness between us, if we do not even according to all things for the which the LORD thy God shall send thee to us.	0.35	positive	"Então disseram a Jeremias: ""Que o Senhor seja uma testemunha verdadeira e fiel contra nós, caso não façamos tudo o que o Senhor, o seu Deus, nos ordenar por você."
JER.42.6	42	6	Whether {it be} good, or whether {it be} evil, we will obey the voice of the LORD our God, to whom we send thee; that it may be well with us, when we obey the voice of the LORD our God.	-0.15	negative	"Quer seja favorável ou não, obedeceremos ao Senhor, ao nosso Deus, a quem o enviamos, para que tudo vá bem conosco, pois obedeceremos ao Senhor, ao nosso Deus""."
JER.42.7	42	7	And it came to pass after ten days, that the word of the LORD came unto Jeremiah.	0.0	neutral	Dez dias depois o Senhor dirigiu a palavra a Jeremias,
JER.42.8	42	8	Then called he Johanan the son of Kareah, and all the captains of the forces which {were} with him, and all the people from the least even to the greatest,	0.35	positive	e ele convocou Joanã, filho de Careá, e todos os comandantes do exército que estavam com ele e todo o povo, desde o menor até o maior.
JER.42.9	42	9	And said unto them, Thus saith the LORD, the God of Israel, unto whom ye sent me to present your supplication before him;	0.0	neutral	"Disse-lhes então: ""Assim diz o Senhor, o Deus de Israel, a quem vocês me enviaram para apresentar a petição de vocês:"
JER.42.10	42	10	If ye will still abide in this land, then will I build you, and not pull {you} down, and I will plant you, and not pluck {you} up: for I repent me of the evil that I have done unto you.	-0.5778	negative	'Se vocês permanecerem nesta terra, eu os edificarei e não os destruirei; eu os plantarei e não os arrancarei, pois muito me pesa a desgraça que eu trouxe sobre vocês.
JER.42.11	42	11	Be not afraid of the king of Babylon, of whom ye are afraid; be not afraid of him, saith the LORD: for I {am} with you to save you, and to deliver you from his hand.	0.0	neutral	Não tenham medo do rei da Babilônia, a quem vocês agora temem. Não tenham medo dele, declara o Senhor, pois estou com vocês e os salvarei e os livrarei das mãos dele.
JER.42.12	42	12	And I will shew mercies unto you, that he may have mercy upon you, and cause you to return to your own land.	0.6	positive	Eu terei compaixão de vocês; e ele também terá compaixão de vocês e lhes permitirá retornar à terra de vocês'.
JER.42.13	42	13	But if ye say, We will not dwell in this land, neither obey the voice of the LORD your God,	0.0	neutral	"""Contudo, se vocês disserem 'Não permaneceremos nesta terra', e assim desobedecerem ao Senhor, ao seu Deus,"
JER.42.14	42	14	Saying, No; but we will go into the land of Egypt, where we shall see no war, nor hear the sound of the trumpet, nor have hunger of bread; and there will we dwell:	0.4	positive	e se disserem: 'Não, nós iremos para o Egito, onde não veremos a guerra nem ouviremos o som da trombeta, nem passaremos fome',
JER.42.15	42	15	And now therefore hear the word of the LORD, ye remnant of Judah; Thus saith the LORD of hosts, the God of Israel; If ye wholly set your faces to enter into Egypt, and go to sojourn there;	0.0	neutral	ouçam a palavra do Senhor, ó remanescente de Judá. Assim diz o Senhor dos Exércitos, Deus de Israel: 'Se vocês estão decididos a ir para o Egito e lá forem residir,
JER.42.16	42	16	Then it shall come to pass, {that} the sword, which ye feared, shall overtake you there in the land of Egypt, and the famine, whereof ye were afraid, shall follow close after you there in Egypt; and there ye shall die. {shall follow...: Heb. shall cleave after you}	-0.6	negative	a guerra que vocês temem os alcançará, e a fome que receiam os seguirá até o Egito, e lá vocês morrerão.
JER.42.17	42	17	So shall it be with all the men that set their faces to go into Egypt to sojourn there; they shall die by the sword, by the famine, and by the pestilence: and none of them shall remain or escape from the evil that I will bring upon them. {So...: Heb. So shall all the men be}	-1.0	negative	Todos os que estão decididos a partir e residir no Egito morrerão pela guerra, pela fome e pela peste; nem um só deles sobreviverá ou escapará da desgraça que trarei sobre eles'.
JER.42.18	42	18	For thus saith the LORD of hosts, the God of Israel; As mine anger and my fury hath been poured forth upon the inhabitants of Jerusalem; so shall my fury be poured forth upon you, when ye shall enter into Egypt: and ye shall be an execration, and an astonishment, and a curse, and a reproach; and ye shall see this place no more.	-0.475	negative	Assim diz o Senhor dos Exércitos, Deus de Israel: 'Como o meu furor foi derramado sobre os habitantes de Jerusalém, também a minha ira será derramada sobre vocês, quando forem para o Egito. Vocês serão objeto de maldição e de pavor, de desprezo e de afronta. Vocês jamais tornarão a ver este lugar'.
JER.42.19	42	19	The LORD hath said concerning you, O ye remnant of Judah; Go ye not into Egypt: know certainly that I have admonished you this day. {admonished...: Heb. testified against you}	0.2143	positive	"""Ó remanescente de Judá, o Senhor lhes disse: 'Não vão para o Egito'. Estejam certos disto: Eu hoje os advirto"
JER.42.20	42	20	For ye dissembled in your hearts, when ye sent me unto the LORD your God, saying, Pray for us unto the LORD our God; and according unto all that the LORD our God shall say, so declare unto us, and we will do {it}. {ye dissembled...: or, ye have used deceit against your souls}	0.0	neutral	que vocês cometeram um erro fatal quando me enviaram ao Senhor, ao seu Deus, pedindo: 'Ore ao Senhor, ao nosso Deus, em nosso favor. Diga-nos tudo o que ele lhe falar, e nós o faremos'.
JER.42.21	42	21	And {now} I have this day declared {it} to you; but ye have not obeyed the voice of the LORD your God, nor any {thing} for the which he hath sent me unto you.	0.0	neutral	Eu lhes disse, hoje mesmo, o que o Senhor, o seu Deus, me mandou dizer a vocês, mas vocês não lhe estão obedecendo.
JER.42.22	42	22	Now therefore know certainly that ye shall die by the sword, by the famine, and by the pestilence, in the place whither ye desire to go {and} to sojourn. {to go...: or, to go to sojourn}	0.2143	positive	"Agora, porém, estejam certos de que vocês morrerão pela guerra, pela fome e pela peste, no lugar que vocês desejam residir""."
JER.43.1	43	1	And it came to pass, {that} when Jeremiah had made an end of speaking unto all the people all the words of the LORD their God, for which the LORD their God had sent him to them, {even} all these words,	0.0	neutral	Quando Jeremias acabou de dizer ao povo tudo o que o Senhor, o seu Deus, lhe mandara dizer,
JER.43.2	43	2	Then spake Azariah the son of Hoshaiah, and Johanan the son of Kareah, and all the proud men, saying unto Jeremiah, Thou speakest falsely: the LORD our God hath not sent thee to say, Go not into Egypt to sojourn there:	0.2	positive	"Azarias, filho de Hosaías, e Joanã, filho de Careá, e todos os homens arrogantes disseram a Jeremias: ""Você está mentindo! O Senhor não lhe mandou dizer que não fôssemos residir no Egito."
JER.43.3	43	3	But Baruch the son of Neriah setteth thee on against us, for to deliver us into the hand of the Chaldeans, that they might put us to death, and carry us away captives into Babylon.	0.0	neutral	"Mas é Baruque, filho de Nerias, que o está instigando contra nós para que sejamos entregues nas mãos dos babilônios, a fim de que nos matem ou nos levem para o exílio na Babilônia""."
JER.43.4	43	4	So Johanan the son of Kareah, and all the captains of the forces, and all the people, obeyed not the voice of the LORD, to dwell in the land of Judah.	0.0	neutral	Assim Joanã, filho de Careá, e todos os comandantes do exército e todo o povo desobedeceram à ordem do Senhor de que permanecessem na terra de Judá.
JER.43.5	43	5	But Johanan the son of Kareah, and all the captains of the forces, took all the remnant of Judah, that were returned from all nations, whither they had been driven, to dwell in the land of Judah;	0.0	neutral	Mas Joanã, filho de Careá, e todos os comandantes do exército, levaram todo o remanescente de Judá que tinha voltado de todas as nações para onde haviam sido espalhados a fim de viver na terra de Judá:
JER.43.6	43	6	{Even} men, and women, and children, and the king's daughters, and every person that Nebuzaradan the captain of the guard had left with Gedaliah the son of Ahikam the son of Shaphan, and Jeremiah the prophet, and Baruch the son of Neriah.	0.0	neutral	todos os homens, mulheres e crianças, as filhas do rei, todos os que Nebuzaradã, o comandante da guarda imperial, deixara com Gedalias, filho de Aicam, neto de Safã; além do profeta Jeremias e de Baruque, filho de Nerias.
JER.43.7	43	7	So they came into the land of Egypt: for they obeyed not the voice of the LORD: thus came they {even} to Tahpanhes.	0.0	neutral	Eles foram para o Egito, desobedecendo ao Senhor, e foram até Tafnes.
JER.43.8	43	8	Then came the word of the LORD unto Jeremiah in Tahpanhes, saying,	0.0	neutral	Em Tafnes, o Senhor dirigiu a palavra a Jeremias, dizendo:
JER.43.9	43	9	Take great stones in thine hand, and hide them in the clay in the brickkiln, which {is} at the entry of Pharaoh's house in Tahpanhes, in the sight of the men of Judah;	0.8	positive	"""Pegue algumas pedras grandes e, à vista dos homens de Judá, enterre-as no barro do pavimento na entrada do palácio do faraó, em Tafnes."
JER.43.10	43	10	And say unto them, Thus saith the LORD of hosts, the God of Israel; Behold, I will send and take Nebuchadrezzar the king of Babylon, my servant, and will set his throne upon these stones that I have hid; and he shall spread his royal pavilion over them.	0.0	neutral	Então diga-lhes: 'Assim diz o Senhor dos Exércitos, Deus de Israel: Mandarei chamar meu servo Nabucodonosor, rei da Babilônia, e ele colocará o seu trono sobre essas pedras que enterrei, e estenderá a sua tenda real sobre elas.
JER.43.11	43	11	And when he cometh, he shall smite the land of Egypt, {and deliver} such {as are} for death to death; and such {as are} for captivity to captivity; and such {as are} for the sword to the sword.	0.0	neutral	Ele virá e atacará o Egito, trará a morte aos destinados a morte, cativeiro aos destinados ao cativeiro, e espada aos destinados a morrer pela espada.
JER.43.12	43	12	And I will kindle a fire in the houses of the gods of Egypt; and he shall burn them, and carry them away captives: and he shall array himself with the land of Egypt, as a shepherd putteth on his garment; and he shall go forth from thence in peace.	0.0	neutral	Ele incendiará os templos dos deuses do Egito; queimará seus templos e levará embora cativos os seus deuses. Como um pastor tira os piolhos do seu manto, assim ele despiolhará o seu Egito, e sairá em paz.
JER.43.13	43	13	He shall break also the images of Bethshemesh, that {is} in the land of Egypt; and the houses of the gods of the Egyptians shall he burn with fire. {images: Heb. statues, or, standing images} {Bethshemesh: or, The house of the sun}	0.0	neutral	"Ele despedaçará as colunas no templo do sol, no Egito, e incendiará os templos dos deuses do Egito' ""."
JER.44.1	44	1	The word that came to Jeremiah concerning all the Jews which dwell in the land of Egypt, which dwell at Migdol, and at Tahpanhes, and at Noph, and in the country of Pathros, saying,	0.0	neutral	Esta é a palavra do Senhor, que foi dirigida a Jeremias, para todos os judeus que estavam no Egito e viviam em Migdol, Tafnes, Mênfis, e na região de Patros:
JER.44.2	44	2	Thus saith the LORD of hosts, the God of Israel; Ye have seen all the evil that I have brought upon Jerusalem, and upon all the cities of Judah; and, behold, this day they {are} a desolation, and no man dwelleth therein,	-1.0	negative	"""Assim diz o Senhor dos Exércitos, Deus de Israel: Vocês viram toda a desgraça que eu trouxe sobre Jerusalém e sobre todas as cidades de Judá. Hoje elas estão em ruínas e desabitadas"
JER.44.3	44	3	Because of their wickedness which they have committed to provoke me to anger, in that they went to burn incense, {and} to serve other gods, whom they knew not, {neither} they, ye, nor your fathers.	-0.4125	negative	por causa do mal que fizeram. Seus moradores provocaram a minha ira queimando incenso e prestando culto a outros deuses, que nem eles nem vocês nem seus antepassados jamais conheceram.
JER.44.4	44	4	Howbeit I sent unto you all my servants the prophets, rising early and sending {them}, saying, Oh, do not this abominable thing that I hate.	-0.35	negative	Dia após dia, eu lhes enviei meus servos, os profetas, que disseram: 'Não façam essa abominação detestável! '
JER.44.5	44	5	But they hearkened not, nor inclined their ear to turn from their wickedness, to burn no incense unto other gods.	-0.125	negative	Mas eles não me ouviram nem me deram atenção; não se converteram de sua impiedade nem cessaram de queimar incenso a outros deuses.
JER.44.6	44	6	Wherefore my fury and mine anger was poured forth, and was kindled in the cities of Judah and in the streets of Jerusalem; and they are wasted {and} desolate, as at this day.	-0.45	negative	Por isso, o meu furor foi derramado e queimou as cidades de Judá e as ruas de Jerusalém, tornando-as na ruína desolada que são no dia de hoje.
JER.44.7	44	7	Therefore now thus saith the LORD, the God of hosts, the God of Israel; Wherefore commit ye {this} great evil against your souls, to cut off from you man and woman, child and suckling, out of Judah, to leave you none to remain; {out...: Heb. out of the midst of Judah}	-0.1	neutral	"""Assim diz o Senhor, o Deus dos Exércitos, o Deus de Israel: Por que trazer uma desgraça tão grande sobre si mesmos, eliminando de Judá homens e mulheres, crianças e recém-nascidos, sem deixar remanescente algum?"
JER.44.8	44	8	In that ye provoke me unto wrath with the works of your hands, burning incense unto other gods in the land of Egypt, whither ye be gone to dwell, that ye might cut yourselves off, and that ye might be a curse and a reproach among all the nations of the earth?	-0.125	negative	Por que vocês provocam a minha ira com o que fazem, queimando incenso a outros deuses no Egito, onde vocês vieram residir? Vocês se destruirão a si mesmos e se tornarão objeto de desprezo e afronta entre todas as nações da terra.
JER.44.9	44	9	Have ye forgotten the wickedness of your fathers, and the wickedness of the kings of Judah, and the wickedness of their wives, and your own wickedness, and the wickedness of your wives, which they have committed in the land of Judah, and in the streets of Jerusalem? {wickedness...: Heb. wickednesses, or, punishments, etc}	0.6	positive	Acaso vocês se esqueceram da impiedade cometida por seus antepassados, pelos reis de Judá e as mulheres deles, e da impiedade cometida por vocês e suas mulheres na terra de Judá e nas ruas de Jerusalém?
JER.44.10	44	10	They are not humbled {even} unto this day, neither have they feared, nor walked in my law, nor in my statutes, that I set before you and before your fathers. {humbled: Heb. contrite}	0.0	neutral	"Até hoje eles não se humilharam nem mostraram reverência, e não têm seguido a minha lei e os decretos que coloquei diante de vocês e dos seus antepassados""."
JER.44.11	44	11	Therefore thus saith the LORD of hosts, the God of Israel; Behold, I will set my face against you for evil, and to cut off all Judah.	-1.0	negative	"""Portanto, assim diz o Senhor dos Exércitos, Deus de Israel: Estou decidido a trazer desgraça sobre vocês e a destruir todo o Judá."
JER.44.12	44	12	And I will take the remnant of Judah, that have set their faces to go into the land of Egypt to sojourn there, and they shall all be consumed, {and} fall in the land of Egypt; they shall {even} be consumed by the sword {and} by the famine: they shall die, from the least even unto the greatest, by the sword and by the famine: and they shall be an execration, {and} an astonishment, and a curse, and a reproach.	0.35	positive	Tomarei o remanescente de Judá, que decidiu partir e residir no Egito, e todos morrerão no Egito. Cairão pela espada ou pela fome; desde o menor até o maior, morrerão pela espada ou pela fome. Eles se tornarão objeto de maldição e de pavor, de desprezo e de afronta.
JER.44.13	44	13	For I will punish them that dwell in the land of Egypt, as I have punished Jerusalem, by the sword, by the famine, and by the pestilence:	0.0	neutral	Castigarei aqueles que vivem no Egito com a guerra, a fome e a peste, como castiguei Jerusalém.
JER.44.14	44	14	So that none of the remnant of Judah, which are gone into the land of Egypt to sojourn there, shall escape or remain, that they should return into the land of Judah, to the which they have a desire to return to dwell there: for none shall return but such as shall escape. {have...: Heb. lift up their soul}	0.0	neutral	"Ninguém dentre o remanescente de Judá que foi morar no Egito escapará ou sobreviverá para voltar à terra de Judá, para a qual anseiam voltar e nela anseiam viver; nenhum voltará, exceto uns poucos fugitivos""."
JER.44.15	44	15	Then all the men which knew that their wives had burned incense unto other gods, and all the women that stood by, a great multitude, even all the people that dwelt in the land of Egypt, in Pathros, answered Jeremiah, saying,	0.3375	positive	Então, todos os homens que sabiam que as suas mulheres queimavam incenso a outros deuses, e todas as mulheres que estavam presentes, em grande número, e todo o povo que morava no Egito, e na região de Patros, disseram a Jeremias:
JER.44.16	44	16	{As for} the word that thou hast spoken unto us in the name of the LORD, we will not hearken unto thee.	0.0	neutral	"""Nós não daremos atenção à mensagem que você nos apresenta em nome do Senhor!"
JER.44.17	44	17	But we will certainly do whatsoever thing goeth forth out of our own mouth, to burn incense unto the queen of heaven, and to pour out drink offerings unto her, as we have done, we, and our fathers, our kings, and our princes, in the cities of Judah, and in the streets of Jerusalem: for {then} had we plenty of victuals, and were well, and saw no evil. {queen...: or, frame of heaven} {victuals: Heb. bread}	0.4381	positive	É certo que faremos tudo o que dissemos que faríamos: Queimaremos incenso à Rainha dos Céus e derramaremos ofertas de bebidas para ela, tal como fazíamos, nós e nossos antepassados, nossos reis e nossos líderes, nas cidades de Judá e nas ruas de Jerusalém. Naquela época tínhamos fartura de comida, éramos prósperos e em nada sofríamos.
JER.44.18	44	18	But since we left off to burn incense to the queen of heaven, and to pour out drink offerings unto her, we have wanted all {things}, and have been consumed by the sword and by the famine.	0.0	neutral	"Mas, desde que paramos de queimar incenso à Rainha dos Céus e de derramar ofertas de bebidas a ela, nada temos tido e temos perecido pela espada e pela fome""."
JER.44.19	44	19	And when we burned incense to the queen of heaven, and poured out drink offerings unto her, did we make her cakes to worship her, and pour out drink offerings unto her, without our men? {men: or, husbands?}	0.0	neutral	"E as mulheres acrescentaram: ""Quando queimávamos incenso à Rainha dos Céus e derramávamos ofertas de bebidas para ela, será que era sem o consentimento de nossos maridos que fazíamos bolos na forma da imagem dela e derramávamos ofertas de bebidas para ela? """
JER.44.20	44	20	Then Jeremiah said unto all the people, to the men, and to the women, and to all the people which had given him {that} answer, saying,	0.0	neutral	Então Jeremias disse a todo o povo, tanto aos homens como às mulheres que estavam respondendo a ele:
JER.44.21	44	21	The incense that ye burned in the cities of Judah, and in the streets of Jerusalem, ye, and your fathers, your kings, and your princes, and the people of the land, did not the LORD remember them, and came it {not} into his mind?	0.0	neutral	"""E o Senhor? Não se lembra ele do incenso queimado nas cidades de Judá e nas ruas de Jerusalém por vocês e por seus antepassados, seus reis e seus líderes e pelo povo da terra? Será que ele não pensa nisso?"
JER.44.22	44	22	So that the LORD could no longer bear, because of the evil of your doings, {and} because of the abominations which ye have committed; therefore is your land a desolation, and an astonishment, and a curse, without an inhabitant, as at this day.	-1.0	negative	Quando o Senhor não pôde mais suportar as impiedades e as práticas repugnantes de vocês, a terra de vocês ficou devastada e desolada, e tornou-se objeto de maldição e desabitada, como se vê no dia de hoje.
JER.44.23	44	23	Because ye have burned incense, and because ye have sinned against the LORD, and have not obeyed the voice of the LORD, nor walked in his law, nor in his statutes, nor in his testimonies; therefore this evil is happened unto you, as at this day.	-1.0	negative	"Foi porque vocês queimaram incenso e pecaram contra o Senhor, e não obedeceram à sua palavra nem seguiram a sua lei, os seus decretos e os seus testemunhos, que esta desgraça caiu sobre vocês, como se vê no dia de hoje""."
JER.44.24	44	24	Moreover Jeremiah said unto all the people, and to all the women, Hear the word of the LORD, all Judah that {are} in the land of Egypt:	0.0	neutral	"Disse então Jeremias a todo o povo, inclusive às mulheres: ""Ouçam a palavra do Senhor, todos vocês, judeus que estão no Egito."
JER.44.25	44	25	Thus saith the LORD of hosts, the God of Israel, saying; Ye and your wives have both spoken with your mouths, and fulfilled with your hand, saying, We will surely perform our vows that we have vowed, to burn incense to the queen of heaven, and to pour out drink offerings unto her: ye will surely accomplish your vows, and surely perform your vows.	0.5	positive	"Assim diz o Senhor dos Exércitos, Deus de Israel: Vocês e suas mulheres cumpriram o que prometeram quando disseram: 'Certamente cumpriremos os votos que fizemos de queimar incenso e derramar ofertas de bebidas à Rainha dos Céus'. ""Prossigam! Façam o que prometeram! Cumpram os seus votos!"
JER.44.26	44	26	Therefore hear ye the word of the LORD, all Judah that dwell in the land of Egypt; Behold, I have sworn by my great name, saith the LORD, that my name shall no more be named in the mouth of any man of Judah in all the land of Egypt, saying, The Lord GOD liveth.	0.275	positive	Mas ouçam a palavra do Senhor, todos vocês, judeus que vivem no Egito: 'Eu juro pelo meu grande nome', diz o Senhor, 'que em todo o Egito ninguém de Judá voltará a invocar o meu nome ou a jurar pela vida do Soberano Senhor.
JER.44.27	44	27	Behold, I will watch over them for evil, and not for good: and all the men of Judah that {are} in the land of Egypt shall be consumed by the sword and by the famine, until there be an end of them.	-0.15	negative	Vigiarei sobre eles para trazer-lhes a desgraça e não o bem; os judeus do Egito perecerão pela espada e pela fome até que sejam todos destruídos.
JER.44.28	44	28	Yet a small number that escape the sword shall return out of the land of Egypt into the land of Judah, and all the remnant of Judah, that are gone into the land of Egypt to sojourn there, shall know whose words shall stand, mine, or theirs. {mine...: Heb. from me, or, from them}	-0.25	negative	Serão poucos os que escaparão da espada e voltarão do Egito para a terra de Judá. Então, todo o remanescente de Judá que veio residir no Egito saberá qual é a palavra que se realiza, a minha ou a deles.
JER.44.29	44	29	And this {shall be} a sign unto you, saith the LORD, that I will punish you in this place, that ye may know that my words shall surely stand against you for evil:	-0.25	negative	""" 'Este será o sinal para vocês de que os castigarei neste lugar', declara o Senhor, 'e então vocês ficarão sabendo que as minhas ameaças de trazer-lhes desgraça certamente se realizarão'."
JER.44.30	44	30	Thus saith the LORD; Behold, I will give Pharaohhophra king of Egypt into the hand of his enemies, and into the hand of them that seek his life; as I gave Zedekiah king of Judah into the hand of Nebuchadrezzar king of Babylon, his enemy, and that sought his life.	0.0	neutral	"Assim diz o Senhor: 'Entregarei o faraó Hofra, rei do Egito, nas mãos dos seus inimigos que desejam tirar-lhe a vida, assim como entreguei Zedequias, rei de Judá, nas mãos de Nabucodonosor, rei da Babilônia, o inimigo que desejava tirar a vida dele' ""."
JER.45.1	45	1	The word that Jeremiah the prophet spake unto Baruch the son of Neriah, when he had written these words in a book at the mouth of Jeremiah, in the fourth year of Jehoiakim the son of Josiah king of Judah, saying,	0.0	neutral	No quarto ano do reinado de Jeoaquim, filho de Josias, rei de Judá, depois que Baruque, filho de Nerias, escreveu num rolo as palavras ditadas por Jeremias, este lhe disse:
JER.45.2	45	2	Thus saith the LORD, the God of Israel, unto thee, O Baruch;	0.0	neutral	"""Assim diz o Senhor, o Deus de Israel, a você, Baruque:"
