verse_id	chapter	verse	text_en	polarity_en	label_en	text_pt
JER.11.21	11	21	Therefore thus saith the LORD of the men of Anathoth, that seek thy life, saying, Prophesy not in the name of the LORD, that thou die not by our hand:	0.0	neutral	"Em vista disso, assim diz o Senhor a respeito dos homens de Anatote que querem tirar a sua vida, e que dizem: ""Não profetize em nome do Senhor, se não nós o mataremos"";"
JER.11.22	11	22	Therefore thus saith the LORD of hosts, Behold, I will punish them: the young men shall die by the sword; their sons and their daughters shall die by famine: {punish: Heb. visit upon}	-0.325	negative	"assim diz o Senhor dos Exércitos: ""Eu os castigarei. Seus jovens morrerão à espada; seus filhos e suas filhas, de fome."
JER.11.23	11	23	And there shall be no remnant of them: for I will bring evil upon the men of Anathoth, {even} the year of their visitation.	-1.0	negative	"Nem mesmo um remanescente lhes restará, porque trarei a desgraça sobre os homens de Anatote no ano do seu castigo""."
JER.12.1	12	1	Righteous {art} thou, O LORD, when I plead with thee: yet let me talk with thee of {thy} judgments: Wherefore doth the way of the wicked prosper? {wherefore} are all they happy that deal very treacherously? {talk...: or, reason the case with thee}	0.5	positive	Tu és justo, Senhor, quando apresento uma causa diante de ti. Contudo, eu gostaria de discutir contigo sobre a tua justiça. Por que o caminho dos ímpios prospera? Por que todos os traidores vivem sem problemas?
JER.12.2	12	2	Thou hast planted them, yea, they have taken root: they grow, yea, they bring forth fruit: thou {art} near in their mouth, and far from their reins. {they grow: Heb. they go on}	0.1	neutral	Tu os plantaste, e eles criaram raízes; crescem e dão fruto. Tu estás sempre perto dos seus lábios, mas longe dos seus corações.
JER.12.3	12	3	But thou, O LORD, knowest me: thou hast seen me, and tried mine heart toward thee: pull them out like sheep for the slaughter, and prepare them for the day of slaughter. {toward...: Heb. with thee}	0.0	neutral	Tu, porém, me conheces, Senhor; tu me vês e provas a minha atitude para contigo. Arranca os ímpios como a ovelhas destinadas ao matadouro! Reserva-os para o dia da matança!
JER.12.4	12	4	How long shall the land mourn, and the herbs of every field wither, for the wickedness of them that dwell therein? the beasts are consumed, and the birds; because they said, He shall not see our last end.	-0.025	neutral	Até quando a terra ficará de luto e a relva de todo o campo estará seca? Perecem os animais e as aves por causa da maldade dos que habitam nesta terra, pois eles disseram: 'Ele não verá o fim que nos espera'.
JER.12.5	12	5	If thou hast run with the footmen, and they have wearied thee, then how canst thou contend with horses? and {if} in the land of peace, {wherein} thou trustedst, {they wearied thee}, then how wilt thou do in the swelling of Jordan?	0.0	neutral	"""Se você correu com homens e eles o cansaram, como poderá competir com cavalos? Se você tropeça em terreno seguro, o que fará nos matagais junto ao Jordão?"
JER.12.6	12	6	For even thy brethren, and the house of thy father, even they have dealt treacherously with thee; yea, they have called a multitude after thee: believe them not, though they speak fair words unto thee. {they have called...: or, they cried after thee fully} {fair...: Heb. good things}	0.7	positive	Até mesmo os seus irmãos e a sua própria família traíram você e o perseguem aos gritos. Não confie neles, mesmo quando lhe dizem coisas boas.
JER.12.7	12	7	I have forsaken mine house, I have left mine heritage; I have given the dearly beloved of my soul into the hand of her enemies. {the dearly...: Heb. the love}	0.4	positive	"""Abandonei a minha família, deixei a minha propriedade e entreguei aquela a quem amo nas mãos dos seus inimigos."
JER.12.8	12	8	Mine heritage is unto me as a lion in the forest; it crieth out against me: therefore have I hated it. {crieth...: or, yelleth: Heb. giveth out his voice}	-0.9	negative	O povo de minha propriedade tornou-se para mim como um leão na floresta. Ele ruge contra mim, por isso eu o odeio.
JER.12.9	12	9	Mine heritage {is} unto me {as} a speckled bird, the birds round about {are} against her; come ye, assemble all the beasts of the field, come to devour. {speckled: or, taloned} {come to: or, cause them to come to}	-0.2	negative	O povo de minha propriedade tornou-se para mim como uma toca de hiena, sobre pairam a qual as aves de rapina. Reúnam todos os animais selvagens; tragam-nos para o banquete.
JER.12.10	12	10	Many pastors have destroyed my vineyard, they have trodden my portion under foot, they have made my pleasant portion a desolate wilderness. {pleasant...: Heb. portion of desire}	0.6556	positive	A minha vinha foi destruída por muitos pastores, os quais pisotearam a minha propriedade. Eles tornaram a minha preciosa propriedade num deserto devastado.
JER.12.11	12	11	They have made it desolate, {and being} desolate it mourneth unto me; the whole land is made desolate, because no man layeth {it} to heart.	0.2	positive	Fizeram dela uma terra devastada; e devastada ela pranteia diante de mim. A terra toda foi devastada, mas não há quem se importe com isso.
JER.12.12	12	12	The spoilers are come upon all high places through the wilderness: for the sword of the LORD shall devour from the {one} end of the land even to the {other} end of the land: no flesh shall have peace.	0.0175	neutral	Destruidores vieram sobre todas as planícies do deserto, pois a espada do Senhor devora esta terra de uma extremidade à outra; ninguém está seguro.
JER.12.13	12	13	They have sown wheat, but shall reap thorns: they have put themselves to pain, {but} shall not profit: and they shall be ashamed of your revenues because of the fierce anger of the LORD. {they shall: or, ye shall}	-0.7	negative	"Semearam trigo, mas colheram espinhos; cansaram-se de trabalhar para nada produzir. Estão desapontados com a colheita por causa do fogo da ira do Senhor. """
JER.12.14	12	14	Thus saith the LORD against all mine evil neighbours, that touch the inheritance which I have caused my people Israel to inherit; Behold, I will pluck them out of their land, and pluck out the house of Judah from among them.	-1.0	negative	"Assim diz o Senhor a respeito de todos os meus vizinhos, as nações ímpias que se apoderam da herança que dei a Israel, meu povo: ""Eu os arrancarei da sua terra, e arrancarei Judá do meio deles."
JER.12.15	12	15	And it shall come to pass, after that I have plucked them out I will return, and have compassion on them, and will bring them again, every man to his heritage, and every man to his land.	0.0	neutral	Mas, depois de arrancá-los, terei compaixão de novo e os farei voltar, cada um à sua propriedade e à sua terra.
JER.12.16	12	16	And it shall come to pass, if they will diligently learn the ways of my people, to swear by my name, The LORD liveth; as they taught my people to swear by Baal; then shall they be built in the midst of my people.	0.0	neutral	E se aprenderem a comportar-se como meu povo, e jurarem pelo nome do Senhor, dizendo: 'Juro pelo nome do Senhor' — como antes ensinaram o meu povo a jurar por Baal — então eles serão estabelecidos no meio do meu povo.
JER.12.17	12	17	But if they will not obey, I will utterly pluck up and destroy that nation, saith the LORD.	-0.1	neutral	"Mas se não me ouvirem, eu arrancarei completamente aquela nação e a destruirei"", declara o Senhor."
JER.13.1	13	1	Thus saith the LORD unto me, Go and get thee a linen girdle, and put it upon thy loins, and put it not in water.	0.0	neutral	"Assim me disse o Senhor: ""Vá comprar um cinto de linho e ponha-o em volta da cintura, mas não o deixe encostar na água""."
JER.13.2	13	2	So I got a girdle according to the word of the LORD, and put {it} on my loins.	0.0	neutral	Comprei um cinto e o pus em volta da cintura, como o Senhor me havia instruído.
JER.13.3	13	3	And the word of the LORD came unto me the second time, saying,	0.0	neutral	O Senhor me dirigiu a palavra pela segunda vez, dizendo:
JER.13.4	13	4	Take the girdle that thou hast got, which {is} upon thy loins, and arise, go to Euphrates, and hide it there in a hole of the rock.	0.0	neutral	"""Pegue o cinto que você comprou e está usando, vá agora a Perate e esconda-o ali numa fenda da rocha""."
JER.13.5	13	5	So I went, and hid it by Euphrates, as the LORD commanded me.	0.0	neutral	Assim, fui e o escondi em Perate, conforme o Senhor me havia ordenado.
JER.13.6	13	6	And it came to pass after many days, that the LORD said unto me, Arise, go to Euphrates, and take the girdle from thence, which I commanded thee to hide there.	0.5	positive	"Depois de muitos dias, o Senhor me disse: ""Vá agora a Perate e pegue o cinto que lhe ordenei que escondesse ali""."
JER.13.7	13	7	Then I went to Euphrates, and digged, and took the girdle from the place where I had hid it: and, behold, the girdle was marred, it was profitable for nothing.	0.0	neutral	Então fui a Perate, desenterrei o cinto e o tirei do lugar em que o havia escondido. O cinto estava podre e se tornara completamente inútil.
JER.13.8	13	8	Then the word of the LORD came unto me, saying,	0.0	neutral	E o Senhor dirigiu-me a palavra, dizendo:
JER.13.9	13	9	Thus saith the LORD, After this manner will I mar the pride of Judah, and the great pride of Jerusalem.	0.8	positive	"""Assim diz o Senhor: Do mesmo modo também arruinarei o orgulho de Judá e o orgulho desmedido de Jerusalém."
JER.13.10	13	10	This evil people, which refuse to hear my words, which walk in the imagination of their heart, and walk after other gods, to serve them, and to worship them, shall even be as this girdle, which is good for nothing. {imagination: or, stubbornness}	-0.1417	negative	Este povo ímpio, que se recusa a ouvir as minhas palavras, que age segundo a dureza de seus corações, seguindo outros deuses para prestar-lhes culto e adorá-los, que este povo seja como aquele cinto: completamente inútil!
JER.13.11	13	11	For as the girdle cleaveth to the loins of a man, so have I caused to cleave unto me the whole house of Israel and the whole house of Judah, saith the LORD; that they might be unto me for a people, and for a name, and for a praise, and for a glory: but they would not hear.	0.2	positive	"Assim como um cinto se apega à cintura de um homem, da mesma forma fiz com que toda a comunidade de Israel e toda a comunidade de Judá se apegasse a mim, para que fosse o meu povo para o meu renome, louvor e honra. Mas eles não me ouviram"", declara o Senhor."
JER.13.12	13	12	Therefore thou shalt speak unto them this word; Thus saith the LORD God of Israel, Every bottle shall be filled with wine: and they shall say unto thee, Do we not certainly know that every bottle shall be filled with wine?	0.231	positive	"""Diga-lhes também: 'Assim diz o Senhor, o Deus de Israel: Deve-se encher de vinho toda vasilha de couro'. E, se eles lhe disserem: 'Será que não sabemos que se deve encher de vinho toda vasilha de couro? '"
JER.13.13	13	13	Then shalt thou say unto them, Thus saith the LORD, Behold, I will fill all the inhabitants of this land, even the kings that sit upon David's throne, and the priests, and the prophets, and all the inhabitants of Jerusalem, with drunkenness.	0.0	neutral	Então você lhes dirá: 'Assim diz o Senhor: Farei com que fiquem totalmente embriagados todos os habitantes desta terra, bem como os reis que se assentam no trono de Davi, os sacerdotes, os profetas e todos os habitantes de Jerusalém.
JER.13.14	13	14	And I will dash them one against another, even the fathers and the sons together, saith the LORD: I will not pity, nor spare, nor have mercy, but destroy them. {one...: Heb. a man against his brother} {but...: Heb. from destroying them}	-0.1167	negative	"Eu os despedaçarei, colocando uns contra os outros, os pais e os filhos, diz o Senhor. Nem a piedade, nem a misericórdia nem a compaixão me impedirão de destruí-los' ""."
JER.13.15	13	15	Hear ye, and give ear; be not proud: for the LORD hath spoken.	-0.4	negative	Escutem e dêem atenção, não sejam arrogantes, pois o Senhor falou.
JER.13.16	13	16	Give glory to the LORD your God, before he cause darkness, and before your feet stumble upon the dark mountains, and, while ye look for light, he turn it into the shadow of death, {and} make {it} gross darkness.	0.05	neutral	Dêem glória ao Senhor, ao seu Deus, antes que ele traga trevas, antes que os pés de vocês tropecem nas colinas ao escurecer. Vocês esperam a luz, mas ele fará dela uma escuridão profunda sim, ele a transformará em densas trevas.
JER.13.17	13	17	But if ye will not hear it, my soul shall weep in secret places for {your} pride; and mine eye shall weep sore, and run down with tears, because the LORD'S flock is carried away captive.	-0.1185	negative	Mas, se vocês não ouvirem, eu chorarei em segredo por causa do orgulho de vocês. Chorarei amargamente, e de lágrimas os meus olhos transbordarão, porque o rebanho do Senhor foi levado para o cativeiro.
JER.13.18	13	18	Say unto the king and to the queen, Humble yourselves, sit down: for your principalities shall come down, {even} the crown of your glory. {principalities: or, head tires}	-0.1704	negative	"Diga-se ao rei e à rainha-mãe: ""Desçam do trono, pois as suas coroas gloriosas caíram de suas cabeças""."
JER.13.19	13	19	The cities of the south shall be shut up, and none shall open {them}: Judah shall be carried away captive all of it, it shall be wholly carried away captive.	0.1333	positive	As cidades do Neguebe estão bloqueadas e não há quem nelas consiga entrar. Todo o Judá foi levado para o exílio, todos os exilados.
JER.13.20	13	20	Lift up your eyes, and behold them that come from the north: where {is} the flock {that} was given thee, thy beautiful flock?	0.85	positive	Erga os olhos, Jerusalém, e veja aqueles que vêm do norte. Onde está o rebanho que lhe foi confiado, as ovelhas das quais você se orgulhava?
JER.13.21	13	21	What wilt thou say when he shall punish thee? for thou hast taught them {to be} captains, {and} as chief over thee: shall not sorrows take thee, as a woman in travail? {punish: Heb visit upon}	0.0	neutral	O que você dirá quando sobre você dominarem aqueles que você sempre teve como aliados? Você não irá sentir dores como as de uma mulher em trabalho de parto?
JER.13.22	13	22	And if thou say in thine heart, Wherefore come these things upon me? For the greatness of thine iniquity are thy skirts discovered, {and} thy heels made bare. {made...: or, shall be violently taken away}	-0.375	negative	E se você se perguntar: 'Por que aconteceu isso comigo? ', saiba que foi por causa dos seus muitos pecados que as suas vestes foram levantadas e você foi violentada.
JER.13.23	13	23	Can the Ethiopian change his skin, or the leopard his spots? {then} may ye also do good, that are accustomed to do evil. {accustomed: Heb. taught}	-0.15	negative	Será que o etíope pode mudar a sua pele? Ou o leopardo as suas pintas? Assim também vocês são incapazes de fazer o bem, vocês que estão acostumados a praticar o mal.
JER.13.24	13	24	Therefore will I scatter them as the stubble that passeth away by the wind of the wilderness.	0.0	neutral	"""Espalharei vocês como a palha levada pelo vento do deserto."
JER.13.25	13	25	This {is} thy lot, the portion of thy measures from me, saith the LORD; because thou hast forgotten me, and trusted in falsehood.	0.0	neutral	"Esta é a sua parte, a porção que lhe determinei"", declara o Senhor, ""porque você se esqueceu de mim e confiou em deuses falsos."
JER.13.26	13	26	Therefore will I discover thy skirts upon thy face, that thy shame may appear.	0.0	neutral	Eu mesmo levantarei as suas vestes até o seu rosto para que as suas vergonhas sejam expostas,
JER.13.27	13	27	I have seen thine adulteries, and thy neighings, the lewdness of thy whoredom, {and} thine abominations on the hills in the fields. Woe unto thee, O Jerusalem! wilt thou not be made clean? when {shall it} once {be}? {when...: Heb. after when yet?}	0.3667	positive	"Tenho visto os seus atos repugnantes os seus adultérios, os seus relinchos, a sua prostituição desavergonhada sobre as colinas e nos campos. Ai de você, Jerusalém! Até quando você continuará impura? """
JER.14.1	14	1	The word of the LORD that came to Jeremiah concerning the dearth. {the dearth: Heb. the words of the dearths, or, restraints}	0.0	neutral	Esta é a palavra que o Senhor dirigiu a Jeremias acerca da seca:
JER.14.2	14	2	Judah mourneth, and the gates thereof languish; they are black unto the ground; and the cry of Jerusalem is gone up.	-0.1667	negative	"""Judá pranteia, as suas cidades estão definhando e os seus habitantes se lamentam, prostrados no chão! O grito de Jerusalém sobe."
JER.14.3	14	3	And their nobles have sent their little ones to the waters: they came to the pits, {and} found no water; they returned with their vessels empty; they were ashamed and confounded, and covered their heads.	-0.1437	negative	Os nobres mandam os seus servos à procura de água; eles vão às cisternas mas nada encontram. Voltam com os potes vazios, e, decepcionados e desesperados, cobrem a cabeça.
JER.14.4	14	4	Because the ground is chapt, for there was no rain in the earth, the plowmen were ashamed, they covered their heads.	0.0	neutral	A terra nada produziu, porque não houve chuva; e os lavradores, decepcionados, cobrem a cabeça.
JER.14.5	14	5	Yea, the hind also calved in the field, and forsook {it}, because there was no grass.	0.0	neutral	Até mesmo a corça no campo abandona a cria recém-nascida, porque não há capim.
JER.14.6	14	6	And the wild asses did stand in the high places, they snuffed up the wind like dragons; their eyes did fail, because {there was} no grass.	-0.08	neutral	"Os jumentos selvagens permanecem nos altos, farejando o vento como os chacais, mas a sua visão falha, por falta de pastagem""."
JER.14.7	14	7	O LORD, though our iniquities testify against us, do thou {it} for thy name's sake: for our backslidings are many; we have sinned against thee.	0.5	positive	Embora os nossos pecados nos acusem, age por amor do teu nome, ó Senhor! Nossas infidelidades são muitas; temos pecado contra ti.
JER.14.8	14	8	O the hope of Israel, the saviour thereof in time of trouble, why shouldest thou be as a stranger in the land, and as a wayfaring man {that} turneth aside to tarry for a night?	-0.2	negative	Ó Esperança de Israel, tu que o salvas na hora da adversidade, por que te comportas como um estrangeiro na terra, ou como um viajante que fica somente uma noite?
JER.14.9	14	9	Why shouldest thou be as a man astonied, as a mighty man {that} cannot save? yet thou, O LORD, {art} in the midst of us, and we are called by thy name; leave us not. {we...: Heb. thy name is called upon us}	0.4	positive	Por que ages como um homem que foi pego de surpresa, como um guerreiro que não pode salvar? Tu estás em nosso meio, ó Senhor, e nós pertencemos a ti; não nos abandones!
JER.14.10	14	10	Thus saith the LORD unto this people, Thus have they loved to wander, they have not refrained their feet, therefore the LORD doth not accept them; he will now remember their iniquity, and visit their sins.	0.7	positive	"Assim diz o Senhor acerca deste povo: ""Eles gostam muito de vaguear; não controlam os pés. Por isso o Senhor não os aceita; agora ele se lembrará da iniqüidade deles e os castigará por causa dos seus pecados""."
JER.14.11	14	11	Then said the LORD unto me, Pray not for this people for {their} good.	0.7	positive	"Então o Senhor me disse: ""Não ore pelo bem-estar deste povo."
JER.14.12	14	12	When they fast, I will not hear their cry; and when they offer burnt offering and an oblation, I will not accept them: but I will consume them by the sword, and by the famine, and by the pestilence.	0.2	positive	"Ainda que jejuem, não escutarei o clamor deles; ainda que ofereçam holocaustos e ofertas de cereal, não os aceitarei. Mas eu os destruirei pela guerra, pela fome e pela peste""."
JER.14.13	14	13	Then said I, Ah, Lord GOD! behold, the prophets say unto them, Ye shall not see the sword, neither shall ye have famine; but I will give you assured peace in this place. {assured...: Heb. peace of truth}	0.0	neutral	"Mas eu disse: ""Ah, Soberano Senhor, os profetas estão dizendo a eles: 'Vocês não verão a guerra nem a fome; eu lhes darei prosperidade duradoura neste lugar' ""."
JER.14.14	14	14	Then the LORD said unto me, The prophets prophesy lies in my name: I sent them not, neither have I commanded them, neither spake unto them: they prophesy unto you a false vision and divination, and a thing of nought, and the deceit of their heart.	-0.4	negative	"Então o Senhor me disse: ""É mentira o que os profetas estão profetizando em meu nome. Eu não os enviei nem lhes dei ordem nenhuma, nem falei com eles. Eles estão profetizando para vocês falsas visões, adivinhações inúteis e ilusões de suas próprias mentes""."
JER.14.15	14	15	Therefore thus saith the LORD concerning the prophets that prophesy in my name, and I sent them not, yet they say, Sword and famine shall not be in this land; By sword and famine shall those prophets be consumed.	0.0	neutral	"Por isso, assim diz o Senhor: ""Quanto aos profetas que estão profetizando em meu nome, embora eu não os tenha enviado, e que dizem: 'Nem guerra nem fome alcançarão esta terra', aqueles mesmos profetas perecerão pela guerra e pela fome!"
JER.14.16	14	16	And the people to whom they prophesy shall be cast out in the streets of Jerusalem because of the famine and the sword; and they shall have none to bury them, them, their wives, nor their sons, nor their daughters: for I will pour their wickedness upon them.	0.0	neutral	E aqueles a quem estão profetizando serão jogados nas ruas de Jerusalém, por causa da fome e da guerra. E não haverá ninguém para sepultá-los, nem para sepultar as suas mulheres, os seus filhos e as suas filhas. Despejarei sobre eles o castigo que merecem.
JER.14.17	14	17	Therefore thou shalt say this word unto them; Let mine eyes run down with tears night and day, and let them not cease: for the virgin daughter of my people is broken with a great breach, with a very grievous blow.	-0.1889	negative	"""Diga-lhes isto: "" 'Que os meus olhos derramem lágrimas, noite e dia sem cessar; pois a minha filha virgem, o meu povo, sofreu um ferimento terrível, um golpe fatal."
JER.14.18	14	18	If I go forth into the field, then behold the slain with the sword! and if I enter into the city, then behold them that are sick with famine! yea, both the prophet and the priest go about into a land that they know not. {go about...: or, make merchandise against a land, and men acknowledge it not}	-0.8929	negative	"Se vou para o campo, vejo os que morreram pela espada; se entro na cidade, vejo a devastação da fome. Tanto o profeta como o sacerdote percorrem a terra sem nada compreender' ""."
JER.14.19	14	19	Hast thou utterly rejected Judah? hath thy soul lothed Zion? why hast thou smitten us, and {there is} no healing for us? we looked for peace, and {there is} no good; and for the time of healing, and behold trouble!	-0.2	negative	Rejeitaste Judá completamente? Desprezaste Sião? Por que nos feriste a ponto de não podermos ser curados? Esperávamos a paz, mas não veio bem algum; esperávamos um tempo de cura, mas há somente terror.
JER.14.20	14	20	We acknowledge, O LORD, our wickedness, {and} the iniquity of our fathers: for we have sinned against thee.	0.0	neutral	Senhor, reconhecemos a nossa impiedade e a iniqüidade dos nossos pais; temos de fato pecado contra ti.
JER.14.21	14	21	Do not abhor {us}, for thy name's sake, do not disgrace the throne of thy glory: remember, break not thy covenant with us.	0.0	neutral	Por amor do teu nome não nos desprezes; não desonres o teu trono glorioso. Lembra-te da tua aliança conosco e não a quebres.
JER.14.22	14	22	Are there {any} among the vanities of the Gentiles that can cause rain? or can the heavens give showers? {art} not thou he, O LORD our God? therefore we will wait upon thee: for thou hast made all these {things}.	0.0	neutral	Entre os ídolos inúteis das nações, existe algum que possa trazer chuva? Podem os céus, por si mesmos, produzir chuvas copiosas? Somente tu o podes, Senhor, nosso Deus! Portanto, a nossa esperança está em ti, pois tu fazes todas essas coisas.
JER.15.1	15	1	Then said the LORD unto me, Though Moses and Samuel stood before me, {yet} my mind {could} not {be} toward this people: cast {them} out of my sight, and let them go forth.	0.0	neutral	"Então o Senhor me disse: ""Ainda que Moisés e Samuel estivessem diante de mim, intercedendo por este povo, eu não lhes mostraria favor. Expulse-os da minha presença! Que saiam!"
JER.15.2	15	2	And it shall come to pass, if they say unto thee, Whither shall we go forth? then thou shalt tell them, Thus saith the LORD; Such as {are} for death, to death; and such as {are} for the sword, to the sword; and such as {are} for the famine, to the famine; and such as {are} for the captivity, to the captivity.	0.0	neutral	"E, se lhe perguntarem: 'Para onde iremos? ', diga-lhes: 'Assim diz o Senhor: "" 'Os destinados à morte, para a morte; os destinados à espada, para a espada; os destinados à fome, para a fome; os destinados ao cativeiro, para o cativeiro'."
JER.15.3	15	3	And I will appoint over them four kinds, saith the LORD: the sword to slay, and the dogs to tear, and the fowls of the heaven, and the beasts of the earth, to devour and destroy. {kinds: Heb. families}	-0.2	negative	"""Enviarei quatro tipos de destruidores contra eles"", declara o Senhor: ""a espada para matar, os cães para dilacerar, as aves do céu e os animais selvagens para devorar e destruir."
