verse_id	chapter	verse	text_en	polarity_en	label_en	text_es
1KI.12.12	12	12	So Jeroboam and all the people came to Rehoboam the third day, as the king had appointed, saying, Come to me again the third day.	0.0	neutral	Y al tercer día vino Jeroboam con todo el pueblo á Roboam; según el rey lo había mandado, diciendo: Volved á mí al tercer día.
1KI.12.13	12	13	And the king answered the people roughly, and forsook the old men's counsel that they gave him; {roughly: Heb. hardly}	-0.0979	neutral	Y el rey respondió al pueblo duramente, dejado el consejo de los ancianos que ellos le habían dado;
1KI.12.14	12	14	And spake to them after the counsel of the young men, saying, My father made your yoke heavy, and I will add to your yoke: my father {also} chastised you with whips, but I will chastise you with scorpions.	-0.05	neutral	Y hablóles conforme al consejo de los mancebos, diciendo: Mi padre agravó vuestro yugo, pero yo añadiré á vuestro yugo; mi padre os hirió con azotes, mas yo os heriré con escorpiones.
1KI.12.15	12	15	Wherefore the king hearkened not unto the people; for the cause was from the LORD, that he might perform his saying, which the LORD spake by Ahijah the Shilonite unto Jeroboam the son of Nebat.	0.0	neutral	Y no oyó el rey al pueblo; porque era ordenación de Jehová, para confirmar su palabra, que Jehová había hablado por medio de Ahías Silonita á Jeroboam hijo de Nabat.
1KI.12.16	12	16	So when all Israel saw that the king hearkened not unto them, the people answered the king, saying, What portion have we in David? neither {have we} inheritance in the son of Jesse: to your tents, O Israel: now see to thine own house, David. So Israel departed unto their tents.	0.6	positive	Y cuando todo el pueblo vió que el rey no les había oído, respondióle estas palabras, diciendo: ¿Qué parte tenemos nosotros con David? No tenemos heredad en el hijo de Isaí. ¡Israel, á tus estancias! ¡Provee ahora en tu casa, David! Entonces Israel se fué á sus estancias.
1KI.12.17	12	17	But {as for} the children of Israel which dwelt in the cities of Judah, Rehoboam reigned over them.	0.0	neutral	Mas reinó Roboam sobre los hijos de Israel que moraban en las ciudades de Judá.
1KI.12.18	12	18	Then king Rehoboam sent Adoram, who {was} over the tribute; and all Israel stoned him with stones, that he died. Therefore king Rehoboam made speed to get him up to his chariot, to flee to Jerusalem. {made...: Heb. strengthened himself}	0.0	neutral	Y el rey Roboam envió á Adoram, que estaba sobre los tributos; pero apedreóle todo Israel, y murió. Entonces el rey Roboam se esforzó á subir en un carro, y huir á Jerusalem.
1KI.12.19	12	19	So Israel rebelled against the house of David unto this day. {rebelled: or, fell away}	0.0	neutral	Así se apartó Israel de la casa de David hasta hoy.
1KI.12.20	12	20	And it came to pass, when all Israel heard that Jeroboam was come again, that they sent and called him unto the congregation, and made him king over all Israel: there was none that followed the house of David, but the tribe of Judah only.	0.0	neutral	Y aconteció, que oyendo todo Israel que Jeroboam había vuelto, enviaron y llamáronle á la congregación, é hiciéronle rey sobre todo Israel, sin quedar tribu alguna que siguiese la casa de David, sino sólo la tribu de Judá.
1KI.12.21	12	21	And when Rehoboam was come to Jerusalem, he assembled all the house of Judah, with the tribe of Benjamin, an hundred and fourscore thousand chosen men, which were warriors, to fight against the house of Israel, to bring the kingdom again to Rehoboam the son of Solomon.	0.0	neutral	Y como Roboam vino á Jerusalem, juntó toda la casa de Judá y la tribu de Benjamín, ciento y ochenta mil hombres escogidos de guerra, para hacer guerra á la casa de Israel, y reducir el reino á Roboam hijo de Salomón.
1KI.12.22	12	22	But the word of God came unto Shemaiah the man of God, saying,	0.0	neutral	Mas fué palabra de Jehová á Semeías varón de Dios, diciendo:
1KI.12.23	12	23	Speak unto Rehoboam, the son of Solomon, king of Judah, and unto all the house of Judah and Benjamin, and to the remnant of the people, saying,	0.0	neutral	Habla á Roboam hijo de Salomón, rey de Judá, y á toda la casa de Judá y de Benjamín, y á los demás del pueblo, diciendo:
1KI.12.24	12	24	Thus saith the LORD, Ye shall not go up, nor fight against your brethren the children of Israel: return every man to his house; for this thing is from me. They hearkened therefore to the word of the LORD, and returned to depart, according to the word of the LORD.	0.0	neutral	Así ha dicho Jehová: No vayáis, ni peleéis contra vuestros hermanos los hijos de Israel; volveos cada uno á su casa; porque este negocio yo lo he hecho. Y ellos oyeron la palabra de Dios, y volviéronse, y fuéronse, conforme á la palabra de Jehová.
1KI.12.25	12	25	Then Jeroboam built Shechem in mount Ephraim, and dwelt therein; and went out from thence, and built Penuel.	0.0	neutral	Y reedificó Jeroboam á Sichêm en el monte de Ephraim, y habitó en ella; y saliendo de allí, reedificó á Penuel.
1KI.12.26	12	26	And Jeroboam said in his heart, Now shall the kingdom return to the house of David:	0.0	neutral	Y dijo Jeroboam en su corazón: Ahora se volverá el reino á la casa de David,
1KI.12.27	12	27	If this people go up to do sacrifice in the house of the LORD at Jerusalem, then shall the heart of this people turn again unto their lord, {even} unto Rehoboam king of Judah, and they shall kill me, and go again to Rehoboam king of Judah.	0.0	neutral	Si este pueblo subiere á sacrificar á la casa de Jehová en Jerusalem: porque el corazón de este pueblo se convertirá á su señor Roboam rey de Judá, y me matarán á mí, y se tornarán á Roboam rey de Judá.
1KI.12.28	12	28	Whereupon the king took counsel, and made two calves {of} gold, and said unto them, It is too much for you to go up to Jerusalem: behold thy gods, O Israel, which brought thee up out of the land of Egypt.	0.2	positive	Y habido consejo, hizo el rey dos becerros de oro, y dijo al pueblo: Harto habéis subido á Jerusalem: he aquí tus dioses, oh Israel, que te hicieron subir de la tierra de Egipto.
1KI.12.29	12	29	And he set the one in Bethel, and the other put he in Dan.	-0.125	negative	Y puso el uno en Beth-el, y el otro puso en Dan.
1KI.12.30	12	30	And this thing became a sin: for the people went {to worship} before the one, {even} unto Dan.	0.0	neutral	Y esto fué ocasión de pecado; porque el pueblo iba á adorar delante del uno, hasta Dan.
1KI.12.31	12	31	And he made an house of high places, and made priests of the lowest of the people, which were not of the sons of Levi.	0.16	positive	Hizo también casa de altos, é hizo sacerdotes de la clase del pueblo, que no eran de los hijos de Leví.
1KI.12.32	12	32	And Jeroboam ordained a feast in the eighth month, on the fifteenth day of the month, like unto the feast that {is} in Judah, and he offered upon the altar. So did he in Bethel, sacrificing unto the calves that he had made: and he placed in Bethel the priests of the high places which he had made. {offered...: or, went up to the altar, etc} {sacrificing: or, to sacrifice}	0.16	positive	Entonces instituyó Jeroboam solemnidad en el mes octavo, á los quince del mes, conforme á la solemnidad que se celebraba en Judá; y sacrificó sobre altar. Así hizo en Beth-el, sacrificando á los becerros que había hecho. Ordenó también en Beth-el sacerdotes de los altos que él había fabricado.
1KI.12.33	12	33	So he offered upon the altar which he had made in Bethel the fifteenth day of the eighth month, {even} in the month which he had devised of his own heart; and ordained a feast unto the children of Israel: and he offered upon the altar, and burnt incense. {offered...: or, went up to the altar, etc} {and burnt...: Heb. to burn incense}	0.6	positive	Sacrificó pues sobre el altar que él había hecho en Beth-el, á los quince del mes octavo, el mes que él había inventado de su corazón; é hizo fiesta á los hijos de Israel, y subió al altar para quemar perfumes.
1KI.13.1	13	1	And, behold, there came a man of God out of Judah by the word of the LORD unto Bethel: and Jeroboam stood by the altar to burn incense. {burn: or, offer}	0.0	neutral	Y HE aquí que un varón de Dios por palabra de Jehová vino de Judá á Beth-el; y estando Jeroboam al altar para quemar perfumes,
1KI.13.2	13	2	And he cried against the altar in the word of the LORD, and said, O altar, altar, thus saith the LORD; Behold, a child shall be born unto the house of David, Josiah by name; and upon thee shall he offer the priests of the high places that burn incense upon thee, and men's bones shall be burnt upon thee.	0.16	positive	El clamó contra el altar por palabra de Jehová, y dijo: Altar, altar, así ha dicho Jehová: He aquí que á la casa de David nacerá un hijo, llamado Josías, el cual sacrificará sobre ti á los sacerdotes de los altos que queman sobre ti perfumes; y sobre ti quemarán huesos de hombres.
1KI.13.3	13	3	And he gave a sign the same day, saying, This {is} the sign which the LORD hath spoken; Behold, the altar shall be rent, and the ashes that {are} upon it shall be poured out.	0.0	neutral	Y aquel mismo día dió una señal, diciendo: Esta es la señal de que Jehová ha hablado: he aquí que el altar se quebrará, y la ceniza que sobre él está se derramará.
1KI.13.4	13	4	And it came to pass, when king Jeroboam heard the saying of the man of God, which had cried against the altar in Bethel, that he put forth his hand from the altar, saying, Lay hold on him. And his hand, which he put forth against him, dried up, so that he could not pull it in again to him.	-0.2	negative	Y como el rey Jeroboam oyó la palabra del varón de Dios, que había clamado contra el altar de Beth-el, extendiendo su mano desde el altar, dijo: ¡Prendedle! Mas la mano que había extendido contra él, se le secó, que no la pudo tornar á sí.
1KI.13.5	13	5	The altar also was rent, and the ashes poured out from the altar, according to the sign which the man of God had given by the word of the LORD.	0.0	neutral	Y el altar se rompió, y derramóse la ceniza del altar, conforme á la señal que el varón de Dios había dado por palabra de Jehová.
1KI.13.6	13	6	And the king answered and said unto the man of God, Intreat now the face of the LORD thy God, and pray for me, that my hand may be restored me again. And the man of God besought the LORD, and the king's hand was restored him again, and became as {it was} before. {the LORD, and: Heb. the face of the LORD, etc}	0.0	neutral	Entonces respondiendo el rey, dijo al varón de Dios: Te pido que ruegues á la faz de Jehová tu Dios, y ora por mí, que mi mano me sea restituída. Y el varón de Dios oró á la faz de Jehová, y la mano del rey se le recuperó y tornóse como antes.
1KI.13.7	13	7	And the king said unto the man of God, Come home with me, and refresh thyself, and I will give thee a reward.	0.0	neutral	Y el rey dijo al varón de Dios: Ven conmigo á casa, y comerás, y yo te daré un presente.
1KI.13.8	13	8	And the man of God said unto the king, If thou wilt give me half thine house, I will not go in with thee, neither will I eat bread nor drink water in this place:	-0.1667	negative	Mas el varón de Dios dijo al rey: Si me dieses la mitad de tu casa, no iría contigo, ni comería pan ni bebería agua en este lugar;
1KI.13.9	13	9	For so was it charged me by the word of the LORD, saying, Eat no bread, nor drink water, nor turn again by the same way that thou camest.	0.0	neutral	Porque así me está mandado por palabra de Jehová, diciendo: No comas pan, ni bebas agua, ni vuelvas por el camino que fueres.
1KI.13.10	13	10	So he went another way, and returned not by the way that he came to Bethel.	0.0	neutral	Fuése pues por otro camino, y no volvió por el camino por donde había venido á Beth-el.
1KI.13.11	13	11	Now there dwelt an old prophet in Bethel; and his sons came and told him all the works that the man of God had done that day in Bethel: the words which he had spoken unto the king, them they told also to their father.	0.1	neutral	Moraba á la sazón en Beth-el un viejo profeta, al cual vino su hijo, y contóle todo lo que el varón de Dios había hecho aquel día en Beth-el: contáronle también á su padre las palabras que había hablado al rey.
1KI.13.12	13	12	And their father said unto them, What way went he? For his sons had seen what way the man of God went, which came from Judah.	0.0	neutral	Y su padre les dijo: ¿Por qué camino fué? Y sus hijos le mostraron el camino por donde se había tornado el varón de Dios, que había venido de Judá.
1KI.13.13	13	13	And he said unto his sons, Saddle me the ass. So they saddled him the ass: and he rode thereon,	0.0	neutral	Y él dijo á sus hijos: Enalbardadme el asno. Y ellos le enalbardaron el asno, y subió en él.
1KI.13.14	13	14	And went after the man of God, and found him sitting under an oak: and he said unto him, {Art} thou the man of God that camest from Judah? And he said, I {am}.	0.0	neutral	Y yendo tras el varón de Dios, hallóle que estaba sentado debajo de un alcornoque: y díjole: ¿Eres tú el varón de Dios que viniste de Judá? Y él dijo: Yo soy.
1KI.13.15	13	15	Then he said unto him, Come home with me, and eat bread.	0.0	neutral	Díjole entonces: Ven conmigo á casa, y come del pan.
1KI.13.16	13	16	And he said, I may not return with thee, nor go in with thee: neither will I eat bread nor drink water with thee in this place:	0.0	neutral	Mas él respondió: No podré volver contigo, ni iré contigo; ni tampoco comeré pan ni beberé agua contigo en este lugar;
1KI.13.17	13	17	For it was said to me by the word of the LORD, Thou shalt eat no bread nor drink water there, nor turn again to go by the way that thou camest. {it...: Heb. a word was}	0.0	neutral	Porque por palabra de Dios me ha sido dicho: No comas pan ni bebas agua allí, ni vuelvas por el camino que fueres.
1KI.13.18	13	18	He said unto him, I {am} a prophet also as thou {art}; and an angel spake unto me by the word of the LORD, saying, Bring him back with thee into thine house, that he may eat bread and drink water. {But} he lied unto him.	0.0	neutral	Y el otro le dijo: Yo también soy profeta como tú, y un ángel me ha hablado por palabra de Jehová, diciendo: Vuélvele contigo á tu casa, para que coma pan y beba agua. Empero mintióle.
1KI.13.19	13	19	So he went back with him, and did eat bread in his house, and drank water.	0.0	neutral	Entonces volvió con él, y comió del pan en su casa, y bebió del agua.
1KI.13.20	13	20	And it came to pass, as they sat at the table, that the word of the LORD came unto the prophet that brought him back:	0.0	neutral	Y aconteció que, estando ellos á la mesa, fué palabra de Jehová al profeta que le había hecho volver;
1KI.13.21	13	21	And he cried unto the man of God that came from Judah, saying, Thus saith the LORD, Forasmuch as thou hast disobeyed the mouth of the LORD, and hast not kept the commandment which the LORD thy God commanded thee,	0.0	neutral	Y clamó al varón de Dios que había venido de Judá, diciendo: Así dijo Jehová: Por cuanto has sido rebelde al dicho de Jehová, y no guardaste el mandamiento que Jehová tu Dios te había prescrito,
1KI.13.22	13	22	But camest back, and hast eaten bread and drunk water in the place, of the which {the LORD} did say to thee, Eat no bread, and drink no water; thy carcase shall not come unto the sepulchre of thy fathers.	-0.25	negative	Sino que volviste, y comiste del pan y bebiste del agua en el lugar donde Jehová te había dicho no comieses pan ni bebieses agua, no entrará tu cuerpo en el sepulcro de tus padres.
1KI.13.23	13	23	And it came to pass, after he had eaten bread, and after he had drunk, that he saddled for him the ass, {to wit}, for the prophet whom he had brought back.	-0.25	negative	Y como hubo comido del pan y bebido, el profeta que le había hecho volver le enalbardó un asno;
1KI.13.24	13	24	And when he was gone, a lion met him by the way, and slew him: and his carcase was cast in the way, and the ass stood by it, the lion also stood by the carcase.	0.0	neutral	Y yéndose, topóle un león en el camino, y matóle; y su cuerpo estaba echado en el camino, y el asno estaba junto á él, y el león también estaba junto al cuerpo.
1KI.13.25	13	25	And, behold, men passed by, and saw the carcase cast in the way, and the lion standing by the carcase: and they came and told {it} in the city where the old prophet dwelt.	0.1	neutral	Y he aquí unos que pasaban, y vieron el cuerpo que estaba echado en el camino, y el león que estaba junto al cuerpo: y vinieron, y dijéronlo en la ciudad donde el viejo profeta habitaba.
1KI.13.26	13	26	And when the prophet that brought him back from the way heard {thereof}, he said, It {is} the man of God, who was disobedient unto the word of the LORD: therefore the LORD hath delivered him unto the lion, which hath torn him, and slain him, according to the word of the LORD, which he spake unto him. {torn: Heb. broken}	-0.2	negative	Y oyéndolo el profeta que le había vuelto del camino, dijo: El varón de Dios es, que fué rebelde al dicho de Jehová: por tanto Jehová le ha entregado al león, que le ha quebrantado y muerto, conforme á la palabra de Jehová que él le dijo.
1KI.13.27	13	27	And he spake to his sons, saying, Saddle me the ass. And they saddled {him}.	0.0	neutral	Y habló á sus hijos, y díjoles: Enalbardadme un asno. Y ellos se lo enalbardaron.
1KI.13.28	13	28	And he went and found his carcase cast in the way, and the ass and the lion standing by the carcase: the lion had not eaten the carcase, nor torn the ass. {torn: Heb. broken}	-0.4	negative	Y él fué, y halló su cuerpo tendido en el camino, y el asno y el león estaban junto al cuerpo: el león no había comido el cuerpo, ni dañado al asno.
1KI.13.29	13	29	And the prophet took up the carcase of the man of God, and laid it upon the ass, and brought it back: and the old prophet came to the city, to mourn and to bury him.	0.05	neutral	Y tomando el profeta el cuerpo del varón de Dios, púsolo sobre el asno, y llevóselo. Y el profeta viejo vino á la ciudad, para endecharle y enterrarle.
1KI.13.30	13	30	And he laid his carcase in his own grave; and they mourned over him, {saying}, Alas, my brother!	0.05	neutral	Y puso su cuerpo en su sepulcro; y endecháronle, diciendo: ¡Ay, hermano mío!
1KI.13.31	13	31	And it came to pass, after he had buried him, that he spake to his sons, saying, When I am dead, then bury me in the sepulchre wherein the man of God {is} buried; lay my bones beside his bones:	-0.2	negative	Y después que le hubieron enterrado, habló á sus hijos, diciendo: Cuando yo muriere, enterradme en el sepulcro en que está sepultado el varón de Dios; poned mis huesos junto á los suyos.
1KI.13.32	13	32	For the saying which he cried by the word of the LORD against the altar in Bethel, and against all the houses of the high places which {are} in the cities of Samaria, shall surely come to pass.	0.33	positive	Porque sin duda vendrá lo que él dijo á voces por palabra de Jehová contra el altar que está en Beth-el, y contra todas las casas de los altos que están en las ciudades de Samaria.
1KI.13.33	13	33	After this thing Jeroboam returned not from his evil way, but made again of the lowest of the people priests of the high places: whosoever would, he consecrated him, and he became {one} of the priests of the high places. {made...: Heb. returned and made} {consecrated...: Heb. filled his hand}	0.02	neutral	Después de esto no se tornó Jeroboam de su mal camino: antes volvió á hacer sacerdotes de los altos de la clase del pueblo, y quien quería se consagraba, y era de los sacerdotes de los altos.
1KI.13.34	13	34	And this thing became sin unto the house of Jeroboam, even to cut {it} off, and to destroy {it} from off the face of the earth.	-0.2	negative	Y esto fué causa de pecado á la casa de Jeroboam; por lo cual fué cortada y raída de sobre la haz de la tierra.
1KI.14.1	14	1	At that time Abijah the son of Jeroboam fell sick.	-0.7143	negative	EN aquel tiempo Abías hijo de Jeroboam cayó enfermo,
1KI.14.2	14	2	And Jeroboam said to his wife, Arise, I pray thee, and disguise thyself, that thou be not known to be the wife of Jeroboam; and get thee to Shiloh: behold, there {is} Ahijah the prophet, which told me that {I should be} king over this people.	0.0	neutral	Y dijo Jeroboam á su mujer: Levántate ahora, disfrázate, porque no te conozcan que eres la mujer de Jeroboam, y ve á Silo; que allá está Ahías profeta, el que me dijo que yo había de ser rey sobre este pueblo.
1KI.14.3	14	3	And take with thee ten loaves, and cracknels, and a cruse of honey, and go to him: he shall tell thee what shall become of the child. {with...: Heb. in thine hand} {cracknels: or, cakes} {cruse: or, bottle}	0.0	neutral	Y toma en tu mano diez panes, y turrones, y una botija de miel, y ve á él; que te declare lo que ha de ser de este mozo.
1KI.14.4	14	4	And Jeroboam's wife did so, and arose, and went to Shiloh, and came to the house of Ahijah. But Ahijah could not see; for his eyes were set by reason of his age. {were...: Heb. stood for his hoariness}	0.0	neutral	Y la mujer de Jeroboam hízolo así; y levantóse, y fué á Silo, y vino á casa de Ahías. Y no podía ya ver Ahías, que sus ojos se habían oscurecido á causa de su vejez.
1KI.14.5	14	5	And the LORD said unto Ahijah, Behold, the wife of Jeroboam cometh to ask a thing of thee for her son; for he {is} sick: thus and thus shalt thou say unto her: for it shall be, when she cometh in, that she shall feign herself {to be} another {woman}.	-0.7143	negative	Mas Jehová había dicho á Ahías: He aquí que la mujer de Jeroboam vendrá á consultarte por su hijo, que está enfermo: así y así le has de responder; pues será que cuando ella viniere, vendrá disimulada.
1KI.14.6	14	6	And it was {so}, when Ahijah heard the sound of her feet, as she came in at the door, that he said, Come in, thou wife of Jeroboam; why feignest thou thyself {to be} another? for I {am} sent to thee {with} heavy {tidings}. {heavy: Heb. hard}	-0.0729	neutral	Y como Ahías oyó el sonido de sus pies cuando entraba por la puerta, dijo: Entra, mujer de Jeroboam; ¿por qué te finges otra? empero yo soy enviado á ti con revelación dura.
1KI.14.7	14	7	Go, tell Jeroboam, Thus saith the LORD God of Israel, Forasmuch as I exalted thee from among the people, and made thee prince over my people Israel,	0.0	neutral	Ve, y di á Jeroboam: Así dijo Jehová Dios de Israel: Por cuanto yo te levanté de en medio del pueblo, y te hice príncipe sobre mi pueblo Israel,
1KI.14.8	14	8	And rent the kingdom away from the house of David, and gave it thee: and {yet} thou hast not been as my servant David, who kept my commandments, and who followed me with all his heart, to do {that} only {which was} right in mine eyes;	0.1429	positive	Y rompí el reino de la casa de David, y te lo entregué á ti; y tú no has sido como David mi siervo, que guardó mis mandamientos y anduvo en pos de mí con todo su corazón, haciendo solamente lo derecho delante de mis ojos;
1KI.14.9	14	9	But hast done evil above all that were before thee: for thou hast gone and made thee other gods, and molten images, to provoke me to anger, and hast cast me behind thy back:	-0.3708	negative	Antes hiciste lo malo sobre todos los que han sido antes de ti: que fuiste y te hiciste dioses ajenos y de fundición para enojarme, y á mí me echaste tras tus espaldas:
1KI.14.10	14	10	Therefore, behold, I will bring evil upon the house of Jeroboam, and will cut off from Jeroboam him that pisseth against the wall, {and} him that is shut up and left in Israel, and will take away the remnant of the house of Jeroboam, as a man taketh away dung, till it be all gone.	-0.5	negative	Por tanto, he aquí que yo traigo mal sobre la casa de Jeroboam, y yo talaré de Jeroboam todo meante á la pared, así el guardado como el desamparado en Israel; y barreré la posteridad de la casa de Jeroboam, como es barrido el estiércol, hasta que sea acabada.
1KI.14.11	14	11	Him that dieth of Jeroboam in the city shall the dogs eat; and him that dieth in the field shall the fowls of the air eat: for the LORD hath spoken {it}.	0.0	neutral	El que muriere de los de Jeroboam en la ciudad, le comerán los perros; y el que muriere en el campo, comerlo han las aves del cielo; porque Jehová lo ha dicho.
1KI.14.12	14	12	Arise thou therefore, get thee to thine own house: {and} when thy feet enter into the city, the child shall die.	-0.075	neutral	Y tú levántate, y vete á tu casa; que en entrando tu pie en la ciudad, morirá el mozo.
1KI.14.13	14	13	And all Israel shall mourn for him, and bury him: for he only of Jeroboam shall come to the grave, because in him there is found {some} good thing toward the LORD God of Israel in the house of Jeroboam.	0.35	positive	Y todo Israel lo endechará, y le enterrarán; porque sólo él de los de Jeroboam entrará en sepultura; por cuanto se ha hallado en él alguna cosa buena de Jehová Dios de Israel, en la casa de Jeroboam.
1KI.14.14	14	14	Moreover the LORD shall raise him up a king over Israel, who shall cut off the house of Jeroboam that day: but what? even now.	0.0	neutral	Y Jehová se levantará un rey sobre Israel, el cual talará la casa de Jeroboam en este día; ¿y qué, si ahora?
