verse_id	chapter	verse	text_en	polarity_en	label_en	text_es
1KI.21.10	21	10	And set two men, sons of Belial, before him, to bear witness against him, saying, Thou didst blaspheme God and the king. And {then} carry him out, and stone him, that he may die.	0.0	neutral	Y poned dos hombres perversos delante de él, que atestigüen contra él, y digan: Tú has blasfemado á Dios y al rey. Y entonces sacadlo, y apedreadlo, y muera.
1KI.21.11	21	11	And the men of his city, {even} the elders and the nobles who were the inhabitants in his city, did as Jezebel had sent unto them, {and} as it {was} written in the letters which she had sent unto them.	0.0	neutral	Y los de su ciudad, los ancianos y los principales que moraban en su ciudad, lo hicieron como Jezabel les mandó, conforme á lo escrito en las cartas que ella les había enviado.
1KI.21.12	21	12	They proclaimed a fast, and set Naboth on high among the people.	0.18	positive	Y promulgaron ayuno, y asentaron á Naboth á la cabecera del pueblo.
1KI.21.13	21	13	And there came in two men, children of Belial, and sat before him: and the men of Belial witnessed against him, {even} against Naboth, in the presence of the people, saying, Naboth did blaspheme God and the king. Then they carried him forth out of the city, and stoned him with stones, that he died.	0.0	neutral	Vinieron entonces dos hombres perversos, y sentáronse delante de él: y aquellos hombres de Belial atestiguaron contra Naboth delante del pueblo, diciendo: Naboth ha blasfemado á Dios y al rey. Y sacáronlo fuera de la ciudad, y apedreáronlo con piedras, y murió.
1KI.21.14	21	14	Then they sent to Jezebel, saying, Naboth is stoned, and is dead.	-0.2	negative	Después enviaron á decir á Jezabel: Naboth ha sido apedreado y muerto.
1KI.21.15	21	15	And it came to pass, when Jezebel heard that Naboth was stoned, and was dead, that Jezebel said to Ahab, Arise, take possession of the vineyard of Naboth the Jezreelite, which he refused to give thee for money: for Naboth is not alive, but dead.	-0.15	negative	Y como Jezabel oyó que Naboth había sido apedreado y muerto, dijo á Achâb: Levántate y posee la viña de Naboth de Jezreel, que no te la quiso dar por dinero; porque Naboth no vive, sino que es muerto.
1KI.21.16	21	16	And it came to pass, when Ahab heard that Naboth was dead, that Ahab rose up to go down to the vineyard of Naboth the Jezreelite, to take possession of it.	0.0815	neutral	Y oyendo Achâb que Naboth era muerto, levantóse para descender á la viña de Naboth de Jezreel, para tomar posesión de ella.
1KI.21.17	21	17	And the word of the LORD came to Elijah the Tishbite, saying,	0.0	neutral	Entonces fué palabra de Jehová á Elías Thisbita, diciendo:
1KI.21.18	21	18	Arise, go down to meet Ahab king of Israel, which {is} in Samaria: behold, {he is} in the vineyard of Naboth, whither he is gone down to possess it.	-0.1556	negative	Levántate, desciende á encontrarte con Achâb rey de Israel, que está en Samaria: he aquí él está en la viña de Naboth, á la cual ha descendido para tomar posesión de ella.
1KI.21.19	21	19	And thou shalt speak unto him, saying, Thus saith the LORD, Hast thou killed, and also taken possession? And thou shalt speak unto him, saying, Thus saith the LORD, In the place where dogs licked the blood of Naboth shall dogs lick thy blood, even thine.	-0.2	negative	Y hablarle has, diciendo: Así ha dicho Jehová: ¿No mataste y también has poseído? Y tornarás á hablarle, diciendo: Así ha dicho Jehová: En el mismo lugar donde lamieron los perros la sangre de Naboth, los perros lamerán también tu sangre, la tuya misma.
1KI.21.20	21	20	And Ahab said to Elijah, Hast thou found me, O mine enemy? And he answered, I have found {thee}: because thou hast sold thyself to work evil in the sight of the LORD.	-1.0	negative	Y Achâb dijo á Elías: ¿Me has hallado, enemigo mío? Y él respondió: Hete encontrado, porque te has vendido á mal hacer delante de Jehová.
1KI.21.21	21	21	Behold, I will bring evil upon thee, and will take away thy posterity, and will cut off from Ahab him that pisseth against the wall, and him that is shut up and left in Israel,	-0.5	negative	He aquí yo traigo mal sobre ti, y barreré tu posteridad, y talaré de Achâb todo meante á la pared, al guardado y al desamparado en Israel:
1KI.21.22	21	22	And will make thine house like the house of Jeroboam the son of Nebat, and like the house of Baasha the son of Ahijah, for the provocation wherewith thou hast provoked {me} to anger, and made Israel to sin.	-0.7	negative	Y yo pondré tu casa como la casa de Jeroboam hijo de Nabat, y como la casa de Baasa hijo de Ahía; por la provocación con que me provocaste á ira, y con que has hecho pecar á Israel.
1KI.21.23	21	23	And of Jezebel also spake the LORD, saying, The dogs shall eat Jezebel by the wall of Jezreel. {wall: or, ditch}	0.0	neutral	De Jezabel también ha hablado Jehová, diciendo: Los perros comerán á Jezabel en la barbacana de Jezreel.
1KI.21.24	21	24	Him that dieth of Ahab in the city the dogs shall eat; and him that dieth in the field shall the fowls of the air eat.	0.0	neutral	El que de Achâb fuere muerto en la ciudad, perros le comerán: y el que fuere muerto en el campo, comerlo han las aves del cielo.
1KI.21.25	21	25	But there was none like unto Ahab, which did sell himself to work wickedness in the sight of the LORD, whom Jezebel his wife stirred up. {stirred...: or, incited}	0.0	neutral	(A la verdad ninguno fué como Achâb, que se vendiese á hacer lo malo á los ojos de Jehová; porque Jezabel su mujer lo incitaba.
1KI.21.26	21	26	And he did very abominably in following idols, according to all {things} as did the Amorites, whom the LORD cast out before the children of Israel.	0.1	neutral	El fué en grande manera abominable, caminando en pos de los ídolos, conforme á todo lo que hicieron los Amorrheos, á los cuales lanzó Jehová delante de los hijos de Israel.)
1KI.21.27	21	27	And it came to pass, when Ahab heard those words, that he rent his clothes, and put sackcloth upon his flesh, and fasted, and lay in sackcloth, and went softly.	0.1	neutral	Y acaeció cuando Achâb oyó estas palabras, que rasgó sus vestidos, y puso saco sobre su carne, y ayunó, y durmió en saco, y anduvo humillado.
1KI.21.28	21	28	And the word of the LORD came to Elijah the Tishbite, saying,	0.0	neutral	Entonces fué palabra de Jehová á Elías Thisbita, diciendo:
1KI.21.29	21	29	Seest thou how Ahab humbleth himself before me? because he humbleth himself before me, I will not bring the evil in his days: {but} in his son's days will I bring the evil upon his house.	-0.9167	negative	¿No has visto como Achâb se ha humillado delante de mí? Pues por cuanto se ha humillado delante de mí, no traeré el mal en sus días: en los días de su hijo traeré el mal sobre su casa.
1KI.22.1	22	1	And they continued three years without war between Syria and Israel.	0.0	neutral	TRES años pasaron sin guerra entre los Siros é Israel.
1KI.22.2	22	2	And it came to pass in the third year, that Jehoshaphat the king of Judah came down to the king of Israel.	-0.0778	neutral	Y aconteció al tercer año, que Josaphat rey de Judá descendió al rey de Israel.
1KI.22.3	22	3	And the king of Israel said unto his servants, Know ye that Ramoth in Gilead {is} ours, and we {be} still, {and} take it not out of the hand of the king of Syria? {still...: Heb. silent from taking it}	0.0	neutral	Y el rey de Israel dijo á sus siervos: ¿No sabéis que es nuestra Ramoth de Galaad? y nosotros callamos en orden á tomarla de mano del rey de Siria.
1KI.22.4	22	4	And he said unto Jehoshaphat, Wilt thou go with me to battle to Ramothgilead? And Jehoshaphat said to the king of Israel, I {am} as thou {art}, my people as thy people, my horses as thy horses.	0.0	neutral	Y dijo á Josaphat: ¿Quieres venir conmigo á pelear contra Ramoth de Galaad? Y Josaphat respondió al rey de Israel: Como yo, así tú; y como mi pueblo, así tu pueblo; y como mis caballos, tus caballos.
1KI.22.5	22	5	And Jehoshaphat said unto the king of Israel, Enquire, I pray thee, at the word of the LORD to day.	0.0	neutral	Y dijo luego Josaphat al rey de Israel: Yo te ruego que consultes hoy la palabra de Jehová.
1KI.22.6	22	6	Then the king of Israel gathered the prophets together, about four hundred men, and said unto them, Shall I go against Ramothgilead to battle, or shall I forbear? And they said, Go up; for the Lord shall deliver {it} into the hand of the king.	0.0	neutral	Entonces el rey de Israel juntó los profetas, como cuatrocientos hombres, á los cuales dijo: ¿Iré á la guerra contra Ramoth de Galaad, ó la dejaré? Y ellos dijeron: Sube; porque el Señor la entregará en mano del rey.
1KI.22.7	22	7	And Jehoshaphat said, {Is there} not here a prophet of the LORD besides, that we might enquire of him?	0.0	neutral	Y dijo Josaphat: ¿Hay aún aquí algún profeta de Jehová, por el cual consultemos?
1KI.22.8	22	8	And the king of Israel said unto Jehoshaphat, {There is} yet one man, Micaiah the son of Imlah, by whom we may enquire of the LORD: but I hate him; for he doth not prophesy good concerning me, but evil. And Jehoshaphat said, Let not the king say so.	-0.3667	negative	Y el rey de Israel respondió á Josaphat: Aun hay un varón por el cual podríamos consultar á Jehová, Michêas, hijo de Imla: mas yo le aborrezco porque nunca me profetiza bien, sino solamente mal. Y Josaphat dijo: No hable el rey así.
1KI.22.9	22	9	Then the king of Israel called an officer, and said, Hasten {hither} Micaiah the son of Imlah. {officer: or, eunuch}	0.0	neutral	Entonces el rey de Israel llamó á un eunuco, y díjole: trae presto á Michêas hijo de Imla.
1KI.22.10	22	10	And the king of Israel and Jehoshaphat the king of Judah sat each on his throne, having put on their robes, in a void place in the entrance of the gate of Samaria; and all the prophets prophesied before them. {void...: Heb. floor}	0.0	neutral	Y el rey de Israel y Josaphat rey de Judá estaban sentados cada uno en su silla, vestidos de sus ropas reales, en la plaza junto á la entrada de la puerta de Samaria; y todos los profetas profetizaban delante de ellos.
1KI.22.11	22	11	And Zedekiah the son of Chenaanah made him horns of iron: and he said, Thus saith the LORD, With these shalt thou push the Syrians, until thou have consumed them.	0.0	neutral	Y Sedechîas hijo de Chânaana se había hecho unos cuernos de hierro, y dijo: Así ha dicho Jehová: Con éstos acornearás á los Siros hasta acabarlos.
1KI.22.12	22	12	And all the prophets prophesied so, saying, Go up to Ramothgilead, and prosper: for the LORD shall deliver {it} into the king's hand.	0.0	neutral	Y todos los profetas profetizaban de la misma manera, diciendo: Sube á Ramoth de Galaad, y serás prosperado; que Jehová la dará en mano del rey.
1KI.22.13	22	13	And the messenger that was gone to call Micaiah spake unto him, saying, Behold now, the words of the prophets {declare} good unto the king with one mouth: let thy word, I pray thee, be like the word of one of them, and speak {that which is} good.	0.7	positive	Y el mensajero que había ido á llamar á Michêas, hablóle, diciendo: He aquí las palabras de los profetas á una boca anuncian al rey bien: sea ahora tu palabra conforme á la palabra de alguno de ellos, y anuncia bien.
1KI.22.14	22	14	And Micaiah said, {As} the LORD liveth, what the LORD saith unto me, that will I speak.	0.0	neutral	Y Michêas respondió: Vive Jehová, que lo que Jehová me hablare, eso diré.
1KI.22.15	22	15	So he came to the king. And the king said unto him, Micaiah, shall we go against Ramothgilead to battle, or shall we forbear? And he answered him, Go, and prosper: for the LORD shall deliver {it} into the hand of the king.	0.0	neutral	Vino pues al rey, y el rey le dijo: Michêas, ¿iremos á pelear contra Ramoth de Galaad, ó la dejaremos? Y él respondió: Sube, que serás prosperado, y Jehová la entregará en mano del rey.
1KI.22.16	22	16	And the king said unto him, How many times shall I adjure thee that thou tell me nothing but {that which is} true in the name of the LORD?	0.425	positive	Y el rey le dijo: ¿Hasta cuántas veces he de conjurarte que no me digas sino la verdad en el nombre de Jehová?
1KI.22.17	22	17	And he said, I saw all Israel scattered upon the hills, as sheep that have not a shepherd: and the LORD said, These have no master: let them return every man to his house in peace.	0.0	neutral	Entonces él dijo: Yo ví á todo Israel esparcido por los montes, como ovejas que no tienen pastor: y Jehová dijo: Estos no tienen señor: vuélvase cada uno á su casa en paz.
1KI.22.18	22	18	And the king of Israel said unto Jehoshaphat, Did I not tell thee that he would prophesy no good concerning me, but evil?	-0.675	negative	Y el rey de Israel dijo á Josaphat: ¿No te lo había yo dicho? Ninguna cosa buena profetizará él acerca de mí, sino solamente mal.
1KI.22.19	22	19	And he said, Hear thou therefore the word of the LORD: I saw the LORD sitting on his throne, and all the host of heaven standing by him on his right hand and on his left.	0.1429	positive	Entonces él dijo: Oye pues palabra de Jehová: Yo vi á Jehová sentado en su trono, y todo el ejército de los cielos estaba junto á él, á su diestra y á su siniestra.
1KI.22.20	22	20	And the LORD said, Who shall persuade Ahab, that he may go up and fall at Ramothgilead? And one said on this manner, and another said on that manner. {persuade: or, deceive}	0.0	neutral	Y Jehová dijo: ¿Quién inducirá á Achâb, para que suba y caiga en Ramoth de Galaad? Y uno decía de una manera; y otro decía de otra.
1KI.22.21	22	21	And there came forth a spirit, and stood before the LORD, and said, I will persuade him.	0.0	neutral	Y salió un espíritu, y púsose delante de Jehová, y dijo: Yo le induciré. Y Jehová le dijo: ¿De qué manera?
1KI.22.22	22	22	And the LORD said unto him, Wherewith? And he said, I will go forth, and I will be a lying spirit in the mouth of all his prophets. And he said, Thou shalt persuade {him}, and prevail also: go forth, and do so.	0.0	neutral	Y él dijo: Yo saldré, y seré espíritu de mentira en boca de todos sus profetas. Y él dijo: inducirlo has, y aun saldrás con ello; sal pues, y hazlo así.
1KI.22.23	22	23	Now therefore, behold, the LORD hath put a lying spirit in the mouth of all these thy prophets, and the LORD hath spoken evil concerning thee.	-1.0	negative	Y ahora, he aquí Jehová ha puesto espíritu de mentira en la boca de todos estos tus profetas, y Jehová ha decretado el mal acerca de ti.
1KI.22.24	22	24	But Zedekiah the son of Chenaanah went near, and smote Micaiah on the cheek, and said, Which way went the Spirit of the LORD from me to speak unto thee?	0.1	neutral	Llegándose entonces Sedechîas hijo de Chânaana, hirió á Michêas en la mejilla, diciendo: ¿Por dónde se fué de mí el espíritu de Jehová para hablarte á ti?
1KI.22.25	22	25	And Micaiah said, Behold, thou shalt see in that day, when thou shalt go into an inner chamber to hide thyself. {into...: or, from chamber to chamber: Heb. a chamber in a chamber}	0.0	neutral	Y Michêas respondió: He aquí tú lo verás en aquel día, cuando te irás metiendo de cámara en cámara por esconderte.
1KI.22.26	22	26	And the king of Israel said, Take Micaiah, and carry him back unto Amon the governor of the city, and to Joash the king's son;	0.0	neutral	Entonces el rey de Israel dijo: Toma á Michêas, y vuélvelo á Amón gobernador de la ciudad, y á Joas hijo del rey;
1KI.22.27	22	27	And say, Thus saith the king, Put this {fellow} in the prison, and feed him with bread of affliction and with water of affliction, until I come in peace.	0.0	neutral	Y dirás: Así ha dicho el rey: Echad á éste en la cárcel, y mantenedle con pan de angustia y con agua de aflicción, hasta que yo vuelva en paz.
1KI.22.28	22	28	And Micaiah said, If thou return at all in peace, the LORD hath not spoken by me. And he said, Hearken, O people, every one of you.	0.0	neutral	Y dijo Michêas: Si llegares á volver en paz, Jehová no ha hablado por mí. En seguida dijo: Oid, pueblos todos.
1KI.22.29	22	29	So the king of Israel and Jehoshaphat the king of Judah went up to Ramothgilead.	0.0	neutral	Subió pues el rey de Israel con Josaphat rey de Judá á Ramoth de Galaad.
1KI.22.30	22	30	And the king of Israel said unto Jehoshaphat, I will disguise myself, and enter into the battle; but put thou on thy robes. And the king of Israel disguised himself, and went into the battle. {I will...: or, when he was to disguise himself, and enter into the battle}	0.0	neutral	Y el rey de Israel dijo á Josaphat: Yo me disfrazaré, y entraré en la batalla: y tú vístete tus vestidos. Y el rey de Israel se disfrazó, y entró en la batalla.
1KI.22.31	22	31	But the king of Syria commanded his thirty and two captains that had rule over his chariots, saying, Fight neither with small nor great, save only with the king of Israel.	0.1833	positive	Mas el rey de Siria había mandado á sus treinta y dos capitanes de los carros, diciendo: No peleéis vosotros ni con grande ni con chico, sino sólo contra el rey de Israel.
1KI.22.32	22	32	And it came to pass, when the captains of the chariots saw Jehoshaphat, that they said, Surely it {is} the king of Israel. And they turned aside to fight against him: and Jehoshaphat cried out.	0.5	positive	Y como los capitanes de los carros vieron á Josaphat, dijeron: Ciertamente éste es el rey de Israel; y viniéronse á él para pelear con él; mas el rey Josaphat dió voces.
1KI.22.33	22	33	And it came to pass, when the captains of the chariots perceived that it {was} not the king of Israel, that they turned back from pursuing him.	0.0	neutral	Viendo entonces los capitanes de los carros que no era el rey de Israel, apartáronse de él.
1KI.22.34	22	34	And a {certain} man drew a bow at a venture, and smote the king of Israel between the joints of the harness: wherefore he said unto the driver of his chariot, Turn thine hand, and carry me out of the host; for I am wounded. {at a...: Heb. in his simplicity} {joints...: Heb. joints and the breastplate} {wounded: Heb. made sick}	-0.25	negative	Y un hombre disparando su arco á la ventura, hirió al rey de Israel por entre las junturas de la armadura; por lo que dijo él á su carretero: Toma la vuelta, y sácame del campo, que estoy herido.
1KI.22.35	22	35	And the battle increased that day: and the king was stayed up in his chariot against the Syrians, and died at even: and the blood ran out of the wound into the midst of the chariot. {increased: Heb. ascended} {midst: Heb. bosom}	0.0	neutral	Mas la batalla había arreciado aquel día, y el rey estuvo en su carro delante de los Siros, y á la tarde murió: y la sangre de la herida corría por el seno del carro.
1KI.22.36	22	36	And there went a proclamation throughout the host about the going down of the sun, saying, Every man to his city, and every man to his own country.	0.2222	positive	Y á puesta del sol salió un pregón por el campo, diciendo: ¡Cada uno á su ciudad, y cada cual á su tierra!
1KI.22.37	22	37	So the king died, and was brought to Samaria; and they buried the king in Samaria. {was brought: Heb. came}	0.0	neutral	Y murió pues el rey, y fué traído á Samaria; y sepultaron al rey en Samaria.
1KI.22.38	22	38	And {one} washed the chariot in the pool of Samaria; and the dogs licked up his blood; and they washed his armour; according unto the word of the LORD which he spake.	0.0	neutral	Y lavaron el carro en el estanque de Samaria; lavaron también sus armas; y los perros lamieron su sangre, conforme á la palabra de Jehová que había hablado.
1KI.22.39	22	39	Now the rest of the acts of Ahab, and all that he did, and the ivory house which he made, and all the cities that he built, {are} they not written in the book of the chronicles of the kings of Israel?	0.0	neutral	Lo demás de los hechos de Achâb, y todas las cosas que ejecutó, y la casa de marfil que hizo, y todas las ciudades que edificó, ¿no está escrito en el libro de las crónicas de los reyes de Israel?
1KI.22.40	22	40	So Ahab slept with his fathers; and Ahaziah his son reigned in his stead.	0.0	neutral	Y durmió Achâb con sus padres, y reinó en su lugar Ochôzías su hijo.
1KI.22.41	22	41	And Jehoshaphat the son of Asa began to reign over Judah in the fourth year of Ahab king of Israel.	0.0	neutral	Y Josaphat hijo de Asa comenzó á reinar sobre Judá en el cuarto año de Achâb rey de Israel.
1KI.22.42	22	42	Jehoshaphat {was} thirty and five years old when he began to reign; and he reigned twenty and five years in Jerusalem. And his mother's name {was} Azubah the daughter of Shilhi.	0.1	neutral	Y era Josaphat de treinta y cinco años cuando comenzó á reinar, y reinó veinticinco años en Jerusalem. El nombre de su madre fué Azuba hija de Silai.
1KI.22.43	22	43	And he walked in all the ways of Asa his father; he turned not aside from it, doing {that which was} right in the eyes of the LORD:	0.2857	positive	Y anduvo en todo el camino de Asa su padre, sin declinar de él, haciendo lo recto en los ojos de Jehová.
1KI.22.44	22	44	Nevertheless the high places were not taken away; {for} the people offered and burnt incense yet in the high places.	0.16	positive	(22-45) Y Josaphat hizo paz con el rey de Israel.
1KI.22.45	22	45	And Jehoshaphat made peace with the king of Israel.	0.0	neutral	(22-46) Lo demás de los hechos de Josaphat, y sus hazañas, y las guerras que hizo, ¿no está escrito en el libro de las crónicas de los reyes de Judá?
1KI.22.46	22	46	Now the rest of the acts of Jehoshaphat, and his might that he shewed, and how he warred, {are} they not written in the book of the chronicles of the kings of Judah?	0.0	neutral	(22-47) Barrió también de la tierra el resto de los sodomitas que habían quedado en el tiempo de su padre Asa.
1KI.22.47	22	47	And the remnant of the sodomites, which remained in the days of his father Asa, he took out of the land.	0.0	neutral	(22-48) No había entonces rey en Edom; presidente había en lugar de rey.
1KI.22.48	22	48	{There was} then no king in Edom: a deputy {was} king.	0.0	neutral	(22-49) Había Josaphat hecho navíos en Tharsis, los cuales habían de ir á Ophir por oro; mas no fueron, porque se rompieron en Ezion-geber.
1KI.22.49	22	49	Jehoshaphat made ships of Tharshish to go to Ophir for gold: but they went not; for the ships were broken at Eziongeber. {made...: or, had ten ships}	-0.2	negative	(22-50) Entonces Ochôzías hijo de Achâb dijo á Josaphat: Vayan mis siervos con los tuyos en los navíos. Mas Josaphat no quiso.
1KI.22.50	22	50	Then said Ahaziah the son of Ahab unto Jehoshaphat, Let my servants go with thy servants in the ships. But Jehoshaphat would not.	0.0	neutral	(22-51) Y durmió Josaphat con sus padres, y fué sepultado con sus padres en la ciudad de David su padre; y en su lugar reinó Joram su hijo.
1KI.22.51	22	51	And Jehoshaphat slept with his fathers, and was buried with his fathers in the city of David his father: and Jehoram his son reigned in his stead.	0.0	neutral	(22-52) Y Ochôzías hijo de Achâb comenzó á reinar sobre Israel en Samaria, el año diecisiete de Josaphat rey de Judá; y reinó dos años sobre Israel.
1KI.22.52	22	52	Ahaziah the son of Ahab began to reign over Israel in Samaria the seventeenth year of Jehoshaphat king of Judah, and reigned two years over Israel.	0.0	neutral	(22-53) E hizo lo malo en los ojos de Jehová, y anduvo en el camino de su padre, y en el camino de su madre, y en el camino de Jeroboam hijo de Nabat, que hizo pecar á Israel:
1KI.22.53	22	53	And he did evil in the sight of the LORD, and walked in the way of his father, and in the way of his mother, and in the way of Jeroboam the son of Nebat, who made Israel to sin:	-1.0	negative	(22-54) Porque sirvió á Baal, y lo adoró, y provocó á ira á Jehová Dios de Israel, conforme á todas las cosas que su padre había hecho.
