verse_id	chapter	verse	text_en	polarity_en	label_en	text_es
1KI.19.7	19	7	And the angel of the LORD came again the second time, and touched him, and said, Arise {and} eat; because the journey {is} too great for thee.	0.4	positive	Y volviendo el ángel de Jehová la segunda vez, tocóle, diciendo: Levántate, come: porque gran camino te resta.
1KI.19.8	19	8	And he arose, and did eat and drink, and went in the strength of that meat forty days and forty nights unto Horeb the mount of God.	0.0	neutral	Levantóse pues, y comió y bebió; y caminó con la fortaleza de aquella comida cuarenta días y cuarenta noches, hasta el monte de Dios, Horeb.
1KI.19.9	19	9	And he came thither unto a cave, and lodged there; and, behold, the word of the LORD {came} to him, and he said unto him, What doest thou here, Elijah?	0.0	neutral	Y allí se metió en una cueva, donde tuvo la noche. Y fué á él palabra de Jehová, el cual le dijo: ¿Qué haces aquí, Elías?
1KI.19.10	19	10	And he said, I have been very jealous for the LORD God of hosts: for the children of Israel have forsaken thy covenant, thrown down thine altars, and slain thy prophets with the sword; and I, {even} I only, am left; and they seek my life, to take it away.	0.0111	neutral	Y él respondió: Sentido he un vivo celo por Jehová Dios de los ejércitos; porque los hijos de Israel han dejado tu alianza, han derribado tus altares, y han muerto á cuchillo tus profetas: y yo solo he quedado, y me buscan para quitarme la vida.
1KI.19.11	19	11	And he said, Go forth, and stand upon the mount before the LORD. And, behold, the LORD passed by, and a great and strong wind rent the mountains, and brake in pieces the rocks before the LORD; {but} the LORD {was} not in the wind: and after the wind an earthquake; {but} the LORD {was} not in the earthquake:	0.6167	positive	Y él le dijo: Sal fuera, y ponte en el monte delante de Jehová. Y he aquí Jehová que pasaba, y un grande y poderoso viento que rompía los montes, y quebraba las peñas delante de Jehová: mas Jehová no estaba en el viento. Y tras el viento un terremoto: mas Jehová no estaba en el terremoto.
1KI.19.12	19	12	And after the earthquake a fire; {but} the LORD {was} not in the fire: and after the fire a still small voice.	-0.25	negative	Y tras el terremoto un fuego: mas Jehová no estaba en el fuego. Y tras el fuego un silvo apacible y delicado.
1KI.19.13	19	13	And it was {so}, when Elijah heard {it}, that he wrapped his face in his mantle, and went out, and stood in the entering in of the cave. And, behold, {there came} a voice unto him, and said, What doest thou here, Elijah?	0.0	neutral	Y cuando lo oyó Elías, cubrió su rostro con su manto, y salió, y paróse á la puerta de la cueva. Y he aquí llegó una voz á él, diciendo: ¿Qué haces aquí, Elías?
1KI.19.14	19	14	And he said, I have been very jealous for the LORD God of hosts: because the children of Israel have forsaken thy covenant, thrown down thine altars, and slain thy prophets with the sword; and I, {even} I only, am left; and they seek my life, to take it away.	0.0111	neutral	Y él respondió: Sentido he un vivo celo por Jehová Dios de los ejércitos; porque los hijos de Israel han dejado tu alianza, han derribado tus altares, y han muerto á cuchillo tus profetas: y yo solo he quedado, y me buscan para quitarme la vida.
1KI.19.15	19	15	And the LORD said unto him, Go, return on thy way to the wilderness of Damascus: and when thou comest, anoint Hazael {to be} king over Syria:	0.0	neutral	Y díjole Jehová: Ve, vuélvete por tu camino, por el desierto de Damasco: y llegarás, y ungirás á Hazael por rey de Siria;
1KI.19.16	19	16	And Jehu the son of Nimshi shalt thou anoint {to be} king over Israel: and Elisha the son of Shaphat of Abelmeholah shalt thou anoint {to be} prophet in thy room. {Elisha: Gr. Eliseus}	0.0	neutral	Y á Jehú hijo de Nimsi, ungirás por rey sobre Israel; y á Eliseo hijo de Saphat, de Abel-mehula, ungirás para que sea profeta en lugar de ti.
1KI.19.17	19	17	And it shall come to pass, {that} him that escapeth the sword of Hazael shall Jehu slay: and him that escapeth from the sword of Jehu shall Elisha slay.	0.0	neutral	Y será, que el que escapare del cuchillo, de Hazael, Jehú lo matará; y el que escapare del cuchillo de Jehú, Eliseo lo matará.
1KI.19.18	19	18	Yet I have left {me} seven thousand in Israel, all the knees which have not bowed unto Baal, and every mouth which hath not kissed him. {I have...: or, I will leave}	0.0	neutral	Y yo haré que queden en Israel siete mil; todas rodillas que no se encorvaron á Baal, y bocas todas que no lo besaron.
1KI.19.19	19	19	So he departed thence, and found Elisha the son of Shaphat, who {was} plowing {with} twelve yoke {of oxen} before him, and he with the twelfth: and Elijah passed by him, and cast his mantle upon him.	0.0	neutral	Y partiéndose él de allí, halló á Eliseo hijo de Saphat, que araba con doce yuntas delante de sí; y él era uno de los doce gañanes. Y pasando Elías por delante de él, echó sobre él su manto.
1KI.19.20	19	20	And he left the oxen, and ran after Elijah, and said, Let me, I pray thee, kiss my father and my mother, and {then} I will follow thee. And he said unto him, Go back again: for what have I done to thee? {Go...: Heb. Go return}	0.0	neutral	Entonces dejando él los bueyes, vino corriendo en pos de Elías, y dijo: Ruégote que me dejes besar mi padre y mi madre, y luego te seguiré. Y él le dijo: Ve, vuelve: ¿qué te he hecho yo?
1KI.19.21	19	21	And he returned back from him, and took a yoke of oxen, and slew them, and boiled their flesh with the instruments of the oxen, and gave unto the people, and they did eat. Then he arose, and went after Elijah, and ministered unto him.	0.0	neutral	Y volvióse de en pos de él, y tomó un par de bueyes, y matólos, y con el arado de los bueyes coció la carne de ellos, y dióla al pueblo que comiesen. Después se levantó, y fué tras Elías, y servíale.
1KI.20.1	20	1	And Benhadad the king of Syria gathered all his host together: and {there were} thirty and two kings with him, and horses, and chariots: and he went up and besieged Samaria, and warred against it.	0.0	neutral	ENTONCES Ben-adad rey de Siria juntó á todo su ejército, y con él treinta y dos reyes, con caballos y carros: y subió, y puso cerco á Samaria, y combatióla.
1KI.20.2	20	2	And he sent messengers to Ahab king of Israel into the city, and said unto him, Thus saith Benhadad,	0.0	neutral	Y envió mensajeros á la ciudad á Achâb rey de Israel, diciendo:
1KI.20.3	20	3	Thy silver and thy gold {is} mine; thy wives also and thy children, {even} the goodliest, {are} mine.	0.0	neutral	Así ha dicho Ben-adad: Tu plata y tu oro es mío, y tus mujeres y tus hijos hermosos son míos.
1KI.20.4	20	4	And the king of Israel answered and said, My lord, O king, according to thy saying, I {am} thine, and all that I have.	0.0	neutral	Y el rey de Israel respondió, y dijo: Como tú dices, rey señor mío, yo soy tuyo, y todo lo que tengo.
1KI.20.5	20	5	And the messengers came again, and said, Thus speaketh Benhadad, saying, Although I have sent unto thee, saying, Thou shalt deliver me thy silver, and thy gold, and thy wives, and thy children;	0.0	neutral	Y volviendo los mensajeros otra vez, dijeron: Así dijo Ben-adad: Yo te envié á decir: Tu plata y tu oro, y tus mujeres y tus hijos me darás.
1KI.20.6	20	6	Yet I will send my servants unto thee to morrow about this time, and they shall search thine house, and the houses of thy servants; and it shall be, {that} whatsoever is pleasant in thine eyes, they shall put {it} in their hand, and take {it} away. {pleasant: Heb. desirable}	0.7333	positive	Además mañana á estas horas enviaré yo á ti mis siervos, los cuales escudriñarán tu casa, y las casas de tus siervos; y tomarán con sus manos, y llevarán todo lo precioso que tuvieres.
1KI.20.7	20	7	Then the king of Israel called all the elders of the land, and said, Mark, I pray you, and see how this {man} seeketh mischief: for he sent unto me for my wives, and for my children, and for my silver, and for my gold; and I denied him not. {I denied...: Heb. I kept not back from him}	0.0	neutral	Entonces el rey de Israel llamó á todos los ancianos de la tierra, y díjoles: Entended, y ved ahora cómo éste no busca sino mal: pues que ha enviado á mí por mis mujeres y mis hijos, y por mi plata y por mi oro; y yo no se lo he negado.
1KI.20.8	20	8	And all the elders and all the people said unto him, Hearken not {unto him}, nor consent.	0.0	neutral	Y todos los ancianos y todo el pueblo le respondieron: No le obedezcas, ni hagas lo que te pide.
1KI.20.9	20	9	Wherefore he said unto the messengers of Benhadad, Tell my lord the king, All that thou didst send for to thy servant at the first I will do: but this thing I may not do. And the messengers departed, and brought him word again.	0.25	positive	Entonces él respondió á los embajadores de Ben-adad: Decid al rey mi señor: Haré todo lo que mandaste á tu siervo al principio; mas esto no lo puedo hacer. Y los embajadores fueron, y diéronle la respuesta.
1KI.20.10	20	10	And Benhadad sent unto him, and said, The gods do so unto me, and more also, if the dust of Samaria shall suffice for handfuls for all the people that follow me. {follow...: Heb. are at my feet}	0.5	positive	Y Ben-adad tornó á enviarle á decir: Así me hagan los dioses, y así me añadan, que el polvo de Samaria no bastará á los puños de todo el pueblo que me sigue.
1KI.20.11	20	11	And the king of Israel answered and said, Tell {him}, Let not him that girdeth on {his harness} boast himself as he that putteth it off.	0.0	neutral	Y el rey de Israel respondió, y dijo: Decidle, que no se alabe el que se ciñe, como el que ya se desciñe.
1KI.20.12	20	12	And it came to pass, when {Benhadad} heard this message, as he {was} drinking, he and the kings in the pavilions, that he said unto his servants, Set {yourselves in array}. And they set {themselves in array} against the city. {message: Heb. word} {pavilions: or, tents} {Set yourselves...: or, Place the engines. And they placed the engines}	0.0	neutral	Y como él oyó esta palabra, estando bebiendo con los reyes en las tiendas, dijo á sus siervos: Poned. Y ellos pusieron contra la ciudad.
1KI.20.13	20	13	And, behold, there came a prophet unto Ahab king of Israel, saying, Thus saith the LORD, Hast thou seen all this great multitude? behold, I will deliver it into thine hand this day; and thou shalt know that I {am} the LORD. {came: Heb. approached}	0.8	positive	Y he aquí un profeta se llegó á Achâb rey de Israel; y le dijo: Así ha dicho Jehová: ¿Has visto esta grande multitud? he aquí yo te la entregaré hoy en tu mano, para que conozcas que yo soy Jehová.
1KI.20.14	20	14	And Ahab said, By whom? And he said, Thus saith the LORD, {Even} by the young men of the princes of the provinces. Then he said, Who shall order the battle? And he answered, Thou. {young...: or, servants} {order: Heb. bind, or, tie}	0.1	neutral	Y respondió Achâb: ¿Por mano de quién? Y él dijo: Así ha dicho Jehová: Por mano de los criados de los príncipes de las provincias. Y dijo Achâb: ¿Quién comenzará la batalla? Y él respondió: Tú.
1KI.20.15	20	15	Then he numbered the young men of the princes of the provinces, and they were two hundred and thirty two: and after them he numbered all the people, {even} all the children of Israel, {being} seven thousand.	0.1	neutral	Entonces él reconoció los criados de los príncipes de las provincias, los cuales fueron doscientos treinta y dos. Luego reconoció todo el pueblo, todos los hijos de Israel, que fueron siete mil.
1KI.20.16	20	16	And they went out at noon. But Benhadad {was} drinking himself drunk in the pavilions, he and the kings, the thirty and two kings that helped him.	-0.5	negative	Y salieron á medio día. Y estaba Ben-adad bebiendo, borracho en las tiendas, él y los reyes, los treinta y dos reyes que habían venido en su ayuda.
1KI.20.17	20	17	And the young men of the princes of the provinces went out first; and Benhadad sent out, and they told him, saying, There are men come out of Samaria.	0.175	positive	Y los criados de los príncipes de las provincias salieron los primeros. Y había Ben-adad enviado quien le dió aviso, diciendo: Han salido hombres de Samaria.
1KI.20.18	20	18	And he said, Whether they be come out for peace, take them alive; or whether they be come out for war, take them alive.	0.1	neutral	El entonces dijo: Si han salido por paz, tomadlos vivos; y si han salido para pelear, tomadlos vivos.
1KI.20.19	20	19	So these young men of the princes of the provinces came out of the city, and the army which followed them.	0.1	neutral	Salieron pues de la ciudad los criados de los príncipes de las provincias, y en pos de ellos el ejército.
1KI.20.20	20	20	And they slew every one his man: and the Syrians fled; and Israel pursued them: and Benhadad the king of Syria escaped on an horse with the horsemen.	0.0	neutral	E hirió cada uno al que venía contra sí: y huyeron los Siros, siguiéndolos los de Israel. Y el rey de Siria, Ben-adad, se escapó en un caballo con alguna gente de caballería.
1KI.20.21	20	21	And the king of Israel went out, and smote the horses and chariots, and slew the Syrians with a great slaughter.	0.8	positive	Y salió el rey de Israel, é hirió la gente de á caballo, y los carros; y deshizo los Siros con grande estrago.
1KI.20.22	20	22	And the prophet came to the king of Israel, and said unto him, Go, strengthen thyself, and mark, and see what thou doest: for at the return of the year the king of Syria will come up against thee.	0.0	neutral	Llegándose luego el profeta al rey de Israel, le dijo: Ve, fortalécete, y considera y mira lo que has de hacer; porque pasado el año, el rey de Siria ha de venir contra ti.
1KI.20.23	20	23	And the servants of the king of Syria said unto him, Their gods {are} gods of the hills; therefore they were stronger than we; but let us fight against them in the plain, and surely we shall be stronger than they.	0.1429	positive	Y los siervos del rey de Siria le dijeron: Sus dioses son dioses de los montes, por eso nos han vencido; mas si peleáremos con ellos en la llanura, se verá si no los vencemos.
1KI.20.24	20	24	And do this thing, Take the kings away, every man out of his place, and put captains in their rooms:	0.0	neutral	Haz pues así: Saca á los reyes cada uno de su puesto, y pon capitanes en lugar de ellos.
1KI.20.25	20	25	And number thee an army, like the army that thou hast lost, horse for horse, and chariot for chariot: and we will fight against them in the plain, {and} surely we shall be stronger than they. And he hearkened unto their voice, and did so. {that thou...: Heb. that was fallen}	0.1429	positive	Y tú, fórmate otro ejército como el ejército que perdiste, caballos por caballos, y carros por carros; luego pelearemos con ellos en campo raso, y veremos si no los vencemos. Y él les dió oído, é hízolo así.
1KI.20.26	20	26	And it came to pass at the return of the year, that Benhadad numbered the Syrians, and went up to Aphek, to fight against Israel. {to fight...: Heb. to the war with Israel}	0.0	neutral	Pasado el año, Ben-adad reconoció los Siros, y vino á Aphec á pelear contra Israel.
1KI.20.27	20	27	And the children of Israel were numbered, and were all present, and went against them: and the children of Israel pitched before them like two little flocks of kids; but the Syrians filled the country. {were all...: or, were nourished}	0.0708	neutral	Y los hijos de Israel fueron también inspeccionados, y tomando provisiones fuéronles al encuentro; y asentaron campo lo hijos de Israel delante de ellos, como dos rebañuelos de cabras; y los Siros henchían la tierra.
1KI.20.28	20	28	And there came a man of God, and spake unto the king of Israel, and said, Thus saith the LORD, Because the Syrians have said, The LORD {is} God of the hills, but he {is} not God of the valleys, therefore will I deliver all this great multitude into thine hand, and ye shall know that I {am} the LORD.	0.8	positive	Llegándose entonces el varón de Dios al rey de Israel, hablóle diciendo: Así dijo Jehová: Por cuanto los Siros han dicho, Jehová es Dios de los montes, no Dios de los valles, yo entregaré toda esta grande multitud en tu mano, para que conozcáis que yo soy Jehová.
1KI.20.29	20	29	And they pitched one over against the other seven days. And {so} it was, that in the seventh day the battle was joined: and the children of Israel slew of the Syrians an hundred thousand footmen in one day.	-0.125	negative	Siete días tuvieron asentado campo los unos delante de los otros, y al séptimo día se dió la batalla: y mataron los hijos de Israel de los Siros en un día cien mil hombres de á pie.
1KI.20.30	20	30	But the rest fled to Aphek, into the city; and {there} a wall fell upon twenty and seven thousand of the men {that were} left. And Benhadad fled, and came into the city, into an inner chamber. {into an...: or, from chamber to chamber: Heb. into a chamber within a chamber}	0.0	neutral	Los demás huyeron á Aphec, á la ciudad: y el muro cayó sobre veinte y siete mil hombres que habían quedado. También Ben-adad vino huyendo á la ciudad, y escondíase de cámara en cámara.
1KI.20.31	20	31	And his servants said unto him, Behold now, we have heard that the kings of the house of Israel {are} merciful kings: let us, I pray thee, put sackcloth on our loins, and ropes upon our heads, and go out to the king of Israel: peradventure he will save thy life.	0.0	neutral	Entonces sus siervos le dijeron: He aquí, hemos oído de los reyes de la casa de Israel que son reyes clementes: pongamos pues ahora sacos en nuestros lomos, y sogas en nuestras cabezas, y salgamos al rey de Israel: por ventura te salvará la vida.
1KI.20.32	20	32	So they girded sackcloth on their loins, and {put} ropes on their heads, and came to the king of Israel, and said, Thy servant Benhadad saith, I pray thee, let me live. And he said, {Is} he yet alive? he {is} my brother.	0.1182	positive	Ciñeron pues sus lomos de sacos, y sogas á sus cabezas, y vinieron al rey de Israel, y dijéronle: Tu siervo Ben-adad dice: Ruégote que viva mi alma. Y él respondió: Si él vive aún, mi hermano es.
1KI.20.33	20	33	Now the men did diligently observe whether {any thing would come} from him, and did hastily catch {it}: and they said, Thy brother Benhadad. Then he said, Go ye, bring him. Then Benhadad came forth to him; and he caused him to come up into the chariot.	0.0	neutral	Esto tomaron aquellos hombres por buen agüero, y presto tomaron esta palabra de su boca, y dijeron: ¡Tu hermano Ben-adad! Y él dijo: Id, y traedle. Ben-adad entonces se presentó á Achâb, y él le hizo subir en un carro.
1KI.20.34	20	34	And {Benhadad} said unto him, The cities, which my father took from thy father, I will restore; and thou shalt make streets for thee in Damascus, as my father made in Samaria. Then {said Ahab}, I will send thee away with this covenant. So he made a covenant with him, and sent him away. {streets: or, market places}	0.0	neutral	Y díjole Ben-adad: Las ciudades que mi padre tomó al tuyo, yo las restituiré; y haz plazas en Damasco para ti, como mi padre las hizo en Samaria. Y yo, dijo Achâb, te dejaré partir con esta alianza. Hizo pues con él alianza, y dejóle ir.
1KI.20.35	20	35	And a certain man of the sons of the prophets said unto his neighbour in the word of the LORD, Smite me, I pray thee. And the man refused to smite him.	0.2143	positive	Entonces un varón de los hijos de los profetas dijo á su compañero por palabra de Dios: Hiéreme ahora. Mas el otro varón no quiso herirle.
1KI.20.36	20	36	Then said he unto him, Because thou hast not obeyed the voice of the LORD, behold, as soon as thou art departed from me, a lion shall slay thee. And as soon as he was departed from him, a lion found him, and slew him.	0.0	neutral	Y él le dijo: Por cuanto no has obedecido á la palabra de Jehová, he aquí en apartándote de mí, te herirá un león. Y como se apartó de él, topóle un león, é hirióle.
1KI.20.37	20	37	Then he found another man, and said, Smite me, I pray thee. And the man smote him, so that in smiting he wounded {him}. {so that...: Heb. smiting and wounding}	0.0	neutral	Encontróse luego con otro hombre, y díjole: Hiéreme ahora. Y el hombre le dió un golpe, é hízole una herida.
1KI.20.38	20	38	So the prophet departed, and waited for the king by the way, and disguised himself with ashes upon his face.	0.0	neutral	Y el profeta se fué, y púsose delante del rey en el camino, y disfrazóse con un velo sobre los ojos.
1KI.20.39	20	39	And as the king passed by, he cried unto the king: and he said, Thy servant went out into the midst of the battle; and, behold, a man turned aside, and brought a man unto me, and said, Keep this man: if by any means he be missing, then shall thy life be for his life, or else thou shalt pay a talent of silver. {pay: Heb. weigh}	-0.2	negative	Y como el rey pasaba, él dió voces al rey, y dijo: Tu siervo salió entre la tropa: y he aquí apartándose uno, trájome un hombre, diciendo: Guarda á este hombre, y si llegare á faltar, tu vida será por la suya, ó pagarás un talento de plata.
1KI.20.40	20	40	And as thy servant was busy here and there, he was gone. And the king of Israel said unto him, So {shall} thy judgment {be}; thyself hast decided {it}. {he was...: Heb. he was not}	0.1	neutral	Y como tu siervo estaba ocupado á una parte y á otra, él desapareció. Entonces el rey de Israel le dijo: Esa será tu sentencia: tú la has pronunciado.
1KI.20.41	20	41	And he hasted, and took the ashes away from his face; and the king of Israel discerned him that he {was} of the prophets.	0.0	neutral	Pero él se quitó presto el velo de sobre sus ojos, y el rey de Israel conoció que era de los profetas.
1KI.20.42	20	42	And he said unto him, Thus saith the LORD, Because thou hast let go out of {thy} hand a man whom I appointed to utter destruction, therefore thy life shall go for his life, and thy people for his people.	0.0	neutral	Y él le dijo: Así ha dicho Jehová: Por cuanto soltaste de la mano el hombre de mi anatema, tu vida será por la suya, y tu pueblo por el suyo.
1KI.20.43	20	43	And the king of Israel went to his house heavy and displeased, and came to Samaria.	-0.2	negative	Y el rey de Israel se fué á su casa triste y enojado, y llegó á Samaria.
1KI.21.1	21	1	And it came to pass after these things, {that} Naboth the Jezreelite had a vineyard, which {was} in Jezreel, hard by the palace of Ahab king of Samaria.	-0.2917	negative	PASADOS estos negocios, aconteció que Naboth de Jezreel tenía en Jezreel una viña junto al palacio de Achâb rey de Samaria.
1KI.21.2	21	2	And Ahab spake unto Naboth, saying, Give me thy vineyard, that I may have it for a garden of herbs, because it {is} near unto my house: and I will give thee for it a better vineyard than it; {or}, if it seem good to thee, I will give thee the worth of it in money. {seem...: Heb. be good in thine eyes}	0.46	positive	Y Achâb habló á Naboth, diciendo: Dame tu viña para un huerto de legumbres, porque está cercana, junto á mi casa, y yo te daré por ella otra viña mejor que esta; ó si mejor te pareciere, te pagaré su valor en dinero.
1KI.21.3	21	3	And Naboth said to Ahab, The LORD forbid it me, that I should give the inheritance of my fathers unto thee.	0.0	neutral	Y Naboth respondió á Achâb: Guárdeme Jehová de que yo te dé á ti la heredad de mis padres.
1KI.21.4	21	4	And Ahab came into his house heavy and displeased because of the word which Naboth the Jezreelite had spoken to him: for he had said, I will not give thee the inheritance of my fathers. And he laid him down upon his bed, and turned away his face, and would eat no bread.	-0.1778	negative	Y vínose Achâb á su casa triste y enojado, por la palabra que Naboth de Jezreel le había respondido, diciendo: No te daré la heredad de mis padres. Y acostóse en su cama, y volvió su rostro, y no comió pan.
1KI.21.5	21	5	But Jezebel his wife came to him, and said unto him, Why is thy spirit so sad, that thou eatest no bread?	-0.5	negative	Y vino á él su mujer Jezabel, y díjole: ¿Por qué está tan triste tu espíritu, y no comes pan?
1KI.21.6	21	6	And he said unto her, Because I spake unto Naboth the Jezreelite, and said unto him, Give me thy vineyard for money; or else, if it please thee, I will give thee {another} vineyard for it: and he answered, I will not give thee my vineyard.	0.0	neutral	Y él respondió: Porque hablé con Naboth de Jezreel, y díjele que me diera su viña por dinero, ó que, si más quería, le daría otra viña por ella; y él respondió: Yo no te daré mi viña.
1KI.21.7	21	7	And Jezebel his wife said unto him, Dost thou now govern the kingdom of Israel? arise, {and} eat bread, and let thine heart be merry: I will give thee the vineyard of Naboth the Jezreelite.	0.0	neutral	Y su mujer Jezabel le dijo: ¿Eres tú ahora rey sobre Israel? Levántate, y come pan, y alégrate: yo te daré la viña de Naboth de Jezreel.
1KI.21.8	21	8	So she wrote letters in Ahab's name, and sealed {them} with his seal, and sent the letters unto the elders and to the nobles that {were} in his city, dwelling with Naboth.	0.0	neutral	Entonces ella escribió cartas en nombre de Achâb, y sellólas con su anillo y enviólas á los ancianos y á los principales que moraban en su ciudad con Naboth.
1KI.21.9	21	9	And she wrote in the letters, saying, Proclaim a fast, and set Naboth on high among the people: {on high...: Heb. in the top of the people}	0.054	neutral	Y las cartas que escribió decían así: Proclamad ayuno, y poned á Naboth á la cabecera del pueblo;
