verse_id	chapter	verse	text_en	polarity_en	label_en	text_es
1KI.10.9	10	9	Blessed be the LORD thy God, which delighted in thee, to set thee on the throne of Israel: because the LORD loved Israel for ever, therefore made he thee king, to do judgment and justice.	0.7	positive	Jehová tu Dios sea bendito, que se agradó de ti para ponerte en el trono de Israel; porque Jehová ha amado siempre á Israel, y te ha puesto por rey, para que hagas derecho y justicia.
1KI.10.10	10	10	And she gave the king an hundred and twenty talents of gold, and of spices very great store, and precious stones: there came no more such abundance of spices as these which the queen of Sheba gave to king Solomon.	0.3125	positive	Y dió ella al rey ciento y veinte talentos de oro, y muy mucha especiería, y piedras preciosas: nunca vino tan grande copia de especias, como la reina de Seba dió al rey Salomón.
1KI.10.11	10	11	And the navy also of Hiram, that brought gold from Ophir, brought in from Ophir great plenty of almug trees, and precious stones. {almug...: also called, algum trees}	0.65	positive	La flota de Hiram que había traído el oro de Ophir, traía también de Ophir muy mucha madera de brasil, y piedras preciosas.
1KI.10.12	10	12	And the king made of the almug trees pillars for the house of the LORD, and for the king's house, harps also and psalteries for singers: there came no such almug trees, nor were seen unto this day. {pillars: or, rails: Heb. a prop}	0.0	neutral	Y de la madera de brasil hizo el rey balaustres para la casa de Jehová, y para las casas reales, arpas también y salterios para los cantores: nunca vino tanta madera de brasil, ni se ha visto hasta hoy.
1KI.10.13	10	13	And king Solomon gave unto the queen of Sheba all her desire, whatsoever she asked, beside {that} which Solomon gave her of his royal bounty. So she turned and went to her own country, she and her servants. {of his...: Heb. according to the hand of king Solomon}	0.6	positive	Y el rey Salomón dió á la reina de Seba todo lo que quiso, y todo lo que pidió, además de lo que Salomón le dió como de mano del rey Salomón. Y ella se volvió, y se fué á su tierra con sus criados.
1KI.10.14	10	14	Now the weight of gold that came to Solomon in one year was six hundred threescore and six talents of gold,	0.0	neutral	El peso del oro que Salomón tenía de renta cada un año, era seiscientos sesenta y seis talentos de oro;
1KI.10.15	10	15	Beside {that he had} of the merchantmen, and of the traffick of the spice merchants, and of all the kings of Arabia, and of the governors of the country. {governors: or, captains}	0.0	neutral	Sin lo de los mercaderes, y de la contratación de especias, y de todos los reyes de Arabia, y de los principales de la tierra.
1KI.10.16	10	16	And king Solomon made two hundred targets {of} beaten gold: six hundred {shekels} of gold went to one target.	0.0	neutral	Hizo también el rey Salomón doscientos paveses de oro extendido: seiscientos siclos de oro gastó en cada pavés.
1KI.10.17	10	17	And {he made} three hundred shields {of} beaten gold; three pound of gold went to one shield: and the king put them in the house of the forest of Lebanon.	0.0	neutral	Asimismo trescientos escudos de oro extendido, en cada uno de los cuales gastó tres libras de oro: y púsolos el rey en la casa del bosque del Líbano.
1KI.10.18	10	18	Moreover the king made a great throne of ivory, and overlaid it with the best gold.	0.9	positive	Hizo también el rey un gran trono de marfil, el cual cubrió de oro purísimo.
1KI.10.19	10	19	The throne had six steps, and the top of the throne {was} round behind: and {there were} stays on either side on the place of the seat, and two lions stood beside the stays. {behind: Heb. on the hinder part thereof} {stays: Heb. hands}	-0.125	negative	Seis gradas tenía el trono, y lo alto de él era redondo por el respaldo: y de la una parte y de la otra tenía apoyos cerca del asiento, junto á los cuales estaban colocados dos leones.
1KI.10.20	10	20	And twelve lions stood there on the one side and on the other upon the six steps: there was not the like made in any kingdom. {the like: Heb. so}	-0.125	negative	Estaban también doce leones puestos allí sobre las seis gradas, de la una parte y de la otra: en ningún otro reino se había hecho trono semejante.
1KI.10.21	10	21	And all king Solomon's drinking vessels {were of} gold, and all the vessels of the house of the forest of Lebanon {were of} pure gold; none {were of} silver: it was nothing accounted of in the days of Solomon. {none...: or, there was no silver in them}	0.2143	positive	Y todos los vasos de beber del rey Salomón eran de oro, y asimismo toda la vajilla de la casa del bosque del Líbano era de oro fino: no había plata; en tiempo de Salomón no era de estima.
1KI.10.22	10	22	For the king had at sea a navy of Tharshish with the navy of Hiram: once in three years came the navy of Tharshish, bringing gold, and silver, ivory, and apes, and peacocks. {ivory: or, elephants' teeth}	0.0	neutral	Porque el rey tenía la flota que salía á la mar, á Tharsis, con la flota de Hiram: una vez en cada tres años venía la flota de Tharsis, y traía oro, plata, marfil, simios y pavos.
1KI.10.23	10	23	So king Solomon exceeded all the kings of the earth for riches and for wisdom.	0.0	neutral	Así excedía el rey Salomón á todos los reyes de la tierra en riquezas y en sabiduría.
1KI.10.24	10	24	And all the earth sought to Solomon, to hear his wisdom, which God had put in his heart. {sought to: Heb. sought the face of}	0.0	neutral	Toda la tierra procuraba ver la cara de Salomón, para oir su sabiduría, la cual Dios había puesto en su corazón.
1KI.10.25	10	25	And they brought every man his present, vessels of silver, and vessels of gold, and garments, and armour, and spices, horses, and mules, a rate year by year.	0.0	neutral	Y todos le llevaban cada año sus presentes: vasos de oro, vasos de plata, vestidos, armas, aromas, caballos y acémilas.
1KI.10.26	10	26	And Solomon gathered together chariots and horsemen: and he had a thousand and four hundred chariots, and twelve thousand horsemen, whom he bestowed in the cities for chariots, and with the king at Jerusalem.	0.0	neutral	Y juntó Salomón carros y gente de á caballo; y tenía mil cuatrocientos carros, y doce mil jinetes, los cuales puso en las ciudades de los carros, y con el rey en Jerusalem.
1KI.10.27	10	27	And the king made silver {to be} in Jerusalem as stones, and cedars made he {to be} as the sycomore trees that {are} in the vale, for abundance. {made: Heb. gave}	0.0	neutral	Y puso el rey en Jerusalem plata como piedras, y cedros como los cabrahigos que están por los campos en abundancia.
1KI.10.28	10	28	And Solomon had horses brought out of Egypt, and linen yarn: the king's merchants received the linen yarn at a price. {And Solomon...: Heb. And the going forth of the horses which was Solomon's}	-0.1	neutral	Y sacaban caballos y lienzos á Salomón de Egipto: porque la compañía de los mercaderes del rey compraban caballos y lienzos.
1KI.10.29	10	29	And a chariot came up and went out of Egypt for six hundred {shekels} of silver, and an horse for an hundred and fifty: and so for all the kings of the Hittites, and for the kings of Syria, did they bring {them} out by their means. {by their...: Heb. by their hand}	0.0	neutral	Y venía y salía de Egipto, el carro por seiscientas piezas de plata, y el caballo por ciento y cincuenta; y así los sacaban por mano de ellos, todos los reyes de los Hetheos, y de Siria.
1KI.11.1	11	1	But king Solomon loved many strange women, together with the daughter of Pharaoh, women of the Moabites, Ammonites, Edomites, Zidonians, {and} Hittites; {together...: or, beside}	0.3833	positive	EMPERO el rey Salomón amó, á más de la hija de Faraón, muchas mujeres extranjeras: á las de Moab, á las de Ammón, á las de Idumea, á las de Sidón, y á las Hetheas;
1KI.11.2	11	2	Of the nations {concerning} which the LORD said unto the children of Israel, Ye shall not go in to them, neither shall they come in unto you: {for} surely they will turn away your heart after their gods: Solomon clave unto these in love.	0.0833	neutral	Gentes de las cuales Jehová había dicho á los hijos de Israel: No entraréis á ellas, ni ellas entrarán á vosotros; porque ciertamente harán inclinar vuestros corazones tras sus dioses. A éstas pues se juntó Salomón con amor.
1KI.11.3	11	3	And he had seven hundred wives, princesses, and three hundred concubines: and his wives turned away his heart.	0.0	neutral	Y tuvo setecientas mujeres reinas, y trescientas concubinas; y sus mujeres torcieron su corazón.
1KI.11.4	11	4	For it came to pass, when Solomon was old, {that} his wives turned away his heart after other gods: and his heart was not perfect with the LORD his God, as {was} the heart of David his father.	-0.175	negative	Y ya que Salomón era viejo, sus mujeres inclinaron su corazón tras dioses ajenos; y su corazón no era perfecto con Jehová su Dios, como el corazón de su padre David.
1KI.11.5	11	5	For Solomon went after Ashtoreth the goddess of the Zidonians, and after Milcom the abomination of the Ammonites. {Milcom: also called, Molech}	0.0	neutral	Porque Salomón siguió á Astaroth, diosa de los Sidonios, y á Milcom, abominación de los Ammonitas.
1KI.11.6	11	6	And Solomon did evil in the sight of the LORD, and went not fully after the LORD, as {did} David his father. {went...: Heb. fulfilled not after}	-1.0	negative	E hizo Salomón lo malo en los ojos de Jehová, y no fué cumplidamente tras Jehová como David su padre.
1KI.11.7	11	7	Then did Solomon build an high place for Chemosh, the abomination of Moab, in the hill that {is} before Jerusalem, and for Molech, the abomination of the children of Ammon.	0.16	positive	Entonces edificó Salomón un alto á Chêmos, abominación de Moab, en el monte que está enfrente de Jerusalem; y á Moloch, abominación de los hijos de Ammón.
1KI.11.8	11	8	And likewise did he for all his strange wives, which burnt incense and sacrificed unto their gods.	-0.05	neutral	Y así hizo para todas sus mujeres extranjeras, las cuales quemaban perfumes, y sacrificaban á sus dioses.
1KI.11.9	11	9	And the LORD was angry with Solomon, because his heart was turned from the LORD God of Israel, which had appeared unto him twice,	-0.5	negative	Y enojóse Jehová contra Salomón, por cuanto estaba su corazón desviado de Jehová Dios de Israel, que le había aparecido dos veces,
1KI.11.10	11	10	And had commanded him concerning this thing, that he should not go after other gods: but he kept not that which the LORD commanded.	-0.125	negative	Y le había mandado acerca de esto, que no siguiese dioses ajenos: mas él no guardó lo que le mandó Jehová.
1KI.11.11	11	11	Wherefore the LORD said unto Solomon, Forasmuch as this is done of thee, and thou hast not kept my covenant and my statutes, which I have commanded thee, I will surely rend the kingdom from thee, and will give it to thy servant. {is done...: Heb. is with thee}	0.5	positive	Y dijo Jehová á Salomón: Por cuanto ha habido esto en ti, y no has guardado mi pacto y mis estatutos que yo te mandé, romperé el reino de ti, y lo entregaré á tu siervo.
1KI.11.12	11	12	Notwithstanding in thy days I will not do it for David thy father's sake: {but} I will rend it out of the hand of thy son.	-0.75	negative	Empero no lo haré en tus días, por amor de David tu padre: romperélo de la mano de tu hijo.
1KI.11.13	11	13	Howbeit I will not rend away all the kingdom; {but} will give one tribe to thy son for David my servant's sake, and for Jerusalem's sake which I have chosen.	0.0	neutral	Sin embargo no romperé todo el reino, sino que daré una tribu á tu hijo, por amor de David mi siervo, y por amor de Jerusalem que yo he elegido.
1KI.11.14	11	14	And the LORD stirred up an adversary unto Solomon, Hadad the Edomite: he {was} of the king's seed in Edom.	0.0	neutral	Y Jehová suscitó un adversario á Salomón, á Adad, Idumeo, de la sangre real, el cual estaba en Edom.
1KI.11.15	11	15	For it came to pass, when David was in Edom, and Joab the captain of the host was gone up to bury the slain, after he had smitten every male in Edom;	0.0	neutral	Porque cuando David estaba en Edom, y subió Joab el general del ejército á enterrar los muertos, y mató á todos los varones de Edom,
1KI.11.16	11	16	(For six months did Joab remain there with all Israel, until he had cut off every male in Edom:)	0.25	positive	(Porque seis meses habitó allí Joab, y todo Israel, hasta que hubo acabado á todo el sexo masculino en Edom;)
1KI.11.17	11	17	That Hadad fled, he and certain Edomites of his father's servants with him, to go into Egypt; Hadad {being} yet a little child.	0.0134	neutral	Entonces huyó Adad, y con él algunos varones Idumeos de los siervos de su padre, y fuése á Egipto; era entonces Adad muchacho pequeño.
1KI.11.18	11	18	And they arose out of Midian, and came to Paran: and they took men with them out of Paran, and they came to Egypt, unto Pharaoh king of Egypt; which gave him an house, and appointed him victuals, and gave him land.	0.0	neutral	Y levantáronse de Madián, y vinieron á Parán; y tomando consigo hombres de Parán, viniéronse á Egipto, á Faraón rey de Egipto, el cual le dió casa, y le señaló alimentos, y aun le dió tierra.
1KI.11.19	11	19	And Hadad found great favour in the sight of Pharaoh, so that he gave him to wife the sister of his own wife, the sister of Tahpenes the queen.	0.7	positive	Y halló Adad grande gracia delante de Faraón, el cual le dió por mujer á la hermana de su esposa, á la hermana de la reina Thaphnes.
1KI.11.20	11	20	And the sister of Tahpenes bare him Genubath his son, whom Tahpenes weaned in Pharaoh's house: and Genubath was in Pharaoh's household among the sons of Pharaoh.	0.05	neutral	Y la hermana de Thaphnes le parió á su hijo Genubath, al cual destetó Thaphnes dentro de la casa de Faraón; y estaba Genubath en casa de Faraón entre los hijos de Faraón.
1KI.11.21	11	21	And when Hadad heard in Egypt that David slept with his fathers, and that Joab the captain of the host was dead, Hadad said to Pharaoh, Let me depart, that I may go to mine own country. {Let...: Heb. Send me away}	0.2	positive	Y oyendo Adad en Egipto que David había dormido con sus padres, y que era muerto Joab general del ejército, Adad dijo á Faraón: Déjame ir á mi tierra.
1KI.11.22	11	22	Then Pharaoh said unto him, But what hast thou lacked with me, that, behold, thou seekest to go to thine own country? And he answered, Nothing: howbeit let me go in any wise. {Nothing: Heb. Not}	0.65	positive	Y respondióle Faraón: ¿Por qué? ¿qué te falta conmigo, que procuras irte á tu tierra? Y él respondió: Nada; con todo, ruégote que me dejes ir.
1KI.11.23	11	23	And God stirred him up {another} adversary, Rezon the son of Eliadah, which fled from his lord Hadadezer king of Zobah:	0.0	neutral	Despertóle también Dios por adversario á Rezón, hijo de Eliada, el cual había huído de su amo Adad-ezer, rey de Soba.
1KI.11.24	11	24	And he gathered men unto him, and became captain over a band, when David slew them {of Zobah}: and they went to Damascus, and dwelt therein, and reigned in Damascus.	0.0	neutral	Y había juntado gente contra él, y habíase hecho capitán de una compañía, cuando David deshizo á los de Soba. Después se fueron á Damasco, y habitaron allí é hiciéronle rey en Damasco.
1KI.11.25	11	25	And he was an adversary to Israel all the days of Solomon, beside the mischief that Hadad {did}: and he abhorred Israel, and reigned over Syria.	0.0	neutral	Y fué adversario á Israel todos los días de Salomón; y fué otro mal con el de Adad, porque aborreció á Israel, y reinó sobre la Siria.
1KI.11.26	11	26	And Jeroboam the son of Nebat, an Ephrathite of Zereda, Solomon's servant, whose mother's name {was} Zeruah, a widow woman, even he lifted up {his} hand against the king.	0.0	neutral	Asimismo Jeroboam hijo de Nabat, Ephrateo de Sereda, siervo de Salomón, (su madre se llamaba Serva, mujer viuda) alzó su mano contra el rey.
1KI.11.27	11	27	And this {was} the cause that he lifted up {his} hand against the king: Solomon built Millo, {and} repaired the breaches of the city of David his father. {repaired: Heb. closed}	-0.1	neutral	Y la causa por qué éste alzó mano contra el rey, fué esta: Salomón edificando á Millo, cerró el portillo de la ciudad de David su padre.
1KI.11.28	11	28	And the man Jeroboam {was} a mighty man of valour: and Solomon seeing the young man that he was industrious, he made him ruler over all the charge of the house of Joseph. {was industrious: Heb. did work} {charge: Heb. burden}	0.25	positive	Y el varón Jeroboam era valiente y esforzado; y viendo Salomón al mancebo que era hombre activo, encomendóle todo el cargo de la casa de José.
1KI.11.29	11	29	And it came to pass at that time when Jeroboam went out of Jerusalem, that the prophet Ahijah the Shilonite found him in the way; and he had clad himself with a new garment; and they two {were} alone in the field:	0.1364	positive	Aconteció pues en aquel tiempo, que saliendo Jeroboam de Jerusalem, topóle en el camino el profeta Ahías Silonita; y él estaba cubierto con una capa nueva; y estaban ellos dos solos en el campo.
1KI.11.30	11	30	And Ahijah caught the new garment that {was} on him, and rent it {in} twelve pieces:	0.1364	positive	Y trabando Ahías de la capa nueva que tenía sobre sí, rompióla en doce pedazos,
1KI.11.31	11	31	And he said to Jeroboam, Take thee ten pieces: for thus saith the LORD, the God of Israel, Behold, I will rend the kingdom out of the hand of Solomon, and will give ten tribes to thee:	0.0	neutral	Y dijo á Jeroboam: Toma para ti los diez pedazos; porque así dijo Jehová Dios de Israel: He aquí que yo rompo el reino de la mano de Salomón, y á ti daré diez tribus;
1KI.11.32	11	32	(But he shall have one tribe for my servant David's sake, and for Jerusalem's sake, the city which I have chosen out of all the tribes of Israel:)	0.5	positive	(Y él tendrá una tribu, por amor de David mi siervo, y por amor de Jerusalem, ciudad que yo he elegido de todas las tribus de Israel:)
1KI.11.33	11	33	Because that they have forsaken me, and have worshipped Ashtoreth the goddess of the Zidonians, Chemosh the god of the Moabites, and Milcom the god of the children of Ammon, and have not walked in my ways, to do {that which is} right in mine eyes, and {to keep} my statutes and my judgments, as {did} David his father.	0.2857	positive	Por cuanto me han dejado, y han adorado á Astharoth diosa de los Sidonios, y á Chêmos dios de Moab, y á Moloch dios de los hijos de Ammón; y no han andado en mis caminos, para hacer lo recto delante de mis ojos, y mis estatutos, y mis derechos, como hizo David su padre.
1KI.11.34	11	34	Howbeit I will not take the whole kingdom out of his hand: but I will make him prince all the days of his life for David my servant's sake, whom I chose, because he kept my commandments and my statutes:	0.2	positive	Empero no quitaré nada de su reino de sus manos, sino que lo retendré por caudillo todos los días de su vida, por amor de David mi siervo, al cual yo elegí, y él guardó mis mandamientos y mis estatutos:
1KI.11.35	11	35	But I will take the kingdom out of his son's hand, and will give it unto thee, {even} ten tribes.	0.0	neutral	Mas yo quitaré el reino de la mano de su hijo, y darélo á ti, las diez tribus.
1KI.11.36	11	36	And unto his son will I give one tribe, that David my servant may have a light alway before me in Jerusalem, the city which I have chosen me to put my name there. {light: Heb. lamp, or, candle}	0.4	positive	Y á su hijo daré una tribu, para que mi siervo David tenga lámpara todos los días delante de mí en Jerusalem, ciudad que yo me elegí para poner en ella mi nombre.
1KI.11.37	11	37	And I will take thee, and thou shalt reign according to all that thy soul desireth, and shalt be king over Israel.	0.0	neutral	Yo pues te tomaré á ti, y tú reinarás en todas las cosas que deseare tu alma, y serás rey sobre Israel.
1KI.11.38	11	38	And it shall be, if thou wilt hearken unto all that I command thee, and wilt walk in my ways, and do {that is} right in my sight, to keep my statutes and my commandments, as David my servant did; that I will be with thee, and build thee a sure house, as I built for David, and will give Israel unto thee.	0.3929	positive	Y será que, si prestares oído á todas las cosas que te mandare, y anduvieres en mis caminos, é hicieres lo recto delante de mis ojos, guardando mis estatutos y mis mandamientos, como hizo David mi siervo, yo seré contigo, y te edificaré casa firme, como la edifiqué á David, y yo te entregaré á Israel.
1KI.11.39	11	39	And I will for this afflict the seed of David, but not for ever.	0.0	neutral	Y yo afligiré la simiente de David á causa de esto, mas no para siempre.
1KI.11.40	11	40	Solomon sought therefore to kill Jeroboam. And Jeroboam arose, and fled into Egypt, unto Shishak king of Egypt, and was in Egypt until the death of Solomon.	0.0	neutral	Procuró por tanto Salomón de matar á Jeroboam, pero levantándose Jeroboam, huyó á Egipto, á Sisac rey de Egipto, y estuvo en Egipto hasta la muerte de Salomóm.
1KI.11.41	11	41	And the rest of the acts of Solomon, and all that he did, and his wisdom, {are} they not written in the book of the acts of Solomon? {acts: or, words, or, things}	0.0	neutral	Lo demás de los hechos de Salomón, y todas las cosas que hizo, y su sabiduría, ¿no están escritas en el libro de los hechos de Salomón?
1KI.11.42	11	42	And the time that Solomon reigned in Jerusalem over all Israel {was} forty years. {time: Heb. days}	0.0	neutral	Y los días que Salomón reinó en Jerusalem sobre todo Israel, fueron cuarenta años.
1KI.11.43	11	43	And Solomon slept with his fathers, and was buried in the city of David his father: and Rehoboam his son reigned in his stead. {Rehoboam: Gr. Roboam}	0.0	neutral	Y durmió Salomón con sus padres, y fué sepultado en la ciudad de su padre David: y reinó en su lugar Roboam su hijo.
1KI.12.1	12	1	And Rehoboam went to Shechem: for all Israel were come to Shechem to make him king.	0.0	neutral	Y FUÉ Roboam á Sichêm; porque todo Israel había venido á Sichêm para hacerlo rey.
1KI.12.2	12	2	And it came to pass, when Jeroboam the son of Nebat, who was yet in Egypt, heard {of it}, (for he was fled from the presence of king Solomon, and Jeroboam dwelt in Egypt;)	0.25	positive	Y aconteció, que como lo oyó Jeroboam hijo de Nabat, que estaba en Egipto, porque había huído de delante del rey Salomón, y habitaba en Egipto;
1KI.12.3	12	3	That they sent and called him. And Jeroboam and all the congregation of Israel came, and spake unto Rehoboam, saying,	0.0	neutral	Enviaron y llamáronle. Vino pues Jeroboam y toda la congregación de Israel, y hablaron á Roboam, diciendo:
1KI.12.4	12	4	Thy father made our yoke grievous: now therefore make thou the grievous service of thy father, and his heavy yoke which he put upon us, lighter, and we will serve thee.	-0.6	negative	Tu padre agravó nuestro yugo, mas ahora tú disminuye algo de la dura servidumbre de tu padre, y del yugo pesado que puso sobre nosotros, y te serviremos.
1KI.12.5	12	5	And he said unto them, Depart yet {for} three days, then come again to me. And the people departed.	0.0	neutral	Y él les dijo: Idos, y de aquí á tres días volved á mí. Y el pueblo se fué.
1KI.12.6	12	6	And king Rehoboam consulted with the old men, that stood before Solomon his father while he yet lived, and said, How do ye advise that I may answer this people?	0.1	neutral	Entonces el rey Roboam tomó consejo con los ancianos que habían estado delante de Salomón su padre cuando vivía, y dijo: ¿Cómo aconsejáis vosotros que responda á este pueblo?
1KI.12.7	12	7	And they spake unto him, saying, If thou wilt be a servant unto this people this day, and wilt serve them, and answer them, and speak good words to them, then they will be thy servants for ever.	0.7	positive	Y ellos le hablaron, diciendo: Si tú fueres hoy siervo de este pueblo, y lo sirvieres, y respondiéndole buenas palabras les hablares, ellos te servirán para siempre.
1KI.12.8	12	8	But he forsook the counsel of the old men, which they had given him, and consulted with the young men that were grown up with him, {and} which stood before him:	0.1	neutral	Mas él, dejado el consejo de los viejos que ellos le habían dado, tomó consejo con los mancebos que se habían criado con él, y estaban delante de él.
1KI.12.9	12	9	And he said unto them, What counsel give ye that we may answer this people, who have spoken to me, saying, Make the yoke which thy father did put upon us lighter?	0.0	neutral	Y díjoles: ¿Cómo aconsejáis vosotros que respondamos á este pueblo, que me ha hablado, diciendo: Disminuye algo del yugo que tu padre puso sobre nosotros?
1KI.12.10	12	10	And the young men that were grown up with him spake unto him, saying, Thus shalt thou speak unto this people that spake unto thee, saying, Thy father made our yoke heavy, but make thou {it} lighter unto us; thus shalt thou say unto them, My little {finger} shall be thicker than my father's loins.	-0.0958	neutral	Entonces los mancebos que se habían criado con él, le respondieron, diciendo: Así hablarás á este pueblo que te ha dicho estas palabras: Tu padre agravó nuestro yugo; mas tú disminúyenos algo: así les hablarás: El menor dedo de los míos es más grueso que los lomos de mi padre.
1KI.12.11	12	11	And now whereas my father did lade you with a heavy yoke, I will add to your yoke: my father hath chastised you with whips, but I will chastise you with scorpions.	-0.2	negative	Ahora pues, mi padre os cargó de pesado yugo, mas yo añadiré á vuestro yugo; mi padre os hirió con azotes, mas yo os heriré con escorpiones.
