verse_id	chapter	verse	text_en	polarity_en	label_en	text_pt
EXO.10.7	10	7	And Pharaoh's servants said unto him, How long shall this man be a snare unto us? let the men go, that they may serve the LORD their God: knowest thou not yet that Egypt is destroyed?	-0.05	neutral	"Os conselheiros do faraó lhe disseram: ""Até quando este homem será uma ameaça para nós? Deixa os homens irem prestar culto ao Senhor Deus deles. Não percebes que o Egito está arruinado? """
EXO.10.8	10	8	And Moses and Aaron were brought again unto Pharaoh: and he said unto them, Go, serve the LORD your God: {but} who {are} they that shall go? {who...: Heb. who and who, etc}	-0.75	negative	"Então Moisés e Arão foram trazidos de volta à presença do faraó, que lhes disse: ""Vão e prestem culto ao Senhor, ao seu Deus. Mas, digam-me, quem irá? """
EXO.10.9	10	9	And Moses said, We will go with our young and with our old, with our sons and with our daughters, with our flocks and with our herds will we go; for we {must hold} a feast unto the LORD.	0.1	neutral	"Moisés respondeu: ""Temos que levar todos: os jovens e os velhos, os nossos filhos e as nossas filhas, as nossas ovelhas e os nossos bois, pois celebraremos uma festa ao Senhor""."
EXO.10.10	10	10	And he said unto them, Let the LORD be so with you, as I will let you go, and your little ones: look {to it}; for evil {is} before you.	-0.5938	negative	"Disse-lhes o faraó: ""Vocês vão mesmo precisar do Senhor quando eu deixá-los ir com as mulheres e crianças! É claro que vocês estão com más intenções."
EXO.10.11	10	11	Not so: go now ye {that are} men, and serve the LORD; for that ye did desire. And they were driven out from Pharaoh's presence.	0.0	neutral	"De forma alguma! Só os homens podem ir prestar culto ao Senhor, como vocês têm pedido"". E Moisés e Arão foram expulsos da presença do faraó."
EXO.10.12	10	12	And the LORD said unto Moses, Stretch out thine hand over the land of Egypt for the locusts, that they may come up upon the land of Egypt, and eat every herb of the land, {even} all that the hail hath left.	0.0	neutral	"Mas o Senhor disse a Moisés: ""Estenda a mão sobre o Egito para que os gafanhotos venham sobre a terra e devorem toda a vegetação, tudo o que foi deixado pelo granizo""."
EXO.10.13	10	13	And Moses stretched forth his rod over the land of Egypt, and the LORD brought an east wind upon the land all that day, and all {that} night; {and} when it was morning, the east wind brought the locusts.	-0.05	neutral	Moisés estendeu a vara sobre o Egito, e o Senhor fez soprar sobre a terra um vento oriental durante todo aquele dia e toda aquela noite. Pela manhã, o vento havia trazido os gafanhotos,
EXO.10.14	10	14	And the locusts went up over all the land of Egypt, and rested in all the coasts of Egypt: very grievous {were they}; before them there were no such locusts as they, neither after them shall be such.	-0.3333	negative	os quais invadiram todo o Egito e desceram em grande número sobre toda a sua extensão. Nunca antes houve tantos gafanhotos, nem jamais haverá.
EXO.10.15	10	15	For they covered the face of the whole earth, so that the land was darkened; and they did eat every herb of the land, and all the fruit of the trees which the hail had left: and there remained not any green thing in the trees, or in the herbs of the field, through all the land of Egypt.	0.0	neutral	Eles cobriram toda a face da terra de tal forma que essa escureceu. Devoraram tudo o que o granizo tinha deixado: toda a vegetação e todos os frutos das árvores. Não restou nada verde nas árvores nem nas plantas do campo, em toda a terra do Egito.
EXO.10.16	10	16	Then Pharaoh called for Moses and Aaron in haste; and he said, I have sinned against the LORD your God, and against you. {called: Heb. hastened to call}	0.0	neutral	"O faraó mandou chamar Moisés e Arão imediatamente e disse-lhes: ""Pequei contra o Senhor seu Deus e contra vocês!"
EXO.10.17	10	17	Now therefore forgive, I pray thee, my sin only this once, and intreat the LORD your God, that he may take away from me this death only.	0.0	neutral	"Agora perdoem ainda esta vez o meu pecado e orem ao Senhor seu Deus para que leve esta praga mortal para longe de mim""."
EXO.10.18	10	18	And he went out from Pharaoh, and intreated the LORD.	0.0	neutral	Moisés saiu da presença do faraó e orou ao Senhor.
EXO.10.19	10	19	And the LORD turned a mighty strong west wind, which took away the locusts, and cast them into the Red sea; there remained not one locust in all the coasts of Egypt. {cast: Heb. fastened}	0.2778	positive	E o Senhor fez soprar com muito mais força o vento ocidental, e este envolveu os gafanhotos e os lançou no mar Vermelho. Não restou um gafanhoto sequer em toda a extensão do Egito.
EXO.10.20	10	20	But the LORD hardened Pharaoh's heart, so that he would not let the children of Israel go.	0.0	neutral	Mas o Senhor endureceu o coração do faraó, e ele não deixou que os israelitas saíssem.
EXO.10.21	10	21	And the LORD said unto Moses, Stretch out thine hand toward heaven, that there may be darkness over the land of Egypt, even darkness {which} may be felt. {even...: Heb. that one may feel darkness}	0.0	neutral	"O Senhor disse a Moisés: ""Estenda a mão para o céu, e trevas cobrirão o Egito, trevas tais que poderão ser apalpadas""."
EXO.10.22	10	22	And Moses stretched forth his hand toward heaven; and there was a thick darkness in all the land of Egypt three days:	-0.175	negative	Moisés estendeu a mão para o céu, e por três dias houve densas trevas em todo o Egito.
EXO.10.23	10	23	They saw not one another, neither rose any from his place for three days: but all the children of Israel had light in their dwellings.	0.5	positive	Ninguém pôde ver ninguém, nem sair do seu lugar durante três dias. Todavia, todos os israelitas tinham luz nos locais em que habitavam.
EXO.10.24	10	24	And Pharaoh called unto Moses, and said, Go ye, serve the LORD; only let your flocks and your herds be stayed: let your little ones also go with you.	-0.0938	neutral	"Então o faraó mandou chamar Moisés e disse: ""Vão e prestem culto ao Senhor. Deixem somente as ovelhas e os bois; as mulheres e as crianças podem ir""."
EXO.10.25	10	25	And Moses said, Thou must give us also sacrifices and burnt offerings, that we may sacrifice unto the LORD our God. {us: Heb. into our hands}	0.0	neutral	"Mas Moisés contestou: ""Tu mesmo nos darás os animais para os nossos sacrifícios e holocaustos que ofereceremos ao Senhor."
EXO.10.26	10	26	Our cattle also shall go with us; there shall not an hoof be left behind; for thereof must we take to serve the LORD our God; and we know not with what we must serve the LORD, until we come thither.	-0.2	negative	"Além disso, os nossos rebanhos também irão conosco; nem um casco de animal será deixado. Temos que escolher alguns deles para prestar culto ao Senhor nosso Deus e, enquanto não chegarmos ao local, não saberemos quais animais sacrificaremos""."
EXO.10.27	10	27	But the LORD hardened Pharaoh's heart, and he would not let them go.	0.0	neutral	Mas o Senhor endureceu o coração do faraó, e ele se recusou a deixá-los ir.
EXO.10.28	10	28	And Pharaoh said unto him, Get thee from me, take heed to thyself, see my face no more; for in {that} day thou seest my face thou shalt die.	-0.25	negative	"Disse o faraó a Moisés: ""Saia da minha presença! Trate de não aparecer nunca mais diante de mim! No dia em que vir a minha face, você morrerá""."
EXO.10.29	10	29	And Moses said, Thou hast spoken well, I will see thy face again no more.	-0.25	negative	"Respondeu Moisés: ""Será como disseste; nunca mais verei a tua face""."
EXO.11.1	11	1	And the LORD said unto Moses, Yet will I bring one plague {more} upon Pharaoh, and upon Egypt; afterwards he will let you go hence: when he shall let {you} go, he shall surely thrust you out hence altogether.	0.5	positive	"Disse então o Senhor a Moisés: ""Enviarei ainda mais uma praga sobre o faraó e sobre o Egito. Somente depois desta ele os deixará sair daqui e até os expulsará totalmente."
EXO.11.2	11	2	Speak now in the ears of the people, and let every man borrow of his neighbour, and every woman of her neighbour, jewels of silver, and jewels of gold.	0.0	neutral	"Diga ao povo, tanto aos homens como às mulheres, que peça aos seus vizinhos objetos de prata e de ouro""."
EXO.11.3	11	3	And the LORD gave the people favour in the sight of the Egyptians. Moreover the man Moses {was} very great in the land of Egypt, in the sight of Pharaoh's servants, and in the sight of the people.	1.0	positive	O Senhor tornou os egípcios favoráveis ao povo, e o próprio Moisés era tido em alta estima no Egito pelos conselheiros do faraó e pelo povo.
EXO.11.4	11	4	And Moses said, Thus saith the LORD, About midnight will I go out into the midst of Egypt:	0.0	neutral	"Disse, pois, Moisés ao faraó: ""Assim diz o Senhor: 'Por volta da meia-noite, passarei por todo o Egito."
EXO.11.5	11	5	And all the firstborn in the land of Egypt shall die, from the firstborn of Pharaoh that sitteth upon his throne, even unto the firstborn of the maidservant that {is} behind the mill; and all the firstborn of beasts.	-0.4	negative	Todos os primogênitos do Egito morrerão, desde o filho mais velho do faraó, herdeiro do trono, até o filho mais velho da escrava que trabalha no moinho, e também todas as primeiras crias do gado.
EXO.11.6	11	6	And there shall be a great cry throughout all the land of Egypt, such as there was none like it, nor shall be like it any more.	0.4333	positive	Haverá grande pranto em todo o Egito, como nunca houve antes nem jamais haverá.
EXO.11.7	11	7	But against any of the children of Israel shall not a dog move his tongue, against man or beast: that ye may know how that the LORD doth put a difference between the Egyptians and Israel.	0.0	neutral	Entre os israelitas, porém, nem sequer um cão latirá contra homem ou animal'. Então vocês saberão que o Senhor faz distinção entre o Egito e Israel!
EXO.11.8	11	8	And all these thy servants shall come down unto me, and bow down themselves unto me, saying, Get thee out, and all the people that follow thee: and after that I will go out. And he went out from Pharaoh in a great anger. {that follow...: Heb. that is at thy feet} {a great...: Heb. heat of anger}	-0.0185	neutral	"Todos esses seus conselheiros virão a mim e se ajoelharão diante de mim, suplicando: 'Saiam você e todo o povo que o segue! ' Só então eu sairei"". E, com grande ira, Moisés saiu da presença do faraó."
EXO.11.9	11	9	And the LORD said unto Moses, Pharaoh shall not hearken unto you; that my wonders may be multiplied in the land of Egypt.	0.0	neutral	"O Senhor tinha dito a Moisés: ""O faraó não lhes dará ouvidos, a fim de que os meus prodígios se multipliquem no Egito""."
EXO.11.10	11	10	And Moses and Aaron did all these wonders before Pharaoh: and the LORD hardened Pharaoh's heart, so that he would not let the children of Israel go out of his land.	0.0	neutral	Moisés e Arão realizaram todos esses prodígios diante do faraó, mas o Senhor lhe endureceu o coração, e ele não quis deixar os israelitas saírem do país.
EXO.12.1	12	1	And the LORD spake unto Moses and Aaron in the land of Egypt, saying,	0.0	neutral	O Senhor disse a Moisés e a Arão, no Egito:
EXO.12.2	12	2	This month {shall be} unto you the beginning of months: it {shall be} the first month of the year to you.	0.25	positive	"""Este deverá ser o primeiro mês do ano para vocês."
EXO.12.3	12	3	Speak ye unto all the congregation of Israel, saying, In the tenth {day} of this month they shall take to them every man a lamb, according to the house of {their} fathers, a lamb for an house: {lamb: or, kid}	-0.75	negative	Digam a toda a comunidade de Israel que no décimo dia deste mês todo homem deverá separar um cordeiro ou um cabrito, para a sua família, um para cada casa.
EXO.12.4	12	4	And if the household be too little for the lamb, let him and his neighbour next unto his house take {it} according to the number of the souls; every man according to his eating shall make your count for the lamb.	-0.0938	neutral	Se uma família for pequena demais para um animal inteiro, deve dividi-lo com seu vizinho mais próximo, conforme o número de pessoas e conforme o que cada um puder comer.
EXO.12.5	12	5	Your lamb shall be without blemish, a male of the first year: ye shall take {it} out from the sheep, or from the goats: {of...: Heb. son of a year}	-0.1667	negative	O animal escolhido será macho de um ano, sem defeito, e pode ser cordeiro ou cabrito.
EXO.12.6	12	6	And ye shall keep it up until the fourteenth day of the same month: and the whole assembly of the congregation of Israel shall kill it in the evening. {in...: Heb. between the two evenings}	0.1	neutral	Guardem-no até o décimo quarto dia do mês, quando toda a comunidade de Israel irá sacrificá-lo, ao pôr-do-sol.
EXO.12.7	12	7	And they shall take of the blood, and strike {it} on the two side posts and on the upper door post of the houses, wherein they shall eat it.	0.0	neutral	Passem, então, um pouco do sangue nas laterais e nas vigas superiores das portas das casas nas quais vocês comerão o animal.
EXO.12.8	12	8	And they shall eat the flesh in that night, roast with fire, and unleavened bread; {and} with bitter {herbs} they shall eat it.	-0.1	neutral	Naquela mesma noite comerão a carne assada no fogo, juntamente com ervas amargas e pão sem fermento.
EXO.12.9	12	9	Eat not of it raw, nor sodden at all with water, but roast {with} fire; his head with his legs, and with the purtenance thereof.	-0.2308	negative	Não comam a carne crua, nem cozida em água, mas assada no fogo: cabeça, pernas e vísceras.
EXO.12.10	12	10	And ye shall let nothing of it remain until the morning; and that which remaineth of it until the morning ye shall burn with fire.	0.0	neutral	Não deixem sobrar nada até pela manhã; caso isso aconteça, queimem o que restar.
EXO.12.11	12	11	And thus shall ye eat it; {with} your loins girded, your shoes on your feet, and your staff in your hand; and ye shall eat it in haste: it {is} the LORD'S passover.	0.0	neutral	Ao comerem, estejam prontos para sair: cinto no lugar, sandálias nos pés e cajado na mão. Comam apressadamente. Esta é a Páscoa do Senhor.
EXO.12.12	12	12	For I will pass through the land of Egypt this night, and will smite all the firstborn in the land of Egypt, both man and beast; and against all the gods of Egypt I will execute judgment: I {am} the LORD. {gods: or, princes}	0.0	neutral	"""Naquela mesma noite passarei pelo Egito e matarei todos os primogênitos, tanto dos homens como dos animais, e executarei juízo sobre todos os deuses do Egito. Eu sou o Senhor!"
EXO.12.13	12	13	And the blood shall be to you for a token upon the houses where ye {are}: and when I see the blood, I will pass over you, and the plague shall not be upon you to destroy {you}, when I smite the land of Egypt. {to destroy...: Heb. for a destruction}	-0.2	negative	O sangue será um sinal para indicar as casas em que vocês estiverem; quando eu vir o sangue, passarei adiante. A praga de destruição não os atingirá quando eu ferir o Egito.
EXO.12.14	12	14	And this day shall be unto you for a memorial; and ye shall keep it a feast to the LORD throughout your generations; ye shall keep it a feast by an ordinance for ever.	0.0	neutral	"""Este dia será um memorial que vocês e todos os seus descendentes o comemorarão como festa ao Senhor. Comemorem-no como decreto perpétuo."
EXO.12.15	12	15	Seven days shall ye eat unleavened bread; even the first day ye shall put away leaven out of your houses: for whosoever eateth leavened bread from the first day until the seventh day, that soul shall be cut off from Israel.	0.25	positive	Durante sete dias comam pão sem fermento. No primeiro dia tirem de casa o fermento, porque quem comer qualquer coisa fermentada, do primeiro ao sétimo dia, será eliminado de Israel.
EXO.12.16	12	16	And in the first day {there shall be} an holy convocation, and in the seventh day there shall be an holy convocation to you; no manner of work shall be done in them, save {that} which every man must eat, that only may be done of you. {man: Heb. soul}	0.125	positive	Convoquem uma reunião santa no primeiro dia e outra no sétimo. Não façam nenhum trabalho nesses dias, exceto o da preparação da comida para todos. É só o que poderão fazer.
