verse_id	chapter	verse	text_en	polarity_en	label_en	text_pt
EXO.4.16	4	16	And he shall be thy spokesman unto the people: and he shall be, {even} he shall be to thee instead of a mouth, and thou shalt be to him instead of God.	0.0	neutral	Assim como Deus fala ao profeta, você falará a seu irmão, e ele será o seu porta-voz diante do povo.
EXO.4.17	4	17	And thou shalt take this rod in thine hand, wherewith thou shalt do signs.	0.0	neutral	"E leve na mão esta vara; com ela você fará os sinais miraculosos""."
EXO.4.18	4	18	And Moses went and returned to Jethro his father in law, and said unto him, Let me go, I pray thee, and return unto my brethren which {are} in Egypt, and see whether they be yet alive. And Jethro said to Moses, Go in peace. {Jethro: Heb. Jether}	0.1	neutral	"Depois Moisés voltou a Jetro, seu sogro, e lhe disse: ""Preciso voltar ao Egito para ver se meus parentes ainda vivem"". Jetro lhe respondeu: ""Vá em paz! """
EXO.4.19	4	19	And the LORD said unto Moses in Midian, Go, return into Egypt: for all the men are dead which sought thy life.	-0.2	negative	"Ora, o Senhor tinha dito a Moisés, em Midiã: ""Volte ao Egito, pois já morreram todos os que procuravam matá-lo""."
EXO.4.20	4	20	And Moses took his wife and his sons, and set them upon an ass, and he returned to the land of Egypt: and Moses took the rod of God in his hand.	0.0	neutral	Então Moisés levou sua mulher e seus filhos montados num jumento e partiu de volta ao Egito. Levava na mão a vara de Deus.
EXO.4.21	4	21	And the LORD said unto Moses, When thou goest to return into Egypt, see that thou do all those wonders before Pharaoh, which I have put in thine hand: but I will harden his heart, that he shall not let the people go.	0.0	neutral	"Disse mais o Senhor a Moisés: ""Quando você voltar ao Egito, tenha o cuidado de fazer diante do faraó todas as maravilhas que concedi a você o poder de realizar. Mas eu vou endurecer o coração dele, para não deixar o povo ir."
EXO.4.22	4	22	And thou shalt say unto Pharaoh, Thus saith the LORD, Israel {is} my son, {even} my firstborn:	0.0	neutral	Depois diga ao faraó que assim diz o Senhor: Israel é o meu primeiro filho,
EXO.4.23	4	23	And I say unto thee, Let my son go, that he may serve me: and if thou refuse to let him go, behold, I will slay thy son, {even} thy firstborn.	0.0	neutral	"e eu já lhe disse que deixe o meu filho ir para prestar-me culto. Mas você não quis deixá-lo ir; por isso matarei o seu primeiro filho! """
EXO.4.24	4	24	And it came to pass by the way in the inn, that the LORD met him, and sought to kill him.	0.0	neutral	Numa hospedaria ao longo do caminho, o Senhor foi ao encontro de Moisés e procurou matá-lo.
EXO.4.25	4	25	Then Zipporah took a sharp stone, and cut off the foreskin of her son, and cast {it} at his feet, and said, Surely a bloody husband {art} thou to me. {sharp...: or, knife} {cast...: Heb. made it touch}	-0.35	negative	"Mas Zípora pegou uma pedra afiada, cortou o prepúcio de seu filho e tocou os pés de Moisés. E disse: ""Você é para mim um marido de sangue! """
EXO.4.26	4	26	So he let him go: then she said, A bloody husband {thou art}, because of the circumcision.	-0.8	negative	"Ela disse ""marido de sangue"", referindo-se à circuncisão. Nessa ocasião o Senhor o deixou."
EXO.4.27	4	27	And the LORD said to Aaron, Go into the wilderness to meet Moses. And he went, and met him in the mount of God, and kissed him.	0.0	neutral	"Então o Senhor disse a Arão: ""Vá ao deserto encontrar-se com Moisés"". Ele foi, encontrou-se com Moisés no monte de Deus, e o saudou com um beijo."
EXO.4.28	4	28	And Moses told Aaron all the words of the LORD who had sent him, and all the signs which he had commanded him.	0.0	neutral	Moisés contou a Arão tudo o que o Senhor lhe tinha mandado dizer, e também falou-lhe de todos os sinais miraculosos que lhe havia ordenado realizar.
EXO.4.29	4	29	And Moses and Aaron went and gathered together all the elders of the children of Israel:	0.0	neutral	Assim Moisés e Arão foram e reuniram todas as autoridades dos israelitas,
EXO.4.30	4	30	And Aaron spake all the words which the LORD had spoken unto Moses, and did the signs in the sight of the people.	0.0	neutral	e Arão lhes contou tudo o que o Senhor dissera a Moisés. Em seguida Moisés também realizou os sinais diante do povo,
EXO.4.31	4	31	And the people believed: and when they heard that the LORD had visited the children of Israel, and that he had looked upon their affliction, then they bowed their heads and worshipped.	0.0	neutral	e eles creram. Quando o povo soube que o Senhor decidira vir em auxílio deles e tinha visto a sua opressão, curvou-se em adoração.
EXO.5.1	5	1	And afterward Moses and Aaron went in, and told Pharaoh, Thus saith the LORD God of Israel, Let my people go, that they may hold a feast unto me in the wilderness.	0.0	neutral	"Depois disso Moisés e Arão foram falar com o faraó e disseram: ""Assim diz o Senhor, o Deus de Israel: 'Deixe o meu povo ir para celebrar-me uma festa no deserto' ""."
EXO.5.2	5	2	And Pharaoh said, Who {is} the LORD, that I should obey his voice to let Israel go? I know not the LORD, neither will I let Israel go.	0.0	neutral	"O faraó respondeu: ""Quem é o Senhor, para que eu lhe obedeça e deixe Israel sair? Não conheço o Senhor, e não deixarei Israel sair""."
EXO.5.3	5	3	And they said, The God of the Hebrews hath met with us: let us go, we pray thee, three days' journey into the desert, and sacrifice unto the LORD our God; lest he fall upon us with pestilence, or with the sword.	0.0	neutral	"Eles insistiram: ""O Deus dos hebreus veio ao nosso encontro. Agora, permite-nos caminhar três dias no deserto, para oferecer sacrifícios ao Senhor, o nosso Deus; caso contrário, ele nos atingirá com pragas ou com a espada""."
EXO.5.4	5	4	And the king of Egypt said unto them, Wherefore do ye, Moses and Aaron, let the people from their works? get you unto your burdens.	0.0	neutral	"Mas o rei do Egito respondeu: ""Moisés e Arão, por que vocês estão fazendo o povo interromper suas tarefas? Voltem ao trabalho! """
EXO.5.5	5	5	And Pharaoh said, Behold, the people of the land now {are} many, and ye make them rest from their burdens.	0.5	positive	"E acrescentou: ""Essa gente já é tão numerosa, e vocês ainda os fazem parar de trabalhar! """
EXO.5.6	5	6	And Pharaoh commanded the same day the taskmasters of the people, and their officers, saying,	0.0	neutral	No mesmo dia o faraó deu a seguinte ordem aos feitores e capatazes responsáveis pelo povo:
EXO.5.7	5	7	Ye shall no more give the people straw to make brick, as heretofore: let them go and gather straw for themselves.	-0.25	negative	"""Não forneçam mais palha ao povo para fazer tijolos, como faziam antes. Eles que tratem de ajuntar palha!"
EXO.5.8	5	8	And the tale of the bricks, which they did make heretofore, ye shall lay upon them; ye shall not diminish {ought} thereof: for they {be} idle; therefore they cry, saying, Let us go {and} sacrifice to our God.	0.0	neutral	Mas exijam que continuem a fazer a mesma quantidade de tijolos; não reduzam a cota. São preguiçosos, e por isso estão clamando: 'Iremos oferecer sacrifícios ao nosso Deus'.
EXO.5.9	5	9	Let there more work be laid upon the men, that they may labour therein; and let them not regard vain words. {Let there...: Heb. Let the work be heavy upon the men}	0.15	positive	"Aumentem a carga de trabalho dessa gente para que cumpram suas tarefas e não dêem atenção a mentiras""."
EXO.5.10	5	10	And the taskmasters of the people went out, and their officers, and they spake to the people, saying, Thus saith Pharaoh, I will not give you straw.	0.0	neutral	"Os feitores e os capatazes foram dizer ao povo: ""Assim diz o faraó: 'Já não lhes darei palha."
EXO.5.11	5	11	Go ye, get you straw where ye can find it: yet not ought of your work shall be diminished.	0.0	neutral	"Saiam e recolham-na onde puderem achá-la, pois o trabalho de vocês em nada será reduzido' ""."
EXO.5.12	5	12	So the people were scattered abroad throughout all the land of Egypt to gather stubble instead of straw.	0.0	neutral	O povo então espalhou-se por todo o Egito, a fim de ajuntar restolho em lugar da palha.
EXO.5.13	5	13	And the taskmasters hasted {them}, saying, Fulfil your works, {your} daily tasks, as when there was straw. {your daily...: Heb. a matter of a day in his day}	0.0	neutral	"Enquanto isso, os feitores os pressionavam, dizendo: ""Completem a mesma tarefa diária que lhes foi exigida quando tinham palha""."
EXO.5.14	5	14	And the officers of the children of Israel, which Pharaoh's taskmasters had set over them, were beaten, {and} demanded, Wherefore have ye not fulfilled your task in making brick both yesterday and to day, as heretofore?	0.0	neutral	"Os capatazes israelitas indicados pelos feitores do faraó eram espancados e interrogados: ""Por que não completaram ontem e hoje a mesma cota de tijolos dos dias anteriores? """
EXO.5.15	5	15	Then the officers of the children of Israel came and cried unto Pharaoh, saying, Wherefore dealest thou thus with thy servants?	0.0	neutral	"Então os capatazes israelitas foram apelar para o faraó: ""Por que tratas os teus servos dessa maneira?"
EXO.5.16	5	16	There is no straw given unto thy servants, and they say to us, Make brick: and, behold, thy servants {are} beaten; but the fault {is} in thine own people.	0.6	positive	"Não se fornece a nós, teus servos, a palha, e contudo nos dizem: 'Façam tijolos! ' Os teus servos têm sido espancados, mas a culpa é do teu próprio povo""."
EXO.5.17	5	17	But he said, Ye {are} idle, {ye are} idle: therefore ye say, Let us go {and} do sacrifice to the LORD.	0.0	neutral	"Respondeu o faraó: ""Preguiçosos, é o que vocês são! Preguiçosos! Por isso andam dizendo: 'Iremos oferecer sacrifícios ao Senhor'."
EXO.5.18	5	18	Go therefore now, {and} work; for there shall no straw be given you, yet shall ye deliver the tale of bricks.	0.0	neutral	"Agora, voltem ao trabalho. Vocês não receberão palha alguma! Continuem a produzir a cota integral de tijolos! """
EXO.5.19	5	19	And the officers of the children of Israel did see {that} they {were} in evil {case}, after it was said, Ye shall not minish {ought} from your bricks of your daily task.	-0.5	negative	Os capatazes israelitas se viram em dificuldade quando lhes disseram que não poderiam reduzir a quantidade de tijolos exigida a cada dia.
EXO.5.20	5	20	And they met Moses and Aaron, who stood in the way, as they came forth from Pharaoh:	0.0	neutral	Ao saírem da presença do faraó, encontraram-se com Moisés e Arão, que estavam à espera deles,
EXO.5.21	5	21	And they said unto them, The LORD look upon you, and judge; because ye have made our savour to be abhorred in the eyes of Pharaoh, and in the eyes of his servants, to put a sword in their hand to slay us. {to be...: Heb. to stink}	0.0	neutral	"e lhes disseram: ""O Senhor os examine e os julgue! Vocês atraíram o ódio do faraó e dos seus conselheiros sobre nós, e lhes puseram nas mãos uma espada para que nos matem""."
EXO.5.22	5	22	And Moses returned unto the LORD, and said, Lord, wherefore hast thou {so} evil entreated this people? why {is} it {that} thou hast sent me?	-1.0	negative	"Moisés voltou-se para o Senhor e perguntou: ""Senhor, por que maltrataste a este povo? Afinal, por que me enviaste?"
EXO.5.23	5	23	For since I came to Pharaoh to speak in thy name, he hath done evil to this people; neither hast thou delivered thy people at all. {neither...: Heb. delivering thou hast not delivered}	-1.0	negative	"Desde que me dirigi ao faraó para falar em teu nome, ele tem maltratado a este povo, e tu de modo algum libertaste o teu povo! """
EXO.6.1	6	1	Then the LORD said unto Moses, Now shalt thou see what I will do to Pharaoh: for with a strong hand shall he let them go, and with a strong hand shall he drive them out of his land.	0.4333	positive	"Então o Senhor disse a Moisés: ""Agora você verá o que farei ao faraó: Por minha mão poderosa, ele os deixará ir; por minha mão poderosa, ele os expulsará do seu país""."
EXO.6.2	6	2	And God spake unto Moses, and said unto him, I {am} the LORD: {the LORD: or, JEHOVAH}	-0.75	negative	"Disse Deus ainda a Moisés: ""Eu sou o Senhor."
EXO.6.3	6	3	And I appeared unto Abraham, unto Isaac, and unto Jacob, by {the name of} God Almighty, but by my name JEHOVAH was I not known to them.	0.0	neutral	Apareci a Abraão, a Isaque e a Jacó como o Deus Todo-poderoso, mas pelo meu nome, o Senhor, não me revelei a eles.
EXO.6.4	6	4	And I have also established my covenant with them, to give them the land of Canaan, the land of their pilgrimage, wherein they were strangers.	0.0	neutral	Depois estabeleci com eles a minha aliança para dar-lhes a terra de Canaã, terra onde viveram como estrangeiros.
EXO.6.5	6	5	And I have also heard the groaning of the children of Israel, whom the Egyptians keep in bondage; and I have remembered my covenant.	0.0	neutral	E agora ouvi o lamento dos israelitas, a quem os egípcios mantêm escravos, e lembrei-me da minha aliança.
EXO.6.6	6	6	Wherefore say unto the children of Israel, I {am} the LORD, and I will bring you out from under the burdens of the Egyptians, and I will rid you out of their bondage, and I will redeem you with a stretched out arm, and with great judgments:	0.375	positive	"""Por isso, diga aos israelitas: Eu sou o Senhor. Eu os livrarei do trabalho imposto pelos egípcios. Eu os libertarei da escravidão e os resgatarei com braço forte e com poderosos atos de juízo."
EXO.6.7	6	7	And I will take you to me for a people, and I will be to you a God: and ye shall know that I {am} the LORD your God, which bringeth you out from under the burdens of the Egyptians.	0.0	neutral	Eu os farei meu povo e serei o Deus de vocês. Então vocês saberão que eu sou o Senhor, o Deus de vocês, que os livra do trabalho imposto pelos egípcios.
EXO.6.8	6	8	And I will bring you in unto the land, concerning the which I did swear to give it to Abraham, to Isaac, and to Jacob; and I will give it you for an heritage: I {am} the LORD. {swear: Heb. lift up my hand}	0.0	neutral	"E os farei entrar na terra que, com mão levantada, jurei que daria a Abraão, a Isaque e a Jacó. Eu a darei a vocês como propriedade. Eu sou o Senhor""."
EXO.6.9	6	9	And Moses spake so unto the children of Israel: but they hearkened not unto Moses for anguish of spirit, and for cruel bondage. {anguish: Heb. shortness, or, straitness}	-1.0	negative	Moisés declarou isso aos israelitas, mas eles não lhe deram ouvidos, por causa da angústia e da cruel escravidão que sofriam.
EXO.6.10	6	10	And the LORD spake unto Moses, saying,	0.0	neutral	Então o Senhor ordenou a Moisés:
EXO.6.11	6	11	Go in, speak unto Pharaoh king of Egypt, that he let the children of Israel go out of his land.	0.0	neutral	"""Vá dizer ao faraó, rei do Egito, que deixe os israelitas saírem do país""."
EXO.6.12	6	12	And Moses spake before the LORD, saying, Behold, the children of Israel have not hearkened unto me; how then shall Pharaoh hear me, who {am} of uncircumcised lips?	0.0	neutral	"Moisés, porém, disse na presença do Senhor: ""Se os israelitas não me dão ouvidos, como me ouvirá o faraó? Ainda mais que não tenho facilidade para falar! """
EXO.6.13	6	13	And the LORD spake unto Moses and unto Aaron, and gave them a charge unto the children of Israel, and unto Pharaoh king of Egypt, to bring the children of Israel out of the land of Egypt.	0.0	neutral	Mas, o Senhor ordenou a Moisés e a Arão que dissessem aos israelitas e ao faraó, rei do Egito, que tinham ordem para tirar do Egito os israelitas.
EXO.6.14	6	14	These {be} the heads of their fathers' houses: The sons of Reuben the firstborn of Israel; Hanoch, and Pallu, Hezron, and Carmi: these {be} the families of Reuben.	0.0	neutral	Estes foram os chefes das famílias israelitas: Os filhos de Rúben, filho mais velho de Israel, foram: Enoque, Palu, Hezrom e Carmi. Esses foram os clãs de Rúben.
EXO.6.15	6	15	And the sons of Simeon; Jemuel, and Jamin, and Ohad, and Jachin, and Zohar, and Shaul the son of a Canaanitish woman: these {are} the families of Simeon.	0.0	neutral	Os filhos de Simeão foram: Jemuel, Jamim, Oade, Jaquim, Zoar e Saul, filho de uma cananéia. Esses foram os clãs de Simeão.
EXO.6.16	6	16	And these {are} the names of the sons of Levi according to their generations; Gershon, and Kohath, and Merari: and the years of the life of Levi {were} an hundred thirty and seven years.	0.0	neutral	Estes, pois, são os nomes dos filhos de Levi, por ordem de nascimento: Gérson, Coate e Merari. Levi viveu cento e trinta e sete anos.
EXO.6.17	6	17	The sons of Gershon; Libni, and Shimi, according to their families.	0.0	neutral	Os filhos de Gérson, conforme seus clãs, foram Libni e Simei.
EXO.6.18	6	18	And the sons of Kohath; Amram, and Izhar, and Hebron, and Uzziel: and the years of the life of Kohath {were} an hundred thirty and three years.	0.0	neutral	Os filhos de Coate foram Anrão, Isar, Hebrom e Uziel. Coate viveu cento e trinta e três anos.
EXO.6.19	6	19	And the sons of Merari; Mahali and Mushi: these {are} the families of Levi according to their generations.	0.0	neutral	Os filhos de Merari foram Mali e Musi. Esses foram os clãs de Levi, por ordem de nascimento.
EXO.6.20	6	20	And Amram took him Jochebed his father's sister to wife; and she bare him Aaron and Moses: and the years of the life of Amram {were} an hundred and thirty and seven years.	0.05	neutral	Anrão tomou por mulher sua tia Joquebede, que lhe deu à luz Arão e Moisés. Anrão viveu cento e trinta e sete anos.
EXO.6.21	6	21	And the sons of Izhar; Korah, and Nepheg, and Zichri.	0.0	neutral	Os filhos de Isar foram Corá, Nefegue e Zicri.
EXO.6.22	6	22	And the sons of Uzziel; Mishael, and Elzaphan, and Zithri.	0.0	neutral	Os filhos de Uziel foram Misael, Elzafã e Sitri.
EXO.6.23	6	23	And Aaron took him Elisheba, daughter of Amminadab, sister of Naashon, to wife; and she bare him Nadab, and Abihu, Eleazar, and Ithamar.	0.05	neutral	Arão tomou por mulher a Eliseba, filha de Aminadabe, irmã de Naassom, e ela lhe deu à luz Nadabe, Abiú, Eleazar e Itamar.
EXO.6.24	6	24	And the sons of Korah; Assir, and Elkanah, and Abiasaph: these {are} the families of the Korhites.	0.0	neutral	Os filhos de Corá foram Assir, Elcana e Abiasafe. Esses foram os clãs dos coraítas.
EXO.6.25	6	25	And Eleazar Aaron's son took him {one} of the daughters of Putiel to wife; and she bare him Phinehas: these {are} the heads of the fathers of the Levites according to their families.	0.05	neutral	Eleazar, filho de Arão, tomou por mulher uma das filhas de Futiel, e ela lhe deu à luz Finéias. Esses foram os chefes das famílias dos levitas, conforme seus clãs.
EXO.6.26	6	26	These {are} that Aaron and Moses, to whom the LORD said, Bring out the children of Israel from the land of Egypt according to their armies.	0.0	neutral	"Foi a este Arão e a este Moisés que o Senhor disse: ""Tirem os israelitas do Egito, organizados segundo as suas divisões""."
EXO.6.27	6	27	These {are} they which spake to Pharaoh king of Egypt, to bring out the children of Israel from Egypt: these {are} that Moses and Aaron.	0.0	neutral	Foram eles, Moisés e Arão, que falaram ao faraó, rei do Egito, a fim de tirar os israelitas do Egito.
EXO.6.28	6	28	And it came to pass on the day {when} the LORD spake unto Moses in the land of Egypt,	0.0	neutral	Ora, quando o Senhor falou com Moisés no Egito,
EXO.6.29	6	29	That the LORD spake unto Moses, saying, I {am} the LORD: speak thou unto Pharaoh king of Egypt all that I say unto thee.	0.0	neutral	"disse-lhe: ""Eu sou o Senhor. Diga ao faraó, rei do Egito, tudo o que eu lhe disser""."
EXO.6.30	6	30	And Moses said before the LORD, Behold, I {am} of uncircumcised lips, and how shall Pharaoh hearken unto me?	0.0	neutral	"Moisés, porém, perguntou ao Senhor: ""Como o faraó me dará ouvidos, se não tenho facilidade para falar? """
EXO.7.1	7	1	And the LORD said unto Moses, See, I have made thee a god to Pharaoh: and Aaron thy brother shall be thy prophet.	0.0	neutral	"O Senhor lhe respondeu: ""Dou-lhe a minha autoridade perante o faraó, e seu irmão Arão será seu porta-voz."
EXO.7.2	7	2	Thou shalt speak all that I command thee: and Aaron thy brother shall speak unto Pharaoh, that he send the children of Israel out of his land.	0.0	neutral	Você falará tudo o que eu lhe ordenar, e o seu irmão Arão dirá ao faraó que deixe os israelitas saírem do país.
EXO.7.3	7	3	And I will harden Pharaoh's heart, and multiply my signs and my wonders in the land of Egypt.	0.0	neutral	Eu, porém, farei o coração do faraó resistir; e, embora multiplique meus sinais e maravilhas no Egito,
EXO.7.4	7	4	But Pharaoh shall not hearken unto you, that I may lay my hand upon Egypt, and bring forth mine armies, {and} my people the children of Israel, out of the land of Egypt by great judgments.	0.8	positive	ele não os ouvirá. Então porei a minha mão sobre o Egito, e com poderosos atos de juízo tirarei do Egito os meus exércitos, o meu povo, os israelitas.
EXO.7.5	7	5	And the Egyptians shall know that I {am} the LORD, when I stretch forth mine hand upon Egypt, and bring out the children of Israel from among them.	0.0	neutral	"E os egípcios saberão que eu sou o Senhor, quando eu estender a minha mão contra o Egito e tirar de lá os israelitas""."
EXO.7.6	7	6	And Moses and Aaron did as the LORD commanded them, so did they.	0.0	neutral	Moisés e Arão fizeram como o Senhor lhes havia ordenado.
EXO.7.7	7	7	And Moses {was} fourscore years old, and Aaron fourscore and three years old, when they spake unto Pharaoh.	0.1	neutral	Moisés tinha oitenta anos de idade e Arão oitenta e três, quando falaram com o faraó.
EXO.7.8	7	8	And the LORD spake unto Moses and unto Aaron, saying,	0.0	neutral	Disse o Senhor a Moisés e a Arão:
EXO.7.9	7	9	When Pharaoh shall speak unto you, saying, Shew a miracle for you: then thou shalt say unto Aaron, Take thy rod, and cast {it} before Pharaoh, {and} it shall become a serpent.	0.0	neutral	"""Quando o faraó lhes pedir que façam algum milagre, diga a Arão que tome a sua vara e a jogue diante do faraó; e ela se transformará numa serpente""."
EXO.7.10	7	10	And Moses and Aaron went in unto Pharaoh, and they did so as the LORD had commanded: and Aaron cast down his rod before Pharaoh, and before his servants, and it became a serpent.	-0.1556	negative	Moisés e Arão dirigiram-se ao faraó e fizeram como o Senhor tinha ordenado. Arão jogou a vara diante do faraó e seus conselheiros, e ela se transformou em serpente.
EXO.7.11	7	11	Then Pharaoh also called the wise men and the sorcerers: now the magicians of Egypt, they also did in like manner with their enchantments.	0.7	positive	O faraó, porém, mandou chamar os sábios e feiticeiros; e também os magos do Egito fizeram a mesma coisa por meio das suas ciências ocultas.
EXO.7.12	7	12	For they cast down every man his rod, and they became serpents: but Aaron's rod swallowed up their rods.	-0.1556	negative	Cada um deles jogou ao chão uma vara, e estas se transformaram em serpentes. Mas a vara de Arão engoliu as varas deles.
EXO.7.13	7	13	And he hardened Pharaoh's heart, that he hearkened not unto them; as the LORD had said.	0.0	neutral	Contudo, o coração do faraó se endureceu e ele não quis dar ouvidos a Moisés e a Arão, como o Senhor tinha dito.
EXO.7.14	7	14	And the LORD said unto Moses, Pharaoh's heart {is} hardened, he refuseth to let the people go.	0.0	neutral	"Disse o Senhor a Moisés: ""O coração do faraó está obstinado; ele não quer deixar o povo ir."
EXO.7.15	7	15	Get thee unto Pharaoh in the morning; lo, he goeth out unto the water; and thou shalt stand by the river's brink against he come; and the rod which was turned to a serpent shalt thou take in thine hand.	0.0	neutral	Vá ao faraó de manhã, quando ele estiver indo às águas. Espere-o na margem do rio para encontrá-lo e leve também a vara que se transformou em serpente.
EXO.7.16	7	16	And thou shalt say unto him, The LORD God of the Hebrews hath sent me unto thee, saying, Let my people go, that they may serve me in the wilderness: and, behold, hitherto thou wouldest not hear.	0.0	neutral	Diga-lhe: O Senhor, o Deus dos hebreus, mandou-me dizer-lhe: Deixe ir o meu povo, para prestar-me culto no deserto. Mas até agora você não me atendeu.
EXO.7.17	7	17	Thus saith the LORD, In this thou shalt know that I {am} the LORD: behold, I will smite with the rod that {is} in mine hand upon the waters which {are} in the river, and they shall be turned to blood.	0.0	neutral	Assim diz o Senhor: Nisto você saberá que eu sou o Senhor: com a vara que trago na mão ferirei as águas do Nilo, e elas se transformarão em sangue.
EXO.7.18	7	18	And the fish that {is} in the river shall die, and the river shall stink; and the Egyptians shall lothe to drink of the water of the river.	0.0	neutral	"Os peixes do Nilo morrerão, o rio ficará cheirando mal, e os egípcios não suportarão beber das suas águas""."
EXO.7.19	7	19	And the LORD spake unto Moses, Say unto Aaron, Take thy rod, and stretch out thine hand upon the waters of Egypt, upon their streams, upon their rivers, and upon their ponds, and upon all their pools of water, that they may become blood; and {that} there may be blood throughout all the land of Egypt, both in {vessels of} wood, and in {vessels of} stone. {pools...: Heb. gathering of their waters}	0.0	neutral	"Disse o Senhor a Moisés: ""Diga a Arão que tome a sua vara e estenda a mão sobre as águas do Egito, dos rios, dos canais, dos açudes e de todos os reservatórios, e elas se transformarão em sangue. Haverá sangue por toda a terra do Egito, até nas vasilhas de madeira e nas vasilhas de pedra""."
