verse_id	chapter	verse	text_en	polarity_en	label_en	text_pt
EXO.7.20	7	20	And Moses and Aaron did so, as the LORD commanded; and he lifted up the rod, and smote the waters that {were} in the river, in the sight of Pharaoh, and in the sight of his servants; and all the waters that {were} in the river were turned to blood.	0.0	neutral	Moisés e Arão fizeram como o Senhor tinha ordenado. Arão levantou a vara e feriu as águas do Nilo na presença do faraó e dos seus conselheiros; e toda a água do rio transformou-se em sangue.
EXO.7.21	7	21	And the fish that {was} in the river died; and the river stank, and the Egyptians could not drink of the water of the river; and there was blood throughout all the land of Egypt.	0.0	neutral	Os peixes morreram e o rio cheirava tão mal que os egípcios não conseguiam beber das suas águas. Havia sangue por toda a terra do Egito.
EXO.7.22	7	22	And the magicians of Egypt did so with their enchantments: and Pharaoh's heart was hardened, neither did he hearken unto them; as the LORD had said.	0.0	neutral	Mas os magos do Egito fizeram a mesma coisa por meio de suas ciências ocultas. O coração do faraó se endureceu, e ele não deu ouvidos a Moisés e a Arão, como o Senhor tinha dito.
EXO.7.23	7	23	And Pharaoh turned and went into his house, neither did he set his heart to this also.	0.0	neutral	Pelo contrário, deu-lhes as costas e voltou para o seu palácio. Nem assim o faraó levou isso a sério.
EXO.7.24	7	24	And all the Egyptians digged round about the river for water to drink; for they could not drink of the water of the river.	-0.2	negative	Todos os egípcios cavaram buracos às margens do Nilo para encontrar água potável, pois da água do rio não podiam mais beber.
EXO.7.25	7	25	And seven days were fulfilled, after that the LORD had smitten the river.	0.0	neutral	Passaram-se sete dias depois que o Senhor feriu o Nilo.
EXO.8.1	8	1	And the LORD spake unto Moses, Go unto Pharaoh, and say unto him, Thus saith the LORD, Let my people go, that they may serve me.	0.0	neutral	"O Senhor falou a Moisés: ""Vá ao faraó e diga-lhe que assim diz o Senhor: Deixe o meu povo ir para que me preste culto."
EXO.8.2	8	2	And if thou refuse to let {them} go, behold, I will smite all thy borders with frogs:	0.0	neutral	Se você não quiser deixá-lo ir, mandarei sobre todo o seu território uma praga de rãs.
EXO.8.3	8	3	And the river shall bring forth frogs abundantly, which shall go up and come into thine house, and into thy bedchamber, and upon thy bed, and into the house of thy servants, and upon thy people, and into thine ovens, and into thy kneadingtroughs: {kneadingtroughs: or, dough}	-0.075	neutral	O Nilo ficará infestado de rãs. Elas subirão e entrarão em seu palácio, em seu quarto, e até em sua cama; estarão também nas casas dos seus conselheiros e do seu povo, dentro dos seus fornos e nas suas amassadeiras.
EXO.8.4	8	4	And the frogs shall come up both on thee, and upon thy people, and upon all thy servants.	0.0	neutral	"As rãs subirão em você, em seus conselheiros e em seu povo""."
EXO.8.5	8	5	And the LORD spake unto Moses, Say unto Aaron, Stretch forth thine hand with thy rod over the streams, over the rivers, and over the ponds, and cause frogs to come up upon the land of Egypt.	0.0	neutral	"Depois o Senhor disse a Moisés: ""Diga a Arão que estenda a mão com a vara sobre os rios, sobre os canais e sobre os açudes, e faça subir deles rãs sobre a terra do Egito""."
EXO.8.6	8	6	And Aaron stretched out his hand over the waters of Egypt; and the frogs came up, and covered the land of Egypt.	-0.05	neutral	Assim Arão estendeu a mão sobre as águas do Egito, e as rãs subiram e cobriram a terra do Egito.
EXO.8.7	8	7	And the magicians did so with their enchantments, and brought up frogs upon the land of Egypt.	0.0	neutral	Mas os magos fizeram a mesma coisa por meio das suas ciências ocultas: fizeram subir rãs sobre a terra do Egito.
EXO.8.8	8	8	Then Pharaoh called for Moses and Aaron, and said, Intreat the LORD, that he may take away the frogs from me, and from my people; and I will let the people go, that they may do sacrifice unto the LORD.	0.0	neutral	"O faraó mandou chamar Moisés e Arão e disse: ""Orem ao Senhor para que ele tire estas rãs de mim e do meu povo; então deixarei o povo ir e oferecer sacrifícios ao Senhor""."
EXO.8.9	8	9	And Moses said unto Pharaoh, Glory over me: when shall I intreat for thee, and for thy servants, and for thy people, to destroy the frogs from thee and thy houses, {that} they may remain in the river only? {Glory...: or, Have this honour over me, etc} {when: or, against when} {to destroy: Heb. to cut off}	-0.1333	negative	"Moisés disse ao faraó: ""Tua é a honra de dizer-me quando devo orar por ti, por teus conselheiros e por teu povo para que tu e tuas casas fiquem livres das rãs e sobrem apenas as que estão no rio""."
EXO.8.10	8	10	And he said, To morrow. And he said, {Be it} according to thy word: that thou mayest know that {there is} none like unto the LORD our God. {To morrow: or, Against to morrow}	0.0	neutral	"""Amanhã"", disse o faraó. Moisés respondeu: ""Será como tu dizes, para que saibas que não há ninguém como o Senhor nosso Deus."
EXO.8.11	8	11	And the frogs shall depart from thee, and from thy houses, and from thy servants, and from thy people; they shall remain in the river only.	0.0	neutral	"As rãs deixarão a ti, às tuas casas, a teus conselheiros e a teu povo; sobrarão apenas as que estão no rio""."
EXO.8.12	8	12	And Moses and Aaron went out from Pharaoh: and Moses cried unto the LORD because of the frogs which he had brought against Pharaoh.	0.0	neutral	Depois que Moisés e Arão saíram da presença do faraó, Moisés clamou ao Senhor por causa das rãs que enviara sobre o faraó.
EXO.8.13	8	13	And the LORD did according to the word of Moses; and the frogs died out of the houses, out of the villages, and out of the fields.	0.0	neutral	E o Senhor atendeu o pedido de Moisés; morreram as rãs que estavam nas casas, nos pátios e nos campos.
EXO.8.14	8	14	And they gathered them together upon heaps: and the land stank.	0.0	neutral	Foram ajuntadas em montões e, por isso, a terra cheirou mal.
EXO.8.15	8	15	But when Pharaoh saw that there was respite, he hardened his heart, and hearkened not unto them; as the LORD had said.	0.0	neutral	Mas quando o faraó percebeu que houve alívio, obstinou-se em seu coração e não deu mais ouvidos a Moisés e a Arão, conforme o Senhor tinha dito.
EXO.8.16	8	16	And the LORD said unto Moses, Say unto Aaron, Stretch out thy rod, and smite the dust of the land, that it may become lice throughout all the land of Egypt.	0.0	neutral	"Então o Senhor disse a Moisés: ""Diga a Arão que estenda a sua vara e fira o pó da terra, e o pó se transformará em piolhos por toda a terra do Egito""."
EXO.8.17	8	17	And they did so; for Aaron stretched out his hand with his rod, and smote the dust of the earth, and it became lice in man, and in beast; all the dust of the land became lice throughout all the land of Egypt.	-0.05	neutral	Assim fizeram, e quando Arão estendeu a mão e com a vara feriu o pó da terra, surgiram piolhos nos homens e nos animais. Todo o pó de toda a terra do Egito transformou-se em piolhos.
EXO.8.18	8	18	And the magicians did so with their enchantments to bring forth lice, but they could not: so there were lice upon man, and upon beast.	0.0	neutral	Mas, quando os magos tentaram fazer surgir piolhos por meio das suas ciências ocultas, não conseguiram. E os piolhos infestavam os homens e os animais.
EXO.8.19	8	19	Then the magicians said unto Pharaoh, This {is} the finger of God: and Pharaoh's heart was hardened, and he hearkened not unto them; as the LORD had said.	0.0	neutral	"Os magos disseram ao faraó: ""Isso é o dedo de Deus"". Mas o coração do faraó permaneceu endurecido, e ele não quis ouvi-los, conforme o Senhor tinha dito."
EXO.8.20	8	20	And the LORD said unto Moses, Rise up early in the morning, and stand before Pharaoh; lo, he cometh forth to the water; and say unto him, Thus saith the LORD, Let my people go, that they may serve me.	0.1	neutral	"Depois o Senhor disse a Moisés: ""Levante-se bem cedo e apresente-se ao faraó, quando ele estiver indo às águas. Diga-lhe que assim diz o Senhor: Deixe o meu povo ir para que me preste culto."
EXO.8.21	8	21	Else, if thou wilt not let my people go, behold, I will send swarms {of flies} upon thee, and upon thy servants, and upon thy people, and into thy houses: and the houses of the Egyptians shall be full of swarms {of flies}, and also the ground whereon they {are}. {swarms...: or, a mixture of noisome beasts, etc}	0.35	positive	Se você não deixar meu povo ir, enviarei enxames de moscas para atacar você, os seus conselheiros, o seu povo e as suas casas. As casas dos egípcios, bem como o chão em que pisam, se encherão de moscas.
EXO.8.22	8	22	And I will sever in that day the land of Goshen, in which my people dwell, that no swarms {of flies} shall be there; to the end thou mayest know that I {am} the LORD in the midst of the earth.	0.0	neutral	"""Mas naquele dia tratarei de maneira diferente a terra de Gósen, onde habita o meu povo; nenhum enxame de moscas se achará ali, para que você saiba que eu, o Senhor, estou nesta terra."
EXO.8.23	8	23	And I will put a division between my people and thy people: to morrow shall this sign be. {a division: Heb. a redemption} {to morrow: or, by to morrow}	0.0	neutral	"Farei distinção entre o meu povo e o seu. Este sinal miraculoso acontecerá amanhã""."
EXO.8.24	8	24	And the LORD did so; and there came a grievous swarm {of flies} into the house of Pharaoh, and {into} his servants' houses, and into all the land of Egypt: the land was corrupted by reason of the swarm {of flies}. {corrupted: or, destroyed}	-0.8	negative	E assim fez o Senhor. Grandes enxames de moscas invadiram o palácio do faraó e as casas de seus conselheiros, e em todo o Egito a terra foi arruinada pelas moscas.
EXO.8.25	8	25	And Pharaoh called for Moses and for Aaron, and said, Go ye, sacrifice to your God in the land.	0.0	neutral	"Então o faraó mandou chamar Moisés e Arão e disse: ""Vão oferecer sacrifícios ao seu Deus, mas não saiam do país""."
EXO.8.26	8	26	And Moses said, It is not meet so to do; for we shall sacrifice the abomination of the Egyptians to the LORD our God: lo, shall we sacrifice the abomination of the Egyptians before their eyes, and will they not stone us?	0.0	neutral	"""Isso não seria sensato"", respondeu Moisés; ""os sacrifícios que oferecemos ao nosso Deus são um sacrilégio para os egípcios. Se oferecermos sacrifícios que lhes pareçam sacrilégio, isso não os levará a nos apedrejar?"
EXO.8.27	8	27	We will go three days' journey into the wilderness, and sacrifice to the LORD our God, as he shall command us.	0.0	neutral	"Faremos três dias de viagem no deserto, e ofereceremos sacrifícios ao Senhor nosso Deus, como ele nos ordena. """
EXO.8.28	8	28	And Pharaoh said, I will let you go, that ye may sacrifice to the LORD your God in the wilderness; only ye shall not go very far away: intreat for me.	0.065	neutral	"Disse o faraó: ""Eu os deixarei ir e oferecer sacrifícios ao Senhor seu Deus no deserto, mas não se afastem muito e orem por mim também""."
EXO.8.29	8	29	And Moses said, Behold, I go out from thee, and I will intreat the LORD that the swarms {of flies} may depart from Pharaoh, from his servants, and from his people, to morrow: but let not Pharaoh deal deceitfully any more in not letting the people go to sacrifice to the LORD.	0.5	positive	"Moisés respondeu: ""Assim que sair da tua presença, orarei ao Senhor, e amanhã os enxames de moscas deixarão o faraó, teus conselheiros e teu povo. Que somente o faraó não volte a agir com falsidade, impedindo que o povo vá oferecer sacrifícios ao Senhor""."
EXO.8.30	8	30	And Moses went out from Pharaoh, and intreated the LORD.	0.0	neutral	Então Moisés saiu da presença do faraó e orou ao Senhor,
EXO.8.31	8	31	And the LORD did according to the word of Moses; and he removed the swarms {of flies} from Pharaoh, from his servants, and from his people; there remained not one.	0.0	neutral	e o Senhor atendeu o seu pedido: as moscas deixaram o faraó, seus conselheiros e seu povo; não restou uma só mosca.
EXO.8.32	8	32	And Pharaoh hardened his heart at this time also, neither would he let the people go.	0.0	neutral	Mas também dessa vez o faraó obstinou-se em seu coração e não deixou que o povo saísse.
EXO.9.1	9	1	Then the LORD said unto Moses, Go in unto Pharaoh, and tell him, Thus saith the LORD God of the Hebrews, Let my people go, that they may serve me.	0.0	neutral	"Depois o Senhor disse a Moisés: ""Vá ao faraó e diga-lhe que assim diz o Senhor, o Deus dos hebreus: Deixe o meu povo ir para que me preste culto."
EXO.9.2	9	2	For if thou refuse to let {them} go, and wilt hold them still,	0.0	neutral	Se você ainda não quiser deixá-lo ir e continuar a impedi-lo,
EXO.9.3	9	3	Behold, the hand of the LORD is upon thy cattle which {is} in the field, upon the horses, upon the asses, upon the camels, upon the oxen, and upon the sheep: {there shall be} a very grievous murrain.	-0.875	negative	saiba que a mão do Senhor trará uma praga terrível sobre os rebanhos do faraó que estão nos campos: os cavalos, os jumentos, os camelos, os bois e as ovelhas.
EXO.9.4	9	4	And the LORD shall sever between the cattle of Israel and the cattle of Egypt: and there shall nothing die of all {that is} the children's of Israel.	0.0	neutral	"Mas o Senhor fará distinção entre os rebanhos de Israel e os do Egito. Nenhum animal dos israelitas morrerá""."
EXO.9.5	9	5	And the LORD appointed a set time, saying, To morrow the LORD shall do this thing in the land.	0.0	neutral	"O Senhor estabeleceu um prazo: ""Amanhã o Senhor fará o que prometeu nesta terra""."
EXO.9.6	9	6	And the LORD did that thing on the morrow, and all the cattle of Egypt died: but of the cattle of the children of Israel died not one.	0.0	neutral	No dia seguinte o Senhor o fez. Todos os rebanhos dos egípcios morreram, mas nenhum rebanho dos israelitas morreu.
EXO.9.7	9	7	And Pharaoh sent, and, behold, there was not one of the cattle of the Israelites dead. And the heart of Pharaoh was hardened, and he did not let the people go.	-0.2	negative	O faraó mandou verificar e constatou que nenhum animal dos israelitas havia morrido. Mesmo assim, seu coração continuou obstinado e não deixou o povo ir.
EXO.9.8	9	8	And the LORD said unto Moses and unto Aaron, Take to you handfuls of ashes of the furnace, and let Moses sprinkle it toward the heaven in the sight of Pharaoh.	0.0	neutral	"Disse mais o Senhor a Moisés e a Arão: ""Tirem um punhado de cinza de uma fornalha, e Moisés a espalhará no ar, diante do faraó."
EXO.9.9	9	9	And it shall become small dust in all the land of Egypt, and shall be a boil breaking forth {with} blains upon man, and upon beast, throughout all the land of Egypt.	-0.25	negative	"Ela se tornará como um pó fino sobre toda a terra do Egito, e feridas purulentas surgirão nos homens e nos animais em todo o Egito""."
EXO.9.10	9	10	And they took ashes of the furnace, and stood before Pharaoh; and Moses sprinkled it up toward heaven; and it became a boil breaking forth {with} blains upon man, and upon beast.	0.0	neutral	Eles tiraram cinza duma fornalha e se puseram diante do faraó. Moisés a espalhou pelo ar, e feridas purulentas começaram a estourar nos homens e nos animais.
EXO.9.11	9	11	And the magicians could not stand before Moses because of the boils; for the boil was upon the magicians, and upon all the Egyptians.	0.0	neutral	Nem os magos podiam manter-se diante de Moisés, porque ficaram cobertos de feridas, como os demais egípcios.
EXO.9.12	9	12	And the LORD hardened the heart of Pharaoh, and he hearkened not unto them; as the LORD had spoken unto Moses.	0.0	neutral	Mas o Senhor endureceu o coração do faraó, e ele se recusou a atender Moisés e Arão, conforme o Senhor tinha dito a Moisés.
EXO.9.13	9	13	And the LORD said unto Moses, Rise up early in the morning, and stand before Pharaoh, and say unto him, Thus saith the LORD God of the Hebrews, Let my people go, that they may serve me.	0.1	neutral	"Disse o Senhor a Moisés: ""Levante-se logo cedo, apresente-se ao faraó e diga-lhe que assim diz o Senhor, o Deus dos hebreus: Deixe o meu povo ir para que me preste culto."
EXO.9.14	9	14	For I will at this time send all my plagues upon thine heart, and upon thy servants, and upon thy people; that thou mayest know that {there is} none like me in all the earth.	0.0	neutral	Caso contrário, mandarei desta vez todas as minhas pragas contra você, contra os seus conselheiros e contra o seu povo, para que você saiba que em toda a terra não há ninguém como eu.
EXO.9.15	9	15	For now I will stretch out my hand, that I may smite thee and thy people with pestilence; and thou shalt be cut off from the earth.	0.0	neutral	Porque eu já poderia ter estendido a mão, ferindo você e o seu povo com uma praga que teria eliminado você da terra.
EXO.9.16	9	16	And in very deed for this {cause} have I raised thee up, for to shew {in} thee my power; and that my name may be declared throughout all the earth. {raised...: Heb. made thee stand}	0.2	positive	Mas eu o mantive de pé exatamente com este propósito: mostrar-lhe o meu poder e fazer que o meu nome seja proclamado em toda a terra.
EXO.9.17	9	17	As yet exaltest thou thyself against my people, that thou wilt not let them go?	0.0	neutral	Contudo você ainda insiste em colocar-se contra o meu povo e não o deixa ir.
EXO.9.18	9	18	Behold, to morrow about this time I will cause it to rain a very grievous hail, such as hath not been in Egypt since the foundation thereof even until now.	-0.5	negative	Amanhã, a esta hora, enviarei a pior tempestade de granizo que já caiu sobre o Egito, desde o dia da sua fundação até hoje.
EXO.9.19	9	19	Send therefore now, {and} gather thy cattle, and all that thou hast in the field; {for upon} every man and beast which shall be found in the field, and shall not be brought home, the hail shall come down upon them, and they shall die.	-0.1556	negative	"Agora, mande recolher os seus rebanhos e tudo o que você tem nos campos. Todos os homens e animais que estiverem nos campos, que não tiverem sido abrigados, serão atingidos pelo granizo e morrerão""."
EXO.9.20	9	20	He that feared the word of the LORD among the servants of Pharaoh made his servants and his cattle flee into the houses:	0.0	neutral	Os conselheiros do faraó que temiam a palavra do Senhor apressaram-se em recolher aos abrigos os seus rebanhos e os seus escravos.
EXO.9.21	9	21	And he that regarded not the word of the LORD left his servants and his cattle in the field. {regarded...: Heb. set not his heart unto}	0.0	neutral	Mas os que não se importaram com a palavra do Senhor deixaram os seus escravos e os seus rebanhos no campo.
EXO.9.22	9	22	And the LORD said unto Moses, Stretch forth thine hand toward heaven, that there may be hail in all the land of Egypt, upon man, and upon beast, and upon every herb of the field, throughout the land of Egypt.	0.0	neutral	"Então o Senhor disse a Moisés: ""Estenda a mão para o céu, e cairá granizo sobre toda a terra do Egito: sobre homens, sobre animais e sobre toda a vegetação do Egito""."
EXO.9.23	9	23	And Moses stretched forth his rod toward heaven: and the LORD sent thunder and hail, and the fire ran along upon the ground; and the LORD rained hail upon the land of Egypt.	-0.05	neutral	Quando Moisés estendeu a vara para o céu, o Senhor fez vir trovões e granizo, e raios caíam sobre a terra. Assim o Senhor fez chover granizo sobre a terra do Egito.
EXO.9.24	9	24	So there was hail, and fire mingled with the hail, very grievous, such as there was none like it in all the land of Egypt since it became a nation.	-0.5	negative	Caiu granizo, e raios cortavam o céu em todas as direções. Nunca houve uma tempestade de granizo como aquela em todo o Egito, desde que este se tornou uma nação.
EXO.9.25	9	25	And the hail smote throughout all the land of Egypt all that {was} in the field, both man and beast; and the hail smote every herb of the field, and brake every tree of the field.	0.0	neutral	Em todo o Egito o granizo atingiu tudo o que havia nos campos, tanto homens como animais; destruiu toda a vegetação, além de quebrar todas as árvores.
EXO.9.26	9	26	Only in the land of Goshen, where the children of Israel {were}, was there no hail.	0.0	neutral	Somente na terra de Gósen, onde estavam os israelitas, não caiu granizo.
EXO.9.27	9	27	And Pharaoh sent, and called for Moses and Aaron, and said unto them, I have sinned this time: the LORD {is} righteous, and I and my people {are} wicked.	0.0	neutral	"Então o faraó mandou chamar Moisés e Arão e disse-lhes: ""Desta vez eu pequei. O Senhor é justo; eu e o meu povo é que somos culpados."
EXO.9.28	9	28	Intreat the LORD (for {it is} enough) that there be no {more} mighty thunderings and hail; and I will let you go, and ye shall stay no longer. {mighty...: Heb. voices of God}	0.1375	positive	"Orem ao Senhor! Os trovões de Deus e o granizo já são demais. Eu os deixarei ir; não precisam mais ficar aqui""."
EXO.9.29	9	29	And Moses said unto him, As soon as I am gone out of the city, I will spread abroad my hands unto the LORD; {and} the thunder shall cease, neither shall there be any more hail; that thou mayest know how that the earth {is} the LORD'S.	0.5	positive	"Moisés respondeu: ""Assim que eu tiver saído da cidade, erguerei as mãos em oração ao Senhor. Os trovões cessarão e não cairá mais granizo, para que saibas que a terra pertence ao Senhor."
EXO.9.30	9	30	But as for thee and thy servants, I know that ye will not yet fear the LORD God.	0.0	neutral	"Mas eu bem sei que tu e os teus conselheiros ainda não sabem o que é tremer diante do Senhor Deus! """
EXO.9.31	9	31	And the flax and the barley was smitten: for the barley {was} in the ear, and the flax {was} bolled.	0.0	neutral	( O linho e a cevada foram destruídos, pois a cevada já havia amadurecido e o linho estava em flor.
EXO.9.32	9	32	But the wheat and the rie were not smitten: for they {were} not grown up. {not grown...: Heb. hidden or, dark}	-0.1583	negative	Todavia, o trigo e o centeio nada sofreram, pois só amadurecem mais tarde. )
EXO.9.33	9	33	And Moses went out of the city from Pharaoh, and spread abroad his hands unto the LORD: and the thunders and hail ceased, and the rain was not poured upon the earth.	0.0	neutral	Assim Moisés deixou o faraó, saiu da cidade, e ergueu as mãos ao Senhor. Os trovões e o granizo cessaram, e a chuva parou.
EXO.9.34	9	34	And when Pharaoh saw that the rain and the hail and the thunders were ceased, he sinned yet more, and hardened his heart, he and his servants.	0.5	positive	Quando o faraó viu que a chuva, o granizo e os trovões haviam cessado, pecou novamente e obstinou-se em seu coração, ele e os seus conselheiros.
EXO.9.35	9	35	And the heart of Pharaoh was hardened, neither would he let the children of Israel go; as the LORD had spoken by Moses. {by Moses: Heb. by the hand of Moses}	0.0	neutral	O coração do faraó continuou endurecido, e ele não deixou que os israelitas saíssem, como o Senhor tinha dito por meio de Moisés.
EXO.10.1	10	1	And the LORD said unto Moses, Go in unto Pharaoh: for I have hardened his heart, and the heart of his servants, that I might shew these my signs before him:	0.0	neutral	"O Senhor disse a Moisés: ""Vá ao faraó, pois tornei obstinado o coração dele e o de seus conselheiros, a fim de realizar estes meus prodígios entre eles,"
EXO.10.2	10	2	And that thou mayest tell in the ears of thy son, and of thy son's son, what things I have wrought in Egypt, and my signs which I have done among them; that ye may know how that I {am} the LORD.	0.0	neutral	"para que você possa contar a seus filhos e netos como zombei dos egípcios e como realizei meus milagres entre eles. Assim vocês saberão que eu sou o Senhor""."
EXO.10.3	10	3	And Moses and Aaron came in unto Pharaoh, and said unto him, Thus saith the LORD God of the Hebrews, How long wilt thou refuse to humble thyself before me? let my people go, that they may serve me.	-0.125	negative	"Dirigiram-se, pois, Moisés e Arão ao faraó e lhe disseram: ""Assim diz o Senhor, o Deus dos hebreus: 'Até quando você se recusará a humilhar-se perante mim? Deixe ir o meu povo, para que me preste culto."
EXO.10.4	10	4	Else, if thou refuse to let my people go, behold, to morrow will I bring the locusts into thy coast:	0.0	neutral	Se você não quiser deixá-lo ir, farei vir gafanhotos sobre o seu território amanhã.
EXO.10.5	10	5	And they shall cover the face of the earth, that one cannot be able to see the earth: and they shall eat the residue of that which is escaped, which remaineth unto you from the hail, and shall eat every tree which groweth for you out of the field: {face: Heb. eye}	-0.125	negative	Eles cobrirão a face da terra até não se poder enxergar o solo. Devorarão tanto o pouco que ainda lhes restou da tempestade de granizo como todas as árvores que estiverem brotando nos campos.
EXO.10.6	10	6	And they shall fill thy houses, and the houses of all thy servants, and the houses of all the Egyptians; which neither thy fathers, nor thy fathers' fathers have seen, since the day that they were upon the earth unto this day. And he turned himself, and went out from Pharaoh.	0.0	neutral	"Encherão os seus palácios e as casas de todos os seus conselheiros e de todos os egípcios: algo que nem os seus pais nem os seus antepassados jamais viram, desde o dia em que se fixaram nesta terra até o dia de hoje' "". A seguir Moisés virou as costas e saiu da presença do faraó."
