verse_id	chapter	verse	text_en	polarity_en	label_en	text_pt
EXO.36.34	36	34	And he overlaid the boards with gold, and made their rings {of} gold {to be} places for the bars, and overlaid the bars with gold.	0.0	neutral	Revestiu de ouro as armações e fez argolas de ouro para sustentar os travessões, os quais também revestiu de ouro.
EXO.36.35	36	35	And he made a vail {of} blue, and purple, and scarlet, and fine twined linen: {with} cherubims made he it of cunning work.	-0.0833	neutral	Fez o véu de linho fino trançado e de fios de tecido azul, roxo e vermelho, e mandou bordar nele querubins.
EXO.36.36	36	36	And he made thereunto four pillars {of} shittim {wood}, and overlaid them with gold: their hooks {were of} gold; and he cast for them four sockets of silver.	0.0	neutral	Fez-lhe quatro colunas de madeira de acácia e as revestiu de ouro. Fez-lhe ainda ganchos de ouro e fundiu as suas bases de prata.
EXO.36.37	36	37	And he made an hanging for the tabernacle door {of} blue, and purple, and scarlet, and fine twined linen, of needlework; {of needlework: Heb. the work of a needleworker or, embroiderer}	0.2083	positive	Para a entrada da tenda fez uma cortina de linho fino trançado e de fios de tecido azul, roxo e vermelho, obra de bordador;
EXO.36.38	36	38	And the five pillars of it with their hooks: and he overlaid their chapiters and their fillets with gold: but their five sockets {were of} brass.	0.0	neutral	e fez-lhe cinco colunas com ganchos. Revestiu de ouro as partes superior e lateral das colunas e fez de bronze as suas cinco bases.
EXO.37.1	37	1	And Bezaleel made the ark {of} shittim wood: two cubits and a half {was} the length of it, and a cubit and a half the breadth of it, and a cubit and a half the height of it:	-0.1667	negative	Bezalel fez a arca com madeira de acácia, com um metro e dez centímetros de comprimento, setenta centímetros de largura e setenta centímetros de altura.
EXO.37.2	37	2	And he overlaid it with pure gold within and without, and made a crown of gold to it round about.	0.0071	neutral	Revestiu-a de ouro puro, por dentro e por fora, e fez uma moldura de ouro ao seu redor.
EXO.37.3	37	3	And he cast for it four rings of gold, {to be set} by the four corners of it; even two rings upon the one side of it, and two rings upon the other side of it.	-0.125	negative	Fundiu quatro argolas de ouro para ela, prendendo-as a seus quatro pés, com duas argolas de um lado e duas do outro.
EXO.37.4	37	4	And he made staves {of} shittim wood, and overlaid them with gold.	0.0	neutral	Depois fez varas de madeira de acácia e revestiu-as de ouro
EXO.37.5	37	5	And he put the staves into the rings by the sides of the ark, to bear the ark.	0.0	neutral	e colocou-as nas argolas laterais da arca para que pudesse ser carregada.
EXO.37.6	37	6	And he made the mercy seat {of} pure gold: two cubits and a half {was} the length thereof, and one cubit and a half the breadth thereof.	-0.0397	neutral	Fez a tampa de ouro puro com um metro e dez centímetros de comprimento por setenta centímetros de largura.
EXO.37.7	37	7	And he made two cherubims {of} gold, beaten out of one piece made he them, on the two ends of the mercy seat; {on...: or, out of, etc}	0.0	neutral	Fez também dois querubins de ouro batido nas extremidades da tampa.
EXO.37.8	37	8	One cherub on the end on this side, and another cherub on the {other} end on that side: out of the mercy seat made he the cherubims on the two ends thereof. {on the end: or, out of, etc} {on the other end: or, out of, etc}	-0.125	negative	Fez ainda um querubim numa extremidade e o segundo na outra, formando uma só peça com a tampa.
EXO.37.9	37	9	And the cherubims spread out {their} wings on high, {and} covered with their wings over the mercy seat, with their faces one to another; {even} to the mercy seatward were the faces of the cherubims.	0.16	positive	Os querubins tinham as asas estendidas para cima, cobrindo com elas a tampa. Estavam de frente um para o outro, com o rosto voltado para a tampa.
EXO.37.10	37	10	And he made the table {of} shittim wood: two cubits {was} the length thereof, and a cubit the breadth thereof, and a cubit and a half the height thereof:	-0.1667	negative	Fez a mesa com madeira de acácia com noventa centímetros de comprimento, quarenta e cinco centímetros de largura e setenta centímetros de altura.
EXO.37.11	37	11	And he overlaid it with pure gold, and made thereunto a crown of gold round about.	0.0071	neutral	Revestiu-a de ouro puro e fez uma moldura de ouro ao seu redor.
EXO.37.12	37	12	Also he made thereunto a border of an handbreadth round about; and made a crown of gold for the border thereof round about.	-0.2	negative	Fez também ao seu redor uma borda com a largura de quatro dedos e uma moldura de ouro para essa borda.
EXO.37.13	37	13	And he cast for it four rings of gold, and put the rings upon the four corners that {were} in the four feet thereof.	0.0	neutral	Fundiu quatro argolas de ouro para a mesa e prendeu-as nos quatro cantos, onde estavam os seus quatro pés.
EXO.37.14	37	14	Over against the border were the rings, the places for the staves to bear the table.	0.0	neutral	As argolas foram presas próximas da borda, para que sustentassem as varas usadas para carregar a mesa.
EXO.37.15	37	15	And he made the staves {of} shittim wood, and overlaid them with gold, to bear the table.	0.0	neutral	Fez as varas para carregar a mesa de madeira de acácia, revestidas de ouro.
EXO.37.16	37	16	And he made the vessels which {were} upon the table, his dishes, and his spoons, and his bowls, and his covers to cover withal, {of} pure gold. {to cover...: or, to pour out withal}	0.2143	positive	E de ouro puro fez os utensílios para a mesa: seus pratos e recipientes para incenso, tigelas e as bacias nas quais se derramam as ofertas de bebidas.
EXO.37.17	37	17	And he made the candlestick {of} pure gold: {of} beaten work made he the candlestick; his shaft, and his branch, his bowls, his knops, and his flowers, were of the same:	-0.1786	negative	Fez o candelabro de ouro puro e batido. O pedestal, a haste, as taças, as flores e os botões formavam com ele uma só peça.
EXO.37.18	37	18	And six branches going out of the sides thereof; three branches of the candlestick out of the one side thereof, and three branches of the candlestick out of the other side thereof:	-0.125	negative	Seis braços saíam do candelabro: três de um lado e três do outro.
EXO.37.19	37	19	Three bowls made after the fashion of almonds in one branch, a knop and a flower; and three bowls made like almonds in another branch, a knop and a flower: so throughout the six branches going out of the candlestick.	0.0	neutral	Havia três taças com formato de flor de amêndoa, num dos braços, cada uma com botão e flor, e três taças com formato de flor de amêndoa no braço seguinte, cada uma com botão e flor. Assim será com os seis braços que saem do candelabro.
EXO.37.20	37	20	And in the candlestick {were} four bowls made like almonds, his knops, and his flowers:	0.0	neutral	Na haste do candelabro havia quatro taças com formato de flor de amêndoa, cada uma com flor e botão.
EXO.37.21	37	21	And a knop under two branches of the same, and a knop under two branches of the same, and a knop under two branches of the same, according to the six branches going out of it.	0.0	neutral	Havia um botão debaixo de cada par dos seis braços que saíam do candelabro.
EXO.37.22	37	22	Their knops and their branches were of the same: all of it {was} one beaten work {of} pure gold.	0.1071	positive	Os braços com seus botões formavam uma só peça com o candelabro, tudo feito de ouro puro e batido.
EXO.37.23	37	23	And he made his seven lamps, and his snuffers, and his snuffdishes, {of} pure gold.	0.2143	positive	Fez de ouro puro suas sete lâmpadas, seus cortadores de pavio e seus apagadores.
EXO.37.24	37	24	{Of} a talent of pure gold made he it, and all the vessels thereof.	0.2143	positive	Com trinta e cinco quilos de ouro puro fez o candelabro com seus botões e todos esses utensílios.
EXO.37.25	37	25	And he made the incense altar {of} shittim wood: the length of it {was} a cubit, and the breadth of it a cubit; {it was} foursquare; and two cubits {was} the height of it; the horns thereof were of the same.	0.0	neutral	Fez ainda o altar de incenso de madeira de acácia. Era quadrado, com quarenta e cinco centímetros de cada lado e noventa centímetros de altura; suas pontas formavam com ele uma só peça.
EXO.37.26	37	26	And he overlaid it with pure gold, {both} the top of it, and the sides thereof round about, and the horns of it: also he made unto it a crown of gold round about.	0.0786	neutral	Revestiu de ouro puro a parte superior, todos os lados e as pontas, e fez uma moldura de ouro ao seu redor.
EXO.37.27	37	27	And he made two rings of gold for it under the crown thereof, by the two corners of it, upon the two sides thereof, to be places for the staves to bear it withal.	0.0	neutral	Fez também duas argolas de ouro de cada lado do altar, abaixo da moldura, para sustentar as varas utilizadas para carregá-lo,
EXO.37.28	37	28	And he made the staves {of} shittim wood, and overlaid them with gold.	0.0	neutral	e usou madeira de acácia para fazer as varas e revestiu-as de ouro.
EXO.37.29	37	29	And he made the holy anointing oil, and the pure incense of sweet spices, according to the work of the apothecary.	0.2821	positive	Fez ainda o óleo sagrado para as unções e o incenso puro e aromático, obra de perfumista.
EXO.38.1	38	1	And he made the altar of burnt offering {of} shittim wood: five cubits {was} the length thereof, and five cubits the breadth thereof; {it was} foursquare; and three cubits the height thereof.	0.0	neutral	Fez um altar de madeira de acácia para os holocaustos, com um metro e trinta e cinco centímetros de altura; era quadrado, com dois metros e vinte e cinco centímetros de cada lado.
EXO.38.2	38	2	And he made the horns thereof on the four corners of it; the horns thereof were of the same: and he overlaid it with brass.	0.0	neutral	E fez uma ponta em forma de chifre em cada um dos quatro cantos, formando uma só peça com o altar, o qual revestiu de bronze.
EXO.38.3	38	3	And he made all the vessels of the altar, the pots, and the shovels, and the basons, {and} the fleshhooks, and the firepans: all the vessels thereof made he {of} brass.	0.0	neutral	De bronze fez todos os seus utensílios: os recipientes para recolher cinzas, as pás, as bacias de aspersão, os garfos para carne e os braseiros.
EXO.38.4	38	4	And he made for the altar a brasen grate of network under the compass thereof beneath unto the midst of it.	0.0	neutral	Fez uma grelha de bronze para o altar em forma de rede, abaixo da sua beirada, a meia altura do altar.
EXO.38.5	38	5	And he cast four rings for the four ends of the grate of brass, {to be} places for the staves.	0.0	neutral	Fundiu quatro argolas de bronze para sustentar as varas nos quatro cantos da grelha de bronze.
EXO.38.6	38	6	And he made the staves {of} shittim wood, and overlaid them with brass.	0.0	neutral	Fez as varas de madeira de acácia, revestiu-as de bronze
EXO.38.7	38	7	And he put the staves into the rings on the sides of the altar, to bear it withal; he made the altar hollow with boards.	-0.1	neutral	e colocou-as nas argolas, nos dois lados do altar, para que o pudessem carregar. O altar era oco, feito de tábuas.
EXO.38.8	38	8	And he made the laver {of} brass, and the foot of it {of} brass, of the lookingglasses of {the women} assembling, which assembled {at} the door of the tabernacle of the congregation. {lookingglasses: or, brasen glasses} {assembling: Heb. assembling by troops}	0.0	neutral	Fez a bacia de bronze e a sua base com os espelhos das mulheres que serviam à entrada da Tenda do Encontro.
EXO.38.9	38	9	And he made the court: on the south side southward the hangings of the court {were of} fine twined linen, an hundred cubits:	0.4167	positive	Fez também o pátio. O lado sul tinha quarenta e cinco metros de comprimento e cortinas externas de linho fino trançado,
EXO.38.10	38	10	Their pillars {were} twenty, and their brasen sockets twenty; the hooks of the pillars and their fillets {were of} silver.	0.0	neutral	com vinte colunas e vinte bases de bronze, com ganchos e ligaduras de prata nas colunas.
EXO.38.11	38	11	And for the north side {the hangings were} an hundred cubits, their pillars {were} twenty, and their sockets of brass twenty; the hooks of the pillars and their fillets {of} silver.	0.0	neutral	O lado norte também tinha quarenta e cinco metros de comprimento, com vinte colunas e vinte bases de bronze. Os ganchos e as ligaduras das colunas eram de prata.
EXO.38.12	38	12	And for the west side {were} hangings of fifty cubits, their pillars ten, and their sockets ten; the hooks of the pillars and their fillets {of} silver.	0.0	neutral	O lado ocidental, com suas cortinas externas, tinha vinte e dois metros e meio de largura, com dez colunas e dez bases, com ganchos e ligaduras de prata nas colunas.
EXO.38.13	38	13	And for the east side eastward fifty cubits.	0.0	neutral	O lado oriental, que dá para o nascente, também tinha vinte e dois metros e meio de largura.
EXO.38.14	38	14	The hangings of the one side {of the gate were} fifteen cubits; their pillars three, and their sockets three.	0.0	neutral	Havia cortinas de seis metros e setenta e cinco centímetros de comprimento num dos lados da entrada, com três colunas e três bases,
EXO.38.15	38	15	And for the other side of the court gate, on this hand and that hand, {were} hangings of fifteen cubits; their pillars three, and their sockets three.	-0.125	negative	e cortinas de seis metros e setenta e cinco centímetros de comprimento no outro lado da entrada do pátio, também com três colunas e três bases.
EXO.38.16	38	16	All the hangings of the court round about {were} of fine twined linen.	0.1083	positive	Todas as cortinas ao redor do pátio eram feitas de linho fino trançado.
EXO.38.17	38	17	And the sockets for the pillars {were of} brass; the hooks of the pillars and their fillets {of} silver; and the overlaying of their chapiters {of} silver; and all the pillars of the court {were} filleted with silver.	0.0	neutral	As bases das colunas eram de bronze. Os ganchos e as ligaduras das colunas eram de prata, e o topo das colunas também eram revestidos de prata; de modo que todas as colunas do pátio tinham ligaduras de prata.
EXO.38.18	38	18	And the hanging for the gate of the court {was} needlework, {of} blue, and purple, and scarlet, and fine twined linen: and twenty cubits {was} the length, and the height in the breadth {was} five cubits, answerable to the hangings of the court.	0.2083	positive	Na entrada do pátio havia uma cortina de linho fino trançado e de fios de tecidos azul, roxo e vermelho, obra de bordador. Tinha nove metros de comprimento e, à semelhança das cortinas do pátio, tinha dois metros e vinte e cinco centímetros de altura,
EXO.38.19	38	19	And their pillars {were} four, and their sockets {of} brass four; their hooks {of} silver, and the overlaying of their chapiters and their fillets {of} silver.	0.0	neutral	com quatro colunas e quatro bases de bronze. Seus ganchos e ligaduras eram de prata, e o topo das colunas também era revestido de prata.
EXO.38.20	38	20	And all the pins of the tabernacle, and of the court round about, {were of} brass.	-0.2	negative	Todas as estacas da tenda do tabernáculo e do pátio que o rodeava eram de bronze.
EXO.38.21	38	21	This is the sum of the tabernacle, {even} of the tabernacle of testimony, as it was counted, according to the commandment of Moses, {for} the service of the Levites, by the hand of Ithamar, son to Aaron the priest.	0.0	neutral	Esta é a relação do material usado para o tabernáculo, o tabernáculo da aliança, registrada por ordem de Moisés pelos levitas, sob a direção de Itamar, filho de Arão, o sacerdote.
EXO.38.22	38	22	And Bezaleel the son of Uri, the son of Hur, of the tribe of Judah, made all that the LORD commanded Moses.	0.0	neutral	Bezalel, filho de Uri, neto de Hur, da tribo de Judá, fez tudo o que o Senhor tinha ordenado a Moisés.
EXO.38.23	38	23	And with him {was} Aholiab, son of Ahisamach, of the tribe of Dan, an engraver, and a cunning workman, and an embroiderer in blue, and in purple, and in scarlet, and fine linen.	0.1389	positive	Com ele estava Aoliabe, filho de Aisamaque, da tribo de Dã, artesão e projetista, e também bordador em linho fino e de fios de tecido azul, roxo e vermelho.
EXO.38.24	38	24	All the gold that was occupied for the work in all the work of the holy {place}, even the gold of the offering, was twenty and nine talents, and seven hundred and thirty shekels, after the shekel of the sanctuary.	0.0	neutral	O peso total do ouro recebido na oferta movida e utilizado para a obra do santuário foi de uma tonelada, com base no peso padrão do santuário.
EXO.38.25	38	25	And the silver of them that were numbered of the congregation {was} an hundred talents, and a thousand seven hundred and threescore and fifteen shekels, after the shekel of the sanctuary:	0.0	neutral	O peso da prata recebida dos que foram contados no recenseamento da comunidade foi superior a três toneladas e meia, com base no peso padrão do santuário:
EXO.38.26	38	26	A bekah for every man, {that is}, half a shekel, after the shekel of the sanctuary, for every one that went to be numbered, from twenty years old and upward, for six hundred thousand and three thousand and five hundred and fifty {men}. {every man: Heb. a poll}	-0.0333	neutral	seis gramas para cada um dos recenseados, seiscentos e três mil, quinhentos e cinqüenta homens de vinte anos de idade para cima.
EXO.38.27	38	27	And of the hundred talents of silver were cast the sockets of the sanctuary, and the sockets of the vail; an hundred sockets of the hundred talents, a talent for a socket.	0.0	neutral	As três toneladas e meia de prata foram usadas para fundir as bases do santuário e do véu: cem bases feitas das três toneladas e meia, trinta e cinco quilos para cada base.
EXO.38.28	38	28	And of the thousand seven hundred seventy and five shekels he made hooks for the pillars, and overlaid their chapiters, and filleted them.	0.0	neutral	Vinte quilos e trezentos gramas foram usados para fazer os ganchos para as colunas, para revestir a parte superior das colunas e para fazer as suas ligaduras.
EXO.38.29	38	29	And the brass of the offering {was} seventy talents, and two thousand and four hundred shekels.	0.0	neutral	O peso do bronze da oferta movida foi de duas toneladas e meia.
EXO.38.30	38	30	And therewith he made the sockets to the door of the tabernacle of the congregation, and the brasen altar, and the brasen grate for it, and all the vessels of the altar,	0.0	neutral	Ele o utilizou para fazer as bases da entrada da Tenda do Encontro, o altar de bronze, a sua grelha e todos os seus utensílios,
EXO.38.31	38	31	And the sockets of the court round about, and the sockets of the court gate, and all the pins of the tabernacle, and all the pins of the court round about.	-0.2	negative	as bases do pátio ao redor e da sua entrada, e todas as estacas do tabernáculo e do pátio em derredor.
EXO.39.1	39	1	And of the blue, and purple, and scarlet, they made cloths of service, to do service in the holy {place}, and made the holy garments for Aaron; as the LORD commanded Moses.	0.0	neutral	Com fios de tecido azul, roxo e vermelho fizeram as vestes litúrgicas para ministrar no Lugar Santo. Também fizeram as vestes sagradas de Arão, como o Senhor tinha ordenado a Moisés.
EXO.39.2	39	2	And he made the ephod {of} gold, blue, and purple, and scarlet, and fine twined linen.	0.2083	positive	Fez o colete sacerdotal de linho fino trançado e de fios de ouro e de fios de tecidos azul, roxo e vermelho.
EXO.39.3	39	3	And they did beat the gold into thin plates, and cut {it into} wires, to work {it} in the blue, and in the purple, and in the scarlet, and in the fine linen, {with} cunning work.	0.0042	neutral	E bateu o ouro em finas placas das quais cortaram fios de ouro para serem bordados no linho fino com os fios de tecido azul, roxo e vermelho, obra artesanal.
EXO.39.4	39	4	They made shoulderpieces for it, to couple {it} together: by the two edges was it coupled together.	0.0	neutral	Fizeram as ombreiras para o colete sacerdotal, atadas às suas duas extremidades, para que pudessem ser amarradas.
EXO.39.5	39	5	And the curious girdle of his ephod, that {was} upon it, {was} of the same, according to the work thereof; {of} gold, blue, and purple, and scarlet, and fine twined linen; as the LORD commanded Moses.	0.0792	neutral	O cinturão e o colete por ele preso foram feitos da mesma peça. O cinturão também foi feito de linho fino trançado e de fios de ouro e de fios de tecido azul, roxo e vermelho, como o Senhor tinha ordenado a Moisés.
EXO.39.6	39	6	And they wrought onyx stones inclosed in ouches of gold, graven, as signets are graven, with the names of the children of Israel.	0.0	neutral	Prenderam as pedras de ônix em filigranas de ouro e nelas gravaram os nomes dos filhos de Israel, como um lapidador grava um selo.
EXO.39.7	39	7	And he put them on the shoulders of the ephod, {that they should be} stones for a memorial to the children of Israel; as the LORD commanded Moses.	0.0	neutral	Então as costuraram nas ombreiras do colete sacerdotal, como pedras memoriais para os filhos de Israel, como o Senhor tinha ordenado a Moisés.
EXO.39.8	39	8	And he made the breastplate {of} cunning work, like the work of the ephod; {of} gold, blue, and purple, and scarlet, and fine twined linen.	0.1389	positive	Fez o peitoral, trabalho artesanal, como o colete sacerdotal: de linho fino trançado, de fios de ouro e de fios de tecidos azul, roxo e vermelho.
EXO.39.9	39	9	It was foursquare; they made the breastplate double: a span {was} the length thereof, and a span the breadth thereof, {being} doubled.	0.0	neutral	Era quadrado, com um palmo de comprimento e um palmo de largura, e dobrado em dois.
EXO.39.10	39	10	And they set in it four rows of stones: {the first} row {was} a sardius, a topaz, and a carbuncle: this {was} the first row. {sardius: or, ruby}	-0.0833	neutral	Em seguida fixaram nele quatro fileiras de pedras preciosas. Na primeira fileira havia um rubi, um topázio e um berilo;
EXO.39.11	39	11	And the second row, an emerald, a sapphire, and a diamond.	0.0	neutral	na segunda, uma turquesa, uma safira e um diamante;
EXO.39.12	39	12	And the third row, a ligure, an agate, and an amethyst.	0.0	neutral	na terceira, um jacinto, uma ágata e uma ametista;
EXO.39.13	39	13	And the fourth row, a beryl, an onyx, and a jasper: {they were} inclosed in ouches of gold in their inclosings.	-0.375	negative	na quarta, um crisólito, um ônix e um jaspe, todas fixadas em filigranas de ouro.
EXO.39.14	39	14	And the stones {were} according to the names of the children of Israel, twelve, according to their names, {like} the engravings of a signet, every one with his name, according to the twelve tribes.	0.0	neutral	Havia doze pedras, uma para cada nome dos filhos de Israel, cada uma gravada como um lapidador grava um selo, com o nome de uma das doze tribos.
EXO.39.15	39	15	And they made upon the breastplate chains at the ends, {of} wreathen work {of} pure gold.	0.2143	positive	Para o peitoral fizeram correntes trançadas de ouro puro, como cordas.
EXO.39.16	39	16	And they made two ouches {of} gold, and two gold rings; and put the two rings in the two ends of the breastplate.	0.0	neutral	De ouro fizeram duas filigranas e duas argolas, as quais prenderam às duas extremidades do peitoral.
EXO.39.17	39	17	And they put the two wreathen chains of gold in the two rings on the ends of the breastplate.	0.0	neutral	Prenderam as duas correntes de ouro às duas argolas nas extremidades do peitoral,
EXO.39.18	39	18	And the two ends of the two wreathen chains they fastened in the two ouches, and put them on the shoulderpieces of the ephod, before it.	0.0	neutral	e as outras extremidades das correntes, às duas filigranas, unindo-as às peças das ombreiras do colete sacerdotal, na parte da frente.
EXO.39.19	39	19	And they made two rings of gold, and put {them} on the two ends of the breastplate, upon the border of it, which {was} on the side of the ephod inward.	0.0	neutral	Fizeram outras duas argolas de ouro e as prenderam às duas extremidades do peitoral na borda interna, próxima ao colete sacerdotal.
EXO.39.20	39	20	And they made two {other} golden rings, and put them on the two sides of the ephod underneath, toward the forepart of it, over against the {other} coupling thereof, above the curious girdle of the ephod.	-0.01	neutral	Depois fizeram mais duas argolas de ouro e as prenderam na parte inferior das ombreiras, na frente do colete sacerdotal, próximas da costura, logo acima do cinturão do colete sacerdotal.
EXO.39.21	39	21	And they did bind the breastplate by his rings unto the rings of the ephod with a lace of blue, that it might be above the curious girdle of the ephod, and that the breastplate might not be loosed from the ephod; as the LORD commanded Moses.	-0.0333	neutral	Amarraram as argolas do peitoral às argolas do colete com um cordão azul, ligando-o ao cinturão, para que o peitoral não se separasse do colete sacerdotal, como o Senhor tinha ordenado a Moisés.
EXO.39.22	39	22	And he made the robe of the ephod {of} woven work, all {of} blue.	0.0	neutral	Fizeram o manto do colete sacerdotal inteiramente de fios de tecido azul, obra de tecelão,
EXO.39.23	39	23	And {there was} an hole in the midst of the robe, as the hole of an habergeon, {with} a band round about the hole, that it should not rend.	-0.2	negative	com uma abertura no centro. Ao redor dessa abertura havia uma dobra tecida, como uma gola, para que não se rasgasse.
