verse_id	chapter	verse	text_en	polarity_en	label_en	text_pt
EXO.39.24	39	24	And they made upon the hems of the robe pomegranates {of} blue, and purple, and scarlet, {and} twined {linen}.	0.0	neutral	Fizeram romãs de linho fino trançado e de fios de tecido azul, roxo e vermelho em volta da borda do manto.
EXO.39.25	39	25	And they made bells {of} pure gold, and put the bells between the pomegranates upon the hem of the robe, round about between the pomegranates;	0.0071	neutral	Fizeram ainda pequenos sinos de ouro puro, atando-os em volta da borda, entre as romãs.
EXO.39.26	39	26	A bell and a pomegranate, a bell and a pomegranate, round about the hem of the robe to minister {in}; as the LORD commanded Moses.	-0.2	negative	Os sinos e as romãs se alternavam por toda a borda do manto. Tudo feito para ser usado ao se ministrar, como o Senhor tinha ordenado a Moisés.
EXO.39.27	39	27	And they made coats {of} fine linen {of} woven work for Aaron, and for his sons,	0.4167	positive	Para Arão e seus filhos fizeram de linho fino as túnicas, obra de tecelão,
EXO.39.28	39	28	And a mitre {of} fine linen, and goodly bonnets {of} fine linen, and linen breeches {of} fine twined linen,	0.4875	positive	o turbante, os gorros e os calções, de linho fino trançado.
EXO.39.29	39	29	And a girdle {of} fine twined linen, and blue, and purple, and scarlet, {of} needlework; as the LORD commanded Moses.	0.2083	positive	O cinturão também era de linho fino trançado e de fios de tecido azul, roxo e vermelho, obra de bordador, como o Senhor tinha ordenado a Moisés.
EXO.39.30	39	30	And they made the plate of the holy crown {of} pure gold, and wrote upon it a writing, {like to} the engravings of a signet, HOLINESS TO THE LORD.	0.2143	positive	Fizeram de ouro puro o diadema sagrado, e gravaram nele como se grava um selo: Consagrado ao Senhor.
EXO.39.31	39	31	And they tied unto it a lace of blue, to fasten {it} on high upon the mitre; as the LORD commanded Moses.	0.08	neutral	Depois usaram um cordão azul para prendê-lo na parte de cima do turbante, como o Senhor tinha ordenado a Moisés.
EXO.39.32	39	32	Thus was all the work of the tabernacle of the tent of the congregation finished: and the children of Israel did according to all that the LORD commanded Moses, so did they.	0.0	neutral	Assim foi encerrada toda a obra do tabernáculo, a Tenda do Encontro. Os israelitas fizeram tudo conforme o Senhor tinha ordenado a Moisés.
EXO.39.33	39	33	And they brought the tabernacle unto Moses, the tent, and all his furniture, his taches, his boards, his bars, and his pillars, and his sockets,	0.0	neutral	Então trouxeram o tabernáculo a Moisés; a tenda e todos os seus utensílios, os ganchos, as molduras, os travessões, as colunas e as bases,
EXO.39.34	39	34	And the covering of rams' skins dyed red, and the covering of badgers' skins, and the vail of the covering,	0.0	neutral	a cobertura de pele de carneiro tingida de vermelho, a cobertura de couro e o véu protetor,
EXO.39.35	39	35	The ark of the testimony, and the staves thereof, and the mercy seat,	0.0	neutral	a arca da aliança com as suas varas e a tampa,
EXO.39.36	39	36	The table, {and} all the vessels thereof, and the shewbread,	0.0	neutral	a mesa com todos os seus utensílios e os pães da Presença,
EXO.39.37	39	37	The pure candlestick, {with} the lamps thereof, {even with} the lamps to be set in order, and all the vessels thereof, and the oil for light,	0.3071	positive	o candelabro de ouro puro com a sua fileira de lâmpadas e todos os seus utensílios e o óleo para iluminação,
EXO.39.38	39	38	And the golden altar, and the anointing oil, and the sweet incense, and the hanging for the tabernacle door, {the sweet...: Heb. the incense of sweet spices}	0.3375	positive	o altar de ouro, o óleo da unção, o incenso aromático e a cortina de entrada para a tenda,
EXO.39.39	39	39	The brasen altar, and his grate of brass, his staves, and all his vessels, the laver and his foot,	0.0	neutral	o altar de bronze com a sua grelha, as suas varas e todos os seus utensílios, a bacia e a sua base,
EXO.39.40	39	40	The hangings of the court, his pillars, and his sockets, and the hanging for the court gate, his cords, and his pins, and all the vessels of the service of the tabernacle, for the tent of the congregation,	0.0	neutral	as cortinas externas do pátio com as suas colunas e bases e a cortina para a entrada do pátio, as cordas e estacas da tenda do pátio, todos os utensílios para o tabernáculo, a Tenda do Encontro,
EXO.39.41	39	41	The cloths of service to do service in the holy {place}, and the holy garments for Aaron the priest, and his sons' garments, to minister in the priest's office.	0.0	neutral	e as vestes litúrgicas para ministrar no Lugar Santo, tanto as vestes sagradas para Arão, o sacerdote, como as vestes de seus filhos, para quando servissem como sacerdotes.
EXO.39.42	39	42	According to all that the LORD commanded Moses, so the children of Israel made all the work.	0.0	neutral	Os israelitas fizeram todo o trabalho conforme o Senhor tinha ordenado a Moisés.
EXO.39.43	39	43	And Moses did look upon all the work, and, behold, they had done it as the LORD had commanded, even so had they done it: and Moses blessed them.	0.0	neutral	Moisés inspecionou a obra e viu que tinham feito tudo como o Senhor tinha ordenado. Então Moisés os abençoou.
EXO.40.1	40	1	And the LORD spake unto Moses, saying,	0.0	neutral	Disse o Senhor a Moisés:
EXO.40.2	40	2	On the first day of the first month shalt thou set up the tabernacle of the tent of the congregation.	0.25	positive	"""Arme o tabernáculo, a Tenda do Encontro, no primeiro dia do primeiro mês."
EXO.40.3	40	3	And thou shalt put therein the ark of the testimony, and cover the ark with the vail.	0.0	neutral	Coloque nele a arca da aliança e proteja-a com o véu.
EXO.40.4	40	4	And thou shalt bring in the table, and set in order the things that are to be set in order upon it; and thou shalt bring in the candlestick, and light the lamps thereof. {the things...: Heb. the order thereof}	0.4	positive	Traga a mesa e arrume sobre ela tudo o que lhe pertence. Depois traga o candelabro e coloque as suas lâmpadas.
EXO.40.5	40	5	And thou shalt set the altar of gold for the incense before the ark of the testimony, and put the hanging of the door to the tabernacle.	0.0	neutral	Ponha o altar de ouro para o incenso diante da arca da aliança e pendure a cortina na entrada do tabernáculo.
EXO.40.6	40	6	And thou shalt set the altar of the burnt offering before the door of the tabernacle of the tent of the congregation.	0.0	neutral	"""Coloque o altar dos holocaustos em frente da entrada do tabernáculo, da Tenda do Encontro;"
EXO.40.7	40	7	And thou shalt set the laver between the tent of the congregation and the altar, and shalt put water therein.	0.0	neutral	ponha a bacia entre a Tenda do Encontro e o altar, e encha-a de água.
EXO.40.8	40	8	And thou shalt set up the court round about, and hang up the hanging at the court gate.	-0.2	negative	Arme ao seu redor o pátio e coloque a cortina na entrada do pátio.
EXO.40.9	40	9	And thou shalt take the anointing oil, and anoint the tabernacle, and all that {is} therein, and shalt hallow it, and all the vessels thereof: and it shall be holy.	0.0	neutral	"""Unja com o óleo da unção o tabernáculo e tudo o que nele há; consagre-o juntamente com tudo o que lhe pertence, e ele será sagrado."
EXO.40.10	40	10	And thou shalt anoint the altar of the burnt offering, and all his vessels, and sanctify the altar: and it shall be an altar most holy. {most holy: Heb. holiness of holinesses}	0.5	positive	Depois unja o altar dos holocaustos e todos os seus utensílios; consagre o altar, e ele será santíssimo.
EXO.40.11	40	11	And thou shalt anoint the laver and his foot, and sanctify it.	0.0	neutral	Unja também a bacia com a sua base e consagre-a.
EXO.40.12	40	12	And thou shalt bring Aaron and his sons unto the door of the tabernacle of the congregation, and wash them with water.	0.0	neutral	"""Traga Arão e seus filhos à entrada da Tenda do Encontro e mande-os se lavar."
EXO.40.13	40	13	And thou shalt put upon Aaron the holy garments, and anoint him, and sanctify him; that he may minister unto me in the priest's office.	0.0	neutral	Vista depois Arão com as vestes sagradas, unja-o e consagre-o para que me sirva como sacerdote.
EXO.40.14	40	14	And thou shalt bring his sons, and clothe them with coats:	0.0	neutral	Traga os filhos dele e vista-os com túnicas.
EXO.40.15	40	15	And thou shalt anoint them, as thou didst anoint their father, that they may minister unto me in the priest's office: for their anointing shall surely be an everlasting priesthood throughout their generations.	0.5	positive	"Unja-os como você ungiu o pai deles, para que me sirvam como sacerdotes. A unção deles será para um sacerdócio perpétuo, geração após geração""."
EXO.40.16	40	16	Thus did Moses: according to all that the LORD commanded him, so did he.	0.0	neutral	Moisés fez tudo conforme o Senhor lhe havia ordenado.
EXO.40.17	40	17	And it came to pass in the first month in the second year, on the first {day} of the month, {that} the tabernacle was reared up.	0.1667	positive	Assim, o tabernáculo foi armado no primeiro dia do primeiro mês do segundo ano.
EXO.40.18	40	18	And Moses reared up the tabernacle, and fastened his sockets, and set up the boards thereof, and put in the bars thereof, and reared up his pillars.	0.0	neutral	Moisés armou o tabernáculo, colocou as bases em seus lugares, armou as molduras, colocou as vigas e levantou as colunas.
EXO.40.19	40	19	And he spread abroad the tent over the tabernacle, and put the covering of the tent above upon it; as the LORD commanded Moses.	0.0	neutral	Depois estendeu a tenda sobre o tabernáculo e colocou a cobertura sobre ela, como o Senhor tinha ordenado.
EXO.40.20	40	20	And he took and put the testimony into the ark, and set the staves on the ark, and put the mercy seat above upon the ark:	0.0	neutral	Colocou também as tábuas da aliança na arca, fixou nela as varas, e pôs sobre ela a tampa.
EXO.40.21	40	21	And he brought the ark into the tabernacle, and set up the vail of the covering, and covered the ark of the testimony; as the LORD commanded Moses.	0.0	neutral	Em seguida trouxe a arca para dentro do tabernáculo e pendurou o véu protetor, cobrindo a arca da aliança, como o Senhor tinha ordenado.
EXO.40.22	40	22	And he put the table in the tent of the congregation, upon the side of the tabernacle northward, without the vail.	0.0	neutral	Moisés colocou a mesa na Tenda do Encontro, no lado norte do tabernáculo, do lado de fora do véu,
EXO.40.23	40	23	And he set the bread in order upon it before the LORD; as the LORD had commanded Moses.	0.0	neutral	e sobre ela colocou os pães da Presença, diante do Senhor, como o Senhor tinha ordenado.
EXO.40.24	40	24	And he put the candlestick in the tent of the congregation, over against the table, on the side of the tabernacle southward.	0.0	neutral	Pôs o candelabro na Tenda do Encontro, em frente da mesa, no lado sul do tabernáculo,
EXO.40.25	40	25	And he lighted the lamps before the LORD; as the LORD commanded Moses.	0.0	neutral	e colocou as lâmpadas diante do Senhor, como o Senhor tinha ordenado.
