verse_id	chapter	verse	text_en	polarity_en	label_en	text_pt
EXO.34.14	34	14	For thou shalt worship no other god: for the LORD, whose name {is} Jealous, {is} a jealous God:	0.0625	neutral	Nunca adore nenhum outro deus, porque o Senhor, cujo nome é Zeloso, é de fato Deus zeloso.
EXO.34.15	34	15	Lest thou make a covenant with the inhabitants of the land, and they go a whoring after their gods, and do sacrifice unto their gods, and {one} call thee, and thou eat of his sacrifice;	0.0	neutral	"""Acautele-se para não fazer acordo com aqueles que já vivem na terra; pois quando eles se prostituírem, seguindo aos seus deuses e lhes oferecerem sacrifícios, convidarão você e poderão levá-lo a comer dos seus sacrifícios"
EXO.34.16	34	16	And thou take of their daughters unto thy sons, and their daughters go a whoring after their gods, and make thy sons go a whoring after their gods.	0.0	neutral	e escolher para os seus filhos mulheres dentre as filhas deles. Quando elas se prostituírem, seguindo aos seus deuses, poderão levar os seus filhos a se prostituírem também.
EXO.34.17	34	17	Thou shalt make thee no molten gods.	0.0	neutral	"""Não faça ídolos de metal para você."
EXO.34.18	34	18	The feast of unleavened bread shalt thou keep. Seven days thou shalt eat unleavened bread, as I commanded thee, in the time of the month Abib: for in the month Abib thou camest out from Egypt.	0.0	neutral	"""Celebre a festa dos pães sem fermento. Durante sete dias coma pão sem fermento, como lhe ordenei. Faça isso no tempo certo, no mês de abibe, porquanto naquele mês você saiu do Egito."
EXO.34.19	34	19	All that openeth the matrix {is} mine; and every firstling among thy cattle, {whether} ox or sheep, {that is male}. {sheep: or, kid}	0.0	neutral	"""O primeiro a nascer de cada ventre me pertence, todos os machos dentre as primeiras crias dos seus rebanhos: bezerros, cordeiros e cabritos."
EXO.34.20	34	20	But the firstling of an ass thou shalt redeem with a lamb: and if thou redeem {him} not, then shalt thou break his neck. All the firstborn of thy sons thou shalt redeem. And none shall appear before me empty. {lamb: or, kid}	-0.1	neutral	"Resgate com um cordeiro cada primeiro jumentinho que nascer; mas se não o resgatar, quebre-lhe o pescoço. Resgate todos os seus primogênitos. ""Ninguém compareça perante mim de mãos vazias."
EXO.34.21	34	21	Six days thou shalt work, but on the seventh day thou shalt rest: in earing time and in harvest thou shalt rest.	0.0	neutral	"""Trabalhe seis dias, mas descanse no sétimo; tanto na época de arar como na da colheita."
EXO.34.22	34	22	And thou shalt observe the feast of weeks, of the firstfruits of wheat harvest, and the feast of ingathering at the year's end. {year's end: Heb. revolution of the year}	0.0	neutral	"""Celebre a festa das semanas, na ocasião dos primeiros frutos da colheita do trigo, e a festa do encerramento da colheita, no fim do ano."
EXO.34.23	34	23	Thrice in the year shall all your men children appear before the Lord GOD, the God of Israel.	0.0	neutral	Três vezes por ano todos os homens do seu povo comparecerão diante do Soberano Senhor, o Deus de Israel.
EXO.34.24	34	24	For I will cast out the nations before thee, and enlarge thy borders: neither shall any man desire thy land, when thou shalt go up to appear before the LORD thy God thrice in the year.	0.0	neutral	Expulsarei nações de diante de você e ampliarei o seu território. Quando você subir três vezes por ano para apresentar-se ao Senhor, o seu Deus, ninguém cobiçará a sua terra.
EXO.34.25	34	25	Thou shalt not offer the blood of my sacrifice with leaven; neither shall the sacrifice of the feast of the passover be left unto the morning.	0.0	neutral	"""Não me ofereça o sangue de nenhum sacrifício misturado com algo fermentado, e não deixe sobra alguma do sacrifício da festa da Páscoa até a manhã seguinte."
EXO.34.26	34	26	The first of the firstfruits of thy land thou shalt bring unto the house of the LORD thy God. Thou shalt not seethe a kid in his mother's milk.	0.25	positive	"""Traga o melhor dos primeiros frutos da terra ao santuário do Senhor, o seu Deus. ""Não cozinhe o cabrito no leite da própria mãe. """
EXO.34.27	34	27	And the LORD said unto Moses, Write thou these words: for after the tenor of these words I have made a covenant with thee and with Israel.	0.0	neutral	"Disse o Senhor a Moisés: ""Escreva essas palavras; porque é de acordo com elas que faço aliança com você e com Israel""."
EXO.34.28	34	28	And he was there with the LORD forty days and forty nights; he did neither eat bread, nor drink water. And he wrote upon the tables the words of the covenant, the ten commandments. {commandments: Heb. words}	0.0	neutral	Moisés ficou ali com o Senhor quarenta dias e quarenta noites, sem comer pão e sem beber água. E escreveu nas tábuas as palavras da aliança: os Dez Mandamentos.
EXO.34.29	34	29	And it came to pass, when Moses came down from mount Sinai with the two tables of testimony in Moses' hand, when he came down from the mount, that Moses wist not that the skin of his face shone while he talked with him.	-0.1556	negative	Ao descer do monte Sinai com as duas tábuas da aliança nas mãos, Moisés não sabia que o seu rosto resplandecia por ter conversado com o Senhor.
EXO.34.30	34	30	And when Aaron and all the children of Israel saw Moses, behold, the skin of his face shone; and they were afraid to come nigh him.	-0.6	negative	Quando Arão e todos os israelitas viram Moisés, com o rosto resplandecente, tiveram medo de aproximar-se dele.
EXO.34.31	34	31	And Moses called unto them; and Aaron and all the rulers of the congregation returned unto him: and Moses talked with them.	0.0	neutral	Ele, porém, os chamou; Arão e os líderes da comunidade atenderam, e Moisés falou com eles.
EXO.34.32	34	32	And afterward all the children of Israel came nigh: and he gave them in commandment all that the LORD had spoken with him in mount Sinai.	0.0	neutral	Depois, todos os israelitas se aproximaram, e ele lhes transmitiu todos os mandamentos que o Senhor lhe tinha dado no monte Sinai.
EXO.34.33	34	33	And {till} Moses had done speaking with them, he put a vail on his face.	0.0	neutral	Quando acabou de falar com eles, cobriu o rosto com um véu.
EXO.34.34	34	34	But when Moses went in before the LORD to speak with him, he took the vail off, until he came out. And he came out, and spake unto the children of Israel {that} which he was commanded.	0.0	neutral	Mas toda vez que entrava para estar na presença do Senhor e falar com ele, tirava o véu até sair. Sempre que saía e contava aos israelitas tudo o que lhe havia sido ordenado,
EXO.34.35	34	35	And the children of Israel saw the face of Moses, that the skin of Moses' face shone: and Moses put the vail upon his face again, until he went in to speak with him.	0.0	neutral	eles viam que o seu rosto resplandecia. Então, de novo Moisés cobria o rosto com o véu até entrar de novo para falar com o Senhor.
EXO.35.1	35	1	And Moses gathered all the congregation of the children of Israel together, and said unto them, These {are} the words which the LORD hath commanded, that {ye} should do them.	0.0	neutral	"Moisés reuniu toda a comunidade de Israel e lhes disse: ""Estas são as coisas que o Senhor os mandou fazer:"
EXO.35.2	35	2	Six days shall work be done, but on the seventh day there shall be to you an holy day, a sabbath of rest to the LORD: whosoever doeth work therein shall be put to death. {an...: Heb. holiness}	0.0	neutral	Em seis dias qualquer trabalho poderá ser feito, mas o sétimo dia lhes será santo, um sábado de descanso consagrado ao Senhor. Todo aquele que trabalhar nesse dia terá que ser morto.
EXO.35.3	35	3	Ye shall kindle no fire throughout your habitations upon the sabbath day.	0.0	neutral	"Nem sequer acendam fogo em nenhuma de suas casas no dia de sábado! """
EXO.35.4	35	4	And Moses spake unto all the congregation of the children of Israel, saying, This {is} the thing which the LORD commanded, saying,	0.0	neutral	"Disse Moisés a toda a comunidade de Israel: ""Foi isto que o Senhor ordenou:"
EXO.35.5	35	5	Take ye from among you an offering unto the LORD: whosoever {is} of a willing heart, let him bring it, an offering of the LORD; gold, and silver, and brass,	0.25	positive	Separem dentre os seus bens uma oferta para o Senhor. Todo aquele que, de coração, estiver disposto, trará como oferta ao Senhor ouro, prata e bronze;
EXO.35.6	35	6	And blue, and purple, and scarlet, and fine linen, and goats' {hair},	0.2083	positive	fios de tecido azul, roxo e vermelho; linho fino e pêlos de cabra;
EXO.35.7	35	7	And rams' skins dyed red, and badgers' skins, and shittim wood,	0.0	neutral	peles de carneiro tingidas de vermelho e couro; madeira de acácia;
EXO.35.8	35	8	And oil for the light, and spices for anointing oil, and for the sweet incense,	0.375	positive	óleo para a iluminação; especiarias para o óleo da unção e para o incenso aromático;
EXO.35.9	35	9	And onyx stones, and stones to be set for the ephod, and for the breastplate.	0.0	neutral	pedras de ônix e outras pedras preciosas para serem encravadas no colete sacerdotal e no peitoral.
EXO.35.10	35	10	And every wise hearted among you shall come, and make all that the LORD hath commanded;	0.7	positive	"""Todos os que dentre vocês forem capazes virão fazer tudo quanto o Senhor ordenou:"
EXO.35.11	35	11	The tabernacle, his tent, and his covering, his taches, and his boards, his bars, his pillars, and his sockets,	0.0	neutral	o tabernáculo com sua tenda e sua cobertura, os ganchos, as armações, os travessões, as colunas e as bases;
EXO.35.12	35	12	The ark, and the staves thereof, {with} the mercy seat, and the vail of the covering,	0.0	neutral	a arca com suas varas, a tampa e o véu que a protege;
EXO.35.13	35	13	The table, and his staves, and all his vessels, and the shewbread,	0.0	neutral	a mesa com suas varas e todos os seus utensílios, e os pães da Presença;
EXO.35.14	35	14	The candlestick also for the light, and his furniture, and his lamps, with the oil for the light,	0.4	positive	o candelabro com seus utensílios, as lâmpadas e o óleo para iluminação;
EXO.35.15	35	15	And the incense altar, and his staves, and the anointing oil, and the sweet incense, and the hanging for the door at the entering in of the tabernacle,	0.35	positive	o altar do incenso com suas varas, o óleo da unção e o incenso aromático; a cortina divisória à entrada do tabernáculo;
EXO.35.16	35	16	The altar of burnt offering, with his brasen grate, his staves, and all his vessels, the laver and his foot,	0.0	neutral	o altar de holocaustos com sua grelha de bronze, suas varas e todos os seus utensílios; a bacia de bronze e sua base;
EXO.35.17	35	17	The hangings of the court, his pillars, and their sockets, and the hanging for the door of the court,	0.0	neutral	as cortinas externas do pátio com suas colunas e bases, e a cortina da entrada para o pátio;
EXO.35.18	35	18	The pins of the tabernacle, and the pins of the court, and their cords,	0.0	neutral	as estacas do tabernáculo e do pátio e suas cordas;
EXO.35.19	35	19	The cloths of service, to do service in the holy {place}, the holy garments for Aaron the priest, and the garments of his sons, to minister in the priest's office.	0.0	neutral	"as vestes litúrgicas para ministrar no Lugar Santo, tanto as vestes sagradas de Arão, o sacerdote, como as vestes de seus filhos, para quando servirem como sacerdotes""."
EXO.35.20	35	20	And all the congregation of the children of Israel departed from the presence of Moses.	0.0	neutral	Então toda a comunidade de Israel saiu da presença de Moisés,
EXO.35.21	35	21	And they came, every one whose heart stirred him up, and every one whom his spirit made willing, {and} they brought the LORD'S offering to the work of the tabernacle of the congregation, and for all his service, and for the holy garments.	0.25	positive	e todos os que estavam dispostos, cujo coração os impeliu a isso, trouxeram uma oferta ao Senhor para a obra na Tenda do Encontro, para todos os seus serviços e para as vestes sagradas.
EXO.35.22	35	22	And they came, both men and women, as many as were willing hearted, {and} brought bracelets, and earrings, and rings, and tablets, all jewels of gold: and every man that offered {offered} an offering of gold unto the LORD.	0.375	positive	Todos os que se dispuseram, tanto homens como mulheres, trouxeram jóias de ouro de todos os tipos: broches, brincos, anéis e ornamentos; e apresentaram seus objetos de ouro como oferta ritualmente movida perante o Senhor.
EXO.35.23	35	23	And every man, with whom was found blue, and purple, and scarlet, and fine linen, and goats' {hair}, and red skins of rams, and badgers' skins, brought {them}.	0.1389	positive	Todos os que possuíam fios de tecido azul, roxo e vermelho, ou linho fino, ou pêlos de cabra, peles de carneiro tingidas de vermelho ou couro, trouxeram-nos.
EXO.35.24	35	24	Every one that did offer an offering of silver and brass brought the LORD'S offering: and every man, with whom was found shittim wood for any work of the service, brought {it}.	0.0	neutral	Aqueles que apresentaram oferta de prata ou de bronze trouxeram-na como oferta ao Senhor, e todo aquele que possuía madeira de acácia para qualquer das partes da obra, também a trouxe.
EXO.35.25	35	25	And all the women that were wise hearted did spin with their hands, and brought that which they had spun, {both} of blue, and of purple, {and} of scarlet, and of fine linen.	0.3722	positive	Todas as mulheres capazes teceram com suas mãos e trouxeram o que haviam feito: tecidos azul, roxo e vermelho e linho fino.
EXO.35.26	35	26	And all the women whose heart stirred them up in wisdom spun goats' {hair}.	0.0	neutral	Todas as mulheres que se dispuseram e que tinham habilidade teceram os pêlos de cabra.
EXO.35.27	35	27	And the rulers brought onyx stones, and stones to be set, for the ephod, and for the breastplate;	0.0	neutral	Os líderes trouxeram pedras de ônix e outras pedras preciosas para serem encravadas no colete sacerdotal e no peitoral.
EXO.35.28	35	28	And spice, and oil for the light, and for the anointing oil, and for the sweet incense.	0.375	positive	Trouxeram também especiarias e azeite de oliva para iluminação, para o óleo da unção e para o incenso aromático.
EXO.35.29	35	29	The children of Israel brought a willing offering unto the LORD, every man and woman, whose heart made them willing to bring for all manner of work, which the LORD had commanded to be made by the hand of Moses.	0.25	positive	Todos os israelitas que se dispuseram, tanto homens como mulheres, trouxeram ao Senhor ofertas voluntárias para toda a obra que o Senhor, por meio de Moisés, ordenou-lhes que fizessem.
EXO.35.30	35	30	And Moses said unto the children of Israel, See, the LORD hath called by name Bezaleel the son of Uri, the son of Hur, of the tribe of Judah;	0.0	neutral	"Disse então Moisés aos israelitas: ""O Senhor escolheu Bezalel, filho de Uri, neto de Hur, da tribo de Judá,"
EXO.35.31	35	31	And he hath filled him with the spirit of God, in wisdom, in understanding, and in knowledge, and in all manner of workmanship;	0.4	positive	e o encheu do Espírito de Deus, dando-lhe destreza, habilidade e plena capacidade artística,
EXO.35.32	35	32	And to devise curious works, to work in gold, and in silver, and in brass,	-0.1	neutral	para desenhar e executar trabalhos em ouro, prata e bronze,
EXO.35.33	35	33	And in the cutting of stones, to set {them}, and in carving of wood, to make any manner of cunning work.	-0.3	negative	para talhar e lapidar pedras, entalhar madeira para todo tipo de obra artesanal.
EXO.35.34	35	34	And he hath put in his heart that he may teach, {both} he, and Aholiab, the son of Ahisamach, of the tribe of Dan.	0.0	neutral	E concedeu tanto a ele como a Aoliabe, filho de Aisamaque, da tribo de Dã, a habilidade de ensinar os outros.
EXO.35.35	35	35	Them hath he filled with wisdom of heart, to work all manner of work, of the engraver, and of the cunning workman, and of the embroiderer, in blue, and in purple, in scarlet, and in fine linen, and of the weaver, {even} of them that do any work, and of those that devise cunning work.	0.1633	positive	"A todos esses deu capacidade para realizar todo tipo de obra como artesãos, projetistas, bordadores de linho fino e de fios de tecido azul, roxo e vermelho, e como tecelões. Eram capazes para projetar e executar qualquer trabalho artesanal""."
EXO.36.1	36	1	Then wrought Bezaleel and Aholiab, and every wise hearted man, in whom the LORD put wisdom and understanding to know how to work all manner of work for the service of the sanctuary, according to all that the LORD had commanded.	0.7	positive	"""Assim farão Bezalel, Aoliabe e todos os homens capazes, a quem o Senhor concedeu destreza e habilidade para fazerem toda a obra de construção do santuário, realizarão a obra como o Senhor ordenou. """
EXO.36.2	36	2	And Moses called Bezaleel and Aholiab, and every wise hearted man, in whose heart the LORD had put wisdom, {even} every one whose heart stirred him up to come unto the work to do it:	0.7	positive	Então Moisés chamou Bezalel e Aoliabe e todos os homens capazes a quem o Senhor dera habilidade e que estavam dispostos a vir realizar a obra.
EXO.36.3	36	3	And they received of Moses all the offering, which the children of Israel had brought for the work of the service of the sanctuary, to make it {withal}. And they brought yet unto him free offerings every morning.	0.4	positive	Receberam de Moisés todas as ofertas que os israelitas tinham trazido para a obra de construção do santuário. E o povo continuava a trazer voluntariamente ofertas, manhã após manhã.
EXO.36.4	36	4	And all the wise men, that wrought all the work of the sanctuary, came every man from his work which they made;	0.7	positive	Por isso, todos os artesãos habilidosos que trabalhavam no santuário interromperam o trabalho
EXO.36.5	36	5	And they spake unto Moses, saying, The people bring much more than enough for the service of the work, which the LORD commanded to make.	0.25	positive	"e disseram a Moisés: ""O povo está trazendo mais do que o suficiente para realizar a obra que o Senhor ordenou""."
EXO.36.6	36	6	And Moses gave commandment, and they caused it to be proclaimed throughout the camp, saying, Let neither man nor woman make any more work for the offering of the sanctuary. So the people were restrained from bringing.	0.5	positive	"Então Moisés ordenou que fosse feita esta proclamação em todo o acampamento: ""Nenhum homem ou mulher deverá fazer mais nada para ser oferecido ao santuário"". Assim, o povo foi impedido de trazer mais,"
EXO.36.7	36	7	For the stuff they had was sufficient for all the work to make it, and too much.	0.2	positive	pois o que já haviam recebido era mais que suficiente para realizar toda a obra.
EXO.36.8	36	8	And every wise hearted man among them that wrought the work of the tabernacle made ten curtains {of} fine twined linen, and blue, and purple, and scarlet: {with} cherubims of cunning work made he them.	0.0611	neutral	Todos os homens capazes dentre os trabalhadores fizeram o tabernáculo com dez cortinas internas de linho fino trançado e de fios de tecido azul, roxo e vermelho, com os querubins bordados sobre eles.
EXO.36.9	36	9	The length of one curtain {was} twenty and eight cubits, and the breadth of one curtain four cubits: the curtains {were} all of one size.	0.0	neutral	Todas as cortinas internas tinham o mesmo tamanho: doze metros e sessenta centímetros de comprimento por um metro e oitenta centímetros de largura.
EXO.36.10	36	10	And he coupled the five curtains one unto another: and {the other} five curtains he coupled one unto another.	-0.125	negative	Prendeu cinco cortinas internas, e fez o mesmo com as outras cinco.
EXO.36.11	36	11	And he made loops of blue on the edge of one curtain from the selvedge in the coupling: likewise he made in the uttermost side of {another} curtain, in the coupling of the second. {selvedge: an edge of cloth so woven that it cannot unravel}	0.0	neutral	Em seguida fez laçadas de tecido azul ao longo da borda da última cortina interna do primeiro conjunto de cortinas internas, fazendo o mesmo com o segundo conjunto.
EXO.36.12	36	12	Fifty loops made he in one curtain, and fifty loops made he in the edge of the curtain which {was} in the coupling of the second: the loops held one {curtain} to another.	0.0	neutral	Fez também cinqüenta laçadas na primeira cortina interna e cinqüenta laçadas na última cortina interna do segundo conjunto; as laçadas estavam opostas umas às outras.
EXO.36.13	36	13	And he made fifty taches of gold, and coupled the curtains one unto another with the taches: so it became one tabernacle.	0.0	neutral	Depois fez cinqüenta ganchos de ouro e com eles prendeu um conjunto de cortinas internas ao outro, para que o tabernáculo formasse um todo.
EXO.36.14	36	14	And he made curtains {of} goats' {hair} for the tent over the tabernacle: eleven curtains he made them.	0.0	neutral	Com o total de onze cortinas internas de pêlos de cabra fez uma tenda para cobrir o tabernáculo.
EXO.36.15	36	15	The length of one curtain {was} thirty cubits, and four cubits {was} the breadth of one curtain: the eleven curtains {were} of one size.	0.0	neutral	As onze cortinas internas tinham a mesma medida: treze metros e meio de comprimento por um metro e oitenta centímetros de largura.
EXO.36.16	36	16	And he coupled five curtains by themselves, and six curtains by themselves.	0.0	neutral	Prendeu cinco cortinas internas num conjunto e as outras seis noutro conjunto.
EXO.36.17	36	17	And he made fifty loops upon the uttermost edge of the curtain in the coupling, and fifty loops made he upon the edge of the curtain which coupleth the second.	0.0	neutral	Depois fez cinqüenta laçadas em volta da borda da última cortina interna de um dos conjuntos e também na borda da última cortina interna do outro conjunto.
EXO.36.18	36	18	And he made fifty taches {of} brass to couple the tent together, that it might be one.	0.0	neutral	Fez também cinqüenta ganchos de bronze para unir a tenda, formando um todo.
EXO.36.19	36	19	And he made a covering for the tent {of} rams' skins dyed red, and a covering {of} badgers' skins above {that}.	0.0	neutral	Em seguida fez para a tenda uma cobertura de pele de carneiro tingida de vermelho, e por cima desta uma cobertura de couro.
EXO.36.20	36	20	And he made boards for the tabernacle {of} shittim wood, standing up.	0.0	neutral	Fez ainda armações verticais de madeira de acácia para o tabernáculo.
EXO.36.21	36	21	The length of a board {was} ten cubits, and the breadth of a board one cubit and a half.	-0.0833	neutral	Cada armação tinha quatro metros e meio de comprimento por setenta centímetros de largura,
EXO.36.22	36	22	One board had two tenons, equally distant one from another: thus did he make for all the boards of the tabernacle.	-0.1	neutral	com dois encaixes paralelos um ao outro. E fez todas as armações do tabernáculo dessa madeira.
EXO.36.23	36	23	And he made boards for the tabernacle; twenty boards for the south side southward:	0.0	neutral	Fez também vinte armações para o lado sul do tabernáculo
EXO.36.24	36	24	And forty sockets of silver he made under the twenty boards; two sockets under one board for his two tenons, and two sockets under another board for his two tenons.	0.0	neutral	e quarenta bases de prata para serem colocadas debaixo delas; duas bases para cada armação, uma debaixo de cada encaixe.
EXO.36.25	36	25	And for the other side of the tabernacle, {which is} toward the north corner, he made twenty boards,	-0.125	negative	Para o outro lado, o lado norte do tabernáculo, fez vinte armações
EXO.36.26	36	26	And their forty sockets of silver; two sockets under one board, and two sockets under another board.	0.0	neutral	e quarenta bases de prata, duas debaixo de cada armação.
EXO.36.27	36	27	And for the sides of the tabernacle westward he made six boards.	0.0	neutral	Fez ainda seis armações na parte de trás do tabernáculo, isto é, para o lado ocidental,
EXO.36.28	36	28	And two boards made he for the corners of the tabernacle in the two sides.	0.0	neutral	e duas armações foram montadas nos cantos, na parte de trás do tabernáculo.
EXO.36.29	36	29	And they were coupled beneath, and coupled together at the head thereof, to one ring: thus he did to both of them in both the corners. {coupled: Heb. twinned}	0.0	neutral	Nesses dois cantos as armações eram duplas, desde a parte inferior até a mais alta, colocadas numa só argola, ambas feitas do mesmo modo.
EXO.36.30	36	30	And there were eight boards; and their sockets {were} sixteen sockets of silver, under every board two sockets. {under...: Heb. two sockets, two sockets under one board}	0.0	neutral	Havia, pois, oito armações e dezesseis bases de prata, duas debaixo de cada armação.
EXO.36.31	36	31	And he made bars of shittim wood; five for the boards of the one side of the tabernacle,	0.0	neutral	Também fez travessões de madeira de acácia: cinco para as armações de um lado do tabernáculo,
EXO.36.32	36	32	And five bars for the boards of the other side of the tabernacle, and five bars for the boards of the tabernacle for the sides westward.	-0.125	negative	cinco para as do outro lado e cinco para as do lado ocidental, na parte de trás do tabernáculo.
EXO.36.33	36	33	And he made the middle bar to shoot through the boards from the one end to the other.	-0.0625	neutral	Fez o travessão central de uma extremidade à outra, passando pelo meio das armações.
