verse_id	chapter	verse	text_en	polarity_en	label_en	text_pt
NUM.4.44	4	44	Even those that were numbered of them after their families, were three thousand and two hundred.	0.0	neutral	Foram contados conforme os seus clãs 3. 200.
NUM.4.45	4	45	These {be} those that were numbered of the families of the sons of Merari, whom Moses and Aaron numbered according to the word of the LORD by the hand of Moses.	0.0	neutral	Esse foi o total de recenseados dos clãs meraritas que serviam na Tenda do Encontro. Moisés e Arão os contaram de acordo com a ordem do Senhor, anunciada por Moisés.
NUM.4.46	4	46	All those that were numbered of the Levites, whom Moses and Aaron and the chief of Israel numbered, after their families, and after the house of their fathers,	0.0	neutral	Assim Moisés, Arão e os líderes de Israel contaram todos os levitas conforme os seus clãs e famílias,
NUM.4.47	4	47	From thirty years old and upward even unto fifty years old, every one that came to do the service of the ministry, and the service of the burden in the tabernacle of the congregation,	0.1	neutral	todos os homens entre trinta e cinqüenta anos de idade que vieram para servir e carregar a Tenda do Encontro
NUM.4.48	4	48	Even those that were numbered of them, were eight thousand and five hundred and fourscore.	0.0	neutral	somavam 8. 580.
NUM.4.49	4	49	According to the commandment of the LORD they were numbered by the hand of Moses, every one according to his service, and according to his burden: thus were they numbered of him, as the LORD commanded Moses.	0.0	neutral	Conforme a ordem do Senhor anunciada por Moisés, a cada um foi designado o seu trabalho e foi dito o que deveria carregar. Assim foram todos contados, conforme o Senhor tinha ordenado a Moisés.
NUM.5.1	5	1	And the LORD spake unto Moses, saying,	0.0	neutral	O Senhor disse a Moisés:
NUM.5.2	5	2	Command the children of Israel, that they put out of the camp every leper, and every one that hath an issue, and whosoever is defiled by the dead:	-0.2	negative	"""Ordene aos israelitas que mandem para fora do acampamento todo aquele que tiver lepra, ou que tiver um fluxo, ou que se tornar impuro por tocar um cadáver."
NUM.5.3	5	3	Both male and female shall ye put out, without the camp shall ye put them; that they defile not their camps, in the midst whereof I dwell.	0.0	neutral	"Mande-os para fora do acampamento tanto homens como mulheres, para que não contaminem o seu próprio acampamento, onde habito entre eles""."
NUM.5.4	5	4	And the children of Israel did so, and put them out without the camp: as the LORD spake unto Moses, so did the children of Israel.	0.0	neutral	Os israelitas assim fizeram e os mandaram para fora do acampamento, como o Senhor tinha ordenado a Moisés.
NUM.5.5	5	5	And the LORD spake unto Moses, saying,	0.0	neutral	E o Senhor disse a Moisés:
NUM.5.6	5	6	Speak unto the children of Israel, When a man or woman shall commit any sin that men commit, to do a trespass against the LORD, and that person be guilty;	-0.5	negative	"""Diga aos israelitas: Quando um homem ou uma mulher prejudicar outra pessoa e, portanto, ofender ao Senhor, será culpado."
NUM.5.7	5	7	Then they shall confess their sin which they have done: and he shall recompense his trespass with the principal thereof, and add unto it the fifth {part} thereof, and give {it} unto {him} against whom he hath trespassed.	0.0	neutral	Confessará o pecado que cometeu, fará restituição total, acrescentará um quinto a esse valor e entregará tudo isso a quem ele prejudicou.
NUM.5.8	5	8	But if the man have no kinsman to recompense the trespass unto, let the trespass be recompensed unto the LORD, {even} to the priest; beside the ram of the atonement, whereby an atonement shall be made for him.	0.0	neutral	Mas, se o prejudicado não tiver nenhum parente próximo para receber a restituição, esta pertencerá ao Senhor e será entregue ao sacerdote, juntamente com o carneiro com o qual se faz propiciação pelo culpado.
NUM.5.9	5	9	And every offering of all the holy things of the children of Israel, which they bring unto the priest, shall be his. {offering: or, heave offering}	0.0	neutral	Todas as contribuições, ou seja, todas as dádivas sagradas que os israelitas trouxerem ao sacerdote, pertencerão a ele.
NUM.5.10	5	10	And every man's hallowed things shall be his: whatsoever any man giveth the priest, it shall be his.	0.0	neutral	"As dádivas sagradas de cada pessoa pertencem a ela, mas o que ela der ao sacerdote pertencerá ao sacerdote""."
NUM.5.11	5	11	And the LORD spake unto Moses, saying,	0.0	neutral	Então o Senhor disse a Moisés:
NUM.5.12	5	12	Speak unto the children of Israel, and say unto them, If any man's wife go aside, and commit a trespass against him,	0.0	neutral	"""Diga o seguinte aos israelitas: Se a mulher de alguém se desviar e lhe for infiel,"
NUM.5.13	5	13	And a man lie with her carnally, and it be hid from the eyes of her husband, and be kept close, and she be defiled, and {there be} no witness against her, neither she be taken {with the manner};	0.0	neutral	e outro homem deitar-se com ela, e isso estiver oculto de seu marido, e a impureza dela não for descoberta, por não haver testemunha contra ela nem tiver ela sido pega no ato;
NUM.5.14	5	14	And the spirit of jealousy come upon him, and he be jealous of his wife, and she be defiled: or if the spirit of jealousy come upon him, and he be jealous of his wife, and she be not defiled:	0.0	neutral	e se o marido dela tiver ciúmes e suspeitar de sua mulher, esteja ela pura ou impura,
NUM.5.15	5	15	Then shall the man bring his wife unto the priest, and he shall bring her offering for her, the tenth {part} of an ephah of barley meal; he shall pour no oil upon it, nor put frankincense thereon; for it {is} an offering of jealousy, an offering of memorial, bringing iniquity to remembrance.	0.0	neutral	ele a levará ao sacerdote, com uma oferta de um jarro de farinha de cevada em favor dela. Não derramará azeite nem porá incenso sobre a farinha, porque é uma oferta de cereal pelo ciúme, para que se revele a verdade sobre o pecado.
NUM.5.16	5	16	And the priest shall bring her near, and set her before the LORD:	0.1	neutral	"""O sacerdote trará a mulher e a colocará perante o Senhor."
NUM.5.17	5	17	And the priest shall take holy water in an earthen vessel; and of the dust that is in the floor of the tabernacle the priest shall take, and put {it} into the water:	0.0	neutral	Então apanhará um pouco de água sagrada num jarro de barro e colocará na água um pouco do pó do chão do tabernáculo.
NUM.5.18	5	18	And the priest shall set the woman before the LORD, and uncover the woman's head, and put the offering of memorial in her hands, which {is} the jealousy offering: and the priest shall have in his hand the bitter water that causeth the curse:	-0.1	neutral	Depois de colocar a mulher perante o Senhor, o sacerdote soltará o cabelo dela e porá nas mãos dela a oferta memorial, a oferta pelo ciúme, enquanto ele mesmo terá em sua mão a água amarga que traz maldição.
NUM.5.19	5	19	And the priest shall charge her by an oath, and say unto the woman, If no man have lain with thee, and if thou hast not gone aside to uncleanness {with another} instead of thy husband, be thou free from this bitter water that causeth the curse: {with another...: or, being in the power of thy husband: Heb. under thy husband}	-0.15	negative	Então o sacerdote fará a mulher jurar e lhe dirá: Se nenhum outro homem se deitou com você e se você não foi infiel nem se tornou impura enquanto casada, que esta água amarga que traz maldição não lhe faça mal.
NUM.5.20	5	20	But if thou hast gone aside {to another} instead of thy husband, and if thou be defiled, and some man have lain with thee beside thine husband:	0.0	neutral	Mas, se você foi infiel enquanto casada e se contaminou por ter se deitado com um homem que não é seu marido —
NUM.5.21	5	21	Then the priest shall charge the woman with an oath of cursing, and the priest shall say unto the woman, The LORD make thee a curse and an oath among thy people, when the LORD doth make thy thigh to rot, and thy belly to swell; {rot: Heb. fall}	0.0	neutral	então o sacerdote fará a mulher pronunciar este juramento com maldição — que o Senhor faça de você objeto de maldição e de desprezo no meio do povo fazendo que a sua barriga inche e que você jamais tenha filhos.
NUM.5.22	5	22	And this water that causeth the curse shall go into thy bowels, to make {thy} belly to swell, and {thy} thigh to rot: And the woman shall say, Amen, amen.	0.0	neutral	"Que esta água que traz maldição entre em seu corpo, inche a sua barriga e a impeça de ter filhos. ""Então a mulher dirá: 'Amém. Assim seja'."
NUM.5.23	5	23	And the priest shall write these curses in a book, and he shall blot {them} out with the bitter water:	-0.1	neutral	"""O sacerdote escreverá essas maldições num documento e depois as lavará na água amarga."
NUM.5.24	5	24	And he shall cause the woman to drink the bitter water that causeth the curse: and the water that causeth the curse shall enter into her, {and become} bitter.	-0.1	neutral	Ele a fará beber a água amarga que traz maldição, e essa água entrará nela, causando-lhe amargo sofrimento.
NUM.5.25	5	25	Then the priest shall take the jealousy offering out of the woman's hand, and shall wave the offering before the LORD, and offer it upon the altar:	0.0	neutral	O sacerdote apanhará das mãos dela a oferta de cereal pelo ciúme, a moverá ritualmente perante o Senhor e a trará ao altar.
NUM.5.26	5	26	And the priest shall take an handful of the offering, {even} the memorial thereof, and burn {it} upon the altar, and afterward shall cause the woman to drink the water.	0.0	neutral	Então apanhará um punhado da oferta de cereal como oferta memorial e a queimará sobre o altar; depois disso fará a mulher beber a água.
NUM.5.27	5	27	And when he hath made her to drink the water, then it shall come to pass, {that}, if she be defiled, and have done trespass against her husband, that the water that causeth the curse shall enter into her, {and become} bitter, and her belly shall swell, and her thigh shall rot: and the woman shall be a curse among her people.	-0.1	neutral	Se ela houver se contaminado, sendo infiel ao seu marido, quando o sacerdote fizer que ela beba a água que traz maldição, essa água entrará nela e causará um amargo sofrimento; sua barriga inchará e ela, incapaz de ter filhos, se tornará objeto de maldição entre o seu povo.
NUM.5.28	5	28	And if the woman be not defiled, but be clean; then she shall be free, and shall conceive seed.	0.3833	positive	Se, porém, a mulher não houver se contaminado, mas estiver pura, não sofrerá punição e será capaz de ter filhos.
NUM.5.29	5	29	This {is} the law of jealousies, when a wife goeth aside {to another} instead of her husband, and is defiled;	0.0	neutral	"""Esse é, pois, o ritual quanto ao ciúme, quando uma mulher for infiel e se contaminar enquanto casada,"
NUM.5.30	5	30	Or when the spirit of jealousy cometh upon him, and he be jealous over his wife, and shall set the woman before the LORD, and the priest shall execute upon her all this law.	0.0	neutral	ou quando o ciúme se apoderar de um homem porque suspeita de sua mulher. O sacerdote a colocará perante o Senhor e a fará passar por todo esse ritual.
NUM.5.31	5	31	Then shall the man be guiltless from iniquity, and this woman shall bear her iniquity.	0.0	neutral	"Se a suspeita não se confirmar, o marido estará inocente, do contrário a mulher sofrerá as conseqüências da sua iniqüidade""."
NUM.6.1	6	1	And the LORD spake unto Moses, saying,	0.0	neutral	O Senhor disse ainda a Moisés:
NUM.6.2	6	2	Speak unto the children of Israel, and say unto them, When either man or woman shall separate {themselves} to vow a vow of a Nazarite, to separate {themselves} unto the LORD: {to separate...: or, to make themselves Nazarites}	-0.75	negative	"""Diga o seguinte aos israelitas: Se um homem ou uma mulher fizer um voto especial, um voto de separação para o Senhor como nazireu,"
NUM.6.3	6	3	He shall separate {himself} from wine and strong drink, and shall drink no vinegar of wine, or vinegar of strong drink, neither shall he drink any liquor of grapes, nor eat moist grapes, or dried.	0.2222	positive	terá que se abster de vinho e de outras bebidas fermentadas e não poderá beber vinagre feito de vinho ou de outra bebida fermentada. Não poderá beber suco de uva nem comer uvas nem passas.
NUM.6.4	6	4	All the days of his separation shall he eat nothing that is made of the vine tree, from the kernels even to the husk. {separation: or, Nazariteship} {vine...: Heb. vine of the wine}	0.0	neutral	Enquanto for nazireu, não poderá comer nada que venha da videira, nem mesmo as sementes ou as cascas.
NUM.6.5	6	5	All the days of the vow of his separation there shall no razor come upon his head: until the days be fulfilled, in the which he separateth {himself} unto the LORD, he shall be holy, {and} shall let the locks of the hair of his head grow.	0.0	neutral	"""Durante todo o período de seu voto de separação, nenhuma lâmina será usada em sua cabeça. Até que termine o período de sua separação para o Senhor ele estará consagrado e deixará crescer o cabelo de sua cabeça."
NUM.6.6	6	6	All the days that he separateth {himself} unto the LORD he shall come at no dead body.	0.1	neutral	Durante todo o período de sua separação para o Senhor, não poderá aproximar-se de um cadáver.
NUM.6.7	6	7	He shall not make himself unclean for his father, or for his mother, for his brother, or for his sister, when they die: because the consecration of his God {is} upon his head. {consecration: Heb. separation}	0.0	neutral	Mesmo que o seu próprio pai ou mãe ou irmã ou irmão morra, ele não poderá tornar-se impuro por causa deles, pois traz sobre a cabeça o símbolo de sua separação para Deus.
NUM.6.8	6	8	All the days of his separation he {is} holy unto the LORD.	0.0	neutral	Durante todo o período de sua separação, estará consagrado ao Senhor.
NUM.6.9	6	9	And if any man die very suddenly by him, and he hath defiled the head of his consecration; then he shall shave his head in the day of his cleansing, on the seventh day shall he shave it.	0.0	neutral	"""Se alguém morrer repentinamente perto dele, contaminando assim o cabelo que consagrou, ele terá que rapar a cabeça sete dias depois, dia da sua purificação."
NUM.6.10	6	10	And on the eighth day he shall bring two turtles, or two young pigeons, to the priest, to the door of the tabernacle of the congregation:	0.1	neutral	No oitavo dia, trará duas rolinhas ou dois pombinhos ao sacerdote à entrada da Tenda do Encontro.
NUM.6.11	6	11	And the priest shall offer the one for a sin offering, and the other for a burnt offering, and make an atonement for him, for that he sinned by the dead, and shall hallow his head that same day.	-0.1083	negative	O sacerdote oferecerá um como oferta pelo pecado e o outro como holocausto, para fazer propiciação por ele, pois pecou ao se aproximar de um cadáver. Naquele mesmo dia o nazireu reconsagrará a sua cabeça.
NUM.6.12	6	12	And he shall consecrate unto the LORD the days of his separation, and shall bring a lamb of the first year for a trespass offering: but the days that were before shall be lost, because his separation was defiled. {be lost: Heb. fall}	0.25	positive	Ele se dedicará ao Senhor pelo período de sua separação e trará um cordeiro de um ano de idade como oferta de reparação. Não se contarão os dias anteriores porque ficou contaminado durante a sua separação.
NUM.6.13	6	13	And this {is} the law of the Nazarite, when the days of his separation are fulfilled: he shall be brought unto the door of the tabernacle of the congregation:	0.0	neutral	"""Este é o ritual do nazireu quando terminar o período de sua separação: ele será trazido à entrada da Tenda do Encontro."
NUM.6.14	6	14	And he shall offer his offering unto the LORD, one he lamb of the first year without blemish for a burnt offering, and one ewe lamb of the first year without blemish for a sin offering, and one ram without blemish for peace offerings,	0.25	positive	Ali apresentará a sua oferta ao Senhor: um cordeiro de um ano e sem defeito como holocausto, uma cordeira de um ano e sem defeito como oferta pelo pecado, um carneiro sem defeito como oferta de comunhão
NUM.6.15	6	15	And a basket of unleavened bread, cakes of fine flour mingled with oil, and wafers of unleavened bread anointed with oil, and their meat offering, and their drink offerings.	0.4167	positive	juntamente com a sua oferta de cereal, com a oferta derramada e com um cesto de pães sem fermento com bolos feitos da melhor farinha amassada com azeite e pães finos untados com azeite.
NUM.6.16	6	16	And the priest shall bring {them} before the LORD, and shall offer his sin offering, and his burnt offering:	0.0	neutral	"""O sacerdote os apresentará ao Senhor e oferecerá o sacrifício pelo pecado e o holocausto."
NUM.6.17	6	17	And he shall offer the ram {for} a sacrifice of peace offerings unto the LORD, with the basket of unleavened bread: the priest shall offer also his meat offering, and his drink offering.	0.0	neutral	Apresentará o cesto de pães sem fermento e oferecerá o cordeiro como sacrifício de comunhão ao Senhor, juntamente com a oferta de cereal e a oferta derramada.
NUM.6.18	6	18	And the Nazarite shall shave the head of his separation {at} the door of the tabernacle of the congregation, and shall take the hair of the head of his separation, and put {it} in the fire which {is} under the sacrifice of the peace offerings.	0.0	neutral	"""Em seguida, à entrada da Tenda do Encontro, o nazireu rapará o cabelo que consagrou e o jogará no fogo que está embaixo do sacrifício da oferta de comunhão."
NUM.6.19	6	19	And the priest shall take the sodden shoulder of the ram, and one unleavened cake out of the basket, and one unleavened wafer, and shall put {them} upon the hands of the Nazarite, after {the hair of} his separation is shaven:	0.0	neutral	"""Depois que o nazireu rapar o cabelo da sua consagração, o sacerdote lhe colocará nas mãos um ombro cozido do carneiro, um bolo e um pão fino tirados do cesto, ambos sem fermento."
NUM.6.20	6	20	And the priest shall wave them {for} a wave offering before the LORD: this {is} holy for the priest, with the wave breast and heave shoulder: and after that the Nazarite may drink wine.	0.0	neutral	O sacerdote os moverá perante o Senhor como gesto ritual de apresentação; são santos e pertencem ao sacerdote, bem como o peito que foi movido e a coxa. Depois disso o nazireu poderá beber vinho.
NUM.6.21	6	21	This {is} the law of the Nazarite who hath vowed, {and of} his offering unto the LORD for his separation, beside {that} that his hand shall get: according to the vow which he vowed, so he must do after the law of his separation.	0.0	neutral	"""Esse é o ritual do voto de nazireu e da oferta dedicada ao Senhor de acordo com a sua separação, sem contar qualquer outra coisa que ele possa dedicar. Cumprirá o voto que tiver feito de acordo com o ritual do nazireu""."
NUM.6.22	6	22	And the LORD spake unto Moses, saying,	0.0	neutral	O Senhor disse a Moisés:
NUM.6.23	6	23	Speak unto Aaron and unto his sons, saying, On this wise ye shall bless the children of Israel, saying unto them,	0.7	positive	"""Diga a Arão e aos seus filhos: Assim vocês abençoarão os israelitas:"
NUM.6.24	6	24	The LORD bless thee, and keep thee:	0.0	neutral	"""O Senhor te abençoe e te guarde;"
NUM.6.25	6	25	The LORD make his face shine upon thee, and be gracious unto thee:	0.0	neutral	o Senhor faça resplandecer o seu rosto sobre ti e te conceda graça;
NUM.6.26	6	26	The LORD lift up his countenance upon thee, and give thee peace.	0.0	neutral	o Senhor volte para ti o seu rosto e te dê paz.
NUM.6.27	6	27	And they shall put my name upon the children of Israel; and I will bless them.	0.0	neutral	"""Assim eles invocarão o meu nome sobre os israelitas, e eu os abençoarei""."
NUM.7.1	7	1	And it came to pass on the day that Moses had fully set up the tabernacle, and had anointed it, and sanctified it, and all the instruments thereof, both the altar and all the vessels thereof, and had anointed them, and sanctified them;	0.0	neutral	Quando Moisés acabou de armar o tabernáculo, ele o ungiu e o consagrou, juntamente com todos os seus utensílios. Também ungiu e consagrou o altar com todos os seus utensílios.
NUM.7.2	7	2	That the princes of Israel, heads of the house of their fathers, who {were} the princes of the tribes, and were over them that were numbered, offered: {and were: Heb. who stood}	-0.75	negative	Então os líderes de Israel, os chefes das famílias que eram os líderes das tribos encarregados do recenseamento, apresentaram ofertas.
NUM.7.3	7	3	And they brought their offering before the LORD, six covered wagons, and twelve oxen; a wagon for two of the princes, and for each one an ox: and they brought them before the tabernacle.	0.0	neutral	Trouxeram as suas dádivas ao Senhor: seis carroças cobertas e doze bois, um boi de cada líder e uma carroça de cada dois líderes; e as apresentaram diante do tabernáculo.
NUM.7.4	7	4	And the LORD spake unto Moses, saying,	0.0	neutral	O Senhor disse a Moisés:
NUM.7.5	7	5	Take {it} of them, that they may be to do the service of the tabernacle of the congregation; and thou shalt give them unto the Levites, to every man according to his service.	0.0	neutral	"""Aceite as ofertas deles para que sejam usadas no trabalho da Tenda do Encontro. Entregue-as aos levitas, conforme exigir o trabalho de cada homem""."
NUM.7.6	7	6	And Moses took the wagons and the oxen, and gave them unto the Levites.	0.0	neutral	Então Moisés recebeu as carroças e os bois e os entregou aos levitas.
NUM.7.7	7	7	Two wagons and four oxen he gave unto the sons of Gershon, according to their service:	0.0	neutral	Deu duas carroças e quatro bois aos gersonitas, conforme exigia o trabalho deles,
NUM.7.8	7	8	And four wagons and eight oxen he gave unto the sons of Merari, according unto their service, under the hand of Ithamar the son of Aaron the priest.	0.0	neutral	e quatro carroças e oito bois aos meraritas, conforme exigia o trabalho deles. Estavam todos sob a supervisão de Itamar, filho do sacerdote Arão.
NUM.7.9	7	9	But unto the sons of Kohath he gave none: because the service of the sanctuary belonging unto them {was that} they should bear upon their shoulders.	0.0	neutral	Mas aos coatitas Moisés não deu nada, pois eles deveriam carregar nos ombros os objetos sagrados pelos quais eram responsáveis.
NUM.7.10	7	10	And the princes offered for dedicating of the altar in the day that it was anointed, even the princes offered their offering before the altar.	0.0	neutral	Quando o altar foi ungido, os líderes trouxeram as suas ofertas para a dedicação do altar, e as apresentaram diante dele.
NUM.7.11	7	11	And the LORD said unto Moses, They shall offer their offering, each prince on his day, for the dedicating of the altar.	0.0	neutral	"Pois o Senhor tinha dito a Moisés: ""Cada dia um líder deverá trazer a sua oferta para a dedicação do altar""."
NUM.7.12	7	12	And he that offered his offering the first day was Nahshon the son of Amminadab, of the tribe of Judah:	0.25	positive	No primeiro dia, Naassom, filho de Aminadabe, da tribo de Judá, trouxe a sua oferta.
NUM.7.13	7	13	And his offering {was} one silver charger, the weight thereof {was} an hundred and thirty {shekels}, one silver bowl of seventy shekels, after the shekel of the sanctuary; both of them {were} full of fine flour mingled with oil for a meat offering:	0.3833	positive	A oferta dele foi um prato de prata de um quilo e quinhentos e sessenta gramas e uma bacia de prata para as aspersões de oitocentos e quarenta gramas, ambos pesados com base no peso padrão do santuário, cada um cheio da melhor farinha amassada com óleo como oferta de cereal;
NUM.7.14	7	14	One spoon of ten {shekels} of gold, full of incense:	0.175	positive	uma vasilha de ouro de cento e vinte gramas, cheia de incenso;
NUM.7.15	7	15	One young bullock, one ram, one lamb of the first year, for a burnt offering:	0.175	positive	um novilho, um carneiro e um cordeiro de um ano como holocausto;
NUM.7.16	7	16	One kid of the goats for a sin offering:	0.0	neutral	um bode como oferta pelo pecado;
NUM.7.17	7	17	And for a sacrifice of peace offerings, two oxen, five rams, five he goats, five lambs of the first year: this {was} the offering of Nahshon the son of Amminadab.	0.25	positive	e dois bois, cinco carneiros, cinco bodes e cinco cordeiros de um ano para serem oferecidos como sacrifício de comunhão. Essa foi a oferta de Naassom, filho de Aminadabe.
NUM.7.18	7	18	On the second day Nethaneel the son of Zuar, prince of Issachar, did offer:	0.0	neutral	No segundo dia, Natanael, filho de Zuar e líder de Issacar, trouxe a sua oferta.
NUM.7.19	7	19	He offered {for} his offering one silver charger, the weight whereof {was} an hundred and thirty {shekels}, one silver bowl of seventy shekels, after the shekel of the sanctuary; both of them full of fine flour mingled with oil for a meat offering:	0.3833	positive	A oferta dele foi um prato de prata de um quilo e quinhentos e sessenta gramas e uma bacia de prata para as aspersões de oitocentos e quarenta gramas, ambos pesados com base no peso padrão do santuário, cada um cheio da melhor farinha amassada com óleo como oferta de cereal;
NUM.7.20	7	20	One spoon of gold of ten {shekels}, full of incense:	0.175	positive	uma vasilha de ouro de cento e vinte gramas, cheia de incenso;
NUM.7.21	7	21	One young bullock, one ram, one lamb of the first year, for a burnt offering:	0.175	positive	um novilho, um carneiro e um cordeiro de um ano como holocausto;
