verse_id	chapter	verse	text_en	polarity_en	label_en	text_pt
NUM.3.10	3	10	And thou shalt appoint Aaron and his sons, and they shall wait on their priest's office: and the stranger that cometh nigh shall be put to death.	0.0	neutral	"Encarregue Arão e os seus filhos de cuidar do sacerdócio; qualquer pessoa não autorizada que se aproximar do santuário terá que ser executada""."
NUM.3.11	3	11	And the LORD spake unto Moses, saying,	0.0	neutral	Disse também o Senhor a Moisés:
NUM.3.12	3	12	And I, behold, I have taken the Levites from among the children of Israel instead of all the firstborn that openeth the matrix among the children of Israel: therefore the Levites shall be mine;	0.0	neutral	"""Eu mesmo escolho os levitas dentre os israelitas em lugar do primeiro filho de cada mulher israelita. Os levitas são meus,"
NUM.3.13	3	13	Because all the firstborn {are} mine; {for} on the day that I smote all the firstborn in the land of Egypt I hallowed unto me all the firstborn in Israel, both man and beast: mine shall they be: I {am} the LORD.	0.0	neutral	"pois todos os primogênitos são meus. Quando feri todos os primogênitos no Egito, separei para mim mesmo todo primogênito de Israel, tanto entre os homens como entre os rebanhos. Serão meus. Eu sou o Senhor""."
NUM.3.14	3	14	And the LORD spake unto Moses in the wilderness of Sinai, saying,	0.0	neutral	E o Senhor disse ainda a Moisés no deserto do Sinai:
NUM.3.15	3	15	Number the children of Levi after the house of their fathers, by their families: every male from a month old and upward shalt thou number them.	0.05	neutral	"""Conte os levitas pelas suas famílias e clãs. Serão contados todos os do sexo masculino de um mês de idade para cima""."
NUM.3.16	3	16	And Moses numbered them according to the word of the LORD, as he was commanded. {word: Heb. mouth}	0.0	neutral	Então Moisés os contou, conforme a ordem que recebera do Senhor.
NUM.3.17	3	17	And these were the sons of Levi by their names; Gershon, and Kohath, and Merari.	0.0	neutral	São estes os nomes dos filhos de Levi: Gérson, Coate e Merari.
NUM.3.18	3	18	And these {are} the names of the sons of Gershon by their families; Libni, and Shimei.	0.0	neutral	São estes os nomes dos clãs gersonitas: Libni e Simei.
NUM.3.19	3	19	And the sons of Kohath by their families; Amram, and Izehar, Hebron, and Uzziel.	0.0	neutral	São estes os nomes dos clãs coatitas: Anrão, Isar, Hebrom e Uziel.
NUM.3.20	3	20	And the sons of Merari by their families; Mahli, and Mushi. These {are} the families of the Levites according to the house of their fathers.	0.0	neutral	E estes são os nomes dos clãs meraritas: Mali e Musi. Foram esses os líderes dos clãs levitas.
NUM.3.21	3	21	Of Gershon {was} the family of the Libnites, and the family of the Shimites: these {are} the families of the Gershonites.	0.0	neutral	A Gérson pertenciam os clãs dos libnitas e dos simeítas; eram esses os clãs gersonitas.
NUM.3.22	3	22	Those that were numbered of them, according to the number of all the males, from a month old and upward, {even} those that were numbered of them {were} seven thousand and five hundred.	0.1	neutral	O número de todos os que foram contados do sexo masculino, de um mês de idade para cima, foi 7. 500.
NUM.3.23	3	23	The families of the Gershonites shall pitch behind the tabernacle westward.	-0.4	negative	Os clãs gersonitas tinham que acampar a oeste, atrás do tabernáculo.
NUM.3.24	3	24	And the chief of the house of the father of the Gershonites {shall be} Eliasaph the son of Lael.	0.0	neutral	O líder das famílias dos gersonitas era Eliasafe, filho de Lael.
NUM.3.25	3	25	And the charge of the sons of Gershon in the tabernacle of the congregation {shall be} the tabernacle, and the tent, the covering thereof, and the hanging for the door of the tabernacle of the congregation,	0.0	neutral	Na Tenda do Encontro os gersonitas tinham a responsabilidade de cuidar do tabernáculo, da tenda, da sua cobertura, da cortina da entrada da Tenda do Encontro,
NUM.3.26	3	26	And the hangings of the court, and the curtain for the door of the court, which {is} by the tabernacle, and by the altar round about, and the cords of it for all the service thereof.	-0.2	negative	das cortinas externas do pátio, da cortina da entrada do pátio que rodeia o tabernáculo e o altar, das cordas, e de tudo o que estava relacionado com esse serviço.
NUM.3.27	3	27	And of Kohath {was} the family of the Amramites, and the family of the Izeharites, and the family of the Hebronites, and the family of the Uzzielites: these {are} the families of the Kohathites.	0.0	neutral	A Coate pertenciam os clãs dos anramitas, dos isaritas, dos hebronitas e dos uzielitas; eram esses os clãs coatitas.
NUM.3.28	3	28	In the number of all the males, from a month old and upward, {were} eight thousand and six hundred, keeping the charge of the sanctuary.	0.1	neutral	O número de todos os do sexo masculino, de um mês de idade para cima, foi 8. 600. Os coatitas tinham a responsabilidade de cuidar do santuário.
NUM.3.29	3	29	The families of the sons of Kohath shall pitch on the side of the tabernacle southward.	0.0	neutral	Os clãs coatitas tinham que acampar no lado sul do tabernáculo.
NUM.3.30	3	30	And the chief of the house of the father of the families of the Kohathites {shall be} Elizaphan the son of Uzziel.	0.0	neutral	O líder das famílias dos clãs coatitas era Elisafã, filho de Uziel.
NUM.3.31	3	31	And their charge {shall be} the ark, and the table, and the candlestick, and the altars, and the vessels of the sanctuary wherewith they minister, and the hanging, and all the service thereof.	0.0	neutral	Tinham a responsabilidade de cuidar da arca, da mesa, do candelabro, dos altares, dos utensílios do santuário com os quais ministravam, da cortina e de tudo o que estava relacionado com esse serviço.
NUM.3.32	3	32	And Eleazar the son of Aaron the priest {shall be} chief over the chief of the Levites, {and have} the oversight of them that keep the charge of the sanctuary.	0.0	neutral	O principal líder dos levitas era Eleazar, filho do sacerdote Arão. Ele tinha a responsabilidade de supervisionar os encarregados de cuidar do santuário.
NUM.3.33	3	33	Of Merari {was} the family of the Mahlites, and the family of the Mushites: these {are} the families of Merari.	0.0	neutral	A Merari pertenciam os clãs dos malitas e dos musitas; eram esses os clãs meraritas.
NUM.3.34	3	34	And those that were numbered of them, according to the number of all the males, from a month old and upward, {were} six thousand and two hundred.	0.1	neutral	O número de todos os que foram contados do sexo masculino, de um mês de idade para cima, foi 6. 200.
NUM.3.35	3	35	And the chief of the house of the father of the families of Merari {was} Zuriel the son of Abihail: {these} shall pitch on the side of the tabernacle northward.	-0.75	negative	O líder das famílias dos clãs meraritas era Zuriel, filho de Abiail; eles tinham que acampar no lado norte do tabernáculo.
NUM.3.36	3	36	And {under} the custody and charge of the sons of Merari {shall be} the boards of the tabernacle, and the bars thereof, and the pillars thereof, and the sockets thereof, and all the vessels thereof, and all that serveth thereto, {under...: Heb. the office of the charge}	0.0	neutral	Os meraritas tinham a responsabilidade de cuidar das armações do tabernáculo, de seus travessões, das colunas, das bases, de todos os seus utensílios e de tudo o que estava relacionado com esse serviço,
NUM.3.37	3	37	And the pillars of the court round about, and their sockets, and their pins, and their cords.	-0.2	negative	bem como das colunas do pátio ao redor, com suas bases, suas estacas e suas cordas.
NUM.3.38	3	38	But those that encamp before the tabernacle toward the east, {even} before the tabernacle of the congregation eastward, {shall be} Moses, and Aaron and his sons, keeping the charge of the sanctuary for the charge of the children of Israel; and the stranger that cometh nigh shall be put to death.	0.0	neutral	E acamparam a leste do tabernáculo, em frente da Tenda do Encontro, Moisés, Arão e seus filhos. Tinham a responsabilidade de cuidar do santuário em favor dos israelitas. Qualquer pessoa não autorizada que se aproximasse do santuário teria que ser executado.
NUM.3.39	3	39	All that were numbered of the Levites, which Moses and Aaron numbered at the commandment of the LORD, throughout their families, all the males from a month old and upward, {were} twenty and two thousand.	0.1	neutral	O número total de levitas contados por Moisés e Arão, conforme a ordem do Senhor, segundo os clãs deles, todos os do sexo masculino, de um mês de idade para cima, foi 22. 000.
NUM.3.40	3	40	And the LORD said unto Moses, Number all the firstborn of the males of the children of Israel from a month old and upward, and take the number of their names.	0.1	neutral	"E o Senhor disse a Moisés: ""Conte todos os primeiros filhos dos israelitas, do sexo masculino, de um mês de idade para cima e faça uma relação de seus nomes."
NUM.3.41	3	41	And thou shalt take the Levites for me (I {am} the LORD) instead of all the firstborn among the children of Israel; and the cattle of the Levites instead of all the firstlings among the cattle of the children of Israel.	0.0	neutral	"Dedique a mim os levitas em lugar de todos os primogênitos dos israelitas, e os rebanhos dos levitas, em lugar de todas as primeiras crias dos rebanhos dos israelitas. Eu sou o Senhor""."
NUM.3.42	3	42	And Moses numbered, as the LORD commanded him, all the firstborn among the children of Israel.	0.0	neutral	E Moisés contou todos os primeiros filhos dos israelitas, conforme o Senhor lhe havia ordenado.
NUM.3.43	3	43	And all the firstborn males by the number of names, from a month old and upward, of those that were numbered of them, were twenty and two thousand two hundred and threescore and thirteen.	0.1	neutral	O número total dos primeiros filhos do sexo masculino, de um mês de idade para cima, relacionados pelo nome, foi 22. 273.
NUM.3.44	3	44	And the LORD spake unto Moses, saying,	0.0	neutral	Disse também o Senhor a Moisés:
NUM.3.45	3	45	Take the Levites instead of all the firstborn among the children of Israel, and the cattle of the Levites instead of their cattle; and the Levites shall be mine: I {am} the LORD.	0.0	neutral	"""Dedique os levitas em lugar de todos os primogênitos dos israelitas, e os rebanhos dos levitas em lugar dos rebanhos dos israelitas. Os levitas serão meus. Eu sou o Senhor."
NUM.3.46	3	46	And for those that are to be redeemed of the two hundred and threescore and thirteen of the firstborn of the children of Israel, which are more than the Levites;	0.5	positive	Para o resgate dos primeiros 273 filhos dos israelitas que excedem o número de levitas,
NUM.3.47	3	47	Thou shalt even take five shekels apiece by the poll, after the shekel of the sanctuary shalt thou take {them}: (the shekel {is} twenty gerahs:)	-0.125	negative	recolha sessenta gramas de prata, com base no peso padrão do santuário, que são doze gramas.
NUM.3.48	3	48	And thou shalt give the money, wherewith the odd number of them is to be redeemed, unto Aaron and to his sons.	-0.1667	negative	"Entregue a Arão e aos seus filhos a prata para o resgate do número excedente de israelitas""."
NUM.3.49	3	49	And Moses took the redemption money of them that were over and above them that were redeemed by the Levites:	0.0	neutral	Assim Moisés recolheu a prata para o resgate daqueles que excederam o número dos levitas.
NUM.3.50	3	50	Of the firstborn of the children of Israel took he the money; a thousand three hundred and threescore and five {shekels}, after the shekel of the sanctuary:	0.0	neutral	Dos primeiros filhos dos israelitas ele recolheu prata no peso de quase dezesseis quilos e meio, com base no peso padrão do santuário.
NUM.3.51	3	51	And Moses gave the money of them that were redeemed unto Aaron and to his sons, according to the word of the LORD, as the LORD commanded Moses.	0.0	neutral	Moisés entregou a Arão e aos filhos dele a prata para o resgate, conforme a ordem que recebera do Senhor.
NUM.4.1	4	1	And the LORD spake unto Moses and unto Aaron, saying,	0.0	neutral	Disse ainda o Senhor a Moisés e a Arão:
NUM.4.2	4	2	Take the sum of the sons of Kohath from among the sons of Levi, after their families, by the house of their fathers,	0.0	neutral	"""Façam um recenseamento dos coatitas na tribo de Levi, pelos seus clãs e famílias;"
NUM.4.3	4	3	From thirty years old and upward even until fifty years old, all that enter into the host, to do the work in the tabernacle of the congregation.	0.1	neutral	contem todos os homens entre trinta e cinqüenta anos, aptos para servir, para que façam o serviço da Tenda do Encontro.
NUM.4.4	4	4	This {shall be} the service of the sons of Kohath in the tabernacle of the congregation, {about} the most holy things:	0.5	positive	"""O serviço dos coatitas na Tenda do Encontro será o cuidado das coisas santíssimas."
NUM.4.5	4	5	And when the camp setteth forward, Aaron shall come, and his sons, and they shall take down the covering vail, and cover the ark of testimony with it:	-0.1556	negative	Quando o acampamento tiver que mudar, Arão e os seus filhos entrarão e descerão o véu protetor e com ele cobrirão a arca da aliança.
NUM.4.6	4	6	And shall put thereon the covering of badgers' skins, and shall spread over {it} a cloth wholly of blue, and shall put in the staves thereof.	0.0	neutral	Depois a cobrirão com couro, estenderão um pano inteiramente azul sobre ela e colocarão as varas no lugar.
NUM.4.7	4	7	And upon the table of shewbread they shall spread a cloth of blue, and put thereon the dishes, and the spoons, and the bowls, and covers to cover withal: and the continual bread shall be thereon: {cover...: or, pour out withal}	-0.375	negative	"""Sobre a mesa da Presença eles estenderão um pano azul e colocarão os pratos, os recipientes para incenso, as tigelas e as bacias para as ofertas derramadas, e os pães da Presença, que devem estar sempre sobre ela."
NUM.4.8	4	8	And they shall spread upon them a cloth of scarlet, and cover the same with a covering of badgers' skins, and shall put in the staves thereof.	0.0	neutral	Sobre tudo isso estenderão um pano vermelho e o cobrirão com couro. Depois colocarão as varas no lugar.
NUM.4.9	4	9	And they shall take a cloth of blue, and cover the candlestick of the light, and his lamps, and his tongs, and his snuffdishes, and all the oil vessels thereof, wherewith they minister unto it:	0.2	positive	"""Pegarão também um pano azul e cobrirão o candelabro usado para iluminação, as suas candeias, as suas tesouras de aparo, os seus apagadores e todos os seus jarros necessários para alimentá-la de óleo."
NUM.4.10	4	10	And they shall put it and all the vessels thereof within a covering of badgers' skins, and shall put {it} upon a bar.	0.0	neutral	Então o embrulharão com todos os seus utensílios numa cobertura de couro e o colocarão num suporte para carregar.
NUM.4.11	4	11	And upon the golden altar they shall spread a cloth of blue, and cover it with a covering of badgers' skins, and shall put to the staves thereof:	0.15	positive	"""Sobre o altar de ouro estenderão um pano azul e o cobrirão com couro. E colocarão as suas varas no lugar."
NUM.4.12	4	12	And they shall take all the instruments of ministry, wherewith they minister in the sanctuary, and put {them} in a cloth of blue, and cover them with a covering of badgers' skins, and shall put {them} on a bar:	0.0	neutral	"""Apanharão todos os utensílios usados na ministração no santuário, depois os embrulharão num pano azul e os cobrirão com couro; a seguir os colocarão num suporte para carregar."
NUM.4.13	4	13	And they shall take away the ashes from the altar, and spread a purple cloth thereon:	0.0	neutral	"""Tirarão a cinza do altar de bronze e estenderão sobre ele um pano roxo."
NUM.4.14	4	14	And they shall put upon it all the vessels thereof, wherewith they minister about it, {even} the censers, the fleshhooks, and the shovels, and the basons, all the vessels of the altar; and they shall spread upon it a covering of badgers' skins, and put to the staves of it. {basons: or, bowls}	0.0	neutral	Colocarão sobre ele todos os utensílios usados na ministração no altar: os braseiros, os garfos de carne, as pás e as bacias da aspersão. Sobre ele estenderão uma cobertura de couro e colocarão as varas no lugar.
NUM.4.15	4	15	And when Aaron and his sons have made an end of covering the sanctuary, and all the vessels of the sanctuary, as the camp is to set forward; after that, the sons of Kohath shall come to bear {it}: but they shall not touch {any} holy thing, lest they die. These {things are} the burden of the sons of Kohath in the tabernacle of the congregation.	0.0	neutral	"""Quando Arão e os seus filhos terminarem de cobrir os utensílios sagrados e todos os artigos sagrados, e o acampamento estiver pronto para partir, os coatitas virão carregá-los. Mas não tocarão nas coisas sagradas; se o fizerem, morrerão. São esses os utensílios da Tenda do Encontro que os coatitas carregarão."
NUM.4.16	4	16	And to the office of Eleazar the son of Aaron the priest {pertaineth} the oil for the light, and the sweet incense, and the daily meat offering, and the anointing oil, {and} the oversight of all the tabernacle, and of all that therein {is}, in the sanctuary, and in the vessels thereof.	0.25	positive	"""Eleazar, filho do sacerdote Arão, ficará encarregado do azeite para a iluminação, do incenso aromático, da oferta costumeira de cereal e do óleo da unção. Ficará encarregado de todo o tabernáculo e de tudo o que nele há, seus utensílios e seus artigos sagrados""."
NUM.4.17	4	17	And the LORD spake unto Moses and unto Aaron, saying,	0.0	neutral	O Senhor disse a Moisés e a Arão:
NUM.4.18	4	18	Cut ye not off the tribe of the families of the Kohathites from among the Levites:	0.0	neutral	"""Não permitam que o ramo dos clãs coatitas seja eliminado dentre os levitas."
NUM.4.19	4	19	But thus do unto them, that they may live, and not die, when they approach unto the most holy things: Aaron and his sons shall go in, and appoint them every one to his service and to his burden:	0.3182	positive	Mas, para que continuem vivos e não morram quando se aproximarem das coisas santíssimas, Arão e os seus filhos entrarão no santuário e designarão a cada homem a sua tarefa e o que deverá carregar.
NUM.4.20	4	20	But they shall not go in to see when the holy things are covered, lest they die.	0.0	neutral	"Os coatitas não entrarão para ver as coisas sagradas, nem por um breve momento, para que não morram""."
NUM.4.21	4	21	And the LORD spake unto Moses, saying,	0.0	neutral	E o Senhor disse a Moisés:
NUM.4.22	4	22	Take also the sum of the sons of Gershon, throughout the houses of their fathers, by their families;	0.0	neutral	"""Faça também um recenseamento dos gersonitas, pelas suas famílias e clãs;"
NUM.4.23	4	23	From thirty years old and upward until fifty years old shalt thou number them; all that enter in to perform the service, to do the work in the tabernacle of the congregation. {to perform...: Heb. to war the warfare}	0.1	neutral	conte todos os homens entre trinta e cinqüenta anos, aptos para servir, para que façam o serviço da Tenda do Encontro.
NUM.4.24	4	24	This {is} the service of the families of the Gershonites, to serve, and for burdens: {burdens: or, carriage}	-0.75	negative	"""Este é o serviço dos clãs gersonitas, o que devem fazer e carregar:"
NUM.4.25	4	25	And they shall bear the curtains of the tabernacle, and the tabernacle of the congregation, his covering, and the covering of the badgers' skins that {is} above upon it, and the hanging for the door of the tabernacle of the congregation,	0.0	neutral	Eles levarão as cortinas internas do tabernáculo, a Tenda do Encontro, a sua cobertura, a cobertura exterior de couro, as cortinas da entrada da Tenda do Encontro.
NUM.4.26	4	26	And the hangings of the court, and the hanging for the door of the gate of the court, which {is} by the tabernacle and by the altar round about, and their cords, and all the instruments of their service, and all that is made for them: so shall they serve.	-0.2	negative	Farão tudo o que for necessário com aquelas coisas e com as cortinas externas do pátio que rodeia o tabernáculo e o altar, com a cortina da entrada, com as cordas e com todos os utensílios usados em seu serviço.
NUM.4.27	4	27	At the appointment of Aaron and his sons shall be all the service of the sons of the Gershonites, in all their burdens, and in all their service: and ye shall appoint unto them in charge all their burdens. {appointment: Heb. mouth}	0.0	neutral	Todo o serviço deles, tudo o que devem fazer e carregar estará sob a direção de Arão e de seus filhos. Designe como responsabilidade deles tudo o que tiverem que carregar.
NUM.4.28	4	28	This {is} the service of the families of the sons of Gershon in the tabernacle of the congregation: and their charge {shall be} under the hand of Ithamar the son of Aaron the priest.	0.0	neutral	Esse é o serviço dos clãs gersonitas na Tenda do Encontro. Suas atividades estarão sob a supervisão de Itamar, filho do sacerdote Arão.
NUM.4.29	4	29	As for the sons of Merari, thou shalt number them after their families, by the house of their fathers;	0.0	neutral	"""Conte os meraritas conforme os seus clãs e famílias,"
NUM.4.30	4	30	From thirty years old and upward even unto fifty years old shalt thou number them, every one that entereth into the service, to do the work of the tabernacle of the congregation. {service: Heb. warfare}	0.1	neutral	todos os homens entre trinta e cinqüenta anos, aptos para servir, para que façam o serviço da Tenda do Encontro.
NUM.4.31	4	31	And this {is} the charge of their burden, according to all their service in the tabernacle of the congregation; the boards of the tabernacle, and the bars thereof, and the pillars thereof, and sockets thereof,	0.0	neutral	Esta é a responsabilidade deles no serviço que realizam na Tenda do Encontro: carregar as armações do tabernáculo, seus travessões, suas colunas e suas bases,
NUM.4.32	4	32	And the pillars of the court round about, and their sockets, and their pins, and their cords, with all their instruments, and with all their service: and by name ye shall reckon the instruments of the charge of their burden.	-0.2	negative	bem como as colunas do pátio, que rodeia a tenda, com suas bases, suas estacas e suas cordas; todos os seus utensílios e tudo o que está relacionado com o seu uso. Designe a cada um aquilo que deverá levar.
NUM.4.33	4	33	This {is} the service of the families of the sons of Merari, according to all their service, in the tabernacle of the congregation, under the hand of Ithamar the son of Aaron the priest.	0.0	neutral	"Este é o serviço dos clãs meraritas. Todo o serviço deles na Tenda do Encontro estará sob a supervisão de Itamar, filho do sacerdote Arão""."
NUM.4.34	4	34	And Moses and Aaron and the chief of the congregation numbered the sons of the Kohathites after their families, and after the house of their fathers,	0.0	neutral	Moisés, Arão e os líderes da comunidade contaram os coatitas, conforme seus clãs e famílias,
NUM.4.35	4	35	From thirty years old and upward even unto fifty years old, every one that entereth into the service, for the work in the tabernacle of the congregation:	0.1	neutral	todos os homens entre trinta e cinqüenta anos, aptos para servir, para que fizessem o serviço da Tenda do Encontro.
NUM.4.36	4	36	And those that were numbered of them by their families were two thousand seven hundred and fifty.	0.0	neutral	Foram contados, conforme os seus clãs, 2. 750 homens.
NUM.4.37	4	37	These {were} they that were numbered of the families of the Kohathites, all that might do service in the tabernacle of the congregation, which Moses and Aaron did number according to the commandment of the LORD by the hand of Moses.	0.0	neutral	Esse foi o total de recenseados dos clãs coatitas que serviam na Tenda do Encontro. Moisés e Arão os contaram de acordo com a ordem do Senhor, anunciada por Moisés.
NUM.4.38	4	38	And those that were numbered of the sons of Gershon, throughout their families, and by the house of their fathers,	0.0	neutral	Os gersonitas foram contados conforme os seus clãs e famílias,
NUM.4.39	4	39	From thirty years old and upward even unto fifty years old, every one that entereth into the service, for the work in the tabernacle of the congregation,	0.1	neutral	todos os homens entre trinta e cinqüenta anos, aptos para servir, para fazer o serviço da Tenda do Encontro.
NUM.4.40	4	40	Even those that were numbered of them, throughout their families, by the house of their fathers, were two thousand and six hundred and thirty.	0.0	neutral	Foram contados conforme os seus clãs e famílias 2. 630.
NUM.4.41	4	41	These {are} they that were numbered of the families of the sons of Gershon, of all that might do service in the tabernacle of the congregation, whom Moses and Aaron did number according to the commandment of the LORD.	0.0	neutral	Esse foi o total de recenseados dos clãs gersonitas que serviam na Tenda do Encontro. Moisés e Arão os contaram de acordo com a ordem do Senhor.
NUM.4.42	4	42	And those that were numbered of the families of the sons of Merari, throughout their families, by the house of their fathers,	0.0	neutral	Os meraritas foram contados conforme os seus clãs e famílias,
NUM.4.43	4	43	From thirty years old and upward even unto fifty years old, every one that entereth into the service, for the work in the tabernacle of the congregation,	0.1	neutral	todos os homens entre trinta e cinqüenta anos, aptos para servir, para fazer o serviço da Tenda do Encontro.
