verse_id	chapter	verse	text_en	polarity_en	label_en	text_pt
1JN.5.13	5	13	These things have I written unto you that believe on the name of the Son of God; that ye may know that ye have eternal life, and that ye may believe on the name of the Son of God.	0.0	neutral	Escrevi-lhes estas coisas, a vocês que crêem no nome do Filho de Deus, para que vocês saibam que têm a vida eterna.
1JN.5.14	5	14	And this is the confidence that we have in him, that, if we ask any thing according to his will, he heareth us: {in: or, concerning}	-0.75	negative	Esta é a confiança que temos ao nos aproximarmos de Deus: se pedirmos alguma coisa de acordo com a sua vontade, ele nos ouve.
1JN.5.15	5	15	And if we know that he hear us, whatsoever we ask, we know that we have the petitions that we desired of him.	0.0	neutral	E se sabemos que ele nos ouve em tudo o que pedimos, sabemos que temos o que dele pedimos.
1JN.5.16	5	16	If any man see his brother sin a sin {which is} not unto death, he shall ask, and he shall give him life for them that sin not unto death. There is a sin unto death: I do not say that he shall pray for it.	0.0	neutral	Se alguém vir seu irmão cometer pecado que não leva à morte, ore, e Deus lhe dará vida. Refiro-me àqueles cujo pecado não leva à morte. Há pecado que leva à morte; não estou dizendo que se deva orar por este.
1JN.5.17	5	17	All unrighteousness is sin: and there is a sin not unto death.	0.0	neutral	Toda injustiça é pecado, mas há pecado que não leva à morte.
1JN.5.18	5	18	We know that whosoever is born of God sinneth not; but he that is begotten of God keepeth himself, and that wicked one toucheth him not. {is born: Gr. has been born}	0.0	neutral	Sabemos que todo aquele que é nascido de Deus não está no pecado; aquele que nasceu de Deus o protege, e o Maligno não o atinge.
1JN.5.19	5	19	{And} we know that we are of God, and the whole world lieth in wickedness.	0.2	positive	Sabemos que somos de Deus e que o mundo todo está sob o poder do Maligno.
1JN.5.20	5	20	And we know that the Son of God is come, and hath given us an understanding, that we may know him that is true, and we are in him that is true, {even} in his Son Jesus Christ. This is the true God, and eternal life.	0.35	positive	Sabemos também que o Filho de Deus veio e nos deu entendimento, para que conheçamos aquele que é o Verdadeiro. E nós estamos naquele que é o Verdadeiro, em seu Filho Jesus Cristo. Este é o verdadeiro Deus e a vida eterna.
1JN.5.21	5	21	Little children, keep yourselves from idols. Amen.	-0.1875	negative	Filhinhos, guardem-se dos ídolos.
