verse_id	chapter	verse	text_en	polarity_en	label_en	text_pt
2KI.4.1	4	1	Now there cried a certain woman of the wives of the sons of the prophets unto Elisha, saying, Thy servant my husband is dead; and thou knowest that thy servant did fear the LORD: and the creditor is come to take unto him my two sons to be bondmen.	0.0071	neutral	"Certo dia, a mulher de um dos discípulos dos profetas foi falar a Eliseu: ""Teu servo, meu marido, morreu, e tu sabes que ele temia o Senhor. Mas agora veio um credor que está querendo levar meus dois filhos como escravos""."
2KI.4.2	4	2	And Elisha said unto her, What shall I do for thee? tell me, what hast thou in the house? And she said, Thine handmaid hath not any thing in the house, save a pot of oil.	0.0	neutral	"Eliseu perguntou-lhe: ""Como posso ajudá-la? Diga-me, o que você tem em casa? "" E ela respondeu: ""Tua serva não tem nada além de uma vasilha de azeite""."
2KI.4.3	4	3	Then he said, Go, borrow thee vessels abroad of all thy neighbours, {even} empty vessels; borrow not a few. {borrow not...: or, scant not}	0.0	neutral	"Então disse Eliseu: ""Vá pedir emprestadas vasilhas a todos os vizinhos. Mas, peça muitas."
2KI.4.4	4	4	And when thou art come in, thou shalt shut the door upon thee and upon thy sons, and shalt pour out into all those vessels, and thou shalt set aside that which is full.	0.35	positive	"Depois entre em casa com seus filhos e feche a porta. Derrame daquele azeite em cada vasilha e vá separando as que você for enchendo""."
2KI.4.5	4	5	So she went from him, and shut the door upon her and upon her sons, who brought {the vessels} to her; and she poured out.	0.0	neutral	Depois disso, ela foi embora, fechou-se em casa com seus filhos e começou a encher as vasilhas que eles lhe traziam.
2KI.4.6	4	6	And it came to pass, when the vessels were full, that she said unto her son, Bring me yet a vessel. And he said unto her, {There is} not a vessel more. And the oil stayed.	0.425	positive	"Quando todas as vasilhas estavam cheias, ela disse a um dos filhos: ""Traga-me mais uma"". Mas ele respondeu: ""Já acabaram"". Então o azeite parou de correr."
2KI.4.7	4	7	Then she came and told the man of God. And he said, Go, sell the oil, and pay thy debt, and live thou and thy children of the rest. {debt: or, creditor}	0.1364	positive	"Ela foi e contou tudo ao homem de Deus, que lhe disse: ""Vá, venda o azeite e pague suas dívidas. E você e seus filhos ainda poderão viver do que sobrar""."
2KI.4.8	4	8	And it fell on a day, that Elisha passed to Shunem, where {was} a great woman; and she constrained him to eat bread. And {so} it was, {that} as oft as he passed by, he turned in thither to eat bread. {it fell on a day: Heb. there was a day} {constrained him: Heb. laid hold on him}	0.8	positive	Certo dia, Eliseu foi a Suném, onde uma mulher rica insistiu que ele fosse tomar uma refeição em sua casa. Depois disso, sempre que passava por ali, ele parava para uma refeição.
2KI.4.9	4	9	And she said unto her husband, Behold now, I perceive that this {is} an holy man of God, which passeth by us continually.	0.0	neutral	"De modo que ela disse ao marido: ""Sei que esse homem que sempre vem aqui é um santo homem de Deus."
2KI.4.10	4	10	Let us make a little chamber, I pray thee, on the wall; and let us set for him there a bed, and a table, and a stool, and a candlestick: and it shall be, when he cometh to us, that he shall turn in thither.	-0.1875	negative	"Vamos construir lá em cima um quartinho de tijolos e colocar nele uma cama, uma mesa, uma cadeira e uma lamparina para ele. Assim, sempre que nos visitar ele poderá ocupá-lo""."
2KI.4.11	4	11	And it fell on a day, that he came thither, and he turned into the chamber, and lay there.	0.0	neutral	Um dia, quando Eliseu chegou, subiu ao seu quarto e deitou-se.
2KI.4.12	4	12	And he said to Gehazi his servant, Call this Shunammite. And when he had called her, she stood before him.	0.0	neutral	Ele mandou o seu servo Geazi chamar a sunamita. Então ele a chamou, e quando ela veio,
2KI.4.13	4	13	And he said unto him, Say now unto her, Behold, thou hast been careful for us with all this care; what {is} to be done for thee? wouldest thou be spoken for to the king, or to the captain of the host? And she answered, I dwell among mine own people.	0.25	positive	"Eliseu mandou que Geazi dissesse a ela: ""Você teve todo este trabalho por nossa causa. O que podemos fazer por você? Quer que eu interceda por você junto ao rei ou ao comandante do exército? "" Ela respondeu: ""Estou bem entre minha própria gente""."
2KI.4.14	4	14	And he said, What then {is} to be done for her? And Gehazi answered, Verily she hath no child, and her husband is old.	0.1	neutral	"Mais tarde Eliseu perguntou a Geazi: ""O que se pode fazer por ela? "" Ele respondeu: ""Bem, ela não tem filhos, e seu marido é idoso""."
2KI.4.15	4	15	And he said, Call her. And when he had called her, she stood in the door.	0.0	neutral	Então Eliseu mandou chamá-la de novo. Geazi a chamou, e ela veio até a porta.
2KI.4.16	4	16	And he said, About this season, according to the time of life, thou shalt embrace a son. And she said, Nay, my lord, {thou} man of God, do not lie unto thine handmaid. {season: Heb. set time}	0.0	neutral	"E ele disse: ""Por volta desta época, no ano que vem, você estará com um filho nos braços"". Ela contestou: ""Não, meu senhor. Não iludas a tua serva, ó homem de Deus! """
2KI.4.17	4	17	And the woman conceived, and bare a son at that season that Elisha had said unto her, according to the time of life.	0.05	neutral	Mas, como Eliseu lhe dissera, a mulher engravidou e, no ano seguinte, por volta daquela mesma época, deu à luz um filho.
2KI.4.18	4	18	And when the child was grown, it fell on a day, that he went out to his father to the reapers.	0.0	neutral	O menino cresceu e, certo dia, foi encontrar seu pai, que estava com os ceifeiros.
2KI.4.19	4	19	And he said unto his father, My head, my head. And he said to a lad, Carry him to his mother.	0.0	neutral	"De repente, ele começou a chamar o pai, gritando: ""Ai, minha cabeça! Ai, minha cabeça! "" Então o pai disse a um servo: ""Leve-o para a mãe dele""."
2KI.4.20	4	20	And when he had taken him, and brought him to his mother, he sat on her knees till noon, and {then} died.	0.0	neutral	O servo o pegou e o levou à mãe, o menino ficou no colo dela até o meio-dia, quando morreu.
2KI.4.21	4	21	And she went up, and laid him on the bed of the man of God, and shut {the door} upon him, and went out.	0.0	neutral	Ela subiu ao quarto do homem de Deus, deitou o menino na cama, saiu e fechou a porta.
2KI.4.22	4	22	And she called unto her husband, and said, Send me, I pray thee, one of the young men, and one of the asses, that I may run to the man of God, and come again.	0.1	neutral	"Ela chamou o marido e disse: ""Preciso de um servo e uma jumenta para ir falar com o homem de Deus. Vou e volto depressa""."
2KI.4.23	4	23	And he said, Wherefore wilt thou go to him to day? {it is} neither new moon, nor sabbath. And she said, {It shall be} well. {well: Heb. peace}	0.1364	positive	"Ele perguntou: ""Mas, por que hoje? Não é lua nova nem sábado! "" Ela respondeu: ""Não se preocupe""."
2KI.4.24	4	24	Then she saddled an ass, and said to her servant, Drive, and go forward; slack not {thy} riding for me, except I bid thee. {slack...: Heb. restrain not for me to ride}	0.0	neutral	"Ela mandou selar a jumenta, e disse ao servo: ""Vamos rápido, só pare quando eu mandar""."
2KI.4.25	4	25	So she went and came unto the man of God to mount Carmel. And it came to pass, when the man of God saw her afar off, that he said to Gehazi his servant, Behold, {yonder is} that Shunammite:	0.0	neutral	"Assim ela partiu para encontrar-se com o homem de Deus no monte Carmelo. Quando ele a viu a distância, disse a seu servo Geazi: ""Olhe! É a sunamita!"
2KI.4.26	4	26	Run now, I pray thee, to meet her, and say unto her, {Is it} well with thee? {is it} well with thy husband? {is it} well with the child? And she answered, {It is} well.	0.0	neutral	"Corra ao encontro dela e lhe pergunte: 'Está tudo bem com você? Tudo bem com seu marido? E com seu filho? ' "" Ela respondeu a Geazi: ""Está tudo bem""."
2KI.4.27	4	27	And when she came to the man of God to the hill, she caught him by the feet: but Gehazi came near to thrust her away. And the man of God said, Let her alone; for her soul {is} vexed within her: and the LORD hath hid {it} from me, and hath not told me. {him...: Heb. by his feet} {vexed: Heb. bitter}	0.0	neutral	"Ao encontrar o homem de Deus no monte, ela se abraçou aos seus pés. Geazi veio para afastá-la, mas o homem de Deus lhe disse: ""Deixe-a em paz! Ela está muito angustiada, mas o Senhor nada me revelou e escondeu de mim a razão de sua angústia""."
2KI.4.28	4	28	Then she said, Did I desire a son of my lord? did I not say, Do not deceive me?	0.0	neutral	"E disse a mulher: ""Acaso eu te pedi um filho, meu senhor? Não te disse para não me dar falsas esperanças? """
2KI.4.29	4	29	Then he said to Gehazi, Gird up thy loins, and take my staff in thine hand, and go thy way: if thou meet any man, salute him not; and if any salute thee, answer him not again: and lay my staff upon the face of the child.	0.0	neutral	"Então Eliseu disse a Geazi: ""Ponha a capa por dentro do cinto, pegue o meu cajado e corra. Se você encontrar alguém, não o cumprimente e, se alguém o cumprimentar, não responda. Quando lá chegar, ponha o meu cajado sobre o rosto do menino""."
2KI.4.30	4	30	And the mother of the child said, {As} the LORD liveth, and {as} thy soul liveth, I will not leave thee. And he arose, and followed her.	0.0	neutral	"Mas a mãe do menino disse: ""Juro pelo nome do Senhor e por tua vida que, se ficares, não irei"". Então ele foi com ela."
2KI.4.31	4	31	And Gehazi passed on before them, and laid the staff upon the face of the child; but {there was} neither voice, nor hearing. Wherefore he went again to meet him, and told him, saying, The child is not awaked. {hearing: Heb. attention}	0.0	neutral	"Geazi chegou primeiro e pôs o cajado sobre o rosto do menino, mas ele não falou nem reagiu. Então Geazi voltou para encontrar-se com Eliseu e lhe disse: ""O menino não voltou a si""."
2KI.4.32	4	32	And when Elisha was come into the house, behold, the child was dead, {and} laid upon his bed.	-0.2	negative	Quando Eliseu chegou à casa, lá estava o menino, morto, estendido na cama.
2KI.4.33	4	33	He went in therefore, and shut the door upon them twain, and prayed unto the LORD.	0.0	neutral	Ele entrou, fechou a porta e orou ao Senhor.
2KI.4.34	4	34	And he went up, and lay upon the child, and put his mouth upon his mouth, and his eyes upon his eyes, and his hands upon his hands: and he stretched himself upon the child; and the flesh of the child waxed warm.	0.275	positive	Então, deitou-se sobre o menino, boca a boca, olhos com olhos, mãos com mãos. Enquanto se debruçava sobre ele, o corpo do menino foi se aquecendo.
2KI.4.35	4	35	Then he returned, and walked in the house to and fro; and went up, and stretched himself upon him: and the child sneezed seven times, and the child opened his eyes. {to and fro: Heb. once hither and once thither}	-0.05	neutral	Eliseu levantou-se e começou a andar pelo quarto; depois subiu na cama e debruçou-se mais uma vez sobre ele. O menino espirrou sete vezes e abriu os olhos.
2KI.4.36	4	36	And he called Gehazi, and said, Call this Shunammite. So he called her. And when she was come in unto him, he said, Take up thy son.	0.0	neutral	"Eliseu chamou Geazi e o mandou chamar a sunamita. E ele obedeceu. Quando ela chegou, Eliseu disse: ""Pegue seu filho""."
2KI.4.37	4	37	Then she went in, and fell at his feet, and bowed herself to the ground, and took up her son, and went out.	0.0	neutral	Ela entrou, prostrou-se a seus pés, curvando-se até o chão. Então pegou o filho e saiu.
2KI.4.38	4	38	And Elisha came again to Gilgal: and {there was} a dearth in the land; and the sons of the prophets {were} sitting before him: and he said unto his servant, Set on the great pot, and seethe pottage for the sons of the prophets.	0.8	positive	"Depois Eliseu voltou a Gilgal. Nesse tempo a fome assolava a região. Quando os discípulos dos profetas estavam reunidos com ele, ordenou ao seu servo: ""Ponha o caldeirão no fogo e faça um ensopado para estes homens""."
2KI.4.39	4	39	And one went out into the field to gather herbs, and found a wild vine, and gathered thereof wild gourds his lap full, and came and shred {them} into the pot of pottage: for they knew {them} not.	0.1833	positive	Um deles foi ao campo apanhar legumes e encontrou uma trepadeira. Apanhou alguns de seus frutos e encheu deles o seu manto. Quando voltou, cortou-os em pedaços e colocou-os no caldeirão do ensopado, embora ninguém soubesse o que era.
2KI.4.40	4	40	So they poured out for the men to eat. And it came to pass, as they were eating of the pottage, that they cried out, and said, O {thou} man of God, {there is} death in the pot. And they could not eat {thereof}.	0.0	neutral	"O ensopado foi servido aos homens, mas, logo que o provaram, eles gritaram: ""Homem de Deus, há morte na panela! "" E não puderam mais tomá-lo."
2KI.4.41	4	41	But he said, Then bring meal. And he cast {it} into the pot; and he said, Pour out for the people, that they may eat. And there was no harm in the pot. {harm: Heb. evil thing}	-1.0	negative	"Então Eliseu pediu um pouco de farinha, colocou no caldeirão e disse: ""Sirvam a todos"". E já não havia mais perigo no caldeirão."
2KI.4.42	4	42	And there came a man from Baalshalisha, and brought the man of God bread of the firstfruits, twenty loaves of barley, and full ears of corn in the husk thereof. And he said, Give unto the people, that they may eat. {the husk...: or, his scrip, or, garment}	0.35	positive	"Veio um homem de Baal-Salisa, trazendo ao homem de Deus vinte pães de cevada, feitos dos primeiros grãos da colheita, e também algumas espigas verdes. Então Eliseu ordenou ao seu servo: ""Sirva a todos""."
2KI.4.43	4	43	And his servitor said, What, should I set this before an hundred men? He said again, Give the people, that they may eat: for thus saith the LORD, They shall eat, and shall leave {thereof}.	0.0	neutral	"O auxiliar de Eliseu perguntou: ""Como poderei servir isso a cem homens? "" Eliseu, porém, respondeu: ""Sirva a todos, pois assim diz o Senhor: 'Eles comerão, e ainda sobrará' ""."
2KI.4.44	4	44	So he set {it} before them, and they did eat, and left {thereof}, according to the word of the LORD.	0.0	neutral	Então ele serviu a todos, e conforme a palavra do Senhor, eles comeram e ainda sobrou.
2KI.5.1	5	1	Now Naaman, captain of the host of the king of Syria, was a great man with his master, and honourable, because by him the LORD had given deliverance unto Syria: he was also a mighty man in valour, {but he was} a leper. {with: Heb. before} {honourable: or, gracious: Heb. lifted up, or, accepted in countenance} {deliverance: or, victory}	0.6	positive	Naamã, comandante do exército do rei da Síria, era muito respeitado e honrado pelo seu senhor, pois por meio dele o Senhor dera vitória à Síria. Mas esse grande guerreiro ficou leproso.
2KI.5.2	5	2	And the Syrians had gone out by companies, and had brought away captive out of the land of Israel a little maid; and she waited on Naaman's wife. {waited...: Heb. was before}	0.0063	neutral	Ora, tropas da Síria haviam atacado Israel e levado cativa uma menina, que passou a servir à mulher de Naamã.
2KI.5.3	5	3	And she said unto her mistress, Would God my lord {were} with the prophet that {is} in Samaria! for he would recover him of his leprosy. {with: Heb. before} {recover: Heb. gather in}	0.0	neutral	"Um dia ela disse à sua senhora: ""Se o meu senhor procurasse o profeta que está em Samaria, ele o curaria da lepra""."
2KI.5.4	5	4	And {one} went in, and told his lord, saying, Thus and thus said the maid that {is} of the land of Israel.	0.0	neutral	Naamã foi contar ao seu senhor o que a menina israelita dissera.
2KI.5.5	5	5	And the king of Syria said, Go to, go, and I will send a letter unto the king of Israel. And he departed, and took with him ten talents of silver, and six thousand {pieces} of gold, and ten changes of raiment. {with...: Heb. in his hand}	0.0	neutral	"O rei da Síria respondeu: ""Vá. Eu lhe darei uma carta que você entregará ao rei de Israel"". Então Naamã partiu, levando consigo trezentos e cinqüenta quilos de prata, setenta e dois quilos de ouro e dez mudas de roupas finas."
2KI.5.6	5	6	And he brought the letter to the king of Israel, saying, Now when this letter is come unto thee, behold, I have {therewith} sent Naaman my servant to thee, that thou mayest recover him of his leprosy.	0.0	neutral	"A carta que levou ao rei de Israel dizia: ""Junto com esta carta estou te enviando meu oficial Naamã, para que o cures da lepra""."
2KI.5.7	5	7	And it came to pass, when the king of Israel had read the letter, that he rent his clothes, and said, {Am} I God, to kill and to make alive, that this man doth send unto me to recover a man of his leprosy? wherefore consider, I pray you, and see how he seeketh a quarrel against me.	0.1	neutral	"Assim que o rei de Israel leu a carta, rasgou as vestes e disse: ""Por acaso sou Deus, capaz de conceder vida ou morte? Por que este homem me envia alguém para que eu o cure da lepra? Vejam como ele procura um motivo para se desentender comigo! """
2KI.5.8	5	8	And it was {so}, when Elisha the man of God had heard that the king of Israel had rent his clothes, that he sent to the king, saying, Wherefore hast thou rent thy clothes? let him come now to me, and he shall know that there is a prophet in Israel.	0.0	neutral	"Quando Eliseu, o homem de Deus, soube que o rei de Israel havia rasgado suas vestes, mandou-lhe esta mensagem: ""Por que rasgaste tuas vestes? Envia o homem a mim, e ele saberá que há profeta em Israel""."
2KI.5.9	5	9	So Naaman came with his horses and with his chariot, and stood at the door of the house of Elisha.	0.0	neutral	Então, Naamã foi com seus cavalos e carros e parou à porta da casa de Eliseu.
2KI.5.10	5	10	And Elisha sent a messenger unto him, saying, Go and wash in Jordan seven times, and thy flesh shall come again to thee, and thou shalt be clean.	0.3667	positive	"Eliseu enviou um mensageiro para lhe dizer: ""Vá e lave-se sete vezes no rio Jordão; sua pele será restaurada e você ficará purificado""."
2KI.5.11	5	11	But Naaman was wroth, and went away, and said, Behold, I thought, He will surely come out to me, and stand, and call on the name of the LORD his God, and strike his hand over the place, and recover the leper. {I thought: Heb. I said} {I thought...: or, I said with myself, He will surely come out, etc: Heb. I said} {strike: Heb. move up and down}	0.2815	positive	"Mas Naamã ficou indignado e saiu dizendo: ""Eu estava certo de que ele sairia para receber-me, invocaria de pé o nome do Senhor seu Deus, moveria a mão sobre o lugar afetado e me curaria da lepra."
2KI.5.12	5	12	{Are} not Abana and Pharpar, rivers of Damascus, better than all the waters of Israel? may I not wash in them, and be clean? So he turned and went away in a rage. {Abana: or, Amana}	0.4333	positive	"Não são os rios Abana e Farfar, em Damasco, melhores do que todas as águas de Israel? Será que não poderia lavar-me neles e ser purificado? "" Então, foi embora dali furioso."
2KI.5.13	5	13	And his servants came near, and spake unto him, and said, My father, {if} the prophet had bid thee {do some} great thing, wouldest thou not have done {it}? how much rather then, when he saith to thee, Wash, and be clean?	0.3667	positive	"Mas os seus servos lhe disseram: ""Meu pai, se o profeta lhe tivesse pedido alguma coisa difícil, o senhor não faria? Quanto mais, quando ele apenas lhe diz para que se lave e seja purificado! """
2KI.5.14	5	14	Then went he down, and dipped himself seven times in Jordan, according to the saying of the man of God: and his flesh came again like unto the flesh of a little child, and he was clean.	0.0079	neutral	Assim ele desceu ao Jordão e mergulhou sete vezes conforme a ordem do homem de Deus; ele foi purificado e sua pele tornou-se como a de uma criança.
2KI.5.15	5	15	And he returned to the man of God, he and all his company, and came, and stood before him: and he said, Behold, now I know that {there is} no God in all the earth, but in Israel: now therefore, I pray thee, take a blessing of thy servant.	0.0	neutral	"Então Naamã e toda a sua comitiva voltaram à casa do homem de Deus. Ao chegar diante do profeta, Naamã lhe disse: ""Agora sei que não há Deus em nenhum outro lugar, senão em Israel. Por favor, aceita um presente de teu servo""."
2KI.5.16	5	16	But he said, {As} the LORD liveth, before whom I stand, I will receive none. And he urged him to take {it}; but he refused.	0.0	neutral	"O profeta respondeu: ""Juro pelo nome do Senhor, a quem sirvo, que nada aceitarei"". Embora Naamã insistisse, ele recusou."
2KI.5.17	5	17	And Naaman said, Shall there not then, I pray thee, be given to thy servant two mules' burden of earth? for thy servant will henceforth offer neither burnt offering nor sacrifice unto other gods, but unto the LORD.	-0.125	negative	"E disse Naamã: ""Já que não aceitas o presente, ao menos permite que eu leve duas mulas carregadas de terra, pois teu servo nunca mais fará holocaustos e sacrifícios a nenhum outro deus senão ao Senhor."
2KI.5.18	5	18	In this thing the LORD pardon thy servant, {that} when my master goeth into the house of Rimmon to worship there, and he leaneth on my hand, and I bow myself in the house of Rimmon: when I bow down myself in the house of Rimmon, the LORD pardon thy servant in this thing.	-0.1556	negative	"Mas que o Senhor me perdoe por uma única coisa: quando meu senhor vai adorar no templo de Rimom, eu também tenho que me ajoelhar ali pois ele se apóia em meu braço. Que o Senhor perdoe o teu servo por isso""."
2KI.5.19	5	19	And he said unto him, Go in peace. So he departed from him a little way. {a little...: Heb. a little piece of ground}	-0.1875	negative	"Disse Eliseu: ""Vá em paz"". Quando Naamã já estava a certa distância,"
2KI.5.20	5	20	But Gehazi, the servant of Elisha the man of God, said, Behold, my master hath spared Naaman this Syrian, in not receiving at his hands that which he brought: but, {as} the LORD liveth, I will run after him, and take somewhat of him.	0.0	neutral	"Geazi, servo de Eliseu, o homem de Deus, pensou: ""Meu senhor foi bom demais para Naamã, aquele arameu, não aceitando o que ele lhe ofereceu. Juro pelo nome do Senhor que correrei atrás dele para ver se ganho alguma coisa""."
2KI.5.21	5	21	So Gehazi followed after Naaman. And when Naaman saw {him} running after him, he lighted down from the chariot to meet him, and said, {Is} all well? {Is...: Heb. Is there peace?}	-0.1556	negative	"Então Geazi correu para alcançar Naamã, que, vendo-o se aproximar, desceu da carruagem para encontrá-lo e perguntou: ""Está tudo bem? """
2KI.5.22	5	22	And he said, All {is} well. My master hath sent me, saying, Behold, even now there be come to me from mount Ephraim two young men of the sons of the prophets: give them, I pray thee, a talent of silver, and two changes of garments.	0.1	neutral	"Geazi respondeu: ""Sim, tudo bem. Mas o meu senhor enviou-me para dizer que dois jovens, discípulos dos profetas, acabaram de chegar, vindos dos montes de Efraim. Por favor, dê-lhes trinta e cinco quilos de prata e duas mudas de roupas finas""."
2KI.5.23	5	23	And Naaman said, Be content, take two talents. And he urged him, and bound two talents of silver in two bags, with two changes of garments, and laid {them} upon two of his servants; and they bare {them} before him.	0.05	neutral	"""Claro"", respondeu Naamã, ""leve setenta quilos"". Ele insistiu com Geazi para que aceitasse e colocou os setenta quilos de prata em duas sacolas, com as duas mudas de roupas, entregando tudo a dois de seus servos, os quais foram à frente de Geazi, levando as sacolas."
2KI.5.24	5	24	And when he came to the tower, he took {them} from their hand, and bestowed {them} in the house: and he let the men go, and they departed. {tower: or, secret place}	-0.4	negative	Quando Geazi chegou à colina onde morava, pegou as sacolas dos servos e guardou-as em casa. Mandou os homens de volta, e eles partiram.
2KI.5.25	5	25	But he went in, and stood before his master. And Elisha said unto him, Whence {comest thou}, Gehazi? And he said, Thy servant went no whither. {no whither: Heb. not hither or thither}	0.0	neutral	"Então entrou e apresentou-se ao seu senhor Eliseu. E este perguntou: ""Onde você esteve, Geazi? "" Geazi respondeu: ""Teu servo não foi a lugar algum""."
2KI.5.26	5	26	And he said unto him, Went not mine heart {with thee}, when the man turned again from his chariot to meet thee? {Is it} a time to receive money, and to receive garments, and oliveyards, and vineyards, and sheep, and oxen, and menservants, and maidservants?	0.0	neutral	"Mas Eliseu lhe disse: ""Você acha que eu não estava com você em espírito quando o homem desceu da carruagem para encontrar-se com você? Este não era o momento de aceitar prata nem roupas, nem de cobiçar olivais, vinhas, ovelhas, bois, servos e servas."
2KI.5.27	5	27	The leprosy therefore of Naaman shall cleave unto thee, and unto thy seed for ever. And he went out from his presence a leper {as white} as snow.	0.0	neutral	"Por isso a lepra de Naamã atingirá você e os seus descendentes para sempre"". Então Geazi saiu da presença de Eliseu já leproso, parecido com neve."
