verse_id	chapter	verse	text_en	polarity_en	label_en	text_pt
2KI.8.15	8	15	And it came to pass on the morrow, that he took a thick cloth, and dipped {it} in water, and spread {it} on his face, so that he died: and Hazael reigned in his stead.	-0.3	negative	Mas, no dia seguinte, ele apanhou um cobertor, encharcou-o e com ele sufocou o rei, até matá-lo. E assim Hazael foi o seu sucessor.
2KI.8.16	8	16	And in the fifth year of Joram the son of Ahab king of Israel, Jehoshaphat {being} then king of Judah, Jehoram the son of Jehoshaphat king of Judah began to reign. {began...: Heb. reigned}	0.0	neutral	No quinto ano de Jorão, filho de Acabe, rei de Israel, sendo Josafá rei de Judá, Jeorão, seu filho, começou a reinar em Judá.
2KI.8.17	8	17	Thirty and two years old was he when he began to reign; and he reigned eight years in Jerusalem.	0.1	neutral	Ele tinha trinta e dois anos de idade quando começou a reinar, e reinou oito anos em Jerusalém.
2KI.8.18	8	18	And he walked in the way of the kings of Israel, as did the house of Ahab: for the daughter of Ahab was his wife: and he did evil in the sight of the LORD.	-1.0	negative	Andou nos caminhos dos reis de Israel, como a família de Acabe havia feito, pois se casou com uma filha de Acabe. E fez o que o Senhor reprova.
2KI.8.19	8	19	Yet the LORD would not destroy Judah for David his servant's sake, as he promised him to give him alway a light, {and} to his children. {light: Heb. candle, or, lamp}	0.3	positive	Entretanto, por amor ao seu servo Davi, o Senhor não quis destruir Judá. Ele havia prometido manter para sempre um descendente de Davi no trono.
2KI.8.20	8	20	In his days Edom revolted from under the hand of Judah, and made a king over themselves.	0.0	neutral	Nos dias de Jeorão, os edomitas rebelaram-se contra o domínio de Judá, proclamando seu próprio rei.
2KI.8.21	8	21	So Joram went over to Zair, and all the chariots with him: and he rose by night, and smote the Edomites which compassed him about, and the captains of the chariots: and the people fled into their tents.	0.6	positive	Por isso, Jeorão foi a Zair com todos os seus carros de guerra. Lá os edomitas cercaram a ele e aos chefes dos seus carros de guerra, mas ele os atacou de noite e rompeu o cerco inimigo, e seu exército conseguiu fugir para casa.
2KI.8.22	8	22	Yet Edom revolted from under the hand of Judah unto this day. Then Libnah revolted at the same time.	0.0	neutral	E até hoje Edom continua independente de Judá. Nessa mesma época, a cidade de Libna também tornou-se independente.
2KI.8.23	8	23	And the rest of the acts of Joram, and all that he did, {are} they not written in the book of the chronicles of the kings of Judah?	0.0	neutral	Os demais acontecimentos do reinado de Jeorão e todas as suas realizações, estão escritos nos registros históricos dos reis de Judá.
2KI.8.24	8	24	And Joram slept with his fathers, and was buried with his fathers in the city of David: and Ahaziah his son reigned in his stead. {Ahaziah: also called, Azariah, and Jehoahaz}	0.0	neutral	Jeorão descansou com seus antepassados e foi sepultado com eles na cidade de Davi. E seu filho Acazias foi o seu sucessor.
2KI.8.25	8	25	In the twelfth year of Joram the son of Ahab king of Israel did Ahaziah the son of Jehoram king of Judah begin to reign.	0.0	neutral	No décimo segundo ano do reinado de Jorão, filho de Acabe, rei de Israel, Acazias, filho de Jeorão, rei de Judá, começou a reinar.
2KI.8.26	8	26	Two and twenty years old {was} Ahaziah when he began to reign; and he reigned one year in Jerusalem. And his mother's name {was} Athaliah, the daughter of Omri king of Israel. {daughter: or, granddaughter}	0.1	neutral	Ele tinha vinte e dois anos de idade quando começou a reinar, e reinou um ano em Jerusalém. O nome de sua mãe era Atalia, neta de Onri, rei de Israel.
2KI.8.27	8	27	And he walked in the way of the house of Ahab, and did evil in the sight of the LORD, as {did} the house of Ahab: for he {was} the son in law of the house of Ahab.	-1.0	negative	Ele andou nos caminhos da família de Acabe e fez o que o Senhor reprova, como a família de Acabe havia feito, pois casou-se com uma mulher da família de Acabe.
2KI.8.28	8	28	And he went with Joram the son of Ahab to the war against Hazael king of Syria in Ramothgilead; and the Syrians wounded Joram.	0.0	neutral	Acazias aliou-se a Jorão, filho de Acabe, e saiu à guerra contra Hazael, rei da Síria, em Ramote-Gileade. Jorão foi ferido
2KI.8.29	8	29	And king Joram went back to be healed in Jezreel of the wounds which the Syrians had given him at Ramah, when he fought against Hazael king of Syria. And Ahaziah the son of Jehoram king of Judah went down to see Joram the son of Ahab in Jezreel, because he was sick. {which...: Heb. wherewith the Syrians had wounded} {Ramah: called Ramoth} {sick: Heb. wounded}	-0.396	negative	e voltou a Jezreel para recuperar-se dos ferimentos sofridos em Ramote, na batalha contra Hazael, rei da Síria. Depois Acazias, rei de Judá, foi a Jezreel visitar Jorão, que se recuperava de seus ferimentos.
2KI.9.1	9	1	And Elisha the prophet called one of the children of the prophets, and said unto him, Gird up thy loins, and take this box of oil in thine hand, and go to Ramothgilead:	0.0	neutral	"Enquanto isso o profeta Eliseu chamou um dos discípulos dos profetas e lhe disse: ""Ponha a capa por dentro do cinto, pegue este frasco de óleo e vá a Ramote-Gileade."
2KI.9.2	9	2	And when thou comest thither, look out there Jehu the son of Jehoshaphat the son of Nimshi, and go in, and make him arise up from among his brethren, and carry him to an inner chamber; {inner...: Heb. chamber in a chamber}	0.0	neutral	Quando lá chegar, procure Jeú, filho de Josafá e neto de Ninsi. Dirija-se a ele e leve-o para uma sala longe dos seus companheiros.
2KI.9.3	9	3	Then take the box of oil, and pour {it} on his head, and say, Thus saith the LORD, I have anointed thee king over Israel. Then open the door, and flee, and tarry not.	0.0	neutral	"Depois pegue o frasco, derrame o óleo sobre a cabeça dele e declare: 'Assim diz o Senhor: Eu o estou ungindo rei sobre Israel'. Então abra a porta e fuja sem demora! """
2KI.9.4	9	4	So the young man, {even} the young man the prophet, went to Ramothgilead.	0.1	neutral	Então o jovem profeta foi a Ramote-Gileade.
2KI.9.5	9	5	And when he came, behold, the captains of the host {were} sitting; and he said, I have an errand to thee, O captain. And Jehu said, Unto which of all us? And he said, To thee, O captain.	0.0	neutral	"Ao chegar, encontrou os comandantes do exército reunidos e disse: ""Trago uma mensagem para ti, comandante"". ""Para qual de nós? "", perguntou Jeú. Ele respondeu: ""Para ti, comandante""."
2KI.9.6	9	6	And he arose, and went into the house; and he poured the oil on his head, and said unto him, Thus saith the LORD God of Israel, I have anointed thee king over the people of the LORD, {even} over Israel.	0.0	neutral	"Jeú levantou-se e entrou na casa. Então o jovem profeta derramou o óleo na cabeça de Jeú e declarou-lhe: ""Assim diz o Senhor, o Deus de Israel: 'Eu o estou ungindo rei de Israel, o povo do Senhor."
2KI.9.7	9	7	And thou shalt smite the house of Ahab thy master, that I may avenge the blood of my servants the prophets, and the blood of all the servants of the LORD, at the hand of Jezebel.	0.0	neutral	Você dará fim à família de Acabe, seu senhor, e assim eu vingarei o sangue de meus servos, os profetas, e o sangue de todos os servos do Senhor, derramado por Jezabel.
2KI.9.8	9	8	For the whole house of Ahab shall perish: and I will cut off from Ahab him that pisseth against the wall, and him that is shut up and left in Israel:	0.1	neutral	Toda a família de Acabe perecerá. Eliminarei todos os de sexo masculino de sua família em Israel, seja escravo seja livre.
2KI.9.9	9	9	And I will make the house of Ahab like the house of Jeroboam the son of Nebat, and like the house of Baasha the son of Ahijah:	0.0	neutral	Tratarei a família de Acabe como tratei a de Jeroboão, filho de Nebate, e a de Baasa, filho de Aías.
2KI.9.10	9	10	And the dogs shall eat Jezebel in the portion of Jezreel, and {there shall be} none to bury {her}. And he opened the door, and fled.	0.0	neutral	"E Jezabel será devorada por cães num terreno em Jezreel, e ninguém a sepultará' "". Então ele abriu a porta e saiu correndo."
2KI.9.11	9	11	Then Jehu came forth to the servants of his lord: and {one} said unto him, {Is} all well? wherefore came this mad {fellow} to thee? And he said unto them, Ye know the man, and his communication.	-0.625	negative	"Quando Jeú voltou para junto dos outros oficiais do rei, um deles lhe perguntou: ""Está tudo bem? O que esse louco queria com você? "" Jeú respondeu: ""Vocês conhecem essa gente e as coisas que dizem""."
2KI.9.12	9	12	And they said, {It is} false; tell us now. And he said, Thus and thus spake he to me, saying, Thus saith the LORD, I have anointed thee king over Israel.	-0.4	negative	"Mas insistiram: ""Não nos engane! Conte-nos o que ele disse"". Então Jeú contou: ""Ele me disse o seguinte: 'Assim diz o Senhor: Eu o estou ungindo rei sobre Israel' ""."
2KI.9.13	9	13	Then they hasted, and took every man his garment, and put {it} under him on the top of the stairs, and blew with trumpets, saying, Jehu is king. {is king: Heb. reigneth}	0.5	positive	"Imediatamente eles pegaram os seus mantos e os estenderam sobre os degraus diante dele. Em seguida tocaram a trombeta e gritaram: ""Jeú é rei! """
2KI.9.14	9	14	So Jehu the son of Jehoshaphat the son of Nimshi conspired against Joram. (Now Joram had kept Ramothgilead, he and all Israel, because of Hazael king of Syria.	0.0	neutral	Então Jeú, filho de Josafá e neto de Ninsi, começou uma conspiração contra o rei Jorão, na época em que este defendeu, com todo Israel, Ramote-Gileade contra Hazael, rei da Síria.
2KI.9.15	9	15	But king Joram was returned to be healed in Jezreel of the wounds which the Syrians had given him, when he fought with Hazael king of Syria.) And Jehu said, If it be your minds, {then} let none go forth {nor} escape out of the city to go to tell {it} in Jezreel. {Joram: Heb. Jehoram but not in verse sixteen} {had given: Heb. smote} {let none...: Heb. let no escaper go, etc}	0.0	neutral	"O rei Jorão tinha voltado a Jezreel para recuperar-se dos ferimentos sofridos na batalha contra Hazael, rei da Síria. Jeú propôs: ""Se vocês me apóiam, não deixem ninguém sair escondido da cidade para nos denunciar em Jezreel""."
2KI.9.16	9	16	So Jehu rode in a chariot, and went to Jezreel; for Joram lay there. And Ahaziah king of Judah was come down to see Joram.	-0.1556	negative	Então ele subiu em seu carro e foi para Jezreel, porque Jorão estava lá se recuperando; e Acazias, rei de Judá, tinha ido visitá-lo.
2KI.9.17	9	17	And there stood a watchman on the tower in Jezreel, and he spied the company of Jehu as he came, and said, I see a company. And Joram said, Take an horseman, and send to meet them, and let him say, {Is it} peace?	0.0	neutral	"Quando a sentinela que estava na torre de vigia de Jezreel percebeu a tropa de Jeú se aproximando, gritou: ""Estou vendo uma tropa! "" Jorão ordenou: ""Chame um cavaleiro e envie-o ao encontro deles para perguntar se eles vêm em paz""."
2KI.9.18	9	18	So there went one on horseback to meet him, and said, Thus saith the king, {Is it} peace? And Jehu said, What hast thou to do with peace? turn thee behind me. And the watchman told, saying, The messenger came to them, but he cometh not again.	-0.4	negative	"O cavaleiro foi ao encontro de Jeú e disse: ""O rei pergunta: 'Vocês vêm em paz? ' "" Jeú respondeu: ""Não me venha falar em paz. Saia da minha frente"". A sentinela relatou: ""O mensageiro chegou a eles, mas não está voltando""."
2KI.9.19	9	19	Then he sent out a second on horseback, which came to them, and said, Thus saith the king, {Is it} peace? And Jehu answered, What hast thou to do with peace? turn thee behind me.	-0.2	negative	"Então o rei enviou um segundo cavaleiro. Quando chegou a eles disse: ""O rei pergunta: 'Vocês vêm em paz? ' "" Jeú respondeu: ""Não me venha falar em paz. Saia da minha frente""."
2KI.9.20	9	20	And the watchman told, saying, He came even unto them, and cometh not again: and the driving {is} like the driving of Jehu the son of Nimshi; for he driveth furiously. {driving: or, marching} {furiously: Heb. in madness}	0.0	neutral	"A sentinela relatou: ""Ele chegou a eles, mas também não está voltando"". E acrescentou: ""O jeito do chefe da tropa guiar o carro é como o de Jeú, neto de Ninsi; dirige como louco""."
2KI.9.21	9	21	And Joram said, Make ready. And his chariot was made ready. And Joram king of Israel and Ahaziah king of Judah went out, each in his chariot, and they went out against Jehu, and met him in the portion of Naboth the Jezreelite. {Make ready: Heb. Bind} {met: Heb. found}	0.2	positive	Jorão ordenou que preparassem seu carro de guerra. Assim que ficou pronto, Jorão, rei de Israel, e Acazias, rei de Judá, saíram, cada um em seu carro, ao encontro de Jeú. Eles o encontraram na propriedade que havia pertencido a Nabote, de Jezreel.
2KI.9.22	9	22	And it came to pass, when Joram saw Jehu, that he said, {Is it} peace, Jehu? And he answered, What peace, so long as the whoredoms of thy mother Jezebel and her witchcrafts {are so} many?	0.225	positive	"Quando Jorão viu Jeú, perguntou: ""Você vem em paz, Jeú? "" Jeú respondeu: ""Como pode haver paz, enquanto continua toda a idolatria e as feitiçarias de sua mãe Jezabel? """
2KI.9.23	9	23	And Joram turned his hands, and fled, and said to Ahaziah, {There is} treachery, O Ahaziah.	0.0	neutral	"Jorão deu meia-volta e fugiu, gritando para Acazias: ""Traição, Acazias! """
2KI.9.24	9	24	And Jehu drew a bow with his full strength, and smote Jehoram between his arms, and the arrow went out at his heart, and he sunk down in his chariot. {drew...: Heb. filled his hand with a bow} {sunk: Heb. bowed}	0.1981	positive	Então Jeú disparou seu arco com toda força e atingiu Jorão nas costas. A flecha atravessou-lhe o coração e ele caiu morto.
2KI.9.25	9	25	Then said {Jehu} to Bidkar his captain, Take up, {and} cast him in the portion of the field of Naboth the Jezreelite: for remember how that, when I and thou rode together after Ahab his father, the LORD laid this burden upon him;	0.0	neutral	"Jeú disse a Bidcar, seu oficial: ""Pegue o cadáver e jogue-o nesta propriedade que pertencia a Nabote, de Jezreel. Lembre-se da advertência que o Senhor proferiu contra Acabe, pai dele, quando juntos acompanhávamos sua comitiva. Ele disse:"
2KI.9.26	9	26	Surely I have seen yesterday the blood of Naboth, and the blood of his sons, saith the LORD; and I will requite thee in this plat, saith the LORD. Now therefore take {and} cast him into the plat {of ground}, according to the word of the LORD. {blood: Heb. bloods} {plat: or, portion}	0.5	positive	"'Ontem, vi o sangue de Nabote e o sangue dos seus filhos, declara o Senhor, e com certeza farei você pagar por isso nesta mesma propriedade, declara o Senhor'. Agora, então, pegue o cadáver e jogue-o nesta propriedade, conforme a palavra do Senhor""."
2KI.9.27	9	27	But when Ahaziah the king of Judah saw {this}, he fled by the way of the garden house. And Jehu followed after him, and said, Smite him also in the chariot. {And they did so} at the going up to Gur, which {is} by Ibleam. And he fled to Megiddo, and died there.	0.0	neutral	"Vendo isso, Acazias, rei de Judá, fugiu na direção de Bete-Hagã. Mas Jeú o perseguiu, gritando: ""Matem-no também! "" Eles o atingiram em seu carro de guerra na subida para Gur, perto de Ibleã, mas ele conseguiu refugiar-se em Megido, onde morreu."
2KI.9.28	9	28	And his servants carried him in a chariot to Jerusalem, and buried him in his sepulchre with his fathers in the city of David.	0.0	neutral	Seus oficiais o levaram até Jerusalém e o sepultaram com seus antepassados em seu túmulo, na cidade de Davi.
2KI.9.29	9	29	And in the eleventh year of Joram the son of Ahab began Ahaziah to reign over Judah.	0.0	neutral	Acazias havia se tornado rei de Judá no décimo primeiro ano de Jorão, filho de Acabe.
2KI.9.30	9	30	And when Jehu was come to Jezreel, Jezebel heard {of it}; and she painted her face, and tired her head, and looked out at a window. {painted...: Heb. put her eyes in painting}	-0.4	negative	Em seguida Jeú entrou em Jezreel. Ao saber disso, Jezabel pintou os olhos, arrumou o cabelo e ficou olhando de uma janela do palácio.
2KI.9.31	9	31	And as Jehu entered in at the gate, she said, {Had} Zimri peace, who slew his master?	0.0	neutral	"Quando Jeú passou pelo portão, ela gritou: ""Como vai, Zinri, assassino do seu senhor? """
2KI.9.32	9	32	And he lifted up his face to the window, and said, Who {is} on my side? who? And there looked out to him two {or} three eunuchs. {eunuchs: or, chamberlains}	0.0	neutral	"Ele ergueu os olhos para a janela e gritou: ""Quem de vocês está do meu lado? "" Dois ou três funcionários olharam para ele."
2KI.9.33	9	33	And he said, Throw her down. So they threw her down: and {some} of her blood was sprinkled on the wall, and on the horses: and he trode her under foot.	-0.1556	negative	"Então Jeú ordenou: ""Joguem essa mulher para baixo! "" Eles a jogaram e o sangue dela espirrou na parede e nos cavalos, e Jeú a atropelou."
2KI.9.34	9	34	And when he was come in, he did eat and drink, and said, Go, see now this cursed {woman}, and bury her: for she {is} a king's daughter.	0.0	neutral	"Jeú entrou, comeu, bebeu e ordenou: ""Peguem aquela maldita e sepultem-na, afinal era filha de rei""."
2KI.9.35	9	35	And they went to bury her: but they found no more of her than the skull, and the feet, and the palms of {her} hands.	-0.25	negative	Mas, quando foram sepultá-la, só encontraram o crânio, os pés e as mãos.
2KI.9.36	9	36	Wherefore they came again, and told him. And he said, This {is} the word of the LORD, which he spake by his servant Elijah the Tishbite, saying, In the portion of Jezreel shall dogs eat the flesh of Jezebel: {by: Heb. by the hand of}	-0.75	negative	"Então voltaram e contaram isso a Jeú, que disse: ""Cumpriu-se a palavra do Senhor, anunciada por meio do seu servo Elias, o tesbita: Num terreno em Jezreel cães devorarão a carne de Jezabel,"
2KI.9.37	9	37	And the carcase of Jezebel shall be as dung upon the face of the field in the portion of Jezreel; {so} that they shall not say, This {is} Jezebel.	0.0	neutral	"os seus restos mortais serão espalhados num terreno em Jezreel, como esterco no campo, de modo que ninguém será capaz de dizer: 'Esta é Jezabel' ""."
2KI.10.1	10	1	And Ahab had seventy sons in Samaria. And Jehu wrote letters, and sent to Samaria, unto the rulers of Jezreel, to the elders, and to them that brought up Ahab's {children}, saying, {them...: Heb. nourishers}	0.0	neutral	Ora, viviam em Samaria setenta descendentes de Acabe. Jeú escreveu uma carta e a enviou a Samaria, aos líderes da cidade, às autoridades e aos tutores dos descendentes de Acabe. A carta dizia:
2KI.10.2	10	2	Now as soon as this letter cometh to you, seeing your master's sons {are} with you, and {there are} with you chariots and horses, a fenced city also, and armour;	0.0	neutral	"""Assim que receberem esta carta, vocês que cuidam dos filhos do rei, e que têm carros de guerra e cavalos, uma cidade fortificada e armas,"
2KI.10.3	10	3	Look even out the best and meetest of your master's sons, and set {him} on his father's throne, and fight for your master's house.	1.0	positive	"escolham o melhor e o mais capaz dos filhos do rei e coloquem-no no trono de seu pai. E lutem pela dinastia de seu senhor""."
2KI.10.4	10	4	But they were exceedingly afraid, and said, Behold, two kings stood not before him: how then shall we stand?	-0.6	negative	"Eles, porém, estavam aterrorizados e disseram: ""Se dois reis não puderam enfrentá-lo, como poderemos nós? """
2KI.10.5	10	5	And he that {was} over the house, and he that {was} over the city, the elders also, and the bringers up {of the children}, sent to Jehu, saying, We {are} thy servants, and will do all that thou shalt bid us; we will not make any king: do thou {that which is} good in thine eyes.	0.7	positive	"Por isso o administrador do palácio, o governador da cidade, as autoridades e os tutores enviaram esta mensagem a Jeú: ""Somos teus servos e faremos tudo o que exigires de nós. Não proclamaremos ninguém como rei. Faze o que achares melhor""."
2KI.10.6	10	6	Then he wrote a letter the second time to them, saying, If ye {be} mine, and {if} ye will hearken unto my voice, take ye the heads of the men your master's sons, and come to me to Jezreel by to morrow this time. Now the king's sons, {being} seventy persons, {were} with the great men of the city, which brought them up. {mine: Heb. for me}	0.4	positive	"Então Jeú escreveu-lhes uma segunda carta que dizia: ""Se vocês estão do meu lado e estão dispostos a obedecer-me, tragam-me as cabeças dos descendentes de seu senhor a Jezreel, amanhã a esta hora"". Os setenta descendentes de Acabe estavam sendo criados pelas autoridades da cidade."
2KI.10.7	10	7	And it came to pass, when the letter came to them, that they took the king's sons, and slew seventy persons, and put their heads in baskets, and sent him {them} to Jezreel.	0.0	neutral	Logo que receberam a carta, pegaram todos os setenta, os decapitaram, colocaram as cabeças em cestos e as enviaram a Jeú, em Jezreel.
2KI.10.8	10	8	And there came a messenger, and told him, saying, They have brought the heads of the king's sons. And he said, Lay ye them in two heaps at the entering in of the gate until the morning.	0.0	neutral	"Ao ser informado de que tinham trazido as cabeças, Jeú ordenou: ""Façam com elas dois montes junto à porta da cidade, para que fiquem expostas lá até amanhã""."
2KI.10.9	10	9	And it came to pass in the morning, that he went out, and stood, and said to all the people, Ye {be} righteous: behold, I conspired against my master, and slew him: but who slew all these?	0.0	neutral	"Na manhã seguinte Jeú saiu e, diante de todo o povo, declarou: ""Vocês são inocentes! Fui eu que conspirei contra meu senhor e o matei, mas quem matou todos estes?"
2KI.10.10	10	10	Know now that there shall fall unto the earth nothing of the word of the LORD, which the LORD spake concerning the house of Ahab: for the LORD hath done {that} which he spake by his servant Elijah. {by: Heb. by the hand of}	0.0	neutral	"Saibam, então, que não deixará de se cumprir uma só palavra que o Senhor falou contra a família de Acabe. O Senhor fez o que prometeu por meio de seu servo Elias""."
2KI.10.11	10	11	So Jehu slew all that remained of the house of Ahab in Jezreel, and all his great men, and his kinsfolks, and his priests, until he left him none remaining. {kinsfolks: or, acquaintance}	0.4	positive	Então Jeú matou todos os que restavam da família de Acabe em Jezreel, bem como todos os seus aliados influentes, os seus amigos pessoais e os seus sacerdotes, não lhe deixando sobrevivente algum.
2KI.10.12	10	12	And he arose and departed, and came to Samaria. {And} as he {was} at the shearing house in the way, {shearing...: Heb. house of shepherds binding sheep}	0.0	neutral	Depois Jeú partiu para Samaria. Em Bete-Equede dos Pastores
2KI.10.13	10	13	Jehu met with the brethren of Ahaziah king of Judah, and said, Who {are} ye? And they answered, We {are} the brethren of Ahaziah; and we go down to salute the children of the king and the children of the queen. {met with: Heb. found} {to salute...: Heb. to the peace of, etc}	-0.1556	negative	"encontrou alguns parentes de Acazias, rei de Judá, e perguntou: ""Quem são vocês? "" Eles responderam: ""Somos parentes de Acazias e estamos indo visitar as famílias do rei e da rainha-mãe""."
2KI.10.14	10	14	And he said, Take them alive. And they took them alive, and slew them at the pit of the shearing house, {even} two and forty men; neither left he any of them.	0.0667	neutral	"Então Jeú ordenou aos seus soldados: ""Peguem-nos vivos! "" Então os pegaram vivos e os mataram junto ao poço de Bete-Equede. Eram quarenta e dois homens, e nenhum deles foi deixado vivo."
2KI.10.15	10	15	And when he was departed thence, he lighted on Jehonadab the son of Rechab {coming} to meet him: and he saluted him, and said to him, Is thine heart right, as my heart {is} with thy heart? And Jehonadab answered, It is. If it be, give {me} thine hand. And he gave {him} his hand; and he took him up to him into the chariot. {lighted on: Heb. found} {saluted: Heb. blessed}	0.2857	positive	"Saindo dali, Jeú encontrou Jonadabe, filho de Recabe, que tinha ido falar com ele. Depois de saudá-lo Jeú perguntou: ""Você está de acordo com o que estou fazendo? "" Jonadabe respondeu: ""Estou"". E disse Jeú: ""Então, dê-me a mão"". Jonadabe estendeu-lhe a mão, e Jeú o ajudou a subir no carro"
2KI.10.16	10	16	And he said, Come with me, and see my zeal for the LORD. So they made him ride in his chariot.	0.0	neutral	"e disse-lhe: ""Venha comigo e veja o meu zelo pelo Senhor"". Então ele o levou em seu carro."
2KI.10.17	10	17	And when he came to Samaria, he slew all that remained unto Ahab in Samaria, till he had destroyed him, according to the saying of the LORD, which he spake to Elijah.	0.0	neutral	Quando Jeú chegou a Samaria, matou todos os que restavam da família de Acabe na cidade; ele os exterminou, conforme a palavra que o Senhor tinha dito a Elias.
2KI.10.18	10	18	And Jehu gathered all the people together, and said unto them, Ahab served Baal a little; {but} Jehu shall serve him much.	0.0063	neutral	"Jeú reuniu todo o povo e declarou: ""Acabe não cultuou ao deus Baal o bastante; eu, Jeú, o cultuarei muito mais."
