verse_id	chapter	verse	text_en	polarity_en	label_en	text_pt
2KI.6.1	6	1	And the sons of the prophets said unto Elisha, Behold now, the place where we dwell with thee is too strait for us.	0.0	neutral	"Os discípulos dos profetas disseram a Eliseu: ""Como vês, o lugar onde nos reunimos contigo é pequeno demais para nós."
2KI.6.2	6	2	Let us go, we pray thee, unto Jordan, and take thence every man a beam, and let us make us a place there, where we may dwell. And he answered, Go ye.	0.0	neutral	"Por que não vamos ao rio Jordão? Lá cada um de nós poderá cortar um tronco para construirmos ali um lugar de reuniões"". Eliseu disse: ""Podem ir""."
2KI.6.3	6	3	And one said, Be content, I pray thee, and go with thy servants. And he answered, I will go.	0.0	neutral	"Então um deles perguntou: ""Não gostarias de ir com os teus servos? "" ""Sim"", ele respondeu."
2KI.6.4	6	4	So he went with them. And when they came to Jordan, they cut down wood.	-0.1556	negative	E foi com eles. Foram ao Jordão e começaram a derrubar árvores.
2KI.6.5	6	5	But as one was felling a beam, the axe head fell into the water: and he cried, and said, Alas, master! for it was borrowed. {axe head: Heb. iron}	-0.5	negative	"Quando um deles estava cortando um tronco, o ferro do machado caiu na água. E ele gritou: ""Ah, meu senhor, era emprestado! """
2KI.6.6	6	6	And the man of God said, Where fell it? And he shewed him the place. And he cut down a stick, and cast {it} in thither; and the iron did swim.	-0.1556	negative	"O homem de Deus perguntou: ""Onde caiu? "" Quando ele lhe mostrou o lugar, Eliseu cortou um galho e o jogou ali, fazendo o ferro flutuar,"
2KI.6.7	6	7	Therefore said he, Take {it} up to thee. And he put out his hand, and took it.	0.0	neutral	"e disse: ""Pegue-o"". O homem esticou o braço e o pegou."
2KI.6.8	6	8	Then the king of Syria warred against Israel, and took counsel with his servants, saying, In such and such a place {shall be} my camp. {camp: or, encamping}	0.0	neutral	"Ora, o rei da Síria estava em guerra contra Israel. Depois de deliberar com os seus conselheiros, dizia: ""Montarei o meu acampamento em tal lugar""."
2KI.6.9	6	9	And the man of God sent unto the king of Israel, saying, Beware that thou pass not such a place; for thither the Syrians are come down.	-0.0778	neutral	"Mas o homem de Deus mandava uma mensagem ao rei de Israel: ""Evite passar por tal lugar, pois os arameus estão descendo para lá""."
2KI.6.10	6	10	And the king of Israel sent to the place which the man of God told him and warned him of, and saved himself there, not once nor twice.	0.0	neutral	Assim, o rei de Israel investigava o lugar indicado pelo homem de Deus. Repetidas vezes Eliseu alertou o rei, que tomava as devidas precauções.
2KI.6.11	6	11	Therefore the heart of the king of Syria was sore troubled for this thing; and he called his servants, and said unto them, Will ye not shew me which of us {is} for the king of Israel?	-0.5	negative	"Isto enfureceu o rei da Síria, que, convocando seus conselheiros, lhes perguntou: ""Vocês não me apontarão qual dos nossos está do lado do rei de Israel? """
2KI.6.12	6	12	And one of his servants said, None, my lord, O king: but Elisha, the prophet that {is} in Israel, telleth the king of Israel the words that thou speakest in thy bedchamber. {None: Heb. No}	0.0	neutral	"Respondeu um dos conselheiros: ""Nenhum de nós, majestade. É Eliseu, o profeta que está em Israel, que revela ao rei de Israel até as palavras que tu falas em teu quarto""."
2KI.6.13	6	13	And he said, Go and spy where he {is}, that I may send and fetch him. And it was told him, saying, Behold, {he is} in Dothan.	0.0	neutral	"Ordenou o rei: ""Descubram onde ele está, para que eu mande capturá-lo"". Quando lhe informaram que o profeta estava em Dotã,"
2KI.6.14	6	14	Therefore sent he thither horses, and chariots, and a great host: and they came by night, and compassed the city about. {great: Heb. heavy}	0.4667	positive	ele enviou para lá uma grande tropa com cavalos e carros de guerra. Eles chegaram de noite e cercaram a cidade.
2KI.6.15	6	15	And when the servant of the man of God was risen early, and gone forth, behold, an host compassed the city both with horses and chariots. And his servant said unto him, Alas, my master! how shall we do? {the servant: or, the minister}	-0.2	negative	"O servo do homem de Deus levantou-se bem cedo pela manhã e, quando saía, viu que uma tropa com cavalos e carros de guerra havia cercado a cidade. Então ele exclamou: ""Ah, meu senhor! O que faremos? """
2KI.6.16	6	16	And he answered, Fear not: for they that {be} with us {are} more than they that {be} with them.	0.5	positive	"O profeta respondeu: ""Não tenha medo. Aqueles que estão conosco são mais numerosos do que eles""."
2KI.6.17	6	17	And Elisha prayed, and said, LORD, I pray thee, open his eyes, that he may see. And the LORD opened the eyes of the young man; and he saw: and, behold, the mountain {was} full of horses and chariots of fire round about Elisha.	0.0625	neutral	"E Eliseu orou: ""Senhor, abre os olhos dele para que veja"". Então o Senhor abriu os olhos do rapaz, que olhou e viu as colinas cheias de cavalos e carros de fogo ao redor de Eliseu."
2KI.6.18	6	18	And when they came down to him, Elisha prayed unto the LORD, and said, Smite this people, I pray thee, with blindness. And he smote them with blindness according to the word of Elisha.	-0.1556	negative	"Quando os arameus desceram na direção de Eliseu, ele orou ao Senhor: ""Fere estes homens de cegueira"". Então ele os feriu de cegueira, conforme Eliseu havia pedido."
2KI.6.19	6	19	And Elisha said unto them, This {is} not the way, neither {is} this the city: follow me, and I will bring you to the man whom ye seek. But he led them to Samaria. {follow...: Heb. come ye after me}	0.0	neutral	"Eliseu lhes disse: ""Este não é o caminho nem esta é a cidade que procuram. Sigam-me, e eu os levarei ao homem que vocês estão procurando"". E os guiou até a cidade de Samaria."
2KI.6.20	6	20	And it came to pass, when they were come into Samaria, that Elisha said, LORD, open the eyes of these {men}, that they may see. And the LORD opened their eyes, and they saw; and, behold, {they were} in the midst of Samaria.	0.0	neutral	"Assim que entraram na cidade, Eliseu disse: ""Senhor, abre os olhos destes homens para que possam ver"". Então o Senhor abriu-lhes os olhos, e eles viram que estavam dentro de Samaria."
2KI.6.21	6	21	And the king of Israel said unto Elisha, when he saw them, My father, shall I smite {them}? shall I smite {them}?	0.0	neutral	"Quando o rei de Israel os viu, perguntou a Eliseu: ""Devo matá-los, meu pai? Devo matá-los? """
2KI.6.22	6	22	And he answered, Thou shalt not smite {them}: wouldest thou smite those whom thou hast taken captive with thy sword and with thy bow? set bread and water before them, that they may eat and drink, and go to their master.	0.2	positive	"Ele respondeu: ""Não! Costumas matar prisioneiros que capturas com a tua espada e o teu arco? Manda-lhes servir comida e bebida e deixa que voltem ao seu senhor""."
2KI.6.23	6	23	And he prepared great provision for them: and when they had eaten and drunk, he sent them away, and they went to their master. So the bands of Syria came no more into the land of Israel.	0.0167	neutral	Então preparou-lhes um grande banquete e, terminando eles de comer e beber, mandou-os de volta para o seu senhor. Assim, as tropas da Síria pararam de invadir o território de Israel.
2KI.6.24	6	24	And it came to pass after this, that Benhadad king of Syria gathered all his host, and went up, and besieged Samaria.	0.0	neutral	Algum tempo depois, Ben-Hadade, rei da Síria, mobilizou todo o seu exército e cercou Samaria.
2KI.6.25	6	25	And there was a great famine in Samaria: and, behold, they besieged it, until an ass's head was {sold} for fourscore {pieces} of silver, and the fourth part of a cab of dove's dung for five {pieces} of silver.	0.4	positive	O cerco durou tanto e causou tamanha fome que uma cabeça de jumento chegou a valer oitenta peças de prata, e uma caneca de esterco de pomba, cinco peças de prata.
2KI.6.26	6	26	And as the king of Israel was passing by upon the wall, there cried a woman unto him, saying, Help, my lord, O king.	0.0	neutral	"Um dia, quando o rei de Israel inspecionava os muros da cidade, uma mulher gritou para ele: ""Socorro, majestade! """
2KI.6.27	6	27	And he said, If the LORD do not help thee, whence shall I help thee? out of the barnfloor, or out of the winepress? {If...: or, Let not the LORD save thee}	0.0	neutral	"O rei respondeu: ""Se o Senhor não socorrê-la, como poderei ajudá-la? Acaso há trigo na eira ou vinho no lagar? """
2KI.6.28	6	28	And the king said unto her, What aileth thee? And she answered, This woman said unto me, Give thy son, that we may eat him to day, and we will eat my son to morrow.	0.0	neutral	"Contudo ele perguntou: ""Qual é o problema? "" Ela respondeu: ""Esta mulher me disse: 'Vamos comer o seu filho hoje, e amanhã comeremos o meu'."
2KI.6.29	6	29	So we boiled my son, and did eat him: and I said unto her on the next day, Give thy son, that we may eat him: and she hath hid her son. {next: Heb. other}	-0.0417	neutral	"Então cozinhamos o meu filho e o comemos. No dia seguinte eu disse a ela que era a vez de comermos o seu filho, mas ela o havia escondido""."
2KI.6.30	6	30	And it came to pass, when the king heard the words of the woman, that he rent his clothes; and he passed by upon the wall, and the people looked, and, behold, {he had} sackcloth within upon his flesh.	0.0	neutral	Quando o rei ouviu as palavras da mulher, rasgou as próprias vestes. Como estava sobre os muros, o povo viu que ele estava usando pano de saco por baixo, junto ao corpo.
2KI.6.31	6	31	Then he said, God do so and more also to me, if the head of Elisha the son of Shaphat shall stand on him this day.	0.5	positive	"E ele disse: ""Deus me castigue com todo rigor, se a cabeça de Eliseu, filho de Safate, continuar hoje sobre seus ombros! """
2KI.6.32	6	32	But Elisha sat in his house, and the elders sat with him; and {the king} sent a man from before him: but ere the messenger came to him, he said to the elders, See ye how this son of a murderer hath sent to take away mine head? look, when the messenger cometh, shut the door, and hold him fast at the door: {is} not the sound of his master's feet behind him?	-0.1375	negative	"Ora, Eliseu estava sentado em sua casa, reunido com as autoridades de Israel. O rei havia mandado um mensageiro à sua frente, mas, antes que ele chegasse, Eliseu disse às autoridades: ""Aquele assassino mandou alguém para cortar-me a cabeça? Quando o mensageiro chegar, fechem a porta e mantenham-na trancada. Vocês não estão ouvindo os passos do seu senhor que vem atrás dele? """
2KI.6.33	6	33	And while he yet talked with them, behold, the messenger came down unto him: and he said, Behold, this evil {is} of the LORD; what should I wait for the LORD any longer?	-0.5778	negative	"Enquanto ainda lhes falava, o mensageiro chegou. Na mesma hora o rei disse: ""Esta desgraça vem do Senhor. Por que devo ainda ter esperança no Senhor? """
2KI.7.1	7	1	Then Elisha said, Hear ye the word of the LORD; Thus saith the LORD, To morrow about this time {shall} a measure of fine flour {be sold} for a shekel, and two measures of barley for a shekel, in the gate of Samaria.	0.4167	positive	"Eliseu respondeu: ""Ouçam a palavra do Senhor! Assim diz o Senhor: Amanhã, por volta desta hora, na porta de Samaria, tanto uma medida de farinha como duas medidas de cevada serão vendidas por uma peça de prata""."
2KI.7.2	7	2	Then a lord on whose hand the king leaned answered the man of God, and said, Behold, {if} the LORD would make windows in heaven, might this thing be? And he said, Behold, thou shalt see {it} with thine eyes, but shalt not eat thereof. {a lord...: Heb. a lord which belonged to the king leaning upon his hand}	0.0	neutral	"O oficial, em cujo braço o rei estava se apoiando, disse ao homem de Deus: ""Ainda que o Senhor abrisse as comportas do céu, será que isso poderia acontecer? "" Mas Eliseu advertiu: ""Você o verá com os próprios olhos, mas não comerá coisa alguma! """
2KI.7.3	7	3	And there were four leprous men at the entering in of the gate: and they said one to another, Why sit we here until we die?	0.0	neutral	"Havia quatro leprosos junto à porta da cidade. Eles disseram uns aos outros: ""Por que ficar aqui esperando a morte?"
2KI.7.4	7	4	If we say, We will enter into the city, then the famine {is} in the city, and we shall die there: and if we sit still here, we die also. Now therefore come, and let us fall unto the host of the Syrians: if they save us alive, we shall live; and if they kill us, we shall but die.	0.1182	positive	"Se resolvermos entrar na cidade, morreremos de fome, mas se ficarmos aqui, também morreremos. Vamos, pois, ao acampamento dos arameus para nos render. Se eles nos pouparem, viveremos; se nos matarem, morreremos""."
2KI.7.5	7	5	And they rose up in the twilight, to go unto the camp of the Syrians: and when they were come to the uttermost part of the camp of Syria, behold, {there was} no man there.	0.6	positive	Ao anoitecer, eles foram ao acampamento dos arameus. Quando chegaram às imediações do acampamento, não havia ninguém ali,
2KI.7.6	7	6	For the Lord had made the host of the Syrians to hear a noise of chariots, and a noise of horses, {even} the noise of a great host: and they said one to another, Lo, the king of Israel hath hired against us the kings of the Hittites, and the kings of the Egyptians, to come upon us.	0.8	positive	"pois o Senhor tinha feito os arameus ouvirem o ruído de um grande exército com cavalos e carros de guerra, de modo que disseram uns aos outros: ""Ouçam, o rei de Israel contratou os reis dos hititas e dos egípcios para nos atacar! """
2KI.7.7	7	7	Wherefore they arose and fled in the twilight, and left their tents, and their horses, and their asses, even the camp as it {was}, and fled for their life.	0.0	neutral	Então, para salvar suas vidas, fugiram ao anoitecer, abandonando tendas, cavalos e jumentos, deixando o acampamento como estava.
2KI.7.8	7	8	And when these lepers came to the uttermost part of the camp, they went into one tent, and did eat and drink, and carried thence silver, and gold, and raiment, and went and hid {it}; and came again, and entered into another tent, and carried thence {also}, and went and hid {it}.	0.0	neutral	Tendo chegado às imediações do acampamento os leprosos entraram numa das tendas. Comeram e beberam; pegaram prata, ouro e roupas e saíram para esconder tudo. Depois voltaram e entraram noutra tenda, pegaram o que quiseram e esconderam isso também.
2KI.7.9	7	9	Then they said one to another, We do not well: this day {is} a day of good tidings, and we hold our peace: if we tarry till the morning light, some mischief will come upon us: now therefore come, that we may go and tell the king's household. {some...: Heb. we shall find punishment}	0.55	positive	"Então disseram uns aos outros: ""Não estamos agindo certo. Este é um dia de boas notícias, e não podemos ficar calados. Se esperarmos até o amanhecer, seremos castigados. Vamos imediatamente contar tudo no palácio do rei""."
2KI.7.10	7	10	So they came and called unto the porter of the city: and they told them, saying, We came to the camp of the Syrians, and, behold, {there was} no man there, neither voice of man, but horses tied, and asses tied, and the tents as they {were}.	0.0	neutral	"Então foram e chamaram as sentinelas da porta da cidade e lhes contaram: ""Entramos no acampamento arameu, e não vimos nem ouvimos ninguém. Havia apenas cavalos e jumentos amarrados, e tendas abandonadas""."
2KI.7.11	7	11	And he called the porters; and they told {it} to the king's house within.	0.0	neutral	As sentinelas da porta proclamaram a notícia, e ela foi anunciada dentro do palácio.
2KI.7.12	7	12	And the king arose in the night, and said unto his servants, I will now shew you what the Syrians have done to us. They know that we {be} hungry; therefore are they gone out of the camp to hide themselves in the field, saying, When they come out of the city, we shall catch them alive, and get into the city.	0.1	neutral	"O rei se levantou de noite e disse aos seus conselheiros: ""Eu lhes explicarei o que os arameus planejaram. Como sabem que estamos passando fome, deixaram o acampamento e se esconderam no campo, pensando: 'Com certeza eles sairão, e então os pegaremos vivos e entraremos na cidade' ""."
2KI.7.13	7	13	And one of his servants answered and said, Let {some} take, I pray thee, five of the horses that remain, which are left in the city, (behold, they {are} as all the multitude of Israel that are left in it: behold, {I say}, they {are} even as all the multitude of the Israelites that are consumed:) and let us send and see. {in the city: Heb. in it}	0.1667	positive	"Um de seus conselheiros respondeu: ""Manda que alguns homens apanhem cinco dos cavalos que restam na cidade. O destino desses homens será o mesmo de todos os israelitas que ficarem, sim, como toda esta multidão condenada. Por isso vamos enviá-los para descobrir o que aconteceu""."
2KI.7.14	7	14	They took therefore two chariot horses; and the king sent after the host of the Syrians, saying, Go and see.	0.0	neutral	"Assim que prepararam dois carros de guerra com seus cavalos, o rei os enviou atrás do exército arameu, ordenando aos condutores: ""Vão e descubram o que aconteceu""."
2KI.7.15	7	15	And they went after them unto Jordan: and, lo, all the way {was} full of garments and vessels, which the Syrians had cast away in their haste. And the messengers returned, and told the king.	0.35	positive	Eles seguiram as pegadas do exército até o Jordão e encontraram todo o caminho cheio de roupas e armas que os arameus haviam deixado para trás enquanto fugiam. Os mensageiros voltaram e relataram tudo ao rei.
2KI.7.16	7	16	And the people went out, and spoiled the tents of the Syrians. So a measure of fine flour was {sold} for a shekel, and two measures of barley for a shekel, according to the word of the LORD.	0.4167	positive	Então o povo saiu e saqueou o acampamento dos arameus. Assim, tanto uma medida de farinha como duas medidas de cevada passaram a ser vendidas por uma peça de prata, conforme o Senhor tinha dito.
2KI.7.17	7	17	And the king appointed the lord on whose hand he leaned to have the charge of the gate: and the people trode upon him in the gate, and he died, as the man of God had said, who spake when the king came down to him.	-0.1556	negative	Ora, o rei havia posto o oficial em cujo braço tinha se apoiado como encarregado da porta da cidade, mas quando o povo saiu, atropelou-o junto à porta, e ele morreu, conforme o homem de Deus havia predito quando o rei foi à sua casa.
2KI.7.18	7	18	And it came to pass as the man of God had spoken to the king, saying, Two measures of barley for a shekel, and a measure of fine flour for a shekel, shall be to morrow about this time in the gate of Samaria:	0.4167	positive	"Aconteceu conforme o homem de Deus dissera ao rei: ""Amanhã, por volta desta hora, na porta de Samaria, tanto uma medida de farinha como duas medidas de cevada serão vendidas por uma peça de prata""."
2KI.7.19	7	19	And that lord answered the man of God, and said, Now, behold, {if} the LORD should make windows in heaven, might such a thing be? And he said, Behold, thou shalt see it with thine eyes, but shalt not eat thereof.	0.0	neutral	"O oficial tinha contestado o homem de Deus perguntando: ""Ainda que o Senhor abrisse as comportas do céu, será que isso poderia acontecer? "" O homem de Deus havia respondido: ""Você verá com os próprios olhos, mas não comerá coisa alguma! """
2KI.7.20	7	20	And so it fell out unto him: for the people trode upon him in the gate, and he died.	0.0	neutral	E foi exatamente isso que lhe aconteceu, pois o povo o pisoteou junto à porta da cidade, e ele morreu.
2KI.8.1	8	1	Then spake Elisha unto the woman, whose son he had restored to life, saying, Arise, and go thou and thine household, and sojourn wheresoever thou canst sojourn: for the LORD hath called for a famine; and it shall also come upon the land seven years.	0.0	neutral	"Eliseu tinha prevenido a mãe do menino que ele havia ressuscitado: ""Saia do país com sua família e vá morar onde puder, pois o Senhor determinou uma fome nesta terra, que durará sete anos""."
2KI.8.2	8	2	And the woman arose, and did after the saying of the man of God: and she went with her household, and sojourned in the land of the Philistines seven years.	0.0	neutral	A mulher seguiu o conselho do homem de Deus, partiu com sua família e passou sete anos na terra dos filisteus.
2KI.8.3	8	3	And it came to pass at the seven years' end, that the woman returned out of the land of the Philistines: and she went forth to cry unto the king for her house and for her land.	0.0	neutral	Ao final dos sete anos ela voltou a Israel e foi fazer um apelo ao rei para readquirir sua casa e sua propriedade.
2KI.8.4	8	4	And the king talked with Gehazi the servant of the man of God, saying, Tell me, I pray thee, all the great things that Elisha hath done.	0.8	positive	"O rei estava conversando com Geazi, servo do homem de Deus, e disse: ""Conte-me todos os prodígios que Eliseu tem feito""."
2KI.8.5	8	5	And it came to pass, as he was telling the king how he had restored a dead body to life, that, behold, the woman, whose son he had restored to life, cried to the king for her house and for her land. And Gehazi said, My lord, O king, this {is} the woman, and this {is} her son, whom Elisha restored to life.	-0.2	negative	"Enquanto Geazi contava ao rei como Eliseu havia ressuscitado o menino, a própria mãe do menino que Eliseu tinha ressuscitado, chegou para apresentar sua petição ao rei para readquirir sua casa e sua propriedade. Geazi exclamou: ""Esta é a mulher, ó rei, meu senhor, e este é o filho dela, a quem Eliseu ressuscitou""."
2KI.8.6	8	6	And when the king asked the woman, she told him. So the king appointed unto her a certain officer, saying, Restore all that {was} hers, and all the fruits of the field since the day that she left the land, even until now. {officer: or, eunuch}	0.1071	positive	"O rei pediu que ela contasse o ocorrido, e ela confirmou os fatos. Então ele designou um funcionário para cuidar do caso dela e lhe ordenou: ""Devolva tudo o que lhe pertencia, inclusive toda a renda das colheitas, desde que ela saiu do país até hoje""."
2KI.8.7	8	7	And Elisha came to Damascus; and Benhadad the king of Syria was sick; and it was told him, saying, The man of God is come hither.	-0.7143	negative	"Certa ocasião, Eliseu foi a Damasco. Ben-Hadade, rei da Síria, estava doente. Quando disseram ao rei: ""O homem de Deus está na cidade"","
2KI.8.8	8	8	And the king said unto Hazael, Take a present in thine hand, and go, meet the man of God, and enquire of the LORD by him, saying, Shall I recover of this disease?	0.0	neutral	"ele ordenou a Hazael: ""Vá encontrar-se com o homem de Deus e leve-lhe um presente. Consulte o Senhor por meio dele: pergunte-lhe se vou me recuperar desta doença""."
2KI.8.9	8	9	So Hazael went to meet him, and took a present with him, even of every good thing of Damascus, forty camels' burden, and came and stood before him, and said, Thy son Benhadad king of Syria hath sent me to thee, saying, Shall I recover of this disease? {with...: Heb. in his hand}	0.35	positive	"Hazael foi encontrar-se com Eliseu, levando consigo de tudo o que havia de melhor em Damasco, um presente carregado por quarenta camelos. Ao chegar diante dele Hazael disse: ""Teu filho Ben-Hadade, rei da Síria, enviou-me para perguntar se ele vai recuperar-se de sua doença""."
2KI.8.10	8	10	And Elisha said unto him, Go, say unto him, Thou mayest certainly recover: howbeit the LORD hath shewed me that he shall surely die.	0.3571	positive	"Eliseu respondeu: ""Vá e diga-lhe: 'Com certeza te recuperarás', no entanto o Senhor me revelou que de fato ele vai morrer""."
2KI.8.11	8	11	And he settled his countenance stedfastly, until he was ashamed: and the man of God wept. {stedfastly: Heb. and set it}	0.0	neutral	Eliseu ficou olhando fixamente para Hazael até deixá-lo constrangido. Então o homem de Deus começou a chorar.
2KI.8.12	8	12	And Hazael said, Why weepeth my lord? And he answered, Because I know the evil that thou wilt do unto the children of Israel: their strong holds wilt thou set on fire, and their young men wilt thou slay with the sword, and wilt dash their children, and rip up their women with child.	-0.1556	negative	"E perguntou Hazael: ""Por que meu senhor está chorando? "" Ele respondeu: ""Porque sei das coisas terríveis que você fará aos israelitas. Você incendiará suas fortalezas, matará seus jovens à espada, esmagará as crianças e rasgará o ventre de suas mulheres grávidas""."
2KI.8.13	8	13	And Hazael said, But what, {is} thy servant a dog, that he should do this great thing? And Elisha answered, The LORD hath shewed me that thou {shalt be} king over Syria.	0.8	positive	"Hazael disse: ""Como poderia teu servo, que não passa de um cão, realizar algo assim? "" Respondeu Eliseu: ""O Senhor me mostrou que você se tornará rei da Síria""."
2KI.8.14	8	14	So he departed from Elisha, and came to his master; who said to him, What said Elisha to thee? And he answered, He told me {that} thou shouldest surely recover.	0.5	positive	"Então Hazael saiu dali e voltou para seu senhor. Quando Ben-Hadade perguntou: ""O que Eliseu lhe disse? "", Hazael respondeu: ""Ele me falou que certamente te recuperarás""."
