verse_id	chapter	verse	text_en	polarity_en	label_en	text_pt
ISA.52.1	52	1	Awake, awake; put on thy strength, O Zion; put on thy beautiful garments, O Jerusalem, the holy city: for henceforth there shall no more come into thee the uncircumcised and the unclean.	0.3	positive	Desperte! Desperte!, ó Sião, vista-se de força. Vista suas roupas de esplendor, ó Jerusalém, cidade santa. Os incircuncisos e os impuros não tornarão a entrar em você.
ISA.52.2	52	2	Shake thyself from the dust; arise, {and} sit down, O Jerusalem: loose thyself from the bands of thy neck, O captive daughter of Zion.	-0.0108	neutral	Sacuda para longe a sua poeira; levante-se, sente-se entronizada, ó Jerusalém. Livre-se das correntes em seu pescoço, ó cidade cativa de Sião.
ISA.52.3	52	3	For thus saith the LORD, Ye have sold yourselves for nought; and ye shall be redeemed without money.	0.0	neutral	"Pois assim diz o Senhor: ""Vocês foram vendidos por nada, e sem dinheiro vocês serão resgatados""."
ISA.52.4	52	4	For thus saith the Lord GOD, My people went down aforetime into Egypt to sojourn there; and the Assyrian oppressed them without cause.	-0.1556	negative	"Pois assim diz o Soberano Senhor: ""No início o meu povo desceu para morar no Egito; ultimamente a Assíria os tem oprimido."
ISA.52.5	52	5	Now therefore, what have I here, saith the LORD, that my people is taken away for nought? they that rule over them make them to howl, saith the LORD; and my name continually every day {is} blasphemed.	0.0	neutral	"""E agora o que tenho aqui? "", pergunta o Senhor. ""Pois o meu povo foi levado por nada, e aqueles que os dominam zombam"", diz o Senhor. ""E o dia inteiro o meu nome é constantemente blasfemado."
ISA.52.6	52	6	Therefore my people shall know my name: therefore {they shall know} in that day that I {am} he that doth speak: behold, {it is} I.	0.0	neutral	"Por isso o meu povo conhecerá o meu nome; naquele dia eles saberão que sou eu que o previ. Sim, sou eu. """
ISA.52.7	52	7	How beautiful upon the mountains are the feet of him that bringeth good tidings, that publisheth peace; that bringeth good tidings of good, that publisheth salvation; that saith unto Zion, Thy God reigneth!	0.7812	positive	"Como são belos nos montes os pés daqueles que anunciam boas novas, que proclamam a paz, que trazem boas notícias, que proclamam salvação, que dizem a Sião: ""O seu Deus reina! """
ISA.52.8	52	8	Thy watchmen shall lift up the voice; with the voice together shall they sing: for they shall see eye to eye, when the LORD shall bring again Zion.	0.0	neutral	Escutem! Suas sentinelas erguem a voz; juntas gritam de alegria. Quando o Senhor voltar a Sião, elas o verão com os próprios olhos.
ISA.52.9	52	9	Break forth into joy, sing together, ye waste places of Jerusalem: for the LORD hath comforted his people, he hath redeemed Jerusalem.	0.3	positive	Cantem juntamente de alegria, vocês, ruínas de Jerusalém, pois o Senhor consolou o seu povo, ele resgatou Jerusalém.
ISA.52.10	52	10	The LORD hath made bare his holy arm in the eyes of all the nations; and all the ends of the earth shall see the salvation of our God.	0.05	neutral	O Senhor desnudará seu santo braço à vista de todas as nações, e todos os confins da terra verão a salvação de nosso Deus.
ISA.52.11	52	11	Depart ye, depart ye, go ye out from thence, touch no unclean {thing}; go ye out of the midst of her; be ye clean, that bear the vessels of the LORD.	0.3667	positive	Afastem-se, afastem-se, saiam daqui! Não toquem em coisas impuras! Saiam dela e sejam puros, vocês, que transportam os utensílios do Senhor.
ISA.52.12	52	12	For ye shall not go out with haste, nor go by flight: for the LORD will go before you; and the God of Israel {will be} your rereward. {be...: Heb. gather you up}	0.0	neutral	Mas vocês não partirão apressadamente, nem sairão em fuga; pois o Senhor irá à frente de vocês, o Deus de Israel será a sua retaguarda.
ISA.52.13	52	13	Behold, my servant shall deal prudently, he shall be exalted and extolled, and be very high. {deal...: or, prosper}	0.208	positive	Vejam, o meu servo agirá com sabedoria; será levantado e erguido e muitíssimo exaltado.
ISA.52.14	52	14	As many were astonied at thee; his visage was so marred more than any man, and his form more than the sons of men:	0.5	positive	Assim como houve muitos que ficaram pasmados diante dele; sua aparência estava tão desfigurada, que ele se tornou irreconhecível como homem; não parecia um ser humano;
ISA.52.15	52	15	So shall he sprinkle many nations; the kings shall shut their mouths at him: for {that} which had not been told them shall they see; and {that} which they had not heard shall they consider.	0.5	positive	de igual modo ele aspergirá muitas nações, e reis calarão a boca por causa dele. Pois aquilo que não lhes foi dito verão, e o que não ouviram compreenderão.
ISA.53.1	53	1	Who hath believed our report? and to whom is the arm of the LORD revealed? {report: or, doctrine?: Heb. hearing?}	0.0	neutral	Quem creu em nossa mensagem e a quem foi revelado o braço do Senhor?
ISA.53.2	53	2	For he shall grow up before him as a tender plant, and as a root out of a dry ground: he hath no form nor comeliness; and when we shall see him, {there is} no beauty that we should desire him.	-0.0667	neutral	Ele cresceu diante dele como um broto tenro, e como uma raiz saída de uma terra seca. Ele não tinha qualquer beleza ou majestade que nos atraísse, nada em sua aparência para que o desejássemos.
ISA.53.3	53	3	He is despised and rejected of men; a man of sorrows, and acquainted with grief: and we hid as it were {our} faces from him; he was despised, and we esteemed him not. {we hid...: or, he hid as it were his face from us: Heb. as an hiding of faces from him, or, from us}	-0.15	negative	Foi desprezado e rejeitado pelos homens, um homem de tristeza e familiarizado com o sofrimento. Como alguém de quem os homens escondem o rosto, foi desprezado, e nós não o tínhamos em estima.
ISA.53.4	53	4	Surely he hath borne our griefs, and carried our sorrows: yet we did esteem him stricken, smitten of God, and afflicted.	0.5	positive	Certamente ele tomou sobre si as nossas enfermidades e sobre si levou as nossas doenças, contudo nós o consideramos castigado por Deus, por ele atingido e afligido.
ISA.53.5	53	5	But he {was} wounded for our transgressions, {he was} bruised for our iniquities: the chastisement of our peace {was} upon him; and with his stripes we are healed. {wounded: or, tormented} {stripes: Heb. bruise}	0.0	neutral	Mas ele foi transpassado por causa das nossas transgressões, foi esmagado por causa de nossas iniqüidades; o castigo que nos trouxe paz estava sobre ele, e pelas suas feridas fomos curados.
ISA.53.6	53	6	All we like sheep have gone astray; we have turned every one to his own way; and the LORD hath laid on him the iniquity of us all. {laid...: Heb. made the iniquity of us all to meet on him}	0.6	positive	Todos nós, tal qual ovelhas, nos desviamos, cada um de nós se voltou para o seu próprio caminho; e o Senhor fez cair sobre ele a iniqüidade de todos nós.
ISA.53.7	53	7	He was oppressed, and he was afflicted, yet he opened not his mouth: he is brought as a lamb to the slaughter, and as a sheep before her shearers is dumb, so he openeth not his mouth.	-0.375	negative	Ele foi oprimido e afligido, contudo não abriu a sua boca; como um cordeiro foi levado para o matadouro, e como uma ovelha que diante de seus tosquiadores fica calada, ele não abriu a sua boca.
ISA.53.8	53	8	He was taken from prison and from judgment: and who shall declare his generation? for he was cut off out of the land of the living: for the transgression of my people was he stricken. {from prison...: or, away by distress and judgment: but, etc} {was he...: Heb. was the stroke upon him}	0.0	neutral	Com julgamento opressivo ele foi levado. E quem pode falar dos seus descendentes? Pois ele foi eliminado da terra dos viventes; por causa da transgressão do meu povo ele foi golpeado.
ISA.53.9	53	9	And he made his grave with the wicked, and with the rich in his death; because he had done no violence, neither {was any} deceit in his mouth. {death: Heb. deaths}	0.375	positive	Foi-lhe dado um túmulo com os ímpios, e com os ricos em sua morte, embora não tivesse cometido qualquer violência nem houvesse qualquer mentira em sua boca.
ISA.53.10	53	10	Yet it pleased the LORD to bruise him; he hath put {him} to grief: when thou shalt make his soul an offering for sin, he shall see {his} seed, he shall prolong {his} days, and the pleasure of the LORD shall prosper in his hand. {thou...: or, his soul shall make an offering}	-0.15	negative	Contudo foi da vontade do Senhor esmagá-lo e fazê-lo sofrer, e, embora o Senhor faça da vida dele uma oferta pela culpa, ele verá sua prole e prolongará seus dias, e a vontade do Senhor prosperará em sua mão.
ISA.53.11	53	11	He shall see of the travail of his soul, {and} shall be satisfied: by his knowledge shall my righteous servant justify many; for he shall bear their iniquities.	0.5	positive	Depois do sofrimento de sua alma, ele verá a luz e ficará satisfeito; pelo seu conhecimento meu servo justo justificará a muitos, e levará a iniqüidade deles.
ISA.53.12	53	12	Therefore will I divide him {a portion} with the great, and he shall divide the spoil with the strong; because he hath poured out his soul unto death: and he was numbered with the transgressors; and he bare the sin of many, and made intercession for the transgressors.	0.4458	positive	Por isso eu lhe darei uma porção entre os grandes, e ele dividirá os despojos com os fortes, porquanto ele derramou sua vida até à morte, e foi contado entre os transgressores. Pois ele carregou o pecado de muitos, e intercedeu pelos transgressores.
ISA.54.1	54	1	Sing, O barren, thou {that} didst not bear; break forth into singing, and cry aloud, thou {that} didst not travail with child: for more {are} the children of the desolate than the children of the married wife, saith the LORD.	0.375	positive	"""Cante, ó estéril, você que nunca teve um filho; irrompa em canto, grite de alegria, você que nunca esteve em trabalho de parto; porque mais são os filhos da mulher abandonada do que os daquela que tem marido"", diz o Senhor."
ISA.54.2	54	2	Enlarge the place of thy tent, and let them stretch forth the curtains of thine habitations: spare not, lengthen thy cords, and strengthen thy stakes;	0.0	neutral	"""Alargue o lugar de sua tenda, estenda bem as cortinas de sua tenda, não o impeça; estique suas cordas, firme suas estacas."
ISA.54.3	54	3	For thou shalt break forth on the right hand and on the left; and thy seed shall inherit the Gentiles, and make the desolate cities to be inhabited.	0.1429	positive	"Pois você se estenderá para a direita e para a esquerda; seus descendentes desapossarão nações e se instalarão em suas cidades abandonadas. """
ISA.54.4	54	4	Fear not; for thou shalt not be ashamed: neither be thou confounded; for thou shalt not be put to shame: for thou shalt forget the shame of thy youth, and shalt not remember the reproach of thy widowhood any more.	0.5	positive	"""Não tenha medo; você não sofrerá vergonha. Não tema o constrangimento; você não será humilhada. Você esquecerá a vergonha de sua juventude e não se lembrará mais da humilhação de sua viuvez."
ISA.54.5	54	5	For thy Maker {is} thine husband; the LORD of hosts {is} his name; and thy Redeemer the Holy One of Israel; The God of the whole earth shall he be called. {Maker: Heb. Makers}	0.2	positive	Pois o seu Criador é o seu marido, o Senhor dos Exércitos é o seu nome, o Santo de Israel é seu Redentor; ele é chamado o Deus de toda a terra.
ISA.54.6	54	6	For the LORD hath called thee as a woman forsaken and grieved in spirit, and a wife of youth, when thou wast refused, saith thy God.	0.0	neutral	"O Senhor chamará você de volta como se você fosse uma mulher abandonada e aflita de espírito, uma mulher que se casou nova, apenas para ser rejeitada"", diz o seu Deus."
ISA.54.7	54	7	For a small moment have I forsaken thee; but with great mercies will I gather thee.	0.275	positive	"""Por um breve instante eu a abandonei, mas com profunda compaixão eu a trarei de volta."
ISA.54.8	54	8	In a little wrath I hid my face from thee for a moment; but with everlasting kindness will I have mercy on thee, saith the LORD thy Redeemer.	-0.1875	negative	"Num impulso de indignação escondi de você por um instante o meu rosto, mas com bondade eterna terei compaixão de você"", diz o Senhor, o seu Redentor."
ISA.54.9	54	9	For this {is as} the waters of Noah unto me: for {as} I have sworn that the waters of Noah should no more go over the earth; so have I sworn that I would not be wroth with thee, nor rebuke thee.	-0.25	negative	"""Para mim isso é como os dias de Noé, quando jurei que as águas de Noé nunca mais tornariam a cobrir a terra. De modo que agora jurei não ficar irado contra você, nem tornar a repreendê-la."
ISA.54.10	54	10	For the mountains shall depart, and the hills be removed; but my kindness shall not depart from thee, neither shall the covenant of my peace be removed, saith the LORD that hath mercy on thee.	0.0	neutral	"Embora os montes sejam sacudidos e as colinas sejam removidas, ainda assim a minha fidelidade para com você não será abalada, nem a minha aliança de paz será removida"", diz o Senhor, que tem compaixão de você."
ISA.54.11	54	11	O thou afflicted, tossed with tempest, {and} not comforted, behold, I will lay thy stones with fair colours, and lay thy foundations with sapphires.	0.7	positive	"""Ó cidade aflita, açoitada por tempestades e não consolada, eu a edificarei com turquesas, edificarei seus alicerces com safiras."
ISA.54.12	54	12	And I will make thy windows of agates, and thy gates of carbuncles, and all thy borders of pleasant stones.	0.7333	positive	Farei de rubis os seus escudos, de carbúnculos as suas portas, e de pedras preciosas todos os seus muros.
ISA.54.13	54	13	And all thy children {shall be} taught of the LORD; and great {shall be} the peace of thy children.	0.8	positive	Todos os seus filhos serão ensinados pelo Senhor, e grande será a paz de suas crianças.
ISA.54.14	54	14	In righteousness shalt thou be established: thou shalt be far from oppression; for thou shalt not fear: and from terror; for it shall not come near thee.	0.1	neutral	Em retidão você será estabelecida: A tirania estará distante; você não terá nada a temer. O pavor estará removido para longe; ele não se aproximará de você.
ISA.54.15	54	15	Behold, they shall surely gather together, {but} not by me: whosoever shall gather together against thee shall fall for thy sake.	0.5	positive	Se alguém a atacar, não será por obra minha; todo aquele que a atacar se renderá a você.
ISA.54.16	54	16	Behold, I have created the smith that bloweth the coals in the fire, and that bringeth forth an instrument for his work; and I have created the waster to destroy.	-0.2	negative	"""Veja, sou eu quem criou o ferreiro, que sopra as brasas até darem chama e forja uma arma própria para o seu fim. E fui eu quem criou o destruidor para gerar o caos;"
ISA.54.17	54	17	No weapon that is formed against thee shall prosper; and every tongue {that} shall rise against thee in judgment thou shalt condemn. This {is} the heritage of the servants of the LORD, and their righteousness {is} of me, saith the LORD.	0.0	neutral	"nenhuma arma forjada contra você prevalecerá, e você refutará toda língua que a acusar. Esta é a herança dos servos do Senhor, e esta é a defesa que faço do nome deles"", declara o Senhor."
ISA.55.1	55	1	Ho, every one that thirsteth, come ye to the waters, and he that hath no money; come ye, buy, and eat; yea, come, buy wine and milk without money and without price.	0.0	neutral	"""Venham, todos vocês que estão com sede, venham às águas; e, vocês que não possuem dinheiro algum, venham, comprem e comam! Venham, comprem vinho e leite sem dinheiro e sem custo."
ISA.55.2	55	2	Wherefore do ye spend money for {that which is} not bread? and your labour for {that which} satisfieth not? hearken diligently unto me, and eat ye {that which is} good, and let your soul delight itself in fatness. {spend: Heb. weigh}	0.7	positive	Por que gastar dinheiro naquilo que não é pão e o seu trabalho árduo naquilo que não satisfaz? Escutem, escutem-me, e comam o que é bom, e a alma de vocês se deliciará na mais fina refeição.
ISA.55.3	55	3	Incline your ear, and come unto me: hear, and your soul shall live; and I will make an everlasting covenant with you, {even} the sure mercies of David.	0.3182	positive	Dêem ouvidos e venham a mim; ouçam-me, para que sua alma viva. Farei uma aliança eterna com vocês, minha fidelidade prometida a Davi.
ISA.55.4	55	4	Behold, I have given him {for} a witness to the people, a leader and commander to the people.	0.0	neutral	Vejam, eu o fiz uma testemunha aos povos, um líder e governante dos povos.
ISA.55.5	55	5	Behold, thou shalt call a nation {that} thou knowest not, and nations {that} knew not thee shall run unto thee because of the LORD thy God, and for the Holy One of Israel; for he hath glorified thee.	0.0	neutral	"Com certeza você convocará nações que você não conhece, e nações que não o conhecem se apressarão até você, por causa do Senhor, o seu Deus, o Santo de Israel, pois ele lhe concedeu esplendor. """
ISA.55.6	55	6	Seek ye the LORD while he may be found, call ye upon him while he is near:	0.1	neutral	Busquem o Senhor enquanto se pode achá-lo; clamem por ele enquanto está perto.
ISA.55.7	55	7	Let the wicked forsake his way, and the unrighteous man his thoughts: and let him return unto the LORD, and he will have mercy upon him; and to our God, for he will abundantly pardon. {the unrighteous...: Heb. the man of iniquity} {abundantly...: Heb. multiply to pardon}	0.4	positive	Que o ímpio abandone seu caminho, e o homem mau, os seus pensamentos. Volte-se ele para o Senhor, que terá misericórdia dele; volte-se para o nosso Deus, pois ele perdoará de bom grado.
ISA.55.8	55	8	For my thoughts {are} not your thoughts, neither {are} your ways my ways, saith the LORD.	0.0	neutral	"""Pois os meus pensamentos não são os pensamentos de vocês, nem os seus caminhos são os meus caminhos"", declara o Senhor."
ISA.55.9	55	9	For {as} the heavens are higher than the earth, so are my ways higher than your ways, and my thoughts than your thoughts.	0.25	positive	"""Assim como os céus são mais altos do que a terra, também os meus caminhos são mais altos do que os seus caminhos e os meus pensamentos mais altos do que os seus pensamentos."
ISA.55.10	55	10	For as the rain cometh down, and the snow from heaven, and returneth not thither, but watereth the earth, and maketh it bring forth and bud, that it may give seed to the sower, and bread to the eater:	-0.1556	negative	Assim como a chuva e a neve descem dos céus e não voltam para ele sem regarem a terra e fazerem-na brotar e florescer, para ela produzir semente para o semeador e pão para o que come,
ISA.55.11	55	11	So shall my word be that goeth forth out of my mouth: it shall not return unto me void, but it shall accomplish that which I please, and it shall prosper {in the thing} whereto I sent it.	0.0	neutral	assim também ocorre com a palavra que sai da minha boca: Ela não voltará para mim vazia, mas fará o que desejo e atingirá o propósito para o qual a enviei.
ISA.55.12	55	12	For ye shall go out with joy, and be led forth with peace: the mountains and the hills shall break forth before you into singing, and all the trees of the field shall clap {their} hands.	0.8	positive	Vocês sairão em júbilo e serão conduzidos em paz; os montes e colinas irromperão em canto diante de vocês, e todas as árvores do campo baterão palmas.
ISA.55.13	55	13	Instead of the thorn shall come up the fir tree, and instead of the brier shall come up the myrtle tree: and it shall be to the LORD for a name, for an everlasting sign {that} shall not be cut off.	0.0	neutral	"No lugar do espinheiro crescerá o pinheiro, e em vez de roseiras bravas crescerá a murta. Isso resultará em renome para o Senhor, para sinal eterno, que não será destruído. """
ISA.56.1	56	1	Thus saith the LORD, Keep ye judgment, and do justice: for my salvation {is} near to come, and my righteousness to be revealed. {judgment: or, equity}	0.1	neutral	"Assim diz o Senhor: ""Mantenham a justiça e pratiquem o que é direito, pois a minha salvação está perto, e logo será revelada a minha retidão."
ISA.56.2	56	2	Blessed {is} the man {that} doeth this, and the son of man {that} layeth hold on it; that keepeth the sabbath from polluting it, and keepeth his hand from doing any evil.	-1.0	negative	"Feliz aquele que age assim, o homem que nisso permanece firme, observando o sábado, para não profaná-lo, e vigiando sua mão, para não cometer nenhum mal""."
ISA.56.3	56	3	Neither let the son of the stranger, that hath joined himself to the LORD, speak, saying, The LORD hath utterly separated me from his people: neither let the eunuch say, Behold, I {am} a dry tree.	-0.0333	neutral	"Que nenhum estrangeiro que se disponha a unir-se ao Senhor venha a dizer: ""É certo que o Senhor me excluirá do seu povo"". E que nenhum eunuco se queixe: ""Não passo de uma árvore seca""."
ISA.56.4	56	4	For thus saith the LORD unto the eunuchs that keep my sabbaths, and choose {the things} that please me, and take hold of my covenant;	0.0	neutral	"Pois assim diz o Senhor: ""Aos eunucos que guardarem os meus sábados, que escolherem o que me agrada e se apegarem à minha aliança,"
ISA.56.5	56	5	Even unto them will I give in mine house and within my walls a place and a name better than of sons and of daughters: I will give them an everlasting name, that shall not be cut off.	0.5	positive	a eles darei, dentro de meu templo e dos seus muros, um memorial e um nome melhor do que filhos e filhas, um nome eterno, que não será eliminado.
ISA.56.6	56	6	Also the sons of the stranger, that join themselves to the LORD, to serve him, and to love the name of the LORD, to be his servants, every one that keepeth the sabbath from polluting it, and taketh hold of my covenant;	0.5	positive	E os estrangeiros que se unirem ao Senhor para servi-lo, para amarem o nome do Senhor e para prestar-lhe culto, todos os que guardarem o sábado sem profaná-lo, e que se apegarem à minha aliança,
ISA.56.7	56	7	Even them will I bring to my holy mountain, and make them joyful in my house of prayer: their burnt offerings and their sacrifices {shall be} accepted upon mine altar; for mine house shall be called an house of prayer for all people.	0.0	neutral	"esses eu trarei ao meu santo monte e lhes darei alegria em minha casa de oração. Seus holocaustos e seus sacrifícios serão aceitos em meu altar; pois a minha casa será chamada casa de oração para todos os povos""."
ISA.56.8	56	8	The Lord GOD which gathereth the outcasts of Israel saith, Yet will I gather {others} to him, beside those that are gathered unto him. {beside...: Heb. to his gathered}	0.0	neutral	"Palavra do Soberano Senhor, daquele que reúne os exilados de Israel: ""Reunirei ainda outros àqueles que já foram reunidos""."
ISA.56.9	56	9	All ye beasts of the field, come to devour, {yea}, all ye beasts in the forest.	0.0	neutral	Venham todos vocês, animais do campo; todos vocês, animais da floresta, venham comer!
ISA.56.10	56	10	His watchmen {are} blind: they are all ignorant, they {are} all dumb dogs, they cannot bark; sleeping, lying down, loving to slumber. {sleeping: or, dreaming, or, talking in their sleep}	-0.1076	negative	As sentinelas de Israel estão cegas e não têm conhecimento; todas elas são como cães mudos, incapazes de latir. Deitam-se e sonham; só querem dormir.
ISA.56.11	56	11	Yea, {they are} greedy dogs {which} can never have enough, and they {are} shepherds {that} cannot understand: they all look to their own way, every one for his gain, from his quarter. {greedy: Heb. strong of appetite} {can...: Heb. know not to be satisfied}	0.3833	positive	São cães devoradores, insaciáveis. São pastores sem entendimento; todos seguem seu próprio caminho, cada um procura vantagem própria.
ISA.56.12	56	12	Come ye, {say they}, I will fetch wine, and we will fill ourselves with strong drink; and to morrow shall be as this day, {and} much more abundant.	0.5111	positive	"""Venham"", cada um grita, ""tragam-me vinho! Bebamos nossa dose de bebida fermentada, que amanhã será como hoje, e até muito melhor! """
ISA.57.1	57	1	The righteous perisheth, and no man layeth {it} to heart: and merciful men {are} taken away, none considering that the righteous is taken away from the evil {to come}. {merciful...: Heb. men of kindness, or, godliness} {from...: or, from that which is evil}	-1.0	negative	O justo perece, e ninguém pondera sobre isso em seu coração; homens piedosos são tirados, e ninguém entende que os justos são tirados para serem poupados do mal.
ISA.57.2	57	2	He shall enter into peace: they shall rest in their beds, {each one} walking {in} his uprightness. {enter into: or, go in} {in his...: or, before him}	0.0	neutral	Aqueles que andam retamente entrarão na paz; acharão descanso na morte.
ISA.57.3	57	3	But draw near hither, ye sons of the sorceress, the seed of the adulterer and the whore.	0.1	neutral	"""Mas vocês, aproximem-se, vocês, filhos de adivinhas, vocês, prole de adúlteros e prostitutas!"
ISA.57.4	57	4	Against whom do ye sport yourselves? against whom make ye a wide mouth, {and} draw out the tongue? {are} ye not children of transgression, a seed of falsehood,	-0.1	neutral	De quem vocês estão zombando? De quem fazem pouco caso? E para quem mostram a língua? Não são vocês uma ninhada de rebeldes, uma prole de mentirosos?
