verse_id	chapter	verse	text_en	polarity_en	label_en	text_pt
ISA.48.14	48	14	All ye, assemble yourselves, and hear; which among them hath declared these {things}? The LORD hath loved him: he will do his pleasure on Babylon, and his arm {shall be on} the Chaldeans.	0.7	positive	"""Reúnam-se, todos vocês, e escutem: Qual dos ídolos predisse essas coisas? O amado do Senhor cumprirá seu propósito contra a Babilônia; seu braço será contra os babilônios."
ISA.48.15	48	15	I, {even} I, have spoken; yea, I have called him: I have brought him, and he shall make his way prosperous.	0.0	neutral	Eu, eu mesmo, falei; sim, eu o chamei. Eu o trarei, e ele será bem sucedido em sua missão.
ISA.48.16	48	16	Come ye near unto me, hear ye this; I have not spoken in secret from the beginning; from the time that it was, there {am} I: and now the Lord GOD, and his Spirit, hath sent me.	-0.15	negative	"""Aproximem-se de mim e escutem isto: ""Desde o primeiro anúncio não falei secretamente; na hora em que acontecer, estarei ali. "" E agora o Soberano Senhor me enviou, com seu Espírito."
ISA.48.17	48	17	Thus saith the LORD, thy Redeemer, the Holy One of Israel; I {am} the LORD thy God which teacheth thee to profit, which leadeth thee by the way {that} thou shouldest go.	0.0	neutral	"Assim diz o Senhor, o seu redentor, o Santo de Israel: ""Eu sou o Senhor, o seu Deus, que lhe ensina o que é melhor para você, que o dirige no caminho em que você deve ir."
ISA.48.18	48	18	O that thou hadst hearkened to my commandments! then had thy peace been as a river, and thy righteousness as the waves of the sea:	0.0	neutral	Se tão-somente você tivesse prestado atenção às minhas ordens, sua paz seria como um rio, sua retidão, como as ondas do mar.
ISA.48.19	48	19	Thy seed also had been as the sand, and the offspring of thy bowels like the gravel thereof; his name should not have been cut off nor destroyed from before me.	0.0	neutral	"Seus descendentes seriam como a areia, seus filhos, como seus inúmeros grãos; o nome deles jamais seria eliminado nem destruído de diante de mim""."
ISA.48.20	48	20	Go ye forth of Babylon, flee ye from the Chaldeans, with a voice of singing declare ye, tell this, utter it {even} to the end of the earth; say ye, The LORD hath redeemed his servant Jacob.	0.0	neutral	"Deixem a Babilônia, fujam do meio dos babilônios! Anunciem isso com gritos de alegria e o proclamem. Enviem-no aos confins da terra; digam: ""O Senhor resgatou seu servo Jacó""."
ISA.48.21	48	21	And they thirsted not {when} he led them through the deserts: he caused the waters to flow out of the rock for them: he clave the rock also, and the waters gushed out.	0.0	neutral	Não tiveram sede quando ele os conduziu através dos desertos; ele fez água fluir da rocha para eles; fendeu a rocha, e a água jorrou.
ISA.48.22	48	22	{There is} no peace, saith the LORD, unto the wicked.	0.0	neutral	"""Não há paz alguma para os ímpios"", diz o Senhor."
ISA.49.1	49	1	Listen, O isles, unto me; and hearken, ye people, from far; The LORD hath called me from the womb; from the bowels of my mother hath he made mention of my name.	0.1	neutral	Escutem-me, vocês, ilhas; ouçam, vocês, nações distantes: Antes de eu nascer o Senhor me chamou; desde o meu nascimento ele fez menção de meu nome.
ISA.49.2	49	2	And he hath made my mouth like a sharp sword; in the shadow of his hand hath he hid me, and made me a polished shaft; in his quiver hath he hid me;	-0.125	negative	Ele fez de minha boca uma espada afiada, na sombra de sua mão ele me escondeu; ele me tornou uma flecha polida e escondeu-me na sua aljava.
ISA.49.3	49	3	And said unto me, Thou {art} my servant, O Israel, in whom I will be glorified.	0.0	neutral	"Ele me disse: ""Você é meu servo, Israel, em quem mostrarei o meu esplendor""."
ISA.49.4	49	4	Then I said, I have laboured in vain, I have spent my strength for nought, and in vain: {yet} surely my judgment {is} with the LORD, and my work with my God. {my work: or, my reward}	-0.1167	negative	"Mas eu disse: ""Tenho me afadigado sem qualquer propósito; tenho gasto minha força em vão e para nada. Contudo, o que me é devido está na mão do Senhor, e a minha recompensa está com o meu Deus""."
ISA.49.5	49	5	And now, saith the LORD that formed me from the womb {to be} his servant, to bring Jacob again to him, Though Israel be not gathered, yet shall I be glorious in the eyes of the LORD, and my God shall be my strength. {Though...: or, That Israel may be gathered to him, and I may, etc}	0.0	neutral	E agora o Senhor diz, aquele que me formou no ventre para ser o seu servo para trazer de volta Jacó e reunir Israel a ele mesmo, pois sou honrado aos olhos do Senhor, e o meu Deus tem sido a minha força;
ISA.49.6	49	6	And he said, It is a light thing that thou shouldest be my servant to raise up the tribes of Jacob, and to restore the preserved of Israel: I will also give thee for a light to the Gentiles, that thou mayest be my salvation unto the end of the earth. {It is...: or, Art thou lighter than that thou shouldest, etc} {preserved: or, desolations}	0.4	positive	"ele diz: ""É coisa pequena demais para você ser meu servo para restaurar as tribos de Jacó e trazer de volta aqueles de Israel que eu guardei. Também farei de você uma luz para os gentios, para que você leve a minha salvação até aos confins da terra""."
ISA.49.7	49	7	Thus saith the LORD, the Redeemer of Israel, {and} his Holy One, to him whom man despiseth, to him whom the nation abhorreth, to a servant of rulers, Kings shall see and arise, princes also shall worship, because of the LORD that is faithful, {and} the Holy One of Israel, and he shall choose thee. {whom man...: or, that is despised in soul}	0.0	neutral	"Assim diz o Senhor, o Redentor e o Santo de Israel, àquele que foi desprezado e detestado pela nação, ao servo de governantes: ""Reis o verão e se levantarão, líderes verão e se encurvarão, por causa do Senhor, que é fiel, o Santo de Israel, que o escolheu""."
ISA.49.8	49	8	Thus saith the LORD, In an acceptable time have I heard thee, and in a day of salvation have I helped thee: and I will preserve thee, and give thee for a covenant of the people, to establish the earth, to cause to inherit the desolate heritages; {establish: or, raise up}	0.0	neutral	"Assim diz o Senhor: ""No tempo favorável eu lhe responderei, e no dia da salvação eu o ajudarei; eu o guardarei e farei que você seja uma aliança para o povo, para restaurar a terra e distribuir suas propriedades abandonadas,"
ISA.49.9	49	9	That thou mayest say to the prisoners, Go forth; to them that {are} in darkness, Shew yourselves. They shall feed in the ways, and their pastures {shall be} in all high places.	0.16	positive	"para dizer aos cativos: ""Saiam"", e para aqueles que estão nas trevas: ""Apareçam! "" ""Eles se apascentarão junto aos caminhos e acharão pastagem em toda colina estéril."
ISA.49.10	49	10	They shall not hunger nor thirst; neither shall the heat nor sun smite them: for he that hath mercy on them shall lead them, even by the springs of water shall he guide them.	0.0	neutral	Não terão fome nem sede, o calor do deserto e o sol os atingirá. Aquele que tem compaixão deles os guiará e os conduzirá para as fontes de água.
ISA.49.11	49	11	And I will make all my mountains a way, and my highways shall be exalted.	0.0	neutral	Transformarei todos os meus montes em estradas, e os meus caminhos serão erguidos.
ISA.49.12	49	12	Behold, these shall come from far: and, lo, these from the north and from the west; and these from the land of Sinim.	0.1	neutral	"Veja, eles virão de bem longe alguns do norte, alguns do oeste, alguns de Assuã""."
ISA.49.13	49	13	Sing, O heavens; and be joyful, O earth; and break forth into singing, O mountains: for the LORD hath comforted his people, and will have mercy upon his afflicted.	0.0	neutral	Gritem de alegria, ó céus, regozije-se, ó terra; irrompam em canção, ó montes! Pois o Senhor consola o seu povo e terá compaixão de seus afligidos.
ISA.49.14	49	14	But Zion said, The LORD hath forsaken me, and my Lord hath forgotten me.	0.0	neutral	"Sião, porém, disse: ""O Senhor me abandonou, o Senhor me desamparou""."
ISA.49.15	49	15	Can a woman forget her sucking child, that she should not have compassion on the son of her womb? yea, they may forget, yet will I not forget thee. {that...: Heb. from having compassion}	0.0	neutral	"""Será que uma mãe pode esquecer do seu bebê que ainda mama e não ter compaixão do filho que gerou? Embora ela possa se esquecer, eu não me esquecerei de você!"
ISA.49.16	49	16	Behold, I have graven thee upon the palms of {my} hands; thy walls {are} continually before me.	0.0	neutral	Veja, eu gravei você nas palmas das minhas mãos; seus muros estão sempre diante de mim.
ISA.49.17	49	17	Thy children shall make haste; thy destroyers and they that made thee waste shall go forth of thee.	-0.2	negative	Seus filhos apressam-se em voltar, e aqueles que a despojaram afastam-se de você.
ISA.49.18	49	18	Lift up thine eyes round about, and behold: all these gather themselves together, {and} come to thee. {As} I live, saith the LORD, thou shalt surely clothe thee with them all, as with an ornament, and bind them {on thee}, as a bride {doeth}.	0.1455	positive	"Erga os olhos e olhe ao redor; todos os seus filhos se ajuntam e vêm até você. Juro pela minha vida Que você vestirá a todos como ornamento; você os vestirá como uma noiva"", declara o Senhor."
ISA.49.19	49	19	For thy waste and thy desolate places, and the land of thy destruction, shall even now be too narrow by reason of the inhabitants, and they that swallowed thee up shall be far away.	-0.1	neutral	"""Embora você estivesse arruinada e fosse abandonada e sua terra fosse arrasada, agora você será pequena demais para o seu povo, e aqueles que a devoraram estarão bem distantes."
ISA.49.20	49	20	The children which thou shalt have, after thou hast lost the other, shall say again in thine ears, The place {is} too strait for me: give place to me that I may dwell.	-0.125	negative	Os filhos nascidos durante seu luto ainda dirão ao alcance de seus ouvidos: 'Este lugar é pequeno demais para nós; dê-nos mais espaço para nele vivermos'.
ISA.49.21	49	21	Then shalt thou say in thine heart, Who hath begotten me these, seeing I have lost my children, and am desolate, a captive, and removing to and fro? and who hath brought up these? Behold, I was left alone; these, where {had} they {been}?	0.1	neutral	"Então você dirá em seu coração: 'Quem me gerou estes filhos? Eu estava enlutada e estéril; estava exilada e rejeitada. Quem os criou? Fui deixada totalmente só, mas estes... de onde vieram? ' """
ISA.49.22	49	22	Thus saith the Lord GOD, Behold, I will lift up mine hand to the Gentiles, and set up my standard to the people: and they shall bring thy sons in {their} arms, and thy daughters shall be carried upon {their} shoulders. {arms: Heb. bosom}	0.0	neutral	"Assim diz o Soberano Senhor: ""Veja, eu acenarei para os gentios, erguerei minha bandeira para os povos; eles trarão nos braços os seus filhos e carregarão nos ombros as suas filhas."
ISA.49.23	49	23	And kings shall be thy nursing fathers, and their queens thy nursing mothers: they shall bow down to thee with {their} face toward the earth, and lick up the dust of thy feet; and thou shalt know that I {am} the LORD: for they shall not be ashamed that wait for me. {nursing fathers: Heb. nourishers} {queens: Heb. princesses}	-0.1556	negative	"Reis serão os seus padrastos, e suas rainhas serão as suas amas de leite. Eles se inclinarão diante de você, com o rosto em terra; lamberão o pó dos seus pés. Então você saberá que eu sou o Senhor; aqueles que esperam em mim não ficarão decepcionados""."
ISA.49.24	49	24	Shall the prey be taken from the mighty, or the lawful captive delivered? {lawful...: Heb. captivity of the just}	0.15	positive	Será que se pode tirar o despojo dos guerreiros, ou serem os prisioneiros resgatados do poder dos violentos?
ISA.49.25	49	25	But thus saith the LORD, Even the captives of the mighty shall be taken away, and the prey of the terrible shall be delivered: for I will contend with him that contendeth with thee, and I will save thy children. {captives: Heb. captivity}	-0.3	negative	Assim, porém, diz o Senhor:
ISA.49.26	49	26	And I will feed them that oppress thee with their own flesh; and they shall be drunken with their own blood, as with sweet wine: and all flesh shall know that I the LORD {am} thy Saviour and thy Redeemer, the mighty One of Jacob. {sweet: or, new}	0.4061	positive	"""Sim, prisioneiros serão tirados de guerreiros, e despojo será retomado dos violentos; brigarei com os que brigam com você, e seus filhos, eu os salvarei. Farei seus opressores comerem sua própria carne; ficarão bêbados com seu próprio sangue, como com vinho. Então todo mundo saberá que eu, o Senhor, sou o seu Salvador, seu Redentor, o Poderoso de Jacó""."
ISA.50.1	50	1	Thus saith the LORD, Where {is} the bill of your mother's divorcement, whom I have put away? or which of my creditors {is it} to whom I have sold you? Behold, for your iniquities have ye sold yourselves, and for your transgressions is your mother put away.	0.0	neutral	"Assim diz o Senhor: ""Onde está a certidão de divórcio de sua mãe com a qual eu a mandei embora? A qual de meus credores eu vendi vocês? Por causa de seus pecados vocês foram vendidos; por causa das transgressões de vocês sua mãe foi mandada embora."
ISA.50.2	50	2	Wherefore, when I came, {was there} no man? when I called, {was there} none to answer? Is my hand shortened at all, that it cannot redeem? or have I no power to deliver? behold, at my rebuke I dry up the sea, I make the rivers a wilderness: their fish stinketh, because {there is} no water, and dieth for thirst.	-0.0667	neutral	Quando eu vim, por que não encontrei ninguém? Quando eu chamei, por que ninguém respondeu? Será que meu braço era curto demais para resgatá-los? Será que me falta a força para redimi-los? Com uma simples repreensão eu seco o mar, transformo rios em deserto; seus peixes apodrecem por falta de água e morrem de sede.
ISA.50.3	50	3	I clothe the heavens with blackness, and I make sackcloth their covering.	0.0	neutral	"Visto os céus com trevas e faço da veste de lamento a sua coberta""."
ISA.50.4	50	4	The Lord GOD hath given me the tongue of the learned, that I should know how to speak a word in season to {him that is} weary: he wakeneth morning by morning, he wakeneth mine ear to hear as the learned.	0.0	neutral	O Soberano Senhor deu-me uma língua instruída, para conhecer a palavra que sustém o exausto. Ele me acorda manhã após manhã, desperta meu ouvido para escutar como alguém que é ensinado.
ISA.50.5	50	5	The Lord GOD hath opened mine ear, and I was not rebellious, neither turned away back.	0.0	neutral	O Soberano Senhor abriu os meus ouvidos, e eu não tenho sido rebelde; eu não me afastei.
ISA.50.6	50	6	I gave my back to the smiters, and my cheeks to them that plucked off the hair: I hid not my face from shame and spitting.	0.0	neutral	Ofereci minhas costas para aqueles que me batiam, meu rosto para aqueles que arrancavam minha barba; não escondi a face da zombaria e da cuspida.
ISA.50.7	50	7	For the Lord GOD will help me; therefore shall I not be confounded: therefore have I set my face like a flint, and I know that I shall not be ashamed.	0.0	neutral	Porque o Senhor Soberano me ajuda, não serei constrangido. Por isso eu me opus firmemente como pederneira, e sei que não serei envergonhado.
ISA.50.8	50	8	{He is} near that justifieth me; who will contend with me? let us stand together: who {is} mine adversary? let him come near to me. {mine...: Heb. the master of my cause?}	0.1	neutral	Aquele que defende o meu nome está perto. Quem então trará acusações contra mim? Encaremo-nos um ao outro! Quem é meu acusador? Que ele me enfrente!
ISA.50.9	50	9	Behold, the Lord GOD will help me; who {is} he {that} shall condemn me? lo, they all shall wax old as a garment; the moth shall eat them up.	0.1	neutral	É o Soberano Senhor que me ajuda. Quem irá me condenar? Todos eles se desgastam como uma roupa; as traças os consumirão.
ISA.50.10	50	10	Who {is} among you that feareth the LORD, that obeyeth the voice of his servant, that walketh {in} darkness, and hath no light? let him trust in the name of the LORD, and stay upon his God.	-0.2	negative	Quem entre vocês teme o Senhor e obedece à palavra de seu servo? Que aquele que anda no escuro, que não tem luz alguma, confie no nome do Senhor e dependa de seu Deus.
ISA.50.11	50	11	Behold, all ye that kindle a fire, that compass {yourselves} about with sparks: walk in the light of your fire, and in the sparks {that} ye have kindled. This shall ye have of mine hand; ye shall lie down in sorrow.	0.1222	positive	Mas agora, todos vocês que acendem fogo e fornecem a si mesmos tochas acesas, vão, andem na luz de seus fogos e das tochas que vocês acenderam. Isso é o que receberão da minha mão: vocês deitarão atormentados.
ISA.51.1	51	1	Hearken to me, ye that follow after righteousness, ye that seek the LORD: look unto the rock {whence} ye are hewn, and to the hole of the pit {whence} ye are digged.	0.0	neutral	"""Escutem-me, vocês que buscam a retidão e procuram pelo Senhor: Olhem para a rocha da qual foram cortados e para a pedreira de onde foram cavados;"
ISA.51.2	51	2	Look unto Abraham your father, and unto Sarah {that} bare you: for I called him alone, and blessed him, and increased him.	0.05	neutral	olhem para Abraão, seu pai, e para Sara, que lhes deu à luz. Quando eu o chamei, ele era apenas um, e eu o abençoei e o tornei muitos.
ISA.51.3	51	3	For the LORD shall comfort Zion: he will comfort all her waste places; and he will make her wilderness like Eden, and her desert like the garden of the LORD; joy and gladness shall be found therein, thanksgiving, and the voice of melody.	0.3	positive	Com certeza o Senhor consolará Sião e olhará com compaixão para todas as ruínas dela; ele tornará seus desertos como o Éden, seus ermos, como o jardim do Senhor. Alegria e contentamento serão achados nela, ações de graças e o som de canções.
ISA.51.4	51	4	Hearken unto me, my people; and give ear unto me, O my nation: for a law shall proceed from me, and I will make my judgment to rest for a light of the people.	0.4	positive	"""Escute-me, meu povo; ouça-me, minha nação: A lei sairá de mim; minha justiça se tornará uma luz para as nações."
ISA.51.5	51	5	My righteousness {is} near; my salvation is gone forth, and mine arms shall judge the people; the isles shall wait upon me, and on mine arm shall they trust.	0.1	neutral	Minha retidão logo virá, minha salvação está a caminho, e meu braço trará justiça às nações. As ilhas esperarão em mim e aguardarão esperançosamente pelo meu braço.
ISA.51.6	51	6	Lift up your eyes to the heavens, and look upon the earth beneath: for the heavens shall vanish away like smoke, and the earth shall wax old like a garment, and they that dwell therein shall die in like manner: but my salvation shall be for ever, and my righteousness shall not be abolished.	0.1	neutral	Ergam os olhos para os céus, olhem para baixo, para a terra; os céus desaparecerão como fumaça, a terra se gastará como uma roupa, e seus habitantes morrerão como moscas. Mas a minha salvação durará para sempre, a minha retidão jamais falhará.
ISA.51.7	51	7	Hearken unto me, ye that know righteousness, the people in whose heart {is} my law; fear ye not the reproach of men, neither be ye afraid of their revilings.	-0.6	negative	"""Ouçam-me, vocês que sabem o que é direito, vocês, povo que têm a minha lei no coração: Não temam a censura de homens nem fiquem aterrorizados com seus insultos."
ISA.51.8	51	8	For the moth shall eat them up like a garment, and the worm shall eat them like wool: but my righteousness shall be for ever, and my salvation from generation to generation.	0.0	neutral	"Pois a traça os comerá como a uma roupa; o verme os devorará como à lã. Mas a minha retidão durará para sempre, a minha salvação de geração a geração. """
ISA.51.9	51	9	Awake, awake, put on strength, O arm of the LORD; awake, as in the ancient days, in the generations of old. {Art} thou not it that hath cut Rahab, {and} wounded the dragon?	0.1	neutral	Desperta! Desperta! Veste-te de força, ó braço do Senhor; acorda, como em dias passados, como em gerações de outrora. Não foste tu que cortaste o Monstro dos Mares em pedaços, que traspassaste aquela serpente aquática?
ISA.51.10	51	10	{Art} thou not it which hath dried the sea, the waters of the great deep; that hath made the depths of the sea a way for the ransomed to pass over?	0.2	positive	Não foste tu que secaste o mar, as águas do grande abismo, que fizeste uma estrada nas profundezas do mar para que os redimidos pudessem atravessar?
ISA.51.11	51	11	Therefore the redeemed of the LORD shall return, and come with singing unto Zion; and everlasting joy {shall be} upon their head: they shall obtain gladness and joy; {and} sorrow and mourning shall flee away.	0.8	positive	Os resgatados do Senhor voltarão. Entrarão em Sião com cântico; alegria eterna coroará suas cabeças. Júbilo e alegria se apossarão deles, tristeza e suspiro deles fugirão.
ISA.51.12	51	12	I, {even} I, {am} he that comforteth you: who {art} thou, that thou shouldest be afraid of a man {that} shall die, and of the son of man {which} shall be made {as} grass;	-0.6	negative	"""Eu, eu mesmo, sou quem a consola. Quem é você para que tema homens mortais, os filhos de homens, que não passam de relva,"
ISA.51.13	51	13	And forgettest the LORD thy maker, that hath stretched forth the heavens, and laid the foundations of the earth; and hast feared continually every day because of the fury of the oppressor, as if he were ready to destroy? and where {is} the fury of the oppressor? {were...: or, made himself ready}	0.0375	neutral	para que você esqueça o Senhor, aquele que fez você, que estendeu os céus e lançou os alicerces da terra, para que viva diariamente, constantemente apavorado por causa da ira do opressor, que está inclinado a destruir? Pois onde está a ira do opressor?
ISA.51.14	51	14	The captive exile hasteneth that he may be loosed, and that he should not die in the pit, nor that his bread should fail.	-0.15	negative	Os prisioneiros encolhidos logo serão postos em liberdade; não morrerão em sua masmorra, nem terão falta de pão.
ISA.51.15	51	15	But I {am} the LORD thy God, that divided the sea, whose waves roared: The LORD of hosts {is} his name.	0.0	neutral	Pois eu sou o Senhor, o seu Deus, que agito o mar para que suas ondas rujam, o Senhor dos Exércitos é o seu nome.
ISA.51.16	51	16	And I have put my words in thy mouth, and I have covered thee in the shadow of mine hand, that I may plant the heavens, and lay the foundations of the earth, and say unto Zion, Thou {art} my people.	0.0	neutral	"Pus minhas palavras em sua boca e o cobri com a sombra da minha mão, eu que pus os céus no lugar, que lancei os alicerces da terra, e que digo a Sião: 'Você é o meu povo'. """
ISA.51.17	51	17	Awake, awake, stand up, O Jerusalem, which hast drunk at the hand of the LORD the cup of his fury; thou hast drunken the dregs of the cup of trembling, {and} wrung {them} out.	-0.5	negative	Desperte, desperte! Levante-se, ó Jerusalém, você que bebeu da mão do Senhor o cálice da ira dele, você que engoliu até a última gota, a taça que faz os homens cambalearem.
ISA.51.18	51	18	{There is} none to guide her among all the sons {whom} she hath brought forth; neither {is there any} that taketh her by the hand of all the sons {that} she hath brought up.	0.0	neutral	De todos os filhos que ela teve não houve nenhum para guiá-la; de todos os filhos que criou não houve nenhum para tomá-la pela mão.
ISA.51.19	51	19	These two {things} are come unto thee; who shall be sorry for thee? desolation, and destruction, and the famine, and the sword: by whom shall I comfort thee? {are...: Heb. happened} {destruction: Heb. breaking}	-0.5	negative	Quem poderá consolá-la dessas duas degraças que a atingiram? Ruína e destruição, fome e espada, quem poderá consolá-la?
ISA.51.20	51	20	Thy sons have fainted, they lie at the head of all the streets, as a wild bull in a net: they are full of the fury of the LORD, the rebuke of thy God.	0.15	positive	Seus filhos desmaiaram; eles jazem no início de cada rua, como antílope pego numa rede. Estão cheios da ira do Senhor e com a repreensão do seu Deus.
ISA.51.21	51	21	Therefore hear now this, thou afflicted, and drunken, but not with wine:	0.0	neutral	Portanto, ouça isto, você, aflita, embriagada, mas não com vinho.
ISA.51.22	51	22	Thus saith thy Lord the LORD, and thy God {that} pleadeth the cause of his people, Behold, I have taken out of thine hand the cup of trembling, {even} the dregs of the cup of my fury; thou shalt no more drink it again:	-0.25	negative	"Assim diz o seu Soberano Senhor, o seu Deus, que defende o seu povo: ""Veja que eu tirei da sua mão o cálice que faz cambalear; dele, do cálice da minha ira, você nunca mais beberá."
ISA.51.23	51	23	But I will put it into the hand of them that afflict thee; which have said to thy soul, Bow down, that we may go over: and thou hast laid thy body as the ground, and as the street, to them that went over.	-0.1556	negative	"Eu a porei nas mãos dos seus atormentadores, que lhe disseram: 'Caia prostrada para que andemos sobre você'. E você fez as suas costas como chão, como uma rua para nela se andar""."
