verse_id	chapter	verse	text_en	polarity_en	label_en	text_es
PRO.1.1	1	1	The proverbs of Solomon the son of David, king of Israel;	0.0	neutral	LOS proverbios de Salomón, hijo de David, rey de Israel:
PRO.1.2	1	2	To know wisdom and instruction; to perceive the words of understanding;	0.0	neutral	Para entender sabiduría y doctrina; Para conocer las razones prudentes;
PRO.1.3	1	3	To receive the instruction of wisdom, justice, and judgment, and equity; {equity: Heb. equities}	0.0	neutral	Para recibir el consejo de prudencia, Justicia, y juicio y equidad;
PRO.1.4	1	4	To give subtilty to the simple, to the young man knowledge and discretion. {discretion: or, advisement}	0.05	neutral	Para dar sagacidad á los simples, Y á los jóvenes inteligencia y cordura.
PRO.1.5	1	5	A wise {man} will hear, and will increase learning; and a man of understanding shall attain unto wise counsels:	0.7	positive	Oirá el sabio, y aumentará el saber; Y el entendido adquirirá consejo;
PRO.1.6	1	6	To understand a proverb, and the interpretation; the words of the wise, and their dark sayings. {the interpretation: or, an eloquent speech}	0.275	positive	Para entender parábola y declaración; Palabras de sabios, y sus dichos oscuros.
PRO.1.7	1	7	The fear of the LORD {is} the beginning of knowledge: {but} fools despise wisdom and instruction. {the beginning: or, the principal part}	-0.75	negative	El principio de la sabiduría es el temor de Jehová: Los insensatos desprecian la sabiduría y la enseñanza.
PRO.1.8	1	8	My son, hear the instruction of thy father, and forsake not the law of thy mother:	0.0	neutral	Oye, hijo mío, la doctrina de tu padre, Y no desprecies la dirección de tu madre:
PRO.1.9	1	9	For they {shall be} an ornament of grace unto thy head, and chains about thy neck. {an...: Heb. an adding}	0.0	neutral	Porque adorno de gracia serán á tu cabeza, Y collares á tu cuello.
PRO.1.10	1	10	My son, if sinners entice thee, consent thou not.	0.0	neutral	Hijo mío, si los pecadores te quisieren engañar, No consientas.
PRO.1.11	1	11	If they say, Come with us, let us lay wait for blood, let us lurk privily for the innocent without cause:	0.5	positive	Si dijeren: Ven con nosotros, Pongamos asechanzas á la sangre, Acechemos sin motivo al inocente;
PRO.1.12	1	12	Let us swallow them up alive as the grave; and whole, as those that go down into the pit:	0.0481	neutral	Los tragaremos vivos como el sepulcro, Y enteros, como los que caen en sima;
PRO.1.13	1	13	We shall find all precious substance, we shall fill our houses with spoil:	0.5	positive	Hallaremos riquezas de todas suertes, Henchiremos nuestras casas de despojos;
PRO.1.14	1	14	Cast in thy lot among us; let us all have one purse:	0.0	neutral	Echa tu suerte entre nosotros; Tengamos todos una bolsa:
PRO.1.15	1	15	My son, walk not thou in the way with them; refrain thy foot from their path:	0.0	neutral	Hijo mío, no andes en camino con ellos; Aparta tu pie de sus veredas:
PRO.1.16	1	16	For their feet run to evil, and make haste to shed blood.	-1.0	negative	Porque sus pies correrán al mal, E irán presurosos á derramar sangre.
PRO.1.17	1	17	Surely in vain the net is spread in the sight of any bird. {in the...: Heb. in the eyes of every thing that hath a wing}	0.25	positive	Porque en vano se tenderá la red Ante los ojos de toda ave;
PRO.1.18	1	18	And they lay wait for their {own} blood; they lurk privily for their {own} lives.	0.6	positive	Mas ellos á su propia sangre ponen asechanzas, Y á sus almas tienden lazo.
PRO.1.19	1	19	So {are} the ways of every one that is greedy of gain; {which} taketh away the life of the owners thereof.	0.0	neutral	Tales son las sendas de todo el que es dado á la codicia, La cual prenderá el alma de sus poseedores.
PRO.1.20	1	20	Wisdom crieth without; she uttereth her voice in the streets: {Wisdom: Heb. Wisdoms, that is, Excellent wisdom}	0.125	positive	La sabiduría clama de fuera, Da su voz en las plazas:
PRO.1.21	1	21	She crieth in the chief place of concourse, in the openings of the gates: in the city she uttereth her words, {saying},	0.0	neutral	Clama en los principales lugares de concurso; En las entradas de las puertas de la ciudad dice sus razones:
PRO.1.22	1	22	How long, ye simple ones, will ye love simplicity? and the scorners delight in their scorning, and fools hate knowledge?	-0.0875	neutral	¿Hasta cuándo, oh simples, amaréis la simpleza, Y los burladores desearán el burlar, Y los insensatos aborrecerán la ciencia?
PRO.1.23	1	23	Turn you at my reproof: behold, I will pour out my spirit unto you, I will make known my words unto you.	0.0	neutral	Volveos á mi reprensión: He aquí yo os derramaré mi espíritu, Y os haré saber mis palabras.
PRO.1.24	1	24	Because I have called, and ye refused; I have stretched out my hand, and no man regarded;	-0.05	neutral	Por cuanto llamé, y no quisisteis: Extendí mi mano, y no hubo quien escuchase;
PRO.1.25	1	25	But ye have set at nought all my counsel, and would none of my reproof:	0.0	neutral	Antes desechasteis todo consejo mío, Y mi reprensión no quisisteis:
PRO.1.26	1	26	I also will laugh at your calamity; I will mock when your fear cometh;	0.3	positive	También yo me reiré en vuestra calamidad, Y me burlaré cuando os viniere lo que teméis;
PRO.1.27	1	27	When your fear cometh as desolation, and your destruction cometh as a whirlwind; when distress and anguish cometh upon you.	0.0	neutral	Cuando viniere como una destrucción lo que teméis, Y vuestra calamidad llegare como un torbellino; Cuando sobre vosotros viniere tribulación y angustia.
PRO.1.28	1	28	Then shall they call upon me, but I will not answer; they shall seek me early, but they shall not find me:	0.1	neutral	Entonces me llamarán, y no responderé; Buscarme han de mañana, y no me hallarán:
PRO.1.29	1	29	For that they hated knowledge, and did not choose the fear of the LORD:	-0.9	negative	Por cuanto aborrecieron la sabiduría, Y no escogieron el temor de Jehová,
PRO.1.30	1	30	They would none of my counsel: they despised all my reproof.	0.0	neutral	Ni quisieron mi consejo, Y menospreciaron toda reprensión mía:
PRO.1.31	1	31	Therefore shall they eat of the fruit of their own way, and be filled with their own devices.	0.5333	positive	Comerán pues del fruto de su camino, Y se hartarán de sus consejos.
PRO.1.32	1	32	For the turning away of the simple shall slay them, and the prosperity of fools shall destroy them. {turning...: or, ease of the simple}	-0.0667	neutral	Porque el reposo de los ignorantes los matará, Y la prosperidad de los necios los echará á perder.
PRO.1.33	1	33	But whoso hearkeneth unto me shall dwell safely, and shall be quiet from fear of evil.	-0.1667	negative	Mas el que me oyere, habitará confiadamente, Y vivirá reposado, sin temor de mal.
PRO.2.1	2	1	My son, if thou wilt receive my words, and hide my commandments with thee;	0.0	neutral	HIJO mío, si tomares mis palabras, Y mis mandamientos guardares dentro de ti,
PRO.2.2	2	2	So that thou incline thine ear unto wisdom, {and} apply thine heart to understanding;	0.0	neutral	Haciendo estar atento tu oído á la sabiduría; Si inclinares tu corazón á la prudencia;
PRO.2.3	2	3	Yea, if thou criest after knowledge, {and} liftest up thy voice for understanding; {liftest...: Heb. givest thy voice}	0.0	neutral	Si clamares á la inteligencia, Y á la prudencia dieres tu voz;
PRO.2.4	2	4	If thou seekest her as silver, and searchest for her as {for} hid treasures;	0.0	neutral	Si como á la plata la buscares, Y la escudriñares como á tesoros;
PRO.2.5	2	5	Then shalt thou understand the fear of the LORD, and find the knowledge of God.	0.0	neutral	Entonces entenderás el temor de Jehová, Y hallarás el conocimiento de Dios.
PRO.2.6	2	6	For the LORD giveth wisdom: out of his mouth {cometh} knowledge and understanding.	0.0	neutral	Porque Jehová da la sabiduría, Y de su boca viene el conocimiento y la inteligencia.
PRO.2.7	2	7	He layeth up sound wisdom for the righteous: {he is} a buckler to them that walk uprightly.	-0.175	negative	El provee de sólida sabiduría á los rectos: Es escudo á los que caminan rectamente.
PRO.2.8	2	8	He keepeth the paths of judgment, and preserveth the way of his saints.	0.0	neutral	Es el que guarda las veredas del juicio, Y preserva el camino de sus santos.
PRO.2.9	2	9	Then shalt thou understand righteousness, and judgment, and equity; {yea}, every good path.	0.7	positive	Entonces entenderás justicia, juicio, Y equidad, y todo buen camino.
PRO.2.10	2	10	When wisdom entereth into thine heart, and knowledge is pleasant unto thy soul;	0.7333	positive	Cuando la sabiduría entrare en tu corazón, Y la ciencia fuere dulce á tu alma,
PRO.2.11	2	11	Discretion shall preserve thee, understanding shall keep thee:	0.0	neutral	El consejo te guardará, Te preservará la inteligencia:
PRO.2.12	2	12	To deliver thee from the way of the evil {man}, from the man that speaketh froward things;	-1.0	negative	Para librarte del mal camino, De los hombres que hablan perversidades;
PRO.2.13	2	13	Who leave the paths of uprightness, to walk in the ways of darkness;	0.0	neutral	Que dejan las veredas derechas, Por andar en caminos tenebrosos;
PRO.2.14	2	14	Who rejoice to do evil, {and} delight in the frowardness of the wicked;	-1.0	negative	Que se alegran haciendo mal, Que se huelgan en las perversidades del vicio;
PRO.2.15	2	15	Whose ways {are} crooked, and {they} froward in their paths:	0.0	neutral	Cuyas veredas son torcidas, Y torcidos sus caminos.
PRO.2.16	2	16	To deliver thee from the strange woman, {even} from the stranger {which} flattereth with her words;	-0.05	neutral	Para librarte de la mujer extraña, De la ajena que halaga con sus palabras;
PRO.2.17	2	17	Which forsaketh the guide of her youth, and forgetteth the covenant of her God.	0.0	neutral	Que desampara el príncipe de su mocedad, Y se olvida del pacto de su Dios.
PRO.2.18	2	18	For her house inclineth unto death, and her paths unto the dead.	-0.2	negative	Por lo cual su casa está inclinada á la muerte, Y sus veredas hacia los muertos:
PRO.2.19	2	19	None that go unto her return again, neither take they hold of the paths of life.	0.0	neutral	Todos los que á ella entraren, no volverán, Ni tomarán las veredas de la vida.
PRO.2.20	2	20	That thou mayest walk in the way of good {men}, and keep the paths of the righteous.	0.7	positive	Para que andes por el camino de los buenos, Y guardes las veredas de los justos.
PRO.2.21	2	21	For the upright shall dwell in the land, and the perfect shall remain in it.	1.0	positive	Porque los rectos habitarán la tierra, Y los perfectos permanecerán en ella;
PRO.2.22	2	22	But the wicked shall be cut off from the earth, and the transgressors shall be rooted out of it. {rooted: or, plucked up}	0.0	neutral	Mas los impíos serán cortados de la tierra, Y los prevaricadores serán de ella desarraigados.
PRO.3.1	3	1	My son, forget not my law; but let thine heart keep my commandments:	0.0	neutral	HIJO mío, no te olvides de mi ley; Y tu corazón guarde mis mandamientos:
PRO.3.2	3	2	For length of days, and long life, and peace, shall they add to thee. {long...: Heb. years of life}	-0.05	neutral	Porque largura de días, y años de vida Y paz te aumentarán.
PRO.3.3	3	3	Let not mercy and truth forsake thee: bind them about thy neck; write them upon the table of thine heart:	0.0	neutral	Misericordia y verdad no te desamparen; Atalas á tu cuello, Escríbelas en la tabla de tu corazón:
PRO.3.4	3	4	So shalt thou find favour and good understanding in the sight of God and man. {good...: or, good success}	0.6	positive	Y hallarás gracia y buena opinión En los ojos de Dios y de los hombres.
PRO.3.5	3	5	Trust in the LORD with all thine heart; and lean not unto thine own understanding.	0.6	positive	Fíate de Jehová de todo tu corazón, Y no estribes en tu prudencia.
PRO.3.6	3	6	In all thy ways acknowledge him, and he shall direct thy paths.	0.1	neutral	Reconócelo en todos tus caminos, Y él enderezará tus veredas.
PRO.3.7	3	7	Be not wise in thine own eyes: fear the LORD, and depart from evil.	-0.25	negative	No seas sabio en tu opinión: Teme á Jehová, y apártate del mal;
PRO.3.8	3	8	It shall be health to thy navel, and marrow to thy bones. {health: Heb. medicine} {marrow: Heb. watering, or, moistening}	0.0	neutral	Porque será medicina á tu ombligo, Y tuétano á tus huesos.
PRO.3.9	3	9	Honour the LORD with thy substance, and with the firstfruits of all thine increase:	0.0	neutral	Honra á Jehová de tu sustancia, Y de las primicias de todos tus frutos;
PRO.3.10	3	10	So shall thy barns be filled with plenty, and thy presses shall burst out with new wine.	0.2682	positive	Y serán llenas tus trojes con abundancia, Y tus lagares rebosarán de mosto.
PRO.3.11	3	11	My son, despise not the chastening of the LORD; neither be weary of his correction:	0.0	neutral	No deseches, hijo mío, el castigo de Jehová; Ni te fatigues de su corrección:
PRO.3.12	3	12	For whom the LORD loveth he correcteth; even as a father the son {in whom} he delighteth.	0.0	neutral	Porque al que ama castiga, Como el padre al hijo á quien quiere.
PRO.3.13	3	13	Happy {is} the man {that} findeth wisdom, and the man {that} getteth understanding. {that getteth...: Heb. that draweth out understanding}	0.8	positive	Bienaventurado el hombre que halla la sabiduría, Y que obtiene la inteligencia:
PRO.3.14	3	14	For the merchandise of it {is} better than the merchandise of silver, and the gain thereof than fine gold.	0.4583	positive	Porque su mercadería es mejor que la mercadería de la plata, Y sus frutos más que el oro fino.
PRO.3.15	3	15	She {is} more precious than rubies: and all the things thou canst desire are not to be compared unto her.	0.5	positive	Más preciosa es que las piedras preciosas; Y todo lo que puedes desear, no se puede comparar á ella.
PRO.3.16	3	16	Length of days {is} in her right hand; {and} in her left hand riches and honour.	0.1429	positive	Largura de días está en su mano derecha; En su izquierda riquezas y honra.
PRO.3.17	3	17	Her ways {are} ways of pleasantness, and all her paths {are} peace.	0.0	neutral	Sus caminos son caminos deleitosos, Y todas sus veredas paz.
PRO.3.18	3	18	She {is} a tree of life to them that lay hold upon her: and happy {is every one} that retaineth her.	0.8	positive	Ella es árbol de vida á los que de ella asen: Y bienaventurados son los que la mantienen.
PRO.3.19	3	19	The LORD by wisdom hath founded the earth; by understanding hath he established the heavens. {established: or, prepared}	0.0	neutral	Jehová con sabiduría fundó la tierra; Afirmó los cielos con inteligencia.
PRO.3.20	3	20	By his knowledge the depths are broken up, and the clouds drop down the dew.	-0.2778	negative	Con su ciencia se partieron los abismos, Y destilan el rocío los cielos.
PRO.3.21	3	21	My son, let not them depart from thine eyes: keep sound wisdom and discretion:	0.4	positive	Hijo mío, no se aparten estas cosas de tus ojos; Guarda la ley y el consejo;
PRO.3.22	3	22	So shall they be life unto thy soul, and grace to thy neck.	0.0	neutral	Y serán vida á tu alma, Y gracia á tu cuello.
PRO.3.23	3	23	Then shalt thou walk in thy way safely, and thy foot shall not stumble.	0.2625	positive	Entonces andarás por tu camino confiadamente, Y tu pie no tropezará.
PRO.3.24	3	24	When thou liest down, thou shalt not be afraid: yea, thou shalt lie down, and thy sleep shall be sweet.	-0.1403	negative	Cuando te acostares, no tendrás temor; Antes te acostarás, y tu sueño será suave.
PRO.3.25	3	25	Be not afraid of sudden fear, neither of the desolation of the wicked, when it cometh.	0.15	positive	No tendrás temor de pavor repentino, Ni de la ruina de los impíos cuando viniere:
PRO.3.26	3	26	For the LORD shall be thy confidence, and shall keep thy foot from being taken.	0.0	neutral	Porque Jehová será tu confianza, Y él preservará tu pie de ser preso.
PRO.3.27	3	27	Withhold not good from them to whom it is due, when it is in the power of thine hand to do {it}. {them...: Heb. the owners thereof}	-0.2375	negative	No detengas el bien de sus dueños, Cuando tuvieres poder para hacerlo.
PRO.3.28	3	28	Say not unto thy neighbour, Go, and come again, and to morrow I will give; when thou hast it by thee.	0.0	neutral	No digas á tu prójimo: Ve, y vuelve, Y mañana te daré; Cuando tienes contigo qué darle.
PRO.3.29	3	29	Devise not evil against thy neighbour, seeing he dwelleth securely by thee. {Devise...: or, Practise no evil}	0.4667	positive	No intentes mal contra tu prójimo, Estando él confiado de ti.
PRO.3.30	3	30	Strive not with a man without cause, if he have done thee no harm.	0.0	neutral	No pleitees con alguno sin razón, Si él no te ha hecho agravio.
PRO.3.31	3	31	Envy thou not the oppressor, and choose none of his ways. {the oppressor: Heb. a man of violence}	0.0	neutral	No envidies al hombre injusto, Ni escojas alguno de sus caminos.
PRO.3.32	3	32	For the froward {is} abomination to the LORD: but his secret {is} with the righteous.	-0.4	negative	Porque el perverso es abominado de Jehová: Mas su secreto es con los rectos.
PRO.3.33	3	33	The curse of the LORD {is} in the house of the wicked: but he blesseth the habitation of the just.	0.0	neutral	La maldición de Jehová está en la casa del impío; Mas él bendecirá la morada de los justos.
PRO.3.34	3	34	Surely he scorneth the scorners: but he giveth grace unto the lowly.	0.25	positive	Ciertamente él escarnecerá á los escarnecedores, Y á los humildes dará gracia.
PRO.3.35	3	35	The wise shall inherit glory: but shame shall be the promotion of fools. {shall be...: Heb. exalteth the fools}	0.7	positive	Los sabios heredarán honra: Mas los necios sostendrán ignominia.
PRO.4.1	4	1	Hear, ye children, the instruction of a father, and attend to know understanding.	0.0	neutral	OID, hijos, la doctrina de un padre, Y estad atentos para que conozcáis cordura.
PRO.4.2	4	2	For I give you good doctrine, forsake ye not my law.	0.7	positive	Porque os doy buena enseñanza; No desamparéis mi ley.
PRO.4.3	4	3	For I was my father's son, tender and only {beloved} in the sight of my mother.	0.35	positive	Porque yo fuí hijo de mi padre, Delicado y único delante de mi madre.
PRO.4.4	4	4	He taught me also, and said unto me, Let thine heart retain my words: keep my commandments, and live.	0.1364	positive	Y él me enseñaba, y me decía: Mantenga tu corazón mis razones, Guarda mis mandamientos, y vivirás:
PRO.4.5	4	5	Get wisdom, get understanding: forget {it} not; neither decline from the words of my mouth.	0.0	neutral	Adquiere sabiduría, adquiere inteligencia; No te olvides ni te apartes de las razones de mi boca;
PRO.4.6	4	6	Forsake her not, and she shall preserve thee: love her, and she shall keep thee.	0.5	positive	No la dejes, y ella te guardará; Amala, y te conservará.
PRO.4.7	4	7	Wisdom {is} the principal thing; {therefore} get wisdom: and with all thy getting get understanding.	0.0	neutral	Sabiduría ante todo: adquiere sabiduría: Y ante toda tu posesión adquiere inteligencia.
PRO.4.8	4	8	Exalt her, and she shall promote thee: she shall bring thee to honour, when thou dost embrace her.	0.0	neutral	Engrandécela, y ella te engrandecerá: Ella te honrará, cuando tú la hubieres abrazado.
PRO.4.9	4	9	She shall give to thine head an ornament of grace: a crown of glory shall she deliver to thee. {a crown...: or, she shall compass thee with a crown of glory}	0.0	neutral	Adorno de gracia dará á tu cabeza: Corona de hermosura te entregará.
PRO.4.10	4	10	Hear, O my son, and receive my sayings; and the years of thy life shall be many.	0.5	positive	Oye, hijo mío, y recibe mis razones; Y se te multiplicarán años de vida.
PRO.4.11	4	11	I have taught thee in the way of wisdom; I have led thee in right paths.	0.2857	positive	Por el camino de la sabiduría te he encaminado, Y por veredas derechas te he hecho andar.
PRO.4.12	4	12	When thou goest, thy steps shall not be straitened; and when thou runnest, thou shalt not stumble.	0.025	neutral	Cuando anduvieres no se estrecharán tus pasos; Y si corrieres, no tropezarás.
PRO.4.13	4	13	Take fast hold of instruction; let {her} not go: keep her; for she {is} thy life.	0.2	positive	Ten el consejo, no lo dejes; Guárdalo, porque eso es tu vida.
PRO.4.14	4	14	Enter not into the path of the wicked, and go not in the way of evil {men}.	-1.0	negative	No entres por la vereda de los impíos, Ni vayas por el camino de los malos.
PRO.4.15	4	15	Avoid it, pass not by it, turn from it, and pass away.	0.0	neutral	Desampárala, no pases por ella; Apártate de ella, pasa.
PRO.4.16	4	16	For they sleep not, except they have done mischief; and their sleep is taken away, unless they cause {some} to fall.	0.0	neutral	Porque no duermen ellos, si no hicieren mal; Y pierden su sueño, si no han hecho caer.
PRO.4.17	4	17	For they eat the bread of wickedness, and drink the wine of violence.	0.0	neutral	Porque comen pan de maldad, y beben vino de robos.
PRO.4.18	4	18	But the path of the just {is} as the shining light, that shineth more and more unto the perfect day.	0.6	positive	Mas la senda de los justos es como la luz de la aurora, Que va en aumento hasta que el día es perfecto.
PRO.4.19	4	19	The way of the wicked {is} as darkness: they know not at what they stumble.	-0.05	neutral	El camino de los impíos es como la oscuridad: No saben en qué tropiezan.
PRO.4.20	4	20	My son, attend to my words; incline thine ear unto my sayings.	0.0	neutral	Hijo mío, está atento á mis palabras; Inclina tu oído á mis razones.
PRO.4.21	4	21	Let them not depart from thine eyes; keep them in the midst of thine heart.	0.0	neutral	No se aparten de tus ojos; Guárdalas en medio de tu corazón.
PRO.4.22	4	22	For they {are} life unto those that find them, and health to all their flesh. {health: Heb. medicine}	0.0	neutral	Porque son vida á los que las hallan, Y medicina á toda su carne.
PRO.4.23	4	23	Keep thy heart with all diligence; for out of it {are} the issues of life. {with...: Heb. above all keeping}	0.0	neutral	Sobre toda cosa guardada guarda tu corazón; Porque de él mana la vida.
PRO.4.24	4	24	Put away from thee a froward mouth, and perverse lips put far from thee. {a froward...: Heb. frowardness of mouth and perverseness of lips}	0.1	neutral	Aparta de ti la perversidad de la boca, Y aleja de ti la iniquidad de labios.
PRO.4.25	4	25	Let thine eyes look right on, and let thine eyelids look straight before thee.	0.2429	positive	Tus ojos miren lo recto, Y tus párpados en derechura delante de ti.
PRO.4.26	4	26	Ponder the path of thy feet, and let all thy ways be established. {let...: or, all thy ways shall be ordered aright}	0.0	neutral	Examina la senda de tus pies, Y todos tus caminos sean ordenados.
PRO.4.27	4	27	Turn not to the right hand nor to the left: remove thy foot from evil.	-0.2381	negative	No te apartes á diestra, ni á siniestra: Aparta tu pie del mal.
PRO.5.1	5	1	My son, attend unto my wisdom, {and} bow thine ear to my understanding:	0.0	neutral	HIJO mío, está atento á mi sabiduría, Y á mi inteligencia inclina tu oído;
PRO.5.2	5	2	That thou mayest regard discretion, and {that} thy lips may keep knowledge.	0.0	neutral	Para que guardes consejo, Y tus labios conserven la ciencia.
PRO.5.3	5	3	For the lips of a strange woman drop {as} an honeycomb, and her mouth {is} smoother than oil: {mouth: Heb. palate}	-0.4	negative	Porque los labios de la extraña destilan miel, Y su paladar es más blando que el aceite;
PRO.5.4	5	4	But her end is bitter as wormwood, sharp as a twoedged sword.	-0.1125	negative	Mas su fin es amargo como el ajenjo, Agudo como cuchillo de dos filos.
PRO.5.5	5	5	Her feet go down to death; her steps take hold on hell.	-0.1556	negative	Sus pies descienden á la muerte; Sus pasos sustentan el sepulcro:
PRO.5.6	5	6	Lest thou shouldest ponder the path of life, her ways are moveable, {that} thou canst not know {them}.	0.0	neutral	Sus caminos son instables; no los conocerás, Si no considerares el camino de vida.
PRO.5.7	5	7	Hear me now therefore, O ye children, and depart not from the words of my mouth.	0.0	neutral	Ahora pues, hijos, oidme, Y no os apartéis de las razones de mi boca.
PRO.5.8	5	8	Remove thy way far from her, and come not nigh the door of her house:	0.1	neutral	Aleja de ella tu camino, Y no te acerques á la puerta de su casa;
PRO.5.9	5	9	Lest thou give thine honour unto others, and thy years unto the cruel:	-1.0	negative	Porque no des á los extraños tu honor, Y tus años á cruel;
PRO.5.10	5	10	Lest strangers be filled with thy wealth; and thy labours {be} in the house of a stranger; {thy wealth: Heb. thy strength}	0.4	positive	Porque no se harten los extraños de tu fuerza, Y tus trabajos estén en casa del extraño;
PRO.5.11	5	11	And thou mourn at the last, when thy flesh and thy body are consumed,	0.0	neutral	Y gimas en tus postrimerías, Cuando se consumiere tu carne y tu cuerpo,
PRO.5.12	5	12	And say, How have I hated instruction, and my heart despised reproof;	-0.9	negative	Y digas: ¡Cómo aborrecí el consejo, Y mi corazón menospreció la reprensión;
PRO.5.13	5	13	And have not obeyed the voice of my teachers, nor inclined mine ear to them that instructed me!	0.0	neutral	Y no oí la voz de los que me adoctrinaban, Y á los que me enseñaban no incliné mi oído!
PRO.5.14	5	14	I was almost in all evil in the midst of the congregation and assembly.	-1.0	negative	Casi en todo mal he estado, En medio de la sociedad y de la congregación.
PRO.5.15	5	15	Drink waters out of thine own cistern, and running waters out of thine own well.	0.6	positive	Bebe el agua de tu cisterna, Y los raudales de tu pozo.
PRO.5.16	5	16	Let thy fountains be dispersed abroad, {and} rivers of waters in the streets.	0.0	neutral	Derrámense por de fuera tus fuentes, En las plazas los ríos de aguas.
PRO.5.17	5	17	Let them be only thine own, and not strangers' with thee.	0.3	positive	Sean para ti solo, Y no para los extraños contigo.
