verse_id	chapter	verse	text_en	polarity_en	label_en	text_es
PRO.29.11	29	11	A fool uttereth all his mind: but a wise {man} keepeth it in till afterwards.	0.7	positive	El necio da suelta á todo su espíritu; Mas el sabio al fin le sosiega.
PRO.29.12	29	12	If a ruler hearken to lies, all his servants {are} wicked.	0.0	neutral	Del señor que escucha la palabra mentirosa, Todos sus ministros son impíos.
PRO.29.13	29	13	The poor and the deceitful man meet together: the LORD lighteneth both their eyes. {the deceitful...: or, the usurer}	-0.4	negative	El pobre y el usurero se encontraron: Jehová alumbra los ojos de ambos.
PRO.29.14	29	14	The king that faithfully judgeth the poor, his throne shall be established for ever.	-0.4	negative	El rey que juzga con verdad á los pobres, Su trono será firme para siempre.
PRO.29.15	29	15	The rod and reproof give wisdom: but a child left {to himself} bringeth his mother to shame.	0.0	neutral	La vara y la corrección dan sabiduría: Mas el muchacho consentido avergonzará á su madre.
PRO.29.16	29	16	When the wicked are multiplied, transgression increaseth: but the righteous shall see their fall.	0.0	neutral	Cuando los impíos son muchos, mucha es la prevaricación; Mas los justos verán la ruina de ellos.
PRO.29.17	29	17	Correct thy son, and he shall give thee rest; yea, he shall give delight unto thy soul.	0.0	neutral	Corrige á tu hijo, y te dará descanso, Y dará deleite á tu alma.
PRO.29.18	29	18	Where {there is} no vision, the people perish: but he that keepeth the law, happy {is} he. {perish: or, is made naked}	0.4	positive	Sin profecía el pueblo será disipado: Mas el que guarda la ley, bienaventurado él.
PRO.29.19	29	19	A servant will not be corrected by words: for though he understand he will not answer.	0.0	neutral	El siervo no se corregirá con palabras: Porque entiende, mas no corresponde.
PRO.29.20	29	20	Seest thou a man {that is} hasty in his words? {there is} more hope of a fool than of him. {words: or, matters?}	0.5	positive	¿Has visto hombre ligero en sus palabras? Más esperanza hay del necio que de él.
PRO.29.21	29	21	He that delicately bringeth up his servant from a child shall have him become {his} son at the length.	-0.3	negative	El que regala á su siervo desde su niñez, A la postre será su hijo:
PRO.29.22	29	22	An angry man stirreth up strife, and a furious man aboundeth in transgression.	-0.5	negative	El hombre iracundo levanta contiendas; Y el furioso muchas veces peca.
PRO.29.23	29	23	A man's pride shall bring him low: but honour shall uphold the humble in spirit.	-0.1	neutral	La soberbia del hombre le abate; Pero al humilde de espíritu sustenta la honra.
PRO.29.24	29	24	Whoso is partner with a thief hateth his own soul: he heareth cursing, and bewrayeth {it} not.	0.6	positive	El aparcero del ladrón aborrece su vida; Oirá maldiciones, y no lo denunciará.
PRO.29.25	29	25	The fear of man bringeth a snare: but whoso putteth his trust in the LORD shall be safe. {safe: Heb. set on high}	0.3867	positive	El temor del hombre pondrá lazo: Mas el que confía en Jehová será levantado.
PRO.29.26	29	26	Many seek the ruler's favour; but {every} man's judgment {cometh} from the LORD. {the ruler's...: Heb. the face of a ruler}	0.5	positive	Muchos buscan el favor del príncipe: Mas de Jehová viene el juicio de cada uno.
PRO.29.27	29	27	An unjust man {is} an abomination to the just: and {he that is} upright in the way {is} abomination to the wicked.	0.0	neutral	Abominación es á los justos el hombre inicuo; Y abominación es al impío el de rectos caminos.
PRO.30.1	30	1	The words of Agur the son of Jakeh, {even} the prophecy: the man spake unto Ithiel, even unto Ithiel and Ucal,	0.0	neutral	PALABRAS de Agur, hijo de Jachê: La profecía que dijo el varón á Ithiel, á Ithiel y á Ucal.
PRO.30.2	30	2	Surely I {am} more brutish than {any} man, and have not the understanding of a man.	0.5	positive	Ciertamente más rudo soy yo que ninguno, Ni tengo entendimiento de hombre.
PRO.30.3	30	3	I neither learned wisdom, nor have the knowledge of the holy. {have: Heb. know}	0.0	neutral	Yo ni aprendí sabiduría, Ni conozco la ciencia del Santo.
PRO.30.4	30	4	Who hath ascended up into heaven, or descended? who hath gathered the wind in his fists? who hath bound the waters in a garment? who hath established all the ends of the earth? what {is} his name, and what {is} his son's name, if thou canst tell?	0.0	neutral	¿Quién subió al cielo, y descendió? ¿Quién encerró los vientos en sus puños? ¿Quién ató las aguas en un paño? ¿Quién afirmó todos los términos de la tierra? ¿Cuál es su nombre, y el nombre de su hijo, si sabes?
PRO.30.5	30	5	Every word of God {is} pure: he {is} a shield unto them that put their trust in him. {pure: Heb. purified}	0.2143	positive	Toda palabra de Dios es limpia: Es escudo á los que en él esperan.
PRO.30.6	30	6	Add thou not unto his words, lest he reprove thee, and thou be found a liar.	0.0	neutral	No añadas á sus palabras, porque no te reprenda, Y seas hallado mentiroso.
PRO.30.7	30	7	Two {things} have I required of thee; deny me {them} not before I die: {deny...: Heb. withhold not from me}	-0.75	negative	Dos cosas te he demandado; No me las niegues antes que muera.
PRO.30.8	30	8	Remove far from me vanity and lies: give me neither poverty nor riches; feed me with food convenient for me: {convenient...: Heb. of my allowance}	-0.325	negative	Vanidad y palabra mentirosa aparta de mí. No me des pobreza ni riquezas; Manténme del pan que he menester;
PRO.30.9	30	9	Lest I be full, and deny {thee}, and say, Who {is} the LORD? or lest I be poor, and steal, and take the name of my God {in vain}. {deny...: Heb. belie thee}	-0.025	neutral	No sea que me harte, y te niegue, y diga, ¿Quién es Jehová? O no sea que siendo pobre, hurte, Y blasfeme el nombre de mi Dios.
PRO.30.10	30	10	Accuse not a servant unto his master, lest he curse thee, and thou be found guilty. {Accuse...: Heb. Hurt not with thy tongue}	-0.5	negative	No acuses al siervo ante su señor, Porque no te maldiga, y peques.
PRO.30.11	30	11	{There is} a generation {that} curseth their father, and doth not bless their mother.	0.0	neutral	Hay generación que maldice á su padre, Y á su madre no bendice.
PRO.30.12	30	12	{There is} a generation {that are} pure in their own eyes, and {yet} is not washed from their filthiness.	0.4071	positive	Hay generación limpia en su opinión, Si bien no se ha limpiado su inmundicia.
PRO.30.13	30	13	{There is} a generation, O how lofty are their eyes! and their eyelids are lifted up.	0.0	neutral	Hay generación cuyos ojos son altivos, Y cuyos párpados son alzados.
PRO.30.14	30	14	{There is} a generation, whose teeth {are as} swords, and their jaw teeth {as} knives, to devour the poor from off the earth, and the needy from {among} men.	-0.4	negative	Hay generación cuyos dientes son espadas, y sus muelas cuchillos, Para devorar á los pobres de la tierra, y de entre los hombres á los menesterosos.
PRO.30.15	30	15	The horseleach hath two daughters, {crying}, Give, give. There are three {things that} are never satisfied, {yea}, four {things} say not, {It is} enough: {It is...: Heb. Wealth}	-0.3	negative	La sanguijuela tiene dos hijas que se llaman, Trae, trae. Tres cosas hay que nunca se hartan; Aun la cuarta nunca dice, Basta:
PRO.30.16	30	16	The grave; and the barren womb; the earth {that} is not filled with water; and the fire {that} saith not, {It is} enough.	-0.1	neutral	El sepulcro, y la matriz estéril, La tierra no harta de aguas, Y el fuego que jamás dice, Basta.
PRO.30.17	30	17	The eye {that} mocketh at {his} father, and despiseth to obey {his} mother, the ravens of the valley shall pick it out, and the young eagles shall eat it. {the valley: or, the brook}	0.1	neutral	El ojo que escarnece á su padre, Y menosprecia la enseñanza de la madre, Los cuervos lo saquen de la arroyada, Y tráguenlo los hijos del águila.
PRO.30.18	30	18	There be three {things which} are too wonderful for me, yea, four which I know not:	1.0	positive	Tres cosas me son ocultas; Aun tampoco sé la cuarta:
PRO.30.19	30	19	The way of an eagle in the air; the way of a serpent upon a rock; the way of a ship in the midst of the sea; and the way of a man with a maid. {midst: Heb. heart}	0.0	neutral	El rastro del águila en el aire; El rastro de la culebra sobre la peña; El rastro de la nave en medio de la mar; Y el rastro del hombre en la moza.
PRO.30.20	30	20	Such {is} the way of an adulterous woman; she eateth, and wipeth her mouth, and saith, I have done no wickedness.	0.0	neutral	Tal es el rastro de la mujer adúltera: Come, y limpia su boca, Y dice: No he hecho maldad.
PRO.30.21	30	21	For three {things} the earth is disquieted, and for four {which} it cannot bear:	0.0	neutral	Por tres cosas se alborota la tierra, Y la cuarta no puede sufrir:
PRO.30.22	30	22	For a servant when he reigneth; and a fool when he is filled with meat;	0.4	positive	Por el siervo cuando reinare; Y por el necio cuando se hartare de pan;
PRO.30.23	30	23	For an odious {woman} when she is married; and an handmaid that is heir to her mistress.	0.25	positive	Por la aborrecida cuando se casare; Y por la sierva cuando heredare á su señora.
PRO.30.24	30	24	There be four {things which are} little upon the earth, but they {are} exceeding wise: {exceeding...: Heb. wise, made wise}	0.2325	positive	Cuatro cosas son de las más pequeñas de la tierra, Y las mismas son más sabias que los sabios:
PRO.30.25	30	25	The ants {are} a people not strong, yet they prepare their meat in the summer;	-0.2167	negative	Las hormigas, pueblo no fuerte, Y en el verano preparan su comida;
PRO.30.26	30	26	The conies {are but} a feeble folk, yet make they their houses in the rocks;	-0.5	negative	Los conejos, pueblo nada esforzado, Y ponen su casa en la piedra;
PRO.30.27	30	27	The locusts have no king, yet go they forth all of them by bands; {by...: Heb. gathered together}	0.0	neutral	Las langostas, no tienen rey, Y salen todas acuadrilladas;
PRO.30.28	30	28	The spider taketh hold with her hands, and is in kings' palaces.	0.0	neutral	La araña, ase con las manos, Y está en palacios de rey.
PRO.30.29	30	29	There be three {things} which go well, yea, four are comely in going:	0.0	neutral	Tres cosas hay de hermoso andar, Y la cuarta pasea muy bien:
PRO.30.30	30	30	A lion {which is} strongest among beasts, and turneth not away for any;	0.0	neutral	El león, fuerte entre todos los animales, Que no torna atrás por nadie;
PRO.30.31	30	31	A greyhound; an he goat also; and a king, against whom {there is} no rising up. {greyhound: or, horse: Heb. girt in the loins}	0.0	neutral	El lebrel ceñido de lomos; asimismo el macho cabrío; Y un rey contra el cual ninguno se levanta.
PRO.30.32	30	32	If thou hast done foolishly in lifting up thyself, or if thou hast thought evil, {lay} thine hand upon thy mouth.	-1.0	negative	Si caiste, fué porque te enalteciste; Y si mal pensaste, Pon el dedo sobre la boca.
PRO.30.33	30	33	Surely the churning of milk bringeth forth butter, and the wringing of the nose bringeth forth blood: so the forcing of wrath bringeth forth strife.	0.0	neutral	Ciertamente el que exprime la leche, sacará manteca; Y el que recio se suena las narices, sacará sangre: Y el que provoca la ira, causará contienda.
PRO.31.1	31	1	The words of king Lemuel, the prophecy that his mother taught him.	0.0	neutral	PALABRAS del rey Lemuel; la profecía con que le enseñó su madre.
PRO.31.2	31	2	What, my son? and what, the son of my womb? and what, the son of my vows?	0.0	neutral	¿Qué, hijo mío? ¿y qué, hijo de mi vientre? ¿Y qué, hijo de mis deseos?
PRO.31.3	31	3	Give not thy strength unto women, nor thy ways to that which destroyeth kings.	0.0	neutral	No des á las mujeres tu fuerza, Ni tus caminos á lo que es para destruir los reyes.
PRO.31.4	31	4	{It is} not for kings, O Lemuel, {it is} not for kings to drink wine; nor for princes strong drink:	0.4333	positive	No es de los reyes, oh Lemuel, no es de los reyes beber vino, Ni de los príncipes la cerveza.
PRO.31.5	31	5	Lest they drink, and forget the law, and pervert the judgment of any of the afflicted. {prevert: Heb. alter} {of any...: Heb. of all the sons of affliction}	0.0	neutral	No sea que bebiendo olviden la ley, Y perviertan el derecho de todos los hijos afligidos.
PRO.31.6	31	6	Give strong drink unto him that is ready to perish, and wine unto those that be of heavy hearts. {of...: Heb. bitter of soul}	0.0833	neutral	Dad la cerveza al desfallecido, Y el vino á los de amargo ánimo:
PRO.31.7	31	7	Let him drink, and forget his poverty, and remember his misery no more.	-0.25	negative	Beban, y olvídense de su necesidad, Y de su miseria no más se acuerden.
PRO.31.8	31	8	Open thy mouth for the dumb in the cause of all such as are appointed to destruction. {such...: Heb. the sons of destruction}	-0.0938	neutral	Abre tu boca por el mudo, En el juicio de todos los hijos de muerte.
PRO.31.9	31	9	Open thy mouth, judge righteously, and plead the cause of the poor and needy.	-0.2	negative	Abre tu boca, juzga justicia, Y el derecho del pobre y del menesteroso.
PRO.31.10	31	10	Who can find a virtuous woman? for her price {is} far above rubies.	0.05	neutral	Mujer fuerte, ¿quién la hallará? Porque su estima sobrepuja largamente á la de piedras preciosas.
PRO.31.11	31	11	The heart of her husband doth safely trust in her, so that he shall have no need of spoil.	0.5	positive	El corazón de su marido está en ella confiado, Y no tendrá necesidad de despojo.
PRO.31.12	31	12	She will do him good and not evil all the days of her life.	0.6	positive	Darále ella bien y no mal, Todos los días de su vida.
PRO.31.13	31	13	She seeketh wool, and flax, and worketh willingly with her hands.	0.25	positive	Buscó lana y lino, Y con voluntad labró de sus manos.
PRO.31.14	31	14	She is like the merchants' ships; she bringeth her food from afar.	0.0	neutral	Fué como navío de mercader: Trae su pan de lejos.
PRO.31.15	31	15	She riseth also while it is yet night, and giveth meat to her household, and a portion to her maidens.	0.0	neutral	Levantóse aun de noche, Y dió comida á su familia, Y ración á sus criadas.
PRO.31.16	31	16	She considereth a field, and buyeth it: with the fruit of her hands she planteth a vineyard. {buyeth: Heb. taketh}	0.0	neutral	Consideró la heredad, y compróla; Y plantó viña del fruto de sus manos.
