verse_id	chapter	verse	text_en	polarity_en	label_en	text_es
PRO.10.8	10	8	The wise in heart will receive commandments: but a prating fool shall fall. {a prating...: Heb. a fool of lips} {fall: Heb. be beaten}	0.7	positive	El sabio de corazón recibirá los mandamientos: Mas el loco de labios caerá.
PRO.10.9	10	9	He that walketh uprightly walketh surely: but he that perverteth his ways shall be known.	0.5	positive	El que camina en integridad, anda confiado: Mas el que pervierte sus caminos, será quebrantado.
PRO.10.10	10	10	He that winketh with the eye causeth sorrow: but a prating fool shall fall. {fall: Heb. be beaten}	0.0	neutral	El que guiña del ojo acarrea tristeza; Y el loco de labios será castigado.
PRO.10.11	10	11	The mouth of a righteous {man is} a well of life: but violence covereth the mouth of the wicked.	0.0	neutral	Vena de vida es la boca del justo: Mas violencia cubrirá la boca de los impíos.
PRO.10.12	10	12	Hatred stirreth up strifes: but love covereth all sins.	0.5	positive	El odio despierta rencillas: Mas la caridad cubrirá todas las faltas.
PRO.10.13	10	13	In the lips of him that hath understanding wisdom is found: but a rod {is} for the back of him that is void of understanding. {of understanding: Heb. of heart}	0.0	neutral	En los labios del prudente se halla sabiduría: Y vara á las espaldas del falto de cordura.
PRO.10.14	10	14	Wise {men} lay up knowledge: but the mouth of the foolish {is} near destruction.	0.4	positive	Los sabios guardan la sabiduría: Mas la boca del loco es calamidad cercana.
PRO.10.15	10	15	The rich man's wealth {is} his strong city: the destruction of the poor {is} their poverty.	0.1361	positive	Las riquezas del rico son su ciudad fuerte; Y el desmayo de los pobres es su pobreza.
PRO.10.16	10	16	The labour of the righteous {tendeth} to life: the fruit of the wicked to sin.	0.0	neutral	La obra del justo es para vida; Mas el fruto del impío es para pecado.
PRO.10.17	10	17	He {is in} the way of life that keepeth instruction: but he that refuseth reproof erreth. {erreth: or, causeth to err}	0.0	neutral	Camino á la vida es guardar la corrección: Mas el que deja la reprensión, yerra.
PRO.10.18	10	18	He that hideth hatred {with} lying lips, and he that uttereth a slander, {is} a fool.	0.0	neutral	El que encubre el odio es de labios mentirosos; Y el que echa mala fama es necio.
PRO.10.19	10	19	In the multitude of words there wanteth not sin: but he that refraineth his lips {is} wise.	0.7	positive	En las muchas palabras no falta pecado: Mas el que refrena sus labios es prudente.
PRO.10.20	10	20	The tongue of the just {is as} choice silver: the heart of the wicked {is} little worth.	0.0562	neutral	Plata escogida es la lengua del justo: Mas el entendimiento de los impíos es como nada.
PRO.10.21	10	21	The lips of the righteous feed many: but fools die for want of wisdom. {of wisdom: Heb. of heart}	0.5	positive	Los labios del justo apacientan á muchos: Mas los necios por falta de entendimiento mueren.
PRO.10.22	10	22	The blessing of the LORD, it maketh rich, and he addeth no sorrow with it.	0.375	positive	La bendición de Jehová es la que enriquece, Y no añade tristeza con ella.
PRO.10.23	10	23	{It is} as sport to a fool to do mischief: but a man of understanding hath wisdom.	0.0	neutral	Hacer abominación es como risa al insensato: Mas el hombre entendido sabe.
PRO.10.24	10	24	The fear of the wicked, it shall come upon him: but the desire of the righteous shall be granted.	0.0	neutral	Lo que el impío teme, eso le vendrá: Mas á los justos les será dado lo que desean.
PRO.10.25	10	25	As the whirlwind passeth, so {is} the wicked no {more}: but the righteous {is} an everlasting foundation.	-0.25	negative	Como pasa el torbellino, así el malo no permanece: Mas el justo, fundado para siempre.
PRO.10.26	10	26	As vinegar to the teeth, and as smoke to the eyes, so {is} the sluggard to them that send him.	0.0	neutral	Como el vinagre á los dientes, y como el humo á los ojos, Así es el perezoso á los que lo envían.
PRO.10.27	10	27	The fear of the LORD prolongeth days: but the years of the wicked shall be shortened. {prolongeth: Heb. addeth}	0.0	neutral	El temor de Jehová aumentará los días: Mas los años de los impíos serán acortados.
PRO.10.28	10	28	The hope of the righteous {shall be} gladness: but the expectation of the wicked shall perish.	0.0	neutral	La esperanza de los justos es alegría; Mas la esperanza de los impíos perecerá.
PRO.10.29	10	29	The way of the LORD {is} strength to the upright: but destruction {shall be} to the workers of iniquity.	0.0	neutral	Fortaleza es al perfecto el camino de Jehová: Mas espanto es á los que obran maldad.
PRO.10.30	10	30	The righteous shall never be removed: but the wicked shall not inhabit the earth.	0.0	neutral	El justo eternalmente no será removido: Mas los impíos no habitarán la tierra.
PRO.10.31	10	31	The mouth of the just bringeth forth wisdom: but the froward tongue shall be cut out.	0.0	neutral	La boca del justo producirá sabiduría: Mas la lengua perversa será cortada.
PRO.10.32	10	32	The lips of the righteous know what is acceptable: but the mouth of the wicked {speaketh} frowardness. {frowardness: Heb. frowardnesses}	0.0	neutral	Los labios del justo conocerán lo que agrada: Mas la boca de los impíos habla perversidades.
PRO.11.1	11	1	A false balance {is} abomination to the LORD: but a just weight {is} his delight. {A false...: Heb. Balances of deceit} {just...: Heb. perfect stone}	0.0667	neutral	EL peso falso abominación es á Jehová: Mas la pesa cabal le agrada.
PRO.11.2	11	2	{When} pride cometh, then cometh shame: but with the lowly {is} wisdom.	0.0	neutral	Cuando viene la soberbia, viene también la deshonra: Mas con los humildes es la sabiduría.
PRO.11.3	11	3	The integrity of the upright shall guide them: but the perverseness of transgressors shall destroy them.	-0.2	negative	La integridad de los rectos los encaminará: Mas destruirá á los pecadores la perversidad de ellos.
PRO.11.4	11	4	Riches profit not in the day of wrath: but righteousness delivereth from death.	0.0	neutral	No aprovecharán las riquezas en el día de la ira: Mas la justicia librará de muerte.
PRO.11.5	11	5	The righteousness of the perfect shall direct his way: but the wicked shall fall by his own wickedness. {direct: Heb. rectify}	0.45	positive	La justicia del perfecto enderezará su camino: mas el impío por su impiedad caerá.
PRO.11.6	11	6	The righteousness of the upright shall deliver them: but transgressors shall be taken in {their own} naughtiness.	0.6	positive	La justicia de los rectos los librará: Mas los pecadores en su pecado serán presos.
PRO.11.7	11	7	When a wicked man dieth, {his} expectation shall perish: and the hope of unjust {men} perisheth.	0.0	neutral	Cuando muere el hombre impío, perece su esperanza; Y la espectativa de los malos perecerá.
PRO.11.8	11	8	The righteous is delivered out of trouble, and the wicked cometh in his stead.	-0.2	negative	El justo es librado de la tribulación: Mas el impío viene en lugar suyo.
PRO.11.9	11	9	An hypocrite with {his} mouth destroyeth his neighbour: but through knowledge shall the just be delivered.	0.0	neutral	El hipócrita con la boca daña á su prójimo: Mas los justos son librados con la sabiduría.
PRO.11.10	11	10	When it goeth well with the righteous, the city rejoiceth: and when the wicked perish, {there is} shouting.	0.0	neutral	En el bien de los justos la ciudad se alegra: Mas cuando los impíos perecen, hay fiestas.
PRO.11.11	11	11	By the blessing of the upright the city is exalted: but it is overthrown by the mouth of the wicked.	0.0	neutral	Por la bendición de los rectos la ciudad será engrandecida: Mas por la boca de los impíos ella será trastornada.
PRO.11.12	11	12	He that is void of wisdom despiseth his neighbour: but a man of understanding holdeth his peace. {void...: Heb. destitute of heart}	0.0	neutral	El que carece de entendimiento, menosprecia á su prójimo: Mas el hombre prudente calla.
