verse_id	chapter	verse	text_en	polarity_en	label_en	text_es
PRO.25.8	25	8	Go not forth hastily to strive, lest {thou know not} what to do in the end thereof, when thy neighbour hath put thee to shame.	0.0	neutral	No salgas á pleito presto, No sea que no sepas qué hacer al fin, Después que tu prójimo te haya dejado confuso.
PRO.25.9	25	9	Debate thy cause with thy neighbour {himself}; and discover not a secret to another: {a secret...: or, the secret of}	-0.3375	negative	Trata tu causa con tu compañero Y no descubras el secreto á otro.
PRO.25.10	25	10	Lest he that heareth {it} put thee to shame, and thine infamy turn not away.	0.0	neutral	No sea que te deshonre el que lo oyere, Y tu infamia no pueda repararse.
PRO.25.11	25	11	A word fitly spoken {is like} apples of gold in pictures of silver. {fitly...: Heb. spoken upon his wheels}	0.4	positive	Manzana de oro con figuras de plata Es la palabra dicha como conviene.
PRO.25.12	25	12	{As} an earring of gold, and an ornament of fine gold, {so is} a wise reprover upon an obedient ear.	0.5056	positive	Como zarcillo de oro y joyel de oro fino, Es el que reprende al sabio que tiene oído dócil.
PRO.25.13	25	13	As the cold of snow in the time of harvest, {so is} a faithful messenger to them that send him: for he refresheth the soul of his masters.	-0.6	negative	Como frío de nieve en tiempo de la siega, Así es el mensajero fiel á los que lo envían: Pues al alma de su señor da refrigerio.
PRO.25.14	25	14	Whoso boasteth himself of a false gift {is like} clouds and wind without rain. {of a...: Heb. in a gift of falsehood}	-0.4	negative	Como nubes y vientos sin lluvia, Así es el hombre que se jacta de vana liberalidad.
PRO.25.15	25	15	By long forbearing is a prince persuaded, and a soft tongue breaketh the bone.	0.025	neutral	Con larga paciencia se aplaca el príncipe; Y la lengua blanda quebranta los huesos.
PRO.25.16	25	16	Hast thou found honey? eat so much as is sufficient for thee, lest thou be filled therewith, and vomit it.	0.3	positive	¿Hallaste la miel? come lo que te basta; No sea que te hartes de ella, y la vomites.
PRO.25.17	25	17	Withdraw thy foot from thy neighbour's house; lest he be weary of thee, and {so} hate thee. {Withdraw...: or, Let thy foot be seldom in} {weary...: Heb. full of thee}	-0.225	negative	Detén tu pie de la casa de tu vecino, Porque harto de ti no te aborrezca.
PRO.25.18	25	18	A man that beareth false witness against his neighbour {is} a maul, and a sword, and a sharp arrow.	-0.2625	negative	Martillo y cuchillo y saeta aguda, Es el hombre que habla contra su prójimo falso testimonio.
PRO.25.19	25	19	Confidence in an unfaithful man in time of trouble {is like} a broken tooth, and a foot out of joint.	-0.4	negative	Diente quebrado y pie resbalador, Es la confianza en el prevaricador en tiempo de angustia.
PRO.25.20	25	20	{As} he that taketh away a garment in cold weather, {and as} vinegar upon nitre, so {is} he that singeth songs to an heavy heart.	-0.4	negative	El que canta canciones al corazón afligido, Es como el que quita la ropa en tiempo de frío, ó el que sobre el jabón echa vinagre.
PRO.25.21	25	21	If thine enemy be hungry, give him bread to eat; and if he be thirsty, give him water to drink:	0.0	neutral	Si el que te aborrece tuviere hambre, dale de comer pan; Y si tuviere sed, dale de beber agua:
PRO.25.22	25	22	For thou shalt heap coals of fire upon his head, and the LORD shall reward thee.	0.0	neutral	Porque ascuas allegas sobre su cabeza, Y Jehová te lo pagará.
PRO.25.23	25	23	The north wind driveth away rain: so {doth} an angry countenance a backbiting tongue. {driveth...: or, bringeth forth rain: so doth a backbiting tongue an angry countenance}	-0.5	negative	El viento del norte ahuyenta la lluvia, Y el rostro airado la lengua detractora.
PRO.25.24	25	24	{It is} better to dwell in the corner of the housetop, than with a brawling woman and in a wide house.	0.2	positive	Mejor es estar en un rincón de casa, Que con la mujer rencillosa en espaciosa casa.
PRO.25.25	25	25	{As} cold waters to a thirsty soul, so {is} good news from a far country.	0.0667	neutral	Como el agua fría al alma sedienta, Así son las buenas nuevas de lejanas tierras.
PRO.25.26	25	26	A righteous man falling down before the wicked {is as} a troubled fountain, and a corrupt spring.	-0.3852	negative	Como fuente turbia y manantial corrompido, Es el justo que cae delante del impío.
PRO.25.27	25	27	{It is} not good to eat much honey: so {for men} to search their own glory {is not} glory.	0.15	positive	Comer mucha miel no es bueno: Ni el buscar la propia gloria es gloria.
PRO.25.28	25	28	He that {hath} no rule over his own spirit {is like} a city {that is} broken down, {and} without walls.	0.0148	neutral	Como ciudad derribada y sin muro, Es el hombre cuyo espíritu no tiene rienda.
PRO.26.1	26	1	As snow in summer, and as rain in harvest, so honour is not seemly for a fool.	0.0	neutral	COMO la nieve en el verano, y la lluvia en la siega, Así conviene al necio la honra.
PRO.26.2	26	2	As the bird by wandering, as the swallow by flying, so the curse causeless shall not come.	0.0	neutral	Como el gorrión en su vagar, y como la golondrina en su vuelo, Así la maldición sin causa nunca vendrá.
PRO.26.3	26	3	A whip for the horse, a bridle for the ass, and a rod for the fool's back.	0.0	neutral	El látigo para el caballo, y el cabestro para el asno, Y la vara para la espalda del necio.
PRO.26.4	26	4	Answer not a fool according to his folly, lest thou also be like unto him.	0.0	neutral	Nunca respondas al necio en conformidad á su necedad, Para que no seas tú también como él.
PRO.26.5	26	5	Answer a fool according to his folly, lest he be wise in his own conceit. {conceit: Heb. eyes}	0.65	positive	Responde al necio según su necedad, Porque no se estime sabio en su opinión.
PRO.26.6	26	6	He that sendeth a message by the hand of a fool cutteth off the feet, {and} drinketh damage. {damage: or, violence}	0.0	neutral	Como el que se corta los pies y bebe su daño, Así es el que envía algo por mano de un necio.
PRO.26.7	26	7	The legs of the lame are not equal: so {is} a parable in the mouth of fools. {are...: Heb. are lifted up}	-0.25	negative	Alzar las piernas del cojo. Así es el proverbio en la boca del necio.
PRO.26.8	26	8	As he that bindeth a stone in a sling, so {is} he that giveth honour to a fool. {bindeth...: or, putteth a precious stone in an heap of stones}	0.5	positive	Como quien liga la piedra en la honda, Así hace el que al necio da honra.
PRO.26.9	26	9	{As} a thorn goeth up into the hand of a drunkard, so {is} a parable in the mouth of fools.	0.0	neutral	Espinas hincadas en mano del embriagado, Tal es el proverbio en la boca de los necios.
PRO.26.10	26	10	The great {God} that formed all {things} both rewardeth the fool, and rewardeth transgressors. {The great...: or, A great man grieveth all, and he hireth the fool, he hireth also transgressors}	0.8	positive	El grande cría todas las cosas; y da la paga al insensato, Y la da á los transgresores.
PRO.26.11	26	11	As a dog returneth to his vomit, {so} a fool returneth to his folly. {returneth to his folly: Heb. iterateth his folly}	0.0	neutral	Como perro que vuelve á su vómito, Así el necio que repite su necedad.
PRO.26.12	26	12	Seest thou a man wise in his own conceit? {there is} more hope of a fool than of him.	0.6	positive	¿Has visto hombre sabio en su opinión? Más esperanza hay del necio que de él.
PRO.26.13	26	13	The slothful {man} saith, {There is} a lion in the way; a lion {is} in the streets.	0.0	neutral	Dice el perezoso: El león está en el camino; El león está en las calles.
PRO.26.14	26	14	{As} the door turneth upon his hinges, so {doth} the slothful upon his bed.	0.0	neutral	Las puertas se revuelven en sus quicios: Así el perezoso en su cama.
PRO.26.15	26	15	The slothful hideth his hand in {his} bosom; it grieveth him to bring it again to his mouth. {it grieveth...: or, he is weary}	0.0	neutral	Esconde el perezoso su mano en el seno; Cánsase de tornarla á su boca.
PRO.26.16	26	16	The sluggard {is} wiser in his own conceit than seven men that can render a reason.	0.6	positive	A su ver es el perezoso más sabio Que siete que le den consejo.
PRO.26.17	26	17	He that passeth by, {and} meddleth with strife {belonging} not to him, {is like} one that taketh a dog by the ears. {meddleth: or, is enraged}	0.0	neutral	El que pasando se deja llevar de la ira en pleito ajeno, Es como el que toma al perro por las orejas.
PRO.26.18	26	18	As a mad {man} who casteth firebrands, arrows, and death, {firebrands: Heb. flames, or, sparks}	-0.625	negative	Como el que enloquece, y echa llamas Y saetas y muerte,
PRO.26.19	26	19	So {is} the man {that} deceiveth his neighbour, and saith, Am not I in sport?	0.0	neutral	Tal es el hombre que daña á su amigo, Y dice: Ciertamente me chanceaba.
PRO.26.20	26	20	Where no wood is, {there} the fire goeth out: so where {there is} no talebearer, the strife ceaseth. {Where no...: Heb. Without wood} {talebearer: or, whisperer} {ceaseth: Heb. is silent}	0.0	neutral	Sin leña se apaga el fuego: Y donde no hay chismoso, cesa la contienda.
PRO.26.21	26	21	{As} coals {are} to burning coals, and wood to fire; so {is} a contentious man to kindle strife.	0.0	neutral	El carbón para brasas, y la leña para el fuego: Y el hombre rencilloso para encender contienda.
PRO.26.22	26	22	The words of a talebearer {are} as wounds, and they go down into the innermost parts of the belly. {innermost...: Heb. chambers}	-0.1556	negative	Las palabras del chismoso parecen blandas; Mas ellas entran hasta lo secreto del vientre.
PRO.26.23	26	23	Burning lips and a wicked heart {are like} a potsherd covered with silver dross.	0.0	neutral	Como escoria de plata echada sobre el tiesto, Son los labios enardecidos y el corazón malo.
PRO.26.24	26	24	He that hateth dissembleth with his lips, and layeth up deceit within him; {dissembleth: or, is known}	0.0	neutral	Otro parece en los labios al que aborrece; Mas en su interior pone engaño.
PRO.26.25	26	25	When he speaketh fair, believe him not: for {there are} seven abominations in his heart. {speaketh...: Heb. maketh his voice gracious}	0.7	positive	Cuando hablare amigablemente, no le creas; Porque siete abominaciones hay en su corazón.
PRO.26.26	26	26	{Whose} hatred is covered by deceit, his wickedness shall be shewed before the {whole} congregation. {by...: or, in secret}	-0.1	neutral	Encúbrese el odio con disimulo; Mas su malicia será descubierta en la congregación.
PRO.26.27	26	27	Whoso diggeth a pit shall fall therein: and he that rolleth a stone, it will return upon him.	0.0	neutral	El que cavare sima, caerá en ella: Y el que revuelva la piedra, á él volverá.
PRO.26.28	26	28	A lying tongue hateth {those that are} afflicted by it; and a flattering mouth worketh ruin.	0.0	neutral	La falsa lengua atormenta al que aborrece: Y la boca lisonjera hace resbaladero.
PRO.27.1	27	1	Boast not thyself of to morrow; for thou knowest not what a day may bring forth. {to...: Heb. to morrow day}	0.0	neutral	NO te jactes del día de mañana; Porque no sabes qué dará de sí el día.
PRO.27.2	27	2	Let another man praise thee, and not thine own mouth; a stranger, and not thine own lips.	0.6	positive	Alábete el extraño, y no tu boca; El ajeno, y no tus labios.
PRO.27.3	27	3	A stone {is} heavy, and the sand weighty; but a fool's wrath {is} heavier than them both. {heavy: Heb. heaviness}	-0.2	negative	Pesada es la piedra, y la arena pesa; Mas la ira del necio es más pesada que ambas cosas.
PRO.27.4	27	4	Wrath {is} cruel, and anger {is} outrageous; but who {is} able to stand before envy? {Wrath...: Heb. Wrath is cruelty, and anger an overflowing} {envy: or, jealousy?}	-0.58	negative	Cruel es la ira, é impetuoso el furor; Mas ¿quién parará delante de la envidia?
PRO.27.5	27	5	Open rebuke {is} better than secret love.	0.15	positive	Mejor es reprensión manifiesta Que amor oculto.
PRO.27.6	27	6	Faithful {are} the wounds of a friend; but the kisses of an enemy {are} deceitful. {deceitful: or, earnest, or, frequent}	0.1	neutral	Fieles son las heridas del que ama; Pero importunos los besos del que aborrece.
PRO.27.7	27	7	The full soul loatheth an honeycomb; but to the hungry soul every bitter thing is sweet. {loatheth: Heb. treadeth under foot}	0.2	positive	El alma harta huella el panal de miel; Mas al alma hambrienta todo lo amargo es dulce.
PRO.27.8	27	8	As a bird that wandereth from her nest, so {is} a man that wandereth from his place.	0.0	neutral	Cual ave que se va de su nido, Tal es el hombre que se va de su lugar.
PRO.27.9	27	9	Ointment and perfume rejoice the heart: so {doth} the sweetness of a man's friend by hearty counsel. {by...: Heb. from the counsel of the soul}	0.0	neutral	El ungüento y el perfume alegran el corazón: Y el amigo al hombre con el cordial consejo.
PRO.27.10	27	10	Thine own friend, and thy father's friend, forsake not; neither go into thy brother's house in the day of thy calamity: {for} better {is} a neighbour {that is} near than a brother far off.	0.11	positive	No dejes á tu amigo, ni al amigo de tu padre; Ni entres en casa de tu hermano el día de tu aflicción. Mejor es el vecino cerca que el hermano lejano.
PRO.27.11	27	11	My son, be wise, and make my heart glad, that I may answer him that reproacheth me.	0.6	positive	Sé sabio, hijo mío, y alegra mi corazón, Y tendré qué responder al que me deshonrare.
PRO.27.12	27	12	A prudent {man} foreseeth the evil, {and} hideth himself; {but} the simple pass on, {and} are punished.	-0.5	negative	El avisado ve el mal, y escóndese, Mas los simples pasan, y llevan el daño.
PRO.27.13	27	13	Take his garment that is surety for a stranger, and take a pledge of him for a strange woman.	-0.05	neutral	Quítale su ropa al que fió al extraño; Y al que fió á la extraña, tómale prenda.
PRO.27.14	27	14	He that blesseth his friend with a loud voice, rising early in the morning, it shall be counted a curse to him.	0.1	neutral	El que bendice á su amigo en alta voz, madrugando de mañana, Por maldición se le contará.
PRO.27.15	27	15	A continual dropping in a very rainy day and a contentious woman are alike.	0.2	positive	Gotera continua en tiempo de lluvia, Y la mujer rencillosa, son semejantes:
PRO.27.16	27	16	Whosoever hideth her hideth the wind, and the ointment of his right hand, {which} bewrayeth {itself}.	0.2857	positive	El que pretende contenerla, arresta el viento: O el aceite en su mano derecha.
PRO.27.17	27	17	Iron sharpeneth iron; so a man sharpeneth the countenance of his friend.	0.0	neutral	Hierro con hierro se aguza; Y el hombre aguza el rostro de su amigo.
PRO.27.18	27	18	Whoso keepeth the fig tree shall eat the fruit thereof: so he that waiteth on his master shall be honoured.	0.0	neutral	El que guarda la higuera, comerá su fruto; Y el que guarda á su señor, será honrado.
PRO.27.19	27	19	As in water face {answereth} to face, so the heart of man to man.	0.0	neutral	Como un agua se parece á otra, Así el corazón del hombre al otro.
PRO.27.20	27	20	Hell and destruction are never full; so the eyes of man are never satisfied. {never: Heb. not}	-0.2125	negative	El sepulcro y la perdición nunca se hartan: Así los ojos del hombre nunca están satisfechos.
PRO.27.21	27	21	{As} the fining pot for silver, and the furnace for gold; so {is} a man to his praise.	0.0	neutral	El crisol prueba la plata, y la hornaza el oro: Y al hombre la boca del que lo alaba.
PRO.27.22	27	22	Though thou shouldest bray a fool in a mortar among wheat with a pestle, {yet} will not his foolishness depart from him.	0.0	neutral	Aunque majes al necio en un mortero entre granos de trigo á pisón majados, No se quitará de él su necedad.
PRO.27.23	27	23	Be thou diligent to know the state of thy flocks, {and} look well to thy herds. {look...: Heb. set thy heart}	0.0	neutral	Considera atentamente el aspecto de tus ovejas; Pon tu corazón á tus rebaños:
PRO.27.24	27	24	For riches {are} not for ever: and doth the crown {endure} to every generation? {riches: Heb. strength} {to...: Heb. to generation and generation?}	0.0	neutral	Porque las riquezas no son para siempre; ¿Y será la corona para perpetuas generaciones?
PRO.27.25	27	25	The hay appeareth, and the tender grass sheweth itself, and herbs of the mountains are gathered.	0.0	neutral	Saldrá la grama, aparecerá la hierba, Y segaránse las hierbas de los montes.
PRO.27.26	27	26	The lambs {are} for thy clothing, and the goats {are} the price of the field.	0.0	neutral	Los corderos para tus vestidos, Y los cabritos para el precio del campo:
PRO.27.27	27	27	And {thou shalt have} goats' milk enough for thy food, for the food of thy household, and {for} the maintenance for thy maidens. {maintenance: Heb. life}	0.0	neutral	Y abundancia de leche de las cabras para tu mantenimiento, y para mantenimiento de tu casa, Y para sustento de tus criadas.
PRO.28.1	28	1	The wicked flee when no man pursueth: but the righteous are bold as a lion.	0.3333	positive	HUYE el impío sin que nadie lo persiga: Mas el justo está confiado como un leoncillo.
PRO.28.2	28	2	For the transgression of a land many {are} the princes thereof: but by a man of understanding {and} knowledge the state {thereof} shall be prolonged. {by...: or, by men of understanding and wisdom shall they likewise be prolonged}	0.5	positive	Por la rebelión de la tierra sus príncipes son muchos: Mas por el hombre entendido y sabio permanecerá sin mutación.
PRO.28.3	28	3	A poor man that oppresseth the poor {is like} a sweeping rain which leaveth no food. {which...: Heb. without food}	-0.4	negative	El hombre pobre y robador de los pobres, Es lluvia de avenida y sin pan.
PRO.28.4	28	4	They that forsake the law praise the wicked: but such as keep the law contend with them.	0.0	neutral	Los que dejan la ley, alaban á los impíos: Mas los que la guardan, contenderán con ellos.
PRO.28.5	28	5	Evil men understand not judgment: but they that seek the LORD understand all {things}.	-1.0	negative	Los hombres malos no entienden el juicio: Mas los que buscan á Jehová, entienden todas las cosas.
PRO.28.6	28	6	Better {is} the poor that walketh in his uprightness, than {he that is} perverse {in his} ways, though he {be} rich.	0.1583	positive	Mejor es el pobre que camina en su integridad, Que el de perversos caminos, y rico.
PRO.28.7	28	7	Whoso keepeth the law {is} a wise son: but he that is a companion of riotous {men} shameth his father. {is a companion...: or, feedeth gluttons}	0.7	positive	El que guarda la ley es hijo prudente: Mas el que es compañero de glotones, avergüenza á su padre.
PRO.28.8	28	8	He that by usury and unjust gain increaseth his substance, he shall gather it for him that will pity the poor. {unjust...: Heb. by increase}	-0.25	negative	El que aumenta sus riquezas con usura y crecido interés, Para que se dé á los pobres lo allega.
PRO.28.9	28	9	He that turneth away his ear from hearing the law, even his prayer {shall be} abomination.	0.0	neutral	El que aparta su oído para no oir la ley, Su oración también es abominable.
PRO.28.10	28	10	Whoso causeth the righteous to go astray in an evil way, he shall fall himself into his own pit: but the upright shall have good {things} in possession.	0.1	neutral	El que hace errar á los rectos por el mal camino, Él caerá en su misma sima: Mas los perfectos heredarán el bien.
PRO.28.11	28	11	The rich man {is} wise in his own conceit; but the poor that hath understanding searcheth him out. {own...: Heb. eyes}	0.375	positive	El hombre rico es sabio en su opinión: Mas el pobre entendido lo examinará.
PRO.28.12	28	12	When righteous {men} do rejoice, {there is} great glory: but when the wicked rise, a man is hidden. {hidden: or, sought for}	0.1556	positive	Cuando los justos se alegran, grande es la gloria; Mas cuando los impíos son levantados, es buscado el hombre.
PRO.28.13	28	13	He that covereth his sins shall not prosper: but whoso confesseth and forsaketh {them} shall have mercy.	0.0	neutral	El que encubre sus pecados, no prosperará: Mas el que los confiesa y se aparta, alcanzará misericordia.
PRO.28.14	28	14	Happy {is} the man that feareth alway: but he that hardeneth his heart shall fall into mischief.	0.8	positive	Bienaventurado el hombre que siempre está temeroso: Mas el que endurece su corazón, caerá en mal.
PRO.28.15	28	15	{As} a roaring lion, and a ranging bear; {so is} a wicked ruler over the poor people.	-0.4	negative	León rugiente y oso hambriento, Es el príncipe impío sobre el pueblo pobre.
PRO.28.16	28	16	The prince that wanteth understanding {is} also a great oppressor: {but} he that hateth covetousness shall prolong {his} days.	0.025	neutral	El príncipe falto de entendimiento multiplicará los agravios: Mas el que aborrece la avaricia, prolongará sus días.
PRO.28.17	28	17	A man that doeth violence to the blood of {any} person shall flee to the pit; let no man stay him.	0.0	neutral	El hombre que hace violencia con sangre de persona, Huirá hasta el sepulcro, y nadie le detendrá.
PRO.28.18	28	18	Whoso walketh uprightly shall be saved: but {he that is} perverse {in his} ways shall fall at once.	0.0	neutral	El que en integridad camina, será salvo; Mas el de perversos caminos caerá en alguno.
PRO.28.19	28	19	He that tilleth his land shall have plenty of bread: but he that followeth after vain {persons} shall have poverty enough.	0.0	neutral	El que labra su tierra, se hartará de pan: Mas el que sigue los ociosos, se hartará de pobreza.
PRO.28.20	28	20	A faithful man shall abound with blessings: but he that maketh haste to be rich shall not be innocent. {innocent: or, unpunished}	0.4583	positive	El hombre de verdad tendrá muchas bendiciones: Mas el que se apresura á enriquecer, no será sin culpa.
PRO.28.21	28	21	To have respect of persons {is} not good: for for a piece of bread {that} man will transgress.	-0.35	negative	Tener acepción de personas, no es bueno: Hasta por un bocado de pan prevaricará el hombre.
PRO.28.22	28	22	He that hasteth to be rich {hath} an evil eye, and considereth not that poverty shall come upon him. {hasteth...: or, hath an evil eye hasteth to be rich}	-0.3125	negative	Apresúrase á ser rico el hombre de mal ojo; Y no conoce que le ha de venir pobreza.
PRO.28.23	28	23	He that rebuketh a man afterwards shall find more favour than he that flattereth with the tongue.	0.5	positive	El que reprende al hombre, hallará después mayor gracia Que el que lisonjea con la lengua.
PRO.28.24	28	24	Whoso robbeth his father or his mother, and saith, {It is} no transgression; the same {is} the companion of a destroyer. {a destroyer: Heb. a man destroying}	-0.1	neutral	El que roba á su padre ó á su madre, y dice que no es maldad, Compañero es del hombre destruidor.
PRO.28.25	28	25	He that is of a proud heart stirreth up strife: but he that putteth his trust in the LORD shall be made fat.	0.8	positive	El altivo de ánimo suscita contiendas: Mas el que en Jehová confía, medrará.
PRO.28.26	28	26	He that trusteth in his own heart is a fool: but whoso walketh wisely, he shall be delivered.	0.65	positive	El que confía en su corazón es necio; Mas el que camina en sabiduría, será salvo.
PRO.28.27	28	27	He that giveth unto the poor shall not lack: but he that hideth his eyes shall have many a curse.	0.05	neutral	El que da al pobre, no tendrá pobreza: Mas el que aparta sus ojos, tendrá muchas maldiciones.
PRO.28.28	28	28	When the wicked rise, men hide themselves: but when they perish, the righteous increase.	0.0	neutral	Cuando los impíos son levantados, esconderáse el hombre: Mas cuando perecen, los justos se multiplican.
PRO.29.1	29	1	He, that being often reproved hardeneth {his} neck, shall suddenly be destroyed, and that without remedy. {He...: Heb. A man of reproofs}	0.0	neutral	EL hombre que reprendido endurece la cerviz, De repente será quebrantado; ni habrá para él medicina.
PRO.29.2	29	2	When the righteous are in authority, the people rejoice: but when the wicked beareth rule, the people mourn. {in...: or, increased}	0.0	neutral	Cuando los justos dominan, el pueblo se alegra: Mas cuando domina el impío, el pueblo gime.
PRO.29.3	29	3	Whoso loveth wisdom rejoiceth his father: but he that keepeth company with harlots spendeth {his} substance.	0.0	neutral	El hombre que ama la sabiduría, alegra á su padre: Mas el que mantiene rameras, perderá la hacienda.
PRO.29.4	29	4	The king by judgment establisheth the land: but he that receiveth gifts overthroweth it. {he...: Heb. a man of oblations}	0.0	neutral	El rey con el juicio afirma la tierra: Mas el hombre de presentes la destruirá.
PRO.29.5	29	5	A man that flattereth his neighbour spreadeth a net for his feet.	0.0	neutral	El hombre que lisonjea á su prójimo, Red tiende delante de sus pasos.
PRO.29.6	29	6	In the transgression of an evil man {there is} a snare: but the righteous doth sing and rejoice.	-1.0	negative	En la prevaricación del hombre malo hay lazo: Mas el justo cantará y se alegrará.
PRO.29.7	29	7	The righteous considereth the cause of the poor: {but} the wicked regardeth not to know {it}.	-0.575	negative	Conoce el justo la causa de los pobres: Mas el impío no entiende sabiduría.
PRO.29.8	29	8	Scornful men bring a city into a snare: but wise {men} turn away wrath. {bring...: or, set a city on fire}	0.7	positive	Los hombres escarnecedores enlazan la ciudad: Mas los sabios apartan la ira.
PRO.29.9	29	9	{If} a wise man contendeth with a foolish man, whether he rage or laugh, {there is} no rest.	0.5	positive	Si el hombre sabio contendiere con el necio, Que se enoje ó que se ría, no tendrá reposo.
PRO.29.10	29	10	The bloodthirsty hate the upright: but the just seek his soul. {The bloodthirsty: Heb. Men of blood}	-0.6	negative	Los hombres sanguinarios aborrecen al perfecto: Mas los rectos buscan su contentamiento.
